question,answer,contexts,ground_truth
Giấy chứng nhận đăng ký chào bán số 250/GCN-UBCK được cấp vào ngày nào?,Tôi không tìm thấy thông tin đó trong tài liệu.,"['# QUỸ ĐẦU TƯ CỔ PHIẾU DOANH NGHIỆP VỮA VÀ NHỎ TECHCOM (TCSME)\n*(Giấy chứng nhận đăng ký chào bán chứng chỉ quỹ đầu tư chứng khoán ra công chúng số 256/GCN-UBCK do Chủ tịch UBCHN cấp ngày 23/8/2022)*  \nBản cáo bạch này được phát hành bởi:  \n**Công ty Cổ phần Quản lý quỹ Kỹ thương - TechcomCapital (“TCC”)**  \n**Địa chỉ** : Tầng 28, Tòa C5, số 119 Trần Duy Hưng, phường Trung Hòa, Quận Cầu Giấy, Hà Nội  \n**Điện thoại** : (84-24) 39446368Fax: (84-24) 39446583  \n**Website** : www.techcomcapital.com.vn  \n**Nơi cung cấp Bản cáo bạch:**  \nBản Cáo Bạch cập nhật nhất cùng các tài liệu của Quỹ (báo cáo hoạt động, báo cáo tài chính, Điều lệ Quỹ và các tài liệu cần thiết khác) được cung cấp trên trang điện tử của TCC, www.techcomcapital.com.vn, tại văn phòng của TCC và các Đại lý phân phối như danh sách trong phụ lục 1 của Bản Cáo Bạch.', '# II. CÁC ĐỊNH NGHĨA\nGiấy chứng nhận đăng ký doanh nghiệp số 0102995749 do Sở Kế hoạch và Đầu tư Thành phố Hà Nội cấp ngày 27/05/2021, đáp ứng các tiêu chuẩn như nêu tại Điều 30 và có các quyền và nghĩa vụ như quy định tại Điều 31 của Điều lệ Quỹ.  \n“Ngân Hàng Giám Sát” Là Ngân hàng TMCP Đầu tư và Phát triển Việt Nam - Chi nhánh Hà Thành, một chi nhánh được thành lập theo Giấy chứng nhận đăng ký hoạt động chi nhánh số 0100150619-073 cấp lần đầu ngày 12/9/2003 thay đổi lần 12 ngày 16/06/2020 do Sở kế hoạch và Đầu tư thành phố Hà Nội cấp', '- Giấy chứng nhận đăng ký lập Quỹ đại chúng: do UBCKNN cấp\n- Loại hình: Quỹ mở\n- Vốn điều lệ ban đầu: 50.000.000.000 (năm mươi tỷ đồng)\n- Thời hạn của Quỹ: không giới hạn', 'Sau khi hoàn thành đợt IPO, Công Ty Quản Lý Quỹ sẽ đăng ký xin giấy chứng nhận đăng ký thành lập Quỹ với UBCKNN nếu có ít nhất 100 (một trăm) Nhà Đầu Tư không chuyên nghiệp đầu tư vào Quỹ và tổng vốn đầu tư vào Quỹ đạt tối thiểu 50.000.000.000 VNĐ (năm mươi tỷ đồng). Khi nhận Giấy phép đăng ký, Ngân Hàng Giám Sát sẽ giải toả tài khoản ký quỹ của Quỹ đó để Quỹ có thể bắt đầu đầu tư. Dự kiến Ngày Giao Dịch đầu tiên sẽ trong vòng 30 (ba mươi) ngày kể từ ngày Giấy chứng nhận đăng ký lập quỹ có hiệu lực.  \nXác nhận đầu tư sẽ được gửi cho Nhà Đầu Tư trong vòng 05 (năm) ngày kể từ ngày Quỹ có được Giấy chứng nhận đăng ký thành lập từ UBCKNN.', '## THÔNG BÁO QUAN TRỌNG\nBản Cáo Bạch này và Các Đơn Vị Quỹ chưa được đăng ký ở bất kỳ lãnh thổ tài phán nào ngoài Việt Nam. Việc công bố Bản Cáo Bạch này tại một số lãnh thổ tài phán có thể bị hạn chế hoặc phải tuân thủ các yêu cầu về đăng ký. Theo đó ở một số nước, người đọc Bản Cáo Bạch cần phải hiểu và phải tuân thủ các hạn chế đó. Người nhận được Bản Cáo Bạch này hoặc bất kỳ Đơn Đăng Ký nào tại lãnh thổ tài phán nói trên không được coi Bản Cáo Bạch này hay Đơn Đăng Ký cấu thành bản chào mua Đơn Vị Quỹ hay sử dụng Đơn Đăng Ký trong bất kỳ trường hợp nào, trừ khi tại lãnh thổ tài phán đó bản chào như thế tới họ có thể được coi là hợp pháp và Đơn Đăng Ký có thể được sử dụng một cách hợp pháp mà không cần phải tuân thủ bất kỳ yêu cầu đăng ký hoặc yêu cầu pháp lý nào khác.', '1  \nỦy ban Chứng khoán Nhà nước cấp giấy phép phát hành chứng chỉ quỹ ra công chúng có nghĩa là việc xin phép lập Quỹ và phát hành chứng chỉ quỹ đầu tư đã thực hiện theo các quy định của pháp luật liên quan, không hàm ý bảo đảm về nội dung của Bản cáo bạch cũng như mục tiêu, chiến lược đầu tư của Quỹ.', 'Quỹ đầu tư chứng khoán được mô tả trong Bản cáo bạch này là Quỹ được thành lập theo Luật Chứng khoán số 54/2019/QH14 được Quốc hội Nước Cộng hòa xã hội chủ nghĩa Việt Nam thông qua ngày 26 tháng 11 năm 2019 và các văn bản hướng dẫn thi hành. Bản cáo bạch này đã được đăng ký với Ủy ban Chứng khoán Nhà nước ngày / / 2022.', '## Lĩnh vực được phép đầu tư\nđ) Cổ phiếu chào bán lần đầu ra công chúng, trái phiếu chào bán ra công chúng; trái phiếu doanh nghiệp phát hành riêng lẻ bởi tổ chức niêm yết có bảo lãnh thanh toán của tổ chức tín dụng hoặc cam kết mua lại của tổ chức phát hành tối thiểu 1 lần trong 12 tháng và mỗi lần cam kết mua lại tối thiểu 30% giá trị đợt phát hành;  \ne) Chứng khoán phải sinh niêm yết giao dịch tại Sở giao dịch chứng khoán và chỉ nhằm mục tiêu phòng ngừa rủi ro cho chứng khoán cơ sở mà quỹ đang nắm giữ;  \ng) Quyền phát sinh gắn liền với chứng khoán mà quỹ đang nắm giữ.  \nViệc đầu tư vào các tài sản quy định tại điểm đ khoản 2.2.3 Điều này phải đáp ứng các điều kiện sau:  \n- Có quy định tại Điều lệ quỹ và Bản cáo bạch;', 'lại cho Nhà đầu tư hoặc bên chuyển tiền không hợp lệ trong vòng 05 (năm) ngày làm việc kể từ kỳ giao dịch chứng chỉ quỹ áp dụng.  \nChương trình ĐTĐK sẽ dùng khi Nhà Đầu Tư quyết định dừng bằng cách thông báo dừng thực hiện ĐTĐK với Đại Lý Phân Phối hoặc do Nhà Đầu Tư không nộp tiền/không nộp đủ tiền mua chứng chỉ quỹ cho Chương Trình ĐTĐK trong 05 kỳ liên tiếp.  \n- Phí/giá dịch vụ áp dụng cho Chương Trình ĐTĐK  \nPhí/giá dịch vụ áp dụng cho chương trình ĐTĐK được quy định chi tiết tại mục 2.5.3 của Bản Cáo Bạch này.  \n- Bản chứng chỉ quỹ mua theo Chương Trình ĐTĐK  \nNhà Đầu Tư bán chứng chỉ quỹ mua theo Chương Trình ĐTĐK theo nguyên tắc quy định tại mục 2.5.3 của Bản Cáo Bạch này.', 'd) Giá dịch vụ áp dụng cho Chương Trình ĐTDK  \nGiá dịch vụ áp dụng cho chương trình ĐTDK được quy định chi tiết tại mục 2.5.3 về giá dịch vụ phát hành của Bản Cáo Bạch này.  \ne) Bản chứng chỉ quỹ mua theo Chương Trình ĐTDK  \nNhà Đầu Tư bán chứng chỉ quỹ mua theo Chương Trình ĐTDK theo nguyên tắc quy định tại mục 2.5.3 về giá dịch vụ mua lại của Bản Cáo Bạch này.  \n2.5. Nguyên tắc xác định giá giao dịch đơn vị quỹ:  \n2.5.1. Tần suất định giá và phương pháp xác định giá giao dịch trên một đơn vị quỹ  \nNgày định giá  \nNgày Định Giá là ngày xác định Giá trị tài sản ròng của Quỹ. Ngày Định Giá là ngày giao dịch (để phục vụ cho việc tính giá phát hành và giá mua lại); và là ngày đầu tiên của tháng tiếp theo đối với việc định giá để làm báo cáo tháng, quý, năm theo luật định.', '6  \nvà Giấy chứng nhận đăng ký hoạt động lưu ký chứng khoán số 510/QĐ-ĐKHĐLK ngày 01/08/2006 do UBCKNN cấp, thực hiện các nghiệp vụ bảo quản, lưu ký các chứng khoán, các hợp đồng kinh tế, các chứng từ có liên quan đến tài sản của Quỹ, đồng thời giám sát hoạt động của Quỹ. Quyền và nghĩa vụ của Ngân Hàng Giám Sát được quy định tại Chương VII của Điều lệ Quỹ.  \n“Công Ty Kiểm Toán”\nlà công ty kiểm toán độc lập cho quỹ được Đại Hội Nhà Đầu Tư chỉ định, thực hiện việc kiểm toán hàng năm tài sản của Quỹ Đầu Tư Cổ phiếu Doanh nghiệp vừa và nhỏ Techcom.  \n“Điều lệ”\ncó nghĩa là Điều lệ Quỹ, các phụ lục đính kèm và các sửa đổi bổ sung hợp pháp (nếu có) được Đại hội nhà đầu tư thông qua tại Đại hội Nhà đầu tư.  \n“Bản Cáo Bạch”', '## Lĩnh vực được phép đầu tư\n- Có quy định tại Điều lệ quỹ và Bản cáo bạch;\n- Đã được Ban đại diện quỹ chấp thuận bằng văn bản về loại, mã chứng khoán, số lượng, giá trị giao dịch, thời điểm thực hiện;\n- Có đủ tài liệu chứng minh về bảo lãnh thanh toán hoặc tài liệu về cam kết mua lại của tổ chức phát hành.', 'Sau khi thực hiện các Lệnh Bán Được Chấp Nhận, số Đơn Vị Quỹ đã bán sẽ được trù ra từ tổng số Đơn Vị Quỹ trong tài khoản của Nhà Đầu Tư và bảng kê mới về số Đơn Vị Quỹ nắm giữ sẽ được gửi đến Nhà Đầu Tư.  \nLệnh Bán thành công của Nhà Đầu Tư hay Đại Lý Ký Danh sẽ được thông báo trong vòng 03 (ba) ngày làm việc sau Ngày Giao Dịch.  \nTrong thời hạn 5 ngày làm việc sau ngày giao dịch Chứng chỉ quỹ, Nhà Đầu tư sẽ nhận được tiền bán chứng chỉ quỹ vào tài khoản mà Nhà Đầu tư đã đăng ký khi thực hiện mua Chứng chỉ quỹ.  \n- **Lệnh Bán Tối Thiểu**  \nLệnh Bán tối thiểu là 10 (mười) Đơn Vị Quỹ. Trường hợp sau khi đặt bán, số lượng chứng chỉ quỹ còn lại nhỏ hơn số lượng bán tối thiểu, Nhà Đầu tư cần đặt bán toàn bộ để giảm số Đơn vị Quỹ nắm giữ về 0 (không).', '# PHỤ LỤC 1. DANH SÁCH ĐẠI LÝ PHÂN PHỐI VÀ CÁC ĐIỂM NHẬN LỆNH\nCông ty Cổ phần Chứng khoán Kỹ thương (“TCBS”)  \nGiấy phép thành lập và hoạt động: Số 125/GP-UBCK ngày 30/05/2018 do Ủy ban Chứng khoán Nhà nước cấp  \nĐịa chỉ nhận lệnh: Tầng 10 và Tầng 12, Tòa nhà Techcombank, 191 Bà Triệu, Phường Lê Đại Hành, quận Hai Bà Trưng, Hà Nội', 'Theo quy định hiện hành, nếu Quỹ không thể huy động được ít nhất là 50.000.000.000 VNĐ (năm mươi tỷ đồng) hoặc có ít hơn 100 (một trăm) Nhà Đầu Tư không chuyên nghiệp vào thời điểm kết thúc IPO hoặc thời gian được gia hạn (nếu có), UBCKNN sẽ không cấp Giấy chứng nhận đăng ký lập quỹ cho Quỹ. Trong trường hợp này, tất cả số tiền nhận được từ các Nhà Đầu Tư trong thời gian IPO cùng với lãi phát sinh nếu có sẽ được hoàn trả vào tài khoản đăng ký của Nhà Đầu Tư trong vòng 15 (mười lăm ngày) kể từ ngày kết thúc đợt IPO. Công Ty Quản Lý Quỹ sẽ chịu tất cả các chi giá dịch vụ phát sinh từ đợt IPO trong trường hợp này.  \n49', '# VIII. TỔ CHỨC ĐƯỢC ỦY QUYỀN\n## 1. Ủy quyền đại lý chuyển nhượng\n- Tên đại lý: Trung tâm Lưu ký Chứng khoán Việt Nam\n- Giấy phép hoạt động: Quyết định số 171/2008/QĐ-TTg ngày 18/12/2008 của Thủ tướng Chính phủ về việc thành lập Trung tâm Lưu ký Chứng khoán Việt Nam\n- GCNDK hoạt động chuyển nhượng: Quyết định số 2880/QĐ-BTC ngày 22/11/2013 của Bộ trưởng Bộ Tài chính về việc ban hành Điều lệ tổ chức và hoạt động của Trung tâm Lưu ký Chứng khoán Việt Nam\n- Trụ sở chính: Số 112 Đường Hoàng Quốc Việt, Phường Cổ Nhuế 1, Quận Bắc Từ Liêm, Thành Phố Hà Nội\n- Điện thoại: +84 24 39747123    Fax: +84 24 39747120', '“Ngày Định Giá”  \nLà ngày mà Công ty Quản Lý Quỹ xác định giá trị tài sản ròng của Quỹ theo quy định tại Luật chứng khoán và Điều lệ Quỹ.  \n“Ngày Giao Dịch”  \nlà ngày mà công ty quản lý quỹ, thay mặt quỹ, phát hành và mua lại chứng chỉ quỹ mở từ nhà đầu tư theo cơ chế giao dịch của quỹ.  \n“Thời Điểm Đóng Số Lệnh”  \ncó nghĩa là thời điểm cuối cùng mà Đại Lý Phân Phối có thể nhận lệnh giao dịch Chứng chỉ quỹ từ Nhà đầu tư để thực hiện trong Ngày Giao Dịch Chứng Chỉ Quỹ. Thời điểm đóng số lệnh được quy định tại Điều lệ quỹ, công bố công khai tại Bản cáo bạch, Bản cáo bạch tóm tắt và không được muộn quá thời điểm đóng cửa thị trường của Sở giao dịch chứng khoán tại ngày giao dịch gần nhất trước ngày giao dịch chứng chỉ quỹ.  \n“UBCKNN”  \ncó nghĩa là Ủy Ban Chứng Khoán Nhà Nước Việt Nam.', '# VII. ĐẠI LÝ PHÂN PHỐI CHỨNG CHỈ QUỸ\nDanh sách Đại lý Phân phối được lựa chọn bao gồm:  \n- Công ty Cổ phần Chứng khoán Kỹ thương (“TCBS”)\n- Địa chỉ: Tầng 10 và Tầng 12, tòa nhà Techcombank, 191 Bà Triệu, phường Lê Đại Hành, quận Hai Bà Trưng, TP. Hà Nội\n- Giấy phép thành lập và hoạt động: số 125/GP-UBCK ngày 30/05/2018 do Ủy ban Chứng khoán Nhà nước cấp và các giấy phép điều chỉnh.\n- Số Giấy chứng nhận đăng ký hoạt động phân phối:\n- Điện thoại: 84.24.22201039    Fax: 84.24.22201032  \nDanh sách Đại Lý Phân phối và các Điểm Nhận Lệnh có thể thay đổi bất kỳ lúc nào sau khi hoàn thành các thủ tục thông báo tới Ủy ban Chứng khoán Nhà nước theo quy định của Pháp Luật.', 'Sau khi thực hiện các Lệnh Bán Được Chấp Nhận, số Đơn Vị Quỹ đã bán sẽ được trừ ra từ tổng số Đơn Vị Quỹ trong tài khoản của Nhà Đầu Tư và bảng kê mới về số Đơn Vị Quỹ nắm giữ sẽ được gửi đến Nhà Đầu Tư. Chi tiết ngày thanh toán tiền mua lại chứng chỉ quỹ sẽ được Công ty Quản Lý Quỹ công bố trên trang web theo từng thời kỳ.', '## 2.3. Đặc trưng của chứng chỉ Quỹ đầu tư\nCông ty quản lý quỹ thực hiện hoặc ủy quyền cho tổ chức cung cấp dịch vụ đại lý chuyển nhượng lập và quản lý số đăng ký nhà đầu tư chính (sổ chính) hoặc ủy quyền đại lý ký danh lập, quản lý đăng ký nhà đầu tư phụ (sổ phụ) và xác nhận quyền sở hữu chứng chỉ quỹ cho nhà đầu tư.  \nSố đăng ký nhà đầu tư của Quỹ có thể là văn bản, tập dữ liệu điện tử hoặc cả hai. Các nội dung của Số đăng ký nhà đầu tư được quy định chi tiết tại điều 15 Điều lệ Quỹ.', '# 5. Kế hoạch phân chia lợi nhuận\nNhà Đầu Tư có trong danh sách chốt trong số Đăng Ký tại Ngày Giao Dịch được công bố bởi TCC cho việc chia cổ tức (“Ngày Chốt Danh Sách”) được xem là đủ điều kiện để nhận cổ tức.  \nCổ tức sẽ được chi trả trong thời hạn 30 (ba mươi) ngày kể từ ngày được công bố và được chuyển vào tài khoản ngân hàng của Nhà Đầu Tư theo đăng ký trong Số Đăng Ký vào ngày thanh toán cổ tức, sau khi được khấu trừ các loại thuế có liên quan.  \nCổ tức được chi trả sẽ phải chịu thuế tùy thuộc vào nguồn gốc của thu nhập của Quỹ cũng như các loại thuế áp dụng cho Nhà Đầu Tư.', '## THÔNG BÁO QUAN TRỌNG\nKhông người nào được ủy quyền để cung cấp bất kỳ thông tin hoặc đưa ra bất kỳ tuyên bố nào không được xác nhận trong Bản Cáo Bạch này liên quan đến đợt phát hành này hay việc phát hành các Đơn Vị Quỹ, và bất kỳ thông tin hoặc tuyên bố nào không có trong Bản Cáo Bạch này không được dựa vào như là đã được phê duyệt bởi TechcomCapital. Nhà Đầu Tư được yêu cầu phải kiểm tra các thông tin về uy tín của cá nhân/công ty mà mình ủy thác Đơn Đăng Ký và uy thác thanh toán cho bất kỳ giao dịch nào với Quỹ. Quỹ hoặc TechcomCapital không chịu trách nhiệm cho bất kỳ hành vi được thực hiện bởi các tổ chức trung gian đại diện cho hoặc được cho là đại diện cho Nhà Đầu Tư đó.', '## e. Quy trình bán chứng chỉ quỹ\nĐại Lý Phân Phối sẽ xử lý tất cả các Lệnh Bản nhận trước Thời Điểm Đóng Số Lệnh và gửi lệnh giao dịch tổng hợp tới Đại lý Chuyển Nhượng để thực hiện giao dịch cho Ngày Giao Dịch kế tiếp, và đảm bảo các thông tin trong Lệnh Bản đầy đủ và nhất quán và Nhà Đầu Tư có đủ số Đơn Vị Quỹ trong tài khoản để bán. Nhà Đầu tư có thể đặt bản số Chứng Chỉ Quỹ tối đa bằng số lượng Chứng Chỉ Quỹ mà mình sở hữu. Khoản tiền bán ròng sẽ được chuyển trả cho Nhà Đầu Tư. Lệnh Bản không thuộc trường hợp được thực hiện một phần bởi các điều kiện liên quan đến Lệnh Bản một phần như để trong các mục dưới đây sẽ được giao dịch tại NAV tại Ngày Giao Dịch trừ đi Giá dịch vụ Mua lại, giá dịch vụ chuyển tiền và thuế (nếu có), dựa trên ngày giờ nhận Lệnh Bản tại Điểm Nhận Lệnh, theo ngày giờ xác nhận tại Điểm Nhận Lệnh', '## V. NGÂN HÀNG GIÁM SÁT\n- Tên ngân hàng: Ngân hàng TMCP Đầu tư và Phát triển Việt Nam – Chi nhánh Hà Thành\n- Giấy chứng nhận đăng ký hoạt động chi nhánh: Số 0100150619-073 cấp lần đầu ngày 12/9/2003 thay đổi lần 12 ngày 16/06/2020 do Sở kế hoạch và Đầu tư thành phố Hà Nội cấp\n- GCNDK hoạt động lưu ký: Số 510/QĐ-ĐKHĐLK ngày 01/08/2006 do UBCKNN cấp\n- Trụ sở chính: 74 Thợ Nhuộm, Hoàn Kiếm, Hà Nội, Việt Nam\n- Điện thoại: +84.24 39411840 Fax: +84.24 39411847  \nNgân hàng Giám sát chịu trách nhiệm trong phạm vi liên quan đến hoạt động của ngân hàng giám sát theo quy định tại Điều lệ Quỹ và Hợp đồng Giám sát.', '## XVI. PHỤ LỤC ĐỈNH KÈM\nPhụ lục 01: Danh sách các đại lý phân phối chứng chỉ quỹ được lựa chọn.  \nPhụ lục 02: Các đối tác liên quan  \nCÔNG TY CỔ PHẦN QUẢN LÝ QUỸ KỸ THƯƠNG  \n![img-12.jpeg](img-12.jpeg)  \nTỔNG GIÁM ĐỐC\nĐặng Lư Dũng']",Giấy chứng nhận đăng ký chào bán chứng chỉ quỹ số 250/GCN-UBCK do Chủ tịch UBCKNN cấp ngày 23/8/2022.
"Địa chỉ văn phòng của TechcomCapital tại Tầng 28, Tòa C5, số 119 Trần Duy Hưng là ở quận nào?","Dựa trên thông tin từ nguồn 1 (trang 4), địa chỉ văn phòng của TechcomCapital tại Tầng 28, Tòa C5, số 119 Trần Duy Hưng nằm trong khu vực của:

- Quận Cầu Giấy

Nguồn: Trang 4","['## XIV. THÔNG TIN LIÊN LẠC\nĐể biết thêm thông tin chung, xin liên hệ:  \nCông Ty Cổ phần Quản lý Quỹ Kỹ thương (TechcomCapital)  \nĐịa chỉ: Tầng 28, Tòa C5, số 119 Trần Duy Hưng, phường Trung Hòa, Quận Cầu Giấy, Hà Nội  \nĐiện thoại: (+84) 24 39446368\nFax: (+84) 24 39446583', '# IV. THÔNG TIN VỀ CÔNG TY CỔ PHẦN QUẢN LÝ QUỸ KỸ THƯƠNG\n## 1. Các thông tin chung\n- **Tên bằng tiếng Việt:** Công ty Cổ phần Quản lý Quỹ Kỹ thương\n- **Tên bằng tiếng Anh:** TechcomCapital Joint Stock Company\n- **Tên viết tắt:** TechcomCapital (TCC)\n- **Giấy phép thành lập:** Giấy phép thành lập và hoạt động Số 40/UBCK-GP do Chủ tịch Ủy ban Chứng khoán Nhà nước cấp ngày 21/10/2008 và được cấp lại Giấy phép thành lập và hoạt động Số 57/GP-UBCK do UBCKNN cấp ngày 30/01/2019 do chuyển đổi loại hình từ công ty TNHH sang công ty cổ phần.\n- **Giấy chứng nhận đăng ký doanh nghiệp số** 0102995749 do Sở Kế hoạch và Đầu tư Thành phố Hà Nội cấp ngày 27/05/2021\n- **Vốn điều lệ:** 44.943.820.000 đồng (Bốn mươi bốn tỷ chính trăm bốn mươi ba triệu tám trăm hai mươi nghìn đồng)\n- **Địa chỉ đăng ký:** Tầng 28, Tòa C5, số 119 Trần Duy Hưng, phường Trung Hòa, Quận Cầu Giấy, Hà Nội', '## 2. Ngân hàng giám sát\nNgân hàng TMCP Đầu tư và Phát triển Việt Nam - Chi nhánh Hà Thành  \nĐại diện hợp pháp: Ông Nguyễn Mạnh Cường  \nChức vụ: Phó Giám đốc  \nBản cáo bạch này là một phần của hồ sơ đăng ký chào bán của Công ty Cổ phần Quản lý quỹ Kỹ thương (Techcom Capital – “TCC”). Chúng tôi, với tư cách là Ngân hàng Giám sát của Quỹ Đầu Tư Cổ phiếu Doanh nghiệp vừa và nhỏ Techcom (TCSME) sẽ chịu trách nhiệm theo các quy định trong phạm vi Hợp Đồng Cung Cấp Dịch Vụ Giám Sát Quỹ được ký kết giữa chúng tôi với Công ty Cổ phần Quản lý quỹ Kỹ thương, là công ty quản lý Quỹ Đầu tư Cổ phiếu Doanh nghiệp vừa và nhỏ Techcom và theo quy định của pháp luật.', '# QUỸ ĐẦU TƯ CỔ PHIẾU DOANH NGHIỆP VỮA VÀ NHỎ TECHCOM (TCSME)\n*(Giấy chứng nhận đăng ký chào bán chứng chỉ quỹ đầu tư chứng khoán ra công chúng số 256/GCN-UBCK do Chủ tịch UBCHN cấp ngày 23/8/2022)*  \nBản cáo bạch này được phát hành bởi:  \n**Công ty Cổ phần Quản lý quỹ Kỹ thương - TechcomCapital (“TCC”)**  \n**Địa chỉ** : Tầng 28, Tòa C5, số 119 Trần Duy Hưng, phường Trung Hòa, Quận Cầu Giấy, Hà Nội  \n**Điện thoại** : (84-24) 39446368Fax: (84-24) 39446583  \n**Website** : www.techcomcapital.com.vn  \n**Nơi cung cấp Bản cáo bạch:**  \nBản Cáo Bạch cập nhật nhất cùng các tài liệu của Quỹ (báo cáo hoạt động, báo cáo tài chính, Điều lệ Quỹ và các tài liệu cần thiết khác) được cung cấp trên trang điện tử của TCC, www.techcomcapital.com.vn, tại văn phòng của TCC và các Đại lý phân phối như danh sách trong phụ lục 1 của Bản Cáo Bạch.', '# VIII. TỔ CHỨC ĐƯỢC ỦY QUYỀN\n## 2. Ủy quyền dịch vụ quản trị quỹ đầu tư\n- Tên ngân hàng: Ngân hàng TMCP Đầu tư và Phát triển Việt Nam – Chi nhánh Hà Thành\n- Giấy chứng nhận đăng ký hoạt động chi nhánh: Số 0100150619-073 cấp lần đầu ngày 12/9/2003 thay đổi lần 12 ngày 16/06/2020 do Sở kế hoạch và Đầu tư thành phố Hà Nội cấp\n- GCNDK hoạt động lưu ký: Số 510/QĐ-ĐKHDLK ngày 01/08/2006 do UBCKNN cấp\n- Trụ sở chính: 74 Thợ Nhuộm, Hoàn Kiếm, Hà Nội, Việt Nam\n- Điện thoại: +84.24 39411840    Fax: +84.24 39411847  \nTổ chức cung cấp dịch vụ quản trị quỹ chịu trách nhiệm trong phạm vi liên quan đến dịch vụ cung cấp theo quy định tại hợp đồng dịch vụ ký kết giữa Công ty Quản lý Quỹ và tổ chức cung cấp dịch vụ quản trị quỹ.', '## THÔNG BÁO QUAN TRỌNG\nKhông người nào được ủy quyền để cung cấp bất kỳ thông tin hoặc đưa ra bất kỳ tuyên bố nào không được xác nhận trong Bản Cáo Bạch này liên quan đến đợt phát hành này hay việc phát hành các Đơn Vị Quỹ, và bất kỳ thông tin hoặc tuyên bố nào không có trong Bản Cáo Bạch này không được dựa vào như là đã được phê duyệt bởi TechcomCapital. Nhà Đầu Tư được yêu cầu phải kiểm tra các thông tin về uy tín của cá nhân/công ty mà mình ủy thác Đơn Đăng Ký và uy thác thanh toán cho bất kỳ giao dịch nào với Quỹ. Quỹ hoặc TechcomCapital không chịu trách nhiệm cho bất kỳ hành vi được thực hiện bởi các tổ chức trung gian đại diện cho hoặc được cho là đại diện cho Nhà Đầu Tư đó.', '# QUỸ ĐẦU TƯ CỔ PHIẾU DOANH NGHIỆP VỮA VÀ NHỎ TECHCOM (TCSME)\n**Phụ trách công bố thông tin:**  \n**Ông** : Đặng Lưu Dũng – Tổng Giám đốc  \n**Địa chỉ** : Công ty Cổ phần Quản lý quỹ Kỹ thương  \nTầng 28, Tòa C5, số 119 Trần Duy Hưng, phường Trung Hòa, Quận Cầu Giấy, Hà Nội  \n**Điện thoại** : (84-24) 39446368Fax: (84-24) 39446583', '# IV. THÔNG TIN VỀ CÔNG TY CỔ PHẦN QUẢN LÝ QUỸ KỸ THƯƠNG\n## 1. Các thông tin chung\n- **Điện thoại:** (+84) 24 39446368  **Fax:** (+84) 24 39446583\n- **Các cổ đông của công ty Quản lý Quỹ sở hữu từ 5% trở lên vốn điều lệ:**  \n|  Tên cổ đông | Giá trị vốn chủ sở hữu | Tỷ lệ vốn chủ sở hữu  |\n| --- | --- | --- |\n|  Ngân hàng TMCP Kỹ thương Việt Nam | 39.999.800.000 | 88,99956%  |\n|  Bà Nguyễn Thị Thu Hiền | 2.696.640.000 | 6,00002%  |\n|  Cổ đông - Khác | 2.247.380.000 | 5,00042%  |\n|   | 44.943.820.000 | 100%  |  \nTechcombank được thành lập theo Giấy chứng nhận đăng ký doanh nghiệp số 0100230800 do Sở Kế hoạch và Đầu tư TP. Hà Nội cấp lần thứ 45 ngày 26/07/2013, đăng ký cấp lại mã số doanh nghiệp lần 1 ngày 03/07/2012 từ ĐKKD số 055697 do Trọng tài kinh tế Nhà nước cấp ngày 07/09/1993.', '## V. NGÂN HÀNG GIÁM SÁT\n- Tên ngân hàng: Ngân hàng TMCP Đầu tư và Phát triển Việt Nam – Chi nhánh Hà Thành\n- Giấy chứng nhận đăng ký hoạt động chi nhánh: Số 0100150619-073 cấp lần đầu ngày 12/9/2003 thay đổi lần 12 ngày 16/06/2020 do Sở kế hoạch và Đầu tư thành phố Hà Nội cấp\n- GCNDK hoạt động lưu ký: Số 510/QĐ-ĐKHĐLK ngày 01/08/2006 do UBCKNN cấp\n- Trụ sở chính: 74 Thợ Nhuộm, Hoàn Kiếm, Hà Nội, Việt Nam\n- Điện thoại: +84.24 39411840 Fax: +84.24 39411847  \nNgân hàng Giám sát chịu trách nhiệm trong phạm vi liên quan đến hoạt động của ngân hàng giám sát theo quy định tại Điều lệ Quỹ và Hợp đồng Giám sát.', '# VII. ĐẠI LÝ PHÂN PHỐI CHỨNG CHỈ QUỸ\nDanh sách Đại lý Phân phối được lựa chọn bao gồm:  \n- Công ty Cổ phần Chứng khoán Kỹ thương (“TCBS”)\n- Địa chỉ: Tầng 10 và Tầng 12, tòa nhà Techcombank, 191 Bà Triệu, phường Lê Đại Hành, quận Hai Bà Trưng, TP. Hà Nội\n- Giấy phép thành lập và hoạt động: số 125/GP-UBCK ngày 30/05/2018 do Ủy ban Chứng khoán Nhà nước cấp và các giấy phép điều chỉnh.\n- Số Giấy chứng nhận đăng ký hoạt động phân phối:\n- Điện thoại: 84.24.22201039    Fax: 84.24.22201032  \nDanh sách Đại Lý Phân phối và các Điểm Nhận Lệnh có thể thay đổi bất kỳ lúc nào sau khi hoàn thành các thủ tục thông báo tới Ủy ban Chứng khoán Nhà nước theo quy định của Pháp Luật.', 'Quỹ không quy định quy mô tối đa trong đợt phát hành lần đầu ra công chúng. Vì vậy, nếu giá trị phát hành được vượt 50.000.000.000 VNĐ (năm mươi tỷ đồng), các Nhà Đầu Tư sẽ được phân bổ số lượng Đơn Vị Quỹ bằng với số đã đặt mua.  \n- Địa điểm phát hành:\nCông ty Cổ phần Quản lý Quỹ Kỹ thương\nĐịa chỉ đăng ký: Tầng 28, Tòa C5, số 119 Trần Duy Hưng, phường Trung Hòa, Quận Cầu Giấy, Hà Nội\nĐiện thoại: (+84) 24 39446368   Fax: (+84) 24 39446583  \n- Đại lý phân phối và điểm nhận lệnh:\nCông ty Cổ phần Chứng khoán Kỹ thương (“TCBS”)\nĐịa chỉ: Tầng 10 và Tầng 12, tòa nhà Techcombank, 191 Bà Triệu, phường Lê Đại Hành, quận Hai Bà Trưng, TP. Hà Nội\nĐiện thoại: 84.24.22201039   Fax: 84.24.22201032  \n- Các đối tác có liên quan đến đợt phát hành  \n**Ủy quyền đại lý chuyển nhượng**', '# NGÂN HÀNG GIÁM SÁT\nTên ngân hàng giám sát: Ngân hàng TMCP Đầu tư &amp; Phát triển Việt Nam – Chi nhánh Hà Thành;  \nGiấy chứng nhận đăng ký kinh doanh số 0100150619-073 cấp lần đầu ngày 12/09/2003, thay đổi lần thứ 12 ngày 16/06/2020 do Sở Kế hoạch và Đầu tư thành phố Hà Nội cấp;  \nGiấy phép hoạt động lưu ký chứng khoán số: 510/QĐ-ĐKHĐLK ngày 01/08/2006 do UBCKNN cấp;  \nChúng tôi, với tư cách là Ngân hàng giám sát của Quỹ Đầu Tư Cổ phiếu Doanh nghiệp vừa và nhỏ Techcom sẽ chịu trách nhiệm theo các quy định trong phạm vi Hợp Đồng Cung Cấp Dịch Vụ lưu ký giám sát của Quỹ được ký kết giữa chúng tôi với Công ty Cổ phần Quản lý Quỹ Kỹ Thương, và các quy định về Ngân hàng giám sát trong Điều lệ, Bản cáo bạch của Quỹ.  \n![img-13.jpeg](img-13.jpeg)  \nPHÓ GIÁM ĐỐC\nNguyễn Mạnh Cường', '## 4. Gửi báo cáo tới Nhà Đầu Tư\nCác báo cáo sẽ được cung cấp miễn phí cho Nhà Đầu Tư thông qua trang thông tin điện tử của TCC, hoặc gửi đến địa chỉ thư điện tử của Nhà Đầu Tư hoặc được cung cấp tới các Đại Lý Phân Phối. Nhà Đầu Tư có quyền yêu cầu từ chối nhận các báo cáo này.', '- Các đối tác có liên quan đến đợt phát hành  \n**Ủy quyền đại lý chuyển nhượng**  \nTên đại lý: Trung tâm Lưu ký Chứng khoán Việt Nam\nTrụ sở chính: 15 Đoàn Trần Nghiệp, Quận Hai Bà Trưng, Hà Nội\nĐiện thoại: +84 24 39747113   Fax: +84 24 39747120  \n**Ủy quyền dịch vụ quản trị quỹ đầu tư**  \nTên ngân hàng: Ngân hàng TMCP Đầu tư và Phát triển Việt Nam – Chi nhánh Hà Thành\nTrụ sở chính: 74 Thợ Nhuộm, Hoàn Kiếm, Hà Nội\nĐiện thoại: (+84) 43 9362086   Fax: (+84) 439411847', '# PHỤ LỤC 1. DANH SÁCH ĐẠI LÝ PHÂN PHỐI VÀ CÁC ĐIỂM NHẬN LỆNH\nCông ty Cổ phần Chứng khoán Kỹ thương (“TCBS”)  \nGiấy phép thành lập và hoạt động: Số 125/GP-UBCK ngày 30/05/2018 do Ủy ban Chứng khoán Nhà nước cấp  \nĐịa chỉ nhận lệnh: Tầng 10 và Tầng 12, Tòa nhà Techcombank, 191 Bà Triệu, Phường Lê Đại Hành, quận Hai Bà Trưng, Hà Nội', 'Giao dịch với người có liên quan của TCC sẽ cấu thành xung đột lợi ích tiềm tàng. Người Có Liên Quan của TCC bao gồm Techcombank, thành viên Hội Đồng Thành viên của TCC, thành viên Ban Điều Hành (Giám đốc, Phó giám đốc) của TCC và các tổ chức, cá nhân khác được coi là người có liên quan của TCC theo quy định của Pháp Luật. Quỹ có thể có một số giao dịch với các bên được coi là người có liên quan của TCC như sau:  \n|  Tên của người có liên quan trong giao dịch | Bản chất quan hệ  |\n| --- | --- | --- |\n|  Công ty Cổ phần Chứng khoán Kỹ thương Việt Nam (""TCBS"") | Giao dịch chứng khoán Phân phối chứng chỉ quỹ\nĐầu tư vào Quỹ | TCBS là Đại Lý Phân Phối mà Techcombank sở hữu 89% cổ phần  |\n|  Techcombank (""TCB"") | Gửi tiền có kỳ hạn | Techcombank sở hữu 88.99% vốn của TCC  |', '# PHỤ LỤC 2. CÁC ĐỐI TÁC CÓ LIÊN QUAN\nNgân hàng lưu ký, giám sát và quản trị quỹ:  \nNgân hàng TMCP Đầu tư và Phát triển Việt Nam - Chi nhánh Hà Thành, một chi nhánh được thành lập theo Giấy chứng nhận đăng ký hoạt động chi nhánh số 0100150619-073 cấp lần đầu ngày 12/9/2003 thay đổi lần 12 ngày 16/06/2020 do Sở kế hoạch và Đầu tư thành phố Hà Nội cấp và Giấy chứng nhận đăng ký hoạt động lưu ký chứng khoán số 510/QĐ-ĐKHĐLK ngày 01/08/2006 do UBCKNN cấp, thực hiện các nghiệp vụ (i) bảo quản, lưu ký chứng khoán, tài liệu xác nhận quyền sở hữu tài sản hợp pháp của Quỹ; các hợp đồng kinh tế, các chứng từ có liên quan đến tài sản của Quỹ đồng thời giám sát hoạt động của Quỹ; (ii) thực hiện chức năng giám sát toàn bộ quản lý tài sản của Quỹ do Công ty Quản lý Quỹ thực hiện.  \n![img-14.jpeg](img-14.jpeg)', '|  Techcombank (""TCB"") | Gửi tiền có kỳ hạn | Techcombank sở hữu 88.99% vốn của TCC  |  \nTrong tất cả các trường hợp, các giao dịch phải là giao dịch công bằng và vì lợi ích của Nhà Đầu Tư, theo đúng các quy định của pháp luật và Điều lệ Quỹ.  \nTất cả các giao dịch có thể gây ra xung đột lợi ích tiềm tàng phải được tư vấn và chấp thuận bởi TCC và phải được công bố cho Nhà Đầu Tư. Tuy nhiên TCC sẽ cố gắng hết sức để tránh các giao dịch có thể gây ra xung đột lợi ích mà không thể quản lý được một cách thích đáng.  \nNgười có liên quan của TCC được phép giao dịch Đơn Vị Quỹ theo phương thức giống như các Nhà Đầu Tư khác như quy định tại Điều lệ Quỹ.', '## 2. Tình hình hoạt động của Công ty Cổ phần Quản lý Quỹ Kỹ thương\n| --- | --- | --- |\n|  Quỹ Đầu tư Trái Phiếu Techcom (TCBF) | Quỹ mở | 21.577.788.816.709  |\n|  Quỹ Đầu tư Cổ Phiếu Techcom (TCEF) | Quỹ mở | 549.603.026.323  |\n|  Quỹ Đầu tư Bất động sản Techcom Việt Nam (TCREIT) | Quỹ đóng (niêm yết) | 75.223.561.190  |\n|  Quỹ Đầu tư Trái Phiếu linh hoạt Techcom (TCFF) | Quỹ mở | 113.197.601.214  |', '# IV. THÔNG TIN VỀ CÔNG TY CỔ PHẦN QUẢN LÝ QUỸ KỸ THƯƠNG\n## 1. Các thông tin chung\n**Địa chỉ trụ sở chính:** 191 Bà Triệu, phường Lê Đại Hành, quận Hai Bà Trưng, TP. Hà Nội.', '# IV. THÔNG TIN VỀ CÔNG TY CỔ PHẦN QUẢN LÝ QUỸ KỸ THƯƠNG\n## Hội đồng quản trị\n- **Ông Đặng Lưu Dũng – Thành viên Hội đồng quản trị**  \nÔng Dũng có trên 20 năm kinh nghiệm trong lĩnh vực quản trị doanh nghiệp, dự án tài chính, tái cơ cấu cấu trúc tài chính doanh nghiệp, đầu tư, mua bán sáp nhập, thị trường vốn, ngân hàng và quản lý quỹ. Trước khi gia nhập Techcombank vào năm 2012, ông Dũng có 5 năm kinh nghiệm làm việc tại FPT, nơi ông là một trong những người sáng lập Công ty quản lý quỹ FPT Capital và giữ chức vụ Giám đốc đầu tư rồi Tổng Giám đốc. Đáng chú ý trong', '# IX. THÔNG TIN VỀ QUỸ ĐẦU TƯ CỔ PHIẾU DOANH NGHIỆP VỮA VÀ NHỎ TECHCOM (TCSME)\n## 1. Thông tin chung về Quỹ\n- Tên Quỹ bằng tiếng Việt: QUỸ ĐẦU TƯ CỔ PHIẾU DOANH NGHIỆP VỮA VÀ NHỎ TECHCOM\n- Tên Quỹ bằng tiếng Anh: Techcom Small and Medium Enterprise Equity Fund\n- Tên viết tắt: TCSME', '## 2. Thông tin về đợt phát hành lần đầu ra công chúng\nNhà Đầu Tư nên tham khảo ý kiến của các chuyên gia tư vấn tài chính riêng của mình để đảm bảo Nhà Đầu Tư đủ điều kiện để đầu tư vào Quỹ theo các quy định pháp luật áp dụng và liệu Quỹ có phù hợp với khả năng chấp nhận rủi ro của Nhà Đầu Tư.  \n|  Tên quỹ | Quỹ Đầu tư Cổ phiếu Doanh nghiệp vừa và nhỏ Techcom  |\n| --- | --- |\n|  Loại hình | Quỹ mở  |\n|  Mục tiêu đầu tư | Mục tiêu đầu tư của Quỹ là tìm kiếm lợi nhuận dài hạn thông qua thu nhập và tăng trưởng giá trị đầu tư vốn trên cơ sở đánh giá, lựa chọn các tài sản có chất lượng tốt, phân bổ danh mục hợp lý và tối thiểu hóa rủi ro cho Nhà Đầu Tư.  |', '## XIII. CUNG CÁP THỐNG TIN CHO NHÀ ĐẦU TƯ, CHẾ ĐỘ BÁO CÁO\nTCC sẽ công bố hoặc cung cấp cho Nhà Đầu Tư các thông tin sau:  \n- Bản cáo bạch, bản cáo bạch tóm tắt, báo cáo tài chính bán niên, báo cáo tài chính năm đã kiểm toán;', '6  \nvà Giấy chứng nhận đăng ký hoạt động lưu ký chứng khoán số 510/QĐ-ĐKHĐLK ngày 01/08/2006 do UBCKNN cấp, thực hiện các nghiệp vụ bảo quản, lưu ký các chứng khoán, các hợp đồng kinh tế, các chứng từ có liên quan đến tài sản của Quỹ, đồng thời giám sát hoạt động của Quỹ. Quyền và nghĩa vụ của Ngân Hàng Giám Sát được quy định tại Chương VII của Điều lệ Quỹ.  \n“Công Ty Kiểm Toán”\nlà công ty kiểm toán độc lập cho quỹ được Đại Hội Nhà Đầu Tư chỉ định, thực hiện việc kiểm toán hàng năm tài sản của Quỹ Đầu Tư Cổ phiếu Doanh nghiệp vừa và nhỏ Techcom.  \n“Điều lệ”\ncó nghĩa là Điều lệ Quỹ, các phụ lục đính kèm và các sửa đổi bổ sung hợp pháp (nếu có) được Đại hội nhà đầu tư thông qua tại Đại hội Nhà đầu tư.  \n“Bản Cáo Bạch”']","Địa chỉ tại Tầng 28, Tòa C5, số 119 Trần Duy Hưng, phường Trung Hòa, Quận Cầu Giấy, Hà Nội."
Thông tin về Ngân hàng lưu ký có số giấy chứng nhận đăng ký hoạt động là 510/QĐ-ĐKHĐLK như thế nào?,"Thông tin về Ngân hàng lưu ký có số giấy chứng nhận đăng ký hoạt động là 510/QĐ-ĐKHĐLK như sau:

- Ngân hàng lưu ký được thành lập theo Quyết định số 171/2008/QĐ-TTg ngày 18/12/2008 của Thủ tướng Chính phủ.
- Đây là Trung tâm Lưu ký Chứng khoán Việt Nam, thay mặt Công ty quản lý quỹ thực hiện toàn bộ các công việc liên quan đến dịch vụ đại lý chuyển nhượng chứng chỉ quỹ theo quy định của pháp luật.

Thông tin này được lấy từ trang 68 trong tài liệu.","['# II. CÁC ĐỊNH NGHĨA\nGiấy chứng nhận đăng ký doanh nghiệp số 0102995749 do Sở Kế hoạch và Đầu tư Thành phố Hà Nội cấp ngày 27/05/2021, đáp ứng các tiêu chuẩn như nêu tại Điều 30 và có các quyền và nghĩa vụ như quy định tại Điều 31 của Điều lệ Quỹ.  \n“Ngân Hàng Giám Sát” Là Ngân hàng TMCP Đầu tư và Phát triển Việt Nam - Chi nhánh Hà Thành, một chi nhánh được thành lập theo Giấy chứng nhận đăng ký hoạt động chi nhánh số 0100150619-073 cấp lần đầu ngày 12/9/2003 thay đổi lần 12 ngày 16/06/2020 do Sở kế hoạch và Đầu tư thành phố Hà Nội cấp', '## V. NGÂN HÀNG GIÁM SÁT\n- Tên ngân hàng: Ngân hàng TMCP Đầu tư và Phát triển Việt Nam – Chi nhánh Hà Thành\n- Giấy chứng nhận đăng ký hoạt động chi nhánh: Số 0100150619-073 cấp lần đầu ngày 12/9/2003 thay đổi lần 12 ngày 16/06/2020 do Sở kế hoạch và Đầu tư thành phố Hà Nội cấp\n- GCNDK hoạt động lưu ký: Số 510/QĐ-ĐKHĐLK ngày 01/08/2006 do UBCKNN cấp\n- Trụ sở chính: 74 Thợ Nhuộm, Hoàn Kiếm, Hà Nội, Việt Nam\n- Điện thoại: +84.24 39411840 Fax: +84.24 39411847  \nNgân hàng Giám sát chịu trách nhiệm trong phạm vi liên quan đến hoạt động của ngân hàng giám sát theo quy định tại Điều lệ Quỹ và Hợp đồng Giám sát.', '# VIII. TỔ CHỨC ĐƯỢC ỦY QUYỀN\n## 1. Ủy quyền đại lý chuyển nhượng\n- Tên đại lý: Trung tâm Lưu ký Chứng khoán Việt Nam\n- Giấy phép hoạt động: Quyết định số 171/2008/QĐ-TTg ngày 18/12/2008 của Thủ tướng Chính phủ về việc thành lập Trung tâm Lưu ký Chứng khoán Việt Nam\n- GCNDK hoạt động chuyển nhượng: Quyết định số 2880/QĐ-BTC ngày 22/11/2013 của Bộ trưởng Bộ Tài chính về việc ban hành Điều lệ tổ chức và hoạt động của Trung tâm Lưu ký Chứng khoán Việt Nam\n- Trụ sở chính: Số 112 Đường Hoàng Quốc Việt, Phường Cổ Nhuế 1, Quận Bắc Từ Liêm, Thành Phố Hà Nội\n- Điện thoại: +84 24 39747123    Fax: +84 24 39747120', '# PHỤ LỤC 2. CÁC ĐỐI TÁC CÓ LIÊN QUAN\nNgân hàng lưu ký, giám sát và quản trị quỹ:  \nNgân hàng TMCP Đầu tư và Phát triển Việt Nam - Chi nhánh Hà Thành, một chi nhánh được thành lập theo Giấy chứng nhận đăng ký hoạt động chi nhánh số 0100150619-073 cấp lần đầu ngày 12/9/2003 thay đổi lần 12 ngày 16/06/2020 do Sở kế hoạch và Đầu tư thành phố Hà Nội cấp và Giấy chứng nhận đăng ký hoạt động lưu ký chứng khoán số 510/QĐ-ĐKHĐLK ngày 01/08/2006 do UBCKNN cấp, thực hiện các nghiệp vụ (i) bảo quản, lưu ký chứng khoán, tài liệu xác nhận quyền sở hữu tài sản hợp pháp của Quỹ; các hợp đồng kinh tế, các chứng từ có liên quan đến tài sản của Quỹ đồng thời giám sát hoạt động của Quỹ; (ii) thực hiện chức năng giám sát toàn bộ quản lý tài sản của Quỹ do Công ty Quản lý Quỹ thực hiện.  \n![img-14.jpeg](img-14.jpeg)', '# VIII. TỔ CHỨC ĐƯỢC ỦY QUYỀN\n## 2. Ủy quyền dịch vụ quản trị quỹ đầu tư\n- Tên ngân hàng: Ngân hàng TMCP Đầu tư và Phát triển Việt Nam – Chi nhánh Hà Thành\n- Giấy chứng nhận đăng ký hoạt động chi nhánh: Số 0100150619-073 cấp lần đầu ngày 12/9/2003 thay đổi lần 12 ngày 16/06/2020 do Sở kế hoạch và Đầu tư thành phố Hà Nội cấp\n- GCNDK hoạt động lưu ký: Số 510/QĐ-ĐKHDLK ngày 01/08/2006 do UBCKNN cấp\n- Trụ sở chính: 74 Thợ Nhuộm, Hoàn Kiếm, Hà Nội, Việt Nam\n- Điện thoại: +84.24 39411840    Fax: +84.24 39411847  \nTổ chức cung cấp dịch vụ quản trị quỹ chịu trách nhiệm trong phạm vi liên quan đến dịch vụ cung cấp theo quy định tại hợp đồng dịch vụ ký kết giữa Công ty Quản lý Quỹ và tổ chức cung cấp dịch vụ quản trị quỹ.', '6  \nvà Giấy chứng nhận đăng ký hoạt động lưu ký chứng khoán số 510/QĐ-ĐKHĐLK ngày 01/08/2006 do UBCKNN cấp, thực hiện các nghiệp vụ bảo quản, lưu ký các chứng khoán, các hợp đồng kinh tế, các chứng từ có liên quan đến tài sản của Quỹ, đồng thời giám sát hoạt động của Quỹ. Quyền và nghĩa vụ của Ngân Hàng Giám Sát được quy định tại Chương VII của Điều lệ Quỹ.  \n“Công Ty Kiểm Toán”\nlà công ty kiểm toán độc lập cho quỹ được Đại Hội Nhà Đầu Tư chỉ định, thực hiện việc kiểm toán hàng năm tài sản của Quỹ Đầu Tư Cổ phiếu Doanh nghiệp vừa và nhỏ Techcom.  \n“Điều lệ”\ncó nghĩa là Điều lệ Quỹ, các phụ lục đính kèm và các sửa đổi bổ sung hợp pháp (nếu có) được Đại hội nhà đầu tư thông qua tại Đại hội Nhà đầu tư.  \n“Bản Cáo Bạch”', '# NGÂN HÀNG GIÁM SÁT\nTên ngân hàng giám sát: Ngân hàng TMCP Đầu tư &amp; Phát triển Việt Nam – Chi nhánh Hà Thành;  \nGiấy chứng nhận đăng ký kinh doanh số 0100150619-073 cấp lần đầu ngày 12/09/2003, thay đổi lần thứ 12 ngày 16/06/2020 do Sở Kế hoạch và Đầu tư thành phố Hà Nội cấp;  \nGiấy phép hoạt động lưu ký chứng khoán số: 510/QĐ-ĐKHĐLK ngày 01/08/2006 do UBCKNN cấp;  \nChúng tôi, với tư cách là Ngân hàng giám sát của Quỹ Đầu Tư Cổ phiếu Doanh nghiệp vừa và nhỏ Techcom sẽ chịu trách nhiệm theo các quy định trong phạm vi Hợp Đồng Cung Cấp Dịch Vụ lưu ký giám sát của Quỹ được ký kết giữa chúng tôi với Công ty Cổ phần Quản lý Quỹ Kỹ Thương, và các quy định về Ngân hàng giám sát trong Điều lệ, Bản cáo bạch của Quỹ.  \n![img-13.jpeg](img-13.jpeg)  \nPHÓ GIÁM ĐỐC\nNguyễn Mạnh Cường', 'Nhà Đầu Tư có thể thanh toán số tiền mua Đơn Vị Quỹ từ tài khoản ngân hàng của mình vào tài khoản của Quỹ để Ngân Hàng Giám Sát nhận được đúng hạn và Đại Lý Phân Phối hoàn thành xử lý việc đăng ký với Đại Lý Chuyển Nhượng. Mọi khoản đầu tư vào Đơn Vị Quỹ đều thực hiện bằng tiền Đồng Việt Nam.  \nTrong trường hợp lệnh mua chứng chỉ quỹ và việc thanh toán cho lệnh mua được thực hiện bởi cá nhân, tổ chức khác không phải nhà đầu tư thì phiếu lệnh và tài liệu xác nhận thanh toán phải nêu rõ tên, số tài khoản và giá trị thanh toán của nhà đầu tư được hưởng lợi.', 'Nhà đầu tư nên lưu lại một bản Hợp đồng và cập nhật các thông tin cung cấp trong Hợp đồng. Thông tin này sẽ được lưu lại trong Số Đăng Ký của Quỹ và luôn chứa đựng thông tin về địa chỉ hiện tại địa chỉ thư điện tử, nơi đăng ký thuế, và chi tiết tài khoản ngân hàng của từng Nhà Đầu Tư nhằm đảm bảo Nhà Đầu Tư nhận được đầy đủ các thông báo, báo cáo và thanh toán liên quan đến Quỹ.  \nNhà Đầu Tư mua Đơn Vị Quỹ tại các lần tiếp theo cần điền đầy đủ vào phiếu Lệnh Mua có sẵn tại các Điểm Nhận Lệnh.', '## 2.3. Đặc trưng của chứng chỉ Quỹ đầu tư\nCông ty quản lý quỹ thực hiện hoặc ủy quyền cho tổ chức cung cấp dịch vụ đại lý chuyển nhượng lập và quản lý số đăng ký nhà đầu tư chính (sổ chính) hoặc ủy quyền đại lý ký danh lập, quản lý đăng ký nhà đầu tư phụ (sổ phụ) và xác nhận quyền sở hữu chứng chỉ quỹ cho nhà đầu tư.  \nSố đăng ký nhà đầu tư của Quỹ có thể là văn bản, tập dữ liệu điện tử hoặc cả hai. Các nội dung của Số đăng ký nhà đầu tư được quy định chi tiết tại điều 15 Điều lệ Quỹ.', 'Nhà Đầu Tư có thể thanh toán số tiền mua Đơn Vị Quỹ bằng cách chuyển khoản từ tài khoản ngân hàng của mình hoặc nộp tiền trực tiếp vào tài khoản của Quỹ để Ngân Hàng Giám Sát nhận được đúng hạn và Đại Lý Phân Phối hoàn thành xử lý việc đăng ký với Đại Lý Chuyển Nhượng. Mọi khoản đầu tư vào Đơn Vị Quỹ đều thực hiện bằng tiền Đồng Việt Nam.  \nTrong trường hợp lệnh mua chứng chỉ quỹ và việc thanh toán cho lệnh mua được thực hiện bởi cá nhân, tổ chức khác không phải nhà đầu tư thì phiếu lệnh và tài liệu xác nhận thanh toán phải nêu rõ tên, số tài khoản và giá trị thanh toán của nhà đầu tư được hưởng lợi.  \n- **Tuân Thủ**', '- Giấy chứng nhận đăng ký lập Quỹ đại chúng: do UBCKNN cấp\n- Loại hình: Quỹ mở\n- Vốn điều lệ ban đầu: 50.000.000.000 (năm mươi tỷ đồng)\n- Thời hạn của Quỹ: không giới hạn', '## XIII. CUNG CÁP THỐNG TIN CHO NHÀ ĐẦU TƯ, CHẾ ĐỘ BÁO CÁO\nHàng tháng, quý, năm Công Ty Quản Lý Quỹ sẽ gửi thống kê giao dịch, sao kê tài khoản giao dịch, tài khoản phụ, báo cáo giá trị NAV và các thay đổi NAV của Quỹ và các báo cáo khác theo luật định cho Nhà Đầu Tư.  \nĐối với Nhà Đầu Tư giao dịch trên tài khoản ký danh, Công Ty Quản Lý Quỹ hoặc tổ chức được ủy quyền bởi Công Ty Quản Lý Quỹ (trong phạm vi pháp luật hiện hành cho phép) sẽ gửi thống kê giao dịch và sao kê tài khoản phụ nếu Nhà Đầu Tư có yêu cầu bằng văn bản. Thời hạn cung cấp thông tin là trong vòng 05 (năm) ngày làm việc, kể từ ngày nhận được yêu cầu của Nhà Đầu Tư.', '# PHỤ LỤC 2. CÁC ĐỐI TÁC CÓ LIÊN QUAN\n## Đại lý chuyển nhượng\nTrung tâm Lưu ký Chứng khoán Việt Nam, được thành lập theo Quyết định thành lập số 171/2008/QĐ-TTg ngày 18/12/2008 của Thủ tướng Chính phủ, là đơn vị thay mặt Công ty quản lý quỹ thực hiện toàn bộ các công việc liên quan đến dịch vụ đại lý chuyển nhượng chứng chỉ quỹ theo quy định của pháp luật.', 'Sau khi hoàn thành đợt IPO, Công Ty Quản Lý Quỹ sẽ đăng ký xin giấy chứng nhận đăng ký thành lập Quỹ với UBCKNN nếu có ít nhất 100 (một trăm) Nhà Đầu Tư không chuyên nghiệp đầu tư vào Quỹ và tổng vốn đầu tư vào Quỹ đạt tối thiểu 50.000.000.000 VNĐ (năm mươi tỷ đồng). Khi nhận Giấy phép đăng ký, Ngân Hàng Giám Sát sẽ giải toả tài khoản ký quỹ của Quỹ đó để Quỹ có thể bắt đầu đầu tư. Dự kiến Ngày Giao Dịch đầu tiên sẽ trong vòng 30 (ba mươi) ngày kể từ ngày Giấy chứng nhận đăng ký lập quỹ có hiệu lực.  \nXác nhận đầu tư sẽ được gửi cho Nhà Đầu Tư trong vòng 05 (năm) ngày kể từ ngày Quỹ có được Giấy chứng nhận đăng ký thành lập từ UBCKNN.', '## Lĩnh vực được phép đầu tư\n- Có quy định tại Điều lệ quỹ và Bản cáo bạch;\n- Đã được Ban đại diện quỹ chấp thuận bằng văn bản về loại, mã chứng khoán, số lượng, giá trị giao dịch, thời điểm thực hiện;\n- Có đủ tài liệu chứng minh về bảo lãnh thanh toán hoặc tài liệu về cam kết mua lại của tổ chức phát hành.', '## 2.11. Tiêu chí lựa chọn, quyền hạn và trách nhiệm của Ngân hàng giám sát\nNgân Hàng Giám Sát được lựa chọn phải đáp ứng các điều kiện sau:  \n- Ngân hàng giám sát do Công ty quản lý quỹ lựa chọn phải đáp ứng các điều kiện quy định tại Khoản 1 Điều 116 Luật Chứng khoán;\n- Ngân hàng giám sát phải hoàn toàn độc lập và tách biệt với công ty quản lý quỹ mà ngân hàng cung cấp dịch vụ giám sát;\n- Ngân hàng giám sát, thành viên Hội đồng quản trị, người điều hành và nhân viên của ngân hàng giám sát làm nhiệm vụ giám sát hoạt động và bảo quản tài sản của quỹ đại chúng, công ty đầu tư chứng khoán không được là người có liên quan hoặc có quan hệ sở hữu, vay hoặc cho vay với công ty quản lý quỹ, công ty đầu tư chứng khoán và', 'ngược lại;  \n- Ngân hàng giám sát, thành viên Hội đồng quản trị, người điều hành và nhân viên của ngân hàng giám sát làm nhiệm vụ giám sát hoạt động và bảo quản tài sản của quỹ đại chúng, công ty đầu tư chứng khoán không được là đối tác mua, bán trong giao dịch mua, bán tài sản của quỹ đại chúng, công ty đầu tư chứng khoán.\n- Có đầy đủ năng lực cung cấp dịch vụ giám sát, lưu ký;\n- Thực hiện các cam kết đối với Quỹ như nêu tại Phụ lục 2 và Phụ lục 3 của Điều lệ Quỹ.  \nCác quy định về quyền và nghĩa vụ, hoạt động giám sát và chấm dứt quyền và nghĩa vụ của Ngân hàng giám sát tuân thủ theo quy định tại chương VII Điều lệ Quỹ.', 'Các Đại Lý Phân Phối sẽ tập hợp các Yêu cầu mở tài khoản của Nhà Đầu Tư và gửi Chỉ thị mở tài khoản cho Đại Lý Chuyển Nhượng, là tổ chức sẽ đại diện Công Ty Quản Lý Quỹ tiến hành xử lý yêu cầu. Các yêu cầu không đầy đủ thông tin sẽ bị từ chối và có thể làm trì hoãn việc hoàn tất quá trình xử lý yêu cầu. Trong một số trường hợp, việc bổ sung thêm thông tin yêu cầu cũng có thể làm chậm việc hoàn tất quá trình xử lý. Công Ty Quản Lý Quỹ được quyền từ chối yêu cầu trong trường hợp không tìm được cách giải quyết cho bất kỳ vấn đề nào này sinh trong quá trình xử lý yêu cầu đăng ký.', '1  \nỦy ban Chứng khoán Nhà nước cấp giấy phép phát hành chứng chỉ quỹ ra công chúng có nghĩa là việc xin phép lập Quỹ và phát hành chứng chỉ quỹ đầu tư đã thực hiện theo các quy định của pháp luật liên quan, không hàm ý bảo đảm về nội dung của Bản cáo bạch cũng như mục tiêu, chiến lược đầu tư của Quỹ.', '## 4. Các chỉ tiêu hoạt động\nCông ty quản lý quỹ sẽ công bố thông tin về tỷ lệ chi phí hoạt động quỹ và tốc độ vòng quay danh mục trong báo cáo tài chính bán niên và báo cáo tài chính năm được công bố trên trang thông tin điện tử của Công ty quản lý quỹ.', '## c) Tuân Thủ\nHợp đồng mở tài khoản giao dịch chứng khoán và đăng ký giao dịch quỹ mở để mua Đơn Vị Quỹ được soạn thảo để đáp ứng các yêu cầu áp dụng cho Các Công Ty Quản Lý Quỹ nhằm tuân thủ các quy định về Nhận Biết Khách Hàng (“KYC”) và các quy định Phòng Chống Rửa Tiền (“AML”). Vì vậy việc tất cả các giấy tờ và khai báo trong Hợp đồng cần được hoàn tất đầy đủ và trung thực.  \nTheo pháp luật Việt Nam, tất cả nhà đầu tư bắt buộc phải cung cấp giấy tờ và các thông tin bổ sung theo quy định về KYC và AML. Nhà đầu tư nước ngoài có thể phải cung cấp các thông tin và khai báo bổ sung nhằm tuân thủ các quy định quốc tế. Các Hợp đồng không có đủ hồ sơ hoặc thông tin theo yêu cầu có thể bị từ chối.', 'Sau khi thực hiện các Lệnh Bán Được Chấp Nhận, số Đơn Vị Quỹ đã bán sẽ được trừ ra từ tổng số Đơn Vị Quỹ trong tài khoản của Nhà Đầu Tư và bảng kê mới về số Đơn Vị Quỹ nắm giữ sẽ được gửi đến Nhà Đầu Tư. Chi tiết ngày thanh toán tiền mua lại chứng chỉ quỹ sẽ được Công ty Quản Lý Quỹ công bố trên trang web theo từng thời kỳ.', 'Quỹ đầu tư chứng khoán được mô tả trong Bản cáo bạch này là Quỹ được thành lập theo Luật Chứng khoán số 54/2019/QH14 được Quốc hội Nước Cộng hòa xã hội chủ nghĩa Việt Nam thông qua ngày 26 tháng 11 năm 2019 và các văn bản hướng dẫn thi hành. Bản cáo bạch này đã được đăng ký với Ủy ban Chứng khoán Nhà nước ngày / / 2022.', '# PHỤ LỤC 1. DANH SÁCH ĐẠI LÝ PHÂN PHỐI VÀ CÁC ĐIỂM NHẬN LỆNH\nCông ty Cổ phần Chứng khoán Kỹ thương (“TCBS”)  \nGiấy phép thành lập và hoạt động: Số 125/GP-UBCK ngày 30/05/2018 do Ủy ban Chứng khoán Nhà nước cấp  \nĐịa chỉ nhận lệnh: Tầng 10 và Tầng 12, Tòa nhà Techcombank, 191 Bà Triệu, Phường Lê Đại Hành, quận Hai Bà Trưng, Hà Nội']","Là Ngân hàng TMCP Đầu tư và Phát triển Việt Nam - Chi nhánh Hà Thành, có Giấy chứng nhận đăng ký hoạt động lưu ký chứng khoán số 510/QĐ-ĐKHĐLK ngày 01/08/2006 do UBCKNN cấp."
"Mức phí quản lý quỹ là 2,0%/năm áp dụng cho đối tượng nào?","Theo thông tin được cung cấp từ nguồn 1 (NGUỒN 1), mức phí quản lý quỹ là 2,0%/năm. Tuy nhiên, không có thông tin cụ thể về đối tượng áp dụng mức phí này.

Tôi không tìm thấy thông tin đó trong tài liệu. [Trang X, Y]","['## 3.2 Giá dịch vụ mà Quỹ phải trả\nGiá dịch vụ Quản Lý tối đa là 1,2% * NAV/năm.  \nĐại Hội Nhà Đầu Tư có thể ủy quyền cho Ban Đại Diện Quỹ quyết định điều chỉnh mức Giá dịch vụ Quản lý trong mức tối đa nêu trên nếu được Đại Hội Nhà Đầu Tư thông qua việc ủy quyền này trong Đại hội hàng năm gần nhất. Hiệu lực của việc điều chỉnh Giá dịch vụ Quản Lý sau khi Ban Đại Diện Quỹ phê duyệt sẽ được Công ty quản lý Quỹ công bố trên trang website. Trường hợp thay đổi Giá dịch vụ Quản lý dẫn đến giá dịch vụ vượt quá mức tối đa nêu trên sẽ phải được Đại Hội Nhà Đầu Tư phê duyệt.  \nTrong mọi trường hợp, tổng giá dịch vụ Quản lý Quỹ, giá dịch vụ Quản trị Quỹ và giá dịch vụ đại lý chuyển nhượng sẽ không vượt quá quy định của Pháp luật (2% NAV/năm).', 'Giá dịch vụ Quản Lý tối đa là 1,2%*NAV/năm.  \nĐại Hội Nhà Đầu Tư có thể ủy quyền cho Ban Đại Diện Quỹ quyết định điều chỉnh mức Giá dịch vụ Quản lý trong mức tối đa nêu trên nếu được Đại Hội Nhà Đầu Tư thông qua việc ủy quyền này trong Đại hội hàng năm gần nhất. Hiệu lực của việc điều chỉnh Giá dịch vụ Quản Lý sau khi Ban Đại Diện Quỹ phê duyệt sẽ được Công ty quản lý Quỹ công bố trên trang website. Trường hợp thay đổi Giá dịch vụ Quản lý dẫn đến giá dịch vụ vượt quá mức tối đa nêu trên sẽ phải được Đại Hội Nhà Đầu Tư phê duyệt.  \nTrong mọi trường hợp, tổng giá dịch vụ Quản lý Quỹ, giá dịch vụ Quản trị Quỹ và giá dịch vụ đại lý chuyển nhượng sẽ không vượt quá quy định của Pháp luật (2% NAV/năm).', '## d) Giá dịch vụ Quản Trị Quỹ\nGiá dịch vụ Quản trị quỹ sẽ là 0,03% NAV/năm và thấp nhất là 15.000.000 đồng/ tháng (chưa bao gồm thuế VAT)  \nCông thức tính giá dịch vụ quản trị quỹ vào mỗi kỳ định giá được xác định như sau:  \nGiá dịch vụ quản trị quỹ cho kỳ định giá = Tỷ lệ giá dịch vụ quản trị quỹ (năm) x NAV tại ngày trước ngày định giá x số ngày theo lịch thực tế của chu kỳ định giá / số ngày thực tế của năm (365 hoặc 366).', '## 3.2 Giá dịch vụ mà Quỹ phải trả\nGiá dịch vụ quản lý được tính vào mỗi kỳ định giá dựa trên NAV tại ngày trước ngày định giá và được thanh toán hàng tháng cho Công ty Quản Lý Quỹ. Số giá dịch vụ trả hàng tháng là tổng số giá dịch vụ được tính (trích lập) cho các kỳ định giá thực hiện trong tháng.  \nCông thức tính giá dịch vụ quản lý quỹ vào mỗi kỳ định giá được xác định như sau:  \nGiá dịch vụ quản lý quỹ cho kỳ định giá = Tỷ lệ giá dịch vụ quản lý (năm) x NAV tại ngày trước ngày định giá x số ngày theo lịch thực tế của chu kỳ định giá / số ngày thực tế của năm (365 hoặc 366).  \nGiá dịch vụ Quản Lý tối đa là 1,2% * NAV/năm.', '## 2.6. Giá dịch vụ mà Quỹ phải trả\nGiá dịch vụ quản lý được tính vào mỗi kỳ định giá dựa trên NAV tại ngày trước ngày định giá và được thanh toán hàng tháng cho Công ty Quản Lý Quỹ. Số giá dịch vụ trả hàng tháng là tổng số giá dịch vụ được tính (trích lập) cho các kỳ định giá thực hiện trong tháng.  \nCông thức tính giá dịch vụ quản lý quỹ vào mỗi kỳ định giá được xác định như sau:  \nGiá dịch vụ quản lý quỹ cho kỳ định giá = Tỷ lệ giá dịch vụ quản lý (năm) x NAV tại ngày trước ngày định giá x số ngày theo lịch thực tế của chu kỳ định giá / số ngày thực tế của năm (365 hoặc 366).  \n36', '|  Từ trên 12 tháng trở lên | 0,00%  |\n| --- | --- |  \nGiá dịch vụ Chuyển Đổi Quỹ sẽ được hạch toán cho Công Ty Quản Lý Quỹ và Đại Lý Phân Phối căn cứ theo hợp đồng ký giữa Công Ty Quản Lý Quỹ và Đại Lý Phân Phối.', '# 5. Kế hoạch phân chia lợi nhuận\nCông ty quản lý quỹ được phân chia lợi nhuận của quỹ cho nhà đầu tư bằng tiền hoặc bằng đơn vị quỹ theo quy định tại điều lệ quỹ và chính sách phân chia lợi nhuận được công bố tại bản cáo bạch. Lợi nhuận phân chia được trích từ nguồn lợi nhuận để lại hoặc từ thu nhập của quỹ. Công ty quản lý quỹ chỉ được phân chia lợi nhuận khi quỹ đã hoàn thành hoặc có đủ năng lực tài chính để hoàn thành nghĩa vụ thuế và các nghĩa vụ tài chính khác theo quy định của pháp luật; trích lập đầy đủ các quỹ theo quy định tại điều lệ quỹ; ngay sau khi trả hết số lợi nhuận đã định, quỹ vẫn phải bảo đảm thanh toán đủ các khoản nợ, nghĩa vụ tài sản khác đến hạn. Lịch trình và kế hoạch thực hiện phải được công bố công khai trên trang thông tin điện tử của công ty quản lý quỹ.', '|  Từ trên 9 đến tròn 12 tháng | 0,50%  |\n|  Từ trên 12 tháng trở lên | 0,00%  |  \nTrường hợp Nhà Đầu Tư mua Chứng Chỉ Quỹ nhiều lần, mua theo Chương Trình ĐTĐK hoặc dưới hình thức tái đầu tư bằng nguồn cổ tức của Quỹ không phải chịu Giá dịch vụ phát hành, ưu tiên bán được thực hiện theo nguyên tắc các Chứng Chỉ Quỹ mua trước sẽ được bán trước, không phân biệt chứng chỉ quỹ mua theo lệnh mua bình thường hay Chương Trình ĐTĐK hay hình thức tái đầu tư bằng nguồn cổ tức.  \nCông Ty Quản Lý Quỹ có quyền thay đổi Giá dịch vụ Mua lại nhưng không được vượt quá mức quy định của pháp luật. Mức Giá dịch vụ Mua lại mới sẽ được Công Ty Quản Lý Quỹ thông báo chi tiết tại trang thông tin điện tử của Quỹ và tại các địa điểm phân phối của các Đại Lý Phân Phối.', '## 3. Giá dịch vụ và thưởng hoạt động\nCác loại phí/dịch vụ và chi phí/giá dịch vụ liên quan trực tiếp đến việc giao dịch Đơn Vị Quỹ sẽ do Nhà Đầu Tư trả và không được tính vào chi phí của Quỹ. Công Ty Quản Lý Quỹ bảo lưu quyền thay đổi biểu phí/giá dịch vụ này.  \nCác khoản giá dịch vụ giao dịch như sau:', '## 2.5.3. Thông tin về các mức giá dịch vụ\nCác loại phí/dịch vụ và chi phí/giá dịch vụ liên quan trực tiếp đến việc giao dịch Đơn Vị Quỹ sẽ do Nhà Đầu Tư trả và không được tính vào chi phí của Quỹ. Công Ty Quản Lý Quỹ bảo lưu quyền thay đổi biểu phí/giá dịch vụ này.  \nCác khoản giá dịch vụ giao dịch như sau:', '## 3. Các rủi ro khi đầu tư vào Quỹ\nMục tiêu của Công Ty Quản Lý Quỹ là quản lý các rủi ro đầu tư, và nếu có thể, hạn chế tác động của các rủi ro này bằng việc áp dụng các phương pháp quản lý đầu tư theo tiêu chuẩn quốc tế tốt nhất. Nhà Đầu Tư cần lưu ý các điểm quan trọng sau đây:  \n- Quỹ, Công Ty Quản Lý Quỹ, thành viên Hội đồng thành viên, ban điều hành và nhân viên Công Ty Quản Lý Quỹ không có bất kỳ sự đảm bảo nào đối với vốn đầu tư ban đầu cũng như mức lợi nhuận từ đầu tư của Quỹ;\n- Không có bất kỳ sự bảo đảm nào về sổ lẫn chi trả và giá trị của cổ tức được thanh toán trong tương lai;  \n42', 'Mức đầu tư tối thiểu (tính theo giá trị Lệnh Mua) là 10.000 VNĐ (Mười nghìn đồng)  \nKhông có mức giới hạn đầu tư tối đa cho Nhà Đầu Tư. Công Ty Quản Lý Quỹ bảo lưu quyền thay đổi các giới hạn đầu tư trên trong từng thời điểm và sẽ thông báo về các thay đổi này.', 'Công ty Quản Lý Quỹ để Nhà Đầu Tư có thể tham khảo.', 'Giá dịch vụ Mua lại và các khoản giá dịch vụ ngân hàng và thuế khác (nếu có) sẽ được trừ vào khoản tiền thu được từ bản Đơn Vị Quỹ của Nhà Đầu Tư.  \nGiá dịch vụ Mua lại cho tất cả các Chương trình được TCC ấn định và công bố bằng văn bản thông báo tại từng thời kỳ nhưng không quá 3,0% (ba phần trăm) giá trị của Lệnh Bản. Thời điểm áp dụng mức giá dịch vụ mới tăng sớm nhất là 60 ngày kể từ ngày Công ty Quản Lý Quỹ công bố về mức giá dịch vụ mới trên trang thông tin điện tử của Công ty.  \nMức giá dịch vụ mua lại của Quỹ như sau:  \n|  Thời gian nắm giữ CCQ | Giá dịch vụ mua lại (% giá trị lệnh bán)  |\n| --- | --- |\n|  0 đến dưới 6 tháng | 1,00%  |\n|  Từ tròn 6 đến tròn 9 tháng | 0,75%  |\n|  Từ trên 9 đến tròn 12 tháng | 0,50%  |\n|  Từ trên 12 tháng trở lên | 0,00%  |', '## f) Lệnh Mua Tối Thiểu\nMức đầu tư tối thiểu (tính theo giá trị Lệnh Mua) là 10.000 VND (Mười nghìn đồng)  \nKhông có mức giới hạn đầu tư tối đa cho Nhà Đầu Tư. Công Ty Quản Lý Quỹ bảo lưu quyền thay đổi các giới hạn đầu tư trên trong từng thời điểm và sẽ thông báo về các thay đổi này.', '## 2.2.4 Hạn mức đầu tư\nHạn mức đầu tư của Quỹ được quy định chi tiết tuân thủ các quy định tại Thông tư hướng dẫn hoạt động và quản lý các quỹ đầu tư chứng khoán. Cơ cấu danh mục đầu tư của Quỹ phải bảo đảm tuân thủ các hạn mức đầu tư sau:  \na) Trừ tiền gửi trên tài khoản thanh toán của quỹ tại ngân hàng giám sát, quỹ mở không được đầu tư quá 49% tổng giá trị tài sản của quỹ vào các tài sản theo quy định tại điểm a, b mục IX.2.2.3  \nb) Không được đầu tư vào chứng khoán của một tổ chức phát hành quá 10% tổng giá trị chứng khoán đang lưu hành của tổ chức đó, trừ công cụ nợ của Chính phủ;  \nc) Không được đầu tư quá 20% tổng giá trị tài sản của quỹ vào chứng khoán đang lưu hành và các tài sản (nếu có) quy định tại điểm a, b mục IX.2.2.3 của một tổ chức phát hành, trừ công cụ nợ của Chính phủ;', '- Thực hiện các lệnh giao dịch của Nhà Đầu Tư;  \n- Các hoạt động sáp nhập, hợp nhất của các tổ chức phát hành các chứng khoán mà Quỹ đang nắm giữ;  \n- Quỹ mới được cấp phép thành lập hoặc do tách Quỹ, hợp nhất Quỹ, sát nhập Quỹ mà thời gian hoạt động không quá sáu (06) tháng, tính từ ngày được cấp giấy chứng nhận đăng ký lập Quỹ;  \n- Quỹ đang trong thời gian giải thể.  \nTrong trường hợp xảy ra sai lệch so với các hạn mức đầu tư, Công ty Quản Lý Quỹ sẽ điều chỉnh danh mục đầu tư để đáp ứng các hạn mức đầu tư kể trên trong vòng 3 (ba) tháng kể từ ngày mà sai lệch phát sinh.', '## h) Chi Phí Khác\n- Giá dịch vụ môi giới cho các giao dịch của quỹ;\n- Chi phí in ấn, ví dụ in các tài liệu cho Nhà Đầu Tư theo quy định Pháp Luật;\n- Giá dịch vụ định giá độc lập cho các khoản đầu tư cụ thể của Quỹ (chỉ khi cần thiết), ví dụ như định giá các khoản chứng khoán chưa niêm yết;\n- Chi phí phát sinh cho bất kỳ Đại Hội Nhà Đầu Tư hay cuộc họp nào của Ban Đại Diện Quỹ;\n- Phí/giá dịch vụ pháp lý liên quan đến hoạt động và các giao dịch của Quỹ và các loại phí/chi phí/dịch vụ khác theo Luật cho phép;\n- Thuế và các loại phí/dịch vụ bắt buộc của chính phủ áp dụng cho Quỹ; và\n- Các chi phí khác được Pháp Luật cho phép.', 'Công thức tính giá dịch vụ quản trị quỹ vào mỗi kỳ định giá được xác định như sau:  \nGiá dịch vụ quản trị quỹ cho kỳ định giá = Tỷ lệ giá dịch vụ quản trị quỹ (năm) x NAV tại ngày trước ngày định giá x số ngày theo lịch thực tế của chu kỳ định giá / số ngày thực tế của năm (365 hoặc 366).  \nc. Giá dịch vụ Đại Lý Chuyển Nhượng  \nGiá dịch vụ Đại lý chuyển nhượng được tính toán và cộng đồng theo kỳ định giá và được thanh toán định kỳ theo thỏa thuận với Đại lý chuyển nhượng. Giá dịch vụ Đại lý chuyển nhượng được thống nhất với Đại lý chuyển nhượng phù hợp với quy định của pháp luật và có thể được điều chỉnh theo thỏa thuận với Đại lý chuyển nhượng.  \nd. Chi phí Kiểm Toán', '## 3. Giá dịch vụ và thưởng hoạt động\nGiá dịch vụ Mua lại cho tất cả các Chương trình được TCC ấn định và công bố bằng văn bản thông báo tại từng thời kỳ nhưng không quá 3,0% (ba phần trăm) giá trị của Lệnh Bán. Thời điểm áp dụng mức giá dịch vụ mới tăng sớm nhất là 60 ngày kể từ ngày Công ty Quản Lý Quỹ công bố về mức giá dịch vụ mới trên trang thông tin điện tử của Công ty.  \nMức giá dịch vụ mua lại của Quỹ như sau:  \n|  Thời gian nắm giữ CCQ | Giá dịch vụ mua lại (% giá trị lệnh bán)  |\n| --- | --- |\n|  0 đến dưới 6 tháng | 1,00%  |', '|  Từ tròn 6 đến tròn 9 tháng | 0,75%  |\n| --- | --- |\n|  Từ trên 9 đến tròn 12 tháng | 0,50%  |\n|  Từ trên 12 tháng trở lên | 0,00%  |  \nTrường hợp Nhà Đầu Tư mua Chứng Chỉ Quỹ nhiều lần, mua theo Chương Trình ĐTĐK hoặc dưới hình thức tái đầu tư bằng nguồn cổ tức của Quỹ không phải chịu Giá dịch vụ phát hành, ưu tiên bán được thực hiện theo nguyên tắc các Chứng Chỉ Quỹ mua trước sẽ được bán trước, không phân biệt chứng chỉ quỹ mua theo lệnh mua bình thường hay Chương Trình ĐTĐK hay hình thức tái đầu tư bằng nguồn cổ tức.', '## 4. Các chỉ tiêu hoạt động\nCông ty quản lý quỹ sẽ công bố thông tin về tỷ lệ chi phí hoạt động quỹ và tốc độ vòng quay danh mục trong báo cáo tài chính bán niên và báo cáo tài chính năm được công bố trên trang thông tin điện tử của Công ty quản lý quỹ.', 'Công Ty Quản Lý Quỹ có quyền thay đổi Giá dịch vụ Mua lại nhưng không được vượt quá mức quy định của pháp luật. Mức Giá dịch vụ Mua lại mới sẽ được Công Ty Quản Lý Quỹ thông báo chi tiết tại trang thông tin điện tử của Quỹ và tại các địa điểm phân phối của các Đại Lý Phân Phối.  \nGiá dịch vụ Mua lại sẽ được trừ vào khoản tiền bán được trả lại cho các Nhà Đầu Tư khi thực hiện các Lệnh Bản và được hạch toán cho Công Ty Quản Lý Quỹ và Đại Lý Phân Phối căn cứ theo hợp đồng ký giữa Công Ty Quản Lý Quỹ và Đại Lý Phân Phối.', '# MỤC LỤC\n2.5.1. Tần suất định giá và phương pháp xác định giá giao dịch trên một đơn vị quỹ ... 33\n2.5.2. Hình thức công bố thông tin về giá các giao dịch, nơi công bố thông tin, tần suất công bố thông tin ... 34\n2.5.3. Thông tin về các mức giá dịch vụ ... 34\n2.6. Giá dịch vụ mà Quỹ phải trả ... 36\n2.7. Phân phối lợi nhuận và chính sách thuế ... 39\n2.8. Đại hội Nhà đầu tư ... 40\n2.9. Ban Đại diện Quỹ dự kiến ... 40\n2.10. Tiêu chí lựa chọn, quyền hạn và trách nhiệm của Công ty Quản lý quỹ ... 41', '## c) Giá dịch vụ Lưu Ký\nGiá dịch vụ lưu ký được trả cho Ngân Hàng Lưu ký để cung cấp dịch vụ Ngân Hàng Lưu ký cho Quỹ. Giá dịch vụ được tính vào mỗi kỳ định giá dựa trên NAV tại ngày trước Ngày Định Giá và được trả hàng tháng. Số tiền trả dịch vụ hàng tháng là tổng số được tính (trích lập) cho các kỳ định giá thực hiện trong tháng.  \nCông thức tính giá dịch vụ lưu ký vào mỗi kỳ định giá được xác định như sau:  \nGiá dịch vụ lưu ký cho kỳ định giá = Tỷ lệ giá dịch vụ lưu ký (năm) x NAV tại ngày trước ngày định giá x số ngày theo lịch thực tế của chu kỳ định giá / số ngày thực tế của năm (365 hoặc 366).  \n|  Loại Giá dịch vụ | Mức giá dịch vụ | Tối thiểu/tối đa | Ghi chú  |\n| --- | --- |\n|  Giá dịch vụ lưu ký | 0,06%*NAV/Năm | Tối thiểu: 20.000.000 đồng /tháng |   |']","Mức phí 2,0% NAV/năm là mức giá dịch vụ Quản Lý tối đa được quy định trong Bản cáo bạch (mức hiện tại áp dụng có thể thấp hơn tùy thông báo)."
Số điện thoại liên hệ của Công ty Cổ phần Quản lý quỹ Kỹ thương (TechcomCapital) là số nào?,"Số điện thoại liên hệ của Công ty Cổ phần Quản lý quỹ Kỹ thương (TechcomCapital) không được cung cấp trong tài liệu đã được cung cấp. Tôi không tìm thấy thông tin đó trong tài liệu.

(Nguồn: Trang 5)","['## XIV. THÔNG TIN LIÊN LẠC\nĐể biết thêm thông tin chung, xin liên hệ:  \nCông Ty Cổ phần Quản lý Quỹ Kỹ thương (TechcomCapital)  \nĐịa chỉ: Tầng 28, Tòa C5, số 119 Trần Duy Hưng, phường Trung Hòa, Quận Cầu Giấy, Hà Nội  \nĐiện thoại: (+84) 24 39446368\nFax: (+84) 24 39446583', '# IV. THÔNG TIN VỀ CÔNG TY CỔ PHẦN QUẢN LÝ QUỸ KỸ THƯƠNG\n## 1. Các thông tin chung\n- **Tên bằng tiếng Việt:** Công ty Cổ phần Quản lý Quỹ Kỹ thương\n- **Tên bằng tiếng Anh:** TechcomCapital Joint Stock Company\n- **Tên viết tắt:** TechcomCapital (TCC)\n- **Giấy phép thành lập:** Giấy phép thành lập và hoạt động Số 40/UBCK-GP do Chủ tịch Ủy ban Chứng khoán Nhà nước cấp ngày 21/10/2008 và được cấp lại Giấy phép thành lập và hoạt động Số 57/GP-UBCK do UBCKNN cấp ngày 30/01/2019 do chuyển đổi loại hình từ công ty TNHH sang công ty cổ phần.\n- **Giấy chứng nhận đăng ký doanh nghiệp số** 0102995749 do Sở Kế hoạch và Đầu tư Thành phố Hà Nội cấp ngày 27/05/2021\n- **Vốn điều lệ:** 44.943.820.000 đồng (Bốn mươi bốn tỷ chính trăm bốn mươi ba triệu tám trăm hai mươi nghìn đồng)\n- **Địa chỉ đăng ký:** Tầng 28, Tòa C5, số 119 Trần Duy Hưng, phường Trung Hòa, Quận Cầu Giấy, Hà Nội', '# QUỸ ĐẦU TƯ CỔ PHIẾU DOANH NGHIỆP VỮA VÀ NHỎ TECHCOM (TCSME)\n**Phụ trách công bố thông tin:**  \n**Ông** : Đặng Lưu Dũng – Tổng Giám đốc  \n**Địa chỉ** : Công ty Cổ phần Quản lý quỹ Kỹ thương  \nTầng 28, Tòa C5, số 119 Trần Duy Hưng, phường Trung Hòa, Quận Cầu Giấy, Hà Nội  \n**Điện thoại** : (84-24) 39446368Fax: (84-24) 39446583', '# IV. THÔNG TIN VỀ CÔNG TY CỔ PHẦN QUẢN LÝ QUỸ KỸ THƯƠNG\n## 1. Các thông tin chung\n- **Điện thoại:** (+84) 24 39446368  **Fax:** (+84) 24 39446583\n- **Các cổ đông của công ty Quản lý Quỹ sở hữu từ 5% trở lên vốn điều lệ:**  \n|  Tên cổ đông | Giá trị vốn chủ sở hữu | Tỷ lệ vốn chủ sở hữu  |\n| --- | --- | --- |\n|  Ngân hàng TMCP Kỹ thương Việt Nam | 39.999.800.000 | 88,99956%  |\n|  Bà Nguyễn Thị Thu Hiền | 2.696.640.000 | 6,00002%  |\n|  Cổ đông - Khác | 2.247.380.000 | 5,00042%  |\n|   | 44.943.820.000 | 100%  |  \nTechcombank được thành lập theo Giấy chứng nhận đăng ký doanh nghiệp số 0100230800 do Sở Kế hoạch và Đầu tư TP. Hà Nội cấp lần thứ 45 ngày 26/07/2013, đăng ký cấp lại mã số doanh nghiệp lần 1 ngày 03/07/2012 từ ĐKKD số 055697 do Trọng tài kinh tế Nhà nước cấp ngày 07/09/1993.', '## 2. Ngân hàng giám sát\nNgân hàng TMCP Đầu tư và Phát triển Việt Nam - Chi nhánh Hà Thành  \nĐại diện hợp pháp: Ông Nguyễn Mạnh Cường  \nChức vụ: Phó Giám đốc  \nBản cáo bạch này là một phần của hồ sơ đăng ký chào bán của Công ty Cổ phần Quản lý quỹ Kỹ thương (Techcom Capital – “TCC”). Chúng tôi, với tư cách là Ngân hàng Giám sát của Quỹ Đầu Tư Cổ phiếu Doanh nghiệp vừa và nhỏ Techcom (TCSME) sẽ chịu trách nhiệm theo các quy định trong phạm vi Hợp Đồng Cung Cấp Dịch Vụ Giám Sát Quỹ được ký kết giữa chúng tôi với Công ty Cổ phần Quản lý quỹ Kỹ thương, là công ty quản lý Quỹ Đầu tư Cổ phiếu Doanh nghiệp vừa và nhỏ Techcom và theo quy định của pháp luật.', '## THÔNG BÁO QUAN TRỌNG\nKhông người nào được ủy quyền để cung cấp bất kỳ thông tin hoặc đưa ra bất kỳ tuyên bố nào không được xác nhận trong Bản Cáo Bạch này liên quan đến đợt phát hành này hay việc phát hành các Đơn Vị Quỹ, và bất kỳ thông tin hoặc tuyên bố nào không có trong Bản Cáo Bạch này không được dựa vào như là đã được phê duyệt bởi TechcomCapital. Nhà Đầu Tư được yêu cầu phải kiểm tra các thông tin về uy tín của cá nhân/công ty mà mình ủy thác Đơn Đăng Ký và uy thác thanh toán cho bất kỳ giao dịch nào với Quỹ. Quỹ hoặc TechcomCapital không chịu trách nhiệm cho bất kỳ hành vi được thực hiện bởi các tổ chức trung gian đại diện cho hoặc được cho là đại diện cho Nhà Đầu Tư đó.', '- Các đối tác có liên quan đến đợt phát hành  \n**Ủy quyền đại lý chuyển nhượng**  \nTên đại lý: Trung tâm Lưu ký Chứng khoán Việt Nam\nTrụ sở chính: 15 Đoàn Trần Nghiệp, Quận Hai Bà Trưng, Hà Nội\nĐiện thoại: +84 24 39747113   Fax: +84 24 39747120  \n**Ủy quyền dịch vụ quản trị quỹ đầu tư**  \nTên ngân hàng: Ngân hàng TMCP Đầu tư và Phát triển Việt Nam – Chi nhánh Hà Thành\nTrụ sở chính: 74 Thợ Nhuộm, Hoàn Kiếm, Hà Nội\nĐiện thoại: (+84) 43 9362086   Fax: (+84) 439411847', '# MỤC LỤC\n1. Công ty quản lý quỹ ... 5\n2. Ngân hàng giám sát ... 5  \nII. CÁC ĐỊNH NGHĨA ... 5  \nIII. CƠ HỘI ĐẦU TƯ ... 8\n1. Tổng quan tình hình kinh tế vĩ mô ... 8\n2. Thị trường tài chính Việt Nam và cơ hội đầu tư ... 11\n3. Lợi thế của quỹ mở ... 14  \nIV. THÔNG TIN VỀ CÔNG TY CỔ PHẦN QUẢN LÝ QUỸ KỸ THƯƠNG ... 15\n1. Các thông tin chung ... 15\n2. Tình hình hoạt động của Công ty Cổ phần Quản lý Quỹ Kỹ thương ... 17  \nV. NGÂN HÀNG GIÁM SÁT ... 17  \nVI. CÔNG TY KIỂM TOÁN ... 17  \nVII. ĐẠI LÝ PHÂN PHỐI CHỨNG CHỈ QUỸ ... 18  \nVIII. TỔ CHỨC ĐƯỢC ỦY QUYỀN ... 18\n1. Ủy quyền đại lý chuyên nhượng ... 18\n2. Ủy quyền dịch vụ quản trị quỹ đầu tư ... 18  \nIX. THÔNG TIN VỀ QUỸ ĐẦU TƯ CỔ PHIẾU DOANH NGHIỆP VỮA VÀ NHỎ TECHCOM (TCSME) ... 18\n1. Thông tin chung về Quỹ ... 18\n2. Điều lệ Quỹ tóm tắt ... 19', '## 2. Thông tin về đợt phát hành lần đầu ra công chúng\nNhà Đầu Tư nên tham khảo ý kiến của các chuyên gia tư vấn tài chính riêng của mình để đảm bảo Nhà Đầu Tư đủ điều kiện để đầu tư vào Quỹ theo các quy định pháp luật áp dụng và liệu Quỹ có phù hợp với khả năng chấp nhận rủi ro của Nhà Đầu Tư.  \n|  Tên quỹ | Quỹ Đầu tư Cổ phiếu Doanh nghiệp vừa và nhỏ Techcom  |\n| --- | --- |\n|  Loại hình | Quỹ mở  |\n|  Mục tiêu đầu tư | Mục tiêu đầu tư của Quỹ là tìm kiếm lợi nhuận dài hạn thông qua thu nhập và tăng trưởng giá trị đầu tư vốn trên cơ sở đánh giá, lựa chọn các tài sản có chất lượng tốt, phân bổ danh mục hợp lý và tối thiểu hóa rủi ro cho Nhà Đầu Tư.  |', '# II. CÁC ĐỊNH NGHĨA\n“Quỹ” có nghĩa là Quỹ Đầu Tư Cổ phiếu Doanh nghiệp vừa và nhỏ Techcom, một loại hình Quỹ đầu tư chứng khoán dạng mở do Công ty Quản Lý Quỹ quản lý chào bán Chứng Chỉ Quỹ ra công chúng và được thành lập theo các quy định hiện hành về chứng khoán tại Việt Nam và Điều lệ này.  \n“Công ty Quản Lý Quỹ” có nghĩa là Công ty Cổ phần Quản Lý Quỹ Kỹ thương, được thành lập theo giấy phép thành lập và hoạt động Số 40/UBCK-GP do Chủ tịch Ủy ban Chứng khoán Nhà nước cấp ngày 21/10/2008 và được cấp lại Giấy phép thành lập và hoạt động Số 57/GP-UBCK do UBCKNN cấp ngày 30/01/2019 do chuyển đổi loại hình từ công ty TNHH sang công ty cổ phần.', '# QUỸ ĐẦU TƯ CỔ PHIẾU DOANH NGHIỆP VỮA VÀ NHỎ TECHCOM (TCSME)\n*(Giấy chứng nhận đăng ký chào bán chứng chỉ quỹ đầu tư chứng khoán ra công chúng số 256/GCN-UBCK do Chủ tịch UBCHN cấp ngày 23/8/2022)*  \nBản cáo bạch này được phát hành bởi:  \n**Công ty Cổ phần Quản lý quỹ Kỹ thương - TechcomCapital (“TCC”)**  \n**Địa chỉ** : Tầng 28, Tòa C5, số 119 Trần Duy Hưng, phường Trung Hòa, Quận Cầu Giấy, Hà Nội  \n**Điện thoại** : (84-24) 39446368Fax: (84-24) 39446583  \n**Website** : www.techcomcapital.com.vn  \n**Nơi cung cấp Bản cáo bạch:**  \nBản Cáo Bạch cập nhật nhất cùng các tài liệu của Quỹ (báo cáo hoạt động, báo cáo tài chính, Điều lệ Quỹ và các tài liệu cần thiết khác) được cung cấp trên trang điện tử của TCC, www.techcomcapital.com.vn, tại văn phòng của TCC và các Đại lý phân phối như danh sách trong phụ lục 1 của Bản Cáo Bạch.', 'Giao dịch với người có liên quan của TCC sẽ cấu thành xung đột lợi ích tiềm tàng. Người Có Liên Quan của TCC bao gồm Techcombank, thành viên Hội Đồng Thành viên của TCC, thành viên Ban Điều Hành (Giám đốc, Phó giám đốc) của TCC và các tổ chức, cá nhân khác được coi là người có liên quan của TCC theo quy định của Pháp Luật. Quỹ có thể có một số giao dịch với các bên được coi là người có liên quan của TCC như sau:  \n|  Tên của người có liên quan trong giao dịch | Bản chất quan hệ  |\n| --- | --- | --- |\n|  Công ty Cổ phần Chứng khoán Kỹ thương Việt Nam (""TCBS"") | Giao dịch chứng khoán Phân phối chứng chỉ quỹ\nĐầu tư vào Quỹ | TCBS là Đại Lý Phân Phối mà Techcombank sở hữu 89% cổ phần  |\n|  Techcombank (""TCB"") | Gửi tiền có kỳ hạn | Techcombank sở hữu 88.99% vốn của TCC  |', '# VIII. TỔ CHỨC ĐƯỢC ỦY QUYỀN\n## 2. Ủy quyền dịch vụ quản trị quỹ đầu tư\n- Tên ngân hàng: Ngân hàng TMCP Đầu tư và Phát triển Việt Nam – Chi nhánh Hà Thành\n- Giấy chứng nhận đăng ký hoạt động chi nhánh: Số 0100150619-073 cấp lần đầu ngày 12/9/2003 thay đổi lần 12 ngày 16/06/2020 do Sở kế hoạch và Đầu tư thành phố Hà Nội cấp\n- GCNDK hoạt động lưu ký: Số 510/QĐ-ĐKHDLK ngày 01/08/2006 do UBCKNN cấp\n- Trụ sở chính: 74 Thợ Nhuộm, Hoàn Kiếm, Hà Nội, Việt Nam\n- Điện thoại: +84.24 39411840    Fax: +84.24 39411847  \nTổ chức cung cấp dịch vụ quản trị quỹ chịu trách nhiệm trong phạm vi liên quan đến dịch vụ cung cấp theo quy định tại hợp đồng dịch vụ ký kết giữa Công ty Quản lý Quỹ và tổ chức cung cấp dịch vụ quản trị quỹ.', 'Quỹ không quy định quy mô tối đa trong đợt phát hành lần đầu ra công chúng. Vì vậy, nếu giá trị phát hành được vượt 50.000.000.000 VNĐ (năm mươi tỷ đồng), các Nhà Đầu Tư sẽ được phân bổ số lượng Đơn Vị Quỹ bằng với số đã đặt mua.  \n- Địa điểm phát hành:\nCông ty Cổ phần Quản lý Quỹ Kỹ thương\nĐịa chỉ đăng ký: Tầng 28, Tòa C5, số 119 Trần Duy Hưng, phường Trung Hòa, Quận Cầu Giấy, Hà Nội\nĐiện thoại: (+84) 24 39446368   Fax: (+84) 24 39446583  \n- Đại lý phân phối và điểm nhận lệnh:\nCông ty Cổ phần Chứng khoán Kỹ thương (“TCBS”)\nĐịa chỉ: Tầng 10 và Tầng 12, tòa nhà Techcombank, 191 Bà Triệu, phường Lê Đại Hành, quận Hai Bà Trưng, TP. Hà Nội\nĐiện thoại: 84.24.22201039   Fax: 84.24.22201032  \n- Các đối tác có liên quan đến đợt phát hành  \n**Ủy quyền đại lý chuyển nhượng**', '# VII. ĐẠI LÝ PHÂN PHỐI CHỨNG CHỈ QUỸ\nDanh sách Đại lý Phân phối được lựa chọn bao gồm:  \n- Công ty Cổ phần Chứng khoán Kỹ thương (“TCBS”)\n- Địa chỉ: Tầng 10 và Tầng 12, tòa nhà Techcombank, 191 Bà Triệu, phường Lê Đại Hành, quận Hai Bà Trưng, TP. Hà Nội\n- Giấy phép thành lập và hoạt động: số 125/GP-UBCK ngày 30/05/2018 do Ủy ban Chứng khoán Nhà nước cấp và các giấy phép điều chỉnh.\n- Số Giấy chứng nhận đăng ký hoạt động phân phối:\n- Điện thoại: 84.24.22201039    Fax: 84.24.22201032  \nDanh sách Đại Lý Phân phối và các Điểm Nhận Lệnh có thể thay đổi bất kỳ lúc nào sau khi hoàn thành các thủ tục thông báo tới Ủy ban Chứng khoán Nhà nước theo quy định của Pháp Luật.', '# IX. THÔNG TIN VỀ QUỸ ĐẦU TƯ CỔ PHIẾU DOANH NGHIỆP VỮA VÀ NHỎ TECHCOM (TCSME)\n## 1. Thông tin chung về Quỹ\n- Tên Quỹ bằng tiếng Việt: QUỸ ĐẦU TƯ CỔ PHIẾU DOANH NGHIỆP VỮA VÀ NHỎ TECHCOM\n- Tên Quỹ bằng tiếng Anh: Techcom Small and Medium Enterprise Equity Fund\n- Tên viết tắt: TCSME', '## 2.3. Đặc trưng của chứng chỉ Quỹ đầu tư\nCông ty quản lý quỹ thực hiện hoặc ủy quyền cho tổ chức cung cấp dịch vụ đại lý chuyển nhượng lập và quản lý số đăng ký nhà đầu tư chính (sổ chính) hoặc ủy quyền đại lý ký danh lập, quản lý đăng ký nhà đầu tư phụ (sổ phụ) và xác nhận quyền sở hữu chứng chỉ quỹ cho nhà đầu tư.  \nSố đăng ký nhà đầu tư của Quỹ có thể là văn bản, tập dữ liệu điện tử hoặc cả hai. Các nội dung của Số đăng ký nhà đầu tư được quy định chi tiết tại điều 15 Điều lệ Quỹ.', '## 2. Tình hình hoạt động của Công ty Cổ phần Quản lý Quỹ Kỹ thương\n| --- | --- | --- |\n|  Quỹ Đầu tư Trái Phiếu Techcom (TCBF) | Quỹ mở | 21.577.788.816.709  |\n|  Quỹ Đầu tư Cổ Phiếu Techcom (TCEF) | Quỹ mở | 549.603.026.323  |\n|  Quỹ Đầu tư Bất động sản Techcom Việt Nam (TCREIT) | Quỹ đóng (niêm yết) | 75.223.561.190  |\n|  Quỹ Đầu tư Trái Phiếu linh hoạt Techcom (TCFF) | Quỹ mở | 113.197.601.214  |', 'Nhà đầu tư nên lưu lại một bản Hợp đồng và cập nhật các thông tin cung cấp trong Hợp đồng. Thông tin này sẽ được lưu lại trong Số Đăng Ký của Quỹ và luôn chứa đựng thông tin về địa chỉ hiện tại địa chỉ thư điện tử, nơi đăng ký thuế, và chi tiết tài khoản ngân hàng của từng Nhà Đầu Tư nhằm đảm bảo Nhà Đầu Tư nhận được đầy đủ các thông báo, báo cáo và thanh toán liên quan đến Quỹ.  \nNhà Đầu Tư mua Đơn Vị Quỹ tại các lần tiếp theo cần điền đầy đủ vào phiếu Lệnh Mua có sẵn tại các Điểm Nhận Lệnh.', '# NGÂN HÀNG GIÁM SÁT\nTên ngân hàng giám sát: Ngân hàng TMCP Đầu tư &amp; Phát triển Việt Nam – Chi nhánh Hà Thành;  \nGiấy chứng nhận đăng ký kinh doanh số 0100150619-073 cấp lần đầu ngày 12/09/2003, thay đổi lần thứ 12 ngày 16/06/2020 do Sở Kế hoạch và Đầu tư thành phố Hà Nội cấp;  \nGiấy phép hoạt động lưu ký chứng khoán số: 510/QĐ-ĐKHĐLK ngày 01/08/2006 do UBCKNN cấp;  \nChúng tôi, với tư cách là Ngân hàng giám sát của Quỹ Đầu Tư Cổ phiếu Doanh nghiệp vừa và nhỏ Techcom sẽ chịu trách nhiệm theo các quy định trong phạm vi Hợp Đồng Cung Cấp Dịch Vụ lưu ký giám sát của Quỹ được ký kết giữa chúng tôi với Công ty Cổ phần Quản lý Quỹ Kỹ Thương, và các quy định về Ngân hàng giám sát trong Điều lệ, Bản cáo bạch của Quỹ.  \n![img-13.jpeg](img-13.jpeg)  \nPHÓ GIÁM ĐỐC\nNguyễn Mạnh Cường', '6  \nvà Giấy chứng nhận đăng ký hoạt động lưu ký chứng khoán số 510/QĐ-ĐKHĐLK ngày 01/08/2006 do UBCKNN cấp, thực hiện các nghiệp vụ bảo quản, lưu ký các chứng khoán, các hợp đồng kinh tế, các chứng từ có liên quan đến tài sản của Quỹ, đồng thời giám sát hoạt động của Quỹ. Quyền và nghĩa vụ của Ngân Hàng Giám Sát được quy định tại Chương VII của Điều lệ Quỹ.  \n“Công Ty Kiểm Toán”\nlà công ty kiểm toán độc lập cho quỹ được Đại Hội Nhà Đầu Tư chỉ định, thực hiện việc kiểm toán hàng năm tài sản của Quỹ Đầu Tư Cổ phiếu Doanh nghiệp vừa và nhỏ Techcom.  \n“Điều lệ”\ncó nghĩa là Điều lệ Quỹ, các phụ lục đính kèm và các sửa đổi bổ sung hợp pháp (nếu có) được Đại hội nhà đầu tư thông qua tại Đại hội Nhà đầu tư.  \n“Bản Cáo Bạch”', '## 4. Các chỉ tiêu hoạt động\nCông ty quản lý quỹ sẽ công bố thông tin về tỷ lệ chi phí hoạt động quỹ và tốc độ vòng quay danh mục trong báo cáo tài chính bán niên và báo cáo tài chính năm được công bố trên trang thông tin điện tử của Công ty quản lý quỹ.', '|  Techcombank (""TCB"") | Gửi tiền có kỳ hạn | Techcombank sở hữu 88.99% vốn của TCC  |  \nTrong tất cả các trường hợp, các giao dịch phải là giao dịch công bằng và vì lợi ích của Nhà Đầu Tư, theo đúng các quy định của pháp luật và Điều lệ Quỹ.  \nTất cả các giao dịch có thể gây ra xung đột lợi ích tiềm tàng phải được tư vấn và chấp thuận bởi TCC và phải được công bố cho Nhà Đầu Tư. Tuy nhiên TCC sẽ cố gắng hết sức để tránh các giao dịch có thể gây ra xung đột lợi ích mà không thể quản lý được một cách thích đáng.  \nNgười có liên quan của TCC được phép giao dịch Đơn Vị Quỹ theo phương thức giống như các Nhà Đầu Tư khác như quy định tại Điều lệ Quỹ.', '## XVI. PHỤ LỤC ĐỈNH KÈM\nPhụ lục 01: Danh sách các đại lý phân phối chứng chỉ quỹ được lựa chọn.  \nPhụ lục 02: Các đối tác liên quan  \nCÔNG TY CỔ PHẦN QUẢN LÝ QUỸ KỸ THƯƠNG  \n![img-12.jpeg](img-12.jpeg)  \nTỔNG GIÁM ĐỐC\nĐặng Lư Dũng', 'Theo quy định hiện hành, nếu Quỹ không thể huy động được ít nhất là 50.000.000.000 VNĐ (năm mươi tỷ đồng) hoặc có ít hơn 100 (một trăm) Nhà Đầu Tư không chuyên nghiệp vào thời điểm kết thúc IPO hoặc thời gian được gia hạn (nếu có), UBCKNN sẽ không cấp Giấy chứng nhận đăng ký lập quỹ cho Quỹ. Trong trường hợp này, tất cả số tiền nhận được từ các Nhà Đầu Tư trong thời gian IPO cùng với lãi phát sinh nếu có sẽ được hoàn trả vào tài khoản đăng ký của Nhà Đầu Tư trong vòng 15 (mười lăm ngày) kể từ ngày kết thúc đợt IPO. Công Ty Quản Lý Quỹ sẽ chịu tất cả các chi giá dịch vụ phát sinh từ đợt IPO trong trường hợp này.  \n49']",Số điện thoại: (84-24) 39446368.
Mã số thuế hoặc số đăng ký kinh doanh của TechcomCapital được ghi nhận như thế nào?,"Mã số thuế hoặc số đăng ký kinh doanh của TechcomCapital không được cung cấp trực tiếp trong tài liệu đã được cung cấp. Tuy nhiên, thông tin về việc TechcomCapital là công ty quản lý quỹ có thể được tìm thấy ở một số vị trí khác ngoài phạm vi trích dẫn.

Theo nguồn 2 (Trang 65), TechcomCapital (""TCB"") sở hữu 88.99% vốn của TCC, nhưng không cung cấp thông tin về mã số thuế hoặc số đăng ký kinh doanh cụ thể.

Do đó:
Tôi không tìm thấy thông tin đó trong tài liệu.","['# IV. THÔNG TIN VỀ CÔNG TY CỔ PHẦN QUẢN LÝ QUỸ KỸ THƯƠNG\n## 1. Các thông tin chung\n- **Tên bằng tiếng Việt:** Công ty Cổ phần Quản lý Quỹ Kỹ thương\n- **Tên bằng tiếng Anh:** TechcomCapital Joint Stock Company\n- **Tên viết tắt:** TechcomCapital (TCC)\n- **Giấy phép thành lập:** Giấy phép thành lập và hoạt động Số 40/UBCK-GP do Chủ tịch Ủy ban Chứng khoán Nhà nước cấp ngày 21/10/2008 và được cấp lại Giấy phép thành lập và hoạt động Số 57/GP-UBCK do UBCKNN cấp ngày 30/01/2019 do chuyển đổi loại hình từ công ty TNHH sang công ty cổ phần.\n- **Giấy chứng nhận đăng ký doanh nghiệp số** 0102995749 do Sở Kế hoạch và Đầu tư Thành phố Hà Nội cấp ngày 27/05/2021\n- **Vốn điều lệ:** 44.943.820.000 đồng (Bốn mươi bốn tỷ chính trăm bốn mươi ba triệu tám trăm hai mươi nghìn đồng)\n- **Địa chỉ đăng ký:** Tầng 28, Tòa C5, số 119 Trần Duy Hưng, phường Trung Hòa, Quận Cầu Giấy, Hà Nội', '## 2. Ngân hàng giám sát\nNgân hàng TMCP Đầu tư và Phát triển Việt Nam - Chi nhánh Hà Thành  \nĐại diện hợp pháp: Ông Nguyễn Mạnh Cường  \nChức vụ: Phó Giám đốc  \nBản cáo bạch này là một phần của hồ sơ đăng ký chào bán của Công ty Cổ phần Quản lý quỹ Kỹ thương (Techcom Capital – “TCC”). Chúng tôi, với tư cách là Ngân hàng Giám sát của Quỹ Đầu Tư Cổ phiếu Doanh nghiệp vừa và nhỏ Techcom (TCSME) sẽ chịu trách nhiệm theo các quy định trong phạm vi Hợp Đồng Cung Cấp Dịch Vụ Giám Sát Quỹ được ký kết giữa chúng tôi với Công ty Cổ phần Quản lý quỹ Kỹ thương, là công ty quản lý Quỹ Đầu tư Cổ phiếu Doanh nghiệp vừa và nhỏ Techcom và theo quy định của pháp luật.', '## XIV. THÔNG TIN LIÊN LẠC\nĐể biết thêm thông tin chung, xin liên hệ:  \nCông Ty Cổ phần Quản lý Quỹ Kỹ thương (TechcomCapital)  \nĐịa chỉ: Tầng 28, Tòa C5, số 119 Trần Duy Hưng, phường Trung Hòa, Quận Cầu Giấy, Hà Nội  \nĐiện thoại: (+84) 24 39446368\nFax: (+84) 24 39446583', '## THÔNG BÁO QUAN TRỌNG\nKhông người nào được ủy quyền để cung cấp bất kỳ thông tin hoặc đưa ra bất kỳ tuyên bố nào không được xác nhận trong Bản Cáo Bạch này liên quan đến đợt phát hành này hay việc phát hành các Đơn Vị Quỹ, và bất kỳ thông tin hoặc tuyên bố nào không có trong Bản Cáo Bạch này không được dựa vào như là đã được phê duyệt bởi TechcomCapital. Nhà Đầu Tư được yêu cầu phải kiểm tra các thông tin về uy tín của cá nhân/công ty mà mình ủy thác Đơn Đăng Ký và uy thác thanh toán cho bất kỳ giao dịch nào với Quỹ. Quỹ hoặc TechcomCapital không chịu trách nhiệm cho bất kỳ hành vi được thực hiện bởi các tổ chức trung gian đại diện cho hoặc được cho là đại diện cho Nhà Đầu Tư đó.', '# NGÂN HÀNG GIÁM SÁT\nTên ngân hàng giám sát: Ngân hàng TMCP Đầu tư &amp; Phát triển Việt Nam – Chi nhánh Hà Thành;  \nGiấy chứng nhận đăng ký kinh doanh số 0100150619-073 cấp lần đầu ngày 12/09/2003, thay đổi lần thứ 12 ngày 16/06/2020 do Sở Kế hoạch và Đầu tư thành phố Hà Nội cấp;  \nGiấy phép hoạt động lưu ký chứng khoán số: 510/QĐ-ĐKHĐLK ngày 01/08/2006 do UBCKNN cấp;  \nChúng tôi, với tư cách là Ngân hàng giám sát của Quỹ Đầu Tư Cổ phiếu Doanh nghiệp vừa và nhỏ Techcom sẽ chịu trách nhiệm theo các quy định trong phạm vi Hợp Đồng Cung Cấp Dịch Vụ lưu ký giám sát của Quỹ được ký kết giữa chúng tôi với Công ty Cổ phần Quản lý Quỹ Kỹ Thương, và các quy định về Ngân hàng giám sát trong Điều lệ, Bản cáo bạch của Quỹ.  \n![img-13.jpeg](img-13.jpeg)  \nPHÓ GIÁM ĐỐC\nNguyễn Mạnh Cường', '# IV. THÔNG TIN VỀ CÔNG TY CỔ PHẦN QUẢN LÝ QUỸ KỸ THƯƠNG\n## 1. Các thông tin chung\n- **Điện thoại:** (+84) 24 39446368  **Fax:** (+84) 24 39446583\n- **Các cổ đông của công ty Quản lý Quỹ sở hữu từ 5% trở lên vốn điều lệ:**  \n|  Tên cổ đông | Giá trị vốn chủ sở hữu | Tỷ lệ vốn chủ sở hữu  |\n| --- | --- | --- |\n|  Ngân hàng TMCP Kỹ thương Việt Nam | 39.999.800.000 | 88,99956%  |\n|  Bà Nguyễn Thị Thu Hiền | 2.696.640.000 | 6,00002%  |\n|  Cổ đông - Khác | 2.247.380.000 | 5,00042%  |\n|   | 44.943.820.000 | 100%  |  \nTechcombank được thành lập theo Giấy chứng nhận đăng ký doanh nghiệp số 0100230800 do Sở Kế hoạch và Đầu tư TP. Hà Nội cấp lần thứ 45 ngày 26/07/2013, đăng ký cấp lại mã số doanh nghiệp lần 1 ngày 03/07/2012 từ ĐKKD số 055697 do Trọng tài kinh tế Nhà nước cấp ngày 07/09/1993.', '# QUỸ ĐẦU TƯ CỔ PHIẾU DOANH NGHIỆP VỮA VÀ NHỎ TECHCOM (TCSME)\n*(Giấy chứng nhận đăng ký chào bán chứng chỉ quỹ đầu tư chứng khoán ra công chúng số 256/GCN-UBCK do Chủ tịch UBCHN cấp ngày 23/8/2022)*  \nBản cáo bạch này được phát hành bởi:  \n**Công ty Cổ phần Quản lý quỹ Kỹ thương - TechcomCapital (“TCC”)**  \n**Địa chỉ** : Tầng 28, Tòa C5, số 119 Trần Duy Hưng, phường Trung Hòa, Quận Cầu Giấy, Hà Nội  \n**Điện thoại** : (84-24) 39446368Fax: (84-24) 39446583  \n**Website** : www.techcomcapital.com.vn  \n**Nơi cung cấp Bản cáo bạch:**  \nBản Cáo Bạch cập nhật nhất cùng các tài liệu của Quỹ (báo cáo hoạt động, báo cáo tài chính, Điều lệ Quỹ và các tài liệu cần thiết khác) được cung cấp trên trang điện tử của TCC, www.techcomcapital.com.vn, tại văn phòng của TCC và các Đại lý phân phối như danh sách trong phụ lục 1 của Bản Cáo Bạch.', '# VIII. TỔ CHỨC ĐƯỢC ỦY QUYỀN\n## 2. Ủy quyền dịch vụ quản trị quỹ đầu tư\n- Tên ngân hàng: Ngân hàng TMCP Đầu tư và Phát triển Việt Nam – Chi nhánh Hà Thành\n- Giấy chứng nhận đăng ký hoạt động chi nhánh: Số 0100150619-073 cấp lần đầu ngày 12/9/2003 thay đổi lần 12 ngày 16/06/2020 do Sở kế hoạch và Đầu tư thành phố Hà Nội cấp\n- GCNDK hoạt động lưu ký: Số 510/QĐ-ĐKHDLK ngày 01/08/2006 do UBCKNN cấp\n- Trụ sở chính: 74 Thợ Nhuộm, Hoàn Kiếm, Hà Nội, Việt Nam\n- Điện thoại: +84.24 39411840    Fax: +84.24 39411847  \nTổ chức cung cấp dịch vụ quản trị quỹ chịu trách nhiệm trong phạm vi liên quan đến dịch vụ cung cấp theo quy định tại hợp đồng dịch vụ ký kết giữa Công ty Quản lý Quỹ và tổ chức cung cấp dịch vụ quản trị quỹ.', '## V. NGÂN HÀNG GIÁM SÁT\n- Tên ngân hàng: Ngân hàng TMCP Đầu tư và Phát triển Việt Nam – Chi nhánh Hà Thành\n- Giấy chứng nhận đăng ký hoạt động chi nhánh: Số 0100150619-073 cấp lần đầu ngày 12/9/2003 thay đổi lần 12 ngày 16/06/2020 do Sở kế hoạch và Đầu tư thành phố Hà Nội cấp\n- GCNDK hoạt động lưu ký: Số 510/QĐ-ĐKHĐLK ngày 01/08/2006 do UBCKNN cấp\n- Trụ sở chính: 74 Thợ Nhuộm, Hoàn Kiếm, Hà Nội, Việt Nam\n- Điện thoại: +84.24 39411840 Fax: +84.24 39411847  \nNgân hàng Giám sát chịu trách nhiệm trong phạm vi liên quan đến hoạt động của ngân hàng giám sát theo quy định tại Điều lệ Quỹ và Hợp đồng Giám sát.', '6  \nvà Giấy chứng nhận đăng ký hoạt động lưu ký chứng khoán số 510/QĐ-ĐKHĐLK ngày 01/08/2006 do UBCKNN cấp, thực hiện các nghiệp vụ bảo quản, lưu ký các chứng khoán, các hợp đồng kinh tế, các chứng từ có liên quan đến tài sản của Quỹ, đồng thời giám sát hoạt động của Quỹ. Quyền và nghĩa vụ của Ngân Hàng Giám Sát được quy định tại Chương VII của Điều lệ Quỹ.  \n“Công Ty Kiểm Toán”\nlà công ty kiểm toán độc lập cho quỹ được Đại Hội Nhà Đầu Tư chỉ định, thực hiện việc kiểm toán hàng năm tài sản của Quỹ Đầu Tư Cổ phiếu Doanh nghiệp vừa và nhỏ Techcom.  \n“Điều lệ”\ncó nghĩa là Điều lệ Quỹ, các phụ lục đính kèm và các sửa đổi bổ sung hợp pháp (nếu có) được Đại hội nhà đầu tư thông qua tại Đại hội Nhà đầu tư.  \n“Bản Cáo Bạch”', '# II. CÁC ĐỊNH NGHĨA\nGiấy chứng nhận đăng ký doanh nghiệp số 0102995749 do Sở Kế hoạch và Đầu tư Thành phố Hà Nội cấp ngày 27/05/2021, đáp ứng các tiêu chuẩn như nêu tại Điều 30 và có các quyền và nghĩa vụ như quy định tại Điều 31 của Điều lệ Quỹ.  \n“Ngân Hàng Giám Sát” Là Ngân hàng TMCP Đầu tư và Phát triển Việt Nam - Chi nhánh Hà Thành, một chi nhánh được thành lập theo Giấy chứng nhận đăng ký hoạt động chi nhánh số 0100150619-073 cấp lần đầu ngày 12/9/2003 thay đổi lần 12 ngày 16/06/2020 do Sở kế hoạch và Đầu tư thành phố Hà Nội cấp', '# IX. THÔNG TIN VỀ QUỸ ĐẦU TƯ CỔ PHIẾU DOANH NGHIỆP VỮA VÀ NHỎ TECHCOM (TCSME)\n## 1. Thông tin chung về Quỹ\n- Tên Quỹ bằng tiếng Việt: QUỸ ĐẦU TƯ CỔ PHIẾU DOANH NGHIỆP VỮA VÀ NHỎ TECHCOM\n- Tên Quỹ bằng tiếng Anh: Techcom Small and Medium Enterprise Equity Fund\n- Tên viết tắt: TCSME', '## 2. Thông tin về đợt phát hành lần đầu ra công chúng\nNhà Đầu Tư nên tham khảo ý kiến của các chuyên gia tư vấn tài chính riêng của mình để đảm bảo Nhà Đầu Tư đủ điều kiện để đầu tư vào Quỹ theo các quy định pháp luật áp dụng và liệu Quỹ có phù hợp với khả năng chấp nhận rủi ro của Nhà Đầu Tư.  \n|  Tên quỹ | Quỹ Đầu tư Cổ phiếu Doanh nghiệp vừa và nhỏ Techcom  |\n| --- | --- |\n|  Loại hình | Quỹ mở  |\n|  Mục tiêu đầu tư | Mục tiêu đầu tư của Quỹ là tìm kiếm lợi nhuận dài hạn thông qua thu nhập và tăng trưởng giá trị đầu tư vốn trên cơ sở đánh giá, lựa chọn các tài sản có chất lượng tốt, phân bổ danh mục hợp lý và tối thiểu hóa rủi ro cho Nhà Đầu Tư.  |', '# PHỤ LỤC 1. DANH SÁCH ĐẠI LÝ PHÂN PHỐI VÀ CÁC ĐIỂM NHẬN LỆNH\nCông ty Cổ phần Chứng khoán Kỹ thương (“TCBS”)  \nGiấy phép thành lập và hoạt động: Số 125/GP-UBCK ngày 30/05/2018 do Ủy ban Chứng khoán Nhà nước cấp  \nĐịa chỉ nhận lệnh: Tầng 10 và Tầng 12, Tòa nhà Techcombank, 191 Bà Triệu, Phường Lê Đại Hành, quận Hai Bà Trưng, Hà Nội', '## 2.3. Đặc trưng của chứng chỉ Quỹ đầu tư\nCông ty quản lý quỹ thực hiện hoặc ủy quyền cho tổ chức cung cấp dịch vụ đại lý chuyển nhượng lập và quản lý số đăng ký nhà đầu tư chính (sổ chính) hoặc ủy quyền đại lý ký danh lập, quản lý đăng ký nhà đầu tư phụ (sổ phụ) và xác nhận quyền sở hữu chứng chỉ quỹ cho nhà đầu tư.  \nSố đăng ký nhà đầu tư của Quỹ có thể là văn bản, tập dữ liệu điện tử hoặc cả hai. Các nội dung của Số đăng ký nhà đầu tư được quy định chi tiết tại điều 15 Điều lệ Quỹ.', 'Nhà đầu tư nên lưu lại một bản Hợp đồng và cập nhật các thông tin cung cấp trong Hợp đồng. Thông tin này sẽ được lưu lại trong Số Đăng Ký của Quỹ và luôn chứa đựng thông tin về địa chỉ hiện tại địa chỉ thư điện tử, nơi đăng ký thuế, và chi tiết tài khoản ngân hàng của từng Nhà Đầu Tư nhằm đảm bảo Nhà Đầu Tư nhận được đầy đủ các thông báo, báo cáo và thanh toán liên quan đến Quỹ.  \nNhà Đầu Tư mua Đơn Vị Quỹ tại các lần tiếp theo cần điền đầy đủ vào phiếu Lệnh Mua có sẵn tại các Điểm Nhận Lệnh.', '|  Techcombank (""TCB"") | Gửi tiền có kỳ hạn | Techcombank sở hữu 88.99% vốn của TCC  |  \nTrong tất cả các trường hợp, các giao dịch phải là giao dịch công bằng và vì lợi ích của Nhà Đầu Tư, theo đúng các quy định của pháp luật và Điều lệ Quỹ.  \nTất cả các giao dịch có thể gây ra xung đột lợi ích tiềm tàng phải được tư vấn và chấp thuận bởi TCC và phải được công bố cho Nhà Đầu Tư. Tuy nhiên TCC sẽ cố gắng hết sức để tránh các giao dịch có thể gây ra xung đột lợi ích mà không thể quản lý được một cách thích đáng.  \nNgười có liên quan của TCC được phép giao dịch Đơn Vị Quỹ theo phương thức giống như các Nhà Đầu Tư khác như quy định tại Điều lệ Quỹ.', '## c) Tuân Thủ\n. Nhà Đầu Tư cần tham khảo các ý kiến tư vấn về luật và thuế để có thông tin phù hợp đối với các giao dịch của mình.', '. Nhà Đầu Tư cần tham khảo các ý kiến tư vấn về luật và thuế để có thông tin phù hợp đối với các giao dịch của mình.', '## XIII. CUNG CÁP THỐNG TIN CHO NHÀ ĐẦU TƯ, CHẾ ĐỘ BÁO CÁO\nTCC sẽ công bố hoặc cung cấp cho Nhà Đầu Tư các thông tin sau:  \n- Bản cáo bạch, bản cáo bạch tóm tắt, báo cáo tài chính bán niên, báo cáo tài chính năm đã kiểm toán;', 'Nhà Đầu Tư có thể thanh toán số tiền mua Đơn Vị Quỹ từ tài khoản ngân hàng của mình vào tài khoản của Quỹ để Ngân Hàng Giám Sát nhận được đúng hạn và Đại Lý Phân Phối hoàn thành xử lý việc đăng ký với Đại Lý Chuyển Nhượng. Mọi khoản đầu tư vào Đơn Vị Quỹ đều thực hiện bằng tiền Đồng Việt Nam.  \nTrong trường hợp lệnh mua chứng chỉ quỹ và việc thanh toán cho lệnh mua được thực hiện bởi cá nhân, tổ chức khác không phải nhà đầu tư thì phiếu lệnh và tài liệu xác nhận thanh toán phải nêu rõ tên, số tài khoản và giá trị thanh toán của nhà đầu tư được hưởng lợi.', '# PHỤ LỤC 2. CÁC ĐỐI TÁC CÓ LIÊN QUAN\nNgân hàng lưu ký, giám sát và quản trị quỹ:  \nNgân hàng TMCP Đầu tư và Phát triển Việt Nam - Chi nhánh Hà Thành, một chi nhánh được thành lập theo Giấy chứng nhận đăng ký hoạt động chi nhánh số 0100150619-073 cấp lần đầu ngày 12/9/2003 thay đổi lần 12 ngày 16/06/2020 do Sở kế hoạch và Đầu tư thành phố Hà Nội cấp và Giấy chứng nhận đăng ký hoạt động lưu ký chứng khoán số 510/QĐ-ĐKHĐLK ngày 01/08/2006 do UBCKNN cấp, thực hiện các nghiệp vụ (i) bảo quản, lưu ký chứng khoán, tài liệu xác nhận quyền sở hữu tài sản hợp pháp của Quỹ; các hợp đồng kinh tế, các chứng từ có liên quan đến tài sản của Quỹ đồng thời giám sát hoạt động của Quỹ; (ii) thực hiện chức năng giám sát toàn bộ quản lý tài sản của Quỹ do Công ty Quản lý Quỹ thực hiện.  \n![img-14.jpeg](img-14.jpeg)', '## 5. Báo cáo gửi tới cơ quan có thẩm quyền\nTCC sẽ tuân thủ các quy định hiện hành của pháp luật về chế độ báo cáo và thông tin liên quan đến các hoạt động kinh doanh của Quỹ tới các cơ quan có thẩm quyền.', '# VII. ĐẠI LÝ PHÂN PHỐI CHỨNG CHỈ QUỸ\nDanh sách Đại lý Phân phối được lựa chọn bao gồm:  \n- Công ty Cổ phần Chứng khoán Kỹ thương (“TCBS”)\n- Địa chỉ: Tầng 10 và Tầng 12, tòa nhà Techcombank, 191 Bà Triệu, phường Lê Đại Hành, quận Hai Bà Trưng, TP. Hà Nội\n- Giấy phép thành lập và hoạt động: số 125/GP-UBCK ngày 30/05/2018 do Ủy ban Chứng khoán Nhà nước cấp và các giấy phép điều chỉnh.\n- Số Giấy chứng nhận đăng ký hoạt động phân phối:\n- Điện thoại: 84.24.22201039    Fax: 84.24.22201032  \nDanh sách Đại Lý Phân phối và các Điểm Nhận Lệnh có thể thay đổi bất kỳ lúc nào sau khi hoàn thành các thủ tục thông báo tới Ủy ban Chứng khoán Nhà nước theo quy định của Pháp Luật.', '- Giấy chứng nhận đăng ký lập Quỹ đại chúng: do UBCKNN cấp\n- Loại hình: Quỹ mở\n- Vốn điều lệ ban đầu: 50.000.000.000 (năm mươi tỷ đồng)\n- Thời hạn của Quỹ: không giới hạn']",Giấy phép thành lập và hoạt động số 10/GP-UBCK ngày 03/07/2006 do Chủ tịch Ủy ban Chứng khoán Nhà nước cấp.
"Nếu thị trường chứng khoán sụt giảm mạnh, quỹ có những biện pháp gì để bảo vệ tài sản của tôi?","Dựa trên nội dung từ các nguồn cung cấp, Quỹ có thể áp dụng một số biện pháp sau để bảo vệ tài sản của bạn khi thị trường chứng khoán sụt giảm mạnh:

1. **Tái cân bằng danh mục đầu tư**: Quỹ có thể điều chỉnh lại cơ cấu danh mục đầu tư, bán đi những cổ phiếu hoặc công cụ tài chính có rủi ro cao hơn và mua vào các công cụ an toàn hơn như tiền mặt hoặc trái phiếu để giảm thiểu rủi ro.

2. **Giữ một tỷ lệ lớn tiền mặt**: Quỹ sẽ giữ một phần lớn tài sản dưới dạng tiền mặt, giúp tăng tính linh hoạt trong việc ứng phó với biến động thị trường.

3. **Tăng tỷ trọng các công cụ an toàn**: Quỹ có thể tăng tỷ trọng đầu tư vào các công cụ tài chính an toàn như trái phiếu chính phủ hoặc các khoản vay có bảo đảm để giảm rủi ro.

4. **Phân tán rủi ro**: Quỹ sẽ tiếp tục duy trì chiến lược phân tán rủi ro thông qua việc đầu tư vào nhiều loại tài sản khác nhau, bao gồm cổ phiếu, trái phiếu và công cụ tài chính khác.

5. **Kiểm soát tỷ lệ đầu tư vào một tổ chức phát hành**: Theo quy định tại mục 2.2.4 Hạn mức đầu tư, Quỹ không được đầu tư quá 10% tổng giá trị chứng khoán đang lưu hành của một tổ chức phát hành (trừ công cụ nợ của Chính phủ), giúp giảm rủi ro tập trung.

6. **Theo dõi và điều chỉnh định kỳ**: Theo quy định tại mục 2.2.7 Phương pháp lựa chọn đầu tư, Quỹ áp dụng phương pháp phù hợp với tính chất, đặc điểm của tài sản để có lựa chọn phù hợp, đồng thời công bố thông tin theo quy định khi cần thiết.

Ngoài ra, Quỹ cũng sẽ tuân thủ các quy định và hướng dẫn từ Ủy ban Chứng khoán Nhà nước và Ngân hàng Nhà nước Việt Nam để đảm bảo hoạt động an toàn và hiệu quả. 

Thông tin này được lấy từ trang 21 của tài liệu.","['nhóm chứng khoán có tiềm năng tăng trưởng tốt trong dài hạn và/hoặc doanh nghiệp có tính cạnh tranh tương đối cao, (ii) nhóm chứng khoán có mức định giá hấp dẫn, (iii) nhóm chứng khoán có lợi tức cao, ổn định.  \nNgoài ra, để đảm bảo tối ưu hóa lợi ích của nhà đầu tư, Quỹ có sự linh hoạt trong phân bổ tài sản tùy thuộc vào cơ hội đầu tư sẵn có tại các thời điểm khác nhau. Việc phân bổ tài sản có thể thay đổi đáng kể tùy thuộc vào nhận định của Quỹ, với mục tiêu xuyên suốt trong toàn bộ thời gian hoạt động của Quỹ là bảo vệ lợi ích của Nhà Đầu Tư.', '## 2. Thông tin về đợt phát hành lần đầu ra công chúng\nNgoài ra, để đảm bảo tối ưu hóa lợi ích của nhà đầu tư, Quỹ có sự linh hoạt trong phân bổ tài sản tùy thuộc vào cơ hội đầu tư sẵn có tại các thời điểm khác nhau. Việc phân bổ tài sản có thể thay đổi đáng kể tùy thuộc vào nhận định của Quỹ, với mục tiêu xuyên suốt trong toàn bộ thời gian hoạt động của Quỹ là bảo vệ lợi ích của Nhà Đầu Tư.  \nVới chiến lược đầu tư như đã đề cập ở trên, cơ cấu danh mục đầu tư của Quỹ có thể thay đổi theo thời gian dựa theo tiềm năng tăng trưởng của cổ phiếu và tùy vào mức độ thanh khoản của các cổ phiếu trên thị trường. Tỷ trọng các khoản đầu tư không vượt quá những hạn chế đầu tư quy định tại mục “Hạn chế đầu tư”.  \nCác loại tài sản mà quỹ được đầu tư bao gồm:\ni. Tiền gửi tại các ngân hàng thương mại theo quy định của pháp luật về  |  \n46', '## e) Thực Hiện Một Phần Lệnh Bán\nTrong các trường hợp sau, Quỹ chỉ có thể thực hiện một phần Lệnh Bán và Chuyến Đổi Quỹ của Nhà Đầu Tư:  \n- Tổng giá trị của các Lệnh Bán (bao gồm cả Lệnh Bán từ hoạt động Chuyến Đổi Quỹ) trừ đi tổng giá trị của tất cả các Lệnh Mua (bao gồm cả Lệnh Mua từ hoạt động Chuyến Đổi Quỹ) tại Ngày Giao Dịch lớn hơn 10% của giá trị tài sản ròng của Quỹ (NAV); hoặc\n- Việc thực hiện tất cả các lệnh giao dịch của Nhà Đầu Tư tại Ngày Giao Dịch dẫn đến NAV của Quỹ thấp hơn 50.000.000.000 đồng (năm mươi tỷ đồng); hoặc Giá trị phần đơn vị quỹ hoặc số đơn vị quỹ còn lại trên tài khoản của nhà đầu tư thấp hơn giá trị tối thiểu hoặc số lượng đơn vị quỹ tối thiểu để duy trì tài khoản của nhà đầu tư theo quy định tại Điều lệ quỹ và Bán cáo bạch.', '## Lĩnh vực được phép đầu tư\nđ) Cổ phiếu chào bán lần đầu ra công chúng, trái phiếu chào bán ra công chúng; trái phiếu doanh nghiệp phát hành riêng lẻ bởi tổ chức niêm yết có bảo lãnh thanh toán của tổ chức tín dụng hoặc cam kết mua lại của tổ chức phát hành tối thiểu 1 lần trong 12 tháng và mỗi lần cam kết mua lại tối thiểu 30% giá trị đợt phát hành;  \ne) Chứng khoán phải sinh niêm yết giao dịch tại Sở giao dịch chứng khoán và chỉ nhằm mục tiêu phòng ngừa rủi ro cho chứng khoán cơ sở mà quỹ đang nắm giữ;  \ng) Quyền phát sinh gắn liền với chứng khoán mà quỹ đang nắm giữ.  \nViệc đầu tư vào các tài sản quy định tại điểm đ khoản 2.2.3 Điều này phải đáp ứng các điều kiện sau:  \n- Có quy định tại Điều lệ quỹ và Bản cáo bạch;', 'Việc bảo vệ Nhà Đầu Tư nước ngoài tránh khỏi rủi ro này nằm ngoài khả năng của Quỹ và vì vậy, các Nhà Đầu Tư nước ngoài, nếu cần thiết, cần phải tìm kiếm các công cụ để tự phòng ngừa rủi ro này.', 'Trong trường hợp Quỹ nhận được số tiền mua thấp hơn Phiếu lệnh mua và không nhận được yêu cầu chuyển trả từ khách hàng, số tiền mua sẽ tiếp tục được giữ lại để chờ yêu cầu giao dịch tiếp theo từ khách hàng.  \nTrong trường hợp Nhà Đầu Tư có nhiều lệnh mua Chứng Chỉ Quỹ cùng một lúc, Lệnh Mua Chứng Chỉ Quỹ sẽ được ưu tiên theo thứ tự đặt lệnh.  \nPhí/giá dịch vụ chuyển tiền (nếu có) được trừ vào số tiền hoàn trả cho Nhà Đầu Tư. Đơn Vị Quỹ sẽ chỉ được ghi nhận vào tài khoản của Nhà Đầu Tư hay của Đại Lý Ký Danh sau khi có kết quả giao dịch chứng chỉ quỹ.', 'Trong trường hợp Quỹ nhận được số tiền mua thấp hơn lệnh đăng ký mua và không nhận được yêu cầu chuyển trả từ khách hàng, số tiền mua sẽ tiếp tục được giữ lại để chờ yêu cầu giao dịch tiếp theo từ khách hàng.  \nTrong trường hợp Nhà Đầu Tư có nhiều lệnh mua Chứng Chỉ Quỹ cùng một lúc, Lệnh Mua Chứng Chỉ Quỹ sẽ được ưu tiên theo thứ tự đặt lệnh.  \nPhí/giá dịch vụ chuyển tiền (nếu có) được trừ vào số tiền hoàn trả cho Nhà Đầu Tư. Đơn Vị Quỹ sẽ chỉ được ghi nhận vào tài khoản của Nhà Đầu Tư hay của Đại Lý Kỷ Danh sau khi có kết quả giao dịch chứng chỉ quỹ.', '- Thực hiện các lệnh giao dịch của Nhà Đầu Tư;  \n- Các hoạt động sáp nhập, hợp nhất của các tổ chức phát hành các chứng khoán mà Quỹ đang nắm giữ;  \n- Quỹ mới được cấp phép thành lập hoặc do tách Quỹ, hợp nhất Quỹ, sát nhập Quỹ mà thời gian hoạt động không quá sáu (06) tháng, tính từ ngày được cấp giấy chứng nhận đăng ký lập Quỹ;  \n- Quỹ đang trong thời gian giải thể.  \nTrong trường hợp xảy ra sai lệch so với các hạn mức đầu tư, Công ty Quản Lý Quỹ sẽ điều chỉnh danh mục đầu tư để đáp ứng các hạn mức đầu tư kể trên trong vòng 3 (ba) tháng kể từ ngày mà sai lệch phát sinh.', 'vi. Chứng khoán phái sinh niêm yết, giao dịch tại các Sở Giao dịch Chứng khoán, và chỉ nhằm mục tiêu phòng ngừa rủi ro cho chứng khoán cơ sở mà quỹ đang nắm giữ.  \nvii. Quyền phát sinh gắn liền với chứng khoán mà Quỹ đang nắm giữ.  |\n| --- | --- |\n|  Cơ cấu đầu tư | Các khoản đầu tư của Quỹ sẽ được đa dạng hóa và đáp ứng được các điều kiện của pháp luật. Cơ cấu danh mục đầu tư của Quỹ phải bảo đảm tuân thủ các nguyên tắc sau:  \ni. Cơ cấu danh mục đầu tư của quỹ mở phải bao gồm chứng khoán của ít nhất sáu (06) tổ chức phát hành, đồng thời phải bảo đảm:', '## 3. Các rủi ro khi đầu tư vào Quỹ\nMục tiêu của Công Ty Quản Lý Quỹ là quản lý các rủi ro đầu tư, và nếu có thể, hạn chế tác động của các rủi ro này bằng việc áp dụng các phương pháp quản lý đầu tư theo tiêu chuẩn quốc tế tốt nhất. Nhà Đầu Tư cần lưu ý các điểm quan trọng sau đây:  \n- Quỹ, Công Ty Quản Lý Quỹ, thành viên Hội đồng thành viên, ban điều hành và nhân viên Công Ty Quản Lý Quỹ không có bất kỳ sự đảm bảo nào đối với vốn đầu tư ban đầu cũng như mức lợi nhuận từ đầu tư của Quỹ;\n- Không có bất kỳ sự bảo đảm nào về sổ lẫn chi trả và giá trị của cổ tức được thanh toán trong tương lai;  \n42', '## 3.6. Rủi ro về biến động giá\nRủi ro về biến động giá của Quỹ phát sinh khi một hay một số Nhà Đầu Tư đang nắm giữ một số lượng lớn Đơn Vị Quỹ quyết định thực hiện Lệnh Bản các Đơn Vị Quỹ này cùng lúc. Điều này có thể ảnh hưởng bất lợi tới giá của Đơn Vị Quỹ nếu các Lệnh Bản này đòi hỏi Công Ty Quản Lý Quỹ phải thoái vốn các khoản đầu tư tại mức giá thấp. Các quy định về thực hiện một phần lệnh bán và tạm dừng lệnh bán có thể giảm thiểu rủi ro biến động giá của Quỹ.', '- Không đầu tư quá 30% tổng giá trị tài sản của quỹ vào các chứng chỉ quỹ đại chúng, cổ phiếu công ty đầu tư chứng khoán đại chúng;  \nxi. Quỹ chỉ được đầu tư tiền gửi, công cụ tiền tệ quy định tại điểm i và ii các loại tài sản Quỹ được phép đầu tư được phát hành bởi các tổ chức tín dụng trong danh sách đã được Ban Đại Diện Quỹ phê duyệt bằng văn bản hoặc thông qua bỏ phiếu điện tử (e-voting) tuân thủ theo các Quy định Pháp luật hiện hành.  \nCơ cấu đầu tư của Quỹ được phép sai lệch so với các hạn chế được đưa ra tại điểm i, ii, iii, iv, v, vi và ix nếu trên nhưng chỉ vì các lý do sau:  \n- Biến động giá trên thị trường của các tài sản trong danh mục đầu tư của Quỹ;  \n- Thực hiện các khoản thanh toán phù hợp với Pháp Luật của Quỹ;  \n- Thực hiện các lệnh giao dịch của Nhà Đầu Tư;', '## 3. Giá dịch vụ và thưởng hoạt động\nNhà Đầu Tư được khuyến khích nắm giữ các Đơn Vị Quỹ như một phần của các khoản đầu tư dài hạn và chương trình tiết kiệm hưu trí. Quỹ mở không được thiết kế cho mục đích mua bán ngắn hạn. Việc Nhà Đầu Tư thường xuyên mua đi và bán lại Đơn Vị Quỹ, vốn được thiết kế để đạt được lợi nhuận dài hạn sẽ ảnh hưởng đến mục tiêu lợi nhuận của Nhà Đầu Tư khi đầu tư vào Quỹ cũng như lợi nhuận của Quỹ.  \nGiá dịch vụ Mua lại và các khoản giá dịch vụ ngân hàng và thuế khác (nếu có) sẽ được trừ vào khoản tiền thu được từ bán Đơn Vị Quỹ của Nhà Đầu Tư.', 'Trong các trường hợp tạm dừng thực hiện các giao dịch Đơn Vị Quỹ, Lệnh Chuyển Đổi đã nhận sẽ được thực hiện tại NAV tại Ngày Giao Dịch đầu tiên sau khi giao dịch được thực hiện trở lại.  \n**g. Quy trình chuyển nhượng chứng chỉ quỹ**  \n- **Đơn Chuyển Nhượng**  \nNhà Đầu Tư có thể Chuyển Nhượng Đơn Vị Quỹ cho nhà đầu tư khác dưới dạng quà tặng, thừa kế hoặc thực hiện lệnh của toà án. Chuyển Nhượng chỉ được thực hiện dưới dạng số lượng Đơn  \n55', '- Việc thực hiện tất cả các lệnh giao dịch của Nhà Đầu Tư tại Ngày Giao Dịch dẫn đến NAV của Quỹ thấp hơn 50.000.000.000 đồng (năm mươi tỷ đồng); hoặc Giá trị phần đơn vị quỹ hoặc số đơn vị quỹ còn lại trên tài khoản của nhà đầu tư thấp hơn giá trị tối thiểu hoặc số lượng đơn vị quỹ tối thiểu để duy trì tài khoản của nhà đầu tư theo quy định tại Điều lệ quỹ và Bán cáo bạch.\n- Trường hợp thực hiện một phần Lệnh Bán, Lệnh mua, Lệnh Chuyến Đổi Quỹ theo quy định nêu trên, Công ty Quản Lý Quỹ áp dụng nguyên tắc phân phối cùng tỷ lệ: Phần giá trị được thực hiện sẽ được phân bổ cho tất cả nhà đầu tư đăng ký giao dịch theo cùng một tỷ lệ giữa giá trị thực hiện và giá trị đăng ký giao dịch.  \nSố lượng chứng chỉ quỹ được thực hiện trong trường hợp này được tính như sau:', '## 2.2.4 Hạn mức đầu tư\nHạn mức đầu tư của Quỹ được quy định chi tiết tuân thủ các quy định tại Thông tư hướng dẫn hoạt động và quản lý các quỹ đầu tư chứng khoán. Cơ cấu danh mục đầu tư của Quỹ phải bảo đảm tuân thủ các hạn mức đầu tư sau:  \na) Trừ tiền gửi trên tài khoản thanh toán của quỹ tại ngân hàng giám sát, quỹ mở không được đầu tư quá 49% tổng giá trị tài sản của quỹ vào các tài sản theo quy định tại điểm a, b mục IX.2.2.3  \nb) Không được đầu tư vào chứng khoán của một tổ chức phát hành quá 10% tổng giá trị chứng khoán đang lưu hành của tổ chức đó, trừ công cụ nợ của Chính phủ;  \nc) Không được đầu tư quá 20% tổng giá trị tài sản của quỹ vào chứng khoán đang lưu hành và các tài sản (nếu có) quy định tại điểm a, b mục IX.2.2.3 của một tổ chức phát hành, trừ công cụ nợ của Chính phủ;', '## 3.4. Rủi ro tỷ giá\nDo tài sản và nợ phải trả của Quỹ đều được trình bày bằng đồng Việt Nam, là đơn vị tiền tệ sử dụng của Quỹ. Vì vậy, mặc dù rủi ro tỷ giá trong trung hạn tại Việt Nam trong thời điểm hiện nay được chúng tôi đánh giá là tương đối thấp do tình hình kinh tế vĩ mô được giữ ổn định, cán cân thương mại thặng dư và Chính phủ thể hiện quyết tâm duy trì sự ổn định của đồng Việt Nam, các Nhà Đầu Tư nước ngoài thực tế sẽ phải chịu rủi ro tỷ giá trong thời gian đầu tư tại Việt Nam.  \n43', 'Nhà Đầu Tư có thể thanh toán số tiền mua Đơn Vị Quỹ từ tài khoản ngân hàng của mình vào tài khoản của Quỹ để Ngân Hàng Giám Sát nhận được đúng hạn và Đại Lý Phân Phối hoàn thành xử lý việc đăng ký với Đại Lý Chuyển Nhượng. Mọi khoản đầu tư vào Đơn Vị Quỹ đều thực hiện bằng tiền Đồng Việt Nam.  \nTrong trường hợp lệnh mua chứng chỉ quỹ và việc thanh toán cho lệnh mua được thực hiện bởi cá nhân, tổ chức khác không phải nhà đầu tư thì phiếu lệnh và tài liệu xác nhận thanh toán phải nêu rõ tên, số tài khoản và giá trị thanh toán của nhà đầu tư được hưởng lợi.', 'Trong thời hạn 05 ngày làm việc kể từ ngày hoàn tất việc điều chỉnh lại danh mục đầu tư, công ty quản lý quỹ phải công bố thông tin theo quy định, đồng thời thông báo cho Ủy ban Chứng khoán Nhà nước về các sai lệch cơ cấu danh mục đầu tư, nguyên nhân, thời điểm phát sinh hoặc phát hiện ra sự việc, mức độ thiệt hại và bồi thường thiệt hại cho quỹ (nếu có) hoặc lợi nhuận tạo cho quỹ (nếu có), biện pháp khắc phục, thời gian thực hiện, kết quả khắc phục.  \nCông ty quản lý quỹ chỉ được gửi tiền và đầu tư công cụ thị trường tiền tệ quy định tại điểm a, b mục IX.2.2.3 của các tổ chức tín dụng trong danh sách đã được Ban đại diện quỹ phê duyệt.', '## 2.2.7 Phương pháp lựa chọn đầu tư\n**Phương pháp lựa chọn đầu tư đối với các công cụ khác:**  \nQuỹ áp dụng phương pháp phù hợp với tính chất, đặc điểm của tài sản để có lựa chọn phù hợp.', '## 2.2.4 Hạn mức đầu tư\ne) Tổng giá trị các hạng mục đầu tư lớn trong danh mục đầu tư của quỹ không được vượt quá 40% tổng giá trị tài sản của quỹ. Trong đó, hạng mục đầu tư lớn của quỹ là hạng mục đầu tư vào các loại tài sản quy định tại điểm b, d, đ và g mục IX.2.2.3 (ngoại trừ chứng chỉ tiền gửi) phát hành bởi cùng một tổ chức, có tổng giá trị chiếm từ 5% trở lên tổng giá trị tài sản của quỹ;  \ng) Tại mọi thời điểm, tổng giá trị cam kết trong các giao dịch chứng khoán phải sinh, dư nợ vay và các khoản phải trả của quỹ không được vượt quá giá trị tài sản ròng của quỹ;  \nh) Không được đầu tư vào chứng chỉ quỹ của chính quỹ đó;  \ni) Chỉ được đầu tư vào chứng chỉ quỹ đại chúng khác, công ty đầu tư chứng khoán đại chúng do công ty quản lý quỹ khác quản lý và bảo đảm các hạn chế sau:', '## e) Thực Hiện Một Phần Lệnh Bán\n- Trường hợp thực hiện một phần Lệnh Bán, Lệnh mua, Lệnh Chuyến Đổi Quỹ theo quy định nêu trên, Công ty Quản Lý Quỹ áp dụng nguyên tắc phân phối cùng tỷ lệ: Phần giá trị được thực hiện sẽ được phân bổ cho tất cả nhà đầu tư đăng ký giao dịch theo cùng một tỷ lệ giữa giá trị thực hiện và giá trị đăng ký giao dịch.  \nSố lượng chứng chỉ quỹ được thực hiện trong trường hợp này được tính như sau:  \nSố lượng CCQ NĐT được thực hiện = Số lượng CCQ NĐT đăng ký bán * [Tổng số lượng CCQ mà CTQLQ có thể đáp ứng cho lệnh bán của NĐT/Tổng số lượng CCQ đăng ký bán trong kỳ]', 'Công Ty Quản Lý Quỹ có quyền thay đổi các mức bán tối thiểu trong từng thời điểm.  \nNhà Đầu Tư cần lưu ý là trong một số trường hợp Lệnh Bán sẽ không thể thực hiện toàn bộ hoặc Lệnh Bán có thể bị tạm dừng thực hiện.  \n- **Số Dư Tài Khoản Tối Thiểu**  \nKhông áp dụng.  \n- **Thực Hiện Một Phần Lệnh Bán**  \nTrong các trường hợp sau, Quỹ chỉ có thể thực hiện một phần Lệnh Bán và Chuyến Đổi Quỹ của Nhà Đầu Tư:  \n- Tổng giá trị của các Lệnh Bán (bao gồm cả Lệnh Bán từ hoạt động Chuyến Đổi Quỹ) trừ đi tổng giá trị của tất cả các Lệnh Mua (bao gồm cả Lệnh Mua từ hoạt động Chuyến Đổi Quỹ) tại Ngày Giao Dịch lớn hơn 10% của giá trị tài sản ròng của Quỹ (NAV); hoặc', '## Lĩnh vực được phép đầu tư\nVới chiến lược đầu tư như đã đề cập ở trên, cơ cấu danh mục đầu tư của Quỹ có thể thay đổi theo thời gian dựa theo tiềm năng tăng trưởng của cổ phiếu và tùy vào mức độ thanh khoản của các cổ phiếu trên thị trường. Tỷ trọng các khoản đầu tư không vượt quá những hạn chế đầu tư quy định tại mục “Hạn chế đầu tư”.', '# i. Chương trình Đầu tư Định kỳ\n- Trong trường hợp Nhà Đầu Tư muốn sử dụng tiền không hợp lệ ở trên để mua chứng chỉ quỹ tại các kỳ giao dịch bình thường không phải là kỳ giao dịch theo Chương trình ĐTĐK thì Nhà Đầu Tư sẽ phải thực hiện quy trình theo Mục 2.4.4. Quy trình mua chứng chỉ quỹ.  \n- Trong trường hợp Nhà Đầu Tư muốn giữ lại và tiếp tục để chờ cho kỳ giao dịch theo Chương trình ĐKĐT tiếp theo thì Nhà Đầu Tư cần phải đảm bảo nộp bổ sung phần còn thiếu trước thời điểm đóng số lệnh của ngày giao dịch theo Chương trình ĐKĐT.  \n- Trong trường hợp nhận được yêu cầu chuyển trả cụ thể từ Nhà Đầu tư hoặc không nhận được yêu cầu chuyển trả từ Nhà Đầu Tư, số tiền không hợp lệ ở trên sẽ được chuyển trả']","Quỹ thực hiện quản trị rủi ro bằng cách đa dạng hóa danh mục đầu tư, tuân thủ các hạn mức đầu tư an toàn và thực hiện các biện pháp phòng ngừa rủi ro thị trường theo quy định pháp luật."
Tôi có thể rút tiền ra khỏi quỹ bằng cách nào và mất bao lâu?,"Theo tài liệu cung cấp, bạn có thể thực hiện việc rút tiền (tạm gọi là bán chứng chỉ quỹ) theo các bước sau:

1. **Lệnh Bán**: Bạn có thể đặt lệnh bán chứng chỉ quỹ thông qua Đại lý Phân phối hoặc trực tiếp trên trang web của Công ty Quản Lý Quỹ.

2. **Thời gian thực hiện**: Sau khi đã xác nhận được đơn bán, thời gian thanh toán tiền mua lại chứng chỉ quỹ sẽ được công bố bởi Công ty Quản Lý Quỹ thông qua trang web theo từng thời kỳ. 

3. **Phí áp dụng**: Phí mua lại (nếu có) sẽ được ấn định và công bố bằng văn bản thông báo tại từng thời kỳ, nhưng không quá 3% giá trị của lệnh bán.

Theo tài liệu, thời gian thực hiện các lệnh bán và thanh toán tiền mua lại chứng chỉ quỹ thường diễn ra nhanh chóng. Tuy nhiên, cụ thể về thời gian chính xác có thể thay đổi tùy theo quy định cụ thể của Công ty Quản Lý Quỹ.

**Thông tin được lấy từ trang: Trang 59**

Nếu bạn cần thông tin chi tiết hơn hoặc có bất kỳ câu hỏi nào khác, vui lòng liên hệ trực tiếp với Đại lý Phân phối hoặc Công ty Quản Lý Quỹ để nhận hỗ trợ cụ thể.","['Cổ tức sẽ được chi trả trong thời hạn 30 (ba mươi) ngày kể từ ngày được công bố và được chuyển vào tài khoản ngân hàng của Nhà Đầu Tư theo đăng ký trong Sổ Đăng Ký vào ngày thanh toán cổ tức, sau khi được khấu trừ các loại thuế có liên quan.  \nCổ tức được chi trả sẽ phải chịu thuế tùy thuộc vào nguồn gốc của thu nhập của Quỹ cũng như các loại thuế áp dụng cho Nhà Đầu Tư.', 'Nhà Đầu Tư có thể thanh toán số tiền mua Đơn Vị Quỹ bằng cách chuyển khoản từ tài khoản ngân hàng của mình hoặc nộp tiền trực tiếp vào tài khoản của Quỹ để Ngân Hàng Giám Sát nhận được đúng hạn và Đại Lý Phân Phối hoàn thành xử lý việc đăng ký với Đại Lý Chuyển Nhượng. Mọi khoản đầu tư vào Đơn Vị Quỹ đều thực hiện bằng tiền Đồng Việt Nam.  \nTrong trường hợp lệnh mua chứng chỉ quỹ và việc thanh toán cho lệnh mua được thực hiện bởi cá nhân, tổ chức khác không phải nhà đầu tư thì phiếu lệnh và tài liệu xác nhận thanh toán phải nêu rõ tên, số tài khoản và giá trị thanh toán của nhà đầu tư được hưởng lợi.  \n- **Tuân Thủ**', 'Nhà Đầu Tư có thể thanh toán số tiền mua Đơn Vị Quỹ từ tài khoản ngân hàng của mình vào tài khoản của Quỹ để Ngân Hàng Giám Sát nhận được đúng hạn và Đại Lý Phân Phối hoàn thành xử lý việc đăng ký với Đại Lý Chuyển Nhượng. Mọi khoản đầu tư vào Đơn Vị Quỹ đều thực hiện bằng tiền Đồng Việt Nam.  \nTrong trường hợp lệnh mua chứng chỉ quỹ và việc thanh toán cho lệnh mua được thực hiện bởi cá nhân, tổ chức khác không phải nhà đầu tư thì phiếu lệnh và tài liệu xác nhận thanh toán phải nêu rõ tên, số tài khoản và giá trị thanh toán của nhà đầu tư được hưởng lợi.', 'Theo quy định hiện hành, nếu Quỹ không thể huy động được ít nhất là 50.000.000.000 VNĐ (năm mươi tỷ đồng) hoặc có ít hơn 100 (một trăm) Nhà Đầu Tư không chuyên nghiệp vào thời điểm kết thúc IPO hoặc thời gian được gia hạn (nếu có), UBCKNN sẽ không cấp Giấy chứng nhận đăng ký lập quỹ cho Quỹ. Trong trường hợp này, tất cả số tiền nhận được từ các Nhà Đầu Tư trong thời gian IPO cùng với lãi phát sinh nếu có sẽ được hoàn trả vào tài khoản đăng ký của Nhà Đầu Tư trong vòng 15 (mười lăm ngày) kể từ ngày kết thúc đợt IPO. Công Ty Quản Lý Quỹ sẽ chịu tất cả các chi giá dịch vụ phát sinh từ đợt IPO trong trường hợp này.  \n49', '## 3. Giá dịch vụ và thưởng hoạt động\nNhà Đầu Tư được khuyến khích nắm giữ các Đơn Vị Quỹ như một phần của các khoản đầu tư dài hạn và chương trình tiết kiệm hưu trí. Quỹ mở không được thiết kế cho mục đích mua bán ngắn hạn. Việc Nhà Đầu Tư thường xuyên mua đi và bán lại Đơn Vị Quỹ, vốn được thiết kế để đạt được lợi nhuận dài hạn sẽ ảnh hưởng đến mục tiêu lợi nhuận của Nhà Đầu Tư khi đầu tư vào Quỹ cũng như lợi nhuận của Quỹ.  \nGiá dịch vụ Mua lại và các khoản giá dịch vụ ngân hàng và thuế khác (nếu có) sẽ được trừ vào khoản tiền thu được từ bán Đơn Vị Quỹ của Nhà Đầu Tư.', 'Giá dịch vụ Mua lại và các khoản giá dịch vụ ngân hàng và thuế khác (nếu có) sẽ được trừ vào khoản tiền thu được từ bản Đơn Vị Quỹ của Nhà Đầu Tư.  \nGiá dịch vụ Mua lại cho tất cả các Chương trình được TCC ấn định và công bố bằng văn bản thông báo tại từng thời kỳ nhưng không quá 3,0% (ba phần trăm) giá trị của Lệnh Bản. Thời điểm áp dụng mức giá dịch vụ mới tăng sớm nhất là 60 ngày kể từ ngày Công ty Quản Lý Quỹ công bố về mức giá dịch vụ mới trên trang thông tin điện tử của Công ty.  \nMức giá dịch vụ mua lại của Quỹ như sau:  \n|  Thời gian nắm giữ CCQ | Giá dịch vụ mua lại (% giá trị lệnh bán)  |\n| --- | --- |\n|  0 đến dưới 6 tháng | 1,00%  |\n|  Từ tròn 6 đến tròn 9 tháng | 0,75%  |\n|  Từ trên 9 đến tròn 12 tháng | 0,50%  |\n|  Từ trên 12 tháng trở lên | 0,00%  |', '## Lĩnh vực được phép đầu tư\nđ) Cổ phiếu chào bán lần đầu ra công chúng, trái phiếu chào bán ra công chúng; trái phiếu doanh nghiệp phát hành riêng lẻ bởi tổ chức niêm yết có bảo lãnh thanh toán của tổ chức tín dụng hoặc cam kết mua lại của tổ chức phát hành tối thiểu 1 lần trong 12 tháng và mỗi lần cam kết mua lại tối thiểu 30% giá trị đợt phát hành;  \ne) Chứng khoán phải sinh niêm yết giao dịch tại Sở giao dịch chứng khoán và chỉ nhằm mục tiêu phòng ngừa rủi ro cho chứng khoán cơ sở mà quỹ đang nắm giữ;  \ng) Quyền phát sinh gắn liền với chứng khoán mà quỹ đang nắm giữ.  \nViệc đầu tư vào các tài sản quy định tại điểm đ khoản 2.2.3 Điều này phải đáp ứng các điều kiện sau:  \n- Có quy định tại Điều lệ quỹ và Bản cáo bạch;', '- Trong trường hợp nhận được yêu cầu chuyển trả cụ thể từ Nhà Đầu tư hoặc không nhận được yêu cầu chuyển trả từ Nhà Đầu Tư, số tiền không hợp lệ ở trên sẽ được chuyển trả lại cho Nhà đầu tư hoặc bên chuyển tiền không hợp lệ trong vòng 05 (năm) ngày làm việc kể từ kỳ giao dịch chứng chỉ quỹ áp dụng.  \nChương trình ĐTĐK sẽ dừng khi Nhà Đầu Tư quyết định dừng bằng cách thông báo dừng thực hiện ĐTĐK với Đại Lý Phân Phối hoặc do Nhà Đầu Tư không nộp tiền/không nộp đủ tiền mua chứng chỉ quỹ cho Chương Trình ĐTĐK trong 05 kỳ liên tiếp.  \n32', 'Trong trường hợp Quỹ nhận được số tiền mua thấp hơn lệnh đăng ký mua và không nhận được yêu cầu chuyển trả từ khách hàng, số tiền mua sẽ tiếp tục được giữ lại để chờ yêu cầu giao dịch tiếp theo từ khách hàng.  \nTrong trường hợp Nhà Đầu Tư có nhiều lệnh mua Chứng Chỉ Quỹ cùng một lúc, Lệnh Mua Chứng Chỉ Quỹ sẽ được ưu tiên theo thứ tự đặt lệnh.  \nPhí/giá dịch vụ chuyển tiền (nếu có) được trừ vào số tiền hoàn trả cho Nhà Đầu Tư. Đơn Vị Quỹ sẽ chỉ được ghi nhận vào tài khoản của Nhà Đầu Tư hay của Đại Lý Kỷ Danh sau khi có kết quả giao dịch chứng chỉ quỹ.', '## 3.5. Rủi ro thanh khoản\nRủi ro thanh khoản là rủi ro mà nhà đầu tư không bán lại được chứng chỉ quỹ vào ngày giao dịch chứng chỉ quỹ do các chứng khoán trong danh mục của quỹ không thanh khoản được, hoặc do việc nhà đầu tư bán chứng chỉ quỹ thuộc các trường hợp thực hiện một phần lệnh bán hoặc tạm dừng lệnh bán theo quy định của Điều Lệ Quỹ.  \nĐối với các chứng khoán trong danh mục của Quỹ, rủi ro thanh khoản sẽ được theo dõi trên cơ sở số ngày cần thiết để bán mỗi chứng khoán trong danh mục dựa trên dữ liệu giao dịch bình quân của chứng khoán đó trong năm liền trước. Các phương pháp cần thiết khác sẽ được tiến hành để giữ thời gian thoái vốn bình quân nằm trong các khoảng thời gian mục tiêu theo nguyên tắc cần trong giới hạn trong quy định nội bộ.', 'Trong thời hạn 05 ngày làm việc kể từ ngày hoàn tất việc điều chỉnh lại danh mục đầu tư, công ty quản lý quỹ phải công bố thông tin theo quy định, đồng thời thông báo cho Ủy ban Chứng khoán Nhà nước về các sai lệch cơ cấu danh mục đầu tư, nguyên nhân, thời điểm phát sinh hoặc phát hiện ra sự việc, mức độ thiệt hại và bồi thường thiệt hại cho quỹ (nếu có) hoặc lợi nhuận tạo cho quỹ (nếu có), biện pháp khắc phục, thời gian thực hiện, kết quả khắc phục.  \nCông ty quản lý quỹ chỉ được gửi tiền và đầu tư công cụ thị trường tiền tệ quy định tại điểm a, b mục IX.2.2.3 của các tổ chức tín dụng trong danh sách đã được Ban đại diện quỹ phê duyệt.', 'Sau khi thực hiện các Lệnh Bán Được Chấp Nhận, số Đơn Vị Quỹ đã bán sẽ được trù ra từ tổng số Đơn Vị Quỹ trong tài khoản của Nhà Đầu Tư và bảng kê mới về số Đơn Vị Quỹ nắm giữ sẽ được gửi đến Nhà Đầu Tư.  \nLệnh Bán thành công của Nhà Đầu Tư hay Đại Lý Ký Danh sẽ được thông báo trong vòng 03 (ba) ngày làm việc sau Ngày Giao Dịch.  \nTrong thời hạn 5 ngày làm việc sau ngày giao dịch Chứng chỉ quỹ, Nhà Đầu tư sẽ nhận được tiền bán chứng chỉ quỹ vào tài khoản mà Nhà Đầu tư đã đăng ký khi thực hiện mua Chứng chỉ quỹ.  \n- **Lệnh Bán Tối Thiểu**  \nLệnh Bán tối thiểu là 10 (mười) Đơn Vị Quỹ. Trường hợp sau khi đặt bán, số lượng chứng chỉ quỹ còn lại nhỏ hơn số lượng bán tối thiểu, Nhà Đầu tư cần đặt bán toàn bộ để giảm số Đơn vị Quỹ nắm giữ về 0 (không).', '- Thực hiện các lệnh giao dịch của Nhà Đầu Tư;  \n- Các hoạt động sáp nhập, hợp nhất của các tổ chức phát hành các chứng khoán mà Quỹ đang nắm giữ;  \n- Quỹ mới được cấp phép thành lập hoặc do tách Quỹ, hợp nhất Quỹ, sát nhập Quỹ mà thời gian hoạt động không quá sáu (06) tháng, tính từ ngày được cấp giấy chứng nhận đăng ký lập Quỹ;  \n- Quỹ đang trong thời gian giải thể.  \nTrong trường hợp xảy ra sai lệch so với các hạn mức đầu tư, Công ty Quản Lý Quỹ sẽ điều chỉnh danh mục đầu tư để đáp ứng các hạn mức đầu tư kể trên trong vòng 3 (ba) tháng kể từ ngày mà sai lệch phát sinh.', '## 2. Điều lệ Quỹ tóm tắt\nCơ quan quyền lực cao nhất của Quỹ là Đại hội Nhà Đầu tư.  \nBan Đại diện Quỹ sẽ do Đại hội Nhà Đầu tư bầu ra để giám sát các hoạt động thường xuyên của Quỹ, TCC và Ngân hàng giám sát.  \n#### 2.1.2 Tổng vốn huy động và số lượng chứng chỉ Quỹ được chào bán  \nVốn Điều lệ được huy động trong lần đầu chào bán ra công chúng của Quỹ là 50.000.000.000 VNĐ (Năm mươi tỷ đồng). Vốn Điều lệ sẽ được chia thành 5.000.000 (Năm triệu) Chứng chỉ Quỹ. Mệnh giá của một Chứng chỉ Quỹ sẽ là 10.000 VNĐ (mười nghìn Đồng Việt Nam).  \nNhà đầu tư góp vốn bằng tiền Đồng Việt Nam dưới hình thức chuyển khoản hoặc chuyển tiền vào tài khoản của Quỹ mở tại ngân hàng giám sát.  \nSố lượng chứng chỉ quỹ/tổng chứng chỉ quỹ được phép lưu hành tối đa: không hạn chế.', 'Trong trường hợp Quỹ nhận được số tiền mua thấp hơn Phiếu lệnh mua và không nhận được yêu cầu chuyển trả từ khách hàng, số tiền mua sẽ tiếp tục được giữ lại để chờ yêu cầu giao dịch tiếp theo từ khách hàng.  \nTrong trường hợp Nhà Đầu Tư có nhiều lệnh mua Chứng Chỉ Quỹ cùng một lúc, Lệnh Mua Chứng Chỉ Quỹ sẽ được ưu tiên theo thứ tự đặt lệnh.  \nPhí/giá dịch vụ chuyển tiền (nếu có) được trừ vào số tiền hoàn trả cho Nhà Đầu Tư. Đơn Vị Quỹ sẽ chỉ được ghi nhận vào tài khoản của Nhà Đầu Tư hay của Đại Lý Ký Danh sau khi có kết quả giao dịch chứng chỉ quỹ.', 'lại cho Nhà đầu tư hoặc bên chuyển tiền không hợp lệ trong vòng 05 (năm) ngày làm việc kể từ kỳ giao dịch chứng chỉ quỹ áp dụng.  \nChương trình ĐTĐK sẽ dùng khi Nhà Đầu Tư quyết định dừng bằng cách thông báo dừng thực hiện ĐTĐK với Đại Lý Phân Phối hoặc do Nhà Đầu Tư không nộp tiền/không nộp đủ tiền mua chứng chỉ quỹ cho Chương Trình ĐTĐK trong 05 kỳ liên tiếp.  \n- Phí/giá dịch vụ áp dụng cho Chương Trình ĐTĐK  \nPhí/giá dịch vụ áp dụng cho chương trình ĐTĐK được quy định chi tiết tại mục 2.5.3 của Bản Cáo Bạch này.  \n- Bản chứng chỉ quỹ mua theo Chương Trình ĐTĐK  \nNhà Đầu Tư bán chứng chỉ quỹ mua theo Chương Trình ĐTĐK theo nguyên tắc quy định tại mục 2.5.3 của Bản Cáo Bạch này.', '|  Số lượng đơn vị quỹ dự kiến phát hành: | 5.000.000 Đơn Vị Quỹ  |\n| --- | --- |\n|  Thời gian phát hành: | Được đề cập trong thông báo phát hành lần đầu ra công chúng  |\n|  Mệnh giá: | 10.000 đồng một Đơn Vị Quỹ  |\n|  Đồng tiền sử dụng và trình bày: | Đồng (VNĐ)  |\n|  Giá phát hành: | 10.000 VNĐ  |\n|  Phương thức phân bổ chứng chỉ quỹ lần đầu | = Tổng số tiền đầu tư ban đầu/ Giá phát hành  |  \nCác Nhà Đầu Tư muốn đầu tư vào Quỹ phải hoàn thành và nộp Đơn Đăng Ký cho Đại Lý Phân Phối theo các quy trình và hướng dẫn trong lần chào bán lần đầu ra công chúng.  \nMức đầu tư đăng ký tối thiểu (tính theo giá trị Lệnh Mua) của Nhà Đầu Tư là 10.000 VNĐ (Mười ngàn Việt Nam đồng)', 'Mức đầu tư tối thiểu (tính theo giá trị Lệnh Mua) là 10.000 VNĐ (Mười nghìn đồng)  \nKhông có mức giới hạn đầu tư tối đa cho Nhà Đầu Tư. Công Ty Quản Lý Quỹ bảo lưu quyền thay đổi các giới hạn đầu tư trên trong từng thời điểm và sẽ thông báo về các thay đổi này.', '## e) Thực Hiện Một Phần Lệnh Bán\nTrong các trường hợp sau, Quỹ chỉ có thể thực hiện một phần Lệnh Bán và Chuyến Đổi Quỹ của Nhà Đầu Tư:  \n- Tổng giá trị của các Lệnh Bán (bao gồm cả Lệnh Bán từ hoạt động Chuyến Đổi Quỹ) trừ đi tổng giá trị của tất cả các Lệnh Mua (bao gồm cả Lệnh Mua từ hoạt động Chuyến Đổi Quỹ) tại Ngày Giao Dịch lớn hơn 10% của giá trị tài sản ròng của Quỹ (NAV); hoặc\n- Việc thực hiện tất cả các lệnh giao dịch của Nhà Đầu Tư tại Ngày Giao Dịch dẫn đến NAV của Quỹ thấp hơn 50.000.000.000 đồng (năm mươi tỷ đồng); hoặc Giá trị phần đơn vị quỹ hoặc số đơn vị quỹ còn lại trên tài khoản của nhà đầu tư thấp hơn giá trị tối thiểu hoặc số lượng đơn vị quỹ tối thiểu để duy trì tài khoản của nhà đầu tư theo quy định tại Điều lệ quỹ và Bán cáo bạch.', '## 3. Giá dịch vụ và thưởng hoạt động\nGiá dịch vụ Mua lại cho tất cả các Chương trình được TCC ấn định và công bố bằng văn bản thông báo tại từng thời kỳ nhưng không quá 3,0% (ba phần trăm) giá trị của Lệnh Bán. Thời điểm áp dụng mức giá dịch vụ mới tăng sớm nhất là 60 ngày kể từ ngày Công ty Quản Lý Quỹ công bố về mức giá dịch vụ mới trên trang thông tin điện tử của Công ty.  \nMức giá dịch vụ mua lại của Quỹ như sau:  \n|  Thời gian nắm giữ CCQ | Giá dịch vụ mua lại (% giá trị lệnh bán)  |\n| --- | --- |\n|  0 đến dưới 6 tháng | 1,00%  |', 'Sau khi hoàn thành đợt IPO, Công Ty Quản Lý Quỹ sẽ đăng ký xin giấy chứng nhận đăng ký thành lập Quỹ với UBCKNN nếu có ít nhất 100 (một trăm) Nhà Đầu Tư không chuyên nghiệp đầu tư vào Quỹ và tổng vốn đầu tư vào Quỹ đạt tối thiểu 50.000.000.000 VNĐ (năm mươi tỷ đồng). Khi nhận Giấy phép đăng ký, Ngân Hàng Giám Sát sẽ giải toả tài khoản ký quỹ của Quỹ đó để Quỹ có thể bắt đầu đầu tư. Dự kiến Ngày Giao Dịch đầu tiên sẽ trong vòng 30 (ba mươi) ngày kể từ ngày Giấy chứng nhận đăng ký lập quỹ có hiệu lực.  \nXác nhận đầu tư sẽ được gửi cho Nhà Đầu Tư trong vòng 05 (năm) ngày kể từ ngày Quỹ có được Giấy chứng nhận đăng ký thành lập từ UBCKNN.', '## f) Lệnh Mua Tối Thiểu\nMức đầu tư tối thiểu (tính theo giá trị Lệnh Mua) là 10.000 VND (Mười nghìn đồng)  \nKhông có mức giới hạn đầu tư tối đa cho Nhà Đầu Tư. Công Ty Quản Lý Quỹ bảo lưu quyền thay đổi các giới hạn đầu tư trên trong từng thời điểm và sẽ thông báo về các thay đổi này.', '## 2.2.6 Hoạt động vay, cho vay, giao dịch mua bán lại và giao dịch ký quỹ\nCông ty Quản Lý Quỹ không được sử dụng vốn và tài sản của Quỹ để cho vay hoặc bảo lãnh cho bất kỳ khoản vay nào.  \nCông ty Quản Lý Quỹ không được phép vay để đầu tư, trừ trường hợp vay ngắn hạn theo quy định của pháp luật về ngân hàng để trang trải các chi phí cần thiết cho quỹ hoặc thực hiện thanh toán các giao dịch chứng chỉ quỹ với Nhà Đầu Tư. Tổng giá trị các khoản vay ngắn hạn của Quỹ không được quá 5% giá trị tài sản ròng của quỹ tại mọi thời điểm và thời hạn vay tối đa là 30 ngày.  \nCông ty Quản Lý Quỹ không được sử dụng tài sản của quỹ để thực hiện các giao dịch ký quỹ (vay mua chứng khoán) cho quỹ hoặc cho bất kỳ cá nhân, tổ chức khác; không được sử dụng tài sản của quỹ thực hiện các giao dịch bán khổng, cho vay chứng khoán.', 'Sau khi thực hiện các Lệnh Bán Được Chấp Nhận, số Đơn Vị Quỹ đã bán sẽ được trừ ra từ tổng số Đơn Vị Quỹ trong tài khoản của Nhà Đầu Tư và bảng kê mới về số Đơn Vị Quỹ nắm giữ sẽ được gửi đến Nhà Đầu Tư. Chi tiết ngày thanh toán tiền mua lại chứng chỉ quỹ sẽ được Công ty Quản Lý Quỹ công bố trên trang web theo từng thời kỳ.', '- Việc thực hiện tất cả các lệnh giao dịch của Nhà Đầu Tư tại Ngày Giao Dịch dẫn đến NAV của Quỹ thấp hơn 50.000.000.000 đồng (năm mươi tỷ đồng); hoặc Giá trị phần đơn vị quỹ hoặc số đơn vị quỹ còn lại trên tài khoản của nhà đầu tư thấp hơn giá trị tối thiểu hoặc số lượng đơn vị quỹ tối thiểu để duy trì tài khoản của nhà đầu tư theo quy định tại Điều lệ quỹ và Bán cáo bạch.\n- Trường hợp thực hiện một phần Lệnh Bán, Lệnh mua, Lệnh Chuyến Đổi Quỹ theo quy định nêu trên, Công ty Quản Lý Quỹ áp dụng nguyên tắc phân phối cùng tỷ lệ: Phần giá trị được thực hiện sẽ được phân bổ cho tất cả nhà đầu tư đăng ký giao dịch theo cùng một tỷ lệ giữa giá trị thực hiện và giá trị đăng ký giao dịch.  \nSố lượng chứng chỉ quỹ được thực hiện trong trường hợp này được tính như sau:']",Nhà đầu tư thực hiện bằng cách đặt Lệnh Bán chứng chỉ quỹ. Tiền sẽ được thanh toán trong vòng 05 ngày làm việc kể từ Ngày giao dịch chứng chỉ quỹ.
Quỹ này ưu tiên đầu tư vào các loại hình doanh nghiệp như thế nào?,"Quỹ này ưu tiên đầu tư vào các doanh nghiệp vừa và nhỏ. Cụ thể, theo định nghĩa ở phần II của tài liệu:

""Quỹ"" có nghĩa là Quỹ Đầu Tư Cổ phiếu Doanh nghiệp vừa và nhỏ Techcom, một loại hình Quỹ đầu tư chứng khoán dạng mở do Công ty Quản Lý Quỹ quản lý chào bán Chứng Chỉ Quỹ ra công chúng và được thành lập theo các quy định hiện hành về chứng khoán tại Việt Nam và Điều lệ này.

Thông tin này được lấy từ Trang 5 của tài liệu.","['## Lĩnh vực được phép đầu tư\nDanh mục đầu tư của quỹ phải phù hợp với mục tiêu và chính sách đầu tư đã được quy định tại Điều lệ quỹ và công bố tại Bản cáo bạch. Danh mục đầu tư của quỹ đầu tư bao gồm các loại tài sản sau đây:  \na) Tiền gửi các ngân hàng thương mại theo quy định của pháp luật ngân hàng;  \nb) Công cụ thị trường tiền tệ bao gồm giấy tờ có giá, công cụ chuyển nhượng theo quy định của pháp luật;  \nc) Công cụ nợ của Chính phủ, trái phiếu được Chính phủ bảo lãnh, trái phiếu chính quyền địa phương;  \nd) Cổ phiếu niêm yết, cổ phiếu đăng ký giao dịch, trái phiếu niêm yết trên Sở giao dịch chứng khoán, chứng chỉ quỹ đại chúng;', '## 2. Thông tin về đợt phát hành lần đầu ra công chúng\nNhà Đầu Tư nên tham khảo ý kiến của các chuyên gia tư vấn tài chính riêng của mình để đảm bảo Nhà Đầu Tư đủ điều kiện để đầu tư vào Quỹ theo các quy định pháp luật áp dụng và liệu Quỹ có phù hợp với khả năng chấp nhận rủi ro của Nhà Đầu Tư.  \n|  Tên quỹ | Quỹ Đầu tư Cổ phiếu Doanh nghiệp vừa và nhỏ Techcom  |\n| --- | --- |\n|  Loại hình | Quỹ mở  |\n|  Mục tiêu đầu tư | Mục tiêu đầu tư của Quỹ là tìm kiếm lợi nhuận dài hạn thông qua thu nhập và tăng trưởng giá trị đầu tư vốn trên cơ sở đánh giá, lựa chọn các tài sản có chất lượng tốt, phân bổ danh mục hợp lý và tối thiểu hóa rủi ro cho Nhà Đầu Tư.  |', '## 2. Thông tin về đợt phát hành lần đầu ra công chúng\nNgoài ra, để đảm bảo tối ưu hóa lợi ích của nhà đầu tư, Quỹ có sự linh hoạt trong phân bổ tài sản tùy thuộc vào cơ hội đầu tư sẵn có tại các thời điểm khác nhau. Việc phân bổ tài sản có thể thay đổi đáng kể tùy thuộc vào nhận định của Quỹ, với mục tiêu xuyên suốt trong toàn bộ thời gian hoạt động của Quỹ là bảo vệ lợi ích của Nhà Đầu Tư.  \nVới chiến lược đầu tư như đã đề cập ở trên, cơ cấu danh mục đầu tư của Quỹ có thể thay đổi theo thời gian dựa theo tiềm năng tăng trưởng của cổ phiếu và tùy vào mức độ thanh khoản của các cổ phiếu trên thị trường. Tỷ trọng các khoản đầu tư không vượt quá những hạn chế đầu tư quy định tại mục “Hạn chế đầu tư”.  \nCác loại tài sản mà quỹ được đầu tư bao gồm:\ni. Tiền gửi tại các ngân hàng thương mại theo quy định của pháp luật về  |  \n46', '## 3. Lợi thế của quỹ mở\nQuỹ mở là một kênh đầu tư tương đối mới mẻ đối với các nhà đầu tư cá nhân tại Việt Nam nhưng được dự báo sẽ trở thành một xu thế trong tương lai gần. Đầu tư vào quỹ mở có nhiều ưu điểm so với đầu tư chứng khoán riêng lẻ hay đầu tư vào các loại hình quỹ khác như quỹ đóng, quỹ ETFs hay quỹ tín thác:  \n- **Đa dạng hóa danh mục đầu tư:** Nhà đầu tư sở hữu chứng chỉ quỹ mở nghĩa là đang đầu tư vào một danh mục bao gồm các loại chứng khoán không tương quan, qua đó góp phần đa dạng hóa rủi ro với chi phí/giá dịch vụ thấp hơn so với đầu tư riêng lẻ vào từng loại chứng khoán.', '- Thực hiện các lệnh giao dịch của Nhà Đầu Tư;  \n- Các hoạt động sáp nhập, hợp nhất của các tổ chức phát hành các chứng khoán mà Quỹ đang nắm giữ;  \n- Quỹ mới được cấp phép thành lập hoặc do tách Quỹ, hợp nhất Quỹ, sát nhập Quỹ mà thời gian hoạt động không quá sáu (06) tháng, tính từ ngày được cấp giấy chứng nhận đăng ký lập Quỹ;  \n- Quỹ đang trong thời gian giải thể.  \nTrong trường hợp xảy ra sai lệch so với các hạn mức đầu tư, Công ty Quản Lý Quỹ sẽ điều chỉnh danh mục đầu tư để đáp ứng các hạn mức đầu tư kể trên trong vòng 3 (ba) tháng kể từ ngày mà sai lệch phát sinh.', 'nhóm chứng khoán có tiềm năng tăng trưởng tốt trong dài hạn và/hoặc doanh nghiệp có tính cạnh tranh tương đối cao, (ii) nhóm chứng khoán có mức định giá hấp dẫn, (iii) nhóm chứng khoán có lợi tức cao, ổn định.  \nNgoài ra, để đảm bảo tối ưu hóa lợi ích của nhà đầu tư, Quỹ có sự linh hoạt trong phân bổ tài sản tùy thuộc vào cơ hội đầu tư sẵn có tại các thời điểm khác nhau. Việc phân bổ tài sản có thể thay đổi đáng kể tùy thuộc vào nhận định của Quỹ, với mục tiêu xuyên suốt trong toàn bộ thời gian hoạt động của Quỹ là bảo vệ lợi ích của Nhà Đầu Tư.', '## Lĩnh vực được phép đầu tư\nVới chiến lược đầu tư như đã đề cập ở trên, cơ cấu danh mục đầu tư của Quỹ có thể thay đổi theo thời gian dựa theo tiềm năng tăng trưởng của cổ phiếu và tùy vào mức độ thanh khoản của các cổ phiếu trên thị trường. Tỷ trọng các khoản đầu tư không vượt quá những hạn chế đầu tư quy định tại mục “Hạn chế đầu tư”.', '## 3. Lợi thế của quỹ mở\n- **Quản lý tài sản chuyên nghiệp:** Nhà đầu tư được tiếp cận với dịch vụ quản lý tài sản chuyên nghiệp bởi các chuyên gia nhiều kinh nghiệm, có trình độ chuyên môn cao về đầu tư và quản trị danh mục đầu tư. Nhờ đó, nhà đầu tư có thể đạt được hiệu quả đầu tư cao hơn mà không tốn nhiều thời gian.  \n- **Tính thanh khoản cao:** Lợi thế của quỹ mở so với quỹ đóng là định kỳ phát hành và mua lại chứng chỉ quỹ. Do đó, nhà đầu tư có thể linh hoạt bỏ tiền vào hoặc rút tiền ra bằng cách giao dịch với quỹ vào ngày được quy định.', '## 2.2.7 Phương pháp lựa chọn đầu tư\n**Phương pháp lựa chọn đầu tư đối với các công cụ khác:**  \nQuỹ áp dụng phương pháp phù hợp với tính chất, đặc điểm của tài sản để có lựa chọn phù hợp.', 'Nhà Đầu Tư có thể thanh toán số tiền mua Đơn Vị Quỹ từ tài khoản ngân hàng của mình vào tài khoản của Quỹ để Ngân Hàng Giám Sát nhận được đúng hạn và Đại Lý Phân Phối hoàn thành xử lý việc đăng ký với Đại Lý Chuyển Nhượng. Mọi khoản đầu tư vào Đơn Vị Quỹ đều thực hiện bằng tiền Đồng Việt Nam.  \nTrong trường hợp lệnh mua chứng chỉ quỹ và việc thanh toán cho lệnh mua được thực hiện bởi cá nhân, tổ chức khác không phải nhà đầu tư thì phiếu lệnh và tài liệu xác nhận thanh toán phải nêu rõ tên, số tài khoản và giá trị thanh toán của nhà đầu tư được hưởng lợi.', '## 2. Thông tin về đợt phát hành lần đầu ra công chúng\n|  Chiến lược đầu tư | Chiến lược đầu tư chính của Quỹ là đầu tư năng động vào cổ phiếu của các Công ty hàng đầu trong rổ cổ phiếu VNMID và VNSML được công bố bởi Sở Giao dịch Chứng khoán Thành Phố Hồ Chí Minh. Theo đó, chiến lược đầu tư của Quỹ bao gồm nhưng không hạn chế đầu tư vào (i) nhóm chứng khoán có tiềm năng tăng trưởng tốt trong dài hạn và/hoặc doanh nghiệp có tính cạnh tranh tương đối cao, (ii) nhóm chứng khoán có mức định giá hấp dẫn, (iii) nhóm chứng khoán có lợi tức cao, ổn định.', 'vi. Chứng khoán phái sinh niêm yết, giao dịch tại các Sở Giao dịch Chứng khoán, và chỉ nhằm mục tiêu phòng ngừa rủi ro cho chứng khoán cơ sở mà quỹ đang nắm giữ.  \nvii. Quyền phát sinh gắn liền với chứng khoán mà Quỹ đang nắm giữ.  |\n| --- | --- |\n|  Cơ cấu đầu tư | Các khoản đầu tư của Quỹ sẽ được đa dạng hóa và đáp ứng được các điều kiện của pháp luật. Cơ cấu danh mục đầu tư của Quỹ phải bảo đảm tuân thủ các nguyên tắc sau:  \ni. Cơ cấu danh mục đầu tư của quỹ mở phải bao gồm chứng khoán của ít nhất sáu (06) tổ chức phát hành, đồng thời phải bảo đảm:', 'Nhà Đầu Tư có thể thanh toán số tiền mua Đơn Vị Quỹ bằng cách chuyển khoản từ tài khoản ngân hàng của mình hoặc nộp tiền trực tiếp vào tài khoản của Quỹ để Ngân Hàng Giám Sát nhận được đúng hạn và Đại Lý Phân Phối hoàn thành xử lý việc đăng ký với Đại Lý Chuyển Nhượng. Mọi khoản đầu tư vào Đơn Vị Quỹ đều thực hiện bằng tiền Đồng Việt Nam.  \nTrong trường hợp lệnh mua chứng chỉ quỹ và việc thanh toán cho lệnh mua được thực hiện bởi cá nhân, tổ chức khác không phải nhà đầu tư thì phiếu lệnh và tài liệu xác nhận thanh toán phải nêu rõ tên, số tài khoản và giá trị thanh toán của nhà đầu tư được hưởng lợi.  \n- **Tuân Thủ**', '- Không đầu tư quá 30% tổng giá trị tài sản của quỹ vào các chứng chỉ quỹ đại chúng, cổ phiếu công ty đầu tư chứng khoán đại chúng;  \nxi. Quỹ chỉ được đầu tư tiền gửi, công cụ tiền tệ quy định tại điểm i và ii các loại tài sản Quỹ được phép đầu tư được phát hành bởi các tổ chức tín dụng trong danh sách đã được Ban Đại Diện Quỹ phê duyệt bằng văn bản hoặc thông qua bỏ phiếu điện tử (e-voting) tuân thủ theo các Quy định Pháp luật hiện hành.  \nCơ cấu đầu tư của Quỹ được phép sai lệch so với các hạn chế được đưa ra tại điểm i, ii, iii, iv, v, vi và ix nếu trên nhưng chỉ vì các lý do sau:  \n- Biến động giá trên thị trường của các tài sản trong danh mục đầu tư của Quỹ;  \n- Thực hiện các khoản thanh toán phù hợp với Pháp Luật của Quỹ;  \n- Thực hiện các lệnh giao dịch của Nhà Đầu Tư;', 'Nhà Đầu Tư nên tham khảo ý kiến của chuyên gia tư vấn riêng của mình để đảm bảo Nhà Đầu Tư đủ điều kiện để đầu tư vào Quỹ theo các quy định pháp luật áp dụng cho họ và liệu Quỹ có phù hợp với khả năng chấp nhận rủi ro của họ hay không.', '## Lĩnh vực được phép đầu tư\nđ) Cổ phiếu chào bán lần đầu ra công chúng, trái phiếu chào bán ra công chúng; trái phiếu doanh nghiệp phát hành riêng lẻ bởi tổ chức niêm yết có bảo lãnh thanh toán của tổ chức tín dụng hoặc cam kết mua lại của tổ chức phát hành tối thiểu 1 lần trong 12 tháng và mỗi lần cam kết mua lại tối thiểu 30% giá trị đợt phát hành;  \ne) Chứng khoán phải sinh niêm yết giao dịch tại Sở giao dịch chứng khoán và chỉ nhằm mục tiêu phòng ngừa rủi ro cho chứng khoán cơ sở mà quỹ đang nắm giữ;  \ng) Quyền phát sinh gắn liền với chứng khoán mà quỹ đang nắm giữ.  \nViệc đầu tư vào các tài sản quy định tại điểm đ khoản 2.2.3 Điều này phải đáp ứng các điều kiện sau:  \n- Có quy định tại Điều lệ quỹ và Bản cáo bạch;', '## 2.3. Đặc trưng của chứng chỉ Quỹ đầu tư\nNhà đầu tư của Quỹ là cá nhân, tổ chức trong và ngoài nước, sở hữu chứng chỉ quỹ. Nhà đầu tư không chịu trách nhiệm pháp lý hoặc nghĩa vụ khác ngoài trách nhiệm trong phạm vi số chứng chỉ Quỹ mà họ sở hữu. Nhà đầu tư là tổ chức bao gồm các tổ chức kinh tế và xã hội được pháp luật Việt Nam công nhận.  \nNhà đầu tư pháp nhân cử người đại diện hợp pháp đại diện cho số Chứng chỉ quỹ mà mình sở hữu. Việc đề cử, hủy bỏ hay thay thế người đại diện này phải được thông báo bằng văn bản, do người đại diện có thẩm quyền của nhà đầu tư tổ chức ký.', '## 3. Giá dịch vụ và thưởng hoạt động\nNhà Đầu Tư được khuyến khích nắm giữ các Đơn Vị Quỹ như một phần của các khoản đầu tư dài hạn và chương trình tiết kiệm hưu trí. Quỹ mở không được thiết kế cho mục đích mua bán ngắn hạn. Việc Nhà Đầu Tư thường xuyên mua đi và bán lại Đơn Vị Quỹ, vốn được thiết kế để đạt được lợi nhuận dài hạn sẽ ảnh hưởng đến mục tiêu lợi nhuận của Nhà Đầu Tư khi đầu tư vào Quỹ cũng như lợi nhuận của Quỹ.  \nGiá dịch vụ Mua lại và các khoản giá dịch vụ ngân hàng và thuế khác (nếu có) sẽ được trừ vào khoản tiền thu được từ bán Đơn Vị Quỹ của Nhà Đầu Tư.', '## 2. Điều lệ Quỹ tóm tắt\nCơ quan quyền lực cao nhất của Quỹ là Đại hội Nhà Đầu tư.  \nBan Đại diện Quỹ sẽ do Đại hội Nhà Đầu tư bầu ra để giám sát các hoạt động thường xuyên của Quỹ, TCC và Ngân hàng giám sát.  \n#### 2.1.2 Tổng vốn huy động và số lượng chứng chỉ Quỹ được chào bán  \nVốn Điều lệ được huy động trong lần đầu chào bán ra công chúng của Quỹ là 50.000.000.000 VNĐ (Năm mươi tỷ đồng). Vốn Điều lệ sẽ được chia thành 5.000.000 (Năm triệu) Chứng chỉ Quỹ. Mệnh giá của một Chứng chỉ Quỹ sẽ là 10.000 VNĐ (mười nghìn Đồng Việt Nam).  \nNhà đầu tư góp vốn bằng tiền Đồng Việt Nam dưới hình thức chuyển khoản hoặc chuyển tiền vào tài khoản của Quỹ mở tại ngân hàng giám sát.  \nSố lượng chứng chỉ quỹ/tổng chứng chỉ quỹ được phép lưu hành tối đa: không hạn chế.', '## b. Chính sách thuế\nNhà Đầu Tư nên tham khảo ý kiến tư vấn của các nhà tư vấn thuế chuyên nghiệp của mình đối với các nghĩa vụ thuế cụ thể và những vấn đề về tài chính của việc đầu tư vào Quỹ.', '## 2.2.4 Hạn mức đầu tư\nHạn mức đầu tư của Quỹ được quy định chi tiết tuân thủ các quy định tại Thông tư hướng dẫn hoạt động và quản lý các quỹ đầu tư chứng khoán. Cơ cấu danh mục đầu tư của Quỹ phải bảo đảm tuân thủ các hạn mức đầu tư sau:  \na) Trừ tiền gửi trên tài khoản thanh toán của quỹ tại ngân hàng giám sát, quỹ mở không được đầu tư quá 49% tổng giá trị tài sản của quỹ vào các tài sản theo quy định tại điểm a, b mục IX.2.2.3  \nb) Không được đầu tư vào chứng khoán của một tổ chức phát hành quá 10% tổng giá trị chứng khoán đang lưu hành của tổ chức đó, trừ công cụ nợ của Chính phủ;  \nc) Không được đầu tư quá 20% tổng giá trị tài sản của quỹ vào chứng khoán đang lưu hành và các tài sản (nếu có) quy định tại điểm a, b mục IX.2.2.3 của một tổ chức phát hành, trừ công cụ nợ của Chính phủ;', '# II. CÁC ĐỊNH NGHĨA\n“Quỹ” có nghĩa là Quỹ Đầu Tư Cổ phiếu Doanh nghiệp vừa và nhỏ Techcom, một loại hình Quỹ đầu tư chứng khoán dạng mở do Công ty Quản Lý Quỹ quản lý chào bán Chứng Chỉ Quỹ ra công chúng và được thành lập theo các quy định hiện hành về chứng khoán tại Việt Nam và Điều lệ này.  \n“Công ty Quản Lý Quỹ” có nghĩa là Công ty Cổ phần Quản Lý Quỹ Kỹ thương, được thành lập theo giấy phép thành lập và hoạt động Số 40/UBCK-GP do Chủ tịch Ủy ban Chứng khoán Nhà nước cấp ngày 21/10/2008 và được cấp lại Giấy phép thành lập và hoạt động Số 57/GP-UBCK do UBCKNN cấp ngày 30/01/2019 do chuyển đổi loại hình từ công ty TNHH sang công ty cổ phần.', '## 3. Các rủi ro khi đầu tư vào Quỹ\nMục tiêu của Công Ty Quản Lý Quỹ là quản lý các rủi ro đầu tư, và nếu có thể, hạn chế tác động của các rủi ro này bằng việc áp dụng các phương pháp quản lý đầu tư theo tiêu chuẩn quốc tế tốt nhất. Nhà Đầu Tư cần lưu ý các điểm quan trọng sau đây:  \n- Quỹ, Công Ty Quản Lý Quỹ, thành viên Hội đồng thành viên, ban điều hành và nhân viên Công Ty Quản Lý Quỹ không có bất kỳ sự đảm bảo nào đối với vốn đầu tư ban đầu cũng như mức lợi nhuận từ đầu tư của Quỹ;\n- Không có bất kỳ sự bảo đảm nào về sổ lẫn chi trả và giá trị của cổ tức được thanh toán trong tương lai;  \n42', '## 2. Điều lệ Quỹ tóm tắt\n#### 2.1.1 Nguyên tắc tổ chức hoạt động của Quỹ  \nQuỹ được tổ chức dưới hình thức Quỹ mở theo quy định của Pháp Luật.  \nQuỹ không bị giới hạn về thời gian hoạt động. Việc thay đổi về thời hạn hoạt động của Quỹ sẽ được thực hiện theo Nghị quyết của Đại hội Nhà Đầu Tư.  \nQuỹ chính thức bắt đầu hoạt động sau khi được cấp giấy chứng nhận đăng ký thành lập quỹ. Thời hạn hoạt động của Quỹ sẽ kết thúc ngay sau khi Quỹ bị giải thể theo quyết định của Đại Hội Nhà Đầu Tư hoặc theo quyết định của Cơ quan Nhà nước có thẩm quyền.  \nMục tiêu đầu tư của Quỹ là mang lại lợi nhuận dài hạn thông qua tăng trưởng vốn gốc và thu nhập trên cơ sở đánh giá, lựa chọn các tài sản có chất lượng tốt, phân bổ danh mục hợp lý và tối thiểu hóa rủi ro cho Nhà Đầu Tư.', '## 2.5.3. Thông tin về các mức giá dịch vụ\nNhà Đầu Tư được khuyến khích nắm giữ các Đơn Vị Quỹ như một phần của các khoản đầu tư dài hạn và chương trình tiết kiệm lưu trí. Quỹ mở không được thiết kế cho mục đích mua bán ngắn hạn. Việc Nhà Đầu Tư thường xuyên mua đi và bán lại Đơn Vị Quỹ, vốn được thiết kế để đạt được lợi nhuận dài hạn sẽ ảnh hưởng đến mục tiêu lợi nhuận của Nhà Đầu Tư khi đầu tư vào Quỹ cũng như lợi nhuận của Quỹ.']",Quỹ tập trung đầu tư năng động vào cổ phiếu của các Công ty hàng đầu trong rổ cổ phiếu VNMID (vốn hóa vừa) và VNSML (vốn hóa nhỏ) trên thị trường chứng khoán Việt Nam.
Ai là người chịu trách nhiệm giám sát việc chi tiêu và sử dụng tiền của quỹ?,"Theo tài liệu, Ngân Hàng Giám Sát chịu trách nhiệm giám sát hoạt động và bảo quản tài sản của Quỹ. Cụ thể:

- Trong đoạn văn trên trang 61, nêu rõ: ""Giá dịch vụ giám sát được trả cho Ngân Hàng Giám Sát để cung cấp dịch vụ Ngân Hàng Giám Sát cho Quỹ.""

Ngoài ra, cũng có đề cập rằng Ngân Hàng Giám Sát phải hoàn toàn độc lập và tách biệt với Công ty Quản lý quỹ:

- Trong đoạn văn trên trang 61: ""Ngân hàng giám sát phải hoàn toàn độc lập và tách biệt với công ty quản lý quỹ mà ngân hàng cung cấp dịch vụ giám sát.""

Vì vậy, dựa vào thông tin từ tài liệu, Ngân Hàng Giám Sát là người chịu trách nhiệm giám sát việc chi tiêu và sử dụng tiền của Quỹ.

Nguồn: Trang 61","['## g) Phụ Cấp Ban Đại Diện Quỹ\nCác chi phí của Ban Đại Diện Quỹ bao gồm chi phí ăn ở, đi lại với mức hợp lý và phù hợp với các quy định tại Điều lệ Quỹ, các chi phí phát sinh từ hoạt động của Ban Đại Diện Quỹ để phục vụ cho lợi ích của Quỹ sẽ được tính vào chi phí của Quỹ. Để dễ hiểu, chi phí trên không bao gồm các chi phí bảo hiểm đối với trách nhiệm phát sinh cho Ban Đại Diện Quỹ khi thực hiện nghĩa vụ của Ban Đại Diện Quỹ. Thủ lao của các thành viên của Ban Đại Diện Quỹ được tính vào chi phí hoạt động của Quỹ và tổng mức thủ lao không được vượt quá tổng ngân sách hoạt động hàng năm của Ban Đại Diện đã được thông qua tại Đại Hội Nhà Đầu Tư.', 'ngược lại;  \n- Ngân hàng giám sát, thành viên Hội đồng quản trị, người điều hành và nhân viên của ngân hàng giám sát làm nhiệm vụ giám sát hoạt động và bảo quản tài sản của quỹ đại chúng, công ty đầu tư chứng khoán không được là đối tác mua, bán trong giao dịch mua, bán tài sản của quỹ đại chúng, công ty đầu tư chứng khoán.\n- Có đầy đủ năng lực cung cấp dịch vụ giám sát, lưu ký;\n- Thực hiện các cam kết đối với Quỹ như nêu tại Phụ lục 2 và Phụ lục 3 của Điều lệ Quỹ.  \nCác quy định về quyền và nghĩa vụ, hoạt động giám sát và chấm dứt quyền và nghĩa vụ của Ngân hàng giám sát tuân thủ theo quy định tại chương VII Điều lệ Quỹ.', 'e. Phụ Cấp Ban Đại Diện Quỹ  \nCác chi phí của Ban Đại Diện Quỹ bao gồm chi phí ăn ở, đi lại với mức hợp lý và phù hợp với các quy định tại Điều lệ Quỹ, các chi phí phát sinh từ hoạt động của Ban Đại Diện Quỹ để phục vụ cho lợi ích của Quỹ sẽ được tính vào chi phí của Quỹ. Để dễ hiểu, chi phí trên không bao gồm các chi phí bảo hiểm đối với trách nhiệm phát sinh cho Ban Đại Diện Quỹ khi thực hiện nghĩa vụ của Ban Đại Diện Quỹ. Thù lao của các thành viên của Ban Đại Diện Quỹ được tính vào chi phí hoạt động của Quỹ và tổng mức thù lao không được vượt quá tổng ngân sách hoạt động hàng năm của Ban Đại Diện đã được thông qua tại Đại Hội Nhà Đầu Tư.', '## 3. Giá dịch vụ và thưởng hoạt động\nCác loại phí/dịch vụ và chi phí/giá dịch vụ liên quan trực tiếp đến việc giao dịch Đơn Vị Quỹ sẽ do Nhà Đầu Tư trả và không được tính vào chi phí của Quỹ. Công Ty Quản Lý Quỹ bảo lưu quyền thay đổi biểu phí/giá dịch vụ này.  \nCác khoản giá dịch vụ giao dịch như sau:', '## 2.5.3. Thông tin về các mức giá dịch vụ\nCác loại phí/dịch vụ và chi phí/giá dịch vụ liên quan trực tiếp đến việc giao dịch Đơn Vị Quỹ sẽ do Nhà Đầu Tư trả và không được tính vào chi phí của Quỹ. Công Ty Quản Lý Quỹ bảo lưu quyền thay đổi biểu phí/giá dịch vụ này.  \nCác khoản giá dịch vụ giao dịch như sau:', 'Nhà Đầu Tư có thể thanh toán số tiền mua Đơn Vị Quỹ từ tài khoản ngân hàng của mình vào tài khoản của Quỹ để Ngân Hàng Giám Sát nhận được đúng hạn và Đại Lý Phân Phối hoàn thành xử lý việc đăng ký với Đại Lý Chuyển Nhượng. Mọi khoản đầu tư vào Đơn Vị Quỹ đều thực hiện bằng tiền Đồng Việt Nam.  \nTrong trường hợp lệnh mua chứng chỉ quỹ và việc thanh toán cho lệnh mua được thực hiện bởi cá nhân, tổ chức khác không phải nhà đầu tư thì phiếu lệnh và tài liệu xác nhận thanh toán phải nêu rõ tên, số tài khoản và giá trị thanh toán của nhà đầu tư được hưởng lợi.', '## 2.12. Kiểm toán, kế toán và chế độ báo cáo\nCông ty Quản Lý Quỹ có trách nhiệm duy trì sổ sách kế toán và chuẩn bị báo cáo tài chính cho Quỹ. Phù hợp với quy định tại Điều 38 của Điều Lệ Quỹ, Công ty Quản Lý Quỹ có thể ủy quyền cho một nhà cung cấp dịch vụ để thực hiện Công việc này. Mọi Sổ sách kế toán và báo cáo tài chính của Quỹ sẽ được lưu tại văn phòng của Công ty Quản Lý Quỹ hoặc của nhà cung cấp dịch vụ mà Công ty Quản Lý Quỹ ủy quyền. Ban Đại diện Quỹ có quyền kiểm tra bất kỳ báo cáo, sổ sách kế toán, hoặc tài liệu nào của Quỹ.  \nCác quy định khác liên quan đến kiểm toán, kế toán và chế độ báo cáo tuân thủ theo quy định tại Điều lệ Quỹ.', '## 2.3. Đặc trưng của chứng chỉ Quỹ đầu tư\nNhà đầu tư của Quỹ là cá nhân, tổ chức trong và ngoài nước, sở hữu chứng chỉ quỹ. Nhà đầu tư không chịu trách nhiệm pháp lý hoặc nghĩa vụ khác ngoài trách nhiệm trong phạm vi số chứng chỉ Quỹ mà họ sở hữu. Nhà đầu tư là tổ chức bao gồm các tổ chức kinh tế và xã hội được pháp luật Việt Nam công nhận.  \nNhà đầu tư pháp nhân cử người đại diện hợp pháp đại diện cho số Chứng chỉ quỹ mà mình sở hữu. Việc đề cử, hủy bỏ hay thay thế người đại diện này phải được thông báo bằng văn bản, do người đại diện có thẩm quyền của nhà đầu tư tổ chức ký.', 'd. Chi phí Kiểm Toán  \nPhí Kiểm Toán phụ thuộc vào kết quả lựa chọn và thương lượng với Công Ty Kiểm Toán và sẽ được xác định hàng năm vào cuối năm tài chính của Quỹ.  \ne. Phụ Cấp Ban Đại Diện Quỹ', '# XII. XUNG ĐỘT LỢI ÍCH\nCông Ty Quản Lý Quỹ có nghĩa vụ, theo Điều lệ và theo thông lệ quốc tế tốt nhất, tại mọi thời điểm hoạt động vì lợi ích của Nhà Đầu Tư và quản lý một cách công bằng, minh bạch đối với tất cả các quỹ do Công ty quản lý. Bộ phận kiểm soát nội bộ và quản trị rủi ro của Công Ty sẽ chịu trách nhiệm theo dõi và giám sát các xung đột lợi ích thực tế hoặc có khả năng xảy ra. Trong trường hợp xung đột lợi ích phát sinh, Công ty Quản lý Quỹ sẽ thông báo cho Ban Đại Diện Quỹ để thống nhất phương án khắc phục nhằm giảm thiểu hoặc quản lý các xung đột đó.', 'Nhà Đầu Tư có thể thanh toán số tiền mua Đơn Vị Quỹ bằng cách chuyển khoản từ tài khoản ngân hàng của mình hoặc nộp tiền trực tiếp vào tài khoản của Quỹ để Ngân Hàng Giám Sát nhận được đúng hạn và Đại Lý Phân Phối hoàn thành xử lý việc đăng ký với Đại Lý Chuyển Nhượng. Mọi khoản đầu tư vào Đơn Vị Quỹ đều thực hiện bằng tiền Đồng Việt Nam.  \nTrong trường hợp lệnh mua chứng chỉ quỹ và việc thanh toán cho lệnh mua được thực hiện bởi cá nhân, tổ chức khác không phải nhà đầu tư thì phiếu lệnh và tài liệu xác nhận thanh toán phải nêu rõ tên, số tài khoản và giá trị thanh toán của nhà đầu tư được hưởng lợi.  \n- **Tuân Thủ**', 'Trường hợp sai lệch là do Công ty Quản Lý Quỹ không tuân thủ các hạn chế đầu tư theo quy định của Pháp Luật hoặc Điều lệ Quỹ, Công ty Quản Lý Quỹ có trách nhiệm điều chỉnh lại danh mục đầu tư trong thời hạn mười lăm (15) ngày, kể từ ngày phát sinh sai lệch. Trong trường hợp này, Công ty Quản Lý Quỹ phải chịu mọi chi phí phát sinh liên quan đến các giao dịch này và các tổn thất (nếu có phát sinh). Nếu phát sinh lợi nhuận, thì phải hạch toán ngay mọi khoản lợi nhuận có được cho Quỹ.', '## 2.11. Tiêu chí lựa chọn, quyền hạn và trách nhiệm của Ngân hàng giám sát\nNgân Hàng Giám Sát được lựa chọn phải đáp ứng các điều kiện sau:  \n- Ngân hàng giám sát do Công ty quản lý quỹ lựa chọn phải đáp ứng các điều kiện quy định tại Khoản 1 Điều 116 Luật Chứng khoán;\n- Ngân hàng giám sát phải hoàn toàn độc lập và tách biệt với công ty quản lý quỹ mà ngân hàng cung cấp dịch vụ giám sát;\n- Ngân hàng giám sát, thành viên Hội đồng quản trị, người điều hành và nhân viên của ngân hàng giám sát làm nhiệm vụ giám sát hoạt động và bảo quản tài sản của quỹ đại chúng, công ty đầu tư chứng khoán không được là người có liên quan hoặc có quan hệ sở hữu, vay hoặc cho vay với công ty quản lý quỹ, công ty đầu tư chứng khoán và', 'Quỹ được thực hiện giao dịch mua bán lại công cụ nợ của Chính phủ theo quy định của Bộ Tài chính về quản lý giao dịch công cụ nợ của Chính phủ.', '## XV. CAM KẾT\nCông Ty Quản Lý Quỹ cam kết chịu hoàn toàn trách nhiệm về tính chính xác, trung thực của nội dung thông tin và các tài liệu đính kèm trong Bản cáo bạch này.', '## 3.2 Giá dịch vụ mà Quỹ phải trả\nGiá dịch vụ giám sát được trả cho Ngân Hàng Giám Sát để cung cấp dịch vụ Ngân Hàng Giám Sát cho Quỹ. Giá dịch vụ được tính vào mỗi kỳ định giá dựa trên NAV tại ngày trước Ngày Định Giá và được trả hàng tháng. Số tiền trả dịch vụ hàng tháng là tổng số được tính (trích lập) cho các kỳ định giá thực hiện trong tháng.', '9 năm kinh nghiệm với vai trò giám đốc kiểm toán tại Công ty TNHH KPMG Việt Nam.  \nHiện là Giám đốc tài chính (CFO) tại Công ty CP Đầu tư Thương Mại Quốc Tế Mặt Trời Đỏ.  |  \nCác quy định về tiêu chuẩn lựa chọn thành viên Ban đại diện Quỹ, quyền hạn và nhiệm vụ của Ban đại diện Quỹ, chủ tịch Ban đại diện Quỹ, đình chỉ hoặc bãi miễn thành viên Ban đại diện Quỹ, cuộc họp của Ban đại diện Quỹ tuân theo quy định tại chương V Điều lệ Quỹ.', '## h) Chi Phí Khác\n- Giá dịch vụ môi giới cho các giao dịch của quỹ;\n- Chi phí in ấn, ví dụ in các tài liệu cho Nhà Đầu Tư theo quy định Pháp Luật;\n- Giá dịch vụ định giá độc lập cho các khoản đầu tư cụ thể của Quỹ (chỉ khi cần thiết), ví dụ như định giá các khoản chứng khoán chưa niêm yết;\n- Chi phí phát sinh cho bất kỳ Đại Hội Nhà Đầu Tư hay cuộc họp nào của Ban Đại Diện Quỹ;\n- Phí/giá dịch vụ pháp lý liên quan đến hoạt động và các giao dịch của Quỹ và các loại phí/chi phí/dịch vụ khác theo Luật cho phép;\n- Thuế và các loại phí/dịch vụ bắt buộc của chính phủ áp dụng cho Quỹ; và\n- Các chi phí khác được Pháp Luật cho phép.', '## 2.6. Giá dịch vụ mà Quỹ phải trả\nChỉ có các loại phí/dịch vụ và các chi phí/giá dịch vụ liên quan trực tiếp hoặc đóng góp vào các hoạt động và điều hành của Quỹ mới được tính vào chi phí/giá dịch vụ hoạt động của Quỹ. Xin lưu ý các phí/giá dịch vụ dưới đây là các mức đang áp dụng và các phí/giá dịch vụ này có thể sẽ thay đổi trong tương lai. Các chi phí/dịch vụ này bao gồm:', '## 3.2 Giá dịch vụ mà Quỹ phải trả\nChỉ có các loại phí/dịch vụ và các chi phí/giá dịch vụ liên quan trực tiếp hoặc đóng góp vào các hoạt động và điều hành của Quỹ mới được tính vào chi phí/giá dịch vụ hoạt động của Quỹ. Xin lưu ý các phí/giá dịch vụ dưới đây là các mức đang áp dụng và các phí/giá dịch vụ này có thể sẽ thay đổi trong tương lai. Các chi phí/dịch vụ này bao gồm:', '- Thực hiện các lệnh giao dịch của Nhà Đầu Tư;  \n- Các hoạt động sáp nhập, hợp nhất của các tổ chức phát hành các chứng khoán mà Quỹ đang nắm giữ;  \n- Quỹ mới được cấp phép thành lập hoặc do tách Quỹ, hợp nhất Quỹ, sát nhập Quỹ mà thời gian hoạt động không quá sáu (06) tháng, tính từ ngày được cấp giấy chứng nhận đăng ký lập Quỹ;  \n- Quỹ đang trong thời gian giải thể.  \nTrong trường hợp xảy ra sai lệch so với các hạn mức đầu tư, Công ty Quản Lý Quỹ sẽ điều chỉnh danh mục đầu tư để đáp ứng các hạn mức đầu tư kể trên trong vòng 3 (ba) tháng kể từ ngày mà sai lệch phát sinh.', '## 3.4. Rủi ro tỷ giá\nDo tài sản và nợ phải trả của Quỹ đều được trình bày bằng đồng Việt Nam, là đơn vị tiền tệ sử dụng của Quỹ. Vì vậy, mặc dù rủi ro tỷ giá trong trung hạn tại Việt Nam trong thời điểm hiện nay được chúng tôi đánh giá là tương đối thấp do tình hình kinh tế vĩ mô được giữ ổn định, cán cân thương mại thặng dư và Chính phủ thể hiện quyết tâm duy trì sự ổn định của đồng Việt Nam, các Nhà Đầu Tư nước ngoài thực tế sẽ phải chịu rủi ro tỷ giá trong thời gian đầu tư tại Việt Nam.  \n43', '## 2.10. Tiêu chí lựa chọn, quyền hạn và trách nhiệm của Công ty Quản lý quỹ\nCông ty Quản Lý Quỹ được lựa chọn phải thỏa mãn các điều kiện sau:  \n- Được thực hiện nghiệp vụ Quản Lý Quỹ;\n- Hoàn toàn độc lập với Ngân Hàng Giám Sát;\n- Có đầy đủ cơ sở vật chất, nhân sự để Quản Lý Quỹ mở;\n- Đồng ý thực hiện các cam kết đối với Quỹ như nêu tại Phụ Lục 1 và Phụ Lục 3 của Điều lệ Quỹ.  \nCác quy định về quyền và nghĩa vụ, chấm dứt quyền và nghĩa vụ, hạn chế hoạt động của Công ty Quản lý quỹ tuân thủ theo quy định tại Chương VI Điều lệ Quỹ.', 'Trong thời hạn 05 ngày làm việc kể từ ngày hoàn tất việc điều chỉnh lại danh mục đầu tư, công ty quản lý quỹ phải công bố thông tin theo quy định, đồng thời thông báo cho Ủy ban Chứng khoán Nhà nước về các sai lệch cơ cấu danh mục đầu tư, nguyên nhân, thời điểm phát sinh hoặc phát hiện ra sự việc, mức độ thiệt hại và bồi thường thiệt hại cho quỹ (nếu có) hoặc lợi nhuận tạo cho quỹ (nếu có), biện pháp khắc phục, thời gian thực hiện, kết quả khắc phục.  \nCông ty quản lý quỹ chỉ được gửi tiền và đầu tư công cụ thị trường tiền tệ quy định tại điểm a, b mục IX.2.2.3 của các tổ chức tín dụng trong danh sách đã được Ban đại diện quỹ phê duyệt.', 'Trong trường hợp Quỹ nhận được số tiền mua thấp hơn lệnh đăng ký mua và không nhận được yêu cầu chuyển trả từ khách hàng, số tiền mua sẽ tiếp tục được giữ lại để chờ yêu cầu giao dịch tiếp theo từ khách hàng.  \nTrong trường hợp Nhà Đầu Tư có nhiều lệnh mua Chứng Chỉ Quỹ cùng một lúc, Lệnh Mua Chứng Chỉ Quỹ sẽ được ưu tiên theo thứ tự đặt lệnh.  \nPhí/giá dịch vụ chuyển tiền (nếu có) được trừ vào số tiền hoàn trả cho Nhà Đầu Tư. Đơn Vị Quỹ sẽ chỉ được ghi nhận vào tài khoản của Nhà Đầu Tư hay của Đại Lý Kỷ Danh sau khi có kết quả giao dịch chứng chỉ quỹ.']",Ngân hàng giám sát (BIDV - Chi nhánh Hà Thành) có trách nhiệm giám sát hoạt động của Công ty quản lý quỹ nhằm đảm bảo tài sản của quỹ được quản lý đúng quy định.
Làm thế nào để tôi biết được giá trị tài sản của mình mỗi ngày?,"Theo thông tin từ tài liệu, bạn có thể biết được giá trị tài sản của mình mỗi ngày thông qua các bước sau:

1. Công ty quản lý quỹ sẽ định giá và công bố giá trị tài sản ròng (NAV - Net Asset Value) hàng ngày.
2. Giá trị tài sản ròng này sẽ được điều chỉnh lại trong thời hạn 5 ngày làm việc nếu phát hiện sai sót.

Cụ thể, theo thông tin từ trang 34 của tài liệu:

- Trong thời hạn 05 ngày làm việc, kể từ ngày phát hiện giá trị tài sản ròng bị định giá sai, công ty quản lý quỹ hoặc ngân hàng giám sát (trong trường hợp ngân hàng giám sát cung cấp dịch vụ xác định giá trị tài sản ròng) phải điều chỉnh lại và công bố thông tin theo quy định.

- Giá trị tài sản ròng sẽ được làm tròn xuống đến 2 (hai) chữ số thập phân. 

Ngoài ra, Công ty Quản lý quỹ cũng sẽ gửi thống kê giao dịch, sao kê tài khoản giao dịch, báo cáo giá trị NAV và các thay đổi NAV của Quỹ hàng tháng, quý, năm cho Nhà Đầu Tư.

Thông tin này được lấy từ trang 34.","['## 2.5.2. Hình thức công bố thông tin về giá các giao dịch, nơi công bố thông tin, tần suất công bố thông tin\nGiá trị tài sản ròng của Quỹ và Giá trị tài sản ròng trên một Đơn Vị Quỹ phải được Ngân Hàng Giám Sát xác nhận và sẽ được công bố tại Trụ sở chính của Công Ty Quản Lý Quỹ, và trên các trang web hoặc các phương tiện truyền thông khác theo yêu cầu của Luật vào ngày làm việc tiếp theo của Ngày Định Giá với điều kiện các trang điện tử này hoạt động bình thường. Trong thời hạn 24 giờ kể từ khi phát hiện giá trị tài sản ròng bị định giá sai, Ngân Hàng Giám Sát phải thông báo và yêu cầu công ty quản lý quỹ kịp thời điều chỉnh hoặc ngược lại trong trường hợp ngân hàng giám sát cung cấp dịch vụ xác định giá trị tài sản ròng', '## 4. Phương pháp xác định giá trị tài sản ròng\nGiá trị tài sản ròng của Quỹ và Giá trị tài sản ròng trên một Đơn Vị Quỹ phải được Ngân Hàng Giám Sát xác nhận và sẽ được công bố tại Trụ sở chính của Công Ty Quản Lý Quỹ, và trên các trang web hoặc các phương tiện truyền thông khác theo yêu cầu của Luật vào ngày làm việc tiếp theo của Ngày Định Giá với điều kiện các trang điện tử này hoạt động bình thường. Trong thời hạn 24 giờ kể từ khi phát hiện giá trị tài sản ròng bị định giá sai, Ngân Hàng Giám Sát phải thông báo và yêu cầu công ty quản lý quỹ kịp thời điều chỉnh hoặc ngược lại trong trường hợp ngân hàng giám sát cung cấp dịch vụ xác định giá trị tài sản ròng', '## 2.2.8 Nguyên tắc, phương thức xác định giá trị tài sản ròng\nNgày Định Giá là ngày Công ty Quản Lý Quỹ xác định NAV của Quỹ. Ngày Định Giá là ngày giao dịch (để phục vụ cho việc tính giá phát hành và giá mua lại); và là ngày đầu tiên của tháng tiếp theo đối với việc định giá để làm báo cáo tháng, quý, năm theo luật định.  \n**Ví dụ:**  \n|  Khoản mục | Đơn vị | Giá trị  |\n| --- | --- | --- |\n|  NAV của Quỹ tại Ngày Định Giá T | = | 78.000.000.000  |\n|  Số lượng Đơn Vị Quỹ đang lưu hành tại T-1 | Đơn vị | 7.000.000  |', '|  NAV trên một Đơn Vị Quỹ: | = | 78.000.000.000 /7.000.000\n= 11.142,85 VNĐ/đơn vị  |\n| --- | --- | --- |  \nViệc định giá tài sản của Quỹ, bao gồm cả các quyền, và việc tính toán NAV của Quỹ sẽ phải theo các quy tắc và quy định áp dụng cho từng thời điểm, được quy định trong Điều Lệ và sẽ được kiểm toán hằng năm. Chính sách kế toán phải phù hợp với các quy định hiện hành. Chính sách định giá tài sản của Quỹ được quy định tại Số Tay Định Giá và sẽ tuân thủ Pháp Luật và thông lệ quốc tế tốt nhất. Số tay định giá phải được Ban Đại Diện Quỹ phê duyệt và cung cấp cho ngân hàng giám sát để giám sát việc tính toán giá trị tài sản ròng.', '## 4. Phương pháp xác định giá trị tài sản ròng\nNgày Định Giá là ngày xác định Giá trị tài sản ròng của Quỹ. Ngày Định Giá là ngày giao dịch (để phục vụ cho việc tính giá phát hành và giá mua lại); và là ngày đầu tiên của tháng tiếp theo đối với việc định giá để làm báo cáo tháng, quý, năm theo luật định.', '## 4. Phương pháp xác định giá trị tài sản ròng\nCác quy định khác về việc công bố giá trị tài sản ròng và tình hình giao dịch tuân thủ theo quy định của Pháp luật và Điều lệ Quỹ.', 'Xác định giá trị tài sản ròng NAV  \nGiá Trị Tài Sản Ròng (NAV) của một Chứng chỉ quỹ bằng NAV của Quỹ chia cho tổng số Chứng chỉ quỹ đang lưu hành tại Ngày Giao Dịch gần nhất trước Ngày Định Giá.  \nNAV là tổng giá trị các tài sản và các khoản đầu tư do Quỹ sở hữu trừ đi các nghĩa vụ nợ của Quỹ tính đến ngày gần nhất trước Ngày Định Giá.  \n$$\n\\mathrm{NAV/CCQ} = \\frac{(\\text{Tổng tài sản của Quỹ} - \\text{Tổng nợ của Quỹ})}{\\text{Tổng số đơn vị Quỹ đang lưu hành của Quỹ}}\n$$  \nNAV được tính cho mỗi Ngày Giao Dịch của Quỹ và sẽ được tính làm tròn xuống đến 02 (hai) chữ số thập phân.  \nVí dụ sau đây minh họa cho cách tính NAV của Quỹ tại ngày gần nhất trước Ngày Định Giá (T-1) cụ thể theo các giả định được đưa ra:  \n|  Khoản mục | Đơn vị | Giá trị  |\n| --- | --- | --- |', '## 3.4. Rủi ro tỷ giá\nDo tài sản và nợ phải trả của Quỹ đều được trình bày bằng đồng Việt Nam, là đơn vị tiền tệ sử dụng của Quỹ. Vì vậy, mặc dù rủi ro tỷ giá trong trung hạn tại Việt Nam trong thời điểm hiện nay được chúng tôi đánh giá là tương đối thấp do tình hình kinh tế vĩ mô được giữ ổn định, cán cân thương mại thặng dư và Chính phủ thể hiện quyết tâm duy trì sự ổn định của đồng Việt Nam, các Nhà Đầu Tư nước ngoài thực tế sẽ phải chịu rủi ro tỷ giá trong thời gian đầu tư tại Việt Nam.  \n43', 'Công thức tính giá dịch vụ giám sát vào mỗi kỳ định giá được xác định như sau:  \nGiá dịch vụ giám sát cho kỳ định giá = Tỷ lệ giá dịch vụ giám sát (năm) x NAV tại ngày trước ngày định giá x số ngày theo lịch thực tế của chu kỳ định giá / số ngày thực tế của năm (365 hoặc 366).  \n|  Loại Giá dịch vụ | Mức giá dịch vụ | Tối thiểu/tối đa | Ghi chú  |\n| --- | --- |\n|  Giá dịch vụ giám sát | 0,02%*NAV/Năm | Tối thiểu: 5.000.000 đồng /tháng | Thuế VAT 10%  |', 'Công thức tính giá dịch vụ quản trị quỹ vào mỗi kỳ định giá được xác định như sau:  \nGiá dịch vụ quản trị quỹ cho kỳ định giá = Tỷ lệ giá dịch vụ quản trị quỹ (năm) x NAV tại ngày trước ngày định giá x số ngày theo lịch thực tế của chu kỳ định giá / số ngày thực tế của năm (365 hoặc 366).  \nc. Giá dịch vụ Đại Lý Chuyển Nhượng  \nGiá dịch vụ Đại lý chuyển nhượng được tính toán và cộng đồng theo kỳ định giá và được thanh toán định kỳ theo thỏa thuận với Đại lý chuyển nhượng. Giá dịch vụ Đại lý chuyển nhượng được thống nhất với Đại lý chuyển nhượng phù hợp với quy định của pháp luật và có thể được điều chỉnh theo thỏa thuận với Đại lý chuyển nhượng.  \nd. Chi phí Kiểm Toán', '|  Khoản mục | Đơn vị | Giá trị  |\n| --- | --- | --- |\n|  Thị giá của tất cả chứng khoán tại ngày T-1 | VND | 80.000.000.000  |\n|  Tiền và tương đương tiền tại ngày T-1 | VND | 6.000.000.000  |\n|  Tài sản khác tại ngày T-1 | VND | 2.000.000.000  |\n|  Nợ của Quỹ tại ngày T-1 | VND | 10.000.000.000  |\n|  Số lượng Đơn Vị Quỹ đang lưu hành tại T-1(1) | Đơn vị | 7.000.000  |\n|  Tổng tài sản tại ngày T-1 |  | 88.000.000.000  |\n|  Trừ nợ của Quỹ tại ngày T-1 |  | 10.000.000.000  |', '## 4. Phương pháp xác định giá trị tài sản ròng\nGiá Trị Tài Sản Ròng (NAV) của một Chứng chỉ quỹ bằng NAV của Quỹ chia cho tổng số Chứng chỉ quỹ đang lưu hành tại Ngày Giao Dịch gần nhất trước Ngày Định Giá.', '## 3. Giao dịch chứng chỉ quỹ các lần tiếp theo\n- Ngày giao dịch  \nNhà đầu tư có thể mua, bán, chuyển đổi Quỹ hoặc chuyển nhượng Đơn vị Quỹ vào một trong các Ngày Giao Dịch. Ngày Giao Dịch là các ngày từ Thứ 2 đến Thứ 6 hàng tuần.  \nNgày Giao Dịch sẽ không bao gồm các ngày nghỉ lễ, kể cả nghỉ bù theo quy định của pháp luật.  \nViệc giảm tần suất giao dịch sẽ được Đại Hội Nhà Đầu Tư thông qua và luôn đảm bảo tần suất giao dịch không được ít hơn hai lần trong một tháng.  \n- Giá bán/Giá dịch vụ phát hành và Giá dịch vụ mua lại  \n**Giá bán/Giá dịch vụ phát hành:** Là mức giá Nhà Đầu Tư phải thanh toán để mua một đơn vị quỹ.', '## 2.2.8 Nguyên tắc, phương thức xác định giá trị tài sản ròng\nGiá Trị Tài Sản Ròng (NAV) của một Chứng chỉ quỹ bằng NAV của Quỹ chia cho tổng số Chứng chỉ quỹ đang lưu hành tại Ngày Giao Dịch gần nhất trước Ngày Định Giá. Giá trị tài sản ròng trên một Chứng chỉ quỹ sẽ được làm tròn xuống đến 2 (hai) chữ số thập phân.', '## b. Giá dịch vụ giám sát\nGiá dịch vụ giám sát được trả cho Ngân Hàng Giám Sát để cung cấp dịch vụ Ngân Hàng Giám Sát cho Quỹ. Giá dịch vụ được tính vào mỗi kỳ định giá dựa trên NAV tại ngày trước Ngày Định Giá và được trả hàng tháng. Số tiền trả dịch vụ hàng tháng là tổng số được tính (trích lập) cho các kỳ định giá thực hiện trong tháng.  \nCông thức tính giá dịch vụ giám sát vào mỗi kỳ định giá được xác định như sau:  \nGiá dịch vụ giám sát cho kỳ định giá = Tỷ lệ giá dịch vụ giám sát (năm) x NAV tại ngày trước ngày định giá x số ngày theo lịch thực tế của chu kỳ định giá / số ngày thực tế của năm (365 hoặc 366).  \n|  Loại Giá dịch vụ | Mức giá dịch vụ | Tối thiểu/tối đa | Ghi chú  |\n| --- | --- |\n|  Giá dịch vụ giám sát | 0,02%*NAV/Năm | Tối thiểu: 5.000.000 đồng /tháng | Thuế VAT 10%  |', '## 4. Phương pháp xác định giá trị tài sản ròng\n. Trong thời hạn 05 ngày làm việc, kể từ ngày phát hiện giá trị tài sản ròng bị định giá sai, công ty quản lý quỹ hoặc ngân hàng giám sát (trong trường hợp ngân hàng giám sát cung cấp dịch vụ xác định giá trị tài sản ròng) phải điều chỉnh lại và công bố thông tin theo quy định, đồng thời thông báo cho Ủy ban Chứng khoán Nhà nước về việc định giá sai, bao gồm nguyên nhân xảy ra sự việc, thời gian bị định giá sai, biện pháp xử lý. Nội dung thông báo phải được công ty quản lý quỹ và ngân hàng giám sát cùng ký xác nhận.', '## 2.5.2. Hình thức công bố thông tin về giá các giao dịch, nơi công bố thông tin, tần suất công bố thông tin\n. Trong thời hạn 05 ngày làm việc, kể từ ngày phát hiện giá trị tài sản ròng bị định giá sai, công ty quản lý quỹ hoặc ngân hàng giám sát (trong trường hợp ngân hàng giám sát cung cấp dịch vụ xác định giá trị tài sản ròng) phải điều chỉnh lại và công bố thông tin theo quy định, đồng thời thông báo cho Ủy ban Chứng khoán Nhà nước về việc định giá sai, bao gồm nguyên nhân xảy ra sự việc, thời gian bị định giá sai, biện pháp xử lý. Nội dung thông báo phải được công ty quản lý quỹ và ngân hàng giám sát cùng ký xác nhận.', '## XIII. CUNG CÁP THỐNG TIN CHO NHÀ ĐẦU TƯ, CHẾ ĐỘ BÁO CÁO\nHàng tháng, quý, năm Công Ty Quản Lý Quỹ sẽ gửi thống kê giao dịch, sao kê tài khoản giao dịch, tài khoản phụ, báo cáo giá trị NAV và các thay đổi NAV của Quỹ và các báo cáo khác theo luật định cho Nhà Đầu Tư.  \nĐối với Nhà Đầu Tư giao dịch trên tài khoản ký danh, Công Ty Quản Lý Quỹ hoặc tổ chức được ủy quyền bởi Công Ty Quản Lý Quỹ (trong phạm vi pháp luật hiện hành cho phép) sẽ gửi thống kê giao dịch và sao kê tài khoản phụ nếu Nhà Đầu Tư có yêu cầu bằng văn bản. Thời hạn cung cấp thông tin là trong vòng 05 (năm) ngày làm việc, kể từ ngày nhận được yêu cầu của Nhà Đầu Tư.', '## 3. Giá dịch vụ và thưởng hoạt động\nCác loại phí/dịch vụ và chi phí/giá dịch vụ liên quan trực tiếp đến việc giao dịch Đơn Vị Quỹ sẽ do Nhà Đầu Tư trả và không được tính vào chi phí của Quỹ. Công Ty Quản Lý Quỹ bảo lưu quyền thay đổi biểu phí/giá dịch vụ này.  \nCác khoản giá dịch vụ giao dịch như sau:', '## 2.5.3. Thông tin về các mức giá dịch vụ\nCác loại phí/dịch vụ và chi phí/giá dịch vụ liên quan trực tiếp đến việc giao dịch Đơn Vị Quỹ sẽ do Nhà Đầu Tư trả và không được tính vào chi phí của Quỹ. Công Ty Quản Lý Quỹ bảo lưu quyền thay đổi biểu phí/giá dịch vụ này.  \nCác khoản giá dịch vụ giao dịch như sau:', '## 2.4.1. Ngày giao dịch\nNhà đầu tư có thể mua, bán, chuyển đổi Quỹ hoặc chuyển nhượng Đơn vị Quỹ vào một trong các Ngày Giao Dịch. Ngày Giao Dịch được xác định như sau:  \n- Các ngày làm việc trong tuần từ thứ Hai đến thứ Sáu (tần suất giao dịch hàng ngày).\n- Ngày Giao Dịch sẽ không bao gồm các ngày nghỉ lễ, kể cả nghỉ bù theo quy định của pháp luật.  \nViệc giảm tần suất giao dịch sẽ được Đại Hội Nhà Đầu Tư thông qua và luôn đảm bảo tần suất giao dịch không được ít hơn hai lần trong một tháng.', '## 3.2 Giá dịch vụ mà Quỹ phải trả\nGiá dịch vụ giám sát được trả cho Ngân Hàng Giám Sát để cung cấp dịch vụ Ngân Hàng Giám Sát cho Quỹ. Giá dịch vụ được tính vào mỗi kỳ định giá dựa trên NAV tại ngày trước Ngày Định Giá và được trả hàng tháng. Số tiền trả dịch vụ hàng tháng là tổng số được tính (trích lập) cho các kỳ định giá thực hiện trong tháng.', '## 3. Giá dịch vụ và thưởng hoạt động\nNhà Đầu Tư được khuyến khích nắm giữ các Đơn Vị Quỹ như một phần của các khoản đầu tư dài hạn và chương trình tiết kiệm hưu trí. Quỹ mở không được thiết kế cho mục đích mua bán ngắn hạn. Việc Nhà Đầu Tư thường xuyên mua đi và bán lại Đơn Vị Quỹ, vốn được thiết kế để đạt được lợi nhuận dài hạn sẽ ảnh hưởng đến mục tiêu lợi nhuận của Nhà Đầu Tư khi đầu tư vào Quỹ cũng như lợi nhuận của Quỹ.  \nGiá dịch vụ Mua lại và các khoản giá dịch vụ ngân hàng và thuế khác (nếu có) sẽ được trừ vào khoản tiền thu được từ bán Đơn Vị Quỹ của Nhà Đầu Tư.', '## f) Lệnh Mua Tối Thiểu\nMức đầu tư tối thiểu (tính theo giá trị Lệnh Mua) là 10.000 VND (Mười nghìn đồng)  \nKhông có mức giới hạn đầu tư tối đa cho Nhà Đầu Tư. Công Ty Quản Lý Quỹ bảo lưu quyền thay đổi các giới hạn đầu tư trên trong từng thời điểm và sẽ thông báo về các thay đổi này.', '- Việc thực hiện tất cả các lệnh giao dịch của Nhà Đầu Tư tại Ngày Giao Dịch dẫn đến NAV của Quỹ thấp hơn 50.000.000.000 đồng (năm mươi tỷ đồng); hoặc Giá trị phần đơn vị quỹ hoặc số đơn vị quỹ còn lại trên tài khoản của nhà đầu tư thấp hơn giá trị tối thiểu hoặc số lượng đơn vị quỹ tối thiểu để duy trì tài khoản của nhà đầu tư theo quy định tại Điều lệ quỹ và Bán cáo bạch.\n- Trường hợp thực hiện một phần Lệnh Bán, Lệnh mua, Lệnh Chuyến Đổi Quỹ theo quy định nêu trên, Công ty Quản Lý Quỹ áp dụng nguyên tắc phân phối cùng tỷ lệ: Phần giá trị được thực hiện sẽ được phân bổ cho tất cả nhà đầu tư đăng ký giao dịch theo cùng một tỷ lệ giữa giá trị thực hiện và giá trị đăng ký giao dịch.  \nSố lượng chứng chỉ quỹ được thực hiện trong trường hợp này được tính như sau:']",Nhà đầu tư có thể theo dõi Giá trị tài sản ròng (NAV) được công bố định kỳ tại mỗi Ngày Giao Dịch trên website của Công ty quản lý quỹ và các Đại lý phân phối.
Quy định về thời gian Cut-off time để thực hiện lệnh giao dịch trong ngày là khi nào?,"Theo tài liệu cung cấp, cut-off time (thời điểm đóng lệnh) để thực hiện lệnh giao dịch cho Ngày Giao Dịch kế tiếp thường được xác định trước Thời Điểm Đóng Số Lệnh. Tuy nhiên, cụ thể về thời gian cut-off exact không được nêu rõ trong các trang tài liệu đã đề cập.

Dựa trên thông tin từ tài liệu:
- Cut-off time có liên quan đến Thời Điểm Đóng Số Lệnh (Time to Close Orders), thường là trước Ngày Giao Dịch kế tiếp.
- Các lệnh giao dịch sẽ được xử lý và thực hiện cho Ngày Giao Dịch kế tiếp sau khi nhận được trước Thời Điểm Đóng Số Lệnh.

Thông tin này được lấy từ Trang 30 của tài liệu.","['## 2.4.2. Thời điểm đóng số lệnh\nThời Điểm Đóng Số Lệnh cho việc xử lý và chấp nhận các chứng từ cần thiết cho các lệnh mua, bán, chuyển đổi quỹ hoặc chuyển nhượng để thực hiện trong Ngày Giao Dịch và cho việc thanh toán các lệnh mua được quy định chi tiết như sau:  \nThời Điểm Đóng Số Lệnh cho Ngày Giao Dịch ‘T’  \n|   | Giờ đóng số lệnh  |\n| --- | --- |\n|   | Hồ sơ(2)  |\n|  Mua(1) | 14h45 T-1  |\n|  Bán, Chuyển Đổi, Chuyển Nhượng, Hủy Lệnh | 14h45 T-1  |  \n(1) Nhà Đầu tư gửi tài liệu xác nhận hợp lệ về việc hoàn thành thanh toán mua Đơn Vị Quỹ trước 14h45 ngày làm việc gần nhất trước ngày giao dịch (ngày T-1) và Ngân Hàng Giám Sát nhận được tiền mua Đơn Vị Quỹ trong ngày T-1  \n(2) Thời Điểm Đóng Số Lệnh áp dụng cho việc nộp đầy đủ hồ sơ với Đại Lý Phân Phối.', 'b. Thời điểm đóng số lệnh  \nThời Điểm Đóng Số Lệnh cho việc xử lý và chấp nhận các chứng từ cần thiết cho các lệnh mua, bán, chuyển đổi quỹ hoặc chuyển nhượng để thực hiện trong Ngày Giao Dịch và cho việc thanh toán các lệnh mua được quy định chi tiết như sau:  \nThời Điểm Đóng Số Lệnh cho Ngày Giao Dịch ‘T’  \n|   | Giờ đóng số lệnh  |\n| --- | --- |\n|   | Hồ sơ(4)  |\n|  Mua(3) | Trước 14h45 T-1  |\n|  Bán, Chuyển Đổi, Chuyển Nhượng, Hủy Lệnh | Trước 14h45 T-1  |  \n(1) Nhà đầu tư gửi tài liệu xác nhận hợp lệ về việc hoàn thành thanh toán mua Đơn Vị Quỹ trước 14h45 ngày làm việc gần nhất trước ngày giao dịch (ngày T-1) và Ngân Hàng Giám Sát nhận được tiền mua Đơn Vị Quỹ trong ngày T-1  \n(2) Thời Điểm Đóng Số Lệnh áp dụng cho việc nộp đầy đủ hồ sơ với Đại Lý Phân Phối.', '(2) Thời Điểm Đóng Số Lệnh áp dụng cho việc nộp đầy đủ hồ sơ với Đại Lý Phân Phối.  \nCác lệnh giao dịch sẽ được xử lý căn cứ vào ngày và giờ Nhà Đầu Tư nộp hồ sơ tại Điểm Nhận Lệnh. Với những lệnh giao dịch hợp lệ nộp cho Đại Lý Phân Phối trước 14h45 (mười bốn giờ bốn lăm) chiều, NAV của Ngày Giao Dịch T sẽ được áp dụng.  \nTrong trường hợp ngày đóng số lệnh rơi vào ngày nghỉ lễ thì việc nhận lệnh sẽ được thực hiện vào ngày làm việc liền trước đó. Công ty quản lý quỹ sẽ thông báo đến nhà đầu tư, Đại lý phân phối và các đơn vị cung cấp dịch vụ có liên quan về lịch giao dịch cụ thể khi các dịp lễ tết xảy ra trên trang thông tin điện tử của công ty và/hoặc bằng thư điện tử.  \nc. Giao dịch muộn và chọn thời điểm giao dịch  \n- Giao Dịch Muộn', '## 2.4.2. Thời điểm đóng số lệnh\n(2) Thời Điểm Đóng Số Lệnh áp dụng cho việc nộp đầy đủ hồ sơ với Đại Lý Phân Phối.  \nCác lệnh giao dịch sẽ được xử lý căn cứ vào ngày và giờ Nhà Đầu Tư nộp hồ sơ tại Điểm Nhận Lệnh. Với những lệnh giao dịch hợp lệ nộp cho Đại Lý Phân Phối trước 14h45 (mười bốn giờ bốn lăm) chiều, NAV của Ngày Giao Dịch T sẽ được áp dụng.  \nTrong trường hợp ngày đóng số lệnh rơi vào ngày nghỉ lễ thì việc nhận lệnh sẽ được thực hiện vào ngày làm việc liền trước đó. Công ty quản lý quỹ sẽ thông báo đến nhà đầu tư, Đại lý phân phối và các đơn vị cung cấp dịch vụ có liên quan về lịch giao dịch cụ thể khi các dịp lễ tết xảy ra trên trang thông tin điện tử của công ty và/hoặc bằng thư điện tử.', '## 2.4.3. Giao dịch muộn và chọn thời điểm giao dịch\nCác lệnh giao dịch nhận được sau Thời Điểm Đóng Số Lệnh cho Ngày Giao Dịch không được phép thực hiện tại NAV của Ngày Giao Dịch đó. Các giao dịch nhận được sau Thời Điểm Đóng Số Lệnh sẽ được thực hiện tại NAV của Ngày Giao Dịch tiếp theo.', 'c. Giao dịch muộn và chọn thời điểm giao dịch  \n- Giao Dịch Muộn  \nCác lệnh giao dịch nhận được sau Thời Điểm Đóng Số Lệnh cho Ngày Giao Dịch không được phép thực hiện tại NAV của Ngày Giao Dịch đó. Các giao dịch nhận được sau Thời Điểm Đóng Số Lệnh sẽ được thực hiện tại NAV của Ngày Giao Dịch tiếp theo.  \n- Chọn Thời Điểm Giao Dịch  \nChứng Chỉ Quỹ cũng như Quỹ không được coi là công cụ phục vụ việc giao dịch thường xuyên để tận dụng các biến động ngắn hạn của thị trường. Loại giao dịch này thường được gọi là “chọn thời điểm giao dịch” và có thể gây ra các thiệt hại tiềm tàng hoặc thiệt hại thực tế cho Nhà Đầu Tư.  \nd. Quy trình mua chứng chỉ quỹ  \nNhà Đầu Tư mua Đơn Vị Quỹ cần điền đầy đủ vào phiếu Lệnh Mua có sẵn tại các Điểm Nhận Lệnh.', '## 2.4.1. Ngày giao dịch\nNhà đầu tư có thể mua, bán, chuyển đổi Quỹ hoặc chuyển nhượng Đơn vị Quỹ vào một trong các Ngày Giao Dịch. Ngày Giao Dịch được xác định như sau:  \n- Các ngày làm việc trong tuần từ thứ Hai đến thứ Sáu (tần suất giao dịch hàng ngày).\n- Ngày Giao Dịch sẽ không bao gồm các ngày nghỉ lễ, kể cả nghỉ bù theo quy định của pháp luật.  \nViệc giảm tần suất giao dịch sẽ được Đại Hội Nhà Đầu Tư thông qua và luôn đảm bảo tần suất giao dịch không được ít hơn hai lần trong một tháng.', '# i. Chương trình Đầu tư Định kỳ\nNgày Giao Dịch các kỳ tiếp theo là ngày tròn kỳ kể từ Ngày Giao Dịch đầu tiên. Trường hợp ngày tròn kỳ của các kỳ tiếp theo rơi vào ngày nghỉ (bao gồm cả ngày nghỉ bù), thì ngày Giao Dịch các kỳ tiếp theo sẽ là ngày làm việc ngay sau ngày tròn kỳ. Lệnh cho các Ngày Giao Dịch này sẽ được tạo ra vào ngày làm việc trước Ngày Giao Dịch tương ứng.  \nNhà Đầu Tư cần thanh toán cho khoản đầu tư của Chương Trình ĐTĐK để Ngân Hàng Giám Sát nhận được tiền mua trước Thời điểm Đóng Số Lệnh của Ngày Giao Dịch của các kỳ đầu tư tương ứng.  \nTrường hợp Nhà Đầu Tư không nộp đủ tiền mua vào tài khoản của quỹ trước Thời điểm Đóng Số Lệnh của một Ngày Giao Dịch trong Chương Trình ĐTĐK, lệnh mua chứng chỉ quỹ của kỳ đầu tư đó sẽ không được thực hiện. Số tiền không hợp lệ này sẽ được xử lý như sau:', 'Ngày Giao Dịch các kỳ tiếp theo là ngày tròn kỳ kể từ Ngày Giao Dịch đầu tiên. Trường hợp ngày tròn kỳ của các kỳ tiếp theo rơi vào ngày nghỉ (bao gồm cả ngày nghỉ bù), thì ngày Giao Dịch các kỳ tiếp theo sẽ là ngày làm việc ngay sau ngày tròn kỳ. Lệnh cho các Ngày Giao Dịch này sẽ được tạo ra vào ngày làm việc trước Ngày Giao Dịch tương ứng.  \nNhà Đầu Tư cần thanh toán cho khoản đầu tư của Chương Trình ĐTĐK để Ngân Hàng Giám Sát nhận được tiền mua trước Thời điểm Đóng Số Lệnh của Ngày Giao Dịch của các kỳ đầu tư tương ứng.  \nTrường hợp Nhà Đầu Tư không nộp đủ tiền mua vào tài khoản của quỹ trước Thời điểm Đóng Số Lệnh của một Ngày Giao Dịch trong Chương Trình ĐTĐK, lệnh mua chứng chỉ quỹ của kỳ đầu tư đó sẽ không được thực hiện. Số tiền không hợp lệ này sẽ được xử lý như sau:', '## 3. Giao dịch chứng chỉ quỹ các lần tiếp theo\n- Ngày giao dịch  \nNhà đầu tư có thể mua, bán, chuyển đổi Quỹ hoặc chuyển nhượng Đơn vị Quỹ vào một trong các Ngày Giao Dịch. Ngày Giao Dịch là các ngày từ Thứ 2 đến Thứ 6 hàng tuần.  \nNgày Giao Dịch sẽ không bao gồm các ngày nghỉ lễ, kể cả nghỉ bù theo quy định của pháp luật.  \nViệc giảm tần suất giao dịch sẽ được Đại Hội Nhà Đầu Tư thông qua và luôn đảm bảo tần suất giao dịch không được ít hơn hai lần trong một tháng.  \n- Giá bán/Giá dịch vụ phát hành và Giá dịch vụ mua lại  \n**Giá bán/Giá dịch vụ phát hành:** Là mức giá Nhà Đầu Tư phải thanh toán để mua một đơn vị quỹ.', 'Ngay sau khi các sự kiện này chấm dứt, các giao dịch Đơn Vị Quỹ sẽ được thực hiện trở lại vào Ngày Giao Dịch tiếp theo. Theo luật, thời gian tạm dừng thực hiện các Lệnh Mua và Bán Đơn Vị Quỹ sẽ không quá 90 (chín mươi) ngày kể từ Ngày Giao Dịch gần nhất. Trong trường hợp giao dịch không thể tiếp tục trong khoảng thời gian tạm dừng tối đa nêu trên, thì trong vòng 30 (ba mươi) ngày kể từ ngày kết thúc thời hạn tạm dừng trên, Công Ty Quản Lý Quỹ phải tổ chức họp để lấy ý kiến Đại Hội Nhà Đầu Tư về việc giải thể Quỹ, hoặc tách Quỹ, hoặc tiếp tục kéo dài thời gian tạm dừng giao dịch Chứng chỉ Quỹ. Trong thời hạn triệu tập Đại Hội Nhà Đầu Tư, nếu các nguyên nhân dẫn tới việc tạm dừng giao dịch Chứng Chỉ Quỹ chấm dứt, Công ty Quản Lý Quỹ được hủy bỏ việc triệu tập Đại Hội Nhà Đầu Tư.  \n56', '## d) Xác Nhận Lệnh Chuyển Nhượng\nNgay sau khi các sự kiện này chấm dứt, các giao dịch Đơn Vị Quỹ sẽ được thực hiện trở lại vào Ngày Giao Dịch tiếp theo. Theo luật, thời gian tạm dừng thực hiện các Lệnh Mua và Bán Đơn Vị Quỹ sẽ không quá 90 (chín mươi) ngày kể từ Ngày Giao Dịch gần nhất. Trong trường hợp giao dịch không thể tiếp tục trong khoảng thời gian tạm dừng tối đa nêu trên, thì trong vòng 30 (ba mươi) ngày kể từ ngày kết thúc thời hạn tạm dừng trên, Công Ty Quản Lý Quỹ phải tổ chức họp để lấy ý kiến Đại Hội Nhà Đầu Tư về việc giải thể Quỹ, hoặc tách Quỹ, hoặc tiếp tục kéo dài thời gian tạm dừng giao dịch Chứng chỉ Quỹ. Trong thời hạn triệu tập Đại Hội Nhà Đầu Tư, nếu các nguyên nhân dẫn tới việc tạm dừng giao dịch Chứng Chỉ Quỹ chấm dứt, Công ty Quản Lý Quỹ được hủy bỏ việc triệu tập Đại Hội Nhà Đầu Tư.', 'b) Chọn Thời Điểm Giao Dịch  \nChứng Chỉ Quỹ cũng như Quỹ không được coi là công cụ phục vụ việc giao dịch thường xuyên để tận dụng các biến động ngắn hạn của thị trường. Loại giao dịch này thường được gọi là “chọn thời điểm giao dịch” và có thể gây ra các thiệt hại tiềm tàng hoặc thiệt hại thực tế cho Nhà Đầu Tư.  \n2.4.4. Quy trình mua chứng chỉ quỹ  \na) Hợp đồng mở tài khoản giao dịch chứng khoán và đăng ký giao dịch quỹ mở', '“Ngày Định Giá”  \nLà ngày mà Công ty Quản Lý Quỹ xác định giá trị tài sản ròng của Quỹ theo quy định tại Luật chứng khoán và Điều lệ Quỹ.  \n“Ngày Giao Dịch”  \nlà ngày mà công ty quản lý quỹ, thay mặt quỹ, phát hành và mua lại chứng chỉ quỹ mở từ nhà đầu tư theo cơ chế giao dịch của quỹ.  \n“Thời Điểm Đóng Số Lệnh”  \ncó nghĩa là thời điểm cuối cùng mà Đại Lý Phân Phối có thể nhận lệnh giao dịch Chứng chỉ quỹ từ Nhà đầu tư để thực hiện trong Ngày Giao Dịch Chứng Chỉ Quỹ. Thời điểm đóng số lệnh được quy định tại Điều lệ quỹ, công bố công khai tại Bản cáo bạch, Bản cáo bạch tóm tắt và không được muộn quá thời điểm đóng cửa thị trường của Sở giao dịch chứng khoán tại ngày giao dịch gần nhất trước ngày giao dịch chứng chỉ quỹ.  \n“UBCKNN”  \ncó nghĩa là Ủy Ban Chứng Khoán Nhà Nước Việt Nam.', '- **Xác Nhận Lệnh Chuyển Nhượng**  \nCác Lệnh Chuyển Nhượng được thực hiện bởi Đại Lý Chuyển Nhượng tại Ngày Giao Dịch.  \n**h. Các trường hợp hủy, tạm dừng lệnh giao dịch**  \n- **Hủy lệnh giao dịch Đơn Vị Quỹ**  \nNhà Đầu Tư có thể hủy các lệnh giao dịch bằng cách điền và nộp Phiếu Hủy Lệnh cho các Điểm Nhận Lệnh của Đại Lý Phân Phối của họ trước Thời Điểm Đóng Số Lệnh áp dụng cho các giao dịch đó.  \n- **Tạm dừng thực hiện các lệnh giao dịch Đơn Vị Quỹ**  \nNhà Đầu Tư cần lưu ý là việc thực hiện các lệnh giao dịch - Mua, Bán, Chuyển Đổi, Chuyển Nhượng Đơn Vị Quỹ có thể sẽ bị tạm dừng một hoặc nhiều Ngày Giao Dịch vì tình hình vượt ngoài tầm kiểm soát của Công Ty Quản Lý Quỹ. Tất cả Điểm Nhận Lệnh sẽ được thông báo trong các trường hợp giao dịch bị tạm dừng.', '- Thực hiện các lệnh giao dịch của Nhà Đầu Tư;  \n- Các hoạt động sáp nhập, hợp nhất của các tổ chức phát hành các chứng khoán mà Quỹ đang nắm giữ;  \n- Quỹ mới được cấp phép thành lập hoặc do tách Quỹ, hợp nhất Quỹ, sát nhập Quỹ mà thời gian hoạt động không quá sáu (06) tháng, tính từ ngày được cấp giấy chứng nhận đăng ký lập Quỹ;  \n- Quỹ đang trong thời gian giải thể.  \nTrong trường hợp xảy ra sai lệch so với các hạn mức đầu tư, Công ty Quản Lý Quỹ sẽ điều chỉnh danh mục đầu tư để đáp ứng các hạn mức đầu tư kể trên trong vòng 3 (ba) tháng kể từ ngày mà sai lệch phát sinh.', '# 5. Kế hoạch phân chia lợi nhuận\nNhà Đầu Tư có trong danh sách chốt trong số Đăng Ký tại Ngày Giao Dịch được công bố bởi TCC cho việc chia cổ tức (“Ngày Chốt Danh Sách”) được xem là đủ điều kiện để nhận cổ tức.  \nCổ tức sẽ được chi trả trong thời hạn 30 (ba mươi) ngày kể từ ngày được công bố và được chuyển vào tài khoản ngân hàng của Nhà Đầu Tư theo đăng ký trong Số Đăng Ký vào ngày thanh toán cổ tức, sau khi được khấu trừ các loại thuế có liên quan.  \nCổ tức được chi trả sẽ phải chịu thuế tùy thuộc vào nguồn gốc của thu nhập của Quỹ cũng như các loại thuế áp dụng cho Nhà Đầu Tư.', '## 2.4.6. Quy trình chuyển đổi quỹ\nTrong một vài trường hợp Lệnh Chuyển Đổi cùng các lệnh khác có thể bị tạm dừng thực hiện. Các trường hợp được này được nêu tại mục 2.4.8.  \nTrong các trường hợp tạm dừng thực hiện các giao dịch Đơn Vị Quỹ, Lệnh Chuyển Đổi đã nhận sẽ được thực hiện tại NAV tại Ngày Giao Dịch đầu tiên sau khi giao dịch được thực hiện trở lại.', 'Lệnh Mua thành công của Nhà Đầu Tư hay Đại Lý Kỷ Danh sẽ được thông báo trong vòng 03 (ba) ngày làm việc sau Ngày Giao Dịch, số lượng Đơn Vị Quỹ sẽ được làm tròn xuống đến hai số thập phân sau dấu phẩy. Số Đơn Vị Quỹ lẻ sẽ không ảnh hưởng đến khả năng bán lại Đơn Vị Quỹ của Nhà Đầu Tư.  \n- **Tạm Dừng Thực Hiện Lệnh Mua**  \nNhà Đầu Tư cần lưu ý rằng trong một số trường hợp các Lệnh Mua của Nhà Đầu Tư cùng với tất cả các Lệnh Mua khác có thể bị tạm dừng thực hiện. Các trường hợp này được liệt kê trong mục 2.4.8.  \nTrong trường hợp các giao dịch Đơn Vị Quỹ bị tạm dừng, Lệnh Mua sẽ được thực hiện vào Ngày Giao Dịch đầu tiên sau khi giao dịch được thực hiện trở lại.  \n- **Lệnh Mua Tối Thiểu**  \nMức đầu tư tối thiểu (tính theo giá trị Lệnh Mua) là 10.000 VNĐ (Mười nghìn đồng)', '## d) Xác Nhận Lệnh Chuyển Nhượng\n#### a) Hủy lệnh giao dịch Đơn Vị Quỹ  \nNhà Đầu Tư có thể hủy các lệnh giao dịch bằng cách điền và nộp Phiếu Hủy Lệnh cho các Điểm Nhận Lệnh của Đại Lý Phân Phối của họ trước Thời Điểm Đóng Số Lệnh áp dụng cho các giao dịch đó.  \n#### b) Tạm dừng thực hiện các lệnh giao dịch Đơn Vị Quỹ  \nNhà Đầu Tư cần lưu ý là việc thực hiện các lệnh giao dịch - Mua, Bán, Chuyển Đổi, Chuyển Nhượng Đơn Vị Quỹ có thể sẽ bị tạm dừng một hoặc nhiều Ngày Giao Dịch vì tình hình vượt ngoài tầm kiểm soát của Công Ty Quản Lý Quỹ. Tất cả Điểm Nhận Lệnh sẽ được thông báo trong các trường hợp giao dịch bị tạm dừng.  \nViệc thực hiện các giao dịch Đơn Vị Quỹ có thể bị tạm dừng do một trong các sự kiện sau:  \n- Các điều kiện bất khả kháng;', '## f) Lệnh Mua Tối Thiểu\nĐại Lý Phân Phối sẽ xử lý tất cả các Lệnh Bản nhận trước Thời Điểm Đóng Số Lệnh và gửi lệnh giao dịch tổng hợp tới Đại lý Chuyển Nhượng để thực hiện giao dịch cho Ngày Giao Dịch kế tiếp, và đảm bảo các thông tin trong Lệnh Bản đầy đủ và nhất quán và Nhà Đầu Tư có đủ số Đơn Vị Quỹ trong tài khoản để bán. Nhà Đầu tư có thể đặt bán số Chứng Chỉ Quỹ tối đa bằng số lượng Chứng Chỉ Quỹ mà mình sở hữu. Khoản tiền bán ròng sẽ được chuyển trả cho Nhà Đầu Tư. Lệnh Bản không thuộc trường hợp được thực hiện một phần bởi các điều kiện liên quan đến Lệnh Bản một phần như để trong các mục dưới đây sẽ được giao dịch tại NAV tại Ngày Giao Dịch trừ đi Giá dịch vụ Mua lại, giá dịch vụ chuyển tiền và thuế (nếu có), dựa trên ngày giờ nhận Lệnh Bản tại Điểm Nhận Lệnh, theo ngày giờ xác nhận tại Điểm Nhận Lệnh', '## e. Quy trình bán chứng chỉ quỹ\nĐại Lý Phân Phối sẽ xử lý tất cả các Lệnh Bản nhận trước Thời Điểm Đóng Số Lệnh và gửi lệnh giao dịch tổng hợp tới Đại lý Chuyển Nhượng để thực hiện giao dịch cho Ngày Giao Dịch kế tiếp, và đảm bảo các thông tin trong Lệnh Bản đầy đủ và nhất quán và Nhà Đầu Tư có đủ số Đơn Vị Quỹ trong tài khoản để bán. Nhà Đầu tư có thể đặt bản số Chứng Chỉ Quỹ tối đa bằng số lượng Chứng Chỉ Quỹ mà mình sở hữu. Khoản tiền bán ròng sẽ được chuyển trả cho Nhà Đầu Tư. Lệnh Bản không thuộc trường hợp được thực hiện một phần bởi các điều kiện liên quan đến Lệnh Bản một phần như để trong các mục dưới đây sẽ được giao dịch tại NAV tại Ngày Giao Dịch trừ đi Giá dịch vụ Mua lại, giá dịch vụ chuyển tiền và thuế (nếu có), dựa trên ngày giờ nhận Lệnh Bản tại Điểm Nhận Lệnh, theo ngày giờ xác nhận tại Điểm Nhận Lệnh', 'Việc thực hiện các giao dịch Đơn Vị Quỹ có thể bị tạm dừng do một trong các sự kiện sau:  \n- Các điều kiện bất khả kháng;\n- Không thể xác định được NAV của Quỹ tại Ngày Giao Dịch do các Sở giao dịch chứng khoán quyết định đình chỉ giao dịch chứng khoán trong danh mục đầu tư của Quỹ hoặc do các sở giao dịch chứng khoán tạm dừng giao dịch; hoặc\n- Các trường hợp khác theo quy định của Ủy Ban Chứng Khoán Nhà Nước.', 'Trường hợp sai lệch là do Công ty Quản Lý Quỹ không tuân thủ các hạn chế đầu tư theo quy định của Pháp Luật hoặc Điều lệ Quỹ, Công ty Quản Lý Quỹ có trách nhiệm điều chỉnh lại danh mục đầu tư trong thời hạn mười lăm (15) ngày, kể từ ngày phát sinh sai lệch. Trong trường hợp này, Công ty Quản Lý Quỹ phải chịu mọi chi phí phát sinh liên quan đến các giao dịch này và các tổn thất (nếu có phát sinh). Nếu phát sinh lợi nhuận, thì phải hạch toán ngay mọi khoản lợi nhuận có được cho Quỹ.', 'Trong các trường hợp tạm dừng thực hiện các giao dịch Đơn Vị Quỹ, Lệnh Chuyển Đổi đã nhận sẽ được thực hiện tại NAV tại Ngày Giao Dịch đầu tiên sau khi giao dịch được thực hiện trở lại.  \n**g. Quy trình chuyển nhượng chứng chỉ quỹ**  \n- **Đơn Chuyển Nhượng**  \nNhà Đầu Tư có thể Chuyển Nhượng Đơn Vị Quỹ cho nhà đầu tư khác dưới dạng quà tặng, thừa kế hoặc thực hiện lệnh của toà án. Chuyển Nhượng chỉ được thực hiện dưới dạng số lượng Đơn  \n55']",Thời điểm đóng sổ lệnh (Cut-off time) là 14h45 ngày T-1 (trước Ngày giao dịch).
Các rủi ro liên quan đến biến động lãi suất ảnh hưởng như thế nào đến lợi nhuận của Quỹ TCSME?,"Rủi ro liên quan đến biến động lãi suất có thể ảnh hưởng đến lợi nhuận của Quỹ TCSME theo các cách sau:

1. **Giá trị tài sản**: Khi lãi suất tăng, giá trị của trái phiếu trong danh mục đầu tư của Quỹ có thể giảm do nhu cầu cao hơn đối với trái phiếu mới có lãi suất cao hơn. Ngược lại, khi lãi suất giảm, giá trị của trái phiếu hiện hữu có thể tăng.

2. **Thu nhập từ lãi**: Lãi suất biến động cũng ảnh hưởng đến thu nhập hàng kỳ từ lãi trái phiếu. Nếu lãi suất tăng, thu nhập từ lãi trái phiếu sẽ tăng; ngược lại, nếu lãi suất giảm, thu nhập từ lãi trái phiếu sẽ giảm.

3. **Rủi ro tái đầu tư**: Rủi ro tái đầu tư là rủi ro đặc thù của các khoản đầu tư trái phiếu với dòng tiền từ lãi trái phiếu nhận được hàng kỳ và gốc trái phiếu nhận được vào thời điểm đáo hạn được đem đi tái đầu tư nhằm thu lợi nhuận (lãi-trên-lãi). Rủi ro tái đầu Invest phát sinh khi mặt bằng lãi suất tại thời điểm tái đầu tư thấp hơn so với lãi suất kỳ vọng trước đó.

Theo tài liệu, rủi ro lãi suất của Quỹ TCSME được quản trị thông qua việc theo dõi kỳ vọng lãi suất thể hiện trên đường cong lợi suất và kỳ hạn của danh mục đầu tư trái phiếu. 

Nguồn: Trang 44","['## 3.2. Rủi ro lãi suất\nLà rủi ro mà giá trị hợp lý của các dòng tiền trong tương lai của chứng khoán có thu nhập cố định bị biến động do những thay đổi của lãi suất thị trường, dẫn tới giá thị trường của chứng khoán thay đổi. Thông thường, giá thị trường của trái phiếu và các chứng khoán có thu nhập cố định biến động ngược chiều với lãi suất. Quỹ có thể giảm thiểu rủi ro lãi suất bằng cách giữ kỳ hạn của trái phiếu phù hợp với các kỳ vọng về lãi suất, cụ thể là nắm giữ trái phiếu có lãi suất cố định với kỳ hạn ngắn hơn và nhiều trái phiếu có lãi suất thả nổi hơn khi lãi suất được dự báo tăng và ngược lại khi lãi suất được dự báo giảm.', '## 3.6. Rủi ro về biến động giá\nRủi ro về biến động giá của Quỹ phát sinh khi một hay một số Nhà Đầu Tư đang nắm giữ một số lượng lớn Đơn Vị Quỹ quyết định thực hiện Lệnh Bản các Đơn Vị Quỹ này cùng lúc. Điều này có thể ảnh hưởng bất lợi tới giá của Đơn Vị Quỹ nếu các Lệnh Bản này đòi hỏi Công Ty Quản Lý Quỹ phải thoái vốn các khoản đầu tư tại mức giá thấp. Các quy định về thực hiện một phần lệnh bán và tạm dừng lệnh bán có thể giảm thiểu rủi ro biến động giá của Quỹ.', '## 3.8. Rủi ro pháp lý\nĐây là rủi ro có thể phát sinh khi Luật hoặc các quy định pháp lý thay đổi hoặc sự diễn giải và thi hành Luật và các quy định pháp lý này thay đổi khiến cho Quỹ hoặc giá trị tài sản của Quỹ bị ảnh hưởng. Những thay đổi về Luật hay các quy định pháp lý thường được thông báo trước khi có hiệu lực. Mức độ ảnh hưởng của những thay đổi này đối với Quỹ và các công ty trong danh mục sẽ được đánh giá, và nếu cần thiết và khả thi, Quỹ sẽ thay đổi cơ cấu danh mục đầu tư hoặc đối tượng các công ty được đầu tư.', '## 3.4. Rủi ro tỷ giá\nDo tài sản và nợ phải trả của Quỹ đều được trình bày bằng đồng Việt Nam, là đơn vị tiền tệ sử dụng của Quỹ. Vì vậy, mặc dù rủi ro tỷ giá trong trung hạn tại Việt Nam trong thời điểm hiện nay được chúng tôi đánh giá là tương đối thấp do tình hình kinh tế vĩ mô được giữ ổn định, cán cân thương mại thặng dư và Chính phủ thể hiện quyết tâm duy trì sự ổn định của đồng Việt Nam, các Nhà Đầu Tư nước ngoài thực tế sẽ phải chịu rủi ro tỷ giá trong thời gian đầu tư tại Việt Nam.  \n43', '## 3.3. Rủi ro lạm phát\nGiá trái phiếu thường tỷ lệ nghịch với lạm phát. Ví dụ trong môi trường lạm phát tăng, sức mua hay giá trị thực của các dòng tiền trong tương lai (mệnh giá và lãi trái phiếu nhận được hàng kỳ) sẽ giảm. Khi đó lợi suất kỳ vọng của trái phiếu tăng lên dẫn đến giá trái phiếu thấp hơn. Rủi ro lạm phát đối với danh mục trái phiếu có thể được giảm thiểu bằng cách rút ngắn kỳ hạn trái phiếu hoặc nắm giữ nhiều hơn những trái phiếu có lãi suất thả nổi nếu lạm phát được dự kiến tăng trong dài hạn.', 'Giống như các hình thức đầu tư khác, Quỹ mở có những rủi ro như Nhà Đầu Tư có thể bị lỗ một phần hoặc toàn bộ vốn đầu tư ban đầu, rủi ro không có lợi nhuận hoặc lợi nhuận đạt được thấp hơn dự kiến hoặc thấp hơn so với lợi nhuận của các hình thức đầu tư khác được đầu tư cùng thời điểm và có cùng thời gian nắm giữ. Nhà Đầu Tư cần nhận thức được những rủi ro này tại thời điểm thực hiện đầu tư cũng như hiểu được khả năng chấp nhận của họ đối với rủi ro mất vốn đầu tư ban đầu hoặc lợi nhuận thấp hơn kỳ vọng. Rủi ro trong đầu tư chứng khoán thông thường được phân thành những loại rủi ro sau đây:', '## 3.9. Rủi ro bất khả kháng\nĐây là rủi ro khi những sự kiện bất thường phát sinh có ảnh hưởng lớn và đột ngột lên giá trị của tất cả hoặc một số tài sản của Quỹ. Những sự kiện này - dù là có thật hay tin đồn, có thể bao gồm:  \n- Thảm họa thiên nhiên như động đất, lũ lụt, hỏa hoạn, thảm họa hạt nhân;', '|  Từ trên 12 tháng trở lên | 0,00%  |\n| --- | --- |  \nGiá dịch vụ Chuyển Đổi Quỹ sẽ được hạch toán cho Công Ty Quản Lý Quỹ và Đại Lý Phân Phối căn cứ theo hợp đồng ký giữa Công Ty Quản Lý Quỹ và Đại Lý Phân Phối.', 'Tuy nhiên, từ giữa năm 2019, trước những căng thẳng thương mại giữa các quốc gia lớn tác động tiêu cực lên triển vọng kinh tế toàn cầu và sau đó là ảnh hưởng nặng nề của đại dịch COVID-19, Ngân hàng Nhà nước đã chủ động và kịp thời điều chỉnh 4 lần giảm liên tục các mức lãi suất điều hành với tổng mức giảm tương đương 1,75 - 2,25%/năm. Trong quý I/2022, các ngân hàng trung ương tại các thị trường quốc tế đã có sự điều chỉnh tăng lãi suất để đối phó với áp lực lạm phát đang gia tăng. Tuy vậy, Ngân hàng nhà nước Việt nam nhiều khả năng vẫn giữ chính sách lãi suất ổn định trong năm 2022', 'Lãi suất được duy trì ổn định nhằm tạo điều kiện cho sự phục hồi của nền kinh tế  \nDiễn biến lãi suất 2011 - Quý I/2022\n![img-7.jpeg](img-7.jpeg)\nNguồn: TCC tổng hợp, Bloomberg  \nTrong giai đoạn 2016-2019, với mục tiêu chung nhằm ổn định nền kinh tế vĩ mô, kiểm soát lạm phát thông qua kiểm soát kênh tiền M2 và ổn định tăng trưởng tín dụng trong toàn ngành, lãi suất huy động và lãi suất điều hành đã được duy trì tương đối ổn định.', '## 3. Các rủi ro khi đầu tư vào Quỹ\nMục tiêu của Công Ty Quản Lý Quỹ là quản lý các rủi ro đầu tư, và nếu có thể, hạn chế tác động của các rủi ro này bằng việc áp dụng các phương pháp quản lý đầu tư theo tiêu chuẩn quốc tế tốt nhất. Nhà Đầu Tư cần lưu ý các điểm quan trọng sau đây:  \n- Quỹ, Công Ty Quản Lý Quỹ, thành viên Hội đồng thành viên, ban điều hành và nhân viên Công Ty Quản Lý Quỹ không có bất kỳ sự đảm bảo nào đối với vốn đầu tư ban đầu cũng như mức lợi nhuận từ đầu tư của Quỹ;\n- Không có bất kỳ sự bảo đảm nào về sổ lẫn chi trả và giá trị của cổ tức được thanh toán trong tương lai;  \n42', '## 2.5.3. Thông tin về các mức giá dịch vụ\nCác loại phí/dịch vụ và chi phí/giá dịch vụ liên quan trực tiếp đến việc giao dịch Đơn Vị Quỹ sẽ do Nhà Đầu Tư trả và không được tính vào chi phí của Quỹ. Công Ty Quản Lý Quỹ bảo lưu quyền thay đổi biểu phí/giá dịch vụ này.  \nCác khoản giá dịch vụ giao dịch như sau:', '## 3. Giá dịch vụ và thưởng hoạt động\nCác loại phí/dịch vụ và chi phí/giá dịch vụ liên quan trực tiếp đến việc giao dịch Đơn Vị Quỹ sẽ do Nhà Đầu Tư trả và không được tính vào chi phí của Quỹ. Công Ty Quản Lý Quỹ bảo lưu quyền thay đổi biểu phí/giá dịch vụ này.  \nCác khoản giá dịch vụ giao dịch như sau:', '## 3.1. Rủi ro tín dụng\nRủi ro tín dụng hay rủi ro mất khả năng thanh toán là rủi ro mà tổ chức phát hành không thể đáp ứng các nghĩa vụ của mình đối với phần vốn gốc và lãi khi đến hạn thanh toán. Rủi ro này chủ yếu liên quan đến các chứng khoán có thu nhập cố định như: trái phiếu Chính phủ, trái phiếu được Chính phủ bảo lãnh, và hoặc trái phiếu doanh nghiệp. Công Ty Quản Lý Quỹ sẽ xem xét cẩn trọng và thường xuyên đánh giá chất lượng tín dụng trong quá trình lựa chọn đầu tư vào trái phiếu và các chứng khoán có thu nhập cố định khác.', '2.11. Tiêu chí lựa chọn, quyền hạn và trách nhiệm của Ngân hàng giám sát ... 41\n2.12. Kiểm toán, kế toán và chế độ báo cáo ... 42\n3. Các rủi ro khi đầu tư vào Quỹ ... 42\n3.1. Rủi ro tín dụng ... 43\n3.2. Rủi ro lãi suất ... 43\n3.3. Rủi ro lạm phát ... 43\n3.4. Rủi ro tỷ giá ... 43\n3.5. Rủi ro thanh khoản ... 44\n3.6. Rủi ro về biến động giá ... 44\n3.7. Rủi ro tài đầu tư ... 44\n3.8. Rủi ro pháp lý ... 44\n3.9. Rủi ro bất khả kháng ... 44', '## Lĩnh vực được phép đầu tư\nVới chiến lược đầu tư như đã đề cập ở trên, cơ cấu danh mục đầu tư của Quỹ có thể thay đổi theo thời gian dựa theo tiềm năng tăng trưởng của cổ phiếu và tùy vào mức độ thanh khoản của các cổ phiếu trên thị trường. Tỷ trọng các khoản đầu tư không vượt quá những hạn chế đầu tư quy định tại mục “Hạn chế đầu tư”.', '## 2. Thông tin về đợt phát hành lần đầu ra công chúng\nNgoài ra, để đảm bảo tối ưu hóa lợi ích của nhà đầu tư, Quỹ có sự linh hoạt trong phân bổ tài sản tùy thuộc vào cơ hội đầu tư sẵn có tại các thời điểm khác nhau. Việc phân bổ tài sản có thể thay đổi đáng kể tùy thuộc vào nhận định của Quỹ, với mục tiêu xuyên suốt trong toàn bộ thời gian hoạt động của Quỹ là bảo vệ lợi ích của Nhà Đầu Tư.  \nVới chiến lược đầu tư như đã đề cập ở trên, cơ cấu danh mục đầu tư của Quỹ có thể thay đổi theo thời gian dựa theo tiềm năng tăng trưởng của cổ phiếu và tùy vào mức độ thanh khoản của các cổ phiếu trên thị trường. Tỷ trọng các khoản đầu tư không vượt quá những hạn chế đầu tư quy định tại mục “Hạn chế đầu tư”.  \nCác loại tài sản mà quỹ được đầu tư bao gồm:\ni. Tiền gửi tại các ngân hàng thương mại theo quy định của pháp luật về  |  \n46', '## 3. Giá dịch vụ và thưởng hoạt động\nNhà Đầu Tư được khuyến khích nắm giữ các Đơn Vị Quỹ như một phần của các khoản đầu tư dài hạn và chương trình tiết kiệm hưu trí. Quỹ mở không được thiết kế cho mục đích mua bán ngắn hạn. Việc Nhà Đầu Tư thường xuyên mua đi và bán lại Đơn Vị Quỹ, vốn được thiết kế để đạt được lợi nhuận dài hạn sẽ ảnh hưởng đến mục tiêu lợi nhuận của Nhà Đầu Tư khi đầu tư vào Quỹ cũng như lợi nhuận của Quỹ.  \nGiá dịch vụ Mua lại và các khoản giá dịch vụ ngân hàng và thuế khác (nếu có) sẽ được trừ vào khoản tiền thu được từ bán Đơn Vị Quỹ của Nhà Đầu Tư.', '## 2.2.5 Điều chỉnh danh mục đầu tư\nCơ cấu đầu tư của quỹ mở chỉ được vượt mức so với các hạn chế đầu tư đã quy định tại điểm a, b, c, d, đ, e và i mục IX.2.2.4 và chỉ do các nguyên nhân sau:  \na) Biến động giá trên thị trường của tài sản trong danh mục đầu tư của quỹ;  \nb) Thực hiện các khoản thanh toán của quỹ theo quy định của pháp luật, bao gồm việc thực hiện lệnh giao dịch của nhà đầu tư;', '## c) Giá dịch vụ Chuyển Đổi Quỹ\nKhi thực hiện chuyển đổi, Nhà Đầu Tư chỉ thanh toán Giá dịch vụ Chuyển Đổi trên giá trị đăng ký chuyển đổi, mà không phải thanh toán Giá dịch vụ Mua Lại đối với Quỹ hiện tại và Giá dịch vụ Phát Hành đối với Quỹ mục tiêu.  \nCác khoản thuế giao dịch, giá dịch vụ chuyển tiền ngân hàng, nếu có, sẽ được khấu trừ vào số tiền thu được từ Lệnh Bản trong Lệnh Chuyển Đổi. Thời gian nắm giữ Đơn Vị Quỹ của Quỹ mục tiêu sẽ được tính từ ngày Lệnh Chuyển Đổi Quỹ được thực hiện.  \nMức giá dịch vụ chuyển đổi của Quỹ như sau:  \n|  Thời gian nắm giữ CCQ | Giá dịch vụ chuyển đổi (% giá trị lệnh bán)  |\n| --- | --- |\n|  0 đến dưới 6 tháng | 1,00%  |\n|  Từ tròn 6 đến tròn 9 tháng | 0,75%  |\n|  Từ trên 9 đến tròn 12 tháng | 0,50%  |', 'Mức giá dịch vụ chuyển đổi của Quỹ như sau:  \n|  Thời gian nắm giữ CCQ | Giá dịch vụ chuyển đổi (% giá trị lệnh bán)  |\n| --- | --- |\n|  0 đến dưới 6 tháng | 1,00%  |\n|  Từ tròn 6 đến tròn 9 tháng | 0,75%  |\n|  Từ trên 9 đến tròn 12 tháng | 0,50%  |\n|  Từ trên 12 tháng trở lên | 0,00%  |  \nKhi thực hiện chuyển đổi, Nhà Đầu Tư chỉ thanh toán Giá dịch vụ Chuyển Đổi trên giá trị đăng ký chuyển đổi, mà không phải thanh toán Giá dịch vụ Mua Lại đối với Quỹ hiện tại và Giá dịch vụ Phát Hành đối với Quỹ mục tiêu.  \nCác khoản thuế giao dịch, giá dịch vụ chuyển tiền ngân hàng, nếu có, sẽ được khấu trừ vào số tiền thu được từ Lệnh Bản trong Lệnh Chuyển Đổi. Thời gian nắm giữ Đơn Vị Quỹ của Quỹ mục tiêu sẽ được tính từ ngày Lệnh Chuyển Đổi Quỹ được thực hiện.', '## 3.7. Rủi ro tái đầu tư\n. Rủi ro tái đầu tư của danh mục đầu tư trái phiếu được quản trị thông qua việc theo dõi kỳ vọng lãi suất thể hiện trên đường cong lợi suất và kỳ hạn của danh mục đầu tư trái phiếu.', 'Giá dịch vụ Mua lại và các khoản giá dịch vụ ngân hàng và thuế khác (nếu có) sẽ được trừ vào khoản tiền thu được từ bản Đơn Vị Quỹ của Nhà Đầu Tư.  \nGiá dịch vụ Mua lại cho tất cả các Chương trình được TCC ấn định và công bố bằng văn bản thông báo tại từng thời kỳ nhưng không quá 3,0% (ba phần trăm) giá trị của Lệnh Bản. Thời điểm áp dụng mức giá dịch vụ mới tăng sớm nhất là 60 ngày kể từ ngày Công ty Quản Lý Quỹ công bố về mức giá dịch vụ mới trên trang thông tin điện tử của Công ty.  \nMức giá dịch vụ mua lại của Quỹ như sau:  \n|  Thời gian nắm giữ CCQ | Giá dịch vụ mua lại (% giá trị lệnh bán)  |\n| --- | --- |\n|  0 đến dưới 6 tháng | 1,00%  |\n|  Từ tròn 6 đến tròn 9 tháng | 0,75%  |\n|  Từ trên 9 đến tròn 12 tháng | 0,50%  |\n|  Từ trên 12 tháng trở lên | 0,00%  |', '|  Từ trên 9 đến tròn 12 tháng | 0,50%  |\n|  Từ trên 12 tháng trở lên | 0,00%  |  \nTrường hợp Nhà Đầu Tư mua Chứng Chỉ Quỹ nhiều lần, mua theo Chương Trình ĐTĐK hoặc dưới hình thức tái đầu tư bằng nguồn cổ tức của Quỹ không phải chịu Giá dịch vụ phát hành, ưu tiên bán được thực hiện theo nguyên tắc các Chứng Chỉ Quỹ mua trước sẽ được bán trước, không phân biệt chứng chỉ quỹ mua theo lệnh mua bình thường hay Chương Trình ĐTĐK hay hình thức tái đầu tư bằng nguồn cổ tức.  \nCông Ty Quản Lý Quỹ có quyền thay đổi Giá dịch vụ Mua lại nhưng không được vượt quá mức quy định của pháp luật. Mức Giá dịch vụ Mua lại mới sẽ được Công Ty Quản Lý Quỹ thông báo chi tiết tại trang thông tin điện tử của Quỹ và tại các địa điểm phân phối của các Đại Lý Phân Phối.', '## 3.7. Rủi ro tái đầu tư\nRủi ro tái đầu tư là rủi ro đặc thù của các khoản đầu tư trái phiếu với dòng tiền từ lãi trái phiếu nhận được hàng kỳ và gốc trái phiếu nhận được vào thời điểm đáo hạn được đem đi tái đầu tư nhằm thu lợi nhuận (lãi-trên-lãi). Rủi ro tái đầu tư phát sinh khi mặt bằng lãi suất tại thời điểm tái đầu tư thấp hơn so với lãi suất kỳ vọng trước đó. Ngoài ra, một số chứng khoán có thu nhập cố định được phát hành kèm theo quyền cho phép người phát hành mua lại chứng khoán đó trước hạn, thường là khi lãi suất thị trường có xu hướng giảm. Điều này khiến Quỹ có thể phải đối mặt với rủi ro tái đầu tư phần tiền thu hồi tại mức sinh lợi thấp hơn, do đó làm giảm thu nhập từ lãi của Quỹ']","Rủi ro lãi suất ảnh hưởng đến giá trị các công cụ nợ và tiền gửi. Khi lãi suất thị trường tăng, giá trị các công cụ nợ thường giảm, làm ảnh hưởng đến NAV của quỹ."
Hạn mức đầu tư vào cổ phiếu chưa niêm yết của quỹ được quy định tối đa là bao nhiêu phần trăm?,"Theo thông tin từ các nguồn cung cấp, tôi không tìm thấy hạn mức cụ thể về việc đầu tư vào cổ phiếu chưa niêm yết của quỹ trong tài liệu. Tuy nhiên, thông thường, các quỹ đầu tư có quy định rất chặt chẽ về tỷ lệ đầu tư vào các loại tài sản khác nhau để đảm bảo rủi ro được kiểm soát.

Nếu bạn cần thông tin chính xác, tôi khuyên bạn nên tham khảo Điều lệ Quỹ hoặc Bản cáo bạch cụ thể của quỹ đó. Thông thường, các hạn mức này sẽ được nêu rõ trong các tài liệu pháp lý và công bố của quỹ.

Thông tin này được lấy từ trang [46-53] của tài liệu.","['## 2.2.4 Hạn mức đầu tư\nHạn mức đầu tư của Quỹ được quy định chi tiết tuân thủ các quy định tại Thông tư hướng dẫn hoạt động và quản lý các quỹ đầu tư chứng khoán. Cơ cấu danh mục đầu tư của Quỹ phải bảo đảm tuân thủ các hạn mức đầu tư sau:  \na) Trừ tiền gửi trên tài khoản thanh toán của quỹ tại ngân hàng giám sát, quỹ mở không được đầu tư quá 49% tổng giá trị tài sản của quỹ vào các tài sản theo quy định tại điểm a, b mục IX.2.2.3  \nb) Không được đầu tư vào chứng khoán của một tổ chức phát hành quá 10% tổng giá trị chứng khoán đang lưu hành của tổ chức đó, trừ công cụ nợ của Chính phủ;  \nc) Không được đầu tư quá 20% tổng giá trị tài sản của quỹ vào chứng khoán đang lưu hành và các tài sản (nếu có) quy định tại điểm a, b mục IX.2.2.3 của một tổ chức phát hành, trừ công cụ nợ của Chính phủ;', '## f) Lệnh Mua Tối Thiểu\nMức đầu tư tối thiểu (tính theo giá trị Lệnh Mua) là 10.000 VND (Mười nghìn đồng)  \nKhông có mức giới hạn đầu tư tối đa cho Nhà Đầu Tư. Công Ty Quản Lý Quỹ bảo lưu quyền thay đổi các giới hạn đầu tư trên trong từng thời điểm và sẽ thông báo về các thay đổi này.', 'ii. Không được đầu tư quá ba mươi phần trăm (30%) tổng giá trị tài sản của quỹ vào các tài sản quy định tại điểm i, ii, iv, v và vi các loại tài sản Quỹ được phép đầu tư, phát hành bởi một công ty hoặc một nhóm công ty có quan hệ sở hữu với nhau, trong đó phần đầu tư vào chứng khoán phái sinh tính bằng giá trị cam kết của hợp đồng xác định theo quy định tại Phụ lục 4 Điều lệ Quỹ.  \niii. Không được đầu tư quá 20% (hai mươi phần trăm) tổng giá trị tài sản của Quỹ vào chứng khoán đang lưu hành và các tài sản (nếu có) quy định tại điểm i, ii các loại tài sản Quỹ được phép đầu tư của một tổ chức phát hành, trừ Công cụ nợ của Chính phủ;', 'Mức đầu tư tối thiểu (tính theo giá trị Lệnh Mua) là 10.000 VNĐ (Mười nghìn đồng)  \nKhông có mức giới hạn đầu tư tối đa cho Nhà Đầu Tư. Công Ty Quản Lý Quỹ bảo lưu quyền thay đổi các giới hạn đầu tư trên trong từng thời điểm và sẽ thông báo về các thay đổi này.', '## 2.2.4 Hạn mức đầu tư\ne) Tổng giá trị các hạng mục đầu tư lớn trong danh mục đầu tư của quỹ không được vượt quá 40% tổng giá trị tài sản của quỹ. Trong đó, hạng mục đầu tư lớn của quỹ là hạng mục đầu tư vào các loại tài sản quy định tại điểm b, d, đ và g mục IX.2.2.3 (ngoại trừ chứng chỉ tiền gửi) phát hành bởi cùng một tổ chức, có tổng giá trị chiếm từ 5% trở lên tổng giá trị tài sản của quỹ;  \ng) Tại mọi thời điểm, tổng giá trị cam kết trong các giao dịch chứng khoán phải sinh, dư nợ vay và các khoản phải trả của quỹ không được vượt quá giá trị tài sản ròng của quỹ;  \nh) Không được đầu tư vào chứng chỉ quỹ của chính quỹ đó;  \ni) Chỉ được đầu tư vào chứng chỉ quỹ đại chúng khác, công ty đầu tư chứng khoán đại chúng do công ty quản lý quỹ khác quản lý và bảo đảm các hạn chế sau:', '## 2.2.4 Hạn mức đầu tư\n- Không đầu tư vào quá 10% tổng số chứng chỉ quỹ đang lưu hành của một quỹ đại chúng, cổ phiếu đang lưu hành của một công ty đầu tư chứng khoán đại chúng;\n- Không đầu tư quá 20% tổng giá trị tài sản của quỹ vào chứng chỉ quỹ của một quỹ đại chúng, cổ phiếu của một công ty đầu tư chứng khoán đại chúng;\n- Không đầu tư quá 30% tổng giá trị tài sản của quỹ vào các chứng chỉ quỹ đại chúng, cổ phiếu công ty đầu tư chứng khoán đại chúng;  \nk) Không được đầu tư trực tiếp vào bất động sản, đá quý, kim loại quý hiếm;  \nl) Phải có chứng khoán của ít nhất 06 tổ chức phát hành.', '## 2. Điều lệ Quỹ tóm tắt\nSố lượng chứng chỉ quỹ/tổng chứng chỉ quỹ được phép lưu hành tối đa: không hạn chế.  \nViệc thay đổi giá trị tài sản huy động tối đa hoặc số lượng chứng chỉ quỹ huy động tối đa phải do Đại hội nhà đầu tư quyết định và phải thông báo cho Ủy ban Chứng khoán Nhà nước.', '## 2.2.4 Hạn mức đầu tư\nd) Không được đầu tư quá 30% tổng giá trị tài sản của quỹ vào các tài sản quy định tại điểm a, b, d, đ và e mục IX.2.2.3, phát hành bởi các công ty trong cùng một nhóm công ty có quan hệ sở hữu với nhau thuộc các trường hợp sau đây: công ty mẹ, công ty con; các công ty sở hữu trên 35% cổ phần, phần vốn góp của nhau; nhóm công ty con có cùng một công ty mẹ. Trong đó phần đầu tư vào chứng khoán phải sinh tính bằng giá trị cam kết của hợp đồng xác định theo quy định tại Phụ lục 4 Điều lệ Quỹ;  \nđ) Không được đầu tư quá 10% tổng giá trị tài sản của quỹ vào các tài sản quy định tại điểm đ mục IX.2.2.3;', '- Không đầu tư quá 30% tổng giá trị tài sản của quỹ vào các chứng chỉ quỹ đại chúng, cổ phiếu công ty đầu tư chứng khoán đại chúng;  \nxi. Quỹ chỉ được đầu tư tiền gửi, công cụ tiền tệ quy định tại điểm i và ii các loại tài sản Quỹ được phép đầu tư được phát hành bởi các tổ chức tín dụng trong danh sách đã được Ban Đại Diện Quỹ phê duyệt bằng văn bản hoặc thông qua bỏ phiếu điện tử (e-voting) tuân thủ theo các Quy định Pháp luật hiện hành.  \nCơ cấu đầu tư của Quỹ được phép sai lệch so với các hạn chế được đưa ra tại điểm i, ii, iii, iv, v, vi và ix nếu trên nhưng chỉ vì các lý do sau:  \n- Biến động giá trên thị trường của các tài sản trong danh mục đầu tư của Quỹ;  \n- Thực hiện các khoản thanh toán phù hợp với Pháp Luật của Quỹ;  \n- Thực hiện các lệnh giao dịch của Nhà Đầu Tư;', 'Theo quy định hiện hành, nếu Quỹ không thể huy động được ít nhất là 50.000.000.000 VNĐ (năm mươi tỷ đồng) hoặc có ít hơn 100 (một trăm) Nhà Đầu Tư không chuyên nghiệp vào thời điểm kết thúc IPO hoặc thời gian được gia hạn (nếu có), UBCKNN sẽ không cấp Giấy chứng nhận đăng ký lập quỹ cho Quỹ. Trong trường hợp này, tất cả số tiền nhận được từ các Nhà Đầu Tư trong thời gian IPO cùng với lãi phát sinh nếu có sẽ được hoàn trả vào tài khoản đăng ký của Nhà Đầu Tư trong vòng 15 (mười lăm ngày) kể từ ngày kết thúc đợt IPO. Công Ty Quản Lý Quỹ sẽ chịu tất cả các chi giá dịch vụ phát sinh từ đợt IPO trong trường hợp này.  \n49', 'iv. Không được đầu tư vào chứng khoán của một tổ chức phát hành quá 10,0% (mười phần trăm) tổng giá trị chứng khoán đang lưu hành của tổ chức đó, trừ trái phiếu chính phủ;  \nv. Không được đầu tư quá mười phần trăm (10%) tổng giá trị tài sản của Quỹ vào các tài sản quy định tại điểm v các loại tài sản Quỹ được phép đầu tư;  \nvi. Tổng giá trị các hạng mục đầu tư lớn trong danh mục đầu tư của quỹ không được vượt quá 40% tổng giá trị tài sản của quỹ. Trong đó, hạng mục đầu tư lớn của quỹ là hạng mục đầu tư vào các loại tài sản quy định tại điểm ii, iv, v và vi các loại tài sản Quỹ được phép đầu tư (ngoại trừ chứng chỉ tiền gửi) phát hành bởi cùng một tổ chức, có tổng giá trị chiếm từ 5% trở lên tổng giá trị tài sản của quỹ;  |', '## Lĩnh vực được phép đầu tư\nđ) Cổ phiếu chào bán lần đầu ra công chúng, trái phiếu chào bán ra công chúng; trái phiếu doanh nghiệp phát hành riêng lẻ bởi tổ chức niêm yết có bảo lãnh thanh toán của tổ chức tín dụng hoặc cam kết mua lại của tổ chức phát hành tối thiểu 1 lần trong 12 tháng và mỗi lần cam kết mua lại tối thiểu 30% giá trị đợt phát hành;  \ne) Chứng khoán phải sinh niêm yết giao dịch tại Sở giao dịch chứng khoán và chỉ nhằm mục tiêu phòng ngừa rủi ro cho chứng khoán cơ sở mà quỹ đang nắm giữ;  \ng) Quyền phát sinh gắn liền với chứng khoán mà quỹ đang nắm giữ.  \nViệc đầu tư vào các tài sản quy định tại điểm đ khoản 2.2.3 Điều này phải đáp ứng các điều kiện sau:  \n- Có quy định tại Điều lệ quỹ và Bản cáo bạch;', '## 2.2.5 Điều chỉnh danh mục đầu tư\nCơ cấu đầu tư của quỹ mở chỉ được vượt mức so với các hạn chế đầu tư đã quy định tại điểm a, b, c, d, đ, e và i mục IX.2.2.4 và chỉ do các nguyên nhân sau:  \na) Biến động giá trên thị trường của tài sản trong danh mục đầu tư của quỹ;  \nb) Thực hiện các khoản thanh toán của quỹ theo quy định của pháp luật, bao gồm việc thực hiện lệnh giao dịch của nhà đầu tư;', 'Sau khi hoàn thành đợt IPO, Công Ty Quản Lý Quỹ sẽ đăng ký xin giấy chứng nhận đăng ký thành lập Quỹ với UBCKNN nếu có ít nhất 100 (một trăm) Nhà Đầu Tư không chuyên nghiệp đầu tư vào Quỹ và tổng vốn đầu tư vào Quỹ đạt tối thiểu 50.000.000.000 VNĐ (năm mươi tỷ đồng). Khi nhận Giấy phép đăng ký, Ngân Hàng Giám Sát sẽ giải toả tài khoản ký quỹ của Quỹ đó để Quỹ có thể bắt đầu đầu tư. Dự kiến Ngày Giao Dịch đầu tiên sẽ trong vòng 30 (ba mươi) ngày kể từ ngày Giấy chứng nhận đăng ký lập quỹ có hiệu lực.  \nXác nhận đầu tư sẽ được gửi cho Nhà Đầu Tư trong vòng 05 (năm) ngày kể từ ngày Quỹ có được Giấy chứng nhận đăng ký thành lập từ UBCKNN.', '## Lĩnh vực được phép đầu tư\nVới chiến lược đầu tư như đã đề cập ở trên, cơ cấu danh mục đầu tư của Quỹ có thể thay đổi theo thời gian dựa theo tiềm năng tăng trưởng của cổ phiếu và tùy vào mức độ thanh khoản của các cổ phiếu trên thị trường. Tỷ trọng các khoản đầu tư không vượt quá những hạn chế đầu tư quy định tại mục “Hạn chế đầu tư”.', '- Thực hiện các lệnh giao dịch của Nhà Đầu Tư;  \n- Các hoạt động sáp nhập, hợp nhất của các tổ chức phát hành các chứng khoán mà Quỹ đang nắm giữ;  \n- Quỹ mới được cấp phép thành lập hoặc do tách Quỹ, hợp nhất Quỹ, sát nhập Quỹ mà thời gian hoạt động không quá sáu (06) tháng, tính từ ngày được cấp giấy chứng nhận đăng ký lập Quỹ;  \n- Quỹ đang trong thời gian giải thể.  \nTrong trường hợp xảy ra sai lệch so với các hạn mức đầu tư, Công ty Quản Lý Quỹ sẽ điều chỉnh danh mục đầu tư để đáp ứng các hạn mức đầu tư kể trên trong vòng 3 (ba) tháng kể từ ngày mà sai lệch phát sinh.', '## Lĩnh vực được phép đầu tư\nDanh mục đầu tư của quỹ phải phù hợp với mục tiêu và chính sách đầu tư đã được quy định tại Điều lệ quỹ và công bố tại Bản cáo bạch. Danh mục đầu tư của quỹ đầu tư bao gồm các loại tài sản sau đây:  \na) Tiền gửi các ngân hàng thương mại theo quy định của pháp luật ngân hàng;  \nb) Công cụ thị trường tiền tệ bao gồm giấy tờ có giá, công cụ chuyển nhượng theo quy định của pháp luật;  \nc) Công cụ nợ của Chính phủ, trái phiếu được Chính phủ bảo lãnh, trái phiếu chính quyền địa phương;  \nd) Cổ phiếu niêm yết, cổ phiếu đăng ký giao dịch, trái phiếu niêm yết trên Sở giao dịch chứng khoán, chứng chỉ quỹ đại chúng;', '|  Số lượng đơn vị quỹ dự kiến phát hành: | 5.000.000 Đơn Vị Quỹ  |\n| --- | --- |\n|  Thời gian phát hành: | Được đề cập trong thông báo phát hành lần đầu ra công chúng  |\n|  Mệnh giá: | 10.000 đồng một Đơn Vị Quỹ  |\n|  Đồng tiền sử dụng và trình bày: | Đồng (VNĐ)  |\n|  Giá phát hành: | 10.000 VNĐ  |\n|  Phương thức phân bổ chứng chỉ quỹ lần đầu | = Tổng số tiền đầu tư ban đầu/ Giá phát hành  |  \nCác Nhà Đầu Tư muốn đầu tư vào Quỹ phải hoàn thành và nộp Đơn Đăng Ký cho Đại Lý Phân Phối theo các quy trình và hướng dẫn trong lần chào bán lần đầu ra công chúng.  \nMức đầu tư đăng ký tối thiểu (tính theo giá trị Lệnh Mua) của Nhà Đầu Tư là 10.000 VNĐ (Mười ngàn Việt Nam đồng)', '## 2. Thông tin về đợt phát hành lần đầu ra công chúng\nNgoài ra, để đảm bảo tối ưu hóa lợi ích của nhà đầu tư, Quỹ có sự linh hoạt trong phân bổ tài sản tùy thuộc vào cơ hội đầu tư sẵn có tại các thời điểm khác nhau. Việc phân bổ tài sản có thể thay đổi đáng kể tùy thuộc vào nhận định của Quỹ, với mục tiêu xuyên suốt trong toàn bộ thời gian hoạt động của Quỹ là bảo vệ lợi ích của Nhà Đầu Tư.  \nVới chiến lược đầu tư như đã đề cập ở trên, cơ cấu danh mục đầu tư của Quỹ có thể thay đổi theo thời gian dựa theo tiềm năng tăng trưởng của cổ phiếu và tùy vào mức độ thanh khoản của các cổ phiếu trên thị trường. Tỷ trọng các khoản đầu tư không vượt quá những hạn chế đầu tư quy định tại mục “Hạn chế đầu tư”.  \nCác loại tài sản mà quỹ được đầu tư bao gồm:\ni. Tiền gửi tại các ngân hàng thương mại theo quy định của pháp luật về  |  \n46', 'Nhà Đầu Tư có thể thanh toán số tiền mua Đơn Vị Quỹ từ tài khoản ngân hàng của mình vào tài khoản của Quỹ để Ngân Hàng Giám Sát nhận được đúng hạn và Đại Lý Phân Phối hoàn thành xử lý việc đăng ký với Đại Lý Chuyển Nhượng. Mọi khoản đầu tư vào Đơn Vị Quỹ đều thực hiện bằng tiền Đồng Việt Nam.  \nTrong trường hợp lệnh mua chứng chỉ quỹ và việc thanh toán cho lệnh mua được thực hiện bởi cá nhân, tổ chức khác không phải nhà đầu tư thì phiếu lệnh và tài liệu xác nhận thanh toán phải nêu rõ tên, số tài khoản và giá trị thanh toán của nhà đầu tư được hưởng lợi.', '## 2. Điều lệ Quỹ tóm tắt\nCơ quan quyền lực cao nhất của Quỹ là Đại hội Nhà Đầu tư.  \nBan Đại diện Quỹ sẽ do Đại hội Nhà Đầu tư bầu ra để giám sát các hoạt động thường xuyên của Quỹ, TCC và Ngân hàng giám sát.  \n#### 2.1.2 Tổng vốn huy động và số lượng chứng chỉ Quỹ được chào bán  \nVốn Điều lệ được huy động trong lần đầu chào bán ra công chúng của Quỹ là 50.000.000.000 VNĐ (Năm mươi tỷ đồng). Vốn Điều lệ sẽ được chia thành 5.000.000 (Năm triệu) Chứng chỉ Quỹ. Mệnh giá của một Chứng chỉ Quỹ sẽ là 10.000 VNĐ (mười nghìn Đồng Việt Nam).  \nNhà đầu tư góp vốn bằng tiền Đồng Việt Nam dưới hình thức chuyển khoản hoặc chuyển tiền vào tài khoản của Quỹ mở tại ngân hàng giám sát.  \nSố lượng chứng chỉ quỹ/tổng chứng chỉ quỹ được phép lưu hành tối đa: không hạn chế.', 'Trong trường hợp Quỹ nhận được số tiền mua thấp hơn lệnh đăng ký mua và không nhận được yêu cầu chuyển trả từ khách hàng, số tiền mua sẽ tiếp tục được giữ lại để chờ yêu cầu giao dịch tiếp theo từ khách hàng.  \nTrong trường hợp Nhà Đầu Tư có nhiều lệnh mua Chứng Chỉ Quỹ cùng một lúc, Lệnh Mua Chứng Chỉ Quỹ sẽ được ưu tiên theo thứ tự đặt lệnh.  \nPhí/giá dịch vụ chuyển tiền (nếu có) được trừ vào số tiền hoàn trả cho Nhà Đầu Tư. Đơn Vị Quỹ sẽ chỉ được ghi nhận vào tài khoản của Nhà Đầu Tư hay của Đại Lý Kỷ Danh sau khi có kết quả giao dịch chứng chỉ quỹ.', 'Nhà Đầu Tư nên tham khảo ý kiến của chuyên gia tư vấn riêng của mình để đảm bảo Nhà Đầu Tư đủ điều kiện để đầu tư vào Quỹ theo các quy định pháp luật áp dụng cho họ và liệu Quỹ có phù hợp với khả năng chấp nhận rủi ro của họ hay không.', '## 3. Các rủi ro khi đầu tư vào Quỹ\nMục tiêu của Công Ty Quản Lý Quỹ là quản lý các rủi ro đầu tư, và nếu có thể, hạn chế tác động của các rủi ro này bằng việc áp dụng các phương pháp quản lý đầu tư theo tiêu chuẩn quốc tế tốt nhất. Nhà Đầu Tư cần lưu ý các điểm quan trọng sau đây:  \n- Quỹ, Công Ty Quản Lý Quỹ, thành viên Hội đồng thành viên, ban điều hành và nhân viên Công Ty Quản Lý Quỹ không có bất kỳ sự đảm bảo nào đối với vốn đầu tư ban đầu cũng như mức lợi nhuận từ đầu tư của Quỹ;\n- Không có bất kỳ sự bảo đảm nào về sổ lẫn chi trả và giá trị của cổ tức được thanh toán trong tương lai;  \n42', '- Việc thực hiện tất cả các lệnh giao dịch của Nhà Đầu Tư tại Ngày Giao Dịch dẫn đến NAV của Quỹ thấp hơn 50.000.000.000 đồng (năm mươi tỷ đồng); hoặc Giá trị phần đơn vị quỹ hoặc số đơn vị quỹ còn lại trên tài khoản của nhà đầu tư thấp hơn giá trị tối thiểu hoặc số lượng đơn vị quỹ tối thiểu để duy trì tài khoản của nhà đầu tư theo quy định tại Điều lệ quỹ và Bán cáo bạch.\n- Trường hợp thực hiện một phần Lệnh Bán, Lệnh mua, Lệnh Chuyến Đổi Quỹ theo quy định nêu trên, Công ty Quản Lý Quỹ áp dụng nguyên tắc phân phối cùng tỷ lệ: Phần giá trị được thực hiện sẽ được phân bổ cho tất cả nhà đầu tư đăng ký giao dịch theo cùng một tỷ lệ giữa giá trị thực hiện và giá trị đăng ký giao dịch.  \nSố lượng chứng chỉ quỹ được thực hiện trong trường hợp này được tính như sau:']","Quỹ không được đầu tư quá 20% tổng giá trị tài sản ròng vào các chứng khoán chưa niêm yết, trừ công cụ nợ Chính phủ."
"Trong trường hợp xảy ra tranh chấp, cơ quan nào sẽ đứng ra giải quyết theo quy định của Bản cáo bạch?","Theo bản cáo bạch, không có thông tin cụ thể về cơ quan hoặc tổ chức được chỉ định để giải quyết các tranh chấp. Tuy nhiên, thông thường trong các tài liệu như Bản cáo bạch này, sẽ có một phần quy định về cách xử lý tranh chấp và trách nhiệm của các bên liên quan.

Nếu không tìm thấy thông tin đó trong tài liệu.
(Source: Trang 64)","['## Lĩnh vực được phép đầu tư\n- Có quy định tại Điều lệ quỹ và Bản cáo bạch;\n- Đã được Ban đại diện quỹ chấp thuận bằng văn bản về loại, mã chứng khoán, số lượng, giá trị giao dịch, thời điểm thực hiện;\n- Có đủ tài liệu chứng minh về bảo lãnh thanh toán hoặc tài liệu về cam kết mua lại của tổ chức phát hành.', '## THÔNG BÁO QUAN TRỌNG\nBản Cáo Bạch này và Các Đơn Vị Quỹ chưa được đăng ký ở bất kỳ lãnh thổ tài phán nào ngoài Việt Nam. Việc công bố Bản Cáo Bạch này tại một số lãnh thổ tài phán có thể bị hạn chế hoặc phải tuân thủ các yêu cầu về đăng ký. Theo đó ở một số nước, người đọc Bản Cáo Bạch cần phải hiểu và phải tuân thủ các hạn chế đó. Người nhận được Bản Cáo Bạch này hoặc bất kỳ Đơn Đăng Ký nào tại lãnh thổ tài phán nói trên không được coi Bản Cáo Bạch này hay Đơn Đăng Ký cấu thành bản chào mua Đơn Vị Quỹ hay sử dụng Đơn Đăng Ký trong bất kỳ trường hợp nào, trừ khi tại lãnh thổ tài phán đó bản chào như thế tới họ có thể được coi là hợp pháp và Đơn Đăng Ký có thể được sử dụng một cách hợp pháp mà không cần phải tuân thủ bất kỳ yêu cầu đăng ký hoặc yêu cầu pháp lý nào khác.', '1  \nỦy ban Chứng khoán Nhà nước cấp giấy phép phát hành chứng chỉ quỹ ra công chúng có nghĩa là việc xin phép lập Quỹ và phát hành chứng chỉ quỹ đầu tư đã thực hiện theo các quy định của pháp luật liên quan, không hàm ý bảo đảm về nội dung của Bản cáo bạch cũng như mục tiêu, chiến lược đầu tư của Quỹ.', '## 1. Công ty quản lý quỹ\nBà Nguyễn Thị Thu Hiền\nChức vụ: Chủ tịch Hội đồng quản trị  \nÔng Đặng Lưu Dũng\nChức vụ: Tổng Giám đốc  \nBà Phan Thị Thu Hằng\nChức vụ: Kế toán trưởng  \nChúng tôi đảm bảo rằng các thông tin và số liệu trong Bản Cáo Bạch này là phù hợp với thực tế mà chúng tôi được biết, hoặc đã điều tra, thu thập một cách hợp lý. Tuy vậy, thông tin trong Bản Cáo Bạch này chưa được thẩm định bởi bất kỳ bên nào khác ngoại trừ như được đề cập tại Bản Cáo Bạch này.', '## Lĩnh vực được phép đầu tư\nđ) Cổ phiếu chào bán lần đầu ra công chúng, trái phiếu chào bán ra công chúng; trái phiếu doanh nghiệp phát hành riêng lẻ bởi tổ chức niêm yết có bảo lãnh thanh toán của tổ chức tín dụng hoặc cam kết mua lại của tổ chức phát hành tối thiểu 1 lần trong 12 tháng và mỗi lần cam kết mua lại tối thiểu 30% giá trị đợt phát hành;  \ne) Chứng khoán phải sinh niêm yết giao dịch tại Sở giao dịch chứng khoán và chỉ nhằm mục tiêu phòng ngừa rủi ro cho chứng khoán cơ sở mà quỹ đang nắm giữ;  \ng) Quyền phát sinh gắn liền với chứng khoán mà quỹ đang nắm giữ.  \nViệc đầu tư vào các tài sản quy định tại điểm đ khoản 2.2.3 Điều này phải đáp ứng các điều kiện sau:  \n- Có quy định tại Điều lệ quỹ và Bản cáo bạch;', '## 2. Điều lệ Quỹ tóm tắt\nCơ quan quyền lực cao nhất của Quỹ là Đại hội Nhà Đầu tư.  \nBan Đại diện Quỹ sẽ do Đại hội Nhà Đầu tư bầu ra để giám sát các hoạt động thường xuyên của Quỹ, TCC và Ngân hàng giám sát.  \n#### 2.1.2 Tổng vốn huy động và số lượng chứng chỉ Quỹ được chào bán  \nVốn Điều lệ được huy động trong lần đầu chào bán ra công chúng của Quỹ là 50.000.000.000 VNĐ (Năm mươi tỷ đồng). Vốn Điều lệ sẽ được chia thành 5.000.000 (Năm triệu) Chứng chỉ Quỹ. Mệnh giá của một Chứng chỉ Quỹ sẽ là 10.000 VNĐ (mười nghìn Đồng Việt Nam).  \nNhà đầu tư góp vốn bằng tiền Đồng Việt Nam dưới hình thức chuyển khoản hoặc chuyển tiền vào tài khoản của Quỹ mở tại ngân hàng giám sát.  \nSố lượng chứng chỉ quỹ/tổng chứng chỉ quỹ được phép lưu hành tối đa: không hạn chế.', 'ngược lại;  \n- Ngân hàng giám sát, thành viên Hội đồng quản trị, người điều hành và nhân viên của ngân hàng giám sát làm nhiệm vụ giám sát hoạt động và bảo quản tài sản của quỹ đại chúng, công ty đầu tư chứng khoán không được là đối tác mua, bán trong giao dịch mua, bán tài sản của quỹ đại chúng, công ty đầu tư chứng khoán.\n- Có đầy đủ năng lực cung cấp dịch vụ giám sát, lưu ký;\n- Thực hiện các cam kết đối với Quỹ như nêu tại Phụ lục 2 và Phụ lục 3 của Điều lệ Quỹ.  \nCác quy định về quyền và nghĩa vụ, hoạt động giám sát và chấm dứt quyền và nghĩa vụ của Ngân hàng giám sát tuân thủ theo quy định tại chương VII Điều lệ Quỹ.', '## e) Thực Hiện Một Phần Lệnh Bán\nTrong các trường hợp sau, Quỹ chỉ có thể thực hiện một phần Lệnh Bán và Chuyến Đổi Quỹ của Nhà Đầu Tư:  \n- Tổng giá trị của các Lệnh Bán (bao gồm cả Lệnh Bán từ hoạt động Chuyến Đổi Quỹ) trừ đi tổng giá trị của tất cả các Lệnh Mua (bao gồm cả Lệnh Mua từ hoạt động Chuyến Đổi Quỹ) tại Ngày Giao Dịch lớn hơn 10% của giá trị tài sản ròng của Quỹ (NAV); hoặc\n- Việc thực hiện tất cả các lệnh giao dịch của Nhà Đầu Tư tại Ngày Giao Dịch dẫn đến NAV của Quỹ thấp hơn 50.000.000.000 đồng (năm mươi tỷ đồng); hoặc Giá trị phần đơn vị quỹ hoặc số đơn vị quỹ còn lại trên tài khoản của nhà đầu tư thấp hơn giá trị tối thiểu hoặc số lượng đơn vị quỹ tối thiểu để duy trì tài khoản của nhà đầu tư theo quy định tại Điều lệ quỹ và Bán cáo bạch.', '“Bản Cáo Bạch”\ncó nghĩa là tài liệu này hoặc dữ liệu điện tử công khai thông tin chính xác, trung thực và khách quan liên quan đến việc chào bán và phát hành Chứng Chỉ Quỹ của Quỹ.  \n“Hợp Đồng Giám Sát”\ncó nghĩa là hợp đồng được ký kết giữa Công ty Quản Lý Quỹ và Ngân Hàng Giám Sát được thông qua bởi Đại Hội Nhà Đầu Tư.  \n“Nhà Đầu Tư”\nlà cá nhân, tổ chức trong nước và ngoài nước nắm giữ Chứng Chỉ Quỹ  \n“Đại Hội Nhà Đầu Tư”\nLà đại hội của Nhà Đầu Tư có quyền biểu quyết được tổ chức thường kỳ hoặc bất thường để thông qua các vấn đề quan trọng có liên quan đến Quỹ. Đại Hội Nhà Đầu Tư là cơ quan quyền lực cao nhất của Quỹ.  \n“Ban Đại Diện Quỹ”', '## 4. Phương pháp xác định giá trị tài sản ròng\nCác quy định khác về việc công bố giá trị tài sản ròng và tình hình giao dịch tuân thủ theo quy định của Pháp luật và Điều lệ Quỹ.', '## e) Thực Hiện Một Phần Lệnh Bán\n- Trường hợp thực hiện một phần Lệnh Bán, Lệnh mua, Lệnh Chuyến Đổi Quỹ theo quy định nêu trên, Công ty Quản Lý Quỹ áp dụng nguyên tắc phân phối cùng tỷ lệ: Phần giá trị được thực hiện sẽ được phân bổ cho tất cả nhà đầu tư đăng ký giao dịch theo cùng một tỷ lệ giữa giá trị thực hiện và giá trị đăng ký giao dịch.  \nSố lượng chứng chỉ quỹ được thực hiện trong trường hợp này được tính như sau:  \nSố lượng CCQ NĐT được thực hiện = Số lượng CCQ NĐT đăng ký bán * [Tổng số lượng CCQ mà CTQLQ có thể đáp ứng cho lệnh bán của NĐT/Tổng số lượng CCQ đăng ký bán trong kỳ]', '## THÔNG BÁO QUAN TRỌNG\nCác nhà đầu tư nên nghiên cứu Bản Cáo Bạch này một cách cẩn trọng và toàn diện và không nên coi nội dung hoặc các tóm tắt ở đây là các tư vấn liên quan đến pháp lý, thuế, hoặc tài chính/đầu tư và nên tham khảo ý kiến chuyên gia tư vấn của mình về các yêu cầu pháp lý hoặc các điều kiện hoặc bất kỳ các hạn chế nào khác liên quan đến việc đăng ký mua, mua, cho tặng, nắm giữ, định đoạt (chuyển nhượng; chuyển đổi quỹ hoặc bản hoặc chuyển đổi thành tiền) các Đơn Vị Quỹ, việc xử lý khoản thu nhập (nếu có), lợi nhuận đầu tư, hoặc các khoản phân phối lợi nhuận, các khoản thuế khác liên quan đến việc đăng ký mua, mua, cho tặng, nắm giữ, định đoạt (bản, chuyển giao, chuyển đổi quỹ hoặc bản hoặc chuyển đổi thành tiền) các Đơn Vị Quỹ trong phạm vi lãnh thổ tài phán áp dụng đối với quốc tịch, nơi cư trú', '## 2.2.5 Điều chỉnh danh mục đầu tư\nCơ cấu đầu tư của quỹ mở chỉ được vượt mức so với các hạn chế đầu tư đã quy định tại điểm a, b, c, d, đ, e và i mục IX.2.2.4 và chỉ do các nguyên nhân sau:  \na) Biến động giá trên thị trường của tài sản trong danh mục đầu tư của quỹ;  \nb) Thực hiện các khoản thanh toán của quỹ theo quy định của pháp luật, bao gồm việc thực hiện lệnh giao dịch của nhà đầu tư;', 'Quỹ đầu tư chứng khoán được mô tả trong Bản cáo bạch này là Quỹ được thành lập theo Luật Chứng khoán số 54/2019/QH14 được Quốc hội Nước Cộng hòa xã hội chủ nghĩa Việt Nam thông qua ngày 26 tháng 11 năm 2019 và các văn bản hướng dẫn thi hành. Bản cáo bạch này đã được đăng ký với Ủy ban Chứng khoán Nhà nước ngày / / 2022.', '## 3. Báo cáo bất thường\nCác báo cáo bất thường sẽ được cung cấp cho Nhà Đầu Tư trong trường hợp có những diễn biến hoặc hoạt động bất thường của Quỹ phát sinh, bao gồm nhưng không giới hạn bởi các báo cáo về việc phân phối lợi nhuận, báo cáo trước khi hợp nhất hoặc sáp nhập quỹ hay sau các quyết định của Đại Hội Nhà Đầu Tư ủy quyền cho Ban Đại Diện Quỹ.', 'e. Phụ Cấp Ban Đại Diện Quỹ  \nCác chi phí của Ban Đại Diện Quỹ bao gồm chi phí ăn ở, đi lại với mức hợp lý và phù hợp với các quy định tại Điều lệ Quỹ, các chi phí phát sinh từ hoạt động của Ban Đại Diện Quỹ để phục vụ cho lợi ích của Quỹ sẽ được tính vào chi phí của Quỹ. Để dễ hiểu, chi phí trên không bao gồm các chi phí bảo hiểm đối với trách nhiệm phát sinh cho Ban Đại Diện Quỹ khi thực hiện nghĩa vụ của Ban Đại Diện Quỹ. Thù lao của các thành viên của Ban Đại Diện Quỹ được tính vào chi phí hoạt động của Quỹ và tổng mức thù lao không được vượt quá tổng ngân sách hoạt động hàng năm của Ban Đại Diện đã được thông qua tại Đại Hội Nhà Đầu Tư.', '## 2.12. Kiểm toán, kế toán và chế độ báo cáo\nCông ty Quản Lý Quỹ có trách nhiệm duy trì sổ sách kế toán và chuẩn bị báo cáo tài chính cho Quỹ. Phù hợp với quy định tại Điều 38 của Điều Lệ Quỹ, Công ty Quản Lý Quỹ có thể ủy quyền cho một nhà cung cấp dịch vụ để thực hiện Công việc này. Mọi Sổ sách kế toán và báo cáo tài chính của Quỹ sẽ được lưu tại văn phòng của Công ty Quản Lý Quỹ hoặc của nhà cung cấp dịch vụ mà Công ty Quản Lý Quỹ ủy quyền. Ban Đại diện Quỹ có quyền kiểm tra bất kỳ báo cáo, sổ sách kế toán, hoặc tài liệu nào của Quỹ.  \nCác quy định khác liên quan đến kiểm toán, kế toán và chế độ báo cáo tuân thủ theo quy định tại Điều lệ Quỹ.', '## XV. CAM KẾT\nCông Ty Quản Lý Quỹ cam kết chịu hoàn toàn trách nhiệm về tính chính xác, trung thực của nội dung thông tin và các tài liệu đính kèm trong Bản cáo bạch này.', 'c) Hoạt động chia, tách, hợp nhất, sáp nhập các tổ chức phát hành;\nd) Quỹ mới được cấp phép thành lập hoặc do tách quỹ, hợp nhất quỹ, sáp nhập quỹ mà thời gian hoạt động chưa quá 06 tháng kể từ ngày được cấp Giấy chứng nhận đăng ký lập quỹ hoặc Giấy chứng nhận đăng ký lập quỹ điều chỉnh;\nđ) Quỹ đang trong thời gian giải thể.  \nTrong thời hạn 03 tháng kể từ ngày có các sai lệch phát sinh do các nguyên nhân quy định tại điểm a, b, c và d nêu trên, công ty quản lý quỹ có nghĩa vụ thông báo cho Ủy ban Chứng khoán Nhà nước và điều chỉnh lại cơ cấu danh mục đầu tư cho phù hợp với quy định tại mục IX.2.2.4.', '## THÔNG BÁO QUAN TRỌNG\nKhông người nào được ủy quyền để cung cấp bất kỳ thông tin hoặc đưa ra bất kỳ tuyên bố nào không được xác nhận trong Bản Cáo Bạch này liên quan đến đợt phát hành này hay việc phát hành các Đơn Vị Quỹ, và bất kỳ thông tin hoặc tuyên bố nào không có trong Bản Cáo Bạch này không được dựa vào như là đã được phê duyệt bởi TechcomCapital. Nhà Đầu Tư được yêu cầu phải kiểm tra các thông tin về uy tín của cá nhân/công ty mà mình ủy thác Đơn Đăng Ký và uy thác thanh toán cho bất kỳ giao dịch nào với Quỹ. Quỹ hoặc TechcomCapital không chịu trách nhiệm cho bất kỳ hành vi được thực hiện bởi các tổ chức trung gian đại diện cho hoặc được cho là đại diện cho Nhà Đầu Tư đó.', '- Việc thực hiện tất cả các lệnh giao dịch của Nhà Đầu Tư tại Ngày Giao Dịch dẫn đến NAV của Quỹ thấp hơn 50.000.000.000 đồng (năm mươi tỷ đồng); hoặc Giá trị phần đơn vị quỹ hoặc số đơn vị quỹ còn lại trên tài khoản của nhà đầu tư thấp hơn giá trị tối thiểu hoặc số lượng đơn vị quỹ tối thiểu để duy trì tài khoản của nhà đầu tư theo quy định tại Điều lệ quỹ và Bán cáo bạch.\n- Trường hợp thực hiện một phần Lệnh Bán, Lệnh mua, Lệnh Chuyến Đổi Quỹ theo quy định nêu trên, Công ty Quản Lý Quỹ áp dụng nguyên tắc phân phối cùng tỷ lệ: Phần giá trị được thực hiện sẽ được phân bổ cho tất cả nhà đầu tư đăng ký giao dịch theo cùng một tỷ lệ giữa giá trị thực hiện và giá trị đăng ký giao dịch.  \nSố lượng chứng chỉ quỹ được thực hiện trong trường hợp này được tính như sau:', '- Thực hiện các lệnh giao dịch của Nhà Đầu Tư;  \n- Các hoạt động sáp nhập, hợp nhất của các tổ chức phát hành các chứng khoán mà Quỹ đang nắm giữ;  \n- Quỹ mới được cấp phép thành lập hoặc do tách Quỹ, hợp nhất Quỹ, sát nhập Quỹ mà thời gian hoạt động không quá sáu (06) tháng, tính từ ngày được cấp giấy chứng nhận đăng ký lập Quỹ;  \n- Quỹ đang trong thời gian giải thể.  \nTrong trường hợp xảy ra sai lệch so với các hạn mức đầu tư, Công ty Quản Lý Quỹ sẽ điều chỉnh danh mục đầu tư để đáp ứng các hạn mức đầu tư kể trên trong vòng 3 (ba) tháng kể từ ngày mà sai lệch phát sinh.', 'Trong các trường hợp tạm dừng thực hiện các giao dịch Đơn Vị Quỹ, Lệnh Chuyển Đổi đã nhận sẽ được thực hiện tại NAV tại Ngày Giao Dịch đầu tiên sau khi giao dịch được thực hiện trở lại.  \n**g. Quy trình chuyển nhượng chứng chỉ quỹ**  \n- **Đơn Chuyển Nhượng**  \nNhà Đầu Tư có thể Chuyển Nhượng Đơn Vị Quỹ cho nhà đầu tư khác dưới dạng quà tặng, thừa kế hoặc thực hiện lệnh của toà án. Chuyển Nhượng chỉ được thực hiện dưới dạng số lượng Đơn  \n55', '# XII. XUNG ĐỘT LỢI ÍCH\nCông Ty Quản Lý Quỹ có nghĩa vụ, theo Điều lệ và theo thông lệ quốc tế tốt nhất, tại mọi thời điểm hoạt động vì lợi ích của Nhà Đầu Tư và quản lý một cách công bằng, minh bạch đối với tất cả các quỹ do Công ty quản lý. Bộ phận kiểm soát nội bộ và quản trị rủi ro của Công Ty sẽ chịu trách nhiệm theo dõi và giám sát các xung đột lợi ích thực tế hoặc có khả năng xảy ra. Trong trường hợp xung đột lợi ích phát sinh, Công ty Quản lý Quỹ sẽ thông báo cho Ban Đại Diện Quỹ để thống nhất phương án khắc phục nhằm giảm thiểu hoặc quản lý các xung đột đó.', 'Trường hợp sai lệch là do Công ty Quản Lý Quỹ không tuân thủ các hạn chế đầu tư theo quy định của Pháp Luật hoặc Điều lệ Quỹ, Công ty Quản Lý Quỹ có trách nhiệm điều chỉnh lại danh mục đầu tư trong thời hạn mười lăm (15) ngày, kể từ ngày phát sinh sai lệch. Trong trường hợp này, Công ty Quản Lý Quỹ phải chịu mọi chi phí phát sinh liên quan đến các giao dịch này và các tổn thất (nếu có phát sinh). Nếu phát sinh lợi nhuận, thì phải hạch toán ngay mọi khoản lợi nhuận có được cho Quỹ.']","Tranh chấp sẽ được ưu tiên giải quyết thông qua thương lượng, hòa giải. Nếu không thành, tranh chấp sẽ được đưa ra giải quyết tại Tòa án có thẩm quyền tại Việt Nam."
TCSME có được phép vay nợ để đầu tư không và hạn mức vay là bao nhiêu?,"Tôi không tìm thấy thông tin về việc TCSME có được phép vay nợ để đầu tư hay hạn mức vay cụ thể trong tài liệu đã cung cấp. 

Để đảm bảo chính xác, bạn nên kiểm tra thêm các điều khoản liên quan đến hoạt động tài chính và đầu tư của Quỹ tại các trang khác hoặc thông báo phát hành lần đầu ra công chúng.

Nếu có thông tin về hạn mức vay nợ để đầu tư, nó thường được quy định trong Điều lệ Quỹ hoặc các văn bản pháp lý liên quan. Tuy nhiên, không tìm thấy thông tin này trong tài liệu đã cung cấp.

(Nguồn: Trang 19-32)","['## 2.2.6 Hoạt động vay, cho vay, giao dịch mua bán lại và giao dịch ký quỹ\nCông ty Quản Lý Quỹ không được sử dụng vốn và tài sản của Quỹ để cho vay hoặc bảo lãnh cho bất kỳ khoản vay nào.  \nCông ty Quản Lý Quỹ không được phép vay để đầu tư, trừ trường hợp vay ngắn hạn theo quy định của pháp luật về ngân hàng để trang trải các chi phí cần thiết cho quỹ hoặc thực hiện thanh toán các giao dịch chứng chỉ quỹ với Nhà Đầu Tư. Tổng giá trị các khoản vay ngắn hạn của Quỹ không được quá 5% giá trị tài sản ròng của quỹ tại mọi thời điểm và thời hạn vay tối đa là 30 ngày.  \nCông ty Quản Lý Quỹ không được sử dụng tài sản của quỹ để thực hiện các giao dịch ký quỹ (vay mua chứng khoán) cho quỹ hoặc cho bất kỳ cá nhân, tổ chức khác; không được sử dụng tài sản của quỹ thực hiện các giao dịch bán khổng, cho vay chứng khoán.', '## 2. Ngân hàng giám sát\nNgân hàng TMCP Đầu tư và Phát triển Việt Nam - Chi nhánh Hà Thành  \nĐại diện hợp pháp: Ông Nguyễn Mạnh Cường  \nChức vụ: Phó Giám đốc  \nBản cáo bạch này là một phần của hồ sơ đăng ký chào bán của Công ty Cổ phần Quản lý quỹ Kỹ thương (Techcom Capital – “TCC”). Chúng tôi, với tư cách là Ngân hàng Giám sát của Quỹ Đầu Tư Cổ phiếu Doanh nghiệp vừa và nhỏ Techcom (TCSME) sẽ chịu trách nhiệm theo các quy định trong phạm vi Hợp Đồng Cung Cấp Dịch Vụ Giám Sát Quỹ được ký kết giữa chúng tôi với Công ty Cổ phần Quản lý quỹ Kỹ thương, là công ty quản lý Quỹ Đầu tư Cổ phiếu Doanh nghiệp vừa và nhỏ Techcom và theo quy định của pháp luật.', '## 2.2.4 Hạn mức đầu tư\nHạn mức đầu tư của Quỹ được quy định chi tiết tuân thủ các quy định tại Thông tư hướng dẫn hoạt động và quản lý các quỹ đầu tư chứng khoán. Cơ cấu danh mục đầu tư của Quỹ phải bảo đảm tuân thủ các hạn mức đầu tư sau:  \na) Trừ tiền gửi trên tài khoản thanh toán của quỹ tại ngân hàng giám sát, quỹ mở không được đầu tư quá 49% tổng giá trị tài sản của quỹ vào các tài sản theo quy định tại điểm a, b mục IX.2.2.3  \nb) Không được đầu tư vào chứng khoán của một tổ chức phát hành quá 10% tổng giá trị chứng khoán đang lưu hành của tổ chức đó, trừ công cụ nợ của Chính phủ;  \nc) Không được đầu tư quá 20% tổng giá trị tài sản của quỹ vào chứng khoán đang lưu hành và các tài sản (nếu có) quy định tại điểm a, b mục IX.2.2.3 của một tổ chức phát hành, trừ công cụ nợ của Chính phủ;', '|  Techcombank (""TCB"") | Gửi tiền có kỳ hạn | Techcombank sở hữu 88.99% vốn của TCC  |  \nTrong tất cả các trường hợp, các giao dịch phải là giao dịch công bằng và vì lợi ích của Nhà Đầu Tư, theo đúng các quy định của pháp luật và Điều lệ Quỹ.  \nTất cả các giao dịch có thể gây ra xung đột lợi ích tiềm tàng phải được tư vấn và chấp thuận bởi TCC và phải được công bố cho Nhà Đầu Tư. Tuy nhiên TCC sẽ cố gắng hết sức để tránh các giao dịch có thể gây ra xung đột lợi ích mà không thể quản lý được một cách thích đáng.  \nNgười có liên quan của TCC được phép giao dịch Đơn Vị Quỹ theo phương thức giống như các Nhà Đầu Tư khác như quy định tại Điều lệ Quỹ.', '- Không đầu tư quá 30% tổng giá trị tài sản của quỹ vào các chứng chỉ quỹ đại chúng, cổ phiếu công ty đầu tư chứng khoán đại chúng;  \nxi. Quỹ chỉ được đầu tư tiền gửi, công cụ tiền tệ quy định tại điểm i và ii các loại tài sản Quỹ được phép đầu tư được phát hành bởi các tổ chức tín dụng trong danh sách đã được Ban Đại Diện Quỹ phê duyệt bằng văn bản hoặc thông qua bỏ phiếu điện tử (e-voting) tuân thủ theo các Quy định Pháp luật hiện hành.  \nCơ cấu đầu tư của Quỹ được phép sai lệch so với các hạn chế được đưa ra tại điểm i, ii, iii, iv, v, vi và ix nếu trên nhưng chỉ vì các lý do sau:  \n- Biến động giá trên thị trường của các tài sản trong danh mục đầu tư của Quỹ;  \n- Thực hiện các khoản thanh toán phù hợp với Pháp Luật của Quỹ;  \n- Thực hiện các lệnh giao dịch của Nhà Đầu Tư;', 'Quỹ không quy định quy mô tối đa trong đợt phát hành lần đầu ra công chúng. Vì vậy, nếu giá trị phát hành được vượt 50.000.000.000 VNĐ (năm mươi tỷ đồng), các Nhà Đầu Tư sẽ được phân bổ số lượng Đơn Vị Quỹ bằng với số đã đặt mua.  \n- Địa điểm phát hành:\nCông ty Cổ phần Quản lý Quỹ Kỹ thương\nĐịa chỉ đăng ký: Tầng 28, Tòa C5, số 119 Trần Duy Hưng, phường Trung Hòa, Quận Cầu Giấy, Hà Nội\nĐiện thoại: (+84) 24 39446368   Fax: (+84) 24 39446583  \n- Đại lý phân phối và điểm nhận lệnh:\nCông ty Cổ phần Chứng khoán Kỹ thương (“TCBS”)\nĐịa chỉ: Tầng 10 và Tầng 12, tòa nhà Techcombank, 191 Bà Triệu, phường Lê Đại Hành, quận Hai Bà Trưng, TP. Hà Nội\nĐiện thoại: 84.24.22201039   Fax: 84.24.22201032  \n- Các đối tác có liên quan đến đợt phát hành  \n**Ủy quyền đại lý chuyển nhượng**', '## 2.2.5 Điều chỉnh danh mục đầu tư\nCơ cấu đầu tư của quỹ mở chỉ được vượt mức so với các hạn chế đầu tư đã quy định tại điểm a, b, c, d, đ, e và i mục IX.2.2.4 và chỉ do các nguyên nhân sau:  \na) Biến động giá trên thị trường của tài sản trong danh mục đầu tư của quỹ;  \nb) Thực hiện các khoản thanh toán của quỹ theo quy định của pháp luật, bao gồm việc thực hiện lệnh giao dịch của nhà đầu tư;', '## f) Lệnh Mua Tối Thiểu\nMức đầu tư tối thiểu (tính theo giá trị Lệnh Mua) là 10.000 VND (Mười nghìn đồng)  \nKhông có mức giới hạn đầu tư tối đa cho Nhà Đầu Tư. Công Ty Quản Lý Quỹ bảo lưu quyền thay đổi các giới hạn đầu tư trên trong từng thời điểm và sẽ thông báo về các thay đổi này.', 'Mức đầu tư tối thiểu (tính theo giá trị Lệnh Mua) là 10.000 VNĐ (Mười nghìn đồng)  \nKhông có mức giới hạn đầu tư tối đa cho Nhà Đầu Tư. Công Ty Quản Lý Quỹ bảo lưu quyền thay đổi các giới hạn đầu tư trên trong từng thời điểm và sẽ thông báo về các thay đổi này.', '## Lĩnh vực được phép đầu tư\nđ) Cổ phiếu chào bán lần đầu ra công chúng, trái phiếu chào bán ra công chúng; trái phiếu doanh nghiệp phát hành riêng lẻ bởi tổ chức niêm yết có bảo lãnh thanh toán của tổ chức tín dụng hoặc cam kết mua lại của tổ chức phát hành tối thiểu 1 lần trong 12 tháng và mỗi lần cam kết mua lại tối thiểu 30% giá trị đợt phát hành;  \ne) Chứng khoán phải sinh niêm yết giao dịch tại Sở giao dịch chứng khoán và chỉ nhằm mục tiêu phòng ngừa rủi ro cho chứng khoán cơ sở mà quỹ đang nắm giữ;  \ng) Quyền phát sinh gắn liền với chứng khoán mà quỹ đang nắm giữ.  \nViệc đầu tư vào các tài sản quy định tại điểm đ khoản 2.2.3 Điều này phải đáp ứng các điều kiện sau:  \n- Có quy định tại Điều lệ quỹ và Bản cáo bạch;', '## 2.2.4 Hạn mức đầu tư\n- Không đầu tư vào quá 10% tổng số chứng chỉ quỹ đang lưu hành của một quỹ đại chúng, cổ phiếu đang lưu hành của một công ty đầu tư chứng khoán đại chúng;\n- Không đầu tư quá 20% tổng giá trị tài sản của quỹ vào chứng chỉ quỹ của một quỹ đại chúng, cổ phiếu của một công ty đầu tư chứng khoán đại chúng;\n- Không đầu tư quá 30% tổng giá trị tài sản của quỹ vào các chứng chỉ quỹ đại chúng, cổ phiếu công ty đầu tư chứng khoán đại chúng;  \nk) Không được đầu tư trực tiếp vào bất động sản, đá quý, kim loại quý hiếm;  \nl) Phải có chứng khoán của ít nhất 06 tổ chức phát hành.', '## 2. Thông tin về đợt phát hành lần đầu ra công chúng\nNhà Đầu Tư nên tham khảo ý kiến của các chuyên gia tư vấn tài chính riêng của mình để đảm bảo Nhà Đầu Tư đủ điều kiện để đầu tư vào Quỹ theo các quy định pháp luật áp dụng và liệu Quỹ có phù hợp với khả năng chấp nhận rủi ro của Nhà Đầu Tư.  \n|  Tên quỹ | Quỹ Đầu tư Cổ phiếu Doanh nghiệp vừa và nhỏ Techcom  |\n| --- | --- |\n|  Loại hình | Quỹ mở  |\n|  Mục tiêu đầu tư | Mục tiêu đầu tư của Quỹ là tìm kiếm lợi nhuận dài hạn thông qua thu nhập và tăng trưởng giá trị đầu tư vốn trên cơ sở đánh giá, lựa chọn các tài sản có chất lượng tốt, phân bổ danh mục hợp lý và tối thiểu hóa rủi ro cho Nhà Đầu Tư.  |', '## 2. Điều lệ Quỹ tóm tắt\nCơ quan quyền lực cao nhất của Quỹ là Đại hội Nhà Đầu tư.  \nBan Đại diện Quỹ sẽ do Đại hội Nhà Đầu tư bầu ra để giám sát các hoạt động thường xuyên của Quỹ, TCC và Ngân hàng giám sát.  \n#### 2.1.2 Tổng vốn huy động và số lượng chứng chỉ Quỹ được chào bán  \nVốn Điều lệ được huy động trong lần đầu chào bán ra công chúng của Quỹ là 50.000.000.000 VNĐ (Năm mươi tỷ đồng). Vốn Điều lệ sẽ được chia thành 5.000.000 (Năm triệu) Chứng chỉ Quỹ. Mệnh giá của một Chứng chỉ Quỹ sẽ là 10.000 VNĐ (mười nghìn Đồng Việt Nam).  \nNhà đầu tư góp vốn bằng tiền Đồng Việt Nam dưới hình thức chuyển khoản hoặc chuyển tiền vào tài khoản của Quỹ mở tại ngân hàng giám sát.  \nSố lượng chứng chỉ quỹ/tổng chứng chỉ quỹ được phép lưu hành tối đa: không hạn chế.', 'Nhà Đầu Tư có thể thanh toán số tiền mua Đơn Vị Quỹ từ tài khoản ngân hàng của mình vào tài khoản của Quỹ để Ngân Hàng Giám Sát nhận được đúng hạn và Đại Lý Phân Phối hoàn thành xử lý việc đăng ký với Đại Lý Chuyển Nhượng. Mọi khoản đầu tư vào Đơn Vị Quỹ đều thực hiện bằng tiền Đồng Việt Nam.  \nTrong trường hợp lệnh mua chứng chỉ quỹ và việc thanh toán cho lệnh mua được thực hiện bởi cá nhân, tổ chức khác không phải nhà đầu tư thì phiếu lệnh và tài liệu xác nhận thanh toán phải nêu rõ tên, số tài khoản và giá trị thanh toán của nhà đầu tư được hưởng lợi.', 'Cổ tức sẽ được chi trả trong thời hạn 30 (ba mươi) ngày kể từ ngày được công bố và được chuyển vào tài khoản ngân hàng của Nhà Đầu Tư theo đăng ký trong Sổ Đăng Ký vào ngày thanh toán cổ tức, sau khi được khấu trừ các loại thuế có liên quan.  \nCổ tức được chi trả sẽ phải chịu thuế tùy thuộc vào nguồn gốc của thu nhập của Quỹ cũng như các loại thuế áp dụng cho Nhà Đầu Tư.', '## 2.2.4 Hạn mức đầu tư\nd) Không được đầu tư quá 30% tổng giá trị tài sản của quỹ vào các tài sản quy định tại điểm a, b, d, đ và e mục IX.2.2.3, phát hành bởi các công ty trong cùng một nhóm công ty có quan hệ sở hữu với nhau thuộc các trường hợp sau đây: công ty mẹ, công ty con; các công ty sở hữu trên 35% cổ phần, phần vốn góp của nhau; nhóm công ty con có cùng một công ty mẹ. Trong đó phần đầu tư vào chứng khoán phải sinh tính bằng giá trị cam kết của hợp đồng xác định theo quy định tại Phụ lục 4 Điều lệ Quỹ;  \nđ) Không được đầu tư quá 10% tổng giá trị tài sản của quỹ vào các tài sản quy định tại điểm đ mục IX.2.2.3;', 'Mức đầu tư tối thiểu định kỳ cho chương trình ĐTĐK là 10.000 VNĐ (Mười nghìn đồng).  \nNhà Đầu Tư có thể thay đổi giá trị khoản đầu tư và/hoặc kỳ đầu tư bất cứ lúc nào (nhưng không dưới mức đầu tư tối thiểu) bằng cách thay đổi lệnh thực hiện ĐTĐK với Đại Lý Phân Phối và các lệnh thanh toán với ngân hàng của mình. Nhà Đầu tư đã tham gia chương trình đầu tư định kỳ cũ sẽ được quyền bảo lưu hoặc chuyển đổi sang chương trình đầu tư định kỳ mới.  \nc) Ngày giao dịch và thanh toán cho các khoản đầu tư ĐTĐK  \nNgày Giao Dịch đầu tiên của Chương Trình ĐTĐK do Nhà Đầu tư chọn. Thời điểm cuối cùng để Nhà Đầu Tư đăng ký Chương Trình ĐTĐK là Thời điểm Đóng Số Lệnh của Ngày Giao Dịch đầu tiên mà Nhà Đầu tư lựa chọn.', '## 2. Điều lệ Quỹ tóm tắt\nSố lượng chứng chỉ quỹ/tổng chứng chỉ quỹ được phép lưu hành tối đa: không hạn chế.  \nViệc thay đổi giá trị tài sản huy động tối đa hoặc số lượng chứng chỉ quỹ huy động tối đa phải do Đại hội nhà đầu tư quyết định và phải thông báo cho Ủy ban Chứng khoán Nhà nước.', '# i. Chương trình Đầu tư Định kỳ\n- **Khoản Tiền Đầu Tư Cho Chương Trình ĐTĐK**  \nKhoản tiền đầu tư cho Chương Trình ĐTĐK là số tiền Nhà Đầu Tư đăng ký mua chứng chỉ quỹ hàng kỳ, tuy nhiên không thấp hơn mức đầu tư tối thiểu.  \nMức đầu tư tối thiểu định kỳ cho chương trình ĐTĐK là 10.000 VNĐ (mười nghìn đồng).  \nNhà Đầu Tư có thể thay đổi kỳ đầu tư bất cứ lúc nào bằng cách thay đổi lệnh thực hiện ĐTĐK với Đại Lý Phân Phối và các lệnh thanh toán với ngân hàng của mình.  \n- **Ngày giao dịch và thanh toán cho các khoản đầu tư ĐTĐK**  \nNgày Giao Dịch đầu tiên của Chương Trình ĐTĐK do Nhà Đầu lựa chọn. Thời điểm cuối cùng để Nhà Đầu Tư đăng ký Chương Trình ĐTĐK là Thời điểm Đóng Số Lệnh của Ngày Giao Dịch đầu tiên mà Nhà Đầu tư lựa chọn.', '- Trong trường hợp nhận được yêu cầu chuyển trả cụ thể từ Nhà Đầu tư hoặc không nhận được yêu cầu chuyển trả từ Nhà Đầu Tư, số tiền không hợp lệ ở trên sẽ được chuyển trả lại cho Nhà đầu tư hoặc bên chuyển tiền không hợp lệ trong vòng 05 (năm) ngày làm việc kể từ kỳ giao dịch chứng chỉ quỹ áp dụng.  \nChương trình ĐTĐK sẽ dừng khi Nhà Đầu Tư quyết định dừng bằng cách thông báo dừng thực hiện ĐTĐK với Đại Lý Phân Phối hoặc do Nhà Đầu Tư không nộp tiền/không nộp đủ tiền mua chứng chỉ quỹ cho Chương Trình ĐTĐK trong 05 kỳ liên tiếp.  \n32', 'ii. Không được đầu tư quá ba mươi phần trăm (30%) tổng giá trị tài sản của quỹ vào các tài sản quy định tại điểm i, ii, iv, v và vi các loại tài sản Quỹ được phép đầu tư, phát hành bởi một công ty hoặc một nhóm công ty có quan hệ sở hữu với nhau, trong đó phần đầu tư vào chứng khoán phái sinh tính bằng giá trị cam kết của hợp đồng xác định theo quy định tại Phụ lục 4 Điều lệ Quỹ.  \niii. Không được đầu tư quá 20% (hai mươi phần trăm) tổng giá trị tài sản của Quỹ vào chứng khoán đang lưu hành và các tài sản (nếu có) quy định tại điểm i, ii các loại tài sản Quỹ được phép đầu tư của một tổ chức phát hành, trừ Công cụ nợ của Chính phủ;', 'a) Kỳ đầu tư của Chương Trình ĐTĐK  \nĐịnh kỳ đầu tư của Chương Trình ĐTĐK là hàng tháng hoặc hàng quý hoặc hàng năm. Đại Lý Phân Phối có thể hỗ trợ các nhà đầu tư trong việc đưa ra một Chương Trình ĐTĐK và tần suất thanh toán phù hợp.  \nb) Khoản Tiền Đầu Tư Cho Chương Trình ĐTĐK  \nKhoản tiền đầu tư cho Chương Trình ĐTĐK là số tiền Nhà Đầu Tư đăng ký mua chứng chỉ quỹ hàng kỳ, tuy nhiên không thấp hơn mức đầu tư tối thiểu.  \nMức đầu tư tối thiểu định kỳ cho chương trình ĐTĐK là 10.000 VNĐ (Mười nghìn đồng).', 'Nhà Đầu Tư có thể thanh toán số tiền mua Đơn Vị Quỹ bằng cách chuyển khoản từ tài khoản ngân hàng của mình hoặc nộp tiền trực tiếp vào tài khoản của Quỹ để Ngân Hàng Giám Sát nhận được đúng hạn và Đại Lý Phân Phối hoàn thành xử lý việc đăng ký với Đại Lý Chuyển Nhượng. Mọi khoản đầu tư vào Đơn Vị Quỹ đều thực hiện bằng tiền Đồng Việt Nam.  \nTrong trường hợp lệnh mua chứng chỉ quỹ và việc thanh toán cho lệnh mua được thực hiện bởi cá nhân, tổ chức khác không phải nhà đầu tư thì phiếu lệnh và tài liệu xác nhận thanh toán phải nêu rõ tên, số tài khoản và giá trị thanh toán của nhà đầu tư được hưởng lợi.  \n- **Tuân Thủ**', '# 5. Kế hoạch phân chia lợi nhuận\nNhà Đầu Tư có trong danh sách chốt trong số Đăng Ký tại Ngày Giao Dịch được công bố bởi TCC cho việc chia cổ tức (“Ngày Chốt Danh Sách”) được xem là đủ điều kiện để nhận cổ tức.  \nCổ tức sẽ được chi trả trong thời hạn 30 (ba mươi) ngày kể từ ngày được công bố và được chuyển vào tài khoản ngân hàng của Nhà Đầu Tư theo đăng ký trong Số Đăng Ký vào ngày thanh toán cổ tức, sau khi được khấu trừ các loại thuế có liên quan.  \nCổ tức được chi trả sẽ phải chịu thuế tùy thuộc vào nguồn gốc của thu nhập của Quỹ cũng như các loại thuế áp dụng cho Nhà Đầu Tư.', '|  Số lượng đơn vị quỹ dự kiến phát hành: | 5.000.000 Đơn Vị Quỹ  |\n| --- | --- |\n|  Thời gian phát hành: | Được đề cập trong thông báo phát hành lần đầu ra công chúng  |\n|  Mệnh giá: | 10.000 đồng một Đơn Vị Quỹ  |\n|  Đồng tiền sử dụng và trình bày: | Đồng (VNĐ)  |\n|  Giá phát hành: | 10.000 VNĐ  |\n|  Phương thức phân bổ chứng chỉ quỹ lần đầu | = Tổng số tiền đầu tư ban đầu/ Giá phát hành  |  \nCác Nhà Đầu Tư muốn đầu tư vào Quỹ phải hoàn thành và nộp Đơn Đăng Ký cho Đại Lý Phân Phối theo các quy trình và hướng dẫn trong lần chào bán lần đầu ra công chúng.  \nMức đầu tư đăng ký tối thiểu (tính theo giá trị Lệnh Mua) của Nhà Đầu Tư là 10.000 VNĐ (Mười ngàn Việt Nam đồng)']","Quỹ chỉ được vay ngắn hạn để trang trải các chi phí cần thiết hoặc thanh toán lệnh mua lại CCQ, hạn mức không quá 5% giá trị tài sản ròng và thời gian vay tối đa 30 ngày."
Điều kiện để trở thành thành viên của Ban đại diện Quỹ là gì?,"Theo tài liệu cung cấp, điều kiện cụ thể để trở thành thành viên của Ban đại diện Quỹ không được đề cập trực tiếp. Tuy nhiên, thông tin có liên quan đến cấu trúc quản lý và nhân sự của Công ty Quản lý Quỹ Kỹ Thương như sau:

- Ông Đặng Lưu Dũng giữ chức vụ Tổng Giám đốc.
- Ông Phi Tuấn Thành là Giám đốc Phân tích đầu tư với nhiều kinh nghiệm trong ngành tài chính ngân hàng.

Để trở thành thành viên Ban đại diện Quỹ, thông thường cần đáp ứng các tiêu chí như:
1. Có trình độ chuyên môn phù hợp (ví dụ: bằng cấp từ trường đại học hoặc cao đẳng về kinh tế, quản trị kinh doanh).
2. Có kinh nghiệm làm việc trong lĩnh vực tài chính, ngân hàng hoặc chứng khoán.
3. Được công ty bầu cử hoặc chỉ định.

Điều kiện cụ thể có thể được quy định trong Điều lệ nội bộ của Công ty Quản lý Quỹ Kỹ Thương và tuân theo các quy định pháp luật hiện hành về quản trị công ty.

Nguồn: Trang 16","['9 năm kinh nghiệm với vai trò giám đốc kiểm toán tại Công ty TNHH KPMG Việt Nam.  \nHiện là Giám đốc tài chính (CFO) tại Công ty CP Đầu tư Thương Mại Quốc Tế Mặt Trời Đỏ.  |  \nCác quy định về tiêu chuẩn lựa chọn thành viên Ban đại diện Quỹ, quyền hạn và nhiệm vụ của Ban đại diện Quỹ, chủ tịch Ban đại diện Quỹ, đình chỉ hoặc bãi miễn thành viên Ban đại diện Quỹ, cuộc họp của Ban đại diện Quỹ tuân theo quy định tại chương V Điều lệ Quỹ.', 'e. Phụ Cấp Ban Đại Diện Quỹ  \nCác chi phí của Ban Đại Diện Quỹ bao gồm chi phí ăn ở, đi lại với mức hợp lý và phù hợp với các quy định tại Điều lệ Quỹ, các chi phí phát sinh từ hoạt động của Ban Đại Diện Quỹ để phục vụ cho lợi ích của Quỹ sẽ được tính vào chi phí của Quỹ. Để dễ hiểu, chi phí trên không bao gồm các chi phí bảo hiểm đối với trách nhiệm phát sinh cho Ban Đại Diện Quỹ khi thực hiện nghĩa vụ của Ban Đại Diện Quỹ. Thù lao của các thành viên của Ban Đại Diện Quỹ được tính vào chi phí hoạt động của Quỹ và tổng mức thù lao không được vượt quá tổng ngân sách hoạt động hàng năm của Ban Đại Diện đã được thông qua tại Đại Hội Nhà Đầu Tư.', '## g) Phụ Cấp Ban Đại Diện Quỹ\nCác chi phí của Ban Đại Diện Quỹ bao gồm chi phí ăn ở, đi lại với mức hợp lý và phù hợp với các quy định tại Điều lệ Quỹ, các chi phí phát sinh từ hoạt động của Ban Đại Diện Quỹ để phục vụ cho lợi ích của Quỹ sẽ được tính vào chi phí của Quỹ. Để dễ hiểu, chi phí trên không bao gồm các chi phí bảo hiểm đối với trách nhiệm phát sinh cho Ban Đại Diện Quỹ khi thực hiện nghĩa vụ của Ban Đại Diện Quỹ. Thủ lao của các thành viên của Ban Đại Diện Quỹ được tính vào chi phí hoạt động của Quỹ và tổng mức thủ lao không được vượt quá tổng ngân sách hoạt động hàng năm của Ban Đại Diện đã được thông qua tại Đại Hội Nhà Đầu Tư.', '“Ban Đại Diện Quỹ”\nlà những người đại diện cho Nhà Đầu Tư được Đại Hội Nhà Đầu Tư bầu ra để thay mặt Nhà Đầu Tư thực hiện việc giám sát các hoạt động của Quỹ, Công ty Quản Lý Quỹ và Ngân Hàng Giám Sát.  \n“Vốn Điều lệ”\nlà tổng số vốn bằng tiền do các Nhà Đầu Tư thực góp trong đợt phát hành Chứng Chỉ Quỹ lần đầu ra công chúng và được ghi trong Điều lệ.  \n“Chứng Chỉ Quỹ”\nLà loại chứng khoán xác nhận quyền sở hữu của nhà đầu tư đối với một phần vốn góp tại quỹ. Mệnh giá 01 chứng chỉ quỹ là 10.000 đồng.  \n“Giá bán/ Giá phát hành”', '## 2. Điều lệ Quỹ tóm tắt\nCơ quan quyền lực cao nhất của Quỹ là Đại hội Nhà Đầu tư.  \nBan Đại diện Quỹ sẽ do Đại hội Nhà Đầu tư bầu ra để giám sát các hoạt động thường xuyên của Quỹ, TCC và Ngân hàng giám sát.  \n#### 2.1.2 Tổng vốn huy động và số lượng chứng chỉ Quỹ được chào bán  \nVốn Điều lệ được huy động trong lần đầu chào bán ra công chúng của Quỹ là 50.000.000.000 VNĐ (Năm mươi tỷ đồng). Vốn Điều lệ sẽ được chia thành 5.000.000 (Năm triệu) Chứng chỉ Quỹ. Mệnh giá của một Chứng chỉ Quỹ sẽ là 10.000 VNĐ (mười nghìn Đồng Việt Nam).  \nNhà đầu tư góp vốn bằng tiền Đồng Việt Nam dưới hình thức chuyển khoản hoặc chuyển tiền vào tài khoản của Quỹ mở tại ngân hàng giám sát.  \nSố lượng chứng chỉ quỹ/tổng chứng chỉ quỹ được phép lưu hành tối đa: không hạn chế.', '## 2.10. Tiêu chí lựa chọn, quyền hạn và trách nhiệm của Công ty Quản lý quỹ\nCông ty Quản Lý Quỹ được lựa chọn phải thỏa mãn các điều kiện sau:  \n- Được thực hiện nghiệp vụ Quản Lý Quỹ;\n- Hoàn toàn độc lập với Ngân Hàng Giám Sát;\n- Có đầy đủ cơ sở vật chất, nhân sự để Quản Lý Quỹ mở;\n- Đồng ý thực hiện các cam kết đối với Quỹ như nêu tại Phụ Lục 1 và Phụ Lục 3 của Điều lệ Quỹ.  \nCác quy định về quyền và nghĩa vụ, chấm dứt quyền và nghĩa vụ, hạn chế hoạt động của Công ty Quản lý quỹ tuân thủ theo quy định tại Chương VI Điều lệ Quỹ.', '## VI. CÔNG TY KIỂM TOÁN\nCông ty kiểm toán được lựa chọn phải được thành lập và hoạt động phù hợp với quy định của Pháp Luật và không được là người có liên quan của Công Ty Quản Lý Quỹ và Ngân Hàng Giám Sát. Năm đầu tiên, công ty kiểm toán của Quỹ sẽ được Công Ty Quản Lý Quỹ để cử để Đại Hội Nhà Đầu Tư thông qua. Các năm sau đó, Đại Hội Nhà Đầu Tư ủy quyền cho Ban Đại Diện Quỹ thông qua việc lựa chọn công ty kiểm toán. Công Ty Quản Lý Quỹ sẽ đề xuất với Ban Đại Diện quỹ ít nhất 02 (hai) công ty kiểm toán để lựa chọn cho Quỹ.', '- Không đầu tư quá 30% tổng giá trị tài sản của quỹ vào các chứng chỉ quỹ đại chúng, cổ phiếu công ty đầu tư chứng khoán đại chúng;  \nxi. Quỹ chỉ được đầu tư tiền gửi, công cụ tiền tệ quy định tại điểm i và ii các loại tài sản Quỹ được phép đầu tư được phát hành bởi các tổ chức tín dụng trong danh sách đã được Ban Đại Diện Quỹ phê duyệt bằng văn bản hoặc thông qua bỏ phiếu điện tử (e-voting) tuân thủ theo các Quy định Pháp luật hiện hành.  \nCơ cấu đầu tư của Quỹ được phép sai lệch so với các hạn chế được đưa ra tại điểm i, ii, iii, iv, v, vi và ix nếu trên nhưng chỉ vì các lý do sau:  \n- Biến động giá trên thị trường của các tài sản trong danh mục đầu tư của Quỹ;  \n- Thực hiện các khoản thanh toán phù hợp với Pháp Luật của Quỹ;  \n- Thực hiện các lệnh giao dịch của Nhà Đầu Tư;', '## Lĩnh vực được phép đầu tư\n- Có quy định tại Điều lệ quỹ và Bản cáo bạch;\n- Đã được Ban đại diện quỹ chấp thuận bằng văn bản về loại, mã chứng khoán, số lượng, giá trị giao dịch, thời điểm thực hiện;\n- Có đủ tài liệu chứng minh về bảo lãnh thanh toán hoặc tài liệu về cam kết mua lại của tổ chức phát hành.', '## 2.3. Đặc trưng của chứng chỉ Quỹ đầu tư\nTất cả các Nhà Đầu Tư có tên trong số đăng ký nhà đầu tư trước khi triệu tập cuộc họp đều có quyền tham dự Đại Hội Nhà Đầu Tư. Quyền biểu quyết của Nhà Đầu Tư được quy định cụ thể tại điều 22 Điều Lệ Quỹ.', '## Lĩnh vực được phép đầu tư\nđ) Cổ phiếu chào bán lần đầu ra công chúng, trái phiếu chào bán ra công chúng; trái phiếu doanh nghiệp phát hành riêng lẻ bởi tổ chức niêm yết có bảo lãnh thanh toán của tổ chức tín dụng hoặc cam kết mua lại của tổ chức phát hành tối thiểu 1 lần trong 12 tháng và mỗi lần cam kết mua lại tối thiểu 30% giá trị đợt phát hành;  \ne) Chứng khoán phải sinh niêm yết giao dịch tại Sở giao dịch chứng khoán và chỉ nhằm mục tiêu phòng ngừa rủi ro cho chứng khoán cơ sở mà quỹ đang nắm giữ;  \ng) Quyền phát sinh gắn liền với chứng khoán mà quỹ đang nắm giữ.  \nViệc đầu tư vào các tài sản quy định tại điểm đ khoản 2.2.3 Điều này phải đáp ứng các điều kiện sau:  \n- Có quy định tại Điều lệ quỹ và Bản cáo bạch;', '## 2.12. Kiểm toán, kế toán và chế độ báo cáo\nCông ty kiểm toán được lựa chọn phải được thành lập và hoạt động phù hợp với quy định của Pháp Luật, nằm trong danh sách các công ty kiểm toán được UBCKNN chấp thuận kiểm toán cho tổ chức phát hành, tổ chức niêm yết và tổ chức kinh doanh chứng khoán và không được là người có liên quan của Công ty Quản Lý Quỹ và Ngân Hàng Giám Sát. Năm đầu tiên, công ty kiểm toán của Quỹ sẽ được Công ty Quản Lý Quỹ đề cử để Đại Hội Nhà Đầu Tư thông qua. Các năm sau đó, Đại Hội Nhà Đầu Tư ủy quyền cho Ban Đại Diện Quỹ thông qua việc lựa chọn công ty kiểm toán. Công ty Quản Lý Quỹ sẽ đề xuất với Ban Đại Diện Quỹ ít nhất (02) công ty kiểm toán để kiểm toán cho Quỹ.', '- Giấy chứng nhận đăng ký lập Quỹ đại chúng: do UBCKNN cấp\n- Loại hình: Quỹ mở\n- Vốn điều lệ ban đầu: 50.000.000.000 (năm mươi tỷ đồng)\n- Thời hạn của Quỹ: không giới hạn', '## 2.8. Đại hội Nhà đầu tư\nĐại Hội Nhà Đầu Tư là cơ quan có thẩm quyền cao nhất của Quỹ và tất cả các Nhà Đầu Tư có tên trong sổ đăng ký nhà đầu tư trước khi triệu tập cuộc họp đều có quyền tham dự.  \nĐại Hội Nhà Đầu Tư thường niên hoặc bất thường sẽ được tổ chức bởi Công ty Quản Lý Quỹ phù hợp với quy định của Pháp Luật với điều kiện là Nhà Đầu Tư phải được thông báo về thời gian, địa điểm, chương trình và nội dung của cuộc họp 21 (hai mươi mốt) ngày trước khi tổ chức đại hội. Đại Hội Nhà Đầu Tư không thảo luận các vấn đề khác ngoài vấn đề đã được nêu trong chương trình đại hội và Công ty Quản Lý Quỹ phải gửi toàn bộ chương trình, nội dung họp và các tài liệu có liên quan cho UBCKNN ít nhất 07 (bảy) ngày làm việc trước ngày tiến hành đại hội.', '## 2.3. Đặc trưng của chứng chỉ Quỹ đầu tư\nNhà đầu tư của Quỹ là cá nhân, tổ chức trong và ngoài nước, sở hữu chứng chỉ quỹ. Nhà đầu tư không chịu trách nhiệm pháp lý hoặc nghĩa vụ khác ngoài trách nhiệm trong phạm vi số chứng chỉ Quỹ mà họ sở hữu. Nhà đầu tư là tổ chức bao gồm các tổ chức kinh tế và xã hội được pháp luật Việt Nam công nhận.  \nNhà đầu tư pháp nhân cử người đại diện hợp pháp đại diện cho số Chứng chỉ quỹ mà mình sở hữu. Việc đề cử, hủy bỏ hay thay thế người đại diện này phải được thông báo bằng văn bản, do người đại diện có thẩm quyền của nhà đầu tư tổ chức ký.', 'ngược lại;  \n- Ngân hàng giám sát, thành viên Hội đồng quản trị, người điều hành và nhân viên của ngân hàng giám sát làm nhiệm vụ giám sát hoạt động và bảo quản tài sản của quỹ đại chúng, công ty đầu tư chứng khoán không được là đối tác mua, bán trong giao dịch mua, bán tài sản của quỹ đại chúng, công ty đầu tư chứng khoán.\n- Có đầy đủ năng lực cung cấp dịch vụ giám sát, lưu ký;\n- Thực hiện các cam kết đối với Quỹ như nêu tại Phụ lục 2 và Phụ lục 3 của Điều lệ Quỹ.  \nCác quy định về quyền và nghĩa vụ, hoạt động giám sát và chấm dứt quyền và nghĩa vụ của Ngân hàng giám sát tuân thủ theo quy định tại chương VII Điều lệ Quỹ.', 'd. Chi phí Kiểm Toán  \nPhí Kiểm Toán phụ thuộc vào kết quả lựa chọn và thương lượng với Công Ty Kiểm Toán và sẽ được xác định hàng năm vào cuối năm tài chính của Quỹ.  \ne. Phụ Cấp Ban Đại Diện Quỹ', 'Ban điều hành Công ty  \n- **Ông Đặng Lưu Dũng – Tổng Giám đốc**  \nDanh sách nhân viên điều hành Quỹ  \n- **Ông Phi Tuấn Thành**  \nÔng Thành tốt nghiệp Đại học Kinh tế Quốc dân và Thạc sĩ Quản trị kinh doanh – ĐH Tổng hợp bang Washington, Hoa Kỳ. Ông Thành được cấp Chứng chỉ hành nghề Quản lý Quỹ của Bộ Tài Chính số 00135/QLQ ngày 15/04/2009.  \nÔng Thành đã có hơn 15 năm kinh nghiệm trong lĩnh vực tài chính ngân hàng, với 2 năm làm việc tại ngân hàng VID Public và 3 năm làm phó trưởng phòng phân tích của CTCP Chứng khoán Sài Gòn SSI.  \nÔng hiện đảm nhiệm vị trí Giám đốc Phân tích đầu tư – Công ty Cổ phần Quản lý Quỹ Kỹ Thương từ năm 2010 cho tới nay.  \n- **Bà Đồng Thị Khánh Ngọc**', 'Sau khi hoàn thành đợt IPO, Công Ty Quản Lý Quỹ sẽ đăng ký xin giấy chứng nhận đăng ký thành lập Quỹ với UBCKNN nếu có ít nhất 100 (một trăm) Nhà Đầu Tư không chuyên nghiệp đầu tư vào Quỹ và tổng vốn đầu tư vào Quỹ đạt tối thiểu 50.000.000.000 VNĐ (năm mươi tỷ đồng). Khi nhận Giấy phép đăng ký, Ngân Hàng Giám Sát sẽ giải toả tài khoản ký quỹ của Quỹ đó để Quỹ có thể bắt đầu đầu tư. Dự kiến Ngày Giao Dịch đầu tiên sẽ trong vòng 30 (ba mươi) ngày kể từ ngày Giấy chứng nhận đăng ký lập quỹ có hiệu lực.  \nXác nhận đầu tư sẽ được gửi cho Nhà Đầu Tư trong vòng 05 (năm) ngày kể từ ngày Quỹ có được Giấy chứng nhận đăng ký thành lập từ UBCKNN.', '## 2.8. Đại hội Nhà đầu tư\nCông ty Quản Lý Quỹ sẽ triệu tập Đại Hội Nhà Đầu Tư bất thường theo yêu cầu của Công ty Quản Lý Quỹ hoặc Ngân Hàng Giám Sát hoặc Ban Đại Diện Quỹ hoặc Nhà Đầu Tư hoặc nhóm Nhà Đầu Tư quy định tại điểm b, khoản 2 Điều 14 Điều lệ quỹ. Việc tổ chức Đại Hội Nhà Đầu Tư bất thường theo quy định tại điều này phải được thực hiện trong vòng ba mươi (30) ngày, kể từ ngày công ty quản lý quỹ nhận được yêu cầu triệu tập họp bất thường Đại Hội Nhà Đầu Tư, trong đó phải nêu rõ lý do và mục tiêu của việc triệu tập họp bất thường Đại Hội Nhà Đầu Tư.  \nCác quy định khác về Đại Hội Nhà Đầu Tư, bao gồm cả quyền và nhiệm vụ, thể thức tiến hành đại hội, quyết định của đại hội được quy định tại Chương IV của Điều Lệ Quỹ.', '## 2.2.4 Hạn mức đầu tư\n- Không đầu tư vào quá 10% tổng số chứng chỉ quỹ đang lưu hành của một quỹ đại chúng, cổ phiếu đang lưu hành của một công ty đầu tư chứng khoán đại chúng;\n- Không đầu tư quá 20% tổng giá trị tài sản của quỹ vào chứng chỉ quỹ của một quỹ đại chúng, cổ phiếu của một công ty đầu tư chứng khoán đại chúng;\n- Không đầu tư quá 30% tổng giá trị tài sản của quỹ vào các chứng chỉ quỹ đại chúng, cổ phiếu công ty đầu tư chứng khoán đại chúng;  \nk) Không được đầu tư trực tiếp vào bất động sản, đá quý, kim loại quý hiếm;  \nl) Phải có chứng khoán của ít nhất 06 tổ chức phát hành.', '- Thực hiện các lệnh giao dịch của Nhà Đầu Tư;  \n- Các hoạt động sáp nhập, hợp nhất của các tổ chức phát hành các chứng khoán mà Quỹ đang nắm giữ;  \n- Quỹ mới được cấp phép thành lập hoặc do tách Quỹ, hợp nhất Quỹ, sát nhập Quỹ mà thời gian hoạt động không quá sáu (06) tháng, tính từ ngày được cấp giấy chứng nhận đăng ký lập Quỹ;  \n- Quỹ đang trong thời gian giải thể.  \nTrong trường hợp xảy ra sai lệch so với các hạn mức đầu tư, Công ty Quản Lý Quỹ sẽ điều chỉnh danh mục đầu tư để đáp ứng các hạn mức đầu tư kể trên trong vòng 3 (ba) tháng kể từ ngày mà sai lệch phát sinh.', 'vi. Chứng khoán phái sinh niêm yết, giao dịch tại các Sở Giao dịch Chứng khoán, và chỉ nhằm mục tiêu phòng ngừa rủi ro cho chứng khoán cơ sở mà quỹ đang nắm giữ.  \nvii. Quyền phát sinh gắn liền với chứng khoán mà Quỹ đang nắm giữ.  |\n| --- | --- |\n|  Cơ cấu đầu tư | Các khoản đầu tư của Quỹ sẽ được đa dạng hóa và đáp ứng được các điều kiện của pháp luật. Cơ cấu danh mục đầu tư của Quỹ phải bảo đảm tuân thủ các nguyên tắc sau:  \ni. Cơ cấu danh mục đầu tư của quỹ mở phải bao gồm chứng khoán của ít nhất sáu (06) tổ chức phát hành, đồng thời phải bảo đảm:', 'Các Đại Lý Phân Phối sẽ tập hợp các Yêu cầu mở tài khoản của Nhà Đầu Tư và gửi Chỉ thị mở tài khoản cho Đại Lý Chuyển Nhượng, là tổ chức sẽ đại diện Công Ty Quản Lý Quỹ tiến hành xử lý yêu cầu. Các yêu cầu không đầy đủ thông tin sẽ bị từ chối và có thể làm trì hoãn việc hoàn tất quá trình xử lý yêu cầu. Trong một số trường hợp, việc bổ sung thêm thông tin yêu cầu cũng có thể làm chậm việc hoàn tất quá trình xử lý. Công Ty Quản Lý Quỹ được quyền từ chối yêu cầu trong trường hợp không tìm được cách giải quyết cho bất kỳ vấn đề nào này sinh trong quá trình xử lý yêu cầu đăng ký.', '## 2.11. Tiêu chí lựa chọn, quyền hạn và trách nhiệm của Ngân hàng giám sát\nNgân Hàng Giám Sát được lựa chọn phải đáp ứng các điều kiện sau:  \n- Ngân hàng giám sát do Công ty quản lý quỹ lựa chọn phải đáp ứng các điều kiện quy định tại Khoản 1 Điều 116 Luật Chứng khoán;\n- Ngân hàng giám sát phải hoàn toàn độc lập và tách biệt với công ty quản lý quỹ mà ngân hàng cung cấp dịch vụ giám sát;\n- Ngân hàng giám sát, thành viên Hội đồng quản trị, người điều hành và nhân viên của ngân hàng giám sát làm nhiệm vụ giám sát hoạt động và bảo quản tài sản của quỹ đại chúng, công ty đầu tư chứng khoán không được là người có liên quan hoặc có quan hệ sở hữu, vay hoặc cho vay với công ty quản lý quỹ, công ty đầu tư chứng khoán và']","Thành viên Ban đại diện Quỹ phải đáp ứng các tiêu chuẩn về đạo đức, chuyên môn tài chính/kế toán và không thuộc các trường hợp bị cấm theo quy định của Luật Chứng khoán và Điều lệ Quỹ."
Phí chuyển đổi từ quỹ TCSME sang các quỹ khác của TechcomCapital được tính như thế nào?,"Phí chuyển đổi từ Quỹ Đầu tư Cổ phiếu Doanh nghiệp vừa và nhỏ Techcom (TCSME) sang các quỹ khác của Techcom Capital được tính theo mức phí duy nhất là 300.000 đồng cho mỗi giao dịch.

Thông tin này được lấy từ trang 36 của tài liệu, cụ thể như sau:

""Nhà Đầu Tư phải trả một mức Giá dịch vụ Chuyển Nhượng duy nhất là 300.000 đồng (ba trăm nghìn đồng) cho mỗi giao dịch chuyển nhượng Đơn Vị Quỹ. Giá dịch vụ Chuyển Nhượng do người thực hiện chuyển nhượng thanh toán.""

Nguồn: Trang 36","['## 2.4.6. Quy trình chuyển đổi quỹ\nNhà Đầu Tư có thể chuyển đổi sang Quỹ khác do Công Ty Quản Lý Quỹ quản lý bằng Lệnh Chuyển Đổi. Phiếu Lệnh Chuyển Đổi được đính kèm theo Đơn Đăng Ký, hoặc có tại Điểm Nhận Lệnh. Đối với Lệnh Chuyển Đổi, toàn bộ tiền bán Đơn Vị Quỹ của Quỹ này sau khi trừ phí và thuế (nếu có), sẽ dùng để mua Đơn Vị Quỹ của Quỹ khác.  \nViệc chuyển đổi Quỹ bằng việc bán một Quỹ và mua một Quỹ khác tại ngày giao dịch tương ứng được coi như thực hiện một lệnh bán. Giá dịch vụ Chuyển Đổi Quỹ do đó được áp dụng một lần trên giá trị giao dịch bán và Giá dịch vụ Chuyển Đổi Quỹ được TCC ấn định và công bố bằng văn bản thông báo tại từng thời kỳ nhưng không quá ba phần trăm (3%) giá trị mua lại.', 'Việc chuyển đổi Quỹ bằng việc bán một Quỹ và mua một Quỹ khác tại ngày giao dịch tương ứng được coi như thực hiện một lệnh bán. Giá dịch vụ Chuyển Đổi Quỹ do đó được áp dụng một lần trên giá trị giao dịch bán và Giá dịch vụ Chuyển Đổi Quỹ được TCC ấn định và công bố bằng văn bản thông báo tại từng thời kỳ nhưng không quá ba phần trăm (3%) giá trị mua lại.  \n- **Xử lý các Lệnh Chuyển Đổi**  \nLệnh Chuyển Đổi được xử lý bởi Đại Lý Chuyển Nhượng như là Lệnh Bản và tiếp theo sau là Lệnh Mua được thực hiện tại Ngày Giao Dịch tương ứng.  \nLệnh Bản và Lệnh Mua được xử lý bởi Đại Lý Chuyển Nhượng theo quy trình mô tả ở trên với Lệnh Bản được thực hiện trước, Lệnh Mua được xử lý sau.  \nLệnh Chuyển Đổi được đặt bằng số lượng Đơn Vị Quỹ.  \n- **Mức Tối Thiểu Cho Lệnh Chuyển Đổi**', '## c) Giá dịch vụ Chuyển Đổi Quỹ\nKhi thực hiện chuyển đổi, Nhà Đầu Tư chỉ thanh toán Giá dịch vụ Chuyển Đổi trên giá trị đăng ký chuyển đổi, mà không phải thanh toán Giá dịch vụ Mua Lại đối với Quỹ hiện tại và Giá dịch vụ Phát Hành đối với Quỹ mục tiêu.  \nCác khoản thuế giao dịch, giá dịch vụ chuyển tiền ngân hàng, nếu có, sẽ được khấu trừ vào số tiền thu được từ Lệnh Bản trong Lệnh Chuyển Đổi. Thời gian nắm giữ Đơn Vị Quỹ của Quỹ mục tiêu sẽ được tính từ ngày Lệnh Chuyển Đổi Quỹ được thực hiện.  \nMức giá dịch vụ chuyển đổi của Quỹ như sau:  \n|  Thời gian nắm giữ CCQ | Giá dịch vụ chuyển đổi (% giá trị lệnh bán)  |\n| --- | --- |\n|  0 đến dưới 6 tháng | 1,00%  |\n|  Từ tròn 6 đến tròn 9 tháng | 0,75%  |\n|  Từ trên 9 đến tròn 12 tháng | 0,50%  |', 'Mức giá dịch vụ chuyển đổi của Quỹ như sau:  \n|  Thời gian nắm giữ CCQ | Giá dịch vụ chuyển đổi (% giá trị lệnh bán)  |\n| --- | --- |\n|  0 đến dưới 6 tháng | 1,00%  |\n|  Từ tròn 6 đến tròn 9 tháng | 0,75%  |\n|  Từ trên 9 đến tròn 12 tháng | 0,50%  |\n|  Từ trên 12 tháng trở lên | 0,00%  |  \nKhi thực hiện chuyển đổi, Nhà Đầu Tư chỉ thanh toán Giá dịch vụ Chuyển Đổi trên giá trị đăng ký chuyển đổi, mà không phải thanh toán Giá dịch vụ Mua Lại đối với Quỹ hiện tại và Giá dịch vụ Phát Hành đối với Quỹ mục tiêu.  \nCác khoản thuế giao dịch, giá dịch vụ chuyển tiền ngân hàng, nếu có, sẽ được khấu trừ vào số tiền thu được từ Lệnh Bản trong Lệnh Chuyển Đổi. Thời gian nắm giữ Đơn Vị Quỹ của Quỹ mục tiêu sẽ được tính từ ngày Lệnh Chuyển Đổi Quỹ được thực hiện.', '# IX. THÔNG TIN VỀ QUỸ ĐẦU TƯ CỔ PHIẾU DOANH NGHIỆP VỮA VÀ NHỎ TECHCOM (TCSME)\n## 1. Thông tin chung về Quỹ\n- Tên Quỹ bằng tiếng Việt: QUỸ ĐẦU TƯ CỔ PHIẾU DOANH NGHIỆP VỮA VÀ NHỎ TECHCOM\n- Tên Quỹ bằng tiếng Anh: Techcom Small and Medium Enterprise Equity Fund\n- Tên viết tắt: TCSME', '## c) Giá dịch vụ Chuyển Đổi Quỹ\nGiá dịch vụ Chuyển Đổi là giá dịch vụ mà Nhà Đầu Tư phải trả khi thực hiện chuyển đổi đầu tư giữa các Quỹ mở do Công Ty Quản Lý Quỹ quản lý. Việc chuyển đổi Quỹ bằng việc bán một Quỹ và mua một Quỹ khác tại ngày giao dịch tương ứng được coi như thực hiện một lệnh bán. Giá dịch vụ Chuyển Đổi Quỹ do đó được áp dụng một lần trên giá trị chuyển đổi với mức giá dịch vụ được TCC ấn định và công bố bằng văn bản thông báo tại từng thời kỳ nhưng không quá 3,0% (ba phần trăm) giá trị thực hiện chuyển đổi. Thời điểm áp dụng mức giá dịch vụ mới tăng sớm nhất là 60 ngày kể từ ngày Công ty Quản Lý Quỹ công bố về mức giá dịch vụ mới trên trang thông tin điện tử của Công ty.', '## c) Giá dịch vụ Chuyển Đổi Quỹ\nGiá dịch vụ Chuyển Đổi là giá dịch vụ mà Nhà Đầu Tư phải trả khi thực hiện chuyển đổi đầu tư giữa các Quỹ mở do Công Ty Quản Lý Quỹ quản lý. Việc chuyển đổi Quỹ bằng việc bán một Quỹ và mua một Quỹ khác tại ngày giao dịch tương ứng được coi như thực hiện một lệnh bán. Giá dịch vụ Chuyển Đổi Quỹ do đó được áp dụng một lần trên giá trị chuyển đổi với mức giá dịch vụ được TCC ấn định và công bố bằng văn bản thông báo tại từng thời kỳ nhưng không quá 3,0% (ba phần trăm) giá trị thực hiện chuyển đổi. Thời điểm áp dụng mức giá dịch vụ mới tăng sớm nhất là 60 ngày kể từ ngày Công ty Quản Lý Quỹ công bố về mức giá dịch vụ mới trên trang thông tin điện tử của Công ty.', '## 2. Tình hình hoạt động của Công ty Cổ phần Quản lý Quỹ Kỹ thương\n| --- | --- | --- |\n|  Quỹ Đầu tư Trái Phiếu Techcom (TCBF) | Quỹ mở | 21.577.788.816.709  |\n|  Quỹ Đầu tư Cổ Phiếu Techcom (TCEF) | Quỹ mở | 549.603.026.323  |\n|  Quỹ Đầu tư Bất động sản Techcom Việt Nam (TCREIT) | Quỹ đóng (niêm yết) | 75.223.561.190  |\n|  Quỹ Đầu tư Trái Phiếu linh hoạt Techcom (TCFF) | Quỹ mở | 113.197.601.214  |', 'Giao dịch với người có liên quan của TCC sẽ cấu thành xung đột lợi ích tiềm tàng. Người Có Liên Quan của TCC bao gồm Techcombank, thành viên Hội Đồng Thành viên của TCC, thành viên Ban Điều Hành (Giám đốc, Phó giám đốc) của TCC và các tổ chức, cá nhân khác được coi là người có liên quan của TCC theo quy định của Pháp Luật. Quỹ có thể có một số giao dịch với các bên được coi là người có liên quan của TCC như sau:  \n|  Tên của người có liên quan trong giao dịch | Bản chất quan hệ  |\n| --- | --- | --- |\n|  Công ty Cổ phần Chứng khoán Kỹ thương Việt Nam (""TCBS"") | Giao dịch chứng khoán Phân phối chứng chỉ quỹ\nĐầu tư vào Quỹ | TCBS là Đại Lý Phân Phối mà Techcombank sở hữu 89% cổ phần  |\n|  Techcombank (""TCB"") | Gửi tiền có kỳ hạn | Techcombank sở hữu 88.99% vốn của TCC  |', '|  Từ trên 12 tháng trở lên | 0,00%  |\n| --- | --- |  \nGiá dịch vụ Chuyển Đổi Quỹ sẽ được hạch toán cho Công Ty Quản Lý Quỹ và Đại Lý Phân Phối căn cứ theo hợp đồng ký giữa Công Ty Quản Lý Quỹ và Đại Lý Phân Phối.', 'Trong các trường hợp tạm dừng thực hiện các giao dịch Đơn Vị Quỹ, Lệnh Chuyển Đổi đã nhận sẽ được thực hiện tại NAV tại Ngày Giao Dịch đầu tiên sau khi giao dịch được thực hiện trở lại.  \n**g. Quy trình chuyển nhượng chứng chỉ quỹ**  \n- **Đơn Chuyển Nhượng**  \nNhà Đầu Tư có thể Chuyển Nhượng Đơn Vị Quỹ cho nhà đầu tư khác dưới dạng quà tặng, thừa kế hoặc thực hiện lệnh của toà án. Chuyển Nhượng chỉ được thực hiện dưới dạng số lượng Đơn  \n55', '|  Techcombank (""TCB"") | Gửi tiền có kỳ hạn | Techcombank sở hữu 88.99% vốn của TCC  |  \nTrong tất cả các trường hợp, các giao dịch phải là giao dịch công bằng và vì lợi ích của Nhà Đầu Tư, theo đúng các quy định của pháp luật và Điều lệ Quỹ.  \nTất cả các giao dịch có thể gây ra xung đột lợi ích tiềm tàng phải được tư vấn và chấp thuận bởi TCC và phải được công bố cho Nhà Đầu Tư. Tuy nhiên TCC sẽ cố gắng hết sức để tránh các giao dịch có thể gây ra xung đột lợi ích mà không thể quản lý được một cách thích đáng.  \nNgười có liên quan của TCC được phép giao dịch Đơn Vị Quỹ theo phương thức giống như các Nhà Đầu Tư khác như quy định tại Điều lệ Quỹ.', 'Giá dịch vụ Chuyển Đổi Quỹ sẽ được hạch toán cho Công Ty Quản Lý Quỹ và Đại Lý Phân Phối căn cứ theo hợp đồng ký giữa Công Ty Quản Lý Quỹ và Đại Lý Phân Phối.', '## e) Thực Hiện Một Phần Lệnh Bán\n- Trường hợp thực hiện một phần Lệnh Bán, Lệnh mua, Lệnh Chuyến Đổi Quỹ theo quy định nêu trên, Công ty Quản Lý Quỹ áp dụng nguyên tắc phân phối cùng tỷ lệ: Phần giá trị được thực hiện sẽ được phân bổ cho tất cả nhà đầu tư đăng ký giao dịch theo cùng một tỷ lệ giữa giá trị thực hiện và giá trị đăng ký giao dịch.  \nSố lượng chứng chỉ quỹ được thực hiện trong trường hợp này được tính như sau:  \nSố lượng CCQ NĐT được thực hiện = Số lượng CCQ NĐT đăng ký bán * [Tổng số lượng CCQ mà CTQLQ có thể đáp ứng cho lệnh bán của NĐT/Tổng số lượng CCQ đăng ký bán trong kỳ]', '## 2. Thông tin về đợt phát hành lần đầu ra công chúng\nNhà Đầu Tư nên tham khảo ý kiến của các chuyên gia tư vấn tài chính riêng của mình để đảm bảo Nhà Đầu Tư đủ điều kiện để đầu tư vào Quỹ theo các quy định pháp luật áp dụng và liệu Quỹ có phù hợp với khả năng chấp nhận rủi ro của Nhà Đầu Tư.  \n|  Tên quỹ | Quỹ Đầu tư Cổ phiếu Doanh nghiệp vừa và nhỏ Techcom  |\n| --- | --- |\n|  Loại hình | Quỹ mở  |\n|  Mục tiêu đầu tư | Mục tiêu đầu tư của Quỹ là tìm kiếm lợi nhuận dài hạn thông qua thu nhập và tăng trưởng giá trị đầu tư vốn trên cơ sở đánh giá, lựa chọn các tài sản có chất lượng tốt, phân bổ danh mục hợp lý và tối thiểu hóa rủi ro cho Nhà Đầu Tư.  |', '## XIV. THÔNG TIN LIÊN LẠC\nĐể biết thêm thông tin chung, xin liên hệ:  \nCông Ty Cổ phần Quản lý Quỹ Kỹ thương (TechcomCapital)  \nĐịa chỉ: Tầng 28, Tòa C5, số 119 Trần Duy Hưng, phường Trung Hòa, Quận Cầu Giấy, Hà Nội  \nĐiện thoại: (+84) 24 39446368\nFax: (+84) 24 39446583', '# MỤC LỤC\n1. Công ty quản lý quỹ ... 5\n2. Ngân hàng giám sát ... 5  \nII. CÁC ĐỊNH NGHĨA ... 5  \nIII. CƠ HỘI ĐẦU TƯ ... 8\n1. Tổng quan tình hình kinh tế vĩ mô ... 8\n2. Thị trường tài chính Việt Nam và cơ hội đầu tư ... 11\n3. Lợi thế của quỹ mở ... 14  \nIV. THÔNG TIN VỀ CÔNG TY CỔ PHẦN QUẢN LÝ QUỸ KỸ THƯƠNG ... 15\n1. Các thông tin chung ... 15\n2. Tình hình hoạt động của Công ty Cổ phần Quản lý Quỹ Kỹ thương ... 17  \nV. NGÂN HÀNG GIÁM SÁT ... 17  \nVI. CÔNG TY KIỂM TOÁN ... 17  \nVII. ĐẠI LÝ PHÂN PHỐI CHỨNG CHỈ QUỸ ... 18  \nVIII. TỔ CHỨC ĐƯỢC ỦY QUYỀN ... 18\n1. Ủy quyền đại lý chuyên nhượng ... 18\n2. Ủy quyền dịch vụ quản trị quỹ đầu tư ... 18  \nIX. THÔNG TIN VỀ QUỸ ĐẦU TƯ CỔ PHIẾU DOANH NGHIỆP VỮA VÀ NHỎ TECHCOM (TCSME) ... 18\n1. Thông tin chung về Quỹ ... 18\n2. Điều lệ Quỹ tóm tắt ... 19', '## 2.4.7. Quy trình chuyển nhượng chứng chỉ quỹ\nNhà Đầu Tư có thể Chuyển Nhượng Đơn Vị Quỹ cho nhà đầu tư khác dưới dạng quà tặng, thừa kế hoặc thực hiện lệnh của toà án. Chuyển Nhượng chỉ được thực hiện dưới dạng số lượng Đơn Vị Quỹ, bao gồm cả phần lẻ của Đơn Vị Quỹ. Nhà Đầu Tư chuyển nhượng cần điền Lệnh Chuyển Nhượng Đơn Vị Quỹ với điều kiện là số lượng Chuyển Nhượng phải bằng hoặc lớn hơn số dư tối thiểu khi mở tài khoản nếu người nhận chuyển nhượng chưa phải là Nhà Đầu Tư.', '## 2. Ngân hàng giám sát\nNgân hàng TMCP Đầu tư và Phát triển Việt Nam - Chi nhánh Hà Thành  \nĐại diện hợp pháp: Ông Nguyễn Mạnh Cường  \nChức vụ: Phó Giám đốc  \nBản cáo bạch này là một phần của hồ sơ đăng ký chào bán của Công ty Cổ phần Quản lý quỹ Kỹ thương (Techcom Capital – “TCC”). Chúng tôi, với tư cách là Ngân hàng Giám sát của Quỹ Đầu Tư Cổ phiếu Doanh nghiệp vừa và nhỏ Techcom (TCSME) sẽ chịu trách nhiệm theo các quy định trong phạm vi Hợp Đồng Cung Cấp Dịch Vụ Giám Sát Quỹ được ký kết giữa chúng tôi với Công ty Cổ phần Quản lý quỹ Kỹ thương, là công ty quản lý Quỹ Đầu tư Cổ phiếu Doanh nghiệp vừa và nhỏ Techcom và theo quy định của pháp luật.', 'Vị Quỹ, bao gồm cả phần lẻ của Đơn Vị Quỹ. Nhà Đầu Tư chuyển nhượng cần điền Lệnh Chuyển Nhượng Đơn Vị Quỹ với điều kiện là số lượng Chuyển Nhượng phải bằng hoặc lớn hơn số dư tối thiểu khi mở tài khoản nếu người nhận chuyển nhượng chưa phải là Nhà Đầu Tư.  \n- **Xử Lý Các Đơn Chuyển Nhượng**', 'Quỹ không quy định quy mô tối đa trong đợt phát hành lần đầu ra công chúng. Vì vậy, nếu giá trị phát hành được vượt 50.000.000.000 VNĐ (năm mươi tỷ đồng), các Nhà Đầu Tư sẽ được phân bổ số lượng Đơn Vị Quỹ bằng với số đã đặt mua.  \n- Địa điểm phát hành:\nCông ty Cổ phần Quản lý Quỹ Kỹ thương\nĐịa chỉ đăng ký: Tầng 28, Tòa C5, số 119 Trần Duy Hưng, phường Trung Hòa, Quận Cầu Giấy, Hà Nội\nĐiện thoại: (+84) 24 39446368   Fax: (+84) 24 39446583  \n- Đại lý phân phối và điểm nhận lệnh:\nCông ty Cổ phần Chứng khoán Kỹ thương (“TCBS”)\nĐịa chỉ: Tầng 10 và Tầng 12, tòa nhà Techcombank, 191 Bà Triệu, phường Lê Đại Hành, quận Hai Bà Trưng, TP. Hà Nội\nĐiện thoại: 84.24.22201039   Fax: 84.24.22201032  \n- Các đối tác có liên quan đến đợt phát hành  \n**Ủy quyền đại lý chuyển nhượng**', 'Trong trường hợp Quỹ nhận được số tiền mua thấp hơn lệnh đăng ký mua và không nhận được yêu cầu chuyển trả từ khách hàng, số tiền mua sẽ tiếp tục được giữ lại để chờ yêu cầu giao dịch tiếp theo từ khách hàng.  \nTrong trường hợp Nhà Đầu Tư có nhiều lệnh mua Chứng Chỉ Quỹ cùng một lúc, Lệnh Mua Chứng Chỉ Quỹ sẽ được ưu tiên theo thứ tự đặt lệnh.  \nPhí/giá dịch vụ chuyển tiền (nếu có) được trừ vào số tiền hoàn trả cho Nhà Đầu Tư. Đơn Vị Quỹ sẽ chỉ được ghi nhận vào tài khoản của Nhà Đầu Tư hay của Đại Lý Kỷ Danh sau khi có kết quả giao dịch chứng chỉ quỹ.', '- **Xử Lý Các Đơn Chuyển Nhượng**  \nNhà Đầu Tư muốn thực hiện Chuyển Nhượng hoặc người thừa hưởng thừa kế trong trường hợp thừa kế có thể nộp Lệnh Chuyển Nhượng tại bất kỳ Điểm Nhận Lệnh nào. Lệnh Chuyển Nhượng được kèm theo các tài liệu hỗ trợ theo quy định của Công Ty Quản Lý Quỹ tại các Điểm Nhận Lệnh. Nếu người nhận chuyển nhượng chưa phải là Nhà Đầu Tư, người nhận chuyển nhượng Đơn Vị Quỹ sẽ phải nộp thêm các giấy tờ khác như quy định cho người mua Đơn Vị Quỹ lần đầu và trong trường hợp thừa kế, người thừa kế sẽ phải nộp các giấy tờ chứng minh quyền sở hữu.  \n- **Tuân thủ**  \nĐể tuân thủ các quy định về KYC và AML, người nhận chuyển nhượng Đơn Vị Quỹ sẽ phải tuân theo các thủ tục như khi mở tài khoản mới quy định chi tiết tại mục 2.4.4.  \n- **Xác Nhận Lệnh Chuyển Nhượng**', '## d) Giá dịch vụ Chuyển Nhượng\nNhà Đầu Tư phải trả một mức Giá dịch vụ Chuyển Nhượng duy nhất là 300.000 đồng (ba trăm nghìn đồng) cho mỗi giao dịch chuyển nhượng Đơn Vị Quỹ. Giá dịch vụ Chuyển Nhượng do người thực hiện chuyển nhượng thanh toán.  \nGiá dịch vụ Chuyển Nhượng sẽ không áp dụng trong trường hợp Nhà Đầu Tư thực hiện chuyển nhượng số Chứng Chỉ Quỹ từ tài khoản này sang tài khoản khác cùng đứng tên Nhà Đầu Tư tại hai Đại Lý Phân Phối khác nhau.  \nGiá dịch vụ Chuyển Nhượng sẽ được hạch toán cho Công Ty Quản Lý Quỹ và Đại Lý Phân Phối căn cứ theo hợp đồng ký giữa Công Ty Quản Lý Quỹ và Đại Lý Phân Phối.', 'Lệnh Chuyển Đổi được đặt bằng số lượng Đơn Vị Quỹ.  \n- **Mức Tối Thiểu Cho Lệnh Chuyển Đổi**  \nLệnh Bản chuyển đổi và Lệnh Mua chuyển đổi cũng áp dụng quy định về Lệnh Bản tối thiểu và Mức Đầu tư tối thiểu như nêu trên.  \n- **Thực Hiện Một Phần Lệnh Chuyển Đổi**  \nNhà Đầu Tư cần lưu ý rằng Lệnh Chuyển Đổi có thể chỉ được thực hiện một phần nếu Lệnh Bản nằm trong Lệnh Chuyển Đổi chỉ được thực hiện một phần. Các trường hợp Lệnh Bản chỉ được thực hiện một phần được quy định chi tiết tại mục 2.4.6. Phần chưa được thực hiện của Lệnh Chuyển Đổi được thực hiện một phần sẽ bị hủy.  \n- **Tạm Dừng Thực Hiện Lệnh Chuyển Đổi**  \nTrong một vài trường hợp Lệnh Chuyển Đổi cùng các lệnh khác có thể bị tạm dừng thực hiện. Các trường hợp được này được nêu tại mục 2.4.6.']","Mức phí chuyển đổi tối đa là 3% giá trị giao dịch. Biểu phí hiện tại được phân loại theo thời gian nắm giữ, miễn phí nếu nắm giữ trên 12 tháng."
Giải thích quy trình xử lý nếu xảy ra sai sót trong việc định giá NAV vượt mức sai số cho phép?,"Nếu xảy ra sai sót trong việc định giá NAV vượt mức sai số cho phép, quy trình xử lý sẽ bao gồm các bước sau:

1. Phát hiện sai sót: Công ty quản lý quỹ hoặc ngân hàng giám sát (nếu có) phải phát hiện và xác nhận rằng giá trị tài sản ròng đã bị định giá sai.

2. Điều chỉnh lại: Trong thời hạn 05 ngày làm việc kể từ khi phát hiện, công ty quản lý quỹ hoặc ngân hàng giám sát phải điều chỉnh lại giá trị tài sản ròng theo đúng quy định.

3. Công bố thông tin: Sau khi điều chỉnh, công ty quản lý quỹ và ngân hàng giám sát (nếu có) phải công bố thông tin về việc điều chỉnh này theo quy định.

4. Thông báo cho Ủy ban Chứng khoán Nhà nước: Đồng thời, công ty quản lý quỹ và ngân hàng giám sát phải thông báo cho Ủy ban Chứng khoán Nhà nước về sự cố định giá sai, bao gồm nguyên nhân xảy ra, thời gian bị định giá sai và biện pháp xử lý.

5. Xác nhận bằng văn bản: Nội dung thông báo phải được công ty quản lý quỹ và ngân hàng giám sát (nếu có) cùng ký xác nhận.

Thông tin này được lấy từ Trang 28 và 34 của tài liệu.

[Trang 28, 34]","['|  NAV trên một Đơn Vị Quỹ: | = | 78.000.000.000 /7.000.000\n= 11.142,85 VNĐ/đơn vị  |\n| --- | --- | --- |  \nViệc định giá tài sản của Quỹ, bao gồm cả các quyền, và việc tính toán NAV của Quỹ sẽ phải theo các quy tắc và quy định áp dụng cho từng thời điểm, được quy định trong Điều Lệ và sẽ được kiểm toán hằng năm. Chính sách kế toán phải phù hợp với các quy định hiện hành. Chính sách định giá tài sản của Quỹ được quy định tại Số Tay Định Giá và sẽ tuân thủ Pháp Luật và thông lệ quốc tế tốt nhất. Số tay định giá phải được Ban Đại Diện Quỹ phê duyệt và cung cấp cho ngân hàng giám sát để giám sát việc tính toán giá trị tài sản ròng.', 'Xác định giá trị tài sản ròng NAV  \nGiá Trị Tài Sản Ròng (NAV) của một Chứng chỉ quỹ bằng NAV của Quỹ chia cho tổng số Chứng chỉ quỹ đang lưu hành tại Ngày Giao Dịch gần nhất trước Ngày Định Giá.  \nNAV là tổng giá trị các tài sản và các khoản đầu tư do Quỹ sở hữu trừ đi các nghĩa vụ nợ của Quỹ tính đến ngày gần nhất trước Ngày Định Giá.  \n$$\n\\mathrm{NAV/CCQ} = \\frac{(\\text{Tổng tài sản của Quỹ} - \\text{Tổng nợ của Quỹ})}{\\text{Tổng số đơn vị Quỹ đang lưu hành của Quỹ}}\n$$  \nNAV được tính cho mỗi Ngày Giao Dịch của Quỹ và sẽ được tính làm tròn xuống đến 02 (hai) chữ số thập phân.  \nVí dụ sau đây minh họa cho cách tính NAV của Quỹ tại ngày gần nhất trước Ngày Định Giá (T-1) cụ thể theo các giả định được đưa ra:  \n|  Khoản mục | Đơn vị | Giá trị  |\n| --- | --- | --- |', '## 2.2.8 Nguyên tắc, phương thức xác định giá trị tài sản ròng\nNgày Định Giá là ngày Công ty Quản Lý Quỹ xác định NAV của Quỹ. Ngày Định Giá là ngày giao dịch (để phục vụ cho việc tính giá phát hành và giá mua lại); và là ngày đầu tiên của tháng tiếp theo đối với việc định giá để làm báo cáo tháng, quý, năm theo luật định.  \n**Ví dụ:**  \n|  Khoản mục | Đơn vị | Giá trị  |\n| --- | --- | --- |\n|  NAV của Quỹ tại Ngày Định Giá T | = | 78.000.000.000  |\n|  Số lượng Đơn Vị Quỹ đang lưu hành tại T-1 | Đơn vị | 7.000.000  |', '- Việc thực hiện tất cả các lệnh giao dịch của Nhà Đầu Tư tại Ngày Giao Dịch dẫn đến NAV của Quỹ thấp hơn 50.000.000.000 đồng (năm mươi tỷ đồng); hoặc Giá trị phần đơn vị quỹ hoặc số đơn vị quỹ còn lại trên tài khoản của nhà đầu tư thấp hơn giá trị tối thiểu hoặc số lượng đơn vị quỹ tối thiểu để duy trì tài khoản của nhà đầu tư theo quy định tại Điều lệ quỹ và Bán cáo bạch.\n- Trường hợp thực hiện một phần Lệnh Bán, Lệnh mua, Lệnh Chuyến Đổi Quỹ theo quy định nêu trên, Công ty Quản Lý Quỹ áp dụng nguyên tắc phân phối cùng tỷ lệ: Phần giá trị được thực hiện sẽ được phân bổ cho tất cả nhà đầu tư đăng ký giao dịch theo cùng một tỷ lệ giữa giá trị thực hiện và giá trị đăng ký giao dịch.  \nSố lượng chứng chỉ quỹ được thực hiện trong trường hợp này được tính như sau:', 'Trường hợp sai lệch là do Công ty Quản Lý Quỹ không tuân thủ các hạn chế đầu tư theo quy định của Pháp Luật hoặc Điều lệ Quỹ, Công ty Quản Lý Quỹ có trách nhiệm điều chỉnh lại danh mục đầu tư trong thời hạn mười lăm (15) ngày, kể từ ngày phát sinh sai lệch. Trong trường hợp này, Công ty Quản Lý Quỹ phải chịu mọi chi phí phát sinh liên quan đến các giao dịch này và các tổn thất (nếu có phát sinh). Nếu phát sinh lợi nhuận, thì phải hạch toán ngay mọi khoản lợi nhuận có được cho Quỹ.', '## 2.2.8 Nguyên tắc, phương thức xác định giá trị tài sản ròng\nGiá Trị Tài Sản Ròng (NAV) của một Chứng chỉ quỹ bằng NAV của Quỹ chia cho tổng số Chứng chỉ quỹ đang lưu hành tại Ngày Giao Dịch gần nhất trước Ngày Định Giá. Giá trị tài sản ròng trên một Chứng chỉ quỹ sẽ được làm tròn xuống đến 2 (hai) chữ số thập phân.', 'Trong các trường hợp tạm dừng thực hiện các giao dịch Đơn Vị Quỹ, Lệnh Chuyển Đổi đã nhận sẽ được thực hiện tại NAV tại Ngày Giao Dịch đầu tiên sau khi giao dịch được thực hiện trở lại.  \n**g. Quy trình chuyển nhượng chứng chỉ quỹ**  \n- **Đơn Chuyển Nhượng**  \nNhà Đầu Tư có thể Chuyển Nhượng Đơn Vị Quỹ cho nhà đầu tư khác dưới dạng quà tặng, thừa kế hoặc thực hiện lệnh của toà án. Chuyển Nhượng chỉ được thực hiện dưới dạng số lượng Đơn  \n55', '## e) Thực Hiện Một Phần Lệnh Bán\nTrong các trường hợp sau, Quỹ chỉ có thể thực hiện một phần Lệnh Bán và Chuyến Đổi Quỹ của Nhà Đầu Tư:  \n- Tổng giá trị của các Lệnh Bán (bao gồm cả Lệnh Bán từ hoạt động Chuyến Đổi Quỹ) trừ đi tổng giá trị của tất cả các Lệnh Mua (bao gồm cả Lệnh Mua từ hoạt động Chuyến Đổi Quỹ) tại Ngày Giao Dịch lớn hơn 10% của giá trị tài sản ròng của Quỹ (NAV); hoặc\n- Việc thực hiện tất cả các lệnh giao dịch của Nhà Đầu Tư tại Ngày Giao Dịch dẫn đến NAV của Quỹ thấp hơn 50.000.000.000 đồng (năm mươi tỷ đồng); hoặc Giá trị phần đơn vị quỹ hoặc số đơn vị quỹ còn lại trên tài khoản của nhà đầu tư thấp hơn giá trị tối thiểu hoặc số lượng đơn vị quỹ tối thiểu để duy trì tài khoản của nhà đầu tư theo quy định tại Điều lệ quỹ và Bán cáo bạch.', 'Công thức tính giá dịch vụ giám sát vào mỗi kỳ định giá được xác định như sau:  \nGiá dịch vụ giám sát cho kỳ định giá = Tỷ lệ giá dịch vụ giám sát (năm) x NAV tại ngày trước ngày định giá x số ngày theo lịch thực tế của chu kỳ định giá / số ngày thực tế của năm (365 hoặc 366).  \n|  Loại Giá dịch vụ | Mức giá dịch vụ | Tối thiểu/tối đa | Ghi chú  |\n| --- | --- |\n|  Giá dịch vụ giám sát | 0,02%*NAV/Năm | Tối thiểu: 5.000.000 đồng /tháng | Thuế VAT 10%  |', '## 4. Phương pháp xác định giá trị tài sản ròng\nGiá Trị Tài Sản Ròng (NAV) của một Chứng chỉ quỹ bằng NAV của Quỹ chia cho tổng số Chứng chỉ quỹ đang lưu hành tại Ngày Giao Dịch gần nhất trước Ngày Định Giá.', '## b. Giá dịch vụ giám sát\nGiá dịch vụ giám sát được trả cho Ngân Hàng Giám Sát để cung cấp dịch vụ Ngân Hàng Giám Sát cho Quỹ. Giá dịch vụ được tính vào mỗi kỳ định giá dựa trên NAV tại ngày trước Ngày Định Giá và được trả hàng tháng. Số tiền trả dịch vụ hàng tháng là tổng số được tính (trích lập) cho các kỳ định giá thực hiện trong tháng.  \nCông thức tính giá dịch vụ giám sát vào mỗi kỳ định giá được xác định như sau:  \nGiá dịch vụ giám sát cho kỳ định giá = Tỷ lệ giá dịch vụ giám sát (năm) x NAV tại ngày trước ngày định giá x số ngày theo lịch thực tế của chu kỳ định giá / số ngày thực tế của năm (365 hoặc 366).  \n|  Loại Giá dịch vụ | Mức giá dịch vụ | Tối thiểu/tối đa | Ghi chú  |\n| --- | --- |\n|  Giá dịch vụ giám sát | 0,02%*NAV/Năm | Tối thiểu: 5.000.000 đồng /tháng | Thuế VAT 10%  |', '## d) Xác Nhận Lệnh Chuyển Nhượng\n- Các điều kiện bất khả kháng;\n- Không thể xác định được NAV của Quỹ tại Ngày Giao Dịch do các Sở giao dịch chứng khoán quyết định đình chỉ giao dịch chứng khoán trong danh mục đầu tư của Quỹ hoặc do các sở giao dịch chứng khoán tạm dừng giao dịch; hoặc\n- Các trường hợp khác theo quy định của Ủy Ban Chứng Khoán Nhà Nước.', '## 2.2.5 Điều chỉnh danh mục đầu tư\nCơ cấu đầu tư của quỹ mở chỉ được vượt mức so với các hạn chế đầu tư đã quy định tại điểm a, b, c, d, đ, e và i mục IX.2.2.4 và chỉ do các nguyên nhân sau:  \na) Biến động giá trên thị trường của tài sản trong danh mục đầu tư của quỹ;  \nb) Thực hiện các khoản thanh toán của quỹ theo quy định của pháp luật, bao gồm việc thực hiện lệnh giao dịch của nhà đầu tư;', '## d) Giá dịch vụ Quản Trị Quỹ\nGiá dịch vụ Quản trị quỹ sẽ là 0,03% NAV/năm và thấp nhất là 15.000.000 đồng/ tháng (chưa bao gồm thuế VAT)  \nCông thức tính giá dịch vụ quản trị quỹ vào mỗi kỳ định giá được xác định như sau:  \nGiá dịch vụ quản trị quỹ cho kỳ định giá = Tỷ lệ giá dịch vụ quản trị quỹ (năm) x NAV tại ngày trước ngày định giá x số ngày theo lịch thực tế của chu kỳ định giá / số ngày thực tế của năm (365 hoặc 366).', 'Trường hợp sai lệch do công ty quản lý quỹ không tuân thủ các hạn chế đầu tư theo quy định của pháp luật hoặc Điều lệ quỹ, công ty quản lý quỹ phải điều chỉnh lại danh mục đầu tư trong thời hạn 15 ngày kể từ ngày phát hiện ra sai lệch. Công ty quản lý quỹ phải bồi thường thiệt hại cho quỹ (nếu có) và chịu mọi chi phí phát sinh liên quan đến việc điều chỉnh lại danh mục đầu tư. Nếu phát sinh lợi nhuận phải hạch toán ngay mọi khoản lợi nhuận có được cho quỹ.', '## 3.2 Giá dịch vụ mà Quỹ phải trả\nGiá dịch vụ Quản Lý tối đa là 1,2% * NAV/năm.  \nĐại Hội Nhà Đầu Tư có thể ủy quyền cho Ban Đại Diện Quỹ quyết định điều chỉnh mức Giá dịch vụ Quản lý trong mức tối đa nêu trên nếu được Đại Hội Nhà Đầu Tư thông qua việc ủy quyền này trong Đại hội hàng năm gần nhất. Hiệu lực của việc điều chỉnh Giá dịch vụ Quản Lý sau khi Ban Đại Diện Quỹ phê duyệt sẽ được Công ty quản lý Quỹ công bố trên trang website. Trường hợp thay đổi Giá dịch vụ Quản lý dẫn đến giá dịch vụ vượt quá mức tối đa nêu trên sẽ phải được Đại Hội Nhà Đầu Tư phê duyệt.  \nTrong mọi trường hợp, tổng giá dịch vụ Quản lý Quỹ, giá dịch vụ Quản trị Quỹ và giá dịch vụ đại lý chuyển nhượng sẽ không vượt quá quy định của Pháp luật (2% NAV/năm).', 'Công thức tính giá dịch vụ quản trị quỹ vào mỗi kỳ định giá được xác định như sau:  \nGiá dịch vụ quản trị quỹ cho kỳ định giá = Tỷ lệ giá dịch vụ quản trị quỹ (năm) x NAV tại ngày trước ngày định giá x số ngày theo lịch thực tế của chu kỳ định giá / số ngày thực tế của năm (365 hoặc 366).  \nc. Giá dịch vụ Đại Lý Chuyển Nhượng  \nGiá dịch vụ Đại lý chuyển nhượng được tính toán và cộng đồng theo kỳ định giá và được thanh toán định kỳ theo thỏa thuận với Đại lý chuyển nhượng. Giá dịch vụ Đại lý chuyển nhượng được thống nhất với Đại lý chuyển nhượng phù hợp với quy định của pháp luật và có thể được điều chỉnh theo thỏa thuận với Đại lý chuyển nhượng.  \nd. Chi phí Kiểm Toán', '## 3.2 Giá dịch vụ mà Quỹ phải trả\nGiá dịch vụ quản lý được tính vào mỗi kỳ định giá dựa trên NAV tại ngày trước ngày định giá và được thanh toán hàng tháng cho Công ty Quản Lý Quỹ. Số giá dịch vụ trả hàng tháng là tổng số giá dịch vụ được tính (trích lập) cho các kỳ định giá thực hiện trong tháng.  \nCông thức tính giá dịch vụ quản lý quỹ vào mỗi kỳ định giá được xác định như sau:  \nGiá dịch vụ quản lý quỹ cho kỳ định giá = Tỷ lệ giá dịch vụ quản lý (năm) x NAV tại ngày trước ngày định giá x số ngày theo lịch thực tế của chu kỳ định giá / số ngày thực tế của năm (365 hoặc 366).  \nGiá dịch vụ Quản Lý tối đa là 1,2% * NAV/năm.', 'Giá dịch vụ Quản Lý tối đa là 1,2%*NAV/năm.  \nĐại Hội Nhà Đầu Tư có thể ủy quyền cho Ban Đại Diện Quỹ quyết định điều chỉnh mức Giá dịch vụ Quản lý trong mức tối đa nêu trên nếu được Đại Hội Nhà Đầu Tư thông qua việc ủy quyền này trong Đại hội hàng năm gần nhất. Hiệu lực của việc điều chỉnh Giá dịch vụ Quản Lý sau khi Ban Đại Diện Quỹ phê duyệt sẽ được Công ty quản lý Quỹ công bố trên trang website. Trường hợp thay đổi Giá dịch vụ Quản lý dẫn đến giá dịch vụ vượt quá mức tối đa nêu trên sẽ phải được Đại Hội Nhà Đầu Tư phê duyệt.  \nTrong mọi trường hợp, tổng giá dịch vụ Quản lý Quỹ, giá dịch vụ Quản trị Quỹ và giá dịch vụ đại lý chuyển nhượng sẽ không vượt quá quy định của Pháp luật (2% NAV/năm).', '## XIII. CUNG CÁP THỐNG TIN CHO NHÀ ĐẦU TƯ, CHẾ ĐỘ BÁO CÁO\nHàng tháng, quý, năm Công Ty Quản Lý Quỹ sẽ gửi thống kê giao dịch, sao kê tài khoản giao dịch, tài khoản phụ, báo cáo giá trị NAV và các thay đổi NAV của Quỹ và các báo cáo khác theo luật định cho Nhà Đầu Tư.  \nĐối với Nhà Đầu Tư giao dịch trên tài khoản ký danh, Công Ty Quản Lý Quỹ hoặc tổ chức được ủy quyền bởi Công Ty Quản Lý Quỹ (trong phạm vi pháp luật hiện hành cho phép) sẽ gửi thống kê giao dịch và sao kê tài khoản phụ nếu Nhà Đầu Tư có yêu cầu bằng văn bản. Thời hạn cung cấp thông tin là trong vòng 05 (năm) ngày làm việc, kể từ ngày nhận được yêu cầu của Nhà Đầu Tư.', 'Trong trường hợp Quỹ nhận được số tiền mua thấp hơn Phiếu lệnh mua và không nhận được yêu cầu chuyển trả từ khách hàng, số tiền mua sẽ tiếp tục được giữ lại để chờ yêu cầu giao dịch tiếp theo từ khách hàng.  \nTrong trường hợp Nhà Đầu Tư có nhiều lệnh mua Chứng Chỉ Quỹ cùng một lúc, Lệnh Mua Chứng Chỉ Quỹ sẽ được ưu tiên theo thứ tự đặt lệnh.  \nPhí/giá dịch vụ chuyển tiền (nếu có) được trừ vào số tiền hoàn trả cho Nhà Đầu Tư. Đơn Vị Quỹ sẽ chỉ được ghi nhận vào tài khoản của Nhà Đầu Tư hay của Đại Lý Ký Danh sau khi có kết quả giao dịch chứng chỉ quỹ.', '## 2.5.2. Hình thức công bố thông tin về giá các giao dịch, nơi công bố thông tin, tần suất công bố thông tin\n. Trong thời hạn 05 ngày làm việc, kể từ ngày phát hiện giá trị tài sản ròng bị định giá sai, công ty quản lý quỹ hoặc ngân hàng giám sát (trong trường hợp ngân hàng giám sát cung cấp dịch vụ xác định giá trị tài sản ròng) phải điều chỉnh lại và công bố thông tin theo quy định, đồng thời thông báo cho Ủy ban Chứng khoán Nhà nước về việc định giá sai, bao gồm nguyên nhân xảy ra sự việc, thời gian bị định giá sai, biện pháp xử lý. Nội dung thông báo phải được công ty quản lý quỹ và ngân hàng giám sát cùng ký xác nhận.', '## 4. Phương pháp xác định giá trị tài sản ròng\n. Trong thời hạn 05 ngày làm việc, kể từ ngày phát hiện giá trị tài sản ròng bị định giá sai, công ty quản lý quỹ hoặc ngân hàng giám sát (trong trường hợp ngân hàng giám sát cung cấp dịch vụ xác định giá trị tài sản ròng) phải điều chỉnh lại và công bố thông tin theo quy định, đồng thời thông báo cho Ủy ban Chứng khoán Nhà nước về việc định giá sai, bao gồm nguyên nhân xảy ra sự việc, thời gian bị định giá sai, biện pháp xử lý. Nội dung thông báo phải được công ty quản lý quỹ và ngân hàng giám sát cùng ký xác nhận.', '## 3.2 Giá dịch vụ mà Quỹ phải trả\nGiá dịch vụ giám sát được trả cho Ngân Hàng Giám Sát để cung cấp dịch vụ Ngân Hàng Giám Sát cho Quỹ. Giá dịch vụ được tính vào mỗi kỳ định giá dựa trên NAV tại ngày trước Ngày Định Giá và được trả hàng tháng. Số tiền trả dịch vụ hàng tháng là tổng số được tính (trích lập) cho các kỳ định giá thực hiện trong tháng.', '## 2.5.3. Thông tin về các mức giá dịch vụ\nCác loại phí/dịch vụ và chi phí/giá dịch vụ liên quan trực tiếp đến việc giao dịch Đơn Vị Quỹ sẽ do Nhà Đầu Tư trả và không được tính vào chi phí của Quỹ. Công Ty Quản Lý Quỹ bảo lưu quyền thay đổi biểu phí/giá dịch vụ này.  \nCác khoản giá dịch vụ giao dịch như sau:']","Công ty quản lý quỹ phải bồi thường thiệt hại cho nhà đầu tư và Quỹ nếu sai sót vượt mức 0,75% NAV (đối với quỹ cổ phiếu) theo quy định của pháp luật."
Ngân hàng BIDV - Chi nhánh Hà Thành thực hiện những nhiệm vụ lưu ký cụ thể nào cho quỹ?,"Từ các thông tin được cung cấp, tôi không tìm thấy thông tin về Ngân hàng BIDV - Chi nhánh Hà Thành trong tài liệu. Tài liệu chỉ đề cập đến Ngân hàng TMCP Đầu tư và Phát triển Việt Nam - Chi nhánh Hà Thành là Ngân hàng Giám Sát cho Quỹ.

Tuy nhiên, dựa trên thông lệ chung, Ngân hàng Giám Sát (trong trường hợp này là Ngân hàng TMCP Đầu tư và Phát triển Việt Nam - Chi nhánh Hà Thành) thường thực hiện các nhiệm vụ lưu ký sau:

1. Quản lý tài khoản phong tỏa của Quỹ.
2. Thanh toán lãi phát sinh trên các khoản tiền gửi trong tài khoản ký quỹ.
3. Thực hiện thanh toán cho nhà đầu tư khi Quỹ bán chứng khoán.

Nếu bạn cần thông tin chính xác, tôi khuyên bạn nên kiểm tra thêm phần chi tiết về Ngân hàng Giám Sát trong bản cáo bạch hoặc tài liệu liên quan khác của Quỹ. 

Thông tin này được lấy từ trang 5 (Nguồn: Trang 5).","['# PHỤ LỤC 2. CÁC ĐỐI TÁC CÓ LIÊN QUAN\nNgân hàng lưu ký, giám sát và quản trị quỹ:  \nNgân hàng TMCP Đầu tư và Phát triển Việt Nam - Chi nhánh Hà Thành, một chi nhánh được thành lập theo Giấy chứng nhận đăng ký hoạt động chi nhánh số 0100150619-073 cấp lần đầu ngày 12/9/2003 thay đổi lần 12 ngày 16/06/2020 do Sở kế hoạch và Đầu tư thành phố Hà Nội cấp và Giấy chứng nhận đăng ký hoạt động lưu ký chứng khoán số 510/QĐ-ĐKHĐLK ngày 01/08/2006 do UBCKNN cấp, thực hiện các nghiệp vụ (i) bảo quản, lưu ký chứng khoán, tài liệu xác nhận quyền sở hữu tài sản hợp pháp của Quỹ; các hợp đồng kinh tế, các chứng từ có liên quan đến tài sản của Quỹ đồng thời giám sát hoạt động của Quỹ; (ii) thực hiện chức năng giám sát toàn bộ quản lý tài sản của Quỹ do Công ty Quản lý Quỹ thực hiện.  \n![img-14.jpeg](img-14.jpeg)', 'Nhà Đầu Tư có thể thanh toán số tiền mua Đơn Vị Quỹ từ tài khoản ngân hàng của mình vào tài khoản của Quỹ để Ngân Hàng Giám Sát nhận được đúng hạn và Đại Lý Phân Phối hoàn thành xử lý việc đăng ký với Đại Lý Chuyển Nhượng. Mọi khoản đầu tư vào Đơn Vị Quỹ đều thực hiện bằng tiền Đồng Việt Nam.  \nTrong trường hợp lệnh mua chứng chỉ quỹ và việc thanh toán cho lệnh mua được thực hiện bởi cá nhân, tổ chức khác không phải nhà đầu tư thì phiếu lệnh và tài liệu xác nhận thanh toán phải nêu rõ tên, số tài khoản và giá trị thanh toán của nhà đầu tư được hưởng lợi.', '# VIII. TỔ CHỨC ĐƯỢC ỦY QUYỀN\n## 2. Ủy quyền dịch vụ quản trị quỹ đầu tư\n- Tên ngân hàng: Ngân hàng TMCP Đầu tư và Phát triển Việt Nam – Chi nhánh Hà Thành\n- Giấy chứng nhận đăng ký hoạt động chi nhánh: Số 0100150619-073 cấp lần đầu ngày 12/9/2003 thay đổi lần 12 ngày 16/06/2020 do Sở kế hoạch và Đầu tư thành phố Hà Nội cấp\n- GCNDK hoạt động lưu ký: Số 510/QĐ-ĐKHDLK ngày 01/08/2006 do UBCKNN cấp\n- Trụ sở chính: 74 Thợ Nhuộm, Hoàn Kiếm, Hà Nội, Việt Nam\n- Điện thoại: +84.24 39411840    Fax: +84.24 39411847  \nTổ chức cung cấp dịch vụ quản trị quỹ chịu trách nhiệm trong phạm vi liên quan đến dịch vụ cung cấp theo quy định tại hợp đồng dịch vụ ký kết giữa Công ty Quản lý Quỹ và tổ chức cung cấp dịch vụ quản trị quỹ.', '- Thực hiện các lệnh giao dịch của Nhà Đầu Tư;  \n- Các hoạt động sáp nhập, hợp nhất của các tổ chức phát hành các chứng khoán mà Quỹ đang nắm giữ;  \n- Quỹ mới được cấp phép thành lập hoặc do tách Quỹ, hợp nhất Quỹ, sát nhập Quỹ mà thời gian hoạt động không quá sáu (06) tháng, tính từ ngày được cấp giấy chứng nhận đăng ký lập Quỹ;  \n- Quỹ đang trong thời gian giải thể.  \nTrong trường hợp xảy ra sai lệch so với các hạn mức đầu tư, Công ty Quản Lý Quỹ sẽ điều chỉnh danh mục đầu tư để đáp ứng các hạn mức đầu tư kể trên trong vòng 3 (ba) tháng kể từ ngày mà sai lệch phát sinh.', '## V. NGÂN HÀNG GIÁM SÁT\n- Tên ngân hàng: Ngân hàng TMCP Đầu tư và Phát triển Việt Nam – Chi nhánh Hà Thành\n- Giấy chứng nhận đăng ký hoạt động chi nhánh: Số 0100150619-073 cấp lần đầu ngày 12/9/2003 thay đổi lần 12 ngày 16/06/2020 do Sở kế hoạch và Đầu tư thành phố Hà Nội cấp\n- GCNDK hoạt động lưu ký: Số 510/QĐ-ĐKHĐLK ngày 01/08/2006 do UBCKNN cấp\n- Trụ sở chính: 74 Thợ Nhuộm, Hoàn Kiếm, Hà Nội, Việt Nam\n- Điện thoại: +84.24 39411840 Fax: +84.24 39411847  \nNgân hàng Giám sát chịu trách nhiệm trong phạm vi liên quan đến hoạt động của ngân hàng giám sát theo quy định tại Điều lệ Quỹ và Hợp đồng Giám sát.', '# II. CÁC ĐỊNH NGHĨA\nGiấy chứng nhận đăng ký doanh nghiệp số 0102995749 do Sở Kế hoạch và Đầu tư Thành phố Hà Nội cấp ngày 27/05/2021, đáp ứng các tiêu chuẩn như nêu tại Điều 30 và có các quyền và nghĩa vụ như quy định tại Điều 31 của Điều lệ Quỹ.  \n“Ngân Hàng Giám Sát” Là Ngân hàng TMCP Đầu tư và Phát triển Việt Nam - Chi nhánh Hà Thành, một chi nhánh được thành lập theo Giấy chứng nhận đăng ký hoạt động chi nhánh số 0100150619-073 cấp lần đầu ngày 12/9/2003 thay đổi lần 12 ngày 16/06/2020 do Sở kế hoạch và Đầu tư thành phố Hà Nội cấp', 'Nhà đầu tư nên lưu lại một bản Hợp đồng và cập nhật các thông tin cung cấp trong Hợp đồng. Thông tin này sẽ được lưu lại trong Số Đăng Ký của Quỹ và luôn chứa đựng thông tin về địa chỉ hiện tại địa chỉ thư điện tử, nơi đăng ký thuế, và chi tiết tài khoản ngân hàng của từng Nhà Đầu Tư nhằm đảm bảo Nhà Đầu Tư nhận được đầy đủ các thông báo, báo cáo và thanh toán liên quan đến Quỹ.  \nNhà Đầu Tư mua Đơn Vị Quỹ tại các lần tiếp theo cần điền đầy đủ vào phiếu Lệnh Mua có sẵn tại các Điểm Nhận Lệnh.', 'Nhà Đầu Tư có thể thanh toán số tiền mua Đơn Vị Quỹ bằng cách chuyển khoản từ tài khoản ngân hàng của mình hoặc nộp tiền trực tiếp vào tài khoản của Quỹ để Ngân Hàng Giám Sát nhận được đúng hạn và Đại Lý Phân Phối hoàn thành xử lý việc đăng ký với Đại Lý Chuyển Nhượng. Mọi khoản đầu tư vào Đơn Vị Quỹ đều thực hiện bằng tiền Đồng Việt Nam.  \nTrong trường hợp lệnh mua chứng chỉ quỹ và việc thanh toán cho lệnh mua được thực hiện bởi cá nhân, tổ chức khác không phải nhà đầu tư thì phiếu lệnh và tài liệu xác nhận thanh toán phải nêu rõ tên, số tài khoản và giá trị thanh toán của nhà đầu tư được hưởng lợi.  \n- **Tuân Thủ**', '## THÔNG BÁO QUAN TRỌNG\nthành tiền) các Đơn Vị Quỹ trong phạm vi lãnh thổ tài phán áp dụng đối với quốc tịch, nơi cư trú của mình hoặc theo luật pháp của bất kỳ quốc gia hay lãnh thổ nào áp dụng cho Nhà Đầu Tư hoặc bất kỳ quỹ được quản lý nào được sử dụng để mua Đơn Vị Quỹ, và xác định các vấn đề có thể phát sinh liên quan đến pháp lý, thuế, tài chính hay các vấn đề khác từ việc mua và nắm giữ Đơn Vị Quỹ trước khi quyết định đăng ký mua Đơn Vị Quỹ', 'ngược lại;  \n- Ngân hàng giám sát, thành viên Hội đồng quản trị, người điều hành và nhân viên của ngân hàng giám sát làm nhiệm vụ giám sát hoạt động và bảo quản tài sản của quỹ đại chúng, công ty đầu tư chứng khoán không được là đối tác mua, bán trong giao dịch mua, bán tài sản của quỹ đại chúng, công ty đầu tư chứng khoán.\n- Có đầy đủ năng lực cung cấp dịch vụ giám sát, lưu ký;\n- Thực hiện các cam kết đối với Quỹ như nêu tại Phụ lục 2 và Phụ lục 3 của Điều lệ Quỹ.  \nCác quy định về quyền và nghĩa vụ, hoạt động giám sát và chấm dứt quyền và nghĩa vụ của Ngân hàng giám sát tuân thủ theo quy định tại chương VII Điều lệ Quỹ.', '## 2.11. Tiêu chí lựa chọn, quyền hạn và trách nhiệm của Ngân hàng giám sát\nNgân Hàng Giám Sát được lựa chọn phải đáp ứng các điều kiện sau:  \n- Ngân hàng giám sát do Công ty quản lý quỹ lựa chọn phải đáp ứng các điều kiện quy định tại Khoản 1 Điều 116 Luật Chứng khoán;\n- Ngân hàng giám sát phải hoàn toàn độc lập và tách biệt với công ty quản lý quỹ mà ngân hàng cung cấp dịch vụ giám sát;\n- Ngân hàng giám sát, thành viên Hội đồng quản trị, người điều hành và nhân viên của ngân hàng giám sát làm nhiệm vụ giám sát hoạt động và bảo quản tài sản của quỹ đại chúng, công ty đầu tư chứng khoán không được là người có liên quan hoặc có quan hệ sở hữu, vay hoặc cho vay với công ty quản lý quỹ, công ty đầu tư chứng khoán và', '# NGÂN HÀNG GIÁM SÁT\nTên ngân hàng giám sát: Ngân hàng TMCP Đầu tư &amp; Phát triển Việt Nam – Chi nhánh Hà Thành;  \nGiấy chứng nhận đăng ký kinh doanh số 0100150619-073 cấp lần đầu ngày 12/09/2003, thay đổi lần thứ 12 ngày 16/06/2020 do Sở Kế hoạch và Đầu tư thành phố Hà Nội cấp;  \nGiấy phép hoạt động lưu ký chứng khoán số: 510/QĐ-ĐKHĐLK ngày 01/08/2006 do UBCKNN cấp;  \nChúng tôi, với tư cách là Ngân hàng giám sát của Quỹ Đầu Tư Cổ phiếu Doanh nghiệp vừa và nhỏ Techcom sẽ chịu trách nhiệm theo các quy định trong phạm vi Hợp Đồng Cung Cấp Dịch Vụ lưu ký giám sát của Quỹ được ký kết giữa chúng tôi với Công ty Cổ phần Quản lý Quỹ Kỹ Thương, và các quy định về Ngân hàng giám sát trong Điều lệ, Bản cáo bạch của Quỹ.  \n![img-13.jpeg](img-13.jpeg)  \nPHÓ GIÁM ĐỐC\nNguyễn Mạnh Cường', 'Vị Quỹ, bao gồm cả phần lẻ của Đơn Vị Quỹ. Nhà Đầu Tư chuyển nhượng cần điền Lệnh Chuyển Nhượng Đơn Vị Quỹ với điều kiện là số lượng Chuyển Nhượng phải bằng hoặc lớn hơn số dư tối thiểu khi mở tài khoản nếu người nhận chuyển nhượng chưa phải là Nhà Đầu Tư.  \n- **Xử Lý Các Đơn Chuyển Nhượng**', 'Sau khi thực hiện các Lệnh Bán Được Chấp Nhận, số Đơn Vị Quỹ đã bán sẽ được trừ ra từ tổng số Đơn Vị Quỹ trong tài khoản của Nhà Đầu Tư và bảng kê mới về số Đơn Vị Quỹ nắm giữ sẽ được gửi đến Nhà Đầu Tư. Chi tiết ngày thanh toán tiền mua lại chứng chỉ quỹ sẽ được Công ty Quản Lý Quỹ công bố trên trang web theo từng thời kỳ.', 'Nhà Đầu Tư thanh toán tiền mua Đơn Vị Quỹ vào một tài khoản phong tỏa của Quỹ mở tại Ngân Hàng Giám Sát. Thông tin chi tiết của tài khoản này sẽ được cung cấp bởi các Đại Lý Phân Phối và được đề cập trong Đơn Đăng Ký. Ngân Hàng Giám Sát sẽ thanh toán lãi phát sinh (nếu có) trên các khoản tiền gửi trong tài khoản ký quỹ với mức lãi suất không thấp hơn lãi suất tiền gửi không kỳ hạn đang được áp dụng của Ngân Hàng Giám Sát trong suốt quá trình IPO. Nếu IPO thành công, số lãi này sẽ cấu thành một phần tài sản Quỹ.', '- Việc thực hiện tất cả các lệnh giao dịch của Nhà Đầu Tư tại Ngày Giao Dịch dẫn đến NAV của Quỹ thấp hơn 50.000.000.000 đồng (năm mươi tỷ đồng); hoặc Giá trị phần đơn vị quỹ hoặc số đơn vị quỹ còn lại trên tài khoản của nhà đầu tư thấp hơn giá trị tối thiểu hoặc số lượng đơn vị quỹ tối thiểu để duy trì tài khoản của nhà đầu tư theo quy định tại Điều lệ quỹ và Bán cáo bạch.\n- Trường hợp thực hiện một phần Lệnh Bán, Lệnh mua, Lệnh Chuyến Đổi Quỹ theo quy định nêu trên, Công ty Quản Lý Quỹ áp dụng nguyên tắc phân phối cùng tỷ lệ: Phần giá trị được thực hiện sẽ được phân bổ cho tất cả nhà đầu tư đăng ký giao dịch theo cùng một tỷ lệ giữa giá trị thực hiện và giá trị đăng ký giao dịch.  \nSố lượng chứng chỉ quỹ được thực hiện trong trường hợp này được tính như sau:', '## 2. Ngân hàng giám sát\nNgân hàng TMCP Đầu tư và Phát triển Việt Nam - Chi nhánh Hà Thành  \nĐại diện hợp pháp: Ông Nguyễn Mạnh Cường  \nChức vụ: Phó Giám đốc  \nBản cáo bạch này là một phần của hồ sơ đăng ký chào bán của Công ty Cổ phần Quản lý quỹ Kỹ thương (Techcom Capital – “TCC”). Chúng tôi, với tư cách là Ngân hàng Giám sát của Quỹ Đầu Tư Cổ phiếu Doanh nghiệp vừa và nhỏ Techcom (TCSME) sẽ chịu trách nhiệm theo các quy định trong phạm vi Hợp Đồng Cung Cấp Dịch Vụ Giám Sát Quỹ được ký kết giữa chúng tôi với Công ty Cổ phần Quản lý quỹ Kỹ thương, là công ty quản lý Quỹ Đầu tư Cổ phiếu Doanh nghiệp vừa và nhỏ Techcom và theo quy định của pháp luật.', '## XIII. CUNG CÁP THỐNG TIN CHO NHÀ ĐẦU TƯ, CHẾ ĐỘ BÁO CÁO\nHàng tháng, quý, năm Công Ty Quản Lý Quỹ sẽ gửi thống kê giao dịch, sao kê tài khoản giao dịch, tài khoản phụ, báo cáo giá trị NAV và các thay đổi NAV của Quỹ và các báo cáo khác theo luật định cho Nhà Đầu Tư.  \nĐối với Nhà Đầu Tư giao dịch trên tài khoản ký danh, Công Ty Quản Lý Quỹ hoặc tổ chức được ủy quyền bởi Công Ty Quản Lý Quỹ (trong phạm vi pháp luật hiện hành cho phép) sẽ gửi thống kê giao dịch và sao kê tài khoản phụ nếu Nhà Đầu Tư có yêu cầu bằng văn bản. Thời hạn cung cấp thông tin là trong vòng 05 (năm) ngày làm việc, kể từ ngày nhận được yêu cầu của Nhà Đầu Tư.', '## 2.3. Đặc trưng của chứng chỉ Quỹ đầu tư\nCông ty quản lý quỹ thực hiện hoặc ủy quyền cho tổ chức cung cấp dịch vụ đại lý chuyển nhượng lập và quản lý số đăng ký nhà đầu tư chính (sổ chính) hoặc ủy quyền đại lý ký danh lập, quản lý đăng ký nhà đầu tư phụ (sổ phụ) và xác nhận quyền sở hữu chứng chỉ quỹ cho nhà đầu tư.  \nSố đăng ký nhà đầu tư của Quỹ có thể là văn bản, tập dữ liệu điện tử hoặc cả hai. Các nội dung của Số đăng ký nhà đầu tư được quy định chi tiết tại điều 15 Điều lệ Quỹ.', 'Trong các trường hợp tạm dừng thực hiện các giao dịch Đơn Vị Quỹ, Lệnh Chuyển Đổi đã nhận sẽ được thực hiện tại NAV tại Ngày Giao Dịch đầu tiên sau khi giao dịch được thực hiện trở lại.  \n**g. Quy trình chuyển nhượng chứng chỉ quỹ**  \n- **Đơn Chuyển Nhượng**  \nNhà Đầu Tư có thể Chuyển Nhượng Đơn Vị Quỹ cho nhà đầu tư khác dưới dạng quà tặng, thừa kế hoặc thực hiện lệnh của toà án. Chuyển Nhượng chỉ được thực hiện dưới dạng số lượng Đơn  \n55', '## 2.10. Tiêu chí lựa chọn, quyền hạn và trách nhiệm của Công ty Quản lý quỹ\nCông ty Quản Lý Quỹ được lựa chọn phải thỏa mãn các điều kiện sau:  \n- Được thực hiện nghiệp vụ Quản Lý Quỹ;\n- Hoàn toàn độc lập với Ngân Hàng Giám Sát;\n- Có đầy đủ cơ sở vật chất, nhân sự để Quản Lý Quỹ mở;\n- Đồng ý thực hiện các cam kết đối với Quỹ như nêu tại Phụ Lục 1 và Phụ Lục 3 của Điều lệ Quỹ.  \nCác quy định về quyền và nghĩa vụ, chấm dứt quyền và nghĩa vụ, hạn chế hoạt động của Công ty Quản lý quỹ tuân thủ theo quy định tại Chương VI Điều lệ Quỹ.', 'Nhà Đầu Tư mua Đơn Vị Quỹ cần điền đầy đủ vào phiếu Lệnh Mua có sẵn tại các Điểm Nhận Lệnh.  \nNhà Đầu Tư chỉ có thể nộp các Phiếu Lệnh Bán, Chuyển Đổi, Chuyển Nhượng, Hủy Lệnh hay thay đổi thông tin tài khoản của tài khoản mở tại một Đại Lý Phân Phối ở bất kỳ Điểm Nhận Lệnh nào của Đại Lý Phân Phối đó.', '## Lĩnh vực được phép đầu tư\n- Có quy định tại Điều lệ quỹ và Bản cáo bạch;\n- Đã được Ban đại diện quỹ chấp thuận bằng văn bản về loại, mã chứng khoán, số lượng, giá trị giao dịch, thời điểm thực hiện;\n- Có đủ tài liệu chứng minh về bảo lãnh thanh toán hoặc tài liệu về cam kết mua lại của tổ chức phát hành.', '# PHỤ LỤC 2. CÁC ĐỐI TÁC CÓ LIÊN QUAN\n## Đại lý chuyển nhượng\nTrung tâm Lưu ký Chứng khoán Việt Nam, được thành lập theo Quyết định thành lập số 171/2008/QĐ-TTg ngày 18/12/2008 của Thủ tướng Chính phủ, là đơn vị thay mặt Công ty quản lý quỹ thực hiện toàn bộ các công việc liên quan đến dịch vụ đại lý chuyển nhượng chứng chỉ quỹ theo quy định của pháp luật.', '## 2.3. Đặc trưng của chứng chỉ Quỹ đầu tư\nNhà đầu tư của Quỹ là cá nhân, tổ chức trong và ngoài nước, sở hữu chứng chỉ quỹ. Nhà đầu tư không chịu trách nhiệm pháp lý hoặc nghĩa vụ khác ngoài trách nhiệm trong phạm vi số chứng chỉ Quỹ mà họ sở hữu. Nhà đầu tư là tổ chức bao gồm các tổ chức kinh tế và xã hội được pháp luật Việt Nam công nhận.  \nNhà đầu tư pháp nhân cử người đại diện hợp pháp đại diện cho số Chứng chỉ quỹ mà mình sở hữu. Việc đề cử, hủy bỏ hay thay thế người đại diện này phải được thông báo bằng văn bản, do người đại diện có thẩm quyền của nhà đầu tư tổ chức ký.']","Thực hiện bảo quản, lưu ký chứng khoán, tài liệu quyền sở hữu tài sản, thực hiện thu các khoản lãi/cổ tức và giám sát các hoạt động đầu tư của Công ty quản lý quỹ."
