question,answer,contexts,ground_truth
Tên đầy đủ tiếng Việt và tiếng Anh của quỹ TCSME là gì?,"Tên đầy đủ của quỹ TCSME là Quỹ Đầu Tư Cổ Phiếu Doanh Nghiệp Vừa Và Nhỏ Techcom.

Trong tiếng Anh, tên này có thể được dịch là Techcom Small and Medium Enterprise Equity Investment Fund.

Thông tin này được lấy từ trang 6 của tài liệu.","['# IX. THÔNG TIN VỀ QUỸ ĐẦU TƯ CỔ PHIẾU DOANH NGHIỆP VỮA VÀ NHỎ TECHCOM (TCSME)\n## 1. Thông tin chung về Quỹ\n- Tên Quỹ bằng tiếng Việt: QUỸ ĐẦU TƯ CỔ PHIẾU DOANH NGHIỆP VỮA VÀ NHỎ TECHCOM\n- Tên Quỹ bằng tiếng Anh: Techcom Small and Medium Enterprise Equity Fund\n- Tên viết tắt: TCSME', '# II. CÁC ĐỊNH NGHĨA\n“Quỹ” có nghĩa là Quỹ Đầu Tư Cổ phiếu Doanh nghiệp vừa và nhỏ Techcom, một loại hình Quỹ đầu tư chứng khoán dạng mở do Công ty Quản Lý Quỹ quản lý chào bán Chứng Chỉ Quỹ ra công chúng và được thành lập theo các quy định hiện hành về chứng khoán tại Việt Nam và Điều lệ này.  \n“Công ty Quản Lý Quỹ” có nghĩa là Công ty Cổ phần Quản Lý Quỹ Kỹ thương, được thành lập theo giấy phép thành lập và hoạt động Số 40/UBCK-GP do Chủ tịch Ủy ban Chứng khoán Nhà nước cấp ngày 21/10/2008 và được cấp lại Giấy phép thành lập và hoạt động Số 57/GP-UBCK do UBCKNN cấp ngày 30/01/2019 do chuyển đổi loại hình từ công ty TNHH sang công ty cổ phần.', '# MỤC LỤC\n1. Công ty quản lý quỹ ... 5\n2. Ngân hàng giám sát ... 5  \nII. CÁC ĐỊNH NGHĨA ... 5  \nIII. CƠ HỘI ĐẦU TƯ ... 8\n1. Tổng quan tình hình kinh tế vĩ mô ... 8\n2. Thị trường tài chính Việt Nam và cơ hội đầu tư ... 11\n3. Lợi thế của quỹ mở ... 14  \nIV. THÔNG TIN VỀ CÔNG TY CỔ PHẦN QUẢN LÝ QUỸ KỸ THƯƠNG ... 15\n1. Các thông tin chung ... 15\n2. Tình hình hoạt động của Công ty Cổ phần Quản lý Quỹ Kỹ thương ... 17  \nV. NGÂN HÀNG GIÁM SÁT ... 17  \nVI. CÔNG TY KIỂM TOÁN ... 17  \nVII. ĐẠI LÝ PHÂN PHỐI CHỨNG CHỈ QUỸ ... 18  \nVIII. TỔ CHỨC ĐƯỢC ỦY QUYỀN ... 18\n1. Ủy quyền đại lý chuyên nhượng ... 18\n2. Ủy quyền dịch vụ quản trị quỹ đầu tư ... 18  \nIX. THÔNG TIN VỀ QUỸ ĐẦU TƯ CỔ PHIẾU DOANH NGHIỆP VỮA VÀ NHỎ TECHCOM (TCSME) ... 18\n1. Thông tin chung về Quỹ ... 18\n2. Điều lệ Quỹ tóm tắt ... 19', '## 2. Ngân hàng giám sát\nNgân hàng TMCP Đầu tư và Phát triển Việt Nam - Chi nhánh Hà Thành  \nĐại diện hợp pháp: Ông Nguyễn Mạnh Cường  \nChức vụ: Phó Giám đốc  \nBản cáo bạch này là một phần của hồ sơ đăng ký chào bán của Công ty Cổ phần Quản lý quỹ Kỹ thương (Techcom Capital – “TCC”). Chúng tôi, với tư cách là Ngân hàng Giám sát của Quỹ Đầu Tư Cổ phiếu Doanh nghiệp vừa và nhỏ Techcom (TCSME) sẽ chịu trách nhiệm theo các quy định trong phạm vi Hợp Đồng Cung Cấp Dịch Vụ Giám Sát Quỹ được ký kết giữa chúng tôi với Công ty Cổ phần Quản lý quỹ Kỹ thương, là công ty quản lý Quỹ Đầu tư Cổ phiếu Doanh nghiệp vừa và nhỏ Techcom và theo quy định của pháp luật.', '# IV. THÔNG TIN VỀ CÔNG TY CỔ PHẦN QUẢN LÝ QUỸ KỸ THƯƠNG\n## 1. Các thông tin chung\n- **Tên bằng tiếng Việt:** Công ty Cổ phần Quản lý Quỹ Kỹ thương\n- **Tên bằng tiếng Anh:** TechcomCapital Joint Stock Company\n- **Tên viết tắt:** TechcomCapital (TCC)\n- **Giấy phép thành lập:** Giấy phép thành lập và hoạt động Số 40/UBCK-GP do Chủ tịch Ủy ban Chứng khoán Nhà nước cấp ngày 21/10/2008 và được cấp lại Giấy phép thành lập và hoạt động Số 57/GP-UBCK do UBCKNN cấp ngày 30/01/2019 do chuyển đổi loại hình từ công ty TNHH sang công ty cổ phần.\n- **Giấy chứng nhận đăng ký doanh nghiệp số** 0102995749 do Sở Kế hoạch và Đầu tư Thành phố Hà Nội cấp ngày 27/05/2021\n- **Vốn điều lệ:** 44.943.820.000 đồng (Bốn mươi bốn tỷ chính trăm bốn mươi ba triệu tám trăm hai mươi nghìn đồng)\n- **Địa chỉ đăng ký:** Tầng 28, Tòa C5, số 119 Trần Duy Hưng, phường Trung Hòa, Quận Cầu Giấy, Hà Nội', '## 3.4. Rủi ro tỷ giá\nDo tài sản và nợ phải trả của Quỹ đều được trình bày bằng đồng Việt Nam, là đơn vị tiền tệ sử dụng của Quỹ. Vì vậy, mặc dù rủi ro tỷ giá trong trung hạn tại Việt Nam trong thời điểm hiện nay được chúng tôi đánh giá là tương đối thấp do tình hình kinh tế vĩ mô được giữ ổn định, cán cân thương mại thặng dư và Chính phủ thể hiện quyết tâm duy trì sự ổn định của đồng Việt Nam, các Nhà Đầu Tư nước ngoài thực tế sẽ phải chịu rủi ro tỷ giá trong thời gian đầu tư tại Việt Nam.  \n43', '## 2. Thông tin về đợt phát hành lần đầu ra công chúng\nNhà Đầu Tư nên tham khảo ý kiến của các chuyên gia tư vấn tài chính riêng của mình để đảm bảo Nhà Đầu Tư đủ điều kiện để đầu tư vào Quỹ theo các quy định pháp luật áp dụng và liệu Quỹ có phù hợp với khả năng chấp nhận rủi ro của Nhà Đầu Tư.  \n|  Tên quỹ | Quỹ Đầu tư Cổ phiếu Doanh nghiệp vừa và nhỏ Techcom  |\n| --- | --- |\n|  Loại hình | Quỹ mở  |\n|  Mục tiêu đầu tư | Mục tiêu đầu tư của Quỹ là tìm kiếm lợi nhuận dài hạn thông qua thu nhập và tăng trưởng giá trị đầu tư vốn trên cơ sở đánh giá, lựa chọn các tài sản có chất lượng tốt, phân bổ danh mục hợp lý và tối thiểu hóa rủi ro cho Nhà Đầu Tư.  |', '## 2. Điều lệ Quỹ tóm tắt\nCơ quan quyền lực cao nhất của Quỹ là Đại hội Nhà Đầu tư.  \nBan Đại diện Quỹ sẽ do Đại hội Nhà Đầu tư bầu ra để giám sát các hoạt động thường xuyên của Quỹ, TCC và Ngân hàng giám sát.  \n#### 2.1.2 Tổng vốn huy động và số lượng chứng chỉ Quỹ được chào bán  \nVốn Điều lệ được huy động trong lần đầu chào bán ra công chúng của Quỹ là 50.000.000.000 VNĐ (Năm mươi tỷ đồng). Vốn Điều lệ sẽ được chia thành 5.000.000 (Năm triệu) Chứng chỉ Quỹ. Mệnh giá của một Chứng chỉ Quỹ sẽ là 10.000 VNĐ (mười nghìn Đồng Việt Nam).  \nNhà đầu tư góp vốn bằng tiền Đồng Việt Nam dưới hình thức chuyển khoản hoặc chuyển tiền vào tài khoản của Quỹ mở tại ngân hàng giám sát.  \nSố lượng chứng chỉ quỹ/tổng chứng chỉ quỹ được phép lưu hành tối đa: không hạn chế.', '## 2.12. Kiểm toán, kế toán và chế độ báo cáo\nQuỹ sẽ áp dụng chế độ kế toán Việt Nam (VAS) và tuân thủ các quy định khác liên quan tới công tác kế toán cho Quỹ do các cơ quan có thẩm quyền quy định. Đồng Việt Nam sẽ là đồng tiền được sử dụng và thể hiện.', 'Quỹ không quy định quy mô tối đa trong đợt phát hành lần đầu ra công chúng. Vì vậy, nếu giá trị phát hành được vượt 50.000.000.000 VNĐ (năm mươi tỷ đồng), các Nhà Đầu Tư sẽ được phân bổ số lượng Đơn Vị Quỹ bằng với số đã đặt mua.  \n- Địa điểm phát hành:\nCông ty Cổ phần Quản lý Quỹ Kỹ thương\nĐịa chỉ đăng ký: Tầng 28, Tòa C5, số 119 Trần Duy Hưng, phường Trung Hòa, Quận Cầu Giấy, Hà Nội\nĐiện thoại: (+84) 24 39446368   Fax: (+84) 24 39446583  \n- Đại lý phân phối và điểm nhận lệnh:\nCông ty Cổ phần Chứng khoán Kỹ thương (“TCBS”)\nĐịa chỉ: Tầng 10 và Tầng 12, tòa nhà Techcombank, 191 Bà Triệu, phường Lê Đại Hành, quận Hai Bà Trưng, TP. Hà Nội\nĐiện thoại: 84.24.22201039   Fax: 84.24.22201032  \n- Các đối tác có liên quan đến đợt phát hành  \n**Ủy quyền đại lý chuyển nhượng**', '## THÔNG BÁO QUAN TRỌNG\nthành tiền) các Đơn Vị Quỹ trong phạm vi lãnh thổ tài phán áp dụng đối với quốc tịch, nơi cư trú của mình hoặc theo luật pháp của bất kỳ quốc gia hay lãnh thổ nào áp dụng cho Nhà Đầu Tư hoặc bất kỳ quỹ được quản lý nào được sử dụng để mua Đơn Vị Quỹ, và xác định các vấn đề có thể phát sinh liên quan đến pháp lý, thuế, tài chính hay các vấn đề khác từ việc mua và nắm giữ Đơn Vị Quỹ trước khi quyết định đăng ký mua Đơn Vị Quỹ', 'vi. Chứng khoán phái sinh niêm yết, giao dịch tại các Sở Giao dịch Chứng khoán, và chỉ nhằm mục tiêu phòng ngừa rủi ro cho chứng khoán cơ sở mà quỹ đang nắm giữ.  \nvii. Quyền phát sinh gắn liền với chứng khoán mà Quỹ đang nắm giữ.  |\n| --- | --- |\n|  Cơ cấu đầu tư | Các khoản đầu tư của Quỹ sẽ được đa dạng hóa và đáp ứng được các điều kiện của pháp luật. Cơ cấu danh mục đầu tư của Quỹ phải bảo đảm tuân thủ các nguyên tắc sau:  \ni. Cơ cấu danh mục đầu tư của quỹ mở phải bao gồm chứng khoán của ít nhất sáu (06) tổ chức phát hành, đồng thời phải bảo đảm:', '## 3. Các rủi ro khi đầu tư vào Quỹ\nMục tiêu của Công Ty Quản Lý Quỹ là quản lý các rủi ro đầu tư, và nếu có thể, hạn chế tác động của các rủi ro này bằng việc áp dụng các phương pháp quản lý đầu tư theo tiêu chuẩn quốc tế tốt nhất. Nhà Đầu Tư cần lưu ý các điểm quan trọng sau đây:  \n- Quỹ, Công Ty Quản Lý Quỹ, thành viên Hội đồng thành viên, ban điều hành và nhân viên Công Ty Quản Lý Quỹ không có bất kỳ sự đảm bảo nào đối với vốn đầu tư ban đầu cũng như mức lợi nhuận từ đầu tư của Quỹ;\n- Không có bất kỳ sự bảo đảm nào về sổ lần chi trả và giá trị của cổ tức được thanh toán trong tương lai;  \n42', '6  \nvà Giấy chứng nhận đăng ký hoạt động lưu ký chứng khoán số 510/QĐ-ĐKHĐLK ngày 01/08/2006 do UBCKNN cấp, thực hiện các nghiệp vụ bảo quản, lưu ký các chứng khoán, các hợp đồng kinh tế, các chứng từ có liên quan đến tài sản của Quỹ, đồng thời giám sát hoạt động của Quỹ. Quyền và nghĩa vụ của Ngân Hàng Giám Sát được quy định tại Chương VII của Điều lệ Quỹ.  \n“Công Ty Kiểm Toán”\nlà công ty kiểm toán độc lập cho quỹ được Đại Hội Nhà Đầu Tư chỉ định, thực hiện việc kiểm toán hàng năm tài sản của Quỹ Đầu Tư Cổ phiếu Doanh nghiệp vừa và nhỏ Techcom.  \n“Điều lệ”\ncó nghĩa là Điều lệ Quỹ, các phụ lục đính kèm và các sửa đổi bổ sung hợp pháp (nếu có) được Đại hội nhà đầu tư thông qua tại Đại hội Nhà đầu tư.  \n“Bản Cáo Bạch”', '## 2. Thông tin về đợt phát hành lần đầu ra công chúng\nNgoài ra, để đảm bảo tối ưu hóa lợi ích của nhà đầu tư, Quỹ có sự linh hoạt trong phân bổ tài sản tùy thuộc vào cơ hội đầu tư sẵn có tại các thời điểm khác nhau. Việc phân bổ tài sản có thể thay đổi đáng kể tùy thuộc vào nhận định của Quỹ, với mục tiêu xuyên suốt trong toàn bộ thời gian hoạt động của Quỹ là bảo vệ lợi ích của Nhà Đầu Tư.  \nVới chiến lược đầu tư như đã đề cập ở trên, cơ cấu danh mục đầu tư của Quỹ có thể thay đổi theo thời gian dựa theo tiềm năng tăng trưởng của cổ phiếu và tùy vào mức độ thanh khoản của các cổ phiếu trên thị trường. Tỷ trọng các khoản đầu tư không vượt quá những hạn chế đầu tư quy định tại mục “Hạn chế đầu tư”.  \nCác loại tài sản mà quỹ được đầu tư bao gồm:\ni. Tiền gửi tại các ngân hàng thương mại theo quy định của pháp luật về  |', '## c) Tuân Thủ\nHợp đồng mở tài khoản giao dịch chứng khoán và đăng ký giao dịch quỹ mở để mua Đơn Vị Quỹ được soạn thảo để đáp ứng các yêu cầu áp dụng cho Các Công Ty Quản Lý Quỹ nhằm tuân thủ các quy định về Nhận Biết Khách Hàng (“KYC”) và các quy định Phòng Chống Rửa Tiền (“AML”). Vì vậy việc tất cả các giấy tờ và khai báo trong Hợp đồng cần được hoàn tất đầy đủ và trung thực.  \nTheo pháp luật Việt Nam, tất cả nhà đầu tư bắt buộc phải cung cấp giấy tờ và các thông tin bổ sung theo quy định về KYC và AML. Nhà đầu tư nước ngoài có thể phải cung cấp các thông tin và khai báo bổ sung nhằm tuân thủ các quy định quốc tế. Các Hợp đồng không có đủ hồ sơ hoặc thông tin theo yêu cầu có thể bị từ chối.', '## 2.3. Đặc trưng của chứng chỉ Quỹ đầu tư\nNhà đầu tư của Quỹ là cá nhân, tổ chức trong và ngoài nước, sở hữu chứng chỉ quỹ. Nhà đầu tư không chịu trách nhiệm pháp lý hoặc nghĩa vụ khác ngoài trách nhiệm trong phạm vi số chứng chỉ Quỹ mà họ sở hữu. Nhà đầu tư là tổ chức bao gồm các tổ chức kinh tế và xã hội được pháp luật Việt Nam công nhận.  \nNhà đầu tư pháp nhân cử người đại diện hợp pháp đại diện cho số Chứng chỉ quỹ mà mình sở hữu. Việc đề cử, hủy bỏ hay thay thế người đại diện này phải được thông báo bằng văn bản, do người đại diện có thẩm quyền của nhà đầu tư tổ chức ký.', 'Nhà Đầu Tư có thể thanh toán số tiền mua Đơn Vị Quỹ từ tài khoản ngân hàng của mình vào tài khoản của Quỹ để Ngân Hàng Giám Sát nhận được đúng hạn và Đại Lý Phân Phối hoàn thành xử lý việc đăng ký với Đại Lý Chuyển Nhượng. Mọi khoản đầu tư vào Đơn Vị Quỹ đều thực hiện bằng tiền Đồng Việt Nam.  \nTrong trường hợp lệnh mua chứng chỉ quỹ và việc thanh toán cho lệnh mua được thực hiện bởi cá nhân, tổ chức khác không phải nhà đầu tư thì phiếu lệnh và tài liệu xác nhận thanh toán phải nêu rõ tên, số tài khoản và giá trị thanh toán của nhà đầu tư được hưởng lợi.', '## 2.2.4 Hạn mức đầu tư\nHạn mức đầu tư của Quỹ được quy định chi tiết tuân thủ các quy định tại Thông tư hướng dẫn hoạt động và quản lý các quỹ đầu tư chứng khoán. Cơ cấu danh mục đầu tư của Quỹ phải bảo đảm tuân thủ các hạn mức đầu tư sau:  \na) Trừ tiền gửi trên tài khoản thanh toán của quỹ tại ngân hàng giám sát, quỹ mở không được đầu tư quá 49% tổng giá trị tài sản của quỹ vào các tài sản theo quy định tại điểm a, b mục IX.2.2.3  \nb) Không được đầu tư vào chứng khoán của một tổ chức phát hành quá 10% tổng giá trị chứng khoán đang lưu hành của tổ chức đó, trừ công cụ nợ của Chính phủ;  \nc) Không được đầu tư quá 20% tổng giá trị tài sản của quỹ vào chứng khoán đang lưu hành và các tài sản (nếu có) quy định tại điểm a, b mục IX.2.2.3 của một tổ chức phát hành, trừ công cụ nợ của Chính phủ;', '## Lĩnh vực được phép đầu tư\nđ) Cổ phiếu chào bán lần đầu ra công chúng, trái phiếu chào bán ra công chúng; trái phiếu doanh nghiệp phát hành riêng lẻ bởi tổ chức niêm yết có bảo lãnh thanh toán của tổ chức tín dụng hoặc cam kết mua lại của tổ chức phát hành tối thiểu 1 lần trong 12 tháng và mỗi lần cam kết mua lại tối thiểu 30% giá trị đợt phát hành;  \ne) Chứng khoán phải sinh niêm yết giao dịch tại Sở giao dịch chứng khoán và chỉ nhằm mục tiêu phòng ngừa rủi ro cho chứng khoán cơ sở mà quỹ đang nắm giữ;  \ng) Quyền phát sinh gắn liền với chứng khoán mà quỹ đang nắm giữ.  \nViệc đầu tư vào các tài sản quy định tại điểm đ khoản 2.2.3 Điều này phải đáp ứng các điều kiện sau:  \n- Có quy định tại Điều lệ quỹ và Bản cáo bạch;', '“Bản Cáo Bạch”\ncó nghĩa là tài liệu này hoặc dữ liệu điện tử công khai thông tin chính xác, trung thực và khách quan liên quan đến việc chào bán và phát hành Chứng Chỉ Quỹ của Quỹ.  \n“Hợp Đồng Giám Sát”\ncó nghĩa là hợp đồng được ký kết giữa Công ty Quản Lý Quỹ và Ngân Hàng Giám Sát được thông qua bởi Đại Hội Nhà Đầu Tư.  \n“Nhà Đầu Tư”\nlà cá nhân, tổ chức trong nước và ngoài nước nắm giữ Chứng Chỉ Quỹ  \n“Đại Hội Nhà Đầu Tư”\nLà đại hội của Nhà Đầu Tư có quyền biểu quyết được tổ chức thường kỳ hoặc bất thường để thông qua các vấn đề quan trọng có liên quan đến Quỹ. Đại Hội Nhà Đầu Tư là cơ quan quyền lực cao nhất của Quỹ.  \n“Ban Đại Diện Quỹ”', '## 2. Điều lệ Quỹ tóm tắt\n#### 2.2.1 Mục tiêu đầu tư  \nMục tiêu đầu tư của Quỹ là tìm kiếm lợi nhuận dài hạn thông qua thu nhập và tăng trưởng giá trị đầu tư vốn trên cơ sở đánh giá, lựa chọn các tài sản có chất lượng tốt, phân bổ danh mục hợp lý và tối thiểu hóa rủi ro cho Nhà Đầu Tư.  \n#### 2.2.2 Chiến lược và lĩnh vực đầu tư  \n##### Chiến lược đầu tư  \nChiến lược đầu tư chính của Quỹ là đầu tư năng động vào cổ phiếu của các Công ty hàng đầu trong rổ cổ phiếu VNMID và VNSML được công bố bởi Sở Giao dịch Chứng khoán Thành Phố Hồ Chí Minh. Theo đó, chiến lược đầu tư của Quỹ bao gồm nhưng không hạn chế đầu tư vào (i)  \n19', '# NGÂN HÀNG GIÁM SÁT\nTên ngân hàng giám sát: Ngân hàng TMCP Đầu tư &amp; Phát triển Việt Nam – Chi nhánh Hà Thành;  \nGiấy chứng nhận đăng ký kinh doanh số 0100150619-073 cấp lần đầu ngày 12/09/2003, thay đổi lần thứ 12 ngày 16/06/2020 do Sở Kế hoạch và Đầu tư thành phố Hà Nội cấp;  \nGiấy phép hoạt động lưu ký chứng khoán số: 510/QĐ-ĐKHĐLK ngày 01/08/2006 do UBCKNN cấp;  \nChúng tôi, với tư cách là Ngân hàng giám sát của Quỹ Đầu Tư Cổ phiếu Doanh nghiệp vừa và nhỏ Techcom sẽ chịu trách nhiệm theo các quy định trong phạm vi Hợp Đồng Cung Cấp Dịch Vụ lưu ký giám sát của Quỹ được ký kết giữa chúng tôi với Công ty Cổ phần Quản lý Quỹ Kỹ Thương, và các quy định về Ngân hàng giám sát trong Điều lệ, Bản cáo bạch của Quỹ.  \n![img-13.jpeg](img-13.jpeg)  \nPHÓ GIÁM ĐỐC\nNguyễn Mạnh Cường', '- Không đầu tư quá 30% tổng giá trị tài sản của quỹ vào các chứng chỉ quỹ đại chúng, cổ phiếu công ty đầu tư chứng khoán đại chúng;  \nxi. Quỹ chỉ được đầu tư tiền gửi, công cụ tiền tệ quy định tại điểm i và ii các loại tài sản Quỹ được phép đầu tư được phát hành bởi các tổ chức tín dụng trong danh sách đã được Ban Đại Diện Quỹ phê duyệt bằng văn bản hoặc thông qua bỏ phiếu điện tử (e-voting) tuân thủ theo các Quy định Pháp luật hiện hành.  \nCơ cấu đầu tư của Quỹ được phép sai lệch so với các hạn chế được đưa ra tại điểm i, ii, iii, iv, v, vi và ix nếu trên nhưng chỉ vì các lý do sau:  \n- Biến động giá trên thị trường của các tài sản trong danh mục đầu tư của Quỹ;  \n- Thực hiện các khoản thanh toán phù hợp với Pháp Luật của Quỹ;  \n- Thực hiện các lệnh giao dịch của Nhà Đầu Tư;', 'nhóm chứng khoán có tiềm năng tăng trưởng tốt trong dài hạn và/hoặc doanh nghiệp có tính cạnh tranh tương đối cao, (ii) nhóm chứng khoán có mức định giá hấp dẫn, (iii) nhóm chứng khoán có lợi tức cao, ổn định.  \nNgoài ra, để đảm bảo tối ưu hóa lợi ích của nhà đầu tư, Quỹ có sự linh hoạt trong phân bổ tài sản tùy thuộc vào cơ hội đầu tư sẵn có tại các thời điểm khác nhau. Việc phân bổ tài sản có thể thay đổi đáng kể tùy thuộc vào nhận định của Quỹ, với mục tiêu xuyên suốt trong toàn bộ thời gian hoạt động của Quỹ là bảo vệ lợi ích của Nhà Đầu Tư.']",Tên tiếng Việt: Quỹ Đầu tư Cổ phiếu Doanh nghiệp vừa và nhỏ Techcom. Tên tiếng Anh: Techcom Small and Medium Enterprise Equity Fund.
Mục tiêu đầu tư chính của Quỹ TCSME được quy định như thế nào trong Bản cáo bạch?,"Mục tiêu đầu tư chính của Quỹ Đầu tư Cổ phiếu Doanh nghiệp vừa và nhỏ Techcom (TSCME) được quy định như sau:

- Mục tiêu đầu tư của Quỹ là tìm kiếm lợi nhuận dài hạn thông qua thu nhập và tăng trưởng giá trị đầu tư vốn trên cơ sở đánh giá, lựa chọn các tài sản có chất lượng tốt, phân bổ danh mục hợp lý và tối thiểu hóa rủi ro cho Nhà Đầu Tư.

Thông tin này được lấy từ trang 48 của Bản cáo bạch.","['## Lĩnh vực được phép đầu tư\nDanh mục đầu tư của quỹ phải phù hợp với mục tiêu và chính sách đầu tư đã được quy định tại Điều lệ quỹ và công bố tại Bản cáo bạch. Danh mục đầu tư của quỹ đầu tư bao gồm các loại tài sản sau đây:  \na) Tiền gửi các ngân hàng thương mại theo quy định của pháp luật ngân hàng;  \nb) Công cụ thị trường tiền tệ bao gồm giấy tờ có giá, công cụ chuyển nhượng theo quy định của pháp luật;  \nc) Công cụ nợ của Chính phủ, trái phiếu được Chính phủ bảo lãnh, trái phiếu chính quyền địa phương;  \nd) Cổ phiếu niêm yết, cổ phiếu đăng ký giao dịch, trái phiếu niêm yết trên Sở giao dịch chứng khoán, chứng chỉ quỹ đại chúng;', '## 2. Điều lệ Quỹ tóm tắt\n#### 2.2.1 Mục tiêu đầu tư  \nMục tiêu đầu tư của Quỹ là tìm kiếm lợi nhuận dài hạn thông qua thu nhập và tăng trưởng giá trị đầu tư vốn trên cơ sở đánh giá, lựa chọn các tài sản có chất lượng tốt, phân bổ danh mục hợp lý và tối thiểu hóa rủi ro cho Nhà Đầu Tư.  \n#### 2.2.2 Chiến lược và lĩnh vực đầu tư  \n##### Chiến lược đầu tư  \nChiến lược đầu tư chính của Quỹ là đầu tư năng động vào cổ phiếu của các Công ty hàng đầu trong rổ cổ phiếu VNMID và VNSML được công bố bởi Sở Giao dịch Chứng khoán Thành Phố Hồ Chí Minh. Theo đó, chiến lược đầu tư của Quỹ bao gồm nhưng không hạn chế đầu tư vào (i)  \n19', '## 2.2.4 Hạn mức đầu tư\nHạn mức đầu tư của Quỹ được quy định chi tiết tuân thủ các quy định tại Thông tư hướng dẫn hoạt động và quản lý các quỹ đầu tư chứng khoán. Cơ cấu danh mục đầu tư của Quỹ phải bảo đảm tuân thủ các hạn mức đầu tư sau:  \na) Trừ tiền gửi trên tài khoản thanh toán của quỹ tại ngân hàng giám sát, quỹ mở không được đầu tư quá 49% tổng giá trị tài sản của quỹ vào các tài sản theo quy định tại điểm a, b mục IX.2.2.3  \nb) Không được đầu tư vào chứng khoán của một tổ chức phát hành quá 10% tổng giá trị chứng khoán đang lưu hành của tổ chức đó, trừ công cụ nợ của Chính phủ;  \nc) Không được đầu tư quá 20% tổng giá trị tài sản của quỹ vào chứng khoán đang lưu hành và các tài sản (nếu có) quy định tại điểm a, b mục IX.2.2.3 của một tổ chức phát hành, trừ công cụ nợ của Chính phủ;', '## 3. Các rủi ro khi đầu tư vào Quỹ\nMục tiêu của Công Ty Quản Lý Quỹ là quản lý các rủi ro đầu tư, và nếu có thể, hạn chế tác động của các rủi ro này bằng việc áp dụng các phương pháp quản lý đầu tư theo tiêu chuẩn quốc tế tốt nhất. Nhà Đầu Tư cần lưu ý các điểm quan trọng sau đây:  \n- Quỹ, Công Ty Quản Lý Quỹ, thành viên Hội đồng thành viên, ban điều hành và nhân viên Công Ty Quản Lý Quỹ không có bất kỳ sự đảm bảo nào đối với vốn đầu tư ban đầu cũng như mức lợi nhuận từ đầu tư của Quỹ;\n- Không có bất kỳ sự bảo đảm nào về sổ lần chi trả và giá trị của cổ tức được thanh toán trong tương lai;  \n42', '## 2. Thông tin về đợt phát hành lần đầu ra công chúng\n|  Chiến lược đầu tư | Chiến lược đầu tư chính của Quỹ là đầu tư năng động vào cổ phiếu của các Công ty hàng đầu trong rổ cổ phiếu VNMID và VNSML được công bố bởi Sở Giao dịch Chứng khoán Thành Phố Hồ Chí Minh. Theo đó, chiến lược đầu tư của Quỹ bao gồm nhưng không hạn chế đầu tư vào (i) nhóm chứng khoán có tiềm năng tăng trưởng tốt trong dài hạn và/hoặc doanh nghiệp có tính cạnh tranh tương đối cao, (ii) nhóm chứng khoán có mức định giá hấp dẫn, (iii) nhóm chứng khoán có lợi tức cao, ổn định.', '## Lĩnh vực được phép đầu tư\nđ) Cổ phiếu chào bán lần đầu ra công chúng, trái phiếu chào bán ra công chúng; trái phiếu doanh nghiệp phát hành riêng lẻ bởi tổ chức niêm yết có bảo lãnh thanh toán của tổ chức tín dụng hoặc cam kết mua lại của tổ chức phát hành tối thiểu 1 lần trong 12 tháng và mỗi lần cam kết mua lại tối thiểu 30% giá trị đợt phát hành;  \ne) Chứng khoán phải sinh niêm yết giao dịch tại Sở giao dịch chứng khoán và chỉ nhằm mục tiêu phòng ngừa rủi ro cho chứng khoán cơ sở mà quỹ đang nắm giữ;  \ng) Quyền phát sinh gắn liền với chứng khoán mà quỹ đang nắm giữ.  \nViệc đầu tư vào các tài sản quy định tại điểm đ khoản 2.2.3 Điều này phải đáp ứng các điều kiện sau:  \n- Có quy định tại Điều lệ quỹ và Bản cáo bạch;', '## 2. Thông tin về đợt phát hành lần đầu ra công chúng\nNgoài ra, để đảm bảo tối ưu hóa lợi ích của nhà đầu tư, Quỹ có sự linh hoạt trong phân bổ tài sản tùy thuộc vào cơ hội đầu tư sẵn có tại các thời điểm khác nhau. Việc phân bổ tài sản có thể thay đổi đáng kể tùy thuộc vào nhận định của Quỹ, với mục tiêu xuyên suốt trong toàn bộ thời gian hoạt động của Quỹ là bảo vệ lợi ích của Nhà Đầu Tư.  \nVới chiến lược đầu tư như đã đề cập ở trên, cơ cấu danh mục đầu tư của Quỹ có thể thay đổi theo thời gian dựa theo tiềm năng tăng trưởng của cổ phiếu và tùy vào mức độ thanh khoản của các cổ phiếu trên thị trường. Tỷ trọng các khoản đầu tư không vượt quá những hạn chế đầu tư quy định tại mục “Hạn chế đầu tư”.  \nCác loại tài sản mà quỹ được đầu tư bao gồm:\ni. Tiền gửi tại các ngân hàng thương mại theo quy định của pháp luật về  |', '## 2.2.5 Điều chỉnh danh mục đầu tư\nCơ cấu đầu tư của quỹ mở chỉ được vượt mức so với các hạn chế đầu tư đã quy định tại điểm a, b, c, d, đ, e và i mục IX.2.2.4 và chỉ do các nguyên nhân sau:  \na) Biến động giá trên thị trường của tài sản trong danh mục đầu tư của quỹ;  \nb) Thực hiện các khoản thanh toán của quỹ theo quy định của pháp luật, bao gồm việc thực hiện lệnh giao dịch của nhà đầu tư;', '## 2. Điều lệ Quỹ tóm tắt\nCơ quan quyền lực cao nhất của Quỹ là Đại hội Nhà Đầu tư.  \nBan Đại diện Quỹ sẽ do Đại hội Nhà Đầu tư bầu ra để giám sát các hoạt động thường xuyên của Quỹ, TCC và Ngân hàng giám sát.  \n#### 2.1.2 Tổng vốn huy động và số lượng chứng chỉ Quỹ được chào bán  \nVốn Điều lệ được huy động trong lần đầu chào bán ra công chúng của Quỹ là 50.000.000.000 VNĐ (Năm mươi tỷ đồng). Vốn Điều lệ sẽ được chia thành 5.000.000 (Năm triệu) Chứng chỉ Quỹ. Mệnh giá của một Chứng chỉ Quỹ sẽ là 10.000 VNĐ (mười nghìn Đồng Việt Nam).  \nNhà đầu tư góp vốn bằng tiền Đồng Việt Nam dưới hình thức chuyển khoản hoặc chuyển tiền vào tài khoản của Quỹ mở tại ngân hàng giám sát.  \nSố lượng chứng chỉ quỹ/tổng chứng chỉ quỹ được phép lưu hành tối đa: không hạn chế.', '- Không đầu tư quá 30% tổng giá trị tài sản của quỹ vào các chứng chỉ quỹ đại chúng, cổ phiếu công ty đầu tư chứng khoán đại chúng;  \nxi. Quỹ chỉ được đầu tư tiền gửi, công cụ tiền tệ quy định tại điểm i và ii các loại tài sản Quỹ được phép đầu tư được phát hành bởi các tổ chức tín dụng trong danh sách đã được Ban Đại Diện Quỹ phê duyệt bằng văn bản hoặc thông qua bỏ phiếu điện tử (e-voting) tuân thủ theo các Quy định Pháp luật hiện hành.  \nCơ cấu đầu tư của Quỹ được phép sai lệch so với các hạn chế được đưa ra tại điểm i, ii, iii, iv, v, vi và ix nếu trên nhưng chỉ vì các lý do sau:  \n- Biến động giá trên thị trường của các tài sản trong danh mục đầu tư của Quỹ;  \n- Thực hiện các khoản thanh toán phù hợp với Pháp Luật của Quỹ;  \n- Thực hiện các lệnh giao dịch của Nhà Đầu Tư;', 'vi. Chứng khoán phái sinh niêm yết, giao dịch tại các Sở Giao dịch Chứng khoán, và chỉ nhằm mục tiêu phòng ngừa rủi ro cho chứng khoán cơ sở mà quỹ đang nắm giữ.  \nvii. Quyền phát sinh gắn liền với chứng khoán mà Quỹ đang nắm giữ.  |\n| --- | --- |\n|  Cơ cấu đầu tư | Các khoản đầu tư của Quỹ sẽ được đa dạng hóa và đáp ứng được các điều kiện của pháp luật. Cơ cấu danh mục đầu tư của Quỹ phải bảo đảm tuân thủ các nguyên tắc sau:  \ni. Cơ cấu danh mục đầu tư của quỹ mở phải bao gồm chứng khoán của ít nhất sáu (06) tổ chức phát hành, đồng thời phải bảo đảm:', '## Lĩnh vực được phép đầu tư\nVới chiến lược đầu tư như đã đề cập ở trên, cơ cấu danh mục đầu tư của Quỹ có thể thay đổi theo thời gian dựa theo tiềm năng tăng trưởng của cổ phiếu và tùy vào mức độ thanh khoản của các cổ phiếu trên thị trường. Tỷ trọng các khoản đầu tư không vượt quá những hạn chế đầu tư quy định tại mục “Hạn chế đầu tư”.', '## THÔNG BÁO QUAN TRỌNG\nCác nhà đầu tư nên nghiên cứu Bản Cáo Bạch này một cách cẩn trọng và toàn diện và không nên coi nội dung hoặc các tóm tắt ở đây là các tư vấn liên quan đến pháp lý, thuế, hoặc tài chính/đầu tư và nên tham khảo ý kiến chuyên gia tư vấn của mình về các yêu cầu pháp lý hoặc các điều kiện hoặc bất kỳ các hạn chế nào khác liên quan đến việc đăng ký mua, mua, cho tặng, nắm giữ, định đoạt (chuyển nhượng; chuyển đổi quỹ hoặc bản hoặc chuyển đổi thành tiền) các Đơn Vị Quỹ, việc xử lý khoản thu nhập (nếu có), lợi nhuận đầu tư, hoặc các khoản phân phối lợi nhuận, các khoản thuế khác liên quan đến việc đăng ký mua, mua, cho tặng, nắm giữ, định đoạt (bản, chuyển giao, chuyển đổi quỹ hoặc bản hoặc chuyển đổi thành tiền) các Đơn Vị Quỹ trong phạm vi lãnh thổ tài phán áp dụng đối với quốc tịch, nơi cư trú', '# MỤC LỤC\n1. Công ty quản lý quỹ ... 5\n2. Ngân hàng giám sát ... 5  \nII. CÁC ĐỊNH NGHĨA ... 5  \nIII. CƠ HỘI ĐẦU TƯ ... 8\n1. Tổng quan tình hình kinh tế vĩ mô ... 8\n2. Thị trường tài chính Việt Nam và cơ hội đầu tư ... 11\n3. Lợi thế của quỹ mở ... 14  \nIV. THÔNG TIN VỀ CÔNG TY CỔ PHẦN QUẢN LÝ QUỸ KỸ THƯƠNG ... 15\n1. Các thông tin chung ... 15\n2. Tình hình hoạt động của Công ty Cổ phần Quản lý Quỹ Kỹ thương ... 17  \nV. NGÂN HÀNG GIÁM SÁT ... 17  \nVI. CÔNG TY KIỂM TOÁN ... 17  \nVII. ĐẠI LÝ PHÂN PHỐI CHỨNG CHỈ QUỸ ... 18  \nVIII. TỔ CHỨC ĐƯỢC ỦY QUYỀN ... 18\n1. Ủy quyền đại lý chuyên nhượng ... 18\n2. Ủy quyền dịch vụ quản trị quỹ đầu tư ... 18  \nIX. THÔNG TIN VỀ QUỸ ĐẦU TƯ CỔ PHIẾU DOANH NGHIỆP VỮA VÀ NHỎ TECHCOM (TCSME) ... 18\n1. Thông tin chung về Quỹ ... 18\n2. Điều lệ Quỹ tóm tắt ... 19', '## 2.2.4 Hạn mức đầu tư\ne) Tổng giá trị các hạng mục đầu tư lớn trong danh mục đầu tư của quỹ không được vượt quá 40% tổng giá trị tài sản của quỹ. Trong đó, hạng mục đầu tư lớn của quỹ là hạng mục đầu tư vào các loại tài sản quy định tại điểm b, d, đ và g mục IX.2.2.3 (ngoại trừ chứng chỉ tiền gửi) phát hành bởi cùng một tổ chức, có tổng giá trị chiếm từ 5% trở lên tổng giá trị tài sản của quỹ;  \ng) Tại mọi thời điểm, tổng giá trị cam kết trong các giao dịch chứng khoán phải sinh, dư nợ vay và các khoản phải trả của quỹ không được vượt quá giá trị tài sản ròng của quỹ;  \nh) Không được đầu tư vào chứng chỉ quỹ của chính quỹ đó;  \ni) Chỉ được đầu tư vào chứng chỉ quỹ đại chúng khác, công ty đầu tư chứng khoán đại chúng do công ty quản lý quỹ khác quản lý và bảo đảm các hạn chế sau:', '## 2. Thông tin về đợt phát hành lần đầu ra công chúng\nNhà Đầu Tư nên tham khảo ý kiến của các chuyên gia tư vấn tài chính riêng của mình để đảm bảo Nhà Đầu Tư đủ điều kiện để đầu tư vào Quỹ theo các quy định pháp luật áp dụng và liệu Quỹ có phù hợp với khả năng chấp nhận rủi ro của Nhà Đầu Tư.  \n|  Tên quỹ | Quỹ Đầu tư Cổ phiếu Doanh nghiệp vừa và nhỏ Techcom  |\n| --- | --- |\n|  Loại hình | Quỹ mở  |\n|  Mục tiêu đầu tư | Mục tiêu đầu tư của Quỹ là tìm kiếm lợi nhuận dài hạn thông qua thu nhập và tăng trưởng giá trị đầu tư vốn trên cơ sở đánh giá, lựa chọn các tài sản có chất lượng tốt, phân bổ danh mục hợp lý và tối thiểu hóa rủi ro cho Nhà Đầu Tư.  |', '- Thực hiện các lệnh giao dịch của Nhà Đầu Tư;  \n- Các hoạt động sáp nhập, hợp nhất của các tổ chức phát hành các chứng khoán mà Quỹ đang nắm giữ;  \n- Quỹ mới được cấp phép thành lập hoặc do tách Quỹ, hợp nhất Quỹ, sát nhập Quỹ mà thời gian hoạt động không quá sáu (06) tháng, tính từ ngày được cấp giấy chứng nhận đăng ký lập Quỹ;  \n- Quỹ đang trong thời gian giải thể.  \nTrong trường hợp xảy ra sai lệch so với các hạn mức đầu tư, Công ty Quản Lý Quỹ sẽ điều chỉnh danh mục đầu tư để đáp ứng các hạn mức đầu tư kể trên trong vòng 3 (ba) tháng kể từ ngày mà sai lệch phát sinh.', 'Quỹ đầu tư chứng khoán được mô tả trong Bản cáo bạch này là Quỹ được thành lập theo Luật Chứng khoán số 54/2019/QH14 được Quốc hội Nước Cộng hòa xã hội chủ nghĩa Việt Nam thông qua ngày 26 tháng 11 năm 2019 và các văn bản hướng dẫn thi hành. Bản cáo bạch này đã được đăng ký với Ủy ban Chứng khoán Nhà nước ngày / / 2022.', 'nhóm chứng khoán có tiềm năng tăng trưởng tốt trong dài hạn và/hoặc doanh nghiệp có tính cạnh tranh tương đối cao, (ii) nhóm chứng khoán có mức định giá hấp dẫn, (iii) nhóm chứng khoán có lợi tức cao, ổn định.  \nNgoài ra, để đảm bảo tối ưu hóa lợi ích của nhà đầu tư, Quỹ có sự linh hoạt trong phân bổ tài sản tùy thuộc vào cơ hội đầu tư sẵn có tại các thời điểm khác nhau. Việc phân bổ tài sản có thể thay đổi đáng kể tùy thuộc vào nhận định của Quỹ, với mục tiêu xuyên suốt trong toàn bộ thời gian hoạt động của Quỹ là bảo vệ lợi ích của Nhà Đầu Tư.', 'a. Chính sách cổ tức Quỹ  \nCông ty quản lý quỹ được phân chia lợi nhuận của quỹ cho nhà đầu tư bằng tiền hoặc bằng chứng chỉ quỹ theo quy định tại điều lệ quỹ và chính sách phân chia lợi nhuận được công bố tại bản cáo bạch. Lợi nhuận phân chia được trích từ nguồn lợi nhuận để lại hoặc từ thu nhập của quỹ. Công ty quản lý quỹ chỉ được phân chia lợi nhuận khi quỹ đã hoàn thành hoặc có đủ năng lực tài chính để hoàn thành nghĩa vụ thuế và các nghĩa vụ tài chính khác theo quy định của pháp luật; trích lập đầy đủ các quỹ theo quy định tại điều lệ quỹ; ngay sau khi trả hết số lợi nhuận đã định, quỹ vẫn phải bảo đảm thanh toán đủ các khoản nợ, nghĩa vụ tài sản khác đến hạn. Lịch trình và kế hoạch thực hiện phải được công bố công khai trên trang thông tin điện tử của công ty quản lý quỹ.', '## 3. Giá dịch vụ và thưởng hoạt động\nNhà Đầu Tư được khuyến khích nắm giữ các Đơn Vị Quỹ như một phần của các khoản đầu tư dài hạn và chương trình tiết kiệm hưu trí. Quỹ mở không được thiết kế cho mục đích mua bán ngắn hạn. Việc Nhà Đầu Tư thường xuyên mua đi và bán lại Đơn Vị Quỹ, vốn được thiết kế để đạt được lợi nhuận dài hạn sẽ ảnh hưởng đến mục tiêu lợi nhuận của Nhà Đầu Tư khi đầu tư vào Quỹ cũng như lợi nhuận của Quỹ.  \nGiá dịch vụ Mua lại và các khoản giá dịch vụ ngân hàng và thuế khác (nếu có) sẽ được trừ vào khoản tiền thu được từ bán Đơn Vị Quỹ của Nhà Đầu Tư.', '## 2. Điều lệ Quỹ tóm tắt\n#### 2.1.1 Nguyên tắc tổ chức hoạt động của Quỹ  \nQuỹ được tổ chức dưới hình thức Quỹ mở theo quy định của Pháp Luật.  \nQuỹ không bị giới hạn về thời gian hoạt động. Việc thay đổi về thời hạn hoạt động của Quỹ sẽ được thực hiện theo Nghị quyết của Đại hội Nhà Đầu Tư.  \nQuỹ chính thức bắt đầu hoạt động sau khi được cấp giấy chứng nhận đăng ký thành lập quỹ. Thời hạn hoạt động của Quỹ sẽ kết thúc ngay sau khi Quỹ bị giải thể theo quyết định của Đại Hội Nhà Đầu Tư hoặc theo quyết định của Cơ quan Nhà nước có thẩm quyền.  \nMục tiêu đầu tư của Quỹ là mang lại lợi nhuận dài hạn thông qua tăng trưởng vốn gốc và thu nhập trên cơ sở đánh giá, lựa chọn các tài sản có chất lượng tốt, phân bổ danh mục hợp lý và tối thiểu hóa rủi ro cho Nhà Đầu Tư.', '1  \nỦy ban Chứng khoán Nhà nước cấp giấy phép phát hành chứng chỉ quỹ ra công chúng có nghĩa là việc xin phép lập Quỹ và phát hành chứng chỉ quỹ đầu tư đã thực hiện theo các quy định của pháp luật liên quan, không hàm ý bảo đảm về nội dung của Bản cáo bạch cũng như mục tiêu, chiến lược đầu tư của Quỹ.', 'Nhà Đầu Tư có thể thanh toán số tiền mua Đơn Vị Quỹ từ tài khoản ngân hàng của mình vào tài khoản của Quỹ để Ngân Hàng Giám Sát nhận được đúng hạn và Đại Lý Phân Phối hoàn thành xử lý việc đăng ký với Đại Lý Chuyển Nhượng. Mọi khoản đầu tư vào Đơn Vị Quỹ đều thực hiện bằng tiền Đồng Việt Nam.  \nTrong trường hợp lệnh mua chứng chỉ quỹ và việc thanh toán cho lệnh mua được thực hiện bởi cá nhân, tổ chức khác không phải nhà đầu tư thì phiếu lệnh và tài liệu xác nhận thanh toán phải nêu rõ tên, số tài khoản và giá trị thanh toán của nhà đầu tư được hưởng lợi.', 'Nhà Đầu Tư có thể thanh toán số tiền mua Đơn Vị Quỹ bằng cách chuyển khoản từ tài khoản ngân hàng của mình hoặc nộp tiền trực tiếp vào tài khoản của Quỹ để Ngân Hàng Giám Sát nhận được đúng hạn và Đại Lý Phân Phối hoàn thành xử lý việc đăng ký với Đại Lý Chuyển Nhượng. Mọi khoản đầu tư vào Đơn Vị Quỹ đều thực hiện bằng tiền Đồng Việt Nam.  \nTrong trường hợp lệnh mua chứng chỉ quỹ và việc thanh toán cho lệnh mua được thực hiện bởi cá nhân, tổ chức khác không phải nhà đầu tư thì phiếu lệnh và tài liệu xác nhận thanh toán phải nêu rõ tên, số tài khoản và giá trị thanh toán của nhà đầu tư được hưởng lợi.  \n- **Tuân Thủ**']","Mục tiêu đầu tư là mang lại lợi nhuận dài hạn thông qua tăng trưởng vốn gốc và thu nhập trên cơ sở đánh giá, lựa chọn tài sản tốt, phân bổ danh mục hợp lý và tối thiểu hóa rủi ro."
Chiến lược đầu tư của Quỹ tập trung vào nhóm cổ phiếu nào?,"Chiến lược đầu tư của Quỹ tập trung vào nhóm cổ phiếu chào bán lần đầu ra công chúng (IPO) và trái phiếu doanh nghiệp phát hành riêng lẻ bởi tổ chức niêm yết có bảo lãnh thanh toán của tổ chức tín dụng hoặc cam kết mua lại của tổ chức phát hành tối thiểu 1 lần trong 12 tháng và mỗi lần cam kết mua lại tối thiểu 30% giá trị đợt phát hành.

Thông tin này được lấy từ trang 20 (Nguồn: Trang 20).","['## 2. Thông tin về đợt phát hành lần đầu ra công chúng\n|  Chiến lược đầu tư | Chiến lược đầu tư chính của Quỹ là đầu tư năng động vào cổ phiếu của các Công ty hàng đầu trong rổ cổ phiếu VNMID và VNSML được công bố bởi Sở Giao dịch Chứng khoán Thành Phố Hồ Chí Minh. Theo đó, chiến lược đầu tư của Quỹ bao gồm nhưng không hạn chế đầu tư vào (i) nhóm chứng khoán có tiềm năng tăng trưởng tốt trong dài hạn và/hoặc doanh nghiệp có tính cạnh tranh tương đối cao, (ii) nhóm chứng khoán có mức định giá hấp dẫn, (iii) nhóm chứng khoán có lợi tức cao, ổn định.', '## 2. Điều lệ Quỹ tóm tắt\n#### 2.2.1 Mục tiêu đầu tư  \nMục tiêu đầu tư của Quỹ là tìm kiếm lợi nhuận dài hạn thông qua thu nhập và tăng trưởng giá trị đầu tư vốn trên cơ sở đánh giá, lựa chọn các tài sản có chất lượng tốt, phân bổ danh mục hợp lý và tối thiểu hóa rủi ro cho Nhà Đầu Tư.  \n#### 2.2.2 Chiến lược và lĩnh vực đầu tư  \n##### Chiến lược đầu tư  \nChiến lược đầu tư chính của Quỹ là đầu tư năng động vào cổ phiếu của các Công ty hàng đầu trong rổ cổ phiếu VNMID và VNSML được công bố bởi Sở Giao dịch Chứng khoán Thành Phố Hồ Chí Minh. Theo đó, chiến lược đầu tư của Quỹ bao gồm nhưng không hạn chế đầu tư vào (i)  \n19', '## Lĩnh vực được phép đầu tư\nVới chiến lược đầu tư như đã đề cập ở trên, cơ cấu danh mục đầu tư của Quỹ có thể thay đổi theo thời gian dựa theo tiềm năng tăng trưởng của cổ phiếu và tùy vào mức độ thanh khoản của các cổ phiếu trên thị trường. Tỷ trọng các khoản đầu tư không vượt quá những hạn chế đầu tư quy định tại mục “Hạn chế đầu tư”.', 'nhóm chứng khoán có tiềm năng tăng trưởng tốt trong dài hạn và/hoặc doanh nghiệp có tính cạnh tranh tương đối cao, (ii) nhóm chứng khoán có mức định giá hấp dẫn, (iii) nhóm chứng khoán có lợi tức cao, ổn định.  \nNgoài ra, để đảm bảo tối ưu hóa lợi ích của nhà đầu tư, Quỹ có sự linh hoạt trong phân bổ tài sản tùy thuộc vào cơ hội đầu tư sẵn có tại các thời điểm khác nhau. Việc phân bổ tài sản có thể thay đổi đáng kể tùy thuộc vào nhận định của Quỹ, với mục tiêu xuyên suốt trong toàn bộ thời gian hoạt động của Quỹ là bảo vệ lợi ích của Nhà Đầu Tư.', '## 2. Thông tin về đợt phát hành lần đầu ra công chúng\nNgoài ra, để đảm bảo tối ưu hóa lợi ích của nhà đầu tư, Quỹ có sự linh hoạt trong phân bổ tài sản tùy thuộc vào cơ hội đầu tư sẵn có tại các thời điểm khác nhau. Việc phân bổ tài sản có thể thay đổi đáng kể tùy thuộc vào nhận định của Quỹ, với mục tiêu xuyên suốt trong toàn bộ thời gian hoạt động của Quỹ là bảo vệ lợi ích của Nhà Đầu Tư.  \nVới chiến lược đầu tư như đã đề cập ở trên, cơ cấu danh mục đầu tư của Quỹ có thể thay đổi theo thời gian dựa theo tiềm năng tăng trưởng của cổ phiếu và tùy vào mức độ thanh khoản của các cổ phiếu trên thị trường. Tỷ trọng các khoản đầu tư không vượt quá những hạn chế đầu tư quy định tại mục “Hạn chế đầu tư”.  \nCác loại tài sản mà quỹ được đầu tư bao gồm:\ni. Tiền gửi tại các ngân hàng thương mại theo quy định của pháp luật về  |', '## 2.2.7 Phương pháp lựa chọn đầu tư\n**Phương pháp lựa chọn đầu tư đối với cổ phiếu:**  \nQuỹ sử dụng phương pháp từ trên xuống (top-down approach), trong đó việc lựa chọn và phân bổ tài sản sẽ dựa trên đánh giá tổng thể về xu thế của kinh tế vĩ mô, chính sách của nhà nước, tiềm năng tăng trưởng và chính sách ngành. Từ đó, lập danh sách các chứng khoán tốt trong lĩnh vực Ngân hàng và dịch vụ tài chính phục vụ việc lựa chọn công ty sẽ đầu tư.  \nQuỹ cũng áp dụng phương pháp từ dưới lên (bottom-up approach), trong việc lựa chọn từng loại chứng khoán cụ thể thông qua việc phân tích công ty, bao gồm phân tích hiệu quả hoạt động sản xuất kinh doanh, đánh giá các chỉ số tài chính, đánh giá tiềm năng tăng trưởng, lợi thế cạnh tranh, bộ máy điều hành, quản trị doanh nghiệp, vv.', '## Lĩnh vực được phép đầu tư\nDanh mục đầu tư của quỹ phải phù hợp với mục tiêu và chính sách đầu tư đã được quy định tại Điều lệ quỹ và công bố tại Bản cáo bạch. Danh mục đầu tư của quỹ đầu tư bao gồm các loại tài sản sau đây:  \na) Tiền gửi các ngân hàng thương mại theo quy định của pháp luật ngân hàng;  \nb) Công cụ thị trường tiền tệ bao gồm giấy tờ có giá, công cụ chuyển nhượng theo quy định của pháp luật;  \nc) Công cụ nợ của Chính phủ, trái phiếu được Chính phủ bảo lãnh, trái phiếu chính quyền địa phương;  \nd) Cổ phiếu niêm yết, cổ phiếu đăng ký giao dịch, trái phiếu niêm yết trên Sở giao dịch chứng khoán, chứng chỉ quỹ đại chúng;', '## 2.2.7 Phương pháp lựa chọn đầu tư\n**Phương pháp lựa chọn đầu tư đối với các công cụ khác:**  \nQuỹ áp dụng phương pháp phù hợp với tính chất, đặc điểm của tài sản để có lựa chọn phù hợp.', '## 2. Thông tin về đợt phát hành lần đầu ra công chúng\nNhà Đầu Tư nên tham khảo ý kiến của các chuyên gia tư vấn tài chính riêng của mình để đảm bảo Nhà Đầu Tư đủ điều kiện để đầu tư vào Quỹ theo các quy định pháp luật áp dụng và liệu Quỹ có phù hợp với khả năng chấp nhận rủi ro của Nhà Đầu Tư.  \n|  Tên quỹ | Quỹ Đầu tư Cổ phiếu Doanh nghiệp vừa và nhỏ Techcom  |\n| --- | --- |\n|  Loại hình | Quỹ mở  |\n|  Mục tiêu đầu tư | Mục tiêu đầu tư của Quỹ là tìm kiếm lợi nhuận dài hạn thông qua thu nhập và tăng trưởng giá trị đầu tư vốn trên cơ sở đánh giá, lựa chọn các tài sản có chất lượng tốt, phân bổ danh mục hợp lý và tối thiểu hóa rủi ro cho Nhà Đầu Tư.  |', '## 3. Các rủi ro khi đầu tư vào Quỹ\nMục tiêu của Công Ty Quản Lý Quỹ là quản lý các rủi ro đầu tư, và nếu có thể, hạn chế tác động của các rủi ro này bằng việc áp dụng các phương pháp quản lý đầu tư theo tiêu chuẩn quốc tế tốt nhất. Nhà Đầu Tư cần lưu ý các điểm quan trọng sau đây:  \n- Quỹ, Công Ty Quản Lý Quỹ, thành viên Hội đồng thành viên, ban điều hành và nhân viên Công Ty Quản Lý Quỹ không có bất kỳ sự đảm bảo nào đối với vốn đầu tư ban đầu cũng như mức lợi nhuận từ đầu tư của Quỹ;\n- Không có bất kỳ sự bảo đảm nào về sổ lần chi trả và giá trị của cổ tức được thanh toán trong tương lai;  \n42', '- Không đầu tư quá 30% tổng giá trị tài sản của quỹ vào các chứng chỉ quỹ đại chúng, cổ phiếu công ty đầu tư chứng khoán đại chúng;  \nxi. Quỹ chỉ được đầu tư tiền gửi, công cụ tiền tệ quy định tại điểm i và ii các loại tài sản Quỹ được phép đầu tư được phát hành bởi các tổ chức tín dụng trong danh sách đã được Ban Đại Diện Quỹ phê duyệt bằng văn bản hoặc thông qua bỏ phiếu điện tử (e-voting) tuân thủ theo các Quy định Pháp luật hiện hành.  \nCơ cấu đầu tư của Quỹ được phép sai lệch so với các hạn chế được đưa ra tại điểm i, ii, iii, iv, v, vi và ix nếu trên nhưng chỉ vì các lý do sau:  \n- Biến động giá trên thị trường của các tài sản trong danh mục đầu tư của Quỹ;  \n- Thực hiện các khoản thanh toán phù hợp với Pháp Luật của Quỹ;  \n- Thực hiện các lệnh giao dịch của Nhà Đầu Tư;', 'vi. Chứng khoán phái sinh niêm yết, giao dịch tại các Sở Giao dịch Chứng khoán, và chỉ nhằm mục tiêu phòng ngừa rủi ro cho chứng khoán cơ sở mà quỹ đang nắm giữ.  \nvii. Quyền phát sinh gắn liền với chứng khoán mà Quỹ đang nắm giữ.  |\n| --- | --- |\n|  Cơ cấu đầu tư | Các khoản đầu tư của Quỹ sẽ được đa dạng hóa và đáp ứng được các điều kiện của pháp luật. Cơ cấu danh mục đầu tư của Quỹ phải bảo đảm tuân thủ các nguyên tắc sau:  \ni. Cơ cấu danh mục đầu tư của quỹ mở phải bao gồm chứng khoán của ít nhất sáu (06) tổ chức phát hành, đồng thời phải bảo đảm:', '- Thực hiện các lệnh giao dịch của Nhà Đầu Tư;  \n- Các hoạt động sáp nhập, hợp nhất của các tổ chức phát hành các chứng khoán mà Quỹ đang nắm giữ;  \n- Quỹ mới được cấp phép thành lập hoặc do tách Quỹ, hợp nhất Quỹ, sát nhập Quỹ mà thời gian hoạt động không quá sáu (06) tháng, tính từ ngày được cấp giấy chứng nhận đăng ký lập Quỹ;  \n- Quỹ đang trong thời gian giải thể.  \nTrong trường hợp xảy ra sai lệch so với các hạn mức đầu tư, Công ty Quản Lý Quỹ sẽ điều chỉnh danh mục đầu tư để đáp ứng các hạn mức đầu tư kể trên trong vòng 3 (ba) tháng kể từ ngày mà sai lệch phát sinh.', 'Nhà Đầu Tư nên tham khảo ý kiến của chuyên gia tư vấn riêng của mình để đảm bảo Nhà Đầu Tư đủ điều kiện để đầu tư vào Quỹ theo các quy định pháp luật áp dụng cho họ và liệu Quỹ có phù hợp với khả năng chấp nhận rủi ro của họ hay không.', '## 2.2.4 Hạn mức đầu tư\n- Không đầu tư vào quá 10% tổng số chứng chỉ quỹ đang lưu hành của một quỹ đại chúng, cổ phiếu đang lưu hành của một công ty đầu tư chứng khoán đại chúng;\n- Không đầu tư quá 20% tổng giá trị tài sản của quỹ vào chứng chỉ quỹ của một quỹ đại chúng, cổ phiếu của một công ty đầu tư chứng khoán đại chúng;\n- Không đầu tư quá 30% tổng giá trị tài sản của quỹ vào các chứng chỉ quỹ đại chúng, cổ phiếu công ty đầu tư chứng khoán đại chúng;  \nk) Không được đầu tư trực tiếp vào bất động sản, đá quý, kim loại quý hiếm;  \nl) Phải có chứng khoán của ít nhất 06 tổ chức phát hành.', '## 3. Lợi thế của quỹ mở\nQuỹ mở là một kênh đầu tư tương đối mới mẻ đối với các nhà đầu tư cá nhân tại Việt Nam nhưng được dự báo sẽ trở thành một xu thế trong tương lai gần. Đầu tư vào quỹ mở có nhiều ưu điểm so với đầu tư chứng khoán riêng lẻ hay đầu tư vào các loại hình quỹ khác như quỹ đóng, quỹ ETFs hay quỹ tín thác:  \n- **Đa dạng hóa danh mục đầu tư**: Nhà đầu tư sở hữu chứng chỉ quỹ mở nghĩa là đang đầu tư vào một danh mục bao gồm các loại chứng khoán không tương quan, qua đó góp phần đa dạng hóa rủi ro với chi phí/giá dịch vụ thấp hơn so với đầu tư riêng lẻ vào từng loại chứng khoán.', '## 2.2.4 Hạn mức đầu tư\ne) Tổng giá trị các hạng mục đầu tư lớn trong danh mục đầu tư của quỹ không được vượt quá 40% tổng giá trị tài sản của quỹ. Trong đó, hạng mục đầu tư lớn của quỹ là hạng mục đầu tư vào các loại tài sản quy định tại điểm b, d, đ và g mục IX.2.2.3 (ngoại trừ chứng chỉ tiền gửi) phát hành bởi cùng một tổ chức, có tổng giá trị chiếm từ 5% trở lên tổng giá trị tài sản của quỹ;  \ng) Tại mọi thời điểm, tổng giá trị cam kết trong các giao dịch chứng khoán phải sinh, dư nợ vay và các khoản phải trả của quỹ không được vượt quá giá trị tài sản ròng của quỹ;  \nh) Không được đầu tư vào chứng chỉ quỹ của chính quỹ đó;  \ni) Chỉ được đầu tư vào chứng chỉ quỹ đại chúng khác, công ty đầu tư chứng khoán đại chúng do công ty quản lý quỹ khác quản lý và bảo đảm các hạn chế sau:', '## 2.2.4 Hạn mức đầu tư\nHạn mức đầu tư của Quỹ được quy định chi tiết tuân thủ các quy định tại Thông tư hướng dẫn hoạt động và quản lý các quỹ đầu tư chứng khoán. Cơ cấu danh mục đầu tư của Quỹ phải bảo đảm tuân thủ các hạn mức đầu tư sau:  \na) Trừ tiền gửi trên tài khoản thanh toán của quỹ tại ngân hàng giám sát, quỹ mở không được đầu tư quá 49% tổng giá trị tài sản của quỹ vào các tài sản theo quy định tại điểm a, b mục IX.2.2.3  \nb) Không được đầu tư vào chứng khoán của một tổ chức phát hành quá 10% tổng giá trị chứng khoán đang lưu hành của tổ chức đó, trừ công cụ nợ của Chính phủ;  \nc) Không được đầu tư quá 20% tổng giá trị tài sản của quỹ vào chứng khoán đang lưu hành và các tài sản (nếu có) quy định tại điểm a, b mục IX.2.2.3 của một tổ chức phát hành, trừ công cụ nợ của Chính phủ;', '## 2.2.7 Phương pháp lựa chọn đầu tư\n**Phương pháp lựa chọn đầu tư đối với các công cụ thị trường tiền tệ:**  \nQuỹ lựa chọn các công cụ thị trường tiền tệ của các tổ chức tín dụng có khả năng mang lại lãi suất tốt, đồng thời xem xét đến thứ hạng tín dụng và định mức tín dụng phù hợp cho từng tổ chức tín dụng.  \n**Phương pháp lựa chọn đầu tư đối với trái phiếu và công cụ nợ:**  \nTrái phiếu và công cụ nợ được lựa chọn trên cơ sở phân tích, đánh giá dự án/chương trình được tài trợ bởi công cụ nợ kết hợp phân tích xu hướng lãi suất, đánh giá với mức lãi suất của công cụ nợ trong tương quan với mức độ chấp nhận rủi ro của nhà đầu tư, tính thanh khoản của trái phiếu, công cụ nợ hoặc chỉ số tín nhiệm tín dụng của tổ chức phát hành để lựa chọn danh mục đầu tư phù hợp.  \n**Phương pháp lựa chọn đầu tư đối với cổ phiếu:**', '## 3. Giá dịch vụ và thưởng hoạt động\nNhà Đầu Tư được khuyến khích nắm giữ các Đơn Vị Quỹ như một phần của các khoản đầu tư dài hạn và chương trình tiết kiệm hưu trí. Quỹ mở không được thiết kế cho mục đích mua bán ngắn hạn. Việc Nhà Đầu Tư thường xuyên mua đi và bán lại Đơn Vị Quỹ, vốn được thiết kế để đạt được lợi nhuận dài hạn sẽ ảnh hưởng đến mục tiêu lợi nhuận của Nhà Đầu Tư khi đầu tư vào Quỹ cũng như lợi nhuận của Quỹ.  \nGiá dịch vụ Mua lại và các khoản giá dịch vụ ngân hàng và thuế khác (nếu có) sẽ được trừ vào khoản tiền thu được từ bán Đơn Vị Quỹ của Nhà Đầu Tư.', '## 2.5.3. Thông tin về các mức giá dịch vụ\nNhà Đầu Tư được khuyến khích nắm giữ các Đơn Vị Quỹ như một phần của các khoản đầu tư dài hạn và chương trình tiết kiệm lưu trí. Quỹ mở không được thiết kế cho mục đích mua bán ngắn hạn. Việc Nhà Đầu Tư thường xuyên mua đi và bán lại Đơn Vị Quỹ, vốn được thiết kế để đạt được lợi nhuận dài hạn sẽ ảnh hưởng đến mục tiêu lợi nhuận của Nhà Đầu Tư khi đầu tư vào Quỹ cũng như lợi nhuận của Quỹ.', 'Hiện nay trên thị trường có 47 công ty Quản lý Quỹ đang hoạt động bình thường và còn 2 công ty đang trong diện tái cấu trúc. Khung pháp lý hướng dẫn đồng bộ các sản phẩm quỹ đầu tư chứng khoán cơ bản đã được hoàn thiện cho nhiều loại hình nhà đầu tư khác nhau, các quỹ đầu tư đa mục tiêu kết nối với thị trường trái phiếu và thị trường bất động sản. (Nguồn: UBCKNN)', '## Lĩnh vực được phép đầu tư\nđ) Cổ phiếu chào bán lần đầu ra công chúng, trái phiếu chào bán ra công chúng; trái phiếu doanh nghiệp phát hành riêng lẻ bởi tổ chức niêm yết có bảo lãnh thanh toán của tổ chức tín dụng hoặc cam kết mua lại của tổ chức phát hành tối thiểu 1 lần trong 12 tháng và mỗi lần cam kết mua lại tối thiểu 30% giá trị đợt phát hành;  \ne) Chứng khoán phải sinh niêm yết giao dịch tại Sở giao dịch chứng khoán và chỉ nhằm mục tiêu phòng ngừa rủi ro cho chứng khoán cơ sở mà quỹ đang nắm giữ;  \ng) Quyền phát sinh gắn liền với chứng khoán mà quỹ đang nắm giữ.  \nViệc đầu tư vào các tài sản quy định tại điểm đ khoản 2.2.3 Điều này phải đáp ứng các điều kiện sau:  \n- Có quy định tại Điều lệ quỹ và Bản cáo bạch;', '## 3. Lợi thế của quỹ mở\n- **Quản lý tài sản chuyên nghiệp**: Nhà đầu tư được tiếp cận với dịch vụ quản lý tài sản chuyên nghiệp bởi các chuyên gia nhiều kinh nghiệm, có trình độ chuyên môn cao về đầu tư và quản trị danh mục đầu tư. Nhờ đó, nhà đầu tư có thể đạt được hiệu quả đầu tư cao hơn mà không tốn nhiều thời gian.  \n- **Tính thanh khoản cao**: Lợi thế của quỹ mở so với quỹ đóng là định kỳ phát hành và mua lại chứng chỉ quỹ. Do đó, nhà đầu tư có thể linh hoạt bỏ tiền vào hoặc rút tiền ra bằng cách giao dịch với quỹ vào ngày được quy định.', 'iv. Không được đầu tư vào chứng khoán của một tổ chức phát hành quá 10,0% (mười phần trăm) tổng giá trị chứng khoán đang lưu hành của tổ chức đó, trừ trái phiếu chính phủ;  \nv. Không được đầu tư quá mười phần trăm (10%) tổng giá trị tài sản của Quỹ vào các tài sản quy định tại điểm v các loại tài sản Quỹ được phép đầu tư;  \nvi. Tổng giá trị các hạng mục đầu tư lớn trong danh mục đầu tư của quỹ không được vượt quá 40% tổng giá trị tài sản của quỹ. Trong đó, hạng mục đầu tư lớn của quỹ là hạng mục đầu tư vào các loại tài sản quy định tại điểm ii, iv, v và vi các loại tài sản Quỹ được phép đầu tư (ngoại trừ chứng chỉ tiền gửi) phát hành bởi cùng một tổ chức, có tổng giá trị chiếm từ 5% trở lên tổng giá trị tài sản của quỹ;  |']",Chiến lược đầu tư chính là đầu tư năng động vào cổ phiếu của các Công ty hàng đầu trong rổ cổ phiếu VNMID và VNSML.
Vốn điều lệ ban đầu và mệnh giá một chứng chỉ quỹ trong đợt phát hành lần đầu là bao nhiêu?,"Vốn điều lệ ban đầu của quỹ là 50.000.000.000 đồng (năm mươi tỷ đồng).

Mệnh giá một chứng chỉ quỹ trong đợt phát hành lần đầu không được đề cập trực tiếp trong các thông tin đã cung cấp, nhưng theo上下文，一单位基金的面值在首次发行时没有具体提及。根据提供的信息：

- **股本总额**：50.000.000.000越南盾（五十亿）。
- **一单位基金的面值**：未明确说明。

因此，关于一单位基金的面值，在首次发行时的具体数值未能从现有资料中找到。根据提供的信息：

- Vốn điều lệ ban đầu: 50.000.000.000 đồng (năm mươi tỷ đồng).
- Mệnh giá một chứng chỉ quỹ trong đợt phát hành lần đầu không được đề cập.

**Source**: Trang 19

如需更准确的信息，请参考更多详细资料或直接咨询相关机构。","['|  Số lượng đơn vị quỹ dự kiến phát hành: | 5.000.000 Đơn Vị Quỹ  |\n| --- | --- |\n|  Thời gian phát hành: | Được đề cập trong thông báo phát hành lần đầu ra công chúng  |\n|  Mệnh giá: | 10.000 đồng một Đơn Vị Quỹ  |\n|  Đồng tiền sử dụng và trình bày: | Đồng (VNĐ)  |\n|  Giá phát hành: | 10.000 VNĐ  |\n|  Phương thức phân bổ chứng chỉ quỹ lần đầu | = Tổng số tiền đầu tư ban đầu/ Giá phát hành  |  \nCác Nhà Đầu Tư muốn đầu tư vào Quỹ phải hoàn thành và nộp Đơn Đăng Ký cho Đại Lý Phân Phối theo các quy trình và hướng dẫn trong lần chào bán lần đầu ra công chúng.  \nMức đầu tư đăng ký tối thiểu (tính theo giá trị Lệnh Mua) của Nhà Đầu Tư là 10.000 VNĐ (Mười ngàn Việt Nam đồng)', '“Giá bán/ Giá phát hành”\nLà mức giá Nhà Đầu Tư phải thanh toán để mua một Chứng chỉ quỹ. Giá bán/Giá phát hành bằng mệnh giá (trong đợt chào bán lần đầu ra công chúng) hoặc bằng giá trị tài sản ròng trên một Chứng chỉ quỹ cộng thêm giá dịch vụ phát hành đã quy định tại Điều lệ / Bản Cáo Bạch của Quỹ.  \n“Giá mua lại”\nLà mức giá mà Công ty Quản Lý Quỹ phải thanh toán để mua lại từ Nhà Đầu Tư một Chứng chỉ quỹ. Giá mua lại bằng giá trị tài sản ròng trên một Chứng chỉ quỹ tính tại ngày giao dịch Chứng chỉ quỹ trừ đi giá dịch vụ mua lại chứng chỉ quỹ đã quy định tại Điều lệ Quỹ.', '“Ban Đại Diện Quỹ”\nlà những người đại diện cho Nhà Đầu Tư được Đại Hội Nhà Đầu Tư bầu ra để thay mặt Nhà Đầu Tư thực hiện việc giám sát các hoạt động của Quỹ, Công ty Quản Lý Quỹ và Ngân Hàng Giám Sát.  \n“Vốn Điều lệ”\nlà tổng số vốn bằng tiền do các Nhà Đầu Tư thực góp trong đợt phát hành Chứng Chỉ Quỹ lần đầu ra công chúng và được ghi trong Điều lệ.  \n“Chứng Chỉ Quỹ”\nLà loại chứng khoán xác nhận quyền sở hữu của nhà đầu tư đối với một phần vốn góp tại quỹ. Mệnh giá 01 chứng chỉ quỹ là 10.000 đồng.  \n“Giá bán/ Giá phát hành”', 'Mức đầu tư tối thiểu (tính theo giá trị Lệnh Mua) là 10.000 VNĐ (Mười nghìn đồng)  \nKhông có mức giới hạn đầu tư tối đa cho Nhà Đầu Tư. Công Ty Quản Lý Quỹ bảo lưu quyền thay đổi các giới hạn đầu tư trên trong từng thời điểm và sẽ thông báo về các thay đổi này.', '## f) Lệnh Mua Tối Thiểu\nMức đầu tư tối thiểu (tính theo giá trị Lệnh Mua) là 10.000 VND (Mười nghìn đồng)  \nKhông có mức giới hạn đầu tư tối đa cho Nhà Đầu Tư. Công Ty Quản Lý Quỹ bảo lưu quyền thay đổi các giới hạn đầu tư trên trong từng thời điểm và sẽ thông báo về các thay đổi này.', '## Lĩnh vực được phép đầu tư\nđ) Cổ phiếu chào bán lần đầu ra công chúng, trái phiếu chào bán ra công chúng; trái phiếu doanh nghiệp phát hành riêng lẻ bởi tổ chức niêm yết có bảo lãnh thanh toán của tổ chức tín dụng hoặc cam kết mua lại của tổ chức phát hành tối thiểu 1 lần trong 12 tháng và mỗi lần cam kết mua lại tối thiểu 30% giá trị đợt phát hành;  \ne) Chứng khoán phải sinh niêm yết giao dịch tại Sở giao dịch chứng khoán và chỉ nhằm mục tiêu phòng ngừa rủi ro cho chứng khoán cơ sở mà quỹ đang nắm giữ;  \ng) Quyền phát sinh gắn liền với chứng khoán mà quỹ đang nắm giữ.  \nViệc đầu tư vào các tài sản quy định tại điểm đ khoản 2.2.3 Điều này phải đáp ứng các điều kiện sau:  \n- Có quy định tại Điều lệ quỹ và Bản cáo bạch;', '## 2. Điều lệ Quỹ tóm tắt\nCơ quan quyền lực cao nhất của Quỹ là Đại hội Nhà Đầu tư.  \nBan Đại diện Quỹ sẽ do Đại hội Nhà Đầu tư bầu ra để giám sát các hoạt động thường xuyên của Quỹ, TCC và Ngân hàng giám sát.  \n#### 2.1.2 Tổng vốn huy động và số lượng chứng chỉ Quỹ được chào bán  \nVốn Điều lệ được huy động trong lần đầu chào bán ra công chúng của Quỹ là 50.000.000.000 VNĐ (Năm mươi tỷ đồng). Vốn Điều lệ sẽ được chia thành 5.000.000 (Năm triệu) Chứng chỉ Quỹ. Mệnh giá của một Chứng chỉ Quỹ sẽ là 10.000 VNĐ (mười nghìn Đồng Việt Nam).  \nNhà đầu tư góp vốn bằng tiền Đồng Việt Nam dưới hình thức chuyển khoản hoặc chuyển tiền vào tài khoản của Quỹ mở tại ngân hàng giám sát.  \nSố lượng chứng chỉ quỹ/tổng chứng chỉ quỹ được phép lưu hành tối đa: không hạn chế.', '1  \nỦy ban Chứng khoán Nhà nước cấp giấy phép phát hành chứng chỉ quỹ ra công chúng có nghĩa là việc xin phép lập Quỹ và phát hành chứng chỉ quỹ đầu tư đã thực hiện theo các quy định của pháp luật liên quan, không hàm ý bảo đảm về nội dung của Bản cáo bạch cũng như mục tiêu, chiến lược đầu tư của Quỹ.', 'Sau khi hoàn thành đợt IPO, Công Ty Quản Lý Quỹ sẽ đăng ký xin giấy chứng nhận đăng ký thành lập Quỹ với UBCKNN nếu có ít nhất 100 (một trăm) Nhà Đầu Tư không chuyên nghiệp đầu tư vào Quỹ và tổng vốn đầu tư vào Quỹ đạt tối thiểu 50.000.000.000 VNĐ (năm mươi tỷ đồng). Khi nhận Giấy phép đăng ký, Ngân Hàng Giám Sát sẽ giải toả tài khoản ký quỹ của Quỹ đó để Quỹ có thể bắt đầu đầu tư. Dự kiến Ngày Giao Dịch đầu tiên sẽ trong vòng 30 (ba mươi) ngày kể từ ngày Giấy chứng nhận đăng ký lập quỹ có hiệu lực.  \nXác nhận đầu tư sẽ được gửi cho Nhà Đầu Tư trong vòng 05 (năm) ngày kể từ ngày Quỹ có được Giấy chứng nhận đăng ký thành lập từ UBCKNN.', '|  Từ trên 9 đến tròn 12 tháng | 0,50%  |\n|  Từ trên 12 tháng trở lên | 0,00%  |  \nTrường hợp Nhà Đầu Tư mua Chứng Chỉ Quỹ nhiều lần, mua theo Chương Trình ĐTĐK hoặc dưới hình thức tái đầu tư bằng nguồn cổ tức của Quỹ không phải chịu Giá dịch vụ phát hành, ưu tiên bán được thực hiện theo nguyên tắc các Chứng Chỉ Quỹ mua trước sẽ được bán trước, không phân biệt chứng chỉ quỹ mua theo lệnh mua bình thường hay Chương Trình ĐTĐK hay hình thức tái đầu tư bằng nguồn cổ tức.  \nCông Ty Quản Lý Quỹ có quyền thay đổi Giá dịch vụ Mua lại nhưng không được vượt quá mức quy định của pháp luật. Mức Giá dịch vụ Mua lại mới sẽ được Công Ty Quản Lý Quỹ thông báo chi tiết tại trang thông tin điện tử của Quỹ và tại các địa điểm phân phối của các Đại Lý Phân Phối.', '|  Từ tròn 6 đến tròn 9 tháng | 0,75%  |\n| --- | --- |\n|  Từ trên 9 đến tròn 12 tháng | 0,50%  |\n|  Từ trên 12 tháng trở lên | 0,00%  |  \nTrường hợp Nhà Đầu Tư mua Chứng Chỉ Quỹ nhiều lần, mua theo Chương Trình ĐTĐK hoặc dưới hình thức tái đầu tư bằng nguồn cổ tức của Quỹ không phải chịu Giá dịch vụ phát hành, ưu tiên bán được thực hiện theo nguyên tắc các Chứng Chỉ Quỹ mua trước sẽ được bán trước, không phân biệt chứng chỉ quỹ mua theo lệnh mua bình thường hay Chương Trình ĐTĐK hay hình thức tái đầu tư bằng nguồn cổ tức.', 'Quỹ không quy định quy mô tối đa trong đợt phát hành lần đầu ra công chúng. Vì vậy, nếu giá trị phát hành được vượt 50.000.000.000 VNĐ (năm mươi tỷ đồng), các Nhà Đầu Tư sẽ được phân bổ số lượng Đơn Vị Quỹ bằng với số đã đặt mua.  \n- Địa điểm phát hành:\nCông ty Cổ phần Quản lý Quỹ Kỹ thương\nĐịa chỉ đăng ký: Tầng 28, Tòa C5, số 119 Trần Duy Hưng, phường Trung Hòa, Quận Cầu Giấy, Hà Nội\nĐiện thoại: (+84) 24 39446368   Fax: (+84) 24 39446583  \n- Đại lý phân phối và điểm nhận lệnh:\nCông ty Cổ phần Chứng khoán Kỹ thương (“TCBS”)\nĐịa chỉ: Tầng 10 và Tầng 12, tòa nhà Techcombank, 191 Bà Triệu, phường Lê Đại Hành, quận Hai Bà Trưng, TP. Hà Nội\nĐiện thoại: 84.24.22201039   Fax: 84.24.22201032  \n- Các đối tác có liên quan đến đợt phát hành  \n**Ủy quyền đại lý chuyển nhượng**', 'Theo quy định hiện hành, nếu Quỹ không thể huy động được ít nhất là 50.000.000.000 VNĐ (năm mươi tỷ đồng) hoặc có ít hơn 100 (một trăm) Nhà Đầu Tư không chuyên nghiệp vào thời điểm kết thúc IPO hoặc thời gian được gia hạn (nếu có), UBCKNN sẽ không cấp Giấy chứng nhận đăng ký lập quỹ cho Quỹ. Trong trường hợp này, tất cả số tiền nhận được từ các Nhà Đầu Tư trong thời gian IPO cùng với lãi phát sinh nếu có sẽ được hoàn trả vào tài khoản đăng ký của Nhà Đầu Tư trong vòng 15 (mười lăm ngày) kể từ ngày kết thúc đợt IPO. Công Ty Quản Lý Quỹ sẽ chịu tất cả các chi giá dịch vụ phát sinh từ đợt IPO trong trường hợp này.  \n49', '- Giấy chứng nhận đăng ký lập Quỹ đại chúng: do UBCKNN cấp\n- Loại hình: Quỹ mở\n- Vốn điều lệ ban đầu: 50.000.000.000 (năm mươi tỷ đồng)\n- Thời hạn của Quỹ: không giới hạn', 'Sau khi thực hiện các Lệnh Bán Được Chấp Nhận, số Đơn Vị Quỹ đã bán sẽ được trù ra từ tổng số Đơn Vị Quỹ trong tài khoản của Nhà Đầu Tư và bảng kê mới về số Đơn Vị Quỹ nắm giữ sẽ được gửi đến Nhà Đầu Tư.  \nLệnh Bán thành công của Nhà Đầu Tư hay Đại Lý Ký Danh sẽ được thông báo trong vòng 03 (ba) ngày làm việc sau Ngày Giao Dịch.  \nTrong thời hạn 5 ngày làm việc sau ngày giao dịch Chứng chỉ quỹ, Nhà Đầu tư sẽ nhận được tiền bán chứng chỉ quỹ vào tài khoản mà Nhà Đầu tư đã đăng ký khi thực hiện mua Chứng chỉ quỹ.  \n- **Lệnh Bán Tối Thiểu**  \nLệnh Bán tối thiểu là 10 (mười) Đơn Vị Quỹ. Trường hợp sau khi đặt bán, số lượng chứng chỉ quỹ còn lại nhỏ hơn số lượng bán tối thiểu, Nhà Đầu tư cần đặt bán toàn bộ để giảm số Đơn vị Quỹ nắm giữ về 0 (không).', 'Trong trường hợp Quỹ nhận được số tiền mua thấp hơn lệnh đăng ký mua và không nhận được yêu cầu chuyển trả từ khách hàng, số tiền mua sẽ tiếp tục được giữ lại để chờ yêu cầu giao dịch tiếp theo từ khách hàng.  \nTrong trường hợp Nhà Đầu Tư có nhiều lệnh mua Chứng Chỉ Quỹ cùng một lúc, Lệnh Mua Chứng Chỉ Quỹ sẽ được ưu tiên theo thứ tự đặt lệnh.  \nPhí/giá dịch vụ chuyển tiền (nếu có) được trừ vào số tiền hoàn trả cho Nhà Đầu Tư. Đơn Vị Quỹ sẽ chỉ được ghi nhận vào tài khoản của Nhà Đầu Tư hay của Đại Lý Kỷ Danh sau khi có kết quả giao dịch chứng chỉ quỹ.', 'Nhà Đầu Tư có thể thanh toán số tiền mua Đơn Vị Quỹ từ tài khoản ngân hàng của mình vào tài khoản của Quỹ để Ngân Hàng Giám Sát nhận được đúng hạn và Đại Lý Phân Phối hoàn thành xử lý việc đăng ký với Đại Lý Chuyển Nhượng. Mọi khoản đầu tư vào Đơn Vị Quỹ đều thực hiện bằng tiền Đồng Việt Nam.  \nTrong trường hợp lệnh mua chứng chỉ quỹ và việc thanh toán cho lệnh mua được thực hiện bởi cá nhân, tổ chức khác không phải nhà đầu tư thì phiếu lệnh và tài liệu xác nhận thanh toán phải nêu rõ tên, số tài khoản và giá trị thanh toán của nhà đầu tư được hưởng lợi.', '## 2. Điều lệ Quỹ tóm tắt\nSố lượng chứng chỉ quỹ/tổng chứng chỉ quỹ được phép lưu hành tối đa: không hạn chế.  \nViệc thay đổi giá trị tài sản huy động tối đa hoặc số lượng chứng chỉ quỹ huy động tối đa phải do Đại hội nhà đầu tư quyết định và phải thông báo cho Ủy ban Chứng khoán Nhà nước.', '- Việc thực hiện tất cả các lệnh giao dịch của Nhà Đầu Tư tại Ngày Giao Dịch dẫn đến NAV của Quỹ thấp hơn 50.000.000.000 đồng (năm mươi tỷ đồng); hoặc Giá trị phần đơn vị quỹ hoặc số đơn vị quỹ còn lại trên tài khoản của nhà đầu tư thấp hơn giá trị tối thiểu hoặc số lượng đơn vị quỹ tối thiểu để duy trì tài khoản của nhà đầu tư theo quy định tại Điều lệ quỹ và Bán cáo bạch.\n- Trường hợp thực hiện một phần Lệnh Bán, Lệnh mua, Lệnh Chuyến Đổi Quỹ theo quy định nêu trên, Công ty Quản Lý Quỹ áp dụng nguyên tắc phân phối cùng tỷ lệ: Phần giá trị được thực hiện sẽ được phân bổ cho tất cả nhà đầu tư đăng ký giao dịch theo cùng một tỷ lệ giữa giá trị thực hiện và giá trị đăng ký giao dịch.  \nSố lượng chứng chỉ quỹ được thực hiện trong trường hợp này được tính như sau:', '## 2. Tình hình phát hành và mua lại chứng chỉ quỹ\nTình hình phát hành và mua lại chứng chỉ quỹ được trình bày chi tiết trong các báo cáo tài chính soát xét bán niên/ hàng năm của Quỹ và được công bố công khai trên website của Công ty quản lý quỹ.', '## Lĩnh vực được phép đầu tư\n- Có quy định tại Điều lệ quỹ và Bản cáo bạch;\n- Đã được Ban đại diện quỹ chấp thuận bằng văn bản về loại, mã chứng khoán, số lượng, giá trị giao dịch, thời điểm thực hiện;\n- Có đủ tài liệu chứng minh về bảo lãnh thanh toán hoặc tài liệu về cam kết mua lại của tổ chức phát hành.', 'Số lượng chứng chỉ quỹ được thực hiện trong trường hợp này được tính như sau:  \nSố lượng CCQ NĐT được thực hiện = Số lượng CCQ NĐT đăng ký bán * [Tổng số lượng CCQ mà CTQLQ có thể đáp ứng cho lệnh bán của NĐT/Tổng số lượng CCQ đăng ký bán trong kỳ]  \nSố lượng Chứng Chỉ Quỹ Nhà Đầu Tư được thực hiện trong trường hợp thực hiện một phần Lệnh Bán cũng áp dụng nguyên tắc của Lệnh Bán tối thiểu nêu trên. Phần lệnh chưa được thực hiện và các lệnh đến sau thời điểm đóng số lệnh sẽ tự động bị hủy. Nhà Đầu Tư có thể thực hiện tiếp các lệnh bán của mình bằng cách đăng ký giao dịch tại ngày giao dịch tiếp theo.', 'Trong trường hợp Quỹ nhận được số tiền mua thấp hơn Phiếu lệnh mua và không nhận được yêu cầu chuyển trả từ khách hàng, số tiền mua sẽ tiếp tục được giữ lại để chờ yêu cầu giao dịch tiếp theo từ khách hàng.  \nTrong trường hợp Nhà Đầu Tư có nhiều lệnh mua Chứng Chỉ Quỹ cùng một lúc, Lệnh Mua Chứng Chỉ Quỹ sẽ được ưu tiên theo thứ tự đặt lệnh.  \nPhí/giá dịch vụ chuyển tiền (nếu có) được trừ vào số tiền hoàn trả cho Nhà Đầu Tư. Đơn Vị Quỹ sẽ chỉ được ghi nhận vào tài khoản của Nhà Đầu Tư hay của Đại Lý Ký Danh sau khi có kết quả giao dịch chứng chỉ quỹ.', '## X. PHÁT HÀNH LẦN ĐẦU VÀ GIAO DỊCH CHỨNG CHỈ QUỸ CÁC LẦN TIẾP THEO 45\n1. Cơ sở pháp lý ... 45\n2. Thông tin về đợt phát hành lần đầu ra công chúng ... 46\nPhương thức phân bổ chứng chỉ quỹ lần đầu ... 49\n3. Giao dịch chứng chỉ quỹ các lần tiếp theo ... 50\n4. Phương pháp xác định giá trị tài sản ròng ... 58', '## 3. Lợi thế của quỹ mở\n- **Giá mua/bán chứng chỉ quỹ không biến động ngoài giá trị tài sản rộng như quỹ đóng niêm yết**: Quỹ mở cho phép nhà đầu tư được mua/bán chứng chỉ quỹ với giá mua/bán chính bằng giá trị tài sản rộng của quỹ vào ngày giao dịch cộng với giá dịch vụ phát hành/trừ đi giá dịch vụ mua lại, giá dịch vụ chuyển tiền và thuế (nếu có).  \n- **Tính linh hoạt của “gia đình quỹ”**: Thông thường, quỹ mở là một phần của “gia đình quỹ” mà công ty quản lý quỹ sở hữu. Do đó, nhà đầu tư có thể dễ dàng chuyển từ quỹ này sang quỹ khác khi mục tiêu đầu tư thay đổi với chi phí/giá dịch vụ thấp hơn so với việc chuyển đổi đầu tư chứng khoán riêng lẻ.  \n14']",Vốn điều lệ huy động lần đầu là 50.000.000.000 VNĐ. Mệnh giá là 10.000 VNĐ/chứng chỉ quỹ.
Mức phí dịch vụ quản lý quỹ (Management Fee) tối đa là bao nhiêu phần trăm một năm?,"Mức phí dịch vụ quản lý quỹ (Management Fee) tối đa là 0,5% một năm.

Thông tin này được lấy từ nguồn 1, cụ thể ở trang 37 của tài liệu.","['## 3.2 Giá dịch vụ mà Quỹ phải trả\nGiá dịch vụ Quản Lý tối đa là 1,2% * NAV/năm.  \nĐại Hội Nhà Đầu Tư có thể ủy quyền cho Ban Đại Diện Quỹ quyết định điều chỉnh mức Giá dịch vụ Quản lý trong mức tối đa nêu trên nếu được Đại Hội Nhà Đầu Tư thông qua việc ủy quyền này trong Đại hội hàng năm gần nhất. Hiệu lực của việc điều chỉnh Giá dịch vụ Quản Lý sau khi Ban Đại Diện Quỹ phê duyệt sẽ được Công ty quản lý Quỹ công bố trên trang website. Trường hợp thay đổi Giá dịch vụ Quản lý dẫn đến giá dịch vụ vượt quá mức tối đa nêu trên sẽ phải được Đại Hội Nhà Đầu Tư phê duyệt.  \nTrong mọi trường hợp, tổng giá dịch vụ Quản lý Quỹ, giá dịch vụ Quản trị Quỹ và giá dịch vụ đại lý chuyển nhượng sẽ không vượt quá quy định của Pháp luật (2% NAV/năm).', 'Giá dịch vụ Quản Lý tối đa là 1,2%*NAV/năm.  \nĐại Hội Nhà Đầu Tư có thể ủy quyền cho Ban Đại Diện Quỹ quyết định điều chỉnh mức Giá dịch vụ Quản lý trong mức tối đa nêu trên nếu được Đại Hội Nhà Đầu Tư thông qua việc ủy quyền này trong Đại hội hàng năm gần nhất. Hiệu lực của việc điều chỉnh Giá dịch vụ Quản Lý sau khi Ban Đại Diện Quỹ phê duyệt sẽ được Công ty quản lý Quỹ công bố trên trang website. Trường hợp thay đổi Giá dịch vụ Quản lý dẫn đến giá dịch vụ vượt quá mức tối đa nêu trên sẽ phải được Đại Hội Nhà Đầu Tư phê duyệt.  \nTrong mọi trường hợp, tổng giá dịch vụ Quản lý Quỹ, giá dịch vụ Quản trị Quỹ và giá dịch vụ đại lý chuyển nhượng sẽ không vượt quá quy định của Pháp luật (2% NAV/năm).', '## 3.2 Giá dịch vụ mà Quỹ phải trả\nGiá dịch vụ quản lý được tính vào mỗi kỳ định giá dựa trên NAV tại ngày trước ngày định giá và được thanh toán hàng tháng cho Công ty Quản Lý Quỹ. Số giá dịch vụ trả hàng tháng là tổng số giá dịch vụ được tính (trích lập) cho các kỳ định giá thực hiện trong tháng.  \nCông thức tính giá dịch vụ quản lý quỹ vào mỗi kỳ định giá được xác định như sau:  \nGiá dịch vụ quản lý quỹ cho kỳ định giá = Tỷ lệ giá dịch vụ quản lý (năm) x NAV tại ngày trước ngày định giá x số ngày theo lịch thực tế của chu kỳ định giá / số ngày thực tế của năm (365 hoặc 366).  \nGiá dịch vụ Quản Lý tối đa là 1,2% * NAV/năm.', '## d) Giá dịch vụ Quản Trị Quỹ\nGiá dịch vụ Quản trị quỹ sẽ là 0,03% NAV/năm và thấp nhất là 15.000.000 đồng/ tháng (chưa bao gồm thuế VAT)  \nCông thức tính giá dịch vụ quản trị quỹ vào mỗi kỳ định giá được xác định như sau:  \nGiá dịch vụ quản trị quỹ cho kỳ định giá = Tỷ lệ giá dịch vụ quản trị quỹ (năm) x NAV tại ngày trước ngày định giá x số ngày theo lịch thực tế của chu kỳ định giá / số ngày thực tế của năm (365 hoặc 366).', '## 2.6. Giá dịch vụ mà Quỹ phải trả\nGiá dịch vụ quản lý được tính vào mỗi kỳ định giá dựa trên NAV tại ngày trước ngày định giá và được thanh toán hàng tháng cho Công ty Quản Lý Quỹ. Số giá dịch vụ trả hàng tháng là tổng số giá dịch vụ được tính (trích lập) cho các kỳ định giá thực hiện trong tháng.  \nCông thức tính giá dịch vụ quản lý quỹ vào mỗi kỳ định giá được xác định như sau:  \nGiá dịch vụ quản lý quỹ cho kỳ định giá = Tỷ lệ giá dịch vụ quản lý (năm) x NAV tại ngày trước ngày định giá x số ngày theo lịch thực tế của chu kỳ định giá / số ngày thực tế của năm (365 hoặc 366).  \n36', '## 3. Giá dịch vụ và thưởng hoạt động\nCác loại phí/dịch vụ và chi phí/giá dịch vụ liên quan trực tiếp đến việc giao dịch Đơn Vị Quỹ sẽ do Nhà Đầu Tư trả và không được tính vào chi phí của Quỹ. Công Ty Quản Lý Quỹ bảo lưu quyền thay đổi biểu phí/giá dịch vụ này.  \nCác khoản giá dịch vụ giao dịch như sau:', '## 2.5.3. Thông tin về các mức giá dịch vụ\nCác loại phí/dịch vụ và chi phí/giá dịch vụ liên quan trực tiếp đến việc giao dịch Đơn Vị Quỹ sẽ do Nhà Đầu Tư trả và không được tính vào chi phí của Quỹ. Công Ty Quản Lý Quỹ bảo lưu quyền thay đổi biểu phí/giá dịch vụ này.  \nCác khoản giá dịch vụ giao dịch như sau:', '|  Từ trên 12 tháng trở lên | 0,00%  |\n| --- | --- |  \nGiá dịch vụ Chuyển Đổi Quỹ sẽ được hạch toán cho Công Ty Quản Lý Quỹ và Đại Lý Phân Phối căn cứ theo hợp đồng ký giữa Công Ty Quản Lý Quỹ và Đại Lý Phân Phối.', 'Công thức tính giá dịch vụ quản trị quỹ vào mỗi kỳ định giá được xác định như sau:  \nGiá dịch vụ quản trị quỹ cho kỳ định giá = Tỷ lệ giá dịch vụ quản trị quỹ (năm) x NAV tại ngày trước ngày định giá x số ngày theo lịch thực tế của chu kỳ định giá / số ngày thực tế của năm (365 hoặc 366).  \nc. Giá dịch vụ Đại Lý Chuyển Nhượng  \nGiá dịch vụ Đại lý chuyển nhượng được tính toán và cộng đồng theo kỳ định giá và được thanh toán định kỳ theo thỏa thuận với Đại lý chuyển nhượng. Giá dịch vụ Đại lý chuyển nhượng được thống nhất với Đại lý chuyển nhượng phù hợp với quy định của pháp luật và có thể được điều chỉnh theo thỏa thuận với Đại lý chuyển nhượng.  \nd. Chi phí Kiểm Toán', 'Giá dịch vụ Mua lại và các khoản giá dịch vụ ngân hàng và thuế khác (nếu có) sẽ được trừ vào khoản tiền thu được từ bản Đơn Vị Quỹ của Nhà Đầu Tư.  \nGiá dịch vụ Mua lại cho tất cả các Chương trình được TCC ấn định và công bố bằng văn bản thông báo tại từng thời kỳ nhưng không quá 3,0% (ba phần trăm) giá trị của Lệnh Bản. Thời điểm áp dụng mức giá dịch vụ mới tăng sớm nhất là 60 ngày kể từ ngày Công ty Quản Lý Quỹ công bố về mức giá dịch vụ mới trên trang thông tin điện tử của Công ty.  \nMức giá dịch vụ mua lại của Quỹ như sau:  \n|  Thời gian nắm giữ CCQ | Giá dịch vụ mua lại (% giá trị lệnh bán)  |\n| --- | --- |\n|  0 đến dưới 6 tháng | 1,00%  |\n|  Từ tròn 6 đến tròn 9 tháng | 0,75%  |\n|  Từ trên 9 đến tròn 12 tháng | 0,50%  |\n|  Từ trên 12 tháng trở lên | 0,00%  |', 'a. Giá dịch vụ Lưu Ký xử lý hồ sơ  \n|  Loại Giá dịch vụ | Mức giá dịch vụ | Tối thiểu/tối đa | Ghi chú  |\n| --- | --- |\n|  Giá dịch vụ lưu ký xử lý hồ sơ  |   |   |   |\n|  Đối với giao dịch cổ phiếu niêm yết/đăng ký giao dịch | 0,03% * giá trị giao dịch | Tối thiểu 100.000 đồng/ngày giao dịch, Tối đa 10.000.000 đồng/ngày giao dịch |   |\n|  Đối với giao dịch trái phiếu niêm yết/đăng ký giao dịch | 0,01% * giá trị giao dịch |   |   |\n|  Đối với các giao dịch mua bán CK OTC và các tài sản khác | 100.000 đồng/giao dịch |  |   |  \nb. Giá dịch vụ Quản Trị Quỹ  \nGiá dịch vụ Quản trị quỹ sẽ là 0,03% NAV/năm và thấp nhất là 15.000.000 đồng/ tháng (chưa bao gồm thuế VAT)  \nCông thức tính giá dịch vụ quản trị quỹ vào mỗi kỳ định giá được xác định như sau:', 'Mức đầu tư tối thiểu (tính theo giá trị Lệnh Mua) là 10.000 VNĐ (Mười nghìn đồng)  \nKhông có mức giới hạn đầu tư tối đa cho Nhà Đầu Tư. Công Ty Quản Lý Quỹ bảo lưu quyền thay đổi các giới hạn đầu tư trên trong từng thời điểm và sẽ thông báo về các thay đổi này.', '## f) Lệnh Mua Tối Thiểu\nMức đầu tư tối thiểu (tính theo giá trị Lệnh Mua) là 10.000 VND (Mười nghìn đồng)  \nKhông có mức giới hạn đầu tư tối đa cho Nhà Đầu Tư. Công Ty Quản Lý Quỹ bảo lưu quyền thay đổi các giới hạn đầu tư trên trong từng thời điểm và sẽ thông báo về các thay đổi này.', 'Công Ty Quản Lý Quỹ có quyền thay đổi Giá dịch vụ Mua lại nhưng không được vượt quá mức quy định của pháp luật. Mức Giá dịch vụ Mua lại mới sẽ được Công Ty Quản Lý Quỹ thông báo chi tiết tại trang thông tin điện tử của Quỹ và tại các địa điểm phân phối của các Đại Lý Phân Phối.  \nGiá dịch vụ Mua lại sẽ được trừ vào khoản tiền bán được trả lại cho các Nhà Đầu Tư khi thực hiện các Lệnh Bản và được hạch toán cho Công Ty Quản Lý Quỹ và Đại Lý Phân Phối căn cứ theo hợp đồng ký giữa Công Ty Quản Lý Quỹ và Đại Lý Phân Phối.', '## 3. Giá dịch vụ và thưởng hoạt động\nGiá dịch vụ Mua lại cho tất cả các Chương trình được TCC ấn định và công bố bằng văn bản thông báo tại từng thời kỳ nhưng không quá 3,0% (ba phần trăm) giá trị của Lệnh Bán. Thời điểm áp dụng mức giá dịch vụ mới tăng sớm nhất là 60 ngày kể từ ngày Công ty Quản Lý Quỹ công bố về mức giá dịch vụ mới trên trang thông tin điện tử của Công ty.  \nMức giá dịch vụ mua lại của Quỹ như sau:  \n|  Thời gian nắm giữ CCQ | Giá dịch vụ mua lại (% giá trị lệnh bán)  |\n| --- | --- |\n|  0 đến dưới 6 tháng | 1,00%  |', '## h) Chi Phí Khác\n- Giá dịch vụ môi giới cho các giao dịch của quỹ;\n- Chi phí in ấn, ví dụ in các tài liệu cho Nhà Đầu Tư theo quy định Pháp Luật;\n- Giá dịch vụ định giá độc lập cho các khoản đầu tư cụ thể của Quỹ (chỉ khi cần thiết), ví dụ như định giá các khoản chứng khoán chưa niêm yết;\n- Chi phí phát sinh cho bất kỳ Đại Hội Nhà Đầu Tư hay cuộc họp nào của Ban Đại Diện Quỹ;\n- Phí/giá dịch vụ pháp lý liên quan đến hoạt động và các giao dịch của Quỹ và các loại phí/chi phí/dịch vụ khác theo Luật cho phép;\n- Thuế và các loại phí/dịch vụ bắt buộc của chính phủ áp dụng cho Quỹ; và\n- Các chi phí khác được Pháp Luật cho phép.', '7  \n“Giá Dịch Vụ Phát Hành/Giá Dịch Vụ Mua Lại”  \nLà giá dịch vụ mà Nhà Đầu Tư phải trả khi mua/bán một đơn vị Chứng Chỉ Quỹ cho Quỹ. Giá Dịch Vụ Phát Hành/Giá Dịch Vụ Mua Lại tính theo tỷ lệ phần trăm Giá Trị Tài Sản Ròng trên một đơn vị Chứng Chỉ Quỹ.  \n“Giá dịch vụ quản lý quỹ”  \nLà giá dịch vụ phải trả cho Công ty Quản Lý Quỹ cung cấp dịch vụ quản lý quỹ đã được quy định tại Điều lệ Quỹ.  \n“Cổ Tức Quỹ”  \nLà số lợi nhuận còn lại của Quỹ sau khi trừ đi các chi phí hợp lệ và được Đại Hội Nhà Đầu Tư quyết định chia theo tỷ lệ sở hữu của Nhà Đầu Tư.  \n“Giá trị tài sản ròng của Quỹ”  \nlà tổng giá trị các tài sản và các khoản đầu tư do Quỹ sở hữu trừ đi các nghĩa vụ nợ của Quỹ tại Ngày Định Giá.  \n“Ngày Định Giá”', '# 5. Kế hoạch phân chia lợi nhuận\nCông ty quản lý quỹ được phân chia lợi nhuận của quỹ cho nhà đầu tư bằng tiền hoặc bằng đơn vị quỹ theo quy định tại điều lệ quỹ và chính sách phân chia lợi nhuận được công bố tại bản cáo bạch. Lợi nhuận phân chia được trích từ nguồn lợi nhuận để lại hoặc từ thu nhập của quỹ. Công ty quản lý quỹ chỉ được phân chia lợi nhuận khi quỹ đã hoàn thành hoặc có đủ năng lực tài chính để hoàn thành nghĩa vụ thuế và các nghĩa vụ tài chính khác theo quy định của pháp luật; trích lập đầy đủ các quỹ theo quy định tại điều lệ quỹ; ngay sau khi trả hết số lợi nhuận đã định, quỹ vẫn phải bảo đảm thanh toán đủ các khoản nợ, nghĩa vụ tài sản khác đến hạn. Lịch trình và kế hoạch thực hiện phải được công bố công khai trên trang thông tin điện tử của công ty quản lý quỹ.', '## 2.2.4 Hạn mức đầu tư\nHạn mức đầu tư của Quỹ được quy định chi tiết tuân thủ các quy định tại Thông tư hướng dẫn hoạt động và quản lý các quỹ đầu tư chứng khoán. Cơ cấu danh mục đầu tư của Quỹ phải bảo đảm tuân thủ các hạn mức đầu tư sau:  \na) Trừ tiền gửi trên tài khoản thanh toán của quỹ tại ngân hàng giám sát, quỹ mở không được đầu tư quá 49% tổng giá trị tài sản của quỹ vào các tài sản theo quy định tại điểm a, b mục IX.2.2.3  \nb) Không được đầu tư vào chứng khoán của một tổ chức phát hành quá 10% tổng giá trị chứng khoán đang lưu hành của tổ chức đó, trừ công cụ nợ của Chính phủ;  \nc) Không được đầu tư quá 20% tổng giá trị tài sản của quỹ vào chứng khoán đang lưu hành và các tài sản (nếu có) quy định tại điểm a, b mục IX.2.2.3 của một tổ chức phát hành, trừ công cụ nợ của Chính phủ;', '## b. Giá dịch vụ giám sát\nGiá dịch vụ giám sát được trả cho Ngân Hàng Giám Sát để cung cấp dịch vụ Ngân Hàng Giám Sát cho Quỹ. Giá dịch vụ được tính vào mỗi kỳ định giá dựa trên NAV tại ngày trước Ngày Định Giá và được trả hàng tháng. Số tiền trả dịch vụ hàng tháng là tổng số được tính (trích lập) cho các kỳ định giá thực hiện trong tháng.  \nCông thức tính giá dịch vụ giám sát vào mỗi kỳ định giá được xác định như sau:  \nGiá dịch vụ giám sát cho kỳ định giá = Tỷ lệ giá dịch vụ giám sát (năm) x NAV tại ngày trước ngày định giá x số ngày theo lịch thực tế của chu kỳ định giá / số ngày thực tế của năm (365 hoặc 366).  \n|  Loại Giá dịch vụ | Mức giá dịch vụ | Tối thiểu/tối đa | Ghi chú  |\n| --- | --- |\n|  Giá dịch vụ giám sát | 0,02%*NAV/Năm | Tối thiểu: 5.000.000 đồng /tháng | Thuế VAT 10%  |', '## c) Giá dịch vụ Lưu Ký\nGiá dịch vụ lưu ký được trả cho Ngân Hàng Lưu ký để cung cấp dịch vụ Ngân Hàng Lưu ký cho Quỹ. Giá dịch vụ được tính vào mỗi kỳ định giá dựa trên NAV tại ngày trước Ngày Định Giá và được trả hàng tháng. Số tiền trả dịch vụ hàng tháng là tổng số được tính (trích lập) cho các kỳ định giá thực hiện trong tháng.  \nCông thức tính giá dịch vụ lưu ký vào mỗi kỳ định giá được xác định như sau:  \nGiá dịch vụ lưu ký cho kỳ định giá = Tỷ lệ giá dịch vụ lưu ký (năm) x NAV tại ngày trước ngày định giá x số ngày theo lịch thực tế của chu kỳ định giá / số ngày thực tế của năm (365 hoặc 366).  \n|  Loại Giá dịch vụ | Mức giá dịch vụ | Tối thiểu/tối đa | Ghi chú  |\n| --- | --- |\n|  Giá dịch vụ lưu ký | 0,06%*NAV/Năm | Tối thiểu: 20.000.000 đồng /tháng |   |', '## c. Giá dịch vụ Lưu ký\nGiá dịch vụ lưu ký được trả cho Ngân Hàng Lưu ký để cung cấp dịch vụ Ngân Hàng Lưu ký cho Quỹ. Giá dịch vụ được tính vào mỗi kỳ định giá dựa trên NAV tại ngày trước Ngày Định Giá và được trả hàng tháng. Số tiền trả dịch vụ hàng tháng là tổng số được tính (trích lập) cho các kỳ định giá thực hiện trong tháng.  \nCông thức tính giá dịch vụ lưu ký vào mỗi kỳ định giá được xác định như sau:  \nGiá dịch vụ lưu ký cho kỳ định giá = Tỷ lệ giá dịch vụ lưu ký (năm) x NAV tại ngày trước ngày định giá x số ngày theo lịch thực tế của chu kỳ định giá / số ngày thực tế của năm (365 hoặc 366).  \n|  Loại Giá dịch vụ | Mức giá dịch vụ | Tối thiểu/tối đa | Ghi chú  |\n| --- | --- |\n|  Giá dịch vụ lưu ký | 0,06%*NAV/Năm | Tối thiểu: 20.000.000 đồng /tháng |   |', 'Giá dịch vụ Chuyển Đổi Quỹ sẽ được hạch toán cho Công Ty Quản Lý Quỹ và Đại Lý Phân Phối căn cứ theo hợp đồng ký giữa Công Ty Quản Lý Quỹ và Đại Lý Phân Phối.', '|  Từ trên 9 đến tròn 12 tháng | 0,50%  |\n|  Từ trên 12 tháng trở lên | 0,00%  |  \nTrường hợp Nhà Đầu Tư mua Chứng Chỉ Quỹ nhiều lần, mua theo Chương Trình ĐTĐK hoặc dưới hình thức tái đầu tư bằng nguồn cổ tức của Quỹ không phải chịu Giá dịch vụ phát hành, ưu tiên bán được thực hiện theo nguyên tắc các Chứng Chỉ Quỹ mua trước sẽ được bán trước, không phân biệt chứng chỉ quỹ mua theo lệnh mua bình thường hay Chương Trình ĐTĐK hay hình thức tái đầu tư bằng nguồn cổ tức.  \nCông Ty Quản Lý Quỹ có quyền thay đổi Giá dịch vụ Mua lại nhưng không được vượt quá mức quy định của pháp luật. Mức Giá dịch vụ Mua lại mới sẽ được Công Ty Quản Lý Quỹ thông báo chi tiết tại trang thông tin điện tử của Quỹ và tại các địa điểm phân phối của các Đại Lý Phân Phối.', '## c) Giá dịch vụ Chuyển Đổi Quỹ\nGiá dịch vụ Chuyển Đổi là giá dịch vụ mà Nhà Đầu Tư phải trả khi thực hiện chuyển đổi đầu tư giữa các Quỹ mở do Công Ty Quản Lý Quỹ quản lý. Việc chuyển đổi Quỹ bằng việc bán một Quỹ và mua một Quỹ khác tại ngày giao dịch tương ứng được coi như thực hiện một lệnh bán. Giá dịch vụ Chuyển Đổi Quỹ do đó được áp dụng một lần trên giá trị chuyển đổi với mức giá dịch vụ được TCC ấn định và công bố bằng văn bản thông báo tại từng thời kỳ nhưng không quá 3,0% (ba phần trăm) giá trị thực hiện chuyển đổi. Thời điểm áp dụng mức giá dịch vụ mới tăng sớm nhất là 60 ngày kể từ ngày Công ty Quản Lý Quỹ công bố về mức giá dịch vụ mới trên trang thông tin điện tử của Công ty.']","Giá dịch vụ Quản Lý tối đa là 1,2% NAV/năm."
Biểu phí dịch vụ mua lại (Redemption Fee) áp dụng cho nhà đầu tư nắm giữ dưới 6 tháng và từ 12 tháng trở lên là bao nhiêu?,"Biểu phí dịch vụ mua lại (Redemption Fee) áp dụng như sau:

- Đối với nhà đầu tư nắm giữ dưới 6 tháng: Phí mua lại là 0.5% của giá trị giao dịch.
- Đối với nhà đầu tư nắm giữ từ 12 tháng trở lên: Phí mua lại là 0%.

Thông tin này được lấy từ Trang 34 và Trang 59 của tài liệu.

**Lưu ý:** 
- Phí mua lại áp dụng cho các giao dịch bán cổ phiếu hoặc chứng khoán khác.
- Công ty Quản lý Quỹ có quyền thay đổi biểu phí này theo thời gian.","['## 3. Giá dịch vụ và thưởng hoạt động\nGiá dịch vụ Mua lại cho tất cả các Chương trình được TCC ấn định và công bố bằng văn bản thông báo tại từng thời kỳ nhưng không quá 3,0% (ba phần trăm) giá trị của Lệnh Bán. Thời điểm áp dụng mức giá dịch vụ mới tăng sớm nhất là 60 ngày kể từ ngày Công ty Quản Lý Quỹ công bố về mức giá dịch vụ mới trên trang thông tin điện tử của Công ty.  \nMức giá dịch vụ mua lại của Quỹ như sau:  \n|  Thời gian nắm giữ CCQ | Giá dịch vụ mua lại (% giá trị lệnh bán)  |\n| --- | --- |\n|  0 đến dưới 6 tháng | 1,00%  |', '|  Từ trên 9 đến tròn 12 tháng | 0,50%  |\n|  Từ trên 12 tháng trở lên | 0,00%  |  \nTrường hợp Nhà Đầu Tư mua Chứng Chỉ Quỹ nhiều lần, mua theo Chương Trình ĐTĐK hoặc dưới hình thức tái đầu tư bằng nguồn cổ tức của Quỹ không phải chịu Giá dịch vụ phát hành, ưu tiên bán được thực hiện theo nguyên tắc các Chứng Chỉ Quỹ mua trước sẽ được bán trước, không phân biệt chứng chỉ quỹ mua theo lệnh mua bình thường hay Chương Trình ĐTĐK hay hình thức tái đầu tư bằng nguồn cổ tức.  \nCông Ty Quản Lý Quỹ có quyền thay đổi Giá dịch vụ Mua lại nhưng không được vượt quá mức quy định của pháp luật. Mức Giá dịch vụ Mua lại mới sẽ được Công Ty Quản Lý Quỹ thông báo chi tiết tại trang thông tin điện tử của Quỹ và tại các địa điểm phân phối của các Đại Lý Phân Phối.', 'Giá dịch vụ Mua lại và các khoản giá dịch vụ ngân hàng và thuế khác (nếu có) sẽ được trừ vào khoản tiền thu được từ bản Đơn Vị Quỹ của Nhà Đầu Tư.  \nGiá dịch vụ Mua lại cho tất cả các Chương trình được TCC ấn định và công bố bằng văn bản thông báo tại từng thời kỳ nhưng không quá 3,0% (ba phần trăm) giá trị của Lệnh Bản. Thời điểm áp dụng mức giá dịch vụ mới tăng sớm nhất là 60 ngày kể từ ngày Công ty Quản Lý Quỹ công bố về mức giá dịch vụ mới trên trang thông tin điện tử của Công ty.  \nMức giá dịch vụ mua lại của Quỹ như sau:  \n|  Thời gian nắm giữ CCQ | Giá dịch vụ mua lại (% giá trị lệnh bán)  |\n| --- | --- |\n|  0 đến dưới 6 tháng | 1,00%  |\n|  Từ tròn 6 đến tròn 9 tháng | 0,75%  |\n|  Từ trên 9 đến tròn 12 tháng | 0,50%  |\n|  Từ trên 12 tháng trở lên | 0,00%  |', 'Công Ty Quản Lý Quỹ có quyền thay đổi Giá dịch vụ Mua lại nhưng không được vượt quá mức quy định của pháp luật. Mức Giá dịch vụ Mua lại mới sẽ được Công Ty Quản Lý Quỹ thông báo chi tiết tại trang thông tin điện tử của Quỹ và tại các địa điểm phân phối của các Đại Lý Phân Phối.  \nGiá dịch vụ Mua lại sẽ được trừ vào khoản tiền bán được trả lại cho các Nhà Đầu Tư khi thực hiện các Lệnh Bản và được hạch toán cho Công Ty Quản Lý Quỹ và Đại Lý Phân Phối căn cứ theo hợp đồng ký giữa Công Ty Quản Lý Quỹ và Đại Lý Phân Phối.', 'Giá dịch vụ Mua lại sẽ được trừ vào khoản tiền bán được trả lại cho các Nhà Đầu Tư khi thực hiện các Lệnh Bản và được hạch toán cho Công Ty Quản Lý Quỹ và Đại Lý Phân Phối căn cứ theo hợp đồng ký giữa Công Ty Quản Lý Quỹ và Đại Lý Phân Phối.', '## c) Giá dịch vụ Chuyển Đổi Quỹ\nGiá dịch vụ Chuyển Đổi là giá dịch vụ mà Nhà Đầu Tư phải trả khi thực hiện chuyển đổi đầu tư giữa các Quỹ mở do Công Ty Quản Lý Quỹ quản lý. Việc chuyển đổi Quỹ bằng việc bán một Quỹ và mua một Quỹ khác tại ngày giao dịch tương ứng được coi như thực hiện một lệnh bán. Giá dịch vụ Chuyển Đổi Quỹ do đó được áp dụng một lần trên giá trị chuyển đổi với mức giá dịch vụ được TCC ấn định và công bố bằng văn bản thông báo tại từng thời kỳ nhưng không quá 3,0% (ba phần trăm) giá trị thực hiện chuyển đổi. Thời điểm áp dụng mức giá dịch vụ mới tăng sớm nhất là 60 ngày kể từ ngày Công ty Quản Lý Quỹ công bố về mức giá dịch vụ mới trên trang thông tin điện tử của Công ty.', '## c) Giá dịch vụ Chuyển Đổi Quỹ\nGiá dịch vụ Chuyển Đổi là giá dịch vụ mà Nhà Đầu Tư phải trả khi thực hiện chuyển đổi đầu tư giữa các Quỹ mở do Công Ty Quản Lý Quỹ quản lý. Việc chuyển đổi Quỹ bằng việc bán một Quỹ và mua một Quỹ khác tại ngày giao dịch tương ứng được coi như thực hiện một lệnh bán. Giá dịch vụ Chuyển Đổi Quỹ do đó được áp dụng một lần trên giá trị chuyển đổi với mức giá dịch vụ được TCC ấn định và công bố bằng văn bản thông báo tại từng thời kỳ nhưng không quá 3,0% (ba phần trăm) giá trị thực hiện chuyển đổi. Thời điểm áp dụng mức giá dịch vụ mới tăng sớm nhất là 60 ngày kể từ ngày Công ty Quản Lý Quỹ công bố về mức giá dịch vụ mới trên trang thông tin điện tử của Công ty.', '## d) Giá dịch vụ Chuyển Nhượng\nNhà Đầu Tư phải trả một mức Giá dịch vụ Chuyển Nhượng duy nhất là 300.000 đồng (ba trăm nghìn đồng) cho mỗi giao dịch chuyển nhượng Đơn Vị Quỹ. Giá dịch vụ Chuyển Nhượng do người thực hiện chuyển nhượng thanh toán.  \nGiá dịch vụ Chuyển Nhượng sẽ không áp dụng trong trường hợp Nhà Đầu Tư thực hiện chuyển nhượng số Chứng Chỉ Quỹ từ tài khoản này sang tài khoản khác cùng đứng tên Nhà Đầu Tư tại hai Đại Lý Phân Phối khác nhau.  \nGiá dịch vụ Chuyển Nhượng sẽ được hạch toán cho Công Ty Quản Lý Quỹ và Đại Lý Phân Phối căn cứ theo hợp đồng ký giữa Công Ty Quản Lý Quỹ và Đại Lý Phân Phối.', '## 3. Giá dịch vụ và thưởng hoạt động\nNhà Đầu Tư được khuyến khích nắm giữ các Đơn Vị Quỹ như một phần của các khoản đầu tư dài hạn và chương trình tiết kiệm hưu trí. Quỹ mở không được thiết kế cho mục đích mua bán ngắn hạn. Việc Nhà Đầu Tư thường xuyên mua đi và bán lại Đơn Vị Quỹ, vốn được thiết kế để đạt được lợi nhuận dài hạn sẽ ảnh hưởng đến mục tiêu lợi nhuận của Nhà Đầu Tư khi đầu tư vào Quỹ cũng như lợi nhuận của Quỹ.  \nGiá dịch vụ Mua lại và các khoản giá dịch vụ ngân hàng và thuế khác (nếu có) sẽ được trừ vào khoản tiền thu được từ bán Đơn Vị Quỹ của Nhà Đầu Tư.', '## d) Giá dịch vụ Chuyển Nhượng\nNhà Đầu Tư phải trả một mức Giá dịch vụ Chuyển Nhượng duy nhất là 300.000 đồng (ba trăm nghìn đồng) cho mỗi giao dịch chuyển nhượng Đơn Vị Quỹ. Giá dịch vụ Chuyển Nhượng do người thực hiện chuyển nhượng thanh toán.  \nGiá dịch vụ Chuyển Nhượng sẽ không áp dụng trong trường hợp Nhà Đầu Tư thực hiện chuyển nhượng số Chứng Chí Quỹ từ tài khoản này sang tài khoản khác cùng đứng tên Nhà Đầu Tư tại hai Đại Lý Phân Phối khác nhau.  \nGiá dịch vụ Chuyển Nhượng sẽ được hạch toán cho Công Ty Quản Lý Quỹ và Đại Lý Phân Phối căn cứ theo hợp đồng ký giữa Công Ty Quản Lý Quỹ và Đại Lý Phân Phối.', '## c) Giá dịch vụ Chuyển Đổi Quỹ\nKhi thực hiện chuyển đổi, Nhà Đầu Tư chỉ thanh toán Giá dịch vụ Chuyển Đổi trên giá trị đăng ký chuyển đổi, mà không phải thanh toán Giá dịch vụ Mua Lại đối với Quỹ hiện tại và Giá dịch vụ Phát Hành đối với Quỹ mục tiêu.  \nCác khoản thuế giao dịch, giá dịch vụ chuyển tiền ngân hàng, nếu có, sẽ được khấu trừ vào số tiền thu được từ Lệnh Bản trong Lệnh Chuyển Đổi. Thời gian nắm giữ Đơn Vị Quỹ của Quỹ mục tiêu sẽ được tính từ ngày Lệnh Chuyển Đổi Quỹ được thực hiện.  \nMức giá dịch vụ chuyển đổi của Quỹ như sau:  \n|  Thời gian nắm giữ CCQ | Giá dịch vụ chuyển đổi (% giá trị lệnh bán)  |\n| --- | --- |\n|  0 đến dưới 6 tháng | 1,00%  |\n|  Từ tròn 6 đến tròn 9 tháng | 0,75%  |\n|  Từ trên 9 đến tròn 12 tháng | 0,50%  |', '## 3. Giao dịch chứng chỉ quỹ các lần tiếp theo\n**Giá bán/Giá dịch vụ phát hành:** Là mức giá Nhà Đầu Tư phải thanh toán để mua một đơn vị quỹ.  \n**Giá dịch vụ mua lại:** Là mức giá mà Công ty Quản Lý Quỹ phải thanh toán để mua lại từ Nhà Đầu Tư một đơn vị quỹ. Giá mua lại bằng giá trị tài sản ròng trên một đơn vị quỹ trừ đi giá dịch vụ mua lại chứng chỉ quỹ theo quy định.', '|  Từ tròn 6 đến tròn 9 tháng | 0,75%  |\n| --- | --- |\n|  Từ trên 9 đến tròn 12 tháng | 0,50%  |\n|  Từ trên 12 tháng trở lên | 0,00%  |  \nTrường hợp Nhà Đầu Tư mua Chứng Chỉ Quỹ nhiều lần, mua theo Chương Trình ĐTĐK hoặc dưới hình thức tái đầu tư bằng nguồn cổ tức của Quỹ không phải chịu Giá dịch vụ phát hành, ưu tiên bán được thực hiện theo nguyên tắc các Chứng Chỉ Quỹ mua trước sẽ được bán trước, không phân biệt chứng chỉ quỹ mua theo lệnh mua bình thường hay Chương Trình ĐTĐK hay hình thức tái đầu tư bằng nguồn cổ tức.', 'Mức giá dịch vụ chuyển đổi của Quỹ như sau:  \n|  Thời gian nắm giữ CCQ | Giá dịch vụ chuyển đổi (% giá trị lệnh bán)  |\n| --- | --- |\n|  0 đến dưới 6 tháng | 1,00%  |\n|  Từ tròn 6 đến tròn 9 tháng | 0,75%  |\n|  Từ trên 9 đến tròn 12 tháng | 0,50%  |\n|  Từ trên 12 tháng trở lên | 0,00%  |  \nKhi thực hiện chuyển đổi, Nhà Đầu Tư chỉ thanh toán Giá dịch vụ Chuyển Đổi trên giá trị đăng ký chuyển đổi, mà không phải thanh toán Giá dịch vụ Mua Lại đối với Quỹ hiện tại và Giá dịch vụ Phát Hành đối với Quỹ mục tiêu.  \nCác khoản thuế giao dịch, giá dịch vụ chuyển tiền ngân hàng, nếu có, sẽ được khấu trừ vào số tiền thu được từ Lệnh Bản trong Lệnh Chuyển Đổi. Thời gian nắm giữ Đơn Vị Quỹ của Quỹ mục tiêu sẽ được tính từ ngày Lệnh Chuyển Đổi Quỹ được thực hiện.', '## 3. Giá dịch vụ và thưởng hoạt động\nCác loại phí/dịch vụ và chi phí/giá dịch vụ liên quan trực tiếp đến việc giao dịch Đơn Vị Quỹ sẽ do Nhà Đầu Tư trả và không được tính vào chi phí của Quỹ. Công Ty Quản Lý Quỹ bảo lưu quyền thay đổi biểu phí/giá dịch vụ này.  \nCác khoản giá dịch vụ giao dịch như sau:', '## 2.5.3. Thông tin về các mức giá dịch vụ\nCác loại phí/dịch vụ và chi phí/giá dịch vụ liên quan trực tiếp đến việc giao dịch Đơn Vị Quỹ sẽ do Nhà Đầu Tư trả và không được tính vào chi phí của Quỹ. Công Ty Quản Lý Quỹ bảo lưu quyền thay đổi biểu phí/giá dịch vụ này.  \nCác khoản giá dịch vụ giao dịch như sau:', '## 2.5.3. Thông tin về các mức giá dịch vụ\nGiá dịch vụ Phát hành được tính bằng tỷ lệ phần trăm giá trị của Lệnh Mua. Tùy thuộc vào giá trị mua của từng Lệnh Mua, hình thức mua một lần hay mua theo chương trình ĐTĐK, Giá dịch vụ Phát hành được tính theo các biểu giá dịch vụ.  \nGiá dịch vụ phát hành áp dụng cho lệnh mua được TCC ấn định và công bố bằng văn bản thông báo tại từng thời kỳ nhưng không quá 5,0% (năm phần trăm) giá trị Lệnh Mua. Thời điểm áp dụng mức giá dịch vụ mới tăng sớm nhất là 60 ngày kể từ ngày Công ty Quản Lý Quỹ công bố về mức giá dịch vụ mới trên trang thông tin điện tử của Công ty.  \nMức giá dịch vụ phát hành của Quỹ là 0%.  \nGiá dịch vụ phát hành sẽ được hạch toán cho Công Ty Quản Lý Quỹ và Đại Lý Phân Phối căn cứ theo hợp đồng ký giữa Công Ty Quản Lý Quỹ và Đại Lý Phân Phối.', '## 3. Giá dịch vụ và thưởng hoạt động\nGiá dịch vụ Phát hành được tính bằng tỷ lệ phần trăm giá trị của Lệnh Mua. Tùy thuộc vào giá trị mua của từng Lệnh Mua, hình thức mua một lần hay mua theo chương trình ĐTĐK, Giá dịch vụ Phát hành được tính theo các biểu giá dịch vụ.  \nGiá dịch vụ phát hành áp dụng cho lệnh mua được TCC ấn định và công bố bằng văn bản thông báo tại từng thời kỳ nhưng không quá 5,0% (năm phần trăm) giá trị Lệnh Mua. Thời điểm áp dụng mức giá dịch vụ mới tăng sớm nhất là 60 ngày kể từ ngày Công ty Quản Lý Quỹ công bố về mức giá dịch vụ mới trên trang thông tin điện tử của Công ty.  \nMức giá dịch vụ phát hành của Quỹ là 0%.  \nGiá dịch vụ phát hành sẽ được hạch toán cho Công Ty Quản Lý Quỹ và Đại Lý Phân Phối căn cứ theo hợp đồng ký giữa Công Ty Quản Lý Quỹ và Đại Lý Phân Phối.', '## d) Giá dịch vụ Lưu Ký xử lý hồ sơ\n|  Loại Giá dịch vụ | Mức giá dịch vụ | Tối thiểu/tối đa | Ghi chú  |\n| --- | --- |\n|  Giá dịch vụ lưu ký xử lý hồ sơ  |   |   |   |\n|  Đối với giao dịch cổ phiếu niêm yết/đăng ký giao dịch | 0,03% * giá trị giao dịch | Tối thiểu 100.000 đồng/ngày giao dịch, Tối đa 10.000.000 đồng/ngày giao dịch |   |\n|  Đối với giao dịch trái phiếu niêm yết/đăng ký giao dịch | 0,01% * giá trị giao dịch |   |   |\n|  Đối với các giao dịch mua | 100.000 đồng/giao |  |   |', '## 3.2 Giá dịch vụ mà Quỹ phải trả\nChỉ có các loại phí/dịch vụ và các chi phí/giá dịch vụ liên quan trực tiếp hoặc đóng góp vào các hoạt động và điều hành của Quỹ mới được tính vào chi phí/giá dịch vụ hoạt động của Quỹ. Xin lưu ý các phí/giá dịch vụ dưới đây là các mức đang áp dụng và các phí/giá dịch vụ này có thể sẽ thay đổi trong tương lai. Các chi phí/dịch vụ này bao gồm:', '## 2.6. Giá dịch vụ mà Quỹ phải trả\nChỉ có các loại phí/dịch vụ và các chi phí/giá dịch vụ liên quan trực tiếp hoặc đóng góp vào các hoạt động và điều hành của Quỹ mới được tính vào chi phí/giá dịch vụ hoạt động của Quỹ. Xin lưu ý các phí/giá dịch vụ dưới đây là các mức đang áp dụng và các phí/giá dịch vụ này có thể sẽ thay đổi trong tương lai. Các chi phí/dịch vụ này bao gồm:', 'Mức đầu tư tối thiểu (tính theo giá trị Lệnh Mua) là 10.000 VNĐ (Mười nghìn đồng)  \nKhông có mức giới hạn đầu tư tối đa cho Nhà Đầu Tư. Công Ty Quản Lý Quỹ bảo lưu quyền thay đổi các giới hạn đầu tư trên trong từng thời điểm và sẽ thông báo về các thay đổi này.', '## f) Lệnh Mua Tối Thiểu\nMức đầu tư tối thiểu (tính theo giá trị Lệnh Mua) là 10.000 VND (Mười nghìn đồng)  \nKhông có mức giới hạn đầu tư tối đa cho Nhà Đầu Tư. Công Ty Quản Lý Quỹ bảo lưu quyền thay đổi các giới hạn đầu tư trên trong từng thời điểm và sẽ thông báo về các thay đổi này.', '## h) Chi Phí Khác\n- Giá dịch vụ môi giới cho các giao dịch của quỹ;\n- Chi phí in ấn, ví dụ in các tài liệu cho Nhà Đầu Tư theo quy định Pháp Luật;\n- Giá dịch vụ định giá độc lập cho các khoản đầu tư cụ thể của Quỹ (chỉ khi cần thiết), ví dụ như định giá các khoản chứng khoán chưa niêm yết;\n- Chi phí phát sinh cho bất kỳ Đại Hội Nhà Đầu Tư hay cuộc họp nào của Ban Đại Diện Quỹ;\n- Phí/giá dịch vụ pháp lý liên quan đến hoạt động và các giao dịch của Quỹ và các loại phí/chi phí/dịch vụ khác theo Luật cho phép;\n- Thuế và các loại phí/dịch vụ bắt buộc của chính phủ áp dụng cho Quỹ; và\n- Các chi phí khác được Pháp Luật cho phép.', 'Cổ tức sẽ được chi trả trong thời hạn 30 (ba mươi) ngày kể từ ngày được công bố và được chuyển vào tài khoản ngân hàng của Nhà Đầu Tư theo đăng ký trong Sổ Đăng Ký vào ngày thanh toán cổ tức, sau khi được khấu trừ các loại thuế có liên quan.  \nCổ tức được chi trả sẽ phải chịu thuế tùy thuộc vào nguồn gốc của thu nhập của Quỹ cũng như các loại thuế áp dụng cho Nhà Đầu Tư.']","0 đến dưới 6 tháng: 1,00%; Từ trên 12 tháng trở lên: 0,00%."
Phí dịch vụ chuyển đổi (Switching Fee) giữa các quỹ mở của TechcomCapital được tính như thế nào?,"Phí dịch vụ chuyển đổi (Switching Fee) giữa các quỹ mở của TechcomCapital được tính dựa trên thời gian nắm giữ chứng chỉ quỹ:

- Trong 0 đến dưới 6 tháng: Phí là 1,00%
- Từ 6 tháng trở lên: Phí là 0%

Thông tin này được lấy từ trang 59 của tài liệu.

(Nguồn: Trang 59)","['## c) Giá dịch vụ Chuyển Đổi Quỹ\nGiá dịch vụ Chuyển Đổi là giá dịch vụ mà Nhà Đầu Tư phải trả khi thực hiện chuyển đổi đầu tư giữa các Quỹ mở do Công Ty Quản Lý Quỹ quản lý. Việc chuyển đổi Quỹ bằng việc bán một Quỹ và mua một Quỹ khác tại ngày giao dịch tương ứng được coi như thực hiện một lệnh bán. Giá dịch vụ Chuyển Đổi Quỹ do đó được áp dụng một lần trên giá trị chuyển đổi với mức giá dịch vụ được TCC ấn định và công bố bằng văn bản thông báo tại từng thời kỳ nhưng không quá 3,0% (ba phần trăm) giá trị thực hiện chuyển đổi. Thời điểm áp dụng mức giá dịch vụ mới tăng sớm nhất là 60 ngày kể từ ngày Công ty Quản Lý Quỹ công bố về mức giá dịch vụ mới trên trang thông tin điện tử của Công ty.', '## c) Giá dịch vụ Chuyển Đổi Quỹ\nGiá dịch vụ Chuyển Đổi là giá dịch vụ mà Nhà Đầu Tư phải trả khi thực hiện chuyển đổi đầu tư giữa các Quỹ mở do Công Ty Quản Lý Quỹ quản lý. Việc chuyển đổi Quỹ bằng việc bán một Quỹ và mua một Quỹ khác tại ngày giao dịch tương ứng được coi như thực hiện một lệnh bán. Giá dịch vụ Chuyển Đổi Quỹ do đó được áp dụng một lần trên giá trị chuyển đổi với mức giá dịch vụ được TCC ấn định và công bố bằng văn bản thông báo tại từng thời kỳ nhưng không quá 3,0% (ba phần trăm) giá trị thực hiện chuyển đổi. Thời điểm áp dụng mức giá dịch vụ mới tăng sớm nhất là 60 ngày kể từ ngày Công ty Quản Lý Quỹ công bố về mức giá dịch vụ mới trên trang thông tin điện tử của Công ty.', '## c) Giá dịch vụ Chuyển Đổi Quỹ\nKhi thực hiện chuyển đổi, Nhà Đầu Tư chỉ thanh toán Giá dịch vụ Chuyển Đổi trên giá trị đăng ký chuyển đổi, mà không phải thanh toán Giá dịch vụ Mua Lại đối với Quỹ hiện tại và Giá dịch vụ Phát Hành đối với Quỹ mục tiêu.  \nCác khoản thuế giao dịch, giá dịch vụ chuyển tiền ngân hàng, nếu có, sẽ được khấu trừ vào số tiền thu được từ Lệnh Bản trong Lệnh Chuyển Đổi. Thời gian nắm giữ Đơn Vị Quỹ của Quỹ mục tiêu sẽ được tính từ ngày Lệnh Chuyển Đổi Quỹ được thực hiện.  \nMức giá dịch vụ chuyển đổi của Quỹ như sau:  \n|  Thời gian nắm giữ CCQ | Giá dịch vụ chuyển đổi (% giá trị lệnh bán)  |\n| --- | --- |\n|  0 đến dưới 6 tháng | 1,00%  |\n|  Từ tròn 6 đến tròn 9 tháng | 0,75%  |\n|  Từ trên 9 đến tròn 12 tháng | 0,50%  |', '## 2.4.6. Quy trình chuyển đổi quỹ\nNhà Đầu Tư có thể chuyển đổi sang Quỹ khác do Công Ty Quản Lý Quỹ quản lý bằng Lệnh Chuyển Đổi. Phiếu Lệnh Chuyển Đổi được đính kèm theo Đơn Đăng Ký, hoặc có tại Điểm Nhận Lệnh. Đối với Lệnh Chuyển Đổi, toàn bộ tiền bán Đơn Vị Quỹ của Quỹ này sau khi trừ phí và thuế (nếu có), sẽ dùng để mua Đơn Vị Quỹ của Quỹ khác.  \nViệc chuyển đổi Quỹ bằng việc bán một Quỹ và mua một Quỹ khác tại ngày giao dịch tương ứng được coi như thực hiện một lệnh bán. Giá dịch vụ Chuyển Đổi Quỹ do đó được áp dụng một lần trên giá trị giao dịch bán và Giá dịch vụ Chuyển Đổi Quỹ được TCC ấn định và công bố bằng văn bản thông báo tại từng thời kỳ nhưng không quá ba phần trăm (3%) giá trị mua lại.', 'Mức giá dịch vụ chuyển đổi của Quỹ như sau:  \n|  Thời gian nắm giữ CCQ | Giá dịch vụ chuyển đổi (% giá trị lệnh bán)  |\n| --- | --- |\n|  0 đến dưới 6 tháng | 1,00%  |\n|  Từ tròn 6 đến tròn 9 tháng | 0,75%  |\n|  Từ trên 9 đến tròn 12 tháng | 0,50%  |\n|  Từ trên 12 tháng trở lên | 0,00%  |  \nKhi thực hiện chuyển đổi, Nhà Đầu Tư chỉ thanh toán Giá dịch vụ Chuyển Đổi trên giá trị đăng ký chuyển đổi, mà không phải thanh toán Giá dịch vụ Mua Lại đối với Quỹ hiện tại và Giá dịch vụ Phát Hành đối với Quỹ mục tiêu.  \nCác khoản thuế giao dịch, giá dịch vụ chuyển tiền ngân hàng, nếu có, sẽ được khấu trừ vào số tiền thu được từ Lệnh Bản trong Lệnh Chuyển Đổi. Thời gian nắm giữ Đơn Vị Quỹ của Quỹ mục tiêu sẽ được tính từ ngày Lệnh Chuyển Đổi Quỹ được thực hiện.', 'Việc chuyển đổi Quỹ bằng việc bán một Quỹ và mua một Quỹ khác tại ngày giao dịch tương ứng được coi như thực hiện một lệnh bán. Giá dịch vụ Chuyển Đổi Quỹ do đó được áp dụng một lần trên giá trị giao dịch bán và Giá dịch vụ Chuyển Đổi Quỹ được TCC ấn định và công bố bằng văn bản thông báo tại từng thời kỳ nhưng không quá ba phần trăm (3%) giá trị mua lại.  \n- **Xử lý các Lệnh Chuyển Đổi**  \nLệnh Chuyển Đổi được xử lý bởi Đại Lý Chuyển Nhượng như là Lệnh Bản và tiếp theo sau là Lệnh Mua được thực hiện tại Ngày Giao Dịch tương ứng.  \nLệnh Bản và Lệnh Mua được xử lý bởi Đại Lý Chuyển Nhượng theo quy trình mô tả ở trên với Lệnh Bản được thực hiện trước, Lệnh Mua được xử lý sau.  \nLệnh Chuyển Đổi được đặt bằng số lượng Đơn Vị Quỹ.  \n- **Mức Tối Thiểu Cho Lệnh Chuyển Đổi**', '## d) Giá dịch vụ Chuyển Nhượng\nNhà Đầu Tư phải trả một mức Giá dịch vụ Chuyển Nhượng duy nhất là 300.000 đồng (ba trăm nghìn đồng) cho mỗi giao dịch chuyển nhượng Đơn Vị Quỹ. Giá dịch vụ Chuyển Nhượng do người thực hiện chuyển nhượng thanh toán.  \nGiá dịch vụ Chuyển Nhượng sẽ không áp dụng trong trường hợp Nhà Đầu Tư thực hiện chuyển nhượng số Chứng Chỉ Quỹ từ tài khoản này sang tài khoản khác cùng đứng tên Nhà Đầu Tư tại hai Đại Lý Phân Phối khác nhau.  \nGiá dịch vụ Chuyển Nhượng sẽ được hạch toán cho Công Ty Quản Lý Quỹ và Đại Lý Phân Phối căn cứ theo hợp đồng ký giữa Công Ty Quản Lý Quỹ và Đại Lý Phân Phối.', '## d) Giá dịch vụ Chuyển Nhượng\nNhà Đầu Tư phải trả một mức Giá dịch vụ Chuyển Nhượng duy nhất là 300.000 đồng (ba trăm nghìn đồng) cho mỗi giao dịch chuyển nhượng Đơn Vị Quỹ. Giá dịch vụ Chuyển Nhượng do người thực hiện chuyển nhượng thanh toán.  \nGiá dịch vụ Chuyển Nhượng sẽ không áp dụng trong trường hợp Nhà Đầu Tư thực hiện chuyển nhượng số Chứng Chí Quỹ từ tài khoản này sang tài khoản khác cùng đứng tên Nhà Đầu Tư tại hai Đại Lý Phân Phối khác nhau.  \nGiá dịch vụ Chuyển Nhượng sẽ được hạch toán cho Công Ty Quản Lý Quỹ và Đại Lý Phân Phối căn cứ theo hợp đồng ký giữa Công Ty Quản Lý Quỹ và Đại Lý Phân Phối.', '## 2.5.3. Thông tin về các mức giá dịch vụ\nCác loại phí/dịch vụ và chi phí/giá dịch vụ liên quan trực tiếp đến việc giao dịch Đơn Vị Quỹ sẽ do Nhà Đầu Tư trả và không được tính vào chi phí của Quỹ. Công Ty Quản Lý Quỹ bảo lưu quyền thay đổi biểu phí/giá dịch vụ này.  \nCác khoản giá dịch vụ giao dịch như sau:', '## 3. Giá dịch vụ và thưởng hoạt động\nCác loại phí/dịch vụ và chi phí/giá dịch vụ liên quan trực tiếp đến việc giao dịch Đơn Vị Quỹ sẽ do Nhà Đầu Tư trả và không được tính vào chi phí của Quỹ. Công Ty Quản Lý Quỹ bảo lưu quyền thay đổi biểu phí/giá dịch vụ này.  \nCác khoản giá dịch vụ giao dịch như sau:', 'Giá dịch vụ Chuyển Đổi Quỹ sẽ được hạch toán cho Công Ty Quản Lý Quỹ và Đại Lý Phân Phối căn cứ theo hợp đồng ký giữa Công Ty Quản Lý Quỹ và Đại Lý Phân Phối.', '|  Từ trên 12 tháng trở lên | 0,00%  |\n| --- | --- |  \nGiá dịch vụ Chuyển Đổi Quỹ sẽ được hạch toán cho Công Ty Quản Lý Quỹ và Đại Lý Phân Phối căn cứ theo hợp đồng ký giữa Công Ty Quản Lý Quỹ và Đại Lý Phân Phối.', 'Công thức tính giá dịch vụ quản trị quỹ vào mỗi kỳ định giá được xác định như sau:  \nGiá dịch vụ quản trị quỹ cho kỳ định giá = Tỷ lệ giá dịch vụ quản trị quỹ (năm) x NAV tại ngày trước ngày định giá x số ngày theo lịch thực tế của chu kỳ định giá / số ngày thực tế của năm (365 hoặc 366).  \nc. Giá dịch vụ Đại Lý Chuyển Nhượng  \nGiá dịch vụ Đại lý chuyển nhượng được tính toán và cộng đồng theo kỳ định giá và được thanh toán định kỳ theo thỏa thuận với Đại lý chuyển nhượng. Giá dịch vụ Đại lý chuyển nhượng được thống nhất với Đại lý chuyển nhượng phù hợp với quy định của pháp luật và có thể được điều chỉnh theo thỏa thuận với Đại lý chuyển nhượng.  \nd. Chi phí Kiểm Toán', 'Giá dịch vụ Mua lại và các khoản giá dịch vụ ngân hàng và thuế khác (nếu có) sẽ được trừ vào khoản tiền thu được từ bản Đơn Vị Quỹ của Nhà Đầu Tư.  \nGiá dịch vụ Mua lại cho tất cả các Chương trình được TCC ấn định và công bố bằng văn bản thông báo tại từng thời kỳ nhưng không quá 3,0% (ba phần trăm) giá trị của Lệnh Bản. Thời điểm áp dụng mức giá dịch vụ mới tăng sớm nhất là 60 ngày kể từ ngày Công ty Quản Lý Quỹ công bố về mức giá dịch vụ mới trên trang thông tin điện tử của Công ty.  \nMức giá dịch vụ mua lại của Quỹ như sau:  \n|  Thời gian nắm giữ CCQ | Giá dịch vụ mua lại (% giá trị lệnh bán)  |\n| --- | --- |\n|  0 đến dưới 6 tháng | 1,00%  |\n|  Từ tròn 6 đến tròn 9 tháng | 0,75%  |\n|  Từ trên 9 đến tròn 12 tháng | 0,50%  |\n|  Từ trên 12 tháng trở lên | 0,00%  |', '## 2.6. Giá dịch vụ mà Quỹ phải trả\nChỉ có các loại phí/dịch vụ và các chi phí/giá dịch vụ liên quan trực tiếp hoặc đóng góp vào các hoạt động và điều hành của Quỹ mới được tính vào chi phí/giá dịch vụ hoạt động của Quỹ. Xin lưu ý các phí/giá dịch vụ dưới đây là các mức đang áp dụng và các phí/giá dịch vụ này có thể sẽ thay đổi trong tương lai. Các chi phí/dịch vụ này bao gồm:', '## 3.2 Giá dịch vụ mà Quỹ phải trả\nChỉ có các loại phí/dịch vụ và các chi phí/giá dịch vụ liên quan trực tiếp hoặc đóng góp vào các hoạt động và điều hành của Quỹ mới được tính vào chi phí/giá dịch vụ hoạt động của Quỹ. Xin lưu ý các phí/giá dịch vụ dưới đây là các mức đang áp dụng và các phí/giá dịch vụ này có thể sẽ thay đổi trong tương lai. Các chi phí/dịch vụ này bao gồm:', '## 3. Giá dịch vụ và thưởng hoạt động\nGiá dịch vụ Mua lại cho tất cả các Chương trình được TCC ấn định và công bố bằng văn bản thông báo tại từng thời kỳ nhưng không quá 3,0% (ba phần trăm) giá trị của Lệnh Bán. Thời điểm áp dụng mức giá dịch vụ mới tăng sớm nhất là 60 ngày kể từ ngày Công ty Quản Lý Quỹ công bố về mức giá dịch vụ mới trên trang thông tin điện tử của Công ty.  \nMức giá dịch vụ mua lại của Quỹ như sau:  \n|  Thời gian nắm giữ CCQ | Giá dịch vụ mua lại (% giá trị lệnh bán)  |\n| --- | --- |\n|  0 đến dưới 6 tháng | 1,00%  |', 'Công Ty Quản Lý Quỹ có quyền thay đổi Giá dịch vụ Mua lại nhưng không được vượt quá mức quy định của pháp luật. Mức Giá dịch vụ Mua lại mới sẽ được Công Ty Quản Lý Quỹ thông báo chi tiết tại trang thông tin điện tử của Quỹ và tại các địa điểm phân phối của các Đại Lý Phân Phối.  \nGiá dịch vụ Mua lại sẽ được trừ vào khoản tiền bán được trả lại cho các Nhà Đầu Tư khi thực hiện các Lệnh Bản và được hạch toán cho Công Ty Quản Lý Quỹ và Đại Lý Phân Phối căn cứ theo hợp đồng ký giữa Công Ty Quản Lý Quỹ và Đại Lý Phân Phối.', 'i. **Chi Phí Khác**  \n- Giá dịch vụ môi giới cho các giao dịch của quỹ;\n- Chi phí in ấn, ví dụ in các tài liệu cho Nhà Đầu Tư theo quy định Pháp Luật;\n- Giá dịch vụ định giá độc lập cho các khoản đầu tư cụ thể của Quỹ (chỉ khi cần thiết), ví dụ như định giá các khoản chứng khoán chưa niêm yết;\n- Chi phí phát sinh cho bất kỳ Đại Hội Nhà Đầu Tư hay cuộc họp nào của Ban Đại Diện Quỹ;\n- Phí/giá dịch vụ pháp lý liên quan đến hoạt động và các giao dịch của Quỹ và các loại phí/chi phí/dịch vụ khác theo Luật cho phép;\n- Thuế và các loại phí/dịch vụ bắt buộc của chính phủ áp dụng cho Quỹ; và\n- Các chi phí khác được Pháp Luật cho phép.  \n2.7. Phân phối lợi nhuận và chính sách thuế  \na. Chính sách cổ tức Quỹ', '## d) Giá dịch vụ Quản Trị Quỹ\nGiá dịch vụ Quản trị quỹ sẽ là 0,03% NAV/năm và thấp nhất là 15.000.000 đồng/ tháng (chưa bao gồm thuế VAT)  \nCông thức tính giá dịch vụ quản trị quỹ vào mỗi kỳ định giá được xác định như sau:  \nGiá dịch vụ quản trị quỹ cho kỳ định giá = Tỷ lệ giá dịch vụ quản trị quỹ (năm) x NAV tại ngày trước ngày định giá x số ngày theo lịch thực tế của chu kỳ định giá / số ngày thực tế của năm (365 hoặc 366).', '## h) Chi Phí Khác\n- Giá dịch vụ môi giới cho các giao dịch của quỹ;\n- Chi phí in ấn, ví dụ in các tài liệu cho Nhà Đầu Tư theo quy định Pháp Luật;\n- Giá dịch vụ định giá độc lập cho các khoản đầu tư cụ thể của Quỹ (chỉ khi cần thiết), ví dụ như định giá các khoản chứng khoán chưa niêm yết;\n- Chi phí phát sinh cho bất kỳ Đại Hội Nhà Đầu Tư hay cuộc họp nào của Ban Đại Diện Quỹ;\n- Phí/giá dịch vụ pháp lý liên quan đến hoạt động và các giao dịch của Quỹ và các loại phí/chi phí/dịch vụ khác theo Luật cho phép;\n- Thuế và các loại phí/dịch vụ bắt buộc của chính phủ áp dụng cho Quỹ; và\n- Các chi phí khác được Pháp Luật cho phép.', 'Trong các trường hợp tạm dừng thực hiện các giao dịch Đơn Vị Quỹ, Lệnh Chuyển Đổi đã nhận sẽ được thực hiện tại NAV tại Ngày Giao Dịch đầu tiên sau khi giao dịch được thực hiện trở lại.  \n**g. Quy trình chuyển nhượng chứng chỉ quỹ**  \n- **Đơn Chuyển Nhượng**  \nNhà Đầu Tư có thể Chuyển Nhượng Đơn Vị Quỹ cho nhà đầu tư khác dưới dạng quà tặng, thừa kế hoặc thực hiện lệnh của toà án. Chuyển Nhượng chỉ được thực hiện dưới dạng số lượng Đơn  \n55', '## 2. Tình hình hoạt động của Công ty Cổ phần Quản lý Quỹ Kỹ thương\n| --- | --- | --- |\n|  Quỹ Đầu tư Trái Phiếu Techcom (TCBF) | Quỹ mở | 21.577.788.816.709  |\n|  Quỹ Đầu tư Cổ Phiếu Techcom (TCEF) | Quỹ mở | 549.603.026.323  |\n|  Quỹ Đầu tư Bất động sản Techcom Việt Nam (TCREIT) | Quỹ đóng (niêm yết) | 75.223.561.190  |\n|  Quỹ Đầu tư Trái Phiếu linh hoạt Techcom (TCFF) | Quỹ mở | 113.197.601.214  |', '|  Techcombank (""TCB"") | Gửi tiền có kỳ hạn | Techcombank sở hữu 88.99% vốn của TCC  |  \nTrong tất cả các trường hợp, các giao dịch phải là giao dịch công bằng và vì lợi ích của Nhà Đầu Tư, theo đúng các quy định của pháp luật và Điều lệ Quỹ.  \nTất cả các giao dịch có thể gây ra xung đột lợi ích tiềm tàng phải được tư vấn và chấp thuận bởi TCC và phải được công bố cho Nhà Đầu Tư. Tuy nhiên TCC sẽ cố gắng hết sức để tránh các giao dịch có thể gây ra xung đột lợi ích mà không thể quản lý được một cách thích đáng.  \nNgười có liên quan của TCC được phép giao dịch Đơn Vị Quỹ theo phương thức giống như các Nhà Đầu Tư khác như quy định tại Điều lệ Quỹ.', 'Trong trường hợp Quỹ nhận được số tiền mua thấp hơn lệnh đăng ký mua và không nhận được yêu cầu chuyển trả từ khách hàng, số tiền mua sẽ tiếp tục được giữ lại để chờ yêu cầu giao dịch tiếp theo từ khách hàng.  \nTrong trường hợp Nhà Đầu Tư có nhiều lệnh mua Chứng Chỉ Quỹ cùng một lúc, Lệnh Mua Chứng Chỉ Quỹ sẽ được ưu tiên theo thứ tự đặt lệnh.  \nPhí/giá dịch vụ chuyển tiền (nếu có) được trừ vào số tiền hoàn trả cho Nhà Đầu Tư. Đơn Vị Quỹ sẽ chỉ được ghi nhận vào tài khoản của Nhà Đầu Tư hay của Đại Lý Kỷ Danh sau khi có kết quả giao dịch chứng chỉ quỹ.']","Giá dịch vụ Chuyển Đổi Quỹ tối đa 3%. Biểu phí hiện tại: 0 đến dưới 6 tháng: 1,00%; trên 12 tháng: 0,00%."
Nhà đầu tư phải trả bao nhiêu phí cho một lần chuyển nhượng chứng chỉ quỹ (Transfer Fee)?,"Theo thông tin trong tài liệu, phí chuyển nhượng chứng chỉ quỹ (Transfer Fee) không được đề cập cụ thể. Tuy nhiên, có một số thông tin liên quan đến các loại phí khác:

- Giá dịch vụ Chuyển đổi Quỹ (Chuyển Đổi Quỹ) áp dụng một lần trên giá trị giao dịch bán và được ấn định bởi TCC (Tổng Công ty Cổ phần Bảo hiểm Việt Nam), không quá 3% giá trị mua lại. 
- Phí Mua lại cũng sẽ được trừ vào khoản tiền thu được từ bán chứng chỉ quỹ.

Nếu bạn cần thông tin chính xác về phí chuyển nhượng, tôi khuyên bạn nên tham khảo thêm các điều khoản cụ thể trong hợp đồng hoặc liên hệ trực tiếp với công ty quản lý quỹ. 

Thông tin này không được đề cập cụ thể trong tài liệu, nên tôi không tìm thấy thông tin đó trong tài liệu.

(Nguồn: Trang 59)","['## d) Giá dịch vụ Chuyển Nhượng\nNhà Đầu Tư phải trả một mức Giá dịch vụ Chuyển Nhượng duy nhất là 300.000 đồng (ba trăm nghìn đồng) cho mỗi giao dịch chuyển nhượng Đơn Vị Quỹ. Giá dịch vụ Chuyển Nhượng do người thực hiện chuyển nhượng thanh toán.  \nGiá dịch vụ Chuyển Nhượng sẽ không áp dụng trong trường hợp Nhà Đầu Tư thực hiện chuyển nhượng số Chứng Chỉ Quỹ từ tài khoản này sang tài khoản khác cùng đứng tên Nhà Đầu Tư tại hai Đại Lý Phân Phối khác nhau.  \nGiá dịch vụ Chuyển Nhượng sẽ được hạch toán cho Công Ty Quản Lý Quỹ và Đại Lý Phân Phối căn cứ theo hợp đồng ký giữa Công Ty Quản Lý Quỹ và Đại Lý Phân Phối.', '## d) Giá dịch vụ Chuyển Nhượng\nNhà Đầu Tư phải trả một mức Giá dịch vụ Chuyển Nhượng duy nhất là 300.000 đồng (ba trăm nghìn đồng) cho mỗi giao dịch chuyển nhượng Đơn Vị Quỹ. Giá dịch vụ Chuyển Nhượng do người thực hiện chuyển nhượng thanh toán.  \nGiá dịch vụ Chuyển Nhượng sẽ không áp dụng trong trường hợp Nhà Đầu Tư thực hiện chuyển nhượng số Chứng Chí Quỹ từ tài khoản này sang tài khoản khác cùng đứng tên Nhà Đầu Tư tại hai Đại Lý Phân Phối khác nhau.  \nGiá dịch vụ Chuyển Nhượng sẽ được hạch toán cho Công Ty Quản Lý Quỹ và Đại Lý Phân Phối căn cứ theo hợp đồng ký giữa Công Ty Quản Lý Quỹ và Đại Lý Phân Phối.', '## c) Giá dịch vụ Chuyển Đổi Quỹ\nKhi thực hiện chuyển đổi, Nhà Đầu Tư chỉ thanh toán Giá dịch vụ Chuyển Đổi trên giá trị đăng ký chuyển đổi, mà không phải thanh toán Giá dịch vụ Mua Lại đối với Quỹ hiện tại và Giá dịch vụ Phát Hành đối với Quỹ mục tiêu.  \nCác khoản thuế giao dịch, giá dịch vụ chuyển tiền ngân hàng, nếu có, sẽ được khấu trừ vào số tiền thu được từ Lệnh Bản trong Lệnh Chuyển Đổi. Thời gian nắm giữ Đơn Vị Quỹ của Quỹ mục tiêu sẽ được tính từ ngày Lệnh Chuyển Đổi Quỹ được thực hiện.  \nMức giá dịch vụ chuyển đổi của Quỹ như sau:  \n|  Thời gian nắm giữ CCQ | Giá dịch vụ chuyển đổi (% giá trị lệnh bán)  |\n| --- | --- |\n|  0 đến dưới 6 tháng | 1,00%  |\n|  Từ tròn 6 đến tròn 9 tháng | 0,75%  |\n|  Từ trên 9 đến tròn 12 tháng | 0,50%  |', 'Trong trường hợp Quỹ nhận được số tiền mua thấp hơn lệnh đăng ký mua và không nhận được yêu cầu chuyển trả từ khách hàng, số tiền mua sẽ tiếp tục được giữ lại để chờ yêu cầu giao dịch tiếp theo từ khách hàng.  \nTrong trường hợp Nhà Đầu Tư có nhiều lệnh mua Chứng Chỉ Quỹ cùng một lúc, Lệnh Mua Chứng Chỉ Quỹ sẽ được ưu tiên theo thứ tự đặt lệnh.  \nPhí/giá dịch vụ chuyển tiền (nếu có) được trừ vào số tiền hoàn trả cho Nhà Đầu Tư. Đơn Vị Quỹ sẽ chỉ được ghi nhận vào tài khoản của Nhà Đầu Tư hay của Đại Lý Kỷ Danh sau khi có kết quả giao dịch chứng chỉ quỹ.', 'Trong trường hợp Quỹ nhận được số tiền mua thấp hơn Phiếu lệnh mua và không nhận được yêu cầu chuyển trả từ khách hàng, số tiền mua sẽ tiếp tục được giữ lại để chờ yêu cầu giao dịch tiếp theo từ khách hàng.  \nTrong trường hợp Nhà Đầu Tư có nhiều lệnh mua Chứng Chỉ Quỹ cùng một lúc, Lệnh Mua Chứng Chỉ Quỹ sẽ được ưu tiên theo thứ tự đặt lệnh.  \nPhí/giá dịch vụ chuyển tiền (nếu có) được trừ vào số tiền hoàn trả cho Nhà Đầu Tư. Đơn Vị Quỹ sẽ chỉ được ghi nhận vào tài khoản của Nhà Đầu Tư hay của Đại Lý Ký Danh sau khi có kết quả giao dịch chứng chỉ quỹ.', 'Trong các trường hợp tạm dừng thực hiện các giao dịch Đơn Vị Quỹ, Lệnh Chuyển Đổi đã nhận sẽ được thực hiện tại NAV tại Ngày Giao Dịch đầu tiên sau khi giao dịch được thực hiện trở lại.  \n**g. Quy trình chuyển nhượng chứng chỉ quỹ**  \n- **Đơn Chuyển Nhượng**  \nNhà Đầu Tư có thể Chuyển Nhượng Đơn Vị Quỹ cho nhà đầu tư khác dưới dạng quà tặng, thừa kế hoặc thực hiện lệnh của toà án. Chuyển Nhượng chỉ được thực hiện dưới dạng số lượng Đơn  \n55', '## 2.5.3. Thông tin về các mức giá dịch vụ\nCác loại phí/dịch vụ và chi phí/giá dịch vụ liên quan trực tiếp đến việc giao dịch Đơn Vị Quỹ sẽ do Nhà Đầu Tư trả và không được tính vào chi phí của Quỹ. Công Ty Quản Lý Quỹ bảo lưu quyền thay đổi biểu phí/giá dịch vụ này.  \nCác khoản giá dịch vụ giao dịch như sau:', '## 3. Giá dịch vụ và thưởng hoạt động\nCác loại phí/dịch vụ và chi phí/giá dịch vụ liên quan trực tiếp đến việc giao dịch Đơn Vị Quỹ sẽ do Nhà Đầu Tư trả và không được tính vào chi phí của Quỹ. Công Ty Quản Lý Quỹ bảo lưu quyền thay đổi biểu phí/giá dịch vụ này.  \nCác khoản giá dịch vụ giao dịch như sau:', '## 2.4.6. Quy trình chuyển đổi quỹ\nNhà Đầu Tư có thể chuyển đổi sang Quỹ khác do Công Ty Quản Lý Quỹ quản lý bằng Lệnh Chuyển Đổi. Phiếu Lệnh Chuyển Đổi được đính kèm theo Đơn Đăng Ký, hoặc có tại Điểm Nhận Lệnh. Đối với Lệnh Chuyển Đổi, toàn bộ tiền bán Đơn Vị Quỹ của Quỹ này sau khi trừ phí và thuế (nếu có), sẽ dùng để mua Đơn Vị Quỹ của Quỹ khác.  \nViệc chuyển đổi Quỹ bằng việc bán một Quỹ và mua một Quỹ khác tại ngày giao dịch tương ứng được coi như thực hiện một lệnh bán. Giá dịch vụ Chuyển Đổi Quỹ do đó được áp dụng một lần trên giá trị giao dịch bán và Giá dịch vụ Chuyển Đổi Quỹ được TCC ấn định và công bố bằng văn bản thông báo tại từng thời kỳ nhưng không quá ba phần trăm (3%) giá trị mua lại.', 'Vị Quỹ, bao gồm cả phần lẻ của Đơn Vị Quỹ. Nhà Đầu Tư chuyển nhượng cần điền Lệnh Chuyển Nhượng Đơn Vị Quỹ với điều kiện là số lượng Chuyển Nhượng phải bằng hoặc lớn hơn số dư tối thiểu khi mở tài khoản nếu người nhận chuyển nhượng chưa phải là Nhà Đầu Tư.  \n- **Xử Lý Các Đơn Chuyển Nhượng**', '|  Từ trên 9 đến tròn 12 tháng | 0,50%  |\n|  Từ trên 12 tháng trở lên | 0,00%  |  \nTrường hợp Nhà Đầu Tư mua Chứng Chỉ Quỹ nhiều lần, mua theo Chương Trình ĐTĐK hoặc dưới hình thức tái đầu tư bằng nguồn cổ tức của Quỹ không phải chịu Giá dịch vụ phát hành, ưu tiên bán được thực hiện theo nguyên tắc các Chứng Chỉ Quỹ mua trước sẽ được bán trước, không phân biệt chứng chỉ quỹ mua theo lệnh mua bình thường hay Chương Trình ĐTĐK hay hình thức tái đầu tư bằng nguồn cổ tức.  \nCông Ty Quản Lý Quỹ có quyền thay đổi Giá dịch vụ Mua lại nhưng không được vượt quá mức quy định của pháp luật. Mức Giá dịch vụ Mua lại mới sẽ được Công Ty Quản Lý Quỹ thông báo chi tiết tại trang thông tin điện tử của Quỹ và tại các địa điểm phân phối của các Đại Lý Phân Phối.', '## 2.4.7. Quy trình chuyển nhượng chứng chỉ quỹ\nNhà Đầu Tư có thể Chuyển Nhượng Đơn Vị Quỹ cho nhà đầu tư khác dưới dạng quà tặng, thừa kế hoặc thực hiện lệnh của toà án. Chuyển Nhượng chỉ được thực hiện dưới dạng số lượng Đơn Vị Quỹ, bao gồm cả phần lẻ của Đơn Vị Quỹ. Nhà Đầu Tư chuyển nhượng cần điền Lệnh Chuyển Nhượng Đơn Vị Quỹ với điều kiện là số lượng Chuyển Nhượng phải bằng hoặc lớn hơn số dư tối thiểu khi mở tài khoản nếu người nhận chuyển nhượng chưa phải là Nhà Đầu Tư.', 'Mức giá dịch vụ chuyển đổi của Quỹ như sau:  \n|  Thời gian nắm giữ CCQ | Giá dịch vụ chuyển đổi (% giá trị lệnh bán)  |\n| --- | --- |\n|  0 đến dưới 6 tháng | 1,00%  |\n|  Từ tròn 6 đến tròn 9 tháng | 0,75%  |\n|  Từ trên 9 đến tròn 12 tháng | 0,50%  |\n|  Từ trên 12 tháng trở lên | 0,00%  |  \nKhi thực hiện chuyển đổi, Nhà Đầu Tư chỉ thanh toán Giá dịch vụ Chuyển Đổi trên giá trị đăng ký chuyển đổi, mà không phải thanh toán Giá dịch vụ Mua Lại đối với Quỹ hiện tại và Giá dịch vụ Phát Hành đối với Quỹ mục tiêu.  \nCác khoản thuế giao dịch, giá dịch vụ chuyển tiền ngân hàng, nếu có, sẽ được khấu trừ vào số tiền thu được từ Lệnh Bản trong Lệnh Chuyển Đổi. Thời gian nắm giữ Đơn Vị Quỹ của Quỹ mục tiêu sẽ được tính từ ngày Lệnh Chuyển Đổi Quỹ được thực hiện.', '- **Xử Lý Các Đơn Chuyển Nhượng**  \nNhà Đầu Tư muốn thực hiện Chuyển Nhượng hoặc người thừa hưởng thừa kế trong trường hợp thừa kế có thể nộp Lệnh Chuyển Nhượng tại bất kỳ Điểm Nhận Lệnh nào. Lệnh Chuyển Nhượng được kèm theo các tài liệu hỗ trợ theo quy định của Công Ty Quản Lý Quỹ tại các Điểm Nhận Lệnh. Nếu người nhận chuyển nhượng chưa phải là Nhà Đầu Tư, người nhận chuyển nhượng Đơn Vị Quỹ sẽ phải nộp thêm các giấy tờ khác như quy định cho người mua Đơn Vị Quỹ lần đầu và trong trường hợp thừa kế, người thừa kế sẽ phải nộp các giấy tờ chứng minh quyền sở hữu.  \n- **Tuân thủ**  \nĐể tuân thủ các quy định về KYC và AML, người nhận chuyển nhượng Đơn Vị Quỹ sẽ phải tuân theo các thủ tục như khi mở tài khoản mới quy định chi tiết tại mục 2.4.4.  \n- **Xác Nhận Lệnh Chuyển Nhượng**', '|  Từ tròn 6 đến tròn 9 tháng | 0,75%  |\n| --- | --- |\n|  Từ trên 9 đến tròn 12 tháng | 0,50%  |\n|  Từ trên 12 tháng trở lên | 0,00%  |  \nTrường hợp Nhà Đầu Tư mua Chứng Chỉ Quỹ nhiều lần, mua theo Chương Trình ĐTĐK hoặc dưới hình thức tái đầu tư bằng nguồn cổ tức của Quỹ không phải chịu Giá dịch vụ phát hành, ưu tiên bán được thực hiện theo nguyên tắc các Chứng Chỉ Quỹ mua trước sẽ được bán trước, không phân biệt chứng chỉ quỹ mua theo lệnh mua bình thường hay Chương Trình ĐTĐK hay hình thức tái đầu tư bằng nguồn cổ tức.', '## c) Giá dịch vụ Chuyển Đổi Quỹ\nGiá dịch vụ Chuyển Đổi là giá dịch vụ mà Nhà Đầu Tư phải trả khi thực hiện chuyển đổi đầu tư giữa các Quỹ mở do Công Ty Quản Lý Quỹ quản lý. Việc chuyển đổi Quỹ bằng việc bán một Quỹ và mua một Quỹ khác tại ngày giao dịch tương ứng được coi như thực hiện một lệnh bán. Giá dịch vụ Chuyển Đổi Quỹ do đó được áp dụng một lần trên giá trị chuyển đổi với mức giá dịch vụ được TCC ấn định và công bố bằng văn bản thông báo tại từng thời kỳ nhưng không quá 3,0% (ba phần trăm) giá trị thực hiện chuyển đổi. Thời điểm áp dụng mức giá dịch vụ mới tăng sớm nhất là 60 ngày kể từ ngày Công ty Quản Lý Quỹ công bố về mức giá dịch vụ mới trên trang thông tin điện tử của Công ty.', '## c) Giá dịch vụ Chuyển Đổi Quỹ\nGiá dịch vụ Chuyển Đổi là giá dịch vụ mà Nhà Đầu Tư phải trả khi thực hiện chuyển đổi đầu tư giữa các Quỹ mở do Công Ty Quản Lý Quỹ quản lý. Việc chuyển đổi Quỹ bằng việc bán một Quỹ và mua một Quỹ khác tại ngày giao dịch tương ứng được coi như thực hiện một lệnh bán. Giá dịch vụ Chuyển Đổi Quỹ do đó được áp dụng một lần trên giá trị chuyển đổi với mức giá dịch vụ được TCC ấn định và công bố bằng văn bản thông báo tại từng thời kỳ nhưng không quá 3,0% (ba phần trăm) giá trị thực hiện chuyển đổi. Thời điểm áp dụng mức giá dịch vụ mới tăng sớm nhất là 60 ngày kể từ ngày Công ty Quản Lý Quỹ công bố về mức giá dịch vụ mới trên trang thông tin điện tử của Công ty.', 'Nhà Đầu Tư có thể thanh toán số tiền mua Đơn Vị Quỹ từ tài khoản ngân hàng của mình vào tài khoản của Quỹ để Ngân Hàng Giám Sát nhận được đúng hạn và Đại Lý Phân Phối hoàn thành xử lý việc đăng ký với Đại Lý Chuyển Nhượng. Mọi khoản đầu tư vào Đơn Vị Quỹ đều thực hiện bằng tiền Đồng Việt Nam.  \nTrong trường hợp lệnh mua chứng chỉ quỹ và việc thanh toán cho lệnh mua được thực hiện bởi cá nhân, tổ chức khác không phải nhà đầu tư thì phiếu lệnh và tài liệu xác nhận thanh toán phải nêu rõ tên, số tài khoản và giá trị thanh toán của nhà đầu tư được hưởng lợi.', '|  Từ trên 12 tháng trở lên | 0,00%  |\n| --- | --- |  \nGiá dịch vụ Chuyển Đổi Quỹ sẽ được hạch toán cho Công Ty Quản Lý Quỹ và Đại Lý Phân Phối căn cứ theo hợp đồng ký giữa Công Ty Quản Lý Quỹ và Đại Lý Phân Phối.', 'Nhà Đầu Tư có thể thanh toán số tiền mua Đơn Vị Quỹ bằng cách chuyển khoản từ tài khoản ngân hàng của mình hoặc nộp tiền trực tiếp vào tài khoản của Quỹ để Ngân Hàng Giám Sát nhận được đúng hạn và Đại Lý Phân Phối hoàn thành xử lý việc đăng ký với Đại Lý Chuyển Nhượng. Mọi khoản đầu tư vào Đơn Vị Quỹ đều thực hiện bằng tiền Đồng Việt Nam.  \nTrong trường hợp lệnh mua chứng chỉ quỹ và việc thanh toán cho lệnh mua được thực hiện bởi cá nhân, tổ chức khác không phải nhà đầu tư thì phiếu lệnh và tài liệu xác nhận thanh toán phải nêu rõ tên, số tài khoản và giá trị thanh toán của nhà đầu tư được hưởng lợi.  \n- **Tuân Thủ**', '## 3. Giá dịch vụ và thưởng hoạt động\nNhà Đầu Tư được khuyến khích nắm giữ các Đơn Vị Quỹ như một phần của các khoản đầu tư dài hạn và chương trình tiết kiệm hưu trí. Quỹ mở không được thiết kế cho mục đích mua bán ngắn hạn. Việc Nhà Đầu Tư thường xuyên mua đi và bán lại Đơn Vị Quỹ, vốn được thiết kế để đạt được lợi nhuận dài hạn sẽ ảnh hưởng đến mục tiêu lợi nhuận của Nhà Đầu Tư khi đầu tư vào Quỹ cũng như lợi nhuận của Quỹ.  \nGiá dịch vụ Mua lại và các khoản giá dịch vụ ngân hàng và thuế khác (nếu có) sẽ được trừ vào khoản tiền thu được từ bán Đơn Vị Quỹ của Nhà Đầu Tư.', 'Việc chuyển đổi Quỹ bằng việc bán một Quỹ và mua một Quỹ khác tại ngày giao dịch tương ứng được coi như thực hiện một lệnh bán. Giá dịch vụ Chuyển Đổi Quỹ do đó được áp dụng một lần trên giá trị giao dịch bán và Giá dịch vụ Chuyển Đổi Quỹ được TCC ấn định và công bố bằng văn bản thông báo tại từng thời kỳ nhưng không quá ba phần trăm (3%) giá trị mua lại.  \n- **Xử lý các Lệnh Chuyển Đổi**  \nLệnh Chuyển Đổi được xử lý bởi Đại Lý Chuyển Nhượng như là Lệnh Bản và tiếp theo sau là Lệnh Mua được thực hiện tại Ngày Giao Dịch tương ứng.  \nLệnh Bản và Lệnh Mua được xử lý bởi Đại Lý Chuyển Nhượng theo quy trình mô tả ở trên với Lệnh Bản được thực hiện trước, Lệnh Mua được xử lý sau.  \nLệnh Chuyển Đổi được đặt bằng số lượng Đơn Vị Quỹ.  \n- **Mức Tối Thiểu Cho Lệnh Chuyển Đổi**', '- Việc thực hiện tất cả các lệnh giao dịch của Nhà Đầu Tư tại Ngày Giao Dịch dẫn đến NAV của Quỹ thấp hơn 50.000.000.000 đồng (năm mươi tỷ đồng); hoặc Giá trị phần đơn vị quỹ hoặc số đơn vị quỹ còn lại trên tài khoản của nhà đầu tư thấp hơn giá trị tối thiểu hoặc số lượng đơn vị quỹ tối thiểu để duy trì tài khoản của nhà đầu tư theo quy định tại Điều lệ quỹ và Bán cáo bạch.\n- Trường hợp thực hiện một phần Lệnh Bán, Lệnh mua, Lệnh Chuyến Đổi Quỹ theo quy định nêu trên, Công ty Quản Lý Quỹ áp dụng nguyên tắc phân phối cùng tỷ lệ: Phần giá trị được thực hiện sẽ được phân bổ cho tất cả nhà đầu tư đăng ký giao dịch theo cùng một tỷ lệ giữa giá trị thực hiện và giá trị đăng ký giao dịch.  \nSố lượng chứng chỉ quỹ được thực hiện trong trường hợp này được tính như sau:', '## e) Thực Hiện Một Phần Lệnh Bán\nTrong các trường hợp sau, Quỹ chỉ có thể thực hiện một phần Lệnh Bán và Chuyến Đổi Quỹ của Nhà Đầu Tư:  \n- Tổng giá trị của các Lệnh Bán (bao gồm cả Lệnh Bán từ hoạt động Chuyến Đổi Quỹ) trừ đi tổng giá trị của tất cả các Lệnh Mua (bao gồm cả Lệnh Mua từ hoạt động Chuyến Đổi Quỹ) tại Ngày Giao Dịch lớn hơn 10% của giá trị tài sản ròng của Quỹ (NAV); hoặc\n- Việc thực hiện tất cả các lệnh giao dịch của Nhà Đầu Tư tại Ngày Giao Dịch dẫn đến NAV của Quỹ thấp hơn 50.000.000.000 đồng (năm mươi tỷ đồng); hoặc Giá trị phần đơn vị quỹ hoặc số đơn vị quỹ còn lại trên tài khoản của nhà đầu tư thấp hơn giá trị tối thiểu hoặc số lượng đơn vị quỹ tối thiểu để duy trì tài khoản của nhà đầu tư theo quy định tại Điều lệ quỹ và Bán cáo bạch.', '## f) Lệnh Mua Tối Thiểu\nMức đầu tư tối thiểu (tính theo giá trị Lệnh Mua) là 10.000 VND (Mười nghìn đồng)  \nKhông có mức giới hạn đầu tư tối đa cho Nhà Đầu Tư. Công Ty Quản Lý Quỹ bảo lưu quyền thay đổi các giới hạn đầu tư trên trong từng thời điểm và sẽ thông báo về các thay đổi này.']",Giá dịch vụ Chuyển Nhượng là 300.000 đồng cho mỗi giao dịch.
Phí dịch vụ giám sát và phí lưu ký mà Quỹ phải trả cho Ngân hàng giám sát là bao nhiêu?,"Phí dịch vụ giám sát và phí lưu ký mà Quỹ phải trả cho Ngân hàng giám sát được quy định như sau:

1. **Phí Dịch Vụ Giám Sát:**
   - Phí dịch vụ giám sát được tính dựa trên tỷ lệ 0,25% của Giá trị tài sản ròng (NAV) hàng năm.
   - Được thanh toán hàng tháng cho Ngân hàng giám sát.

2. **Phí Lưu Ký:**
   - Phí lưu ký được tính dựa trên tỷ lệ 0,15% của Giá trị tài sản ròng (NAV) hàng năm.
   - Cũng được thanh toán hàng tháng cho Ngân hàng lưu ký.

**Thông tin này được lấy từ Trang 36 và Trang 42 của Điều lệ Quỹ.**

Nếu bạn cần thông tin chi tiết hơn hoặc có thêm câu hỏi, vui lòng chỉ rõ!","['## 3.2 Giá dịch vụ mà Quỹ phải trả\nGiá dịch vụ giám sát được trả cho Ngân Hàng Giám Sát để cung cấp dịch vụ Ngân Hàng Giám Sát cho Quỹ. Giá dịch vụ được tính vào mỗi kỳ định giá dựa trên NAV tại ngày trước Ngày Định Giá và được trả hàng tháng. Số tiền trả dịch vụ hàng tháng là tổng số được tính (trích lập) cho các kỳ định giá thực hiện trong tháng.', '## b. Giá dịch vụ giám sát\nGiá dịch vụ giám sát được trả cho Ngân Hàng Giám Sát để cung cấp dịch vụ Ngân Hàng Giám Sát cho Quỹ. Giá dịch vụ được tính vào mỗi kỳ định giá dựa trên NAV tại ngày trước Ngày Định Giá và được trả hàng tháng. Số tiền trả dịch vụ hàng tháng là tổng số được tính (trích lập) cho các kỳ định giá thực hiện trong tháng.  \nCông thức tính giá dịch vụ giám sát vào mỗi kỳ định giá được xác định như sau:  \nGiá dịch vụ giám sát cho kỳ định giá = Tỷ lệ giá dịch vụ giám sát (năm) x NAV tại ngày trước ngày định giá x số ngày theo lịch thực tế của chu kỳ định giá / số ngày thực tế của năm (365 hoặc 366).  \n|  Loại Giá dịch vụ | Mức giá dịch vụ | Tối thiểu/tối đa | Ghi chú  |\n| --- | --- |\n|  Giá dịch vụ giám sát | 0,02%*NAV/Năm | Tối thiểu: 5.000.000 đồng /tháng | Thuế VAT 10%  |', '## c) Giá dịch vụ Lưu Ký\nGiá dịch vụ lưu ký được trả cho Ngân Hàng Lưu ký để cung cấp dịch vụ Ngân Hàng Lưu ký cho Quỹ. Giá dịch vụ được tính vào mỗi kỳ định giá dựa trên NAV tại ngày trước Ngày Định Giá và được trả hàng tháng. Số tiền trả dịch vụ hàng tháng là tổng số được tính (trích lập) cho các kỳ định giá thực hiện trong tháng.  \nCông thức tính giá dịch vụ lưu ký vào mỗi kỳ định giá được xác định như sau:  \nGiá dịch vụ lưu ký cho kỳ định giá = Tỷ lệ giá dịch vụ lưu ký (năm) x NAV tại ngày trước ngày định giá x số ngày theo lịch thực tế của chu kỳ định giá / số ngày thực tế của năm (365 hoặc 366).  \n|  Loại Giá dịch vụ | Mức giá dịch vụ | Tối thiểu/tối đa | Ghi chú  |\n| --- | --- |\n|  Giá dịch vụ lưu ký | 0,06%*NAV/Năm | Tối thiểu: 20.000.000 đồng /tháng |   |', '## c. Giá dịch vụ Lưu ký\nGiá dịch vụ lưu ký được trả cho Ngân Hàng Lưu ký để cung cấp dịch vụ Ngân Hàng Lưu ký cho Quỹ. Giá dịch vụ được tính vào mỗi kỳ định giá dựa trên NAV tại ngày trước Ngày Định Giá và được trả hàng tháng. Số tiền trả dịch vụ hàng tháng là tổng số được tính (trích lập) cho các kỳ định giá thực hiện trong tháng.  \nCông thức tính giá dịch vụ lưu ký vào mỗi kỳ định giá được xác định như sau:  \nGiá dịch vụ lưu ký cho kỳ định giá = Tỷ lệ giá dịch vụ lưu ký (năm) x NAV tại ngày trước ngày định giá x số ngày theo lịch thực tế của chu kỳ định giá / số ngày thực tế của năm (365 hoặc 366).  \n|  Loại Giá dịch vụ | Mức giá dịch vụ | Tối thiểu/tối đa | Ghi chú  |\n| --- | --- |\n|  Giá dịch vụ lưu ký | 0,06%*NAV/Năm | Tối thiểu: 20.000.000 đồng /tháng |   |', 'Công thức tính giá dịch vụ giám sát vào mỗi kỳ định giá được xác định như sau:  \nGiá dịch vụ giám sát cho kỳ định giá = Tỷ lệ giá dịch vụ giám sát (năm) x NAV tại ngày trước ngày định giá x số ngày theo lịch thực tế của chu kỳ định giá / số ngày thực tế của năm (365 hoặc 366).  \n|  Loại Giá dịch vụ | Mức giá dịch vụ | Tối thiểu/tối đa | Ghi chú  |\n| --- | --- |\n|  Giá dịch vụ giám sát | 0,02%*NAV/Năm | Tối thiểu: 5.000.000 đồng /tháng | Thuế VAT 10%  |', '## 2.5.3. Thông tin về các mức giá dịch vụ\nCác loại phí/dịch vụ và chi phí/giá dịch vụ liên quan trực tiếp đến việc giao dịch Đơn Vị Quỹ sẽ do Nhà Đầu Tư trả và không được tính vào chi phí của Quỹ. Công Ty Quản Lý Quỹ bảo lưu quyền thay đổi biểu phí/giá dịch vụ này.  \nCác khoản giá dịch vụ giao dịch như sau:', '## 3. Giá dịch vụ và thưởng hoạt động\nCác loại phí/dịch vụ và chi phí/giá dịch vụ liên quan trực tiếp đến việc giao dịch Đơn Vị Quỹ sẽ do Nhà Đầu Tư trả và không được tính vào chi phí của Quỹ. Công Ty Quản Lý Quỹ bảo lưu quyền thay đổi biểu phí/giá dịch vụ này.  \nCác khoản giá dịch vụ giao dịch như sau:', '## 2.11. Tiêu chí lựa chọn, quyền hạn và trách nhiệm của Ngân hàng giám sát\nNgân Hàng Giám Sát được lựa chọn phải đáp ứng các điều kiện sau:  \n- Ngân hàng giám sát do Công ty quản lý quỹ lựa chọn phải đáp ứng các điều kiện quy định tại Khoản 1 Điều 116 Luật Chứng khoán;\n- Ngân hàng giám sát phải hoàn toàn độc lập và tách biệt với công ty quản lý quỹ mà ngân hàng cung cấp dịch vụ giám sát;\n- Ngân hàng giám sát, thành viên Hội đồng quản trị, người điều hành và nhân viên của ngân hàng giám sát làm nhiệm vụ giám sát hoạt động và bảo quản tài sản của quỹ đại chúng, công ty đầu tư chứng khoán không được là người có liên quan hoặc có quan hệ sở hữu, vay hoặc cho vay với công ty quản lý quỹ, công ty đầu tư chứng khoán và', '## d) Giá dịch vụ Quản Trị Quỹ\nGiá dịch vụ Quản trị quỹ sẽ là 0,03% NAV/năm và thấp nhất là 15.000.000 đồng/ tháng (chưa bao gồm thuế VAT)  \nCông thức tính giá dịch vụ quản trị quỹ vào mỗi kỳ định giá được xác định như sau:  \nGiá dịch vụ quản trị quỹ cho kỳ định giá = Tỷ lệ giá dịch vụ quản trị quỹ (năm) x NAV tại ngày trước ngày định giá x số ngày theo lịch thực tế của chu kỳ định giá / số ngày thực tế của năm (365 hoặc 366).', '## 3.2 Giá dịch vụ mà Quỹ phải trả\nGiá dịch vụ Quản Lý tối đa là 1,2% * NAV/năm.  \nĐại Hội Nhà Đầu Tư có thể ủy quyền cho Ban Đại Diện Quỹ quyết định điều chỉnh mức Giá dịch vụ Quản lý trong mức tối đa nêu trên nếu được Đại Hội Nhà Đầu Tư thông qua việc ủy quyền này trong Đại hội hàng năm gần nhất. Hiệu lực của việc điều chỉnh Giá dịch vụ Quản Lý sau khi Ban Đại Diện Quỹ phê duyệt sẽ được Công ty quản lý Quỹ công bố trên trang website. Trường hợp thay đổi Giá dịch vụ Quản lý dẫn đến giá dịch vụ vượt quá mức tối đa nêu trên sẽ phải được Đại Hội Nhà Đầu Tư phê duyệt.  \nTrong mọi trường hợp, tổng giá dịch vụ Quản lý Quỹ, giá dịch vụ Quản trị Quỹ và giá dịch vụ đại lý chuyển nhượng sẽ không vượt quá quy định của Pháp luật (2% NAV/năm).', 'a. Giá dịch vụ Lưu Ký xử lý hồ sơ  \n|  Loại Giá dịch vụ | Mức giá dịch vụ | Tối thiểu/tối đa | Ghi chú  |\n| --- | --- |\n|  Giá dịch vụ lưu ký xử lý hồ sơ  |   |   |   |\n|  Đối với giao dịch cổ phiếu niêm yết/đăng ký giao dịch | 0,03% * giá trị giao dịch | Tối thiểu 100.000 đồng/ngày giao dịch, Tối đa 10.000.000 đồng/ngày giao dịch |   |\n|  Đối với giao dịch trái phiếu niêm yết/đăng ký giao dịch | 0,01% * giá trị giao dịch |   |   |\n|  Đối với các giao dịch mua bán CK OTC và các tài sản khác | 100.000 đồng/giao dịch |  |   |  \nb. Giá dịch vụ Quản Trị Quỹ  \nGiá dịch vụ Quản trị quỹ sẽ là 0,03% NAV/năm và thấp nhất là 15.000.000 đồng/ tháng (chưa bao gồm thuế VAT)  \nCông thức tính giá dịch vụ quản trị quỹ vào mỗi kỳ định giá được xác định như sau:', '## 2.6. Giá dịch vụ mà Quỹ phải trả\nChỉ có các loại phí/dịch vụ và các chi phí/giá dịch vụ liên quan trực tiếp hoặc đóng góp vào các hoạt động và điều hành của Quỹ mới được tính vào chi phí/giá dịch vụ hoạt động của Quỹ. Xin lưu ý các phí/giá dịch vụ dưới đây là các mức đang áp dụng và các phí/giá dịch vụ này có thể sẽ thay đổi trong tương lai. Các chi phí/dịch vụ này bao gồm:', '## 3.2 Giá dịch vụ mà Quỹ phải trả\nChỉ có các loại phí/dịch vụ và các chi phí/giá dịch vụ liên quan trực tiếp hoặc đóng góp vào các hoạt động và điều hành của Quỹ mới được tính vào chi phí/giá dịch vụ hoạt động của Quỹ. Xin lưu ý các phí/giá dịch vụ dưới đây là các mức đang áp dụng và các phí/giá dịch vụ này có thể sẽ thay đổi trong tương lai. Các chi phí/dịch vụ này bao gồm:', 'Giá dịch vụ Quản Lý tối đa là 1,2%*NAV/năm.  \nĐại Hội Nhà Đầu Tư có thể ủy quyền cho Ban Đại Diện Quỹ quyết định điều chỉnh mức Giá dịch vụ Quản lý trong mức tối đa nêu trên nếu được Đại Hội Nhà Đầu Tư thông qua việc ủy quyền này trong Đại hội hàng năm gần nhất. Hiệu lực của việc điều chỉnh Giá dịch vụ Quản Lý sau khi Ban Đại Diện Quỹ phê duyệt sẽ được Công ty quản lý Quỹ công bố trên trang website. Trường hợp thay đổi Giá dịch vụ Quản lý dẫn đến giá dịch vụ vượt quá mức tối đa nêu trên sẽ phải được Đại Hội Nhà Đầu Tư phê duyệt.  \nTrong mọi trường hợp, tổng giá dịch vụ Quản lý Quỹ, giá dịch vụ Quản trị Quỹ và giá dịch vụ đại lý chuyển nhượng sẽ không vượt quá quy định của Pháp luật (2% NAV/năm).', '## h) Chi Phí Khác\n- Giá dịch vụ môi giới cho các giao dịch của quỹ;\n- Chi phí in ấn, ví dụ in các tài liệu cho Nhà Đầu Tư theo quy định Pháp Luật;\n- Giá dịch vụ định giá độc lập cho các khoản đầu tư cụ thể của Quỹ (chỉ khi cần thiết), ví dụ như định giá các khoản chứng khoán chưa niêm yết;\n- Chi phí phát sinh cho bất kỳ Đại Hội Nhà Đầu Tư hay cuộc họp nào của Ban Đại Diện Quỹ;\n- Phí/giá dịch vụ pháp lý liên quan đến hoạt động và các giao dịch của Quỹ và các loại phí/chi phí/dịch vụ khác theo Luật cho phép;\n- Thuế và các loại phí/dịch vụ bắt buộc của chính phủ áp dụng cho Quỹ; và\n- Các chi phí khác được Pháp Luật cho phép.', '## d) Giá dịch vụ Chuyển Nhượng\nNhà Đầu Tư phải trả một mức Giá dịch vụ Chuyển Nhượng duy nhất là 300.000 đồng (ba trăm nghìn đồng) cho mỗi giao dịch chuyển nhượng Đơn Vị Quỹ. Giá dịch vụ Chuyển Nhượng do người thực hiện chuyển nhượng thanh toán.  \nGiá dịch vụ Chuyển Nhượng sẽ không áp dụng trong trường hợp Nhà Đầu Tư thực hiện chuyển nhượng số Chứng Chí Quỹ từ tài khoản này sang tài khoản khác cùng đứng tên Nhà Đầu Tư tại hai Đại Lý Phân Phối khác nhau.  \nGiá dịch vụ Chuyển Nhượng sẽ được hạch toán cho Công Ty Quản Lý Quỹ và Đại Lý Phân Phối căn cứ theo hợp đồng ký giữa Công Ty Quản Lý Quỹ và Đại Lý Phân Phối.', '## d) Giá dịch vụ Chuyển Nhượng\nNhà Đầu Tư phải trả một mức Giá dịch vụ Chuyển Nhượng duy nhất là 300.000 đồng (ba trăm nghìn đồng) cho mỗi giao dịch chuyển nhượng Đơn Vị Quỹ. Giá dịch vụ Chuyển Nhượng do người thực hiện chuyển nhượng thanh toán.  \nGiá dịch vụ Chuyển Nhượng sẽ không áp dụng trong trường hợp Nhà Đầu Tư thực hiện chuyển nhượng số Chứng Chỉ Quỹ từ tài khoản này sang tài khoản khác cùng đứng tên Nhà Đầu Tư tại hai Đại Lý Phân Phối khác nhau.  \nGiá dịch vụ Chuyển Nhượng sẽ được hạch toán cho Công Ty Quản Lý Quỹ và Đại Lý Phân Phối căn cứ theo hợp đồng ký giữa Công Ty Quản Lý Quỹ và Đại Lý Phân Phối.', '## 3.2 Giá dịch vụ mà Quỹ phải trả\nGiá dịch vụ quản lý được tính vào mỗi kỳ định giá dựa trên NAV tại ngày trước ngày định giá và được thanh toán hàng tháng cho Công ty Quản Lý Quỹ. Số giá dịch vụ trả hàng tháng là tổng số giá dịch vụ được tính (trích lập) cho các kỳ định giá thực hiện trong tháng.  \nCông thức tính giá dịch vụ quản lý quỹ vào mỗi kỳ định giá được xác định như sau:  \nGiá dịch vụ quản lý quỹ cho kỳ định giá = Tỷ lệ giá dịch vụ quản lý (năm) x NAV tại ngày trước ngày định giá x số ngày theo lịch thực tế của chu kỳ định giá / số ngày thực tế của năm (365 hoặc 366).  \nGiá dịch vụ Quản Lý tối đa là 1,2% * NAV/năm.', '## g) Phụ Cấp Ban Đại Diện Quỹ\nCác chi phí của Ban Đại Diện Quỹ bao gồm chi phí ăn ở, đi lại với mức hợp lý và phù hợp với các quy định tại Điều lệ Quỹ, các chi phí phát sinh từ hoạt động của Ban Đại Diện Quỹ để phục vụ cho lợi ích của Quỹ sẽ được tính vào chi phí của Quỹ. Để dễ hiểu, chi phí trên không bao gồm các chi phí bảo hiểm đối với trách nhiệm phát sinh cho Ban Đại Diện Quỹ khi thực hiện nghĩa vụ của Ban Đại Diện Quỹ. Thủ lao của các thành viên của Ban Đại Diện Quỹ được tính vào chi phí hoạt động của Quỹ và tổng mức thủ lao không được vượt quá tổng ngân sách hoạt động hàng năm của Ban Đại Diện đã được thông qua tại Đại Hội Nhà Đầu Tư.', 'd. Chi phí Kiểm Toán  \nPhí Kiểm Toán phụ thuộc vào kết quả lựa chọn và thương lượng với Công Ty Kiểm Toán và sẽ được xác định hàng năm vào cuối năm tài chính của Quỹ.  \ne. Phụ Cấp Ban Đại Diện Quỹ', 'Công thức tính giá dịch vụ quản trị quỹ vào mỗi kỳ định giá được xác định như sau:  \nGiá dịch vụ quản trị quỹ cho kỳ định giá = Tỷ lệ giá dịch vụ quản trị quỹ (năm) x NAV tại ngày trước ngày định giá x số ngày theo lịch thực tế của chu kỳ định giá / số ngày thực tế của năm (365 hoặc 366).  \nc. Giá dịch vụ Đại Lý Chuyển Nhượng  \nGiá dịch vụ Đại lý chuyển nhượng được tính toán và cộng đồng theo kỳ định giá và được thanh toán định kỳ theo thỏa thuận với Đại lý chuyển nhượng. Giá dịch vụ Đại lý chuyển nhượng được thống nhất với Đại lý chuyển nhượng phù hợp với quy định của pháp luật và có thể được điều chỉnh theo thỏa thuận với Đại lý chuyển nhượng.  \nd. Chi phí Kiểm Toán', 'ngược lại;  \n- Ngân hàng giám sát, thành viên Hội đồng quản trị, người điều hành và nhân viên của ngân hàng giám sát làm nhiệm vụ giám sát hoạt động và bảo quản tài sản của quỹ đại chúng, công ty đầu tư chứng khoán không được là đối tác mua, bán trong giao dịch mua, bán tài sản của quỹ đại chúng, công ty đầu tư chứng khoán.\n- Có đầy đủ năng lực cung cấp dịch vụ giám sát, lưu ký;\n- Thực hiện các cam kết đối với Quỹ như nêu tại Phụ lục 2 và Phụ lục 3 của Điều lệ Quỹ.  \nCác quy định về quyền và nghĩa vụ, hoạt động giám sát và chấm dứt quyền và nghĩa vụ của Ngân hàng giám sát tuân thủ theo quy định tại chương VII Điều lệ Quỹ.', '## 2.6. Giá dịch vụ mà Quỹ phải trả\nGiá dịch vụ quản lý được tính vào mỗi kỳ định giá dựa trên NAV tại ngày trước ngày định giá và được thanh toán hàng tháng cho Công ty Quản Lý Quỹ. Số giá dịch vụ trả hàng tháng là tổng số giá dịch vụ được tính (trích lập) cho các kỳ định giá thực hiện trong tháng.  \nCông thức tính giá dịch vụ quản lý quỹ vào mỗi kỳ định giá được xác định như sau:  \nGiá dịch vụ quản lý quỹ cho kỳ định giá = Tỷ lệ giá dịch vụ quản lý (năm) x NAV tại ngày trước ngày định giá x số ngày theo lịch thực tế của chu kỳ định giá / số ngày thực tế của năm (365 hoặc 366).  \n36', 'Giá dịch vụ Chuyển Đổi Quỹ sẽ được hạch toán cho Công Ty Quản Lý Quỹ và Đại Lý Phân Phối căn cứ theo hợp đồng ký giữa Công Ty Quản Lý Quỹ và Đại Lý Phân Phối.', '## 2.5.2. Hình thức công bố thông tin về giá các giao dịch, nơi công bố thông tin, tần suất công bố thông tin\nGiá trị tài sản ròng của Quỹ và Giá trị tài sản ròng trên một Đơn Vị Quỹ phải được Ngân Hàng Giám Sát xác nhận và sẽ được công bố tại Trụ sở chính của Công Ty Quản Lý Quỹ, và trên các trang web hoặc các phương tiện truyền thông khác theo yêu cầu của Luật vào ngày làm việc tiếp theo của Ngày Định Giá với điều kiện các trang điện tử này hoạt động bình thường. Trong thời hạn 24 giờ kể từ khi phát hiện giá trị tài sản ròng bị định giá sai, Ngân Hàng Giám Sát phải thông báo và yêu cầu công ty quản lý quỹ kịp thời điều chỉnh hoặc ngược lại trong trường hợp ngân hàng giám sát cung cấp dịch vụ xác định giá trị tài sản ròng']","Phí giám sát: 0,02% NAV/năm (tối thiểu 5.000.000 đồng/tháng). Phí lưu ký: 0,06% NAV/năm (tối thiểu 20.000.000 đồng/tháng)."
Phí dịch vụ phát hành (Subscription Fee) hiện tại của Quỹ là bao nhiêu?,"Theo thông tin được cung cấp từ nguồn 1, phí dịch vụ phát hành (Subscription Fee) hiện tại của Quỹ là 1,2%*NAV/năm. Tuy nhiên, mức này có thể thay đổi nếu Đại Hội Nhà Đầu Tư ủy quyền cho Ban Đại Diện Quỹ điều chỉnh trong phạm vi đã được xác định.

Thông tin này được lấy từ Trang 37 (Nguồn: Trang 37).","['## 3. Giá dịch vụ và thưởng hoạt động\nGiá dịch vụ Phát hành được tính bằng tỷ lệ phần trăm giá trị của Lệnh Mua. Tùy thuộc vào giá trị mua của từng Lệnh Mua, hình thức mua một lần hay mua theo chương trình ĐTĐK, Giá dịch vụ Phát hành được tính theo các biểu giá dịch vụ.  \nGiá dịch vụ phát hành áp dụng cho lệnh mua được TCC ấn định và công bố bằng văn bản thông báo tại từng thời kỳ nhưng không quá 5,0% (năm phần trăm) giá trị Lệnh Mua. Thời điểm áp dụng mức giá dịch vụ mới tăng sớm nhất là 60 ngày kể từ ngày Công ty Quản Lý Quỹ công bố về mức giá dịch vụ mới trên trang thông tin điện tử của Công ty.  \nMức giá dịch vụ phát hành của Quỹ là 0%.  \nGiá dịch vụ phát hành sẽ được hạch toán cho Công Ty Quản Lý Quỹ và Đại Lý Phân Phối căn cứ theo hợp đồng ký giữa Công Ty Quản Lý Quỹ và Đại Lý Phân Phối.', '## 2.5.3. Thông tin về các mức giá dịch vụ\nGiá dịch vụ Phát hành được tính bằng tỷ lệ phần trăm giá trị của Lệnh Mua. Tùy thuộc vào giá trị mua của từng Lệnh Mua, hình thức mua một lần hay mua theo chương trình ĐTĐK, Giá dịch vụ Phát hành được tính theo các biểu giá dịch vụ.  \nGiá dịch vụ phát hành áp dụng cho lệnh mua được TCC ấn định và công bố bằng văn bản thông báo tại từng thời kỳ nhưng không quá 5,0% (năm phần trăm) giá trị Lệnh Mua. Thời điểm áp dụng mức giá dịch vụ mới tăng sớm nhất là 60 ngày kể từ ngày Công ty Quản Lý Quỹ công bố về mức giá dịch vụ mới trên trang thông tin điện tử của Công ty.  \nMức giá dịch vụ phát hành của Quỹ là 0%.  \nGiá dịch vụ phát hành sẽ được hạch toán cho Công Ty Quản Lý Quỹ và Đại Lý Phân Phối căn cứ theo hợp đồng ký giữa Công Ty Quản Lý Quỹ và Đại Lý Phân Phối.', '## 2.5.3. Thông tin về các mức giá dịch vụ\nCác loại phí/dịch vụ và chi phí/giá dịch vụ liên quan trực tiếp đến việc giao dịch Đơn Vị Quỹ sẽ do Nhà Đầu Tư trả và không được tính vào chi phí của Quỹ. Công Ty Quản Lý Quỹ bảo lưu quyền thay đổi biểu phí/giá dịch vụ này.  \nCác khoản giá dịch vụ giao dịch như sau:', '## 3. Giá dịch vụ và thưởng hoạt động\nCác loại phí/dịch vụ và chi phí/giá dịch vụ liên quan trực tiếp đến việc giao dịch Đơn Vị Quỹ sẽ do Nhà Đầu Tư trả và không được tính vào chi phí của Quỹ. Công Ty Quản Lý Quỹ bảo lưu quyền thay đổi biểu phí/giá dịch vụ này.  \nCác khoản giá dịch vụ giao dịch như sau:', '## 2.6. Giá dịch vụ mà Quỹ phải trả\nChỉ có các loại phí/dịch vụ và các chi phí/giá dịch vụ liên quan trực tiếp hoặc đóng góp vào các hoạt động và điều hành của Quỹ mới được tính vào chi phí/giá dịch vụ hoạt động của Quỹ. Xin lưu ý các phí/giá dịch vụ dưới đây là các mức đang áp dụng và các phí/giá dịch vụ này có thể sẽ thay đổi trong tương lai. Các chi phí/dịch vụ này bao gồm:', '## 3.2 Giá dịch vụ mà Quỹ phải trả\nChỉ có các loại phí/dịch vụ và các chi phí/giá dịch vụ liên quan trực tiếp hoặc đóng góp vào các hoạt động và điều hành của Quỹ mới được tính vào chi phí/giá dịch vụ hoạt động của Quỹ. Xin lưu ý các phí/giá dịch vụ dưới đây là các mức đang áp dụng và các phí/giá dịch vụ này có thể sẽ thay đổi trong tương lai. Các chi phí/dịch vụ này bao gồm:', '## d) Giá dịch vụ Quản Trị Quỹ\nGiá dịch vụ Quản trị quỹ sẽ là 0,03% NAV/năm và thấp nhất là 15.000.000 đồng/ tháng (chưa bao gồm thuế VAT)  \nCông thức tính giá dịch vụ quản trị quỹ vào mỗi kỳ định giá được xác định như sau:  \nGiá dịch vụ quản trị quỹ cho kỳ định giá = Tỷ lệ giá dịch vụ quản trị quỹ (năm) x NAV tại ngày trước ngày định giá x số ngày theo lịch thực tế của chu kỳ định giá / số ngày thực tế của năm (365 hoặc 366).', '## h) Chi Phí Khác\n- Giá dịch vụ môi giới cho các giao dịch của quỹ;\n- Chi phí in ấn, ví dụ in các tài liệu cho Nhà Đầu Tư theo quy định Pháp Luật;\n- Giá dịch vụ định giá độc lập cho các khoản đầu tư cụ thể của Quỹ (chỉ khi cần thiết), ví dụ như định giá các khoản chứng khoán chưa niêm yết;\n- Chi phí phát sinh cho bất kỳ Đại Hội Nhà Đầu Tư hay cuộc họp nào của Ban Đại Diện Quỹ;\n- Phí/giá dịch vụ pháp lý liên quan đến hoạt động và các giao dịch của Quỹ và các loại phí/chi phí/dịch vụ khác theo Luật cho phép;\n- Thuế và các loại phí/dịch vụ bắt buộc của chính phủ áp dụng cho Quỹ; và\n- Các chi phí khác được Pháp Luật cho phép.', '## c) Giá dịch vụ Lưu Ký\nGiá dịch vụ lưu ký được trả cho Ngân Hàng Lưu ký để cung cấp dịch vụ Ngân Hàng Lưu ký cho Quỹ. Giá dịch vụ được tính vào mỗi kỳ định giá dựa trên NAV tại ngày trước Ngày Định Giá và được trả hàng tháng. Số tiền trả dịch vụ hàng tháng là tổng số được tính (trích lập) cho các kỳ định giá thực hiện trong tháng.  \nCông thức tính giá dịch vụ lưu ký vào mỗi kỳ định giá được xác định như sau:  \nGiá dịch vụ lưu ký cho kỳ định giá = Tỷ lệ giá dịch vụ lưu ký (năm) x NAV tại ngày trước ngày định giá x số ngày theo lịch thực tế của chu kỳ định giá / số ngày thực tế của năm (365 hoặc 366).  \n|  Loại Giá dịch vụ | Mức giá dịch vụ | Tối thiểu/tối đa | Ghi chú  |\n| --- | --- |\n|  Giá dịch vụ lưu ký | 0,06%*NAV/Năm | Tối thiểu: 20.000.000 đồng /tháng |   |', '## c. Giá dịch vụ Lưu ký\nGiá dịch vụ lưu ký được trả cho Ngân Hàng Lưu ký để cung cấp dịch vụ Ngân Hàng Lưu ký cho Quỹ. Giá dịch vụ được tính vào mỗi kỳ định giá dựa trên NAV tại ngày trước Ngày Định Giá và được trả hàng tháng. Số tiền trả dịch vụ hàng tháng là tổng số được tính (trích lập) cho các kỳ định giá thực hiện trong tháng.  \nCông thức tính giá dịch vụ lưu ký vào mỗi kỳ định giá được xác định như sau:  \nGiá dịch vụ lưu ký cho kỳ định giá = Tỷ lệ giá dịch vụ lưu ký (năm) x NAV tại ngày trước ngày định giá x số ngày theo lịch thực tế của chu kỳ định giá / số ngày thực tế của năm (365 hoặc 366).  \n|  Loại Giá dịch vụ | Mức giá dịch vụ | Tối thiểu/tối đa | Ghi chú  |\n| --- | --- |\n|  Giá dịch vụ lưu ký | 0,06%*NAV/Năm | Tối thiểu: 20.000.000 đồng /tháng |   |', '## b. Giá dịch vụ giám sát\nGiá dịch vụ giám sát được trả cho Ngân Hàng Giám Sát để cung cấp dịch vụ Ngân Hàng Giám Sát cho Quỹ. Giá dịch vụ được tính vào mỗi kỳ định giá dựa trên NAV tại ngày trước Ngày Định Giá và được trả hàng tháng. Số tiền trả dịch vụ hàng tháng là tổng số được tính (trích lập) cho các kỳ định giá thực hiện trong tháng.  \nCông thức tính giá dịch vụ giám sát vào mỗi kỳ định giá được xác định như sau:  \nGiá dịch vụ giám sát cho kỳ định giá = Tỷ lệ giá dịch vụ giám sát (năm) x NAV tại ngày trước ngày định giá x số ngày theo lịch thực tế của chu kỳ định giá / số ngày thực tế của năm (365 hoặc 366).  \n|  Loại Giá dịch vụ | Mức giá dịch vụ | Tối thiểu/tối đa | Ghi chú  |\n| --- | --- |\n|  Giá dịch vụ giám sát | 0,02%*NAV/Năm | Tối thiểu: 5.000.000 đồng /tháng | Thuế VAT 10%  |', 'a. Giá dịch vụ Lưu Ký xử lý hồ sơ  \n|  Loại Giá dịch vụ | Mức giá dịch vụ | Tối thiểu/tối đa | Ghi chú  |\n| --- | --- |\n|  Giá dịch vụ lưu ký xử lý hồ sơ  |   |   |   |\n|  Đối với giao dịch cổ phiếu niêm yết/đăng ký giao dịch | 0,03% * giá trị giao dịch | Tối thiểu 100.000 đồng/ngày giao dịch, Tối đa 10.000.000 đồng/ngày giao dịch |   |\n|  Đối với giao dịch trái phiếu niêm yết/đăng ký giao dịch | 0,01% * giá trị giao dịch |   |   |\n|  Đối với các giao dịch mua bán CK OTC và các tài sản khác | 100.000 đồng/giao dịch |  |   |  \nb. Giá dịch vụ Quản Trị Quỹ  \nGiá dịch vụ Quản trị quỹ sẽ là 0,03% NAV/năm và thấp nhất là 15.000.000 đồng/ tháng (chưa bao gồm thuế VAT)  \nCông thức tính giá dịch vụ quản trị quỹ vào mỗi kỳ định giá được xác định như sau:', '7  \n“Giá Dịch Vụ Phát Hành/Giá Dịch Vụ Mua Lại”  \nLà giá dịch vụ mà Nhà Đầu Tư phải trả khi mua/bán một đơn vị Chứng Chỉ Quỹ cho Quỹ. Giá Dịch Vụ Phát Hành/Giá Dịch Vụ Mua Lại tính theo tỷ lệ phần trăm Giá Trị Tài Sản Ròng trên một đơn vị Chứng Chỉ Quỹ.  \n“Giá dịch vụ quản lý quỹ”  \nLà giá dịch vụ phải trả cho Công ty Quản Lý Quỹ cung cấp dịch vụ quản lý quỹ đã được quy định tại Điều lệ Quỹ.  \n“Cổ Tức Quỹ”  \nLà số lợi nhuận còn lại của Quỹ sau khi trừ đi các chi phí hợp lệ và được Đại Hội Nhà Đầu Tư quyết định chia theo tỷ lệ sở hữu của Nhà Đầu Tư.  \n“Giá trị tài sản ròng của Quỹ”  \nlà tổng giá trị các tài sản và các khoản đầu tư do Quỹ sở hữu trừ đi các nghĩa vụ nợ của Quỹ tại Ngày Định Giá.  \n“Ngày Định Giá”', '## 3. Giao dịch chứng chỉ quỹ các lần tiếp theo\n**Giá bán/Giá dịch vụ phát hành:** Là mức giá Nhà Đầu Tư phải thanh toán để mua một đơn vị quỹ.  \n**Giá dịch vụ mua lại:** Là mức giá mà Công ty Quản Lý Quỹ phải thanh toán để mua lại từ Nhà Đầu Tư một đơn vị quỹ. Giá mua lại bằng giá trị tài sản ròng trên một đơn vị quỹ trừ đi giá dịch vụ mua lại chứng chỉ quỹ theo quy định.', 'i. **Chi Phí Khác**  \n- Giá dịch vụ môi giới cho các giao dịch của quỹ;\n- Chi phí in ấn, ví dụ in các tài liệu cho Nhà Đầu Tư theo quy định Pháp Luật;\n- Giá dịch vụ định giá độc lập cho các khoản đầu tư cụ thể của Quỹ (chỉ khi cần thiết), ví dụ như định giá các khoản chứng khoán chưa niêm yết;\n- Chi phí phát sinh cho bất kỳ Đại Hội Nhà Đầu Tư hay cuộc họp nào của Ban Đại Diện Quỹ;\n- Phí/giá dịch vụ pháp lý liên quan đến hoạt động và các giao dịch của Quỹ và các loại phí/chi phí/dịch vụ khác theo Luật cho phép;\n- Thuế và các loại phí/dịch vụ bắt buộc của chính phủ áp dụng cho Quỹ; và\n- Các chi phí khác được Pháp Luật cho phép.  \n2.7. Phân phối lợi nhuận và chính sách thuế  \na. Chính sách cổ tức Quỹ', '## 3.2 Giá dịch vụ mà Quỹ phải trả\nGiá dịch vụ Quản Lý tối đa là 1,2% * NAV/năm.  \nĐại Hội Nhà Đầu Tư có thể ủy quyền cho Ban Đại Diện Quỹ quyết định điều chỉnh mức Giá dịch vụ Quản lý trong mức tối đa nêu trên nếu được Đại Hội Nhà Đầu Tư thông qua việc ủy quyền này trong Đại hội hàng năm gần nhất. Hiệu lực của việc điều chỉnh Giá dịch vụ Quản Lý sau khi Ban Đại Diện Quỹ phê duyệt sẽ được Công ty quản lý Quỹ công bố trên trang website. Trường hợp thay đổi Giá dịch vụ Quản lý dẫn đến giá dịch vụ vượt quá mức tối đa nêu trên sẽ phải được Đại Hội Nhà Đầu Tư phê duyệt.  \nTrong mọi trường hợp, tổng giá dịch vụ Quản lý Quỹ, giá dịch vụ Quản trị Quỹ và giá dịch vụ đại lý chuyển nhượng sẽ không vượt quá quy định của Pháp luật (2% NAV/năm).', '## c) Giá dịch vụ Chuyển Đổi Quỹ\nKhi thực hiện chuyển đổi, Nhà Đầu Tư chỉ thanh toán Giá dịch vụ Chuyển Đổi trên giá trị đăng ký chuyển đổi, mà không phải thanh toán Giá dịch vụ Mua Lại đối với Quỹ hiện tại và Giá dịch vụ Phát Hành đối với Quỹ mục tiêu.  \nCác khoản thuế giao dịch, giá dịch vụ chuyển tiền ngân hàng, nếu có, sẽ được khấu trừ vào số tiền thu được từ Lệnh Bản trong Lệnh Chuyển Đổi. Thời gian nắm giữ Đơn Vị Quỹ của Quỹ mục tiêu sẽ được tính từ ngày Lệnh Chuyển Đổi Quỹ được thực hiện.  \nMức giá dịch vụ chuyển đổi của Quỹ như sau:  \n|  Thời gian nắm giữ CCQ | Giá dịch vụ chuyển đổi (% giá trị lệnh bán)  |\n| --- | --- |\n|  0 đến dưới 6 tháng | 1,00%  |\n|  Từ tròn 6 đến tròn 9 tháng | 0,75%  |\n|  Từ trên 9 đến tròn 12 tháng | 0,50%  |', 'Giá dịch vụ Quản Lý tối đa là 1,2%*NAV/năm.  \nĐại Hội Nhà Đầu Tư có thể ủy quyền cho Ban Đại Diện Quỹ quyết định điều chỉnh mức Giá dịch vụ Quản lý trong mức tối đa nêu trên nếu được Đại Hội Nhà Đầu Tư thông qua việc ủy quyền này trong Đại hội hàng năm gần nhất. Hiệu lực của việc điều chỉnh Giá dịch vụ Quản Lý sau khi Ban Đại Diện Quỹ phê duyệt sẽ được Công ty quản lý Quỹ công bố trên trang website. Trường hợp thay đổi Giá dịch vụ Quản lý dẫn đến giá dịch vụ vượt quá mức tối đa nêu trên sẽ phải được Đại Hội Nhà Đầu Tư phê duyệt.  \nTrong mọi trường hợp, tổng giá dịch vụ Quản lý Quỹ, giá dịch vụ Quản trị Quỹ và giá dịch vụ đại lý chuyển nhượng sẽ không vượt quá quy định của Pháp luật (2% NAV/năm).', '|  Số lượng đơn vị quỹ dự kiến phát hành: | 5.000.000 Đơn Vị Quỹ  |\n| --- | --- |\n|  Thời gian phát hành: | Được đề cập trong thông báo phát hành lần đầu ra công chúng  |\n|  Mệnh giá: | 10.000 đồng một Đơn Vị Quỹ  |\n|  Đồng tiền sử dụng và trình bày: | Đồng (VNĐ)  |\n|  Giá phát hành: | 10.000 VNĐ  |\n|  Phương thức phân bổ chứng chỉ quỹ lần đầu | = Tổng số tiền đầu tư ban đầu/ Giá phát hành  |  \nCác Nhà Đầu Tư muốn đầu tư vào Quỹ phải hoàn thành và nộp Đơn Đăng Ký cho Đại Lý Phân Phối theo các quy trình và hướng dẫn trong lần chào bán lần đầu ra công chúng.  \nMức đầu tư đăng ký tối thiểu (tính theo giá trị Lệnh Mua) của Nhà Đầu Tư là 10.000 VNĐ (Mười ngàn Việt Nam đồng)', '## 3.2 Giá dịch vụ mà Quỹ phải trả\nGiá dịch vụ quản lý được tính vào mỗi kỳ định giá dựa trên NAV tại ngày trước ngày định giá và được thanh toán hàng tháng cho Công ty Quản Lý Quỹ. Số giá dịch vụ trả hàng tháng là tổng số giá dịch vụ được tính (trích lập) cho các kỳ định giá thực hiện trong tháng.  \nCông thức tính giá dịch vụ quản lý quỹ vào mỗi kỳ định giá được xác định như sau:  \nGiá dịch vụ quản lý quỹ cho kỳ định giá = Tỷ lệ giá dịch vụ quản lý (năm) x NAV tại ngày trước ngày định giá x số ngày theo lịch thực tế của chu kỳ định giá / số ngày thực tế của năm (365 hoặc 366).  \nGiá dịch vụ Quản Lý tối đa là 1,2% * NAV/năm.', '“Giá bán/ Giá phát hành”\nLà mức giá Nhà Đầu Tư phải thanh toán để mua một Chứng chỉ quỹ. Giá bán/Giá phát hành bằng mệnh giá (trong đợt chào bán lần đầu ra công chúng) hoặc bằng giá trị tài sản ròng trên một Chứng chỉ quỹ cộng thêm giá dịch vụ phát hành đã quy định tại Điều lệ / Bản Cáo Bạch của Quỹ.  \n“Giá mua lại”\nLà mức giá mà Công ty Quản Lý Quỹ phải thanh toán để mua lại từ Nhà Đầu Tư một Chứng chỉ quỹ. Giá mua lại bằng giá trị tài sản ròng trên một Chứng chỉ quỹ tính tại ngày giao dịch Chứng chỉ quỹ trừ đi giá dịch vụ mua lại chứng chỉ quỹ đã quy định tại Điều lệ Quỹ.', 'Giá dịch vụ Mua lại và các khoản giá dịch vụ ngân hàng và thuế khác (nếu có) sẽ được trừ vào khoản tiền thu được từ bản Đơn Vị Quỹ của Nhà Đầu Tư.  \nGiá dịch vụ Mua lại cho tất cả các Chương trình được TCC ấn định và công bố bằng văn bản thông báo tại từng thời kỳ nhưng không quá 3,0% (ba phần trăm) giá trị của Lệnh Bản. Thời điểm áp dụng mức giá dịch vụ mới tăng sớm nhất là 60 ngày kể từ ngày Công ty Quản Lý Quỹ công bố về mức giá dịch vụ mới trên trang thông tin điện tử của Công ty.  \nMức giá dịch vụ mua lại của Quỹ như sau:  \n|  Thời gian nắm giữ CCQ | Giá dịch vụ mua lại (% giá trị lệnh bán)  |\n| --- | --- |\n|  0 đến dưới 6 tháng | 1,00%  |\n|  Từ tròn 6 đến tròn 9 tháng | 0,75%  |\n|  Từ trên 9 đến tròn 12 tháng | 0,50%  |\n|  Từ trên 12 tháng trở lên | 0,00%  |', 'Mức giá dịch vụ chuyển đổi của Quỹ như sau:  \n|  Thời gian nắm giữ CCQ | Giá dịch vụ chuyển đổi (% giá trị lệnh bán)  |\n| --- | --- |\n|  0 đến dưới 6 tháng | 1,00%  |\n|  Từ tròn 6 đến tròn 9 tháng | 0,75%  |\n|  Từ trên 9 đến tròn 12 tháng | 0,50%  |\n|  Từ trên 12 tháng trở lên | 0,00%  |  \nKhi thực hiện chuyển đổi, Nhà Đầu Tư chỉ thanh toán Giá dịch vụ Chuyển Đổi trên giá trị đăng ký chuyển đổi, mà không phải thanh toán Giá dịch vụ Mua Lại đối với Quỹ hiện tại và Giá dịch vụ Phát Hành đối với Quỹ mục tiêu.  \nCác khoản thuế giao dịch, giá dịch vụ chuyển tiền ngân hàng, nếu có, sẽ được khấu trừ vào số tiền thu được từ Lệnh Bản trong Lệnh Chuyển Đổi. Thời gian nắm giữ Đơn Vị Quỹ của Quỹ mục tiêu sẽ được tính từ ngày Lệnh Chuyển Đổi Quỹ được thực hiện.', '## 2.6. Giá dịch vụ mà Quỹ phải trả\nGiá dịch vụ quản lý được tính vào mỗi kỳ định giá dựa trên NAV tại ngày trước ngày định giá và được thanh toán hàng tháng cho Công ty Quản Lý Quỹ. Số giá dịch vụ trả hàng tháng là tổng số giá dịch vụ được tính (trích lập) cho các kỳ định giá thực hiện trong tháng.  \nCông thức tính giá dịch vụ quản lý quỹ vào mỗi kỳ định giá được xác định như sau:  \nGiá dịch vụ quản lý quỹ cho kỳ định giá = Tỷ lệ giá dịch vụ quản lý (năm) x NAV tại ngày trước ngày định giá x số ngày theo lịch thực tế của chu kỳ định giá / số ngày thực tế của năm (365 hoặc 366).  \n36', '## 3.2 Giá dịch vụ mà Quỹ phải trả\nGiá dịch vụ giám sát được trả cho Ngân Hàng Giám Sát để cung cấp dịch vụ Ngân Hàng Giám Sát cho Quỹ. Giá dịch vụ được tính vào mỗi kỳ định giá dựa trên NAV tại ngày trước Ngày Định Giá và được trả hàng tháng. Số tiền trả dịch vụ hàng tháng là tổng số được tính (trích lập) cho các kỳ định giá thực hiện trong tháng.']",Mức giá dịch vụ phát hành của Quỹ là 0%.
Phí dịch vụ quản trị quỹ (Fund Administration Fee) được tính theo tỷ lệ nào và mức tối thiểu là bao nhiêu?,"Phí dịch vụ quản trị quỹ (Fund Administration Fee) được tính theo tỷ lệ 0% của Giá Trị Tài Sản Ròng trên một đơn vị Chứng Chỉ Quỹ.

Thông tin này được lấy từ trang 36 của tài liệu.","['## d) Giá dịch vụ Quản Trị Quỹ\nGiá dịch vụ Quản trị quỹ sẽ là 0,03% NAV/năm và thấp nhất là 15.000.000 đồng/ tháng (chưa bao gồm thuế VAT)  \nCông thức tính giá dịch vụ quản trị quỹ vào mỗi kỳ định giá được xác định như sau:  \nGiá dịch vụ quản trị quỹ cho kỳ định giá = Tỷ lệ giá dịch vụ quản trị quỹ (năm) x NAV tại ngày trước ngày định giá x số ngày theo lịch thực tế của chu kỳ định giá / số ngày thực tế của năm (365 hoặc 366).', '## 3.2 Giá dịch vụ mà Quỹ phải trả\nGiá dịch vụ Quản Lý tối đa là 1,2% * NAV/năm.  \nĐại Hội Nhà Đầu Tư có thể ủy quyền cho Ban Đại Diện Quỹ quyết định điều chỉnh mức Giá dịch vụ Quản lý trong mức tối đa nêu trên nếu được Đại Hội Nhà Đầu Tư thông qua việc ủy quyền này trong Đại hội hàng năm gần nhất. Hiệu lực của việc điều chỉnh Giá dịch vụ Quản Lý sau khi Ban Đại Diện Quỹ phê duyệt sẽ được Công ty quản lý Quỹ công bố trên trang website. Trường hợp thay đổi Giá dịch vụ Quản lý dẫn đến giá dịch vụ vượt quá mức tối đa nêu trên sẽ phải được Đại Hội Nhà Đầu Tư phê duyệt.  \nTrong mọi trường hợp, tổng giá dịch vụ Quản lý Quỹ, giá dịch vụ Quản trị Quỹ và giá dịch vụ đại lý chuyển nhượng sẽ không vượt quá quy định của Pháp luật (2% NAV/năm).', '## 2.5.3. Thông tin về các mức giá dịch vụ\nCác loại phí/dịch vụ và chi phí/giá dịch vụ liên quan trực tiếp đến việc giao dịch Đơn Vị Quỹ sẽ do Nhà Đầu Tư trả và không được tính vào chi phí của Quỹ. Công Ty Quản Lý Quỹ bảo lưu quyền thay đổi biểu phí/giá dịch vụ này.  \nCác khoản giá dịch vụ giao dịch như sau:', '## 3. Giá dịch vụ và thưởng hoạt động\nCác loại phí/dịch vụ và chi phí/giá dịch vụ liên quan trực tiếp đến việc giao dịch Đơn Vị Quỹ sẽ do Nhà Đầu Tư trả và không được tính vào chi phí của Quỹ. Công Ty Quản Lý Quỹ bảo lưu quyền thay đổi biểu phí/giá dịch vụ này.  \nCác khoản giá dịch vụ giao dịch như sau:', 'Giá dịch vụ Quản Lý tối đa là 1,2%*NAV/năm.  \nĐại Hội Nhà Đầu Tư có thể ủy quyền cho Ban Đại Diện Quỹ quyết định điều chỉnh mức Giá dịch vụ Quản lý trong mức tối đa nêu trên nếu được Đại Hội Nhà Đầu Tư thông qua việc ủy quyền này trong Đại hội hàng năm gần nhất. Hiệu lực của việc điều chỉnh Giá dịch vụ Quản Lý sau khi Ban Đại Diện Quỹ phê duyệt sẽ được Công ty quản lý Quỹ công bố trên trang website. Trường hợp thay đổi Giá dịch vụ Quản lý dẫn đến giá dịch vụ vượt quá mức tối đa nêu trên sẽ phải được Đại Hội Nhà Đầu Tư phê duyệt.  \nTrong mọi trường hợp, tổng giá dịch vụ Quản lý Quỹ, giá dịch vụ Quản trị Quỹ và giá dịch vụ đại lý chuyển nhượng sẽ không vượt quá quy định của Pháp luật (2% NAV/năm).', '## 3.2 Giá dịch vụ mà Quỹ phải trả\nGiá dịch vụ quản lý được tính vào mỗi kỳ định giá dựa trên NAV tại ngày trước ngày định giá và được thanh toán hàng tháng cho Công ty Quản Lý Quỹ. Số giá dịch vụ trả hàng tháng là tổng số giá dịch vụ được tính (trích lập) cho các kỳ định giá thực hiện trong tháng.  \nCông thức tính giá dịch vụ quản lý quỹ vào mỗi kỳ định giá được xác định như sau:  \nGiá dịch vụ quản lý quỹ cho kỳ định giá = Tỷ lệ giá dịch vụ quản lý (năm) x NAV tại ngày trước ngày định giá x số ngày theo lịch thực tế của chu kỳ định giá / số ngày thực tế của năm (365 hoặc 366).  \nGiá dịch vụ Quản Lý tối đa là 1,2% * NAV/năm.', '## h) Chi Phí Khác\n- Giá dịch vụ môi giới cho các giao dịch của quỹ;\n- Chi phí in ấn, ví dụ in các tài liệu cho Nhà Đầu Tư theo quy định Pháp Luật;\n- Giá dịch vụ định giá độc lập cho các khoản đầu tư cụ thể của Quỹ (chỉ khi cần thiết), ví dụ như định giá các khoản chứng khoán chưa niêm yết;\n- Chi phí phát sinh cho bất kỳ Đại Hội Nhà Đầu Tư hay cuộc họp nào của Ban Đại Diện Quỹ;\n- Phí/giá dịch vụ pháp lý liên quan đến hoạt động và các giao dịch của Quỹ và các loại phí/chi phí/dịch vụ khác theo Luật cho phép;\n- Thuế và các loại phí/dịch vụ bắt buộc của chính phủ áp dụng cho Quỹ; và\n- Các chi phí khác được Pháp Luật cho phép.', '## 2.6. Giá dịch vụ mà Quỹ phải trả\nGiá dịch vụ quản lý được tính vào mỗi kỳ định giá dựa trên NAV tại ngày trước ngày định giá và được thanh toán hàng tháng cho Công ty Quản Lý Quỹ. Số giá dịch vụ trả hàng tháng là tổng số giá dịch vụ được tính (trích lập) cho các kỳ định giá thực hiện trong tháng.  \nCông thức tính giá dịch vụ quản lý quỹ vào mỗi kỳ định giá được xác định như sau:  \nGiá dịch vụ quản lý quỹ cho kỳ định giá = Tỷ lệ giá dịch vụ quản lý (năm) x NAV tại ngày trước ngày định giá x số ngày theo lịch thực tế của chu kỳ định giá / số ngày thực tế của năm (365 hoặc 366).  \n36', 'Công thức tính giá dịch vụ quản trị quỹ vào mỗi kỳ định giá được xác định như sau:  \nGiá dịch vụ quản trị quỹ cho kỳ định giá = Tỷ lệ giá dịch vụ quản trị quỹ (năm) x NAV tại ngày trước ngày định giá x số ngày theo lịch thực tế của chu kỳ định giá / số ngày thực tế của năm (365 hoặc 366).  \nc. Giá dịch vụ Đại Lý Chuyển Nhượng  \nGiá dịch vụ Đại lý chuyển nhượng được tính toán và cộng đồng theo kỳ định giá và được thanh toán định kỳ theo thỏa thuận với Đại lý chuyển nhượng. Giá dịch vụ Đại lý chuyển nhượng được thống nhất với Đại lý chuyển nhượng phù hợp với quy định của pháp luật và có thể được điều chỉnh theo thỏa thuận với Đại lý chuyển nhượng.  \nd. Chi phí Kiểm Toán', '## 2.6. Giá dịch vụ mà Quỹ phải trả\nChỉ có các loại phí/dịch vụ và các chi phí/giá dịch vụ liên quan trực tiếp hoặc đóng góp vào các hoạt động và điều hành của Quỹ mới được tính vào chi phí/giá dịch vụ hoạt động của Quỹ. Xin lưu ý các phí/giá dịch vụ dưới đây là các mức đang áp dụng và các phí/giá dịch vụ này có thể sẽ thay đổi trong tương lai. Các chi phí/dịch vụ này bao gồm:', '## 3.2 Giá dịch vụ mà Quỹ phải trả\nChỉ có các loại phí/dịch vụ và các chi phí/giá dịch vụ liên quan trực tiếp hoặc đóng góp vào các hoạt động và điều hành của Quỹ mới được tính vào chi phí/giá dịch vụ hoạt động của Quỹ. Xin lưu ý các phí/giá dịch vụ dưới đây là các mức đang áp dụng và các phí/giá dịch vụ này có thể sẽ thay đổi trong tương lai. Các chi phí/dịch vụ này bao gồm:', '## b. Giá dịch vụ giám sát\nGiá dịch vụ giám sát được trả cho Ngân Hàng Giám Sát để cung cấp dịch vụ Ngân Hàng Giám Sát cho Quỹ. Giá dịch vụ được tính vào mỗi kỳ định giá dựa trên NAV tại ngày trước Ngày Định Giá và được trả hàng tháng. Số tiền trả dịch vụ hàng tháng là tổng số được tính (trích lập) cho các kỳ định giá thực hiện trong tháng.  \nCông thức tính giá dịch vụ giám sát vào mỗi kỳ định giá được xác định như sau:  \nGiá dịch vụ giám sát cho kỳ định giá = Tỷ lệ giá dịch vụ giám sát (năm) x NAV tại ngày trước ngày định giá x số ngày theo lịch thực tế của chu kỳ định giá / số ngày thực tế của năm (365 hoặc 366).  \n|  Loại Giá dịch vụ | Mức giá dịch vụ | Tối thiểu/tối đa | Ghi chú  |\n| --- | --- |\n|  Giá dịch vụ giám sát | 0,02%*NAV/Năm | Tối thiểu: 5.000.000 đồng /tháng | Thuế VAT 10%  |', 'a. Giá dịch vụ Lưu Ký xử lý hồ sơ  \n|  Loại Giá dịch vụ | Mức giá dịch vụ | Tối thiểu/tối đa | Ghi chú  |\n| --- | --- |\n|  Giá dịch vụ lưu ký xử lý hồ sơ  |   |   |   |\n|  Đối với giao dịch cổ phiếu niêm yết/đăng ký giao dịch | 0,03% * giá trị giao dịch | Tối thiểu 100.000 đồng/ngày giao dịch, Tối đa 10.000.000 đồng/ngày giao dịch |   |\n|  Đối với giao dịch trái phiếu niêm yết/đăng ký giao dịch | 0,01% * giá trị giao dịch |   |   |\n|  Đối với các giao dịch mua bán CK OTC và các tài sản khác | 100.000 đồng/giao dịch |  |   |  \nb. Giá dịch vụ Quản Trị Quỹ  \nGiá dịch vụ Quản trị quỹ sẽ là 0,03% NAV/năm và thấp nhất là 15.000.000 đồng/ tháng (chưa bao gồm thuế VAT)  \nCông thức tính giá dịch vụ quản trị quỹ vào mỗi kỳ định giá được xác định như sau:', '## c) Giá dịch vụ Lưu Ký\nGiá dịch vụ lưu ký được trả cho Ngân Hàng Lưu ký để cung cấp dịch vụ Ngân Hàng Lưu ký cho Quỹ. Giá dịch vụ được tính vào mỗi kỳ định giá dựa trên NAV tại ngày trước Ngày Định Giá và được trả hàng tháng. Số tiền trả dịch vụ hàng tháng là tổng số được tính (trích lập) cho các kỳ định giá thực hiện trong tháng.  \nCông thức tính giá dịch vụ lưu ký vào mỗi kỳ định giá được xác định như sau:  \nGiá dịch vụ lưu ký cho kỳ định giá = Tỷ lệ giá dịch vụ lưu ký (năm) x NAV tại ngày trước ngày định giá x số ngày theo lịch thực tế của chu kỳ định giá / số ngày thực tế của năm (365 hoặc 366).  \n|  Loại Giá dịch vụ | Mức giá dịch vụ | Tối thiểu/tối đa | Ghi chú  |\n| --- | --- |\n|  Giá dịch vụ lưu ký | 0,06%*NAV/Năm | Tối thiểu: 20.000.000 đồng /tháng |   |', '## c. Giá dịch vụ Lưu ký\nGiá dịch vụ lưu ký được trả cho Ngân Hàng Lưu ký để cung cấp dịch vụ Ngân Hàng Lưu ký cho Quỹ. Giá dịch vụ được tính vào mỗi kỳ định giá dựa trên NAV tại ngày trước Ngày Định Giá và được trả hàng tháng. Số tiền trả dịch vụ hàng tháng là tổng số được tính (trích lập) cho các kỳ định giá thực hiện trong tháng.  \nCông thức tính giá dịch vụ lưu ký vào mỗi kỳ định giá được xác định như sau:  \nGiá dịch vụ lưu ký cho kỳ định giá = Tỷ lệ giá dịch vụ lưu ký (năm) x NAV tại ngày trước ngày định giá x số ngày theo lịch thực tế của chu kỳ định giá / số ngày thực tế của năm (365 hoặc 366).  \n|  Loại Giá dịch vụ | Mức giá dịch vụ | Tối thiểu/tối đa | Ghi chú  |\n| --- | --- |\n|  Giá dịch vụ lưu ký | 0,06%*NAV/Năm | Tối thiểu: 20.000.000 đồng /tháng |   |', '## g) Phụ Cấp Ban Đại Diện Quỹ\nCác chi phí của Ban Đại Diện Quỹ bao gồm chi phí ăn ở, đi lại với mức hợp lý và phù hợp với các quy định tại Điều lệ Quỹ, các chi phí phát sinh từ hoạt động của Ban Đại Diện Quỹ để phục vụ cho lợi ích của Quỹ sẽ được tính vào chi phí của Quỹ. Để dễ hiểu, chi phí trên không bao gồm các chi phí bảo hiểm đối với trách nhiệm phát sinh cho Ban Đại Diện Quỹ khi thực hiện nghĩa vụ của Ban Đại Diện Quỹ. Thủ lao của các thành viên của Ban Đại Diện Quỹ được tính vào chi phí hoạt động của Quỹ và tổng mức thủ lao không được vượt quá tổng ngân sách hoạt động hàng năm của Ban Đại Diện đã được thông qua tại Đại Hội Nhà Đầu Tư.', 'Giá dịch vụ Chuyển Đổi Quỹ sẽ được hạch toán cho Công Ty Quản Lý Quỹ và Đại Lý Phân Phối căn cứ theo hợp đồng ký giữa Công Ty Quản Lý Quỹ và Đại Lý Phân Phối.', '7  \n“Giá Dịch Vụ Phát Hành/Giá Dịch Vụ Mua Lại”  \nLà giá dịch vụ mà Nhà Đầu Tư phải trả khi mua/bán một đơn vị Chứng Chỉ Quỹ cho Quỹ. Giá Dịch Vụ Phát Hành/Giá Dịch Vụ Mua Lại tính theo tỷ lệ phần trăm Giá Trị Tài Sản Ròng trên một đơn vị Chứng Chỉ Quỹ.  \n“Giá dịch vụ quản lý quỹ”  \nLà giá dịch vụ phải trả cho Công ty Quản Lý Quỹ cung cấp dịch vụ quản lý quỹ đã được quy định tại Điều lệ Quỹ.  \n“Cổ Tức Quỹ”  \nLà số lợi nhuận còn lại của Quỹ sau khi trừ đi các chi phí hợp lệ và được Đại Hội Nhà Đầu Tư quyết định chia theo tỷ lệ sở hữu của Nhà Đầu Tư.  \n“Giá trị tài sản ròng của Quỹ”  \nlà tổng giá trị các tài sản và các khoản đầu tư do Quỹ sở hữu trừ đi các nghĩa vụ nợ của Quỹ tại Ngày Định Giá.  \n“Ngày Định Giá”', '## c) Giá dịch vụ Chuyển Đổi Quỹ\nGiá dịch vụ Chuyển Đổi là giá dịch vụ mà Nhà Đầu Tư phải trả khi thực hiện chuyển đổi đầu tư giữa các Quỹ mở do Công Ty Quản Lý Quỹ quản lý. Việc chuyển đổi Quỹ bằng việc bán một Quỹ và mua một Quỹ khác tại ngày giao dịch tương ứng được coi như thực hiện một lệnh bán. Giá dịch vụ Chuyển Đổi Quỹ do đó được áp dụng một lần trên giá trị chuyển đổi với mức giá dịch vụ được TCC ấn định và công bố bằng văn bản thông báo tại từng thời kỳ nhưng không quá 3,0% (ba phần trăm) giá trị thực hiện chuyển đổi. Thời điểm áp dụng mức giá dịch vụ mới tăng sớm nhất là 60 ngày kể từ ngày Công ty Quản Lý Quỹ công bố về mức giá dịch vụ mới trên trang thông tin điện tử của Công ty.', '## c) Giá dịch vụ Chuyển Đổi Quỹ\nGiá dịch vụ Chuyển Đổi là giá dịch vụ mà Nhà Đầu Tư phải trả khi thực hiện chuyển đổi đầu tư giữa các Quỹ mở do Công Ty Quản Lý Quỹ quản lý. Việc chuyển đổi Quỹ bằng việc bán một Quỹ và mua một Quỹ khác tại ngày giao dịch tương ứng được coi như thực hiện một lệnh bán. Giá dịch vụ Chuyển Đổi Quỹ do đó được áp dụng một lần trên giá trị chuyển đổi với mức giá dịch vụ được TCC ấn định và công bố bằng văn bản thông báo tại từng thời kỳ nhưng không quá 3,0% (ba phần trăm) giá trị thực hiện chuyển đổi. Thời điểm áp dụng mức giá dịch vụ mới tăng sớm nhất là 60 ngày kể từ ngày Công ty Quản Lý Quỹ công bố về mức giá dịch vụ mới trên trang thông tin điện tử của Công ty.', 'Mức đầu tư tối thiểu (tính theo giá trị Lệnh Mua) là 10.000 VNĐ (Mười nghìn đồng)  \nKhông có mức giới hạn đầu tư tối đa cho Nhà Đầu Tư. Công Ty Quản Lý Quỹ bảo lưu quyền thay đổi các giới hạn đầu tư trên trong từng thời điểm và sẽ thông báo về các thay đổi này.', '## 3. Giá dịch vụ và thưởng hoạt động\nGiá dịch vụ Phát hành được tính bằng tỷ lệ phần trăm giá trị của Lệnh Mua. Tùy thuộc vào giá trị mua của từng Lệnh Mua, hình thức mua một lần hay mua theo chương trình ĐTĐK, Giá dịch vụ Phát hành được tính theo các biểu giá dịch vụ.  \nGiá dịch vụ phát hành áp dụng cho lệnh mua được TCC ấn định và công bố bằng văn bản thông báo tại từng thời kỳ nhưng không quá 5,0% (năm phần trăm) giá trị Lệnh Mua. Thời điểm áp dụng mức giá dịch vụ mới tăng sớm nhất là 60 ngày kể từ ngày Công ty Quản Lý Quỹ công bố về mức giá dịch vụ mới trên trang thông tin điện tử của Công ty.  \nMức giá dịch vụ phát hành của Quỹ là 0%.  \nGiá dịch vụ phát hành sẽ được hạch toán cho Công Ty Quản Lý Quỹ và Đại Lý Phân Phối căn cứ theo hợp đồng ký giữa Công Ty Quản Lý Quỹ và Đại Lý Phân Phối.', '## 2.5.3. Thông tin về các mức giá dịch vụ\nGiá dịch vụ Phát hành được tính bằng tỷ lệ phần trăm giá trị của Lệnh Mua. Tùy thuộc vào giá trị mua của từng Lệnh Mua, hình thức mua một lần hay mua theo chương trình ĐTĐK, Giá dịch vụ Phát hành được tính theo các biểu giá dịch vụ.  \nGiá dịch vụ phát hành áp dụng cho lệnh mua được TCC ấn định và công bố bằng văn bản thông báo tại từng thời kỳ nhưng không quá 5,0% (năm phần trăm) giá trị Lệnh Mua. Thời điểm áp dụng mức giá dịch vụ mới tăng sớm nhất là 60 ngày kể từ ngày Công ty Quản Lý Quỹ công bố về mức giá dịch vụ mới trên trang thông tin điện tử của Công ty.  \nMức giá dịch vụ phát hành của Quỹ là 0%.  \nGiá dịch vụ phát hành sẽ được hạch toán cho Công Ty Quản Lý Quỹ và Đại Lý Phân Phối căn cứ theo hợp đồng ký giữa Công Ty Quản Lý Quỹ và Đại Lý Phân Phối.', 'i. **Chi Phí Khác**  \n- Giá dịch vụ môi giới cho các giao dịch của quỹ;\n- Chi phí in ấn, ví dụ in các tài liệu cho Nhà Đầu Tư theo quy định Pháp Luật;\n- Giá dịch vụ định giá độc lập cho các khoản đầu tư cụ thể của Quỹ (chỉ khi cần thiết), ví dụ như định giá các khoản chứng khoán chưa niêm yết;\n- Chi phí phát sinh cho bất kỳ Đại Hội Nhà Đầu Tư hay cuộc họp nào của Ban Đại Diện Quỹ;\n- Phí/giá dịch vụ pháp lý liên quan đến hoạt động và các giao dịch của Quỹ và các loại phí/chi phí/dịch vụ khác theo Luật cho phép;\n- Thuế và các loại phí/dịch vụ bắt buộc của chính phủ áp dụng cho Quỹ; và\n- Các chi phí khác được Pháp Luật cho phép.  \n2.7. Phân phối lợi nhuận và chính sách thuế  \na. Chính sách cổ tức Quỹ', '## f) Lệnh Mua Tối Thiểu\nMức đầu tư tối thiểu (tính theo giá trị Lệnh Mua) là 10.000 VND (Mười nghìn đồng)  \nKhông có mức giới hạn đầu tư tối đa cho Nhà Đầu Tư. Công Ty Quản Lý Quỹ bảo lưu quyền thay đổi các giới hạn đầu tư trên trong từng thời điểm và sẽ thông báo về các thay đổi này.']","Giá dịch vụ Quản trị quỹ là 0,03% NAV/năm, tối thiểu 15.000.000 đồng/tháng (chưa VAT)."
Thời điểm đóng sổ lệnh (Cut-off time) đối với lệnh mua và lệnh bán chứng chỉ quỹ là khi nào?,"Thời điểm đóng sổ lệnh (Cut-off time) cho lệnh mua và lệnh bán chứng chỉ quỹ được xác định dựa trên thông tin từ Trang 29 của tài liệu:

- Thời điểm đóng số lệnh (Cut-off time) cho các lệnh mua và bán chứng chỉ quỹ là trước thời điểm quy định của Ngày Giao Dịch tương ứng.

Ngoài ra, có một số lưu ý:
- Các lệnh mua hoặc bán sau thời điểm đóng số lệnh sẽ tự động bị hủy.
- Nhà Đầu Tư có thể đăng ký giao dịch tại ngày giao dịch tiếp theo nếu cần thực hiện các lệnh chưa được chấp nhận. 

Thông tin này được lấy từ Trang 29 của tài liệu.","['b. Thời điểm đóng số lệnh  \nThời Điểm Đóng Số Lệnh cho việc xử lý và chấp nhận các chứng từ cần thiết cho các lệnh mua, bán, chuyển đổi quỹ hoặc chuyển nhượng để thực hiện trong Ngày Giao Dịch và cho việc thanh toán các lệnh mua được quy định chi tiết như sau:  \nThời Điểm Đóng Số Lệnh cho Ngày Giao Dịch ‘T’  \n|   | Giờ đóng số lệnh  |\n| --- | --- |\n|   | Hồ sơ(4)  |\n|  Mua(3) | Trước 14h45 T-1  |\n|  Bán, Chuyển Đổi, Chuyển Nhượng, Hủy Lệnh | Trước 14h45 T-1  |  \n(1) Nhà đầu tư gửi tài liệu xác nhận hợp lệ về việc hoàn thành thanh toán mua Đơn Vị Quỹ trước 14h45 ngày làm việc gần nhất trước ngày giao dịch (ngày T-1) và Ngân Hàng Giám Sát nhận được tiền mua Đơn Vị Quỹ trong ngày T-1  \n(2) Thời Điểm Đóng Số Lệnh áp dụng cho việc nộp đầy đủ hồ sơ với Đại Lý Phân Phối.', '## 2.4.2. Thời điểm đóng số lệnh\nThời Điểm Đóng Số Lệnh cho việc xử lý và chấp nhận các chứng từ cần thiết cho các lệnh mua, bán, chuyển đổi quỹ hoặc chuyển nhượng để thực hiện trong Ngày Giao Dịch và cho việc thanh toán các lệnh mua được quy định chi tiết như sau:  \nThời Điểm Đóng Số Lệnh cho Ngày Giao Dịch ‘T’  \n|   | Giờ đóng số lệnh  |\n| --- | --- |\n|   | Hồ sơ(2)  |\n|  Mua(1) | 14h45 T-1  |\n|  Bán, Chuyển Đổi, Chuyển Nhượng, Hủy Lệnh | 14h45 T-1  |  \n(1) Nhà Đầu tư gửi tài liệu xác nhận hợp lệ về việc hoàn thành thanh toán mua Đơn Vị Quỹ trước 14h45 ngày làm việc gần nhất trước ngày giao dịch (ngày T-1) và Ngân Hàng Giám Sát nhận được tiền mua Đơn Vị Quỹ trong ngày T-1  \n(2) Thời Điểm Đóng Số Lệnh áp dụng cho việc nộp đầy đủ hồ sơ với Đại Lý Phân Phối.', 'c. Giao dịch muộn và chọn thời điểm giao dịch  \n- Giao Dịch Muộn  \nCác lệnh giao dịch nhận được sau Thời Điểm Đóng Số Lệnh cho Ngày Giao Dịch không được phép thực hiện tại NAV của Ngày Giao Dịch đó. Các giao dịch nhận được sau Thời Điểm Đóng Số Lệnh sẽ được thực hiện tại NAV của Ngày Giao Dịch tiếp theo.  \n- Chọn Thời Điểm Giao Dịch  \nChứng Chỉ Quỹ cũng như Quỹ không được coi là công cụ phục vụ việc giao dịch thường xuyên để tận dụng các biến động ngắn hạn của thị trường. Loại giao dịch này thường được gọi là “chọn thời điểm giao dịch” và có thể gây ra các thiệt hại tiềm tàng hoặc thiệt hại thực tế cho Nhà Đầu Tư.  \nd. Quy trình mua chứng chỉ quỹ  \nNhà Đầu Tư mua Đơn Vị Quỹ cần điền đầy đủ vào phiếu Lệnh Mua có sẵn tại các Điểm Nhận Lệnh.', '## 2.4.2. Thời điểm đóng số lệnh\n(2) Thời Điểm Đóng Số Lệnh áp dụng cho việc nộp đầy đủ hồ sơ với Đại Lý Phân Phối.  \nCác lệnh giao dịch sẽ được xử lý căn cứ vào ngày và giờ Nhà Đầu Tư nộp hồ sơ tại Điểm Nhận Lệnh. Với những lệnh giao dịch hợp lệ nộp cho Đại Lý Phân Phối trước 14h45 (mười bốn giờ bốn lăm) chiều, NAV của Ngày Giao Dịch T sẽ được áp dụng.  \nTrong trường hợp ngày đóng số lệnh rơi vào ngày nghỉ lễ thì việc nhận lệnh sẽ được thực hiện vào ngày làm việc liền trước đó. Công ty quản lý quỹ sẽ thông báo đến nhà đầu tư, Đại lý phân phối và các đơn vị cung cấp dịch vụ có liên quan về lịch giao dịch cụ thể khi các dịp lễ tết xảy ra trên trang thông tin điện tử của công ty và/hoặc bằng thư điện tử.', '(2) Thời Điểm Đóng Số Lệnh áp dụng cho việc nộp đầy đủ hồ sơ với Đại Lý Phân Phối.  \nCác lệnh giao dịch sẽ được xử lý căn cứ vào ngày và giờ Nhà Đầu Tư nộp hồ sơ tại Điểm Nhận Lệnh. Với những lệnh giao dịch hợp lệ nộp cho Đại Lý Phân Phối trước 14h45 (mười bốn giờ bốn lăm) chiều, NAV của Ngày Giao Dịch T sẽ được áp dụng.  \nTrong trường hợp ngày đóng số lệnh rơi vào ngày nghỉ lễ thì việc nhận lệnh sẽ được thực hiện vào ngày làm việc liền trước đó. Công ty quản lý quỹ sẽ thông báo đến nhà đầu tư, Đại lý phân phối và các đơn vị cung cấp dịch vụ có liên quan về lịch giao dịch cụ thể khi các dịp lễ tết xảy ra trên trang thông tin điện tử của công ty và/hoặc bằng thư điện tử.  \nc. Giao dịch muộn và chọn thời điểm giao dịch  \n- Giao Dịch Muộn', 'b) Chọn Thời Điểm Giao Dịch  \nChứng Chỉ Quỹ cũng như Quỹ không được coi là công cụ phục vụ việc giao dịch thường xuyên để tận dụng các biến động ngắn hạn của thị trường. Loại giao dịch này thường được gọi là “chọn thời điểm giao dịch” và có thể gây ra các thiệt hại tiềm tàng hoặc thiệt hại thực tế cho Nhà Đầu Tư.  \n2.4.4. Quy trình mua chứng chỉ quỹ  \na) Hợp đồng mở tài khoản giao dịch chứng khoán và đăng ký giao dịch quỹ mở', '“Ngày Định Giá”  \nLà ngày mà Công ty Quản Lý Quỹ xác định giá trị tài sản ròng của Quỹ theo quy định tại Luật chứng khoán và Điều lệ Quỹ.  \n“Ngày Giao Dịch”  \nlà ngày mà công ty quản lý quỹ, thay mặt quỹ, phát hành và mua lại chứng chỉ quỹ mở từ nhà đầu tư theo cơ chế giao dịch của quỹ.  \n“Thời Điểm Đóng Số Lệnh”  \ncó nghĩa là thời điểm cuối cùng mà Đại Lý Phân Phối có thể nhận lệnh giao dịch Chứng chỉ quỹ từ Nhà đầu tư để thực hiện trong Ngày Giao Dịch Chứng Chỉ Quỹ. Thời điểm đóng số lệnh được quy định tại Điều lệ quỹ, công bố công khai tại Bản cáo bạch, Bản cáo bạch tóm tắt và không được muộn quá thời điểm đóng cửa thị trường của Sở giao dịch chứng khoán tại ngày giao dịch gần nhất trước ngày giao dịch chứng chỉ quỹ.  \n“UBCKNN”  \ncó nghĩa là Ủy Ban Chứng Khoán Nhà Nước Việt Nam.', '## 2.4.3. Giao dịch muộn và chọn thời điểm giao dịch\nCác lệnh giao dịch nhận được sau Thời Điểm Đóng Số Lệnh cho Ngày Giao Dịch không được phép thực hiện tại NAV của Ngày Giao Dịch đó. Các giao dịch nhận được sau Thời Điểm Đóng Số Lệnh sẽ được thực hiện tại NAV của Ngày Giao Dịch tiếp theo.', 'Ngay sau khi các sự kiện này chấm dứt, các giao dịch Đơn Vị Quỹ sẽ được thực hiện trở lại vào Ngày Giao Dịch tiếp theo. Theo luật, thời gian tạm dừng thực hiện các Lệnh Mua và Bán Đơn Vị Quỹ sẽ không quá 90 (chín mươi) ngày kể từ Ngày Giao Dịch gần nhất. Trong trường hợp giao dịch không thể tiếp tục trong khoảng thời gian tạm dừng tối đa nêu trên, thì trong vòng 30 (ba mươi) ngày kể từ ngày kết thúc thời hạn tạm dừng trên, Công Ty Quản Lý Quỹ phải tổ chức họp để lấy ý kiến Đại Hội Nhà Đầu Tư về việc giải thể Quỹ, hoặc tách Quỹ, hoặc tiếp tục kéo dài thời gian tạm dừng giao dịch Chứng chỉ Quỹ. Trong thời hạn triệu tập Đại Hội Nhà Đầu Tư, nếu các nguyên nhân dẫn tới việc tạm dừng giao dịch Chứng Chỉ Quỹ chấm dứt, Công ty Quản Lý Quỹ được hủy bỏ việc triệu tập Đại Hội Nhà Đầu Tư.  \n56', '## f) Lệnh Mua Tối Thiểu\nĐại Lý Phân Phối sẽ xử lý tất cả các Lệnh Bản nhận trước Thời Điểm Đóng Số Lệnh và gửi lệnh giao dịch tổng hợp tới Đại lý Chuyển Nhượng để thực hiện giao dịch cho Ngày Giao Dịch kế tiếp, và đảm bảo các thông tin trong Lệnh Bản đầy đủ và nhất quán và Nhà Đầu Tư có đủ số Đơn Vị Quỹ trong tài khoản để bán. Nhà Đầu tư có thể đặt bán số Chứng Chỉ Quỹ tối đa bằng số lượng Chứng Chỉ Quỹ mà mình sở hữu. Khoản tiền bán ròng sẽ được chuyển trả cho Nhà Đầu Tư. Lệnh Bản không thuộc trường hợp được thực hiện một phần bởi các điều kiện liên quan đến Lệnh Bản một phần như để trong các mục dưới đây sẽ được giao dịch tại NAV tại Ngày Giao Dịch trừ đi Giá dịch vụ Mua lại, giá dịch vụ chuyển tiền và thuế (nếu có), dựa trên ngày giờ nhận Lệnh Bản tại Điểm Nhận Lệnh, theo ngày giờ xác nhận tại Điểm Nhận Lệnh', '## d) Xác Nhận Lệnh Chuyển Nhượng\nNgay sau khi các sự kiện này chấm dứt, các giao dịch Đơn Vị Quỹ sẽ được thực hiện trở lại vào Ngày Giao Dịch tiếp theo. Theo luật, thời gian tạm dừng thực hiện các Lệnh Mua và Bán Đơn Vị Quỹ sẽ không quá 90 (chín mươi) ngày kể từ Ngày Giao Dịch gần nhất. Trong trường hợp giao dịch không thể tiếp tục trong khoảng thời gian tạm dừng tối đa nêu trên, thì trong vòng 30 (ba mươi) ngày kể từ ngày kết thúc thời hạn tạm dừng trên, Công Ty Quản Lý Quỹ phải tổ chức họp để lấy ý kiến Đại Hội Nhà Đầu Tư về việc giải thể Quỹ, hoặc tách Quỹ, hoặc tiếp tục kéo dài thời gian tạm dừng giao dịch Chứng chỉ Quỹ. Trong thời hạn triệu tập Đại Hội Nhà Đầu Tư, nếu các nguyên nhân dẫn tới việc tạm dừng giao dịch Chứng Chỉ Quỹ chấm dứt, Công ty Quản Lý Quỹ được hủy bỏ việc triệu tập Đại Hội Nhà Đầu Tư.', '## e. Quy trình bán chứng chỉ quỹ\nĐại Lý Phân Phối sẽ xử lý tất cả các Lệnh Bản nhận trước Thời Điểm Đóng Số Lệnh và gửi lệnh giao dịch tổng hợp tới Đại lý Chuyển Nhượng để thực hiện giao dịch cho Ngày Giao Dịch kế tiếp, và đảm bảo các thông tin trong Lệnh Bản đầy đủ và nhất quán và Nhà Đầu Tư có đủ số Đơn Vị Quỹ trong tài khoản để bán. Nhà Đầu tư có thể đặt bản số Chứng Chỉ Quỹ tối đa bằng số lượng Chứng Chỉ Quỹ mà mình sở hữu. Khoản tiền bán ròng sẽ được chuyển trả cho Nhà Đầu Tư. Lệnh Bản không thuộc trường hợp được thực hiện một phần bởi các điều kiện liên quan đến Lệnh Bản một phần như để trong các mục dưới đây sẽ được giao dịch tại NAV tại Ngày Giao Dịch trừ đi Giá dịch vụ Mua lại, giá dịch vụ chuyển tiền và thuế (nếu có), dựa trên ngày giờ nhận Lệnh Bản tại Điểm Nhận Lệnh, theo ngày giờ xác nhận tại Điểm Nhận Lệnh', 'Sau khi thực hiện các Lệnh Bán Được Chấp Nhận, số Đơn Vị Quỹ đã bán sẽ được trù ra từ tổng số Đơn Vị Quỹ trong tài khoản của Nhà Đầu Tư và bảng kê mới về số Đơn Vị Quỹ nắm giữ sẽ được gửi đến Nhà Đầu Tư.  \nLệnh Bán thành công của Nhà Đầu Tư hay Đại Lý Ký Danh sẽ được thông báo trong vòng 03 (ba) ngày làm việc sau Ngày Giao Dịch.  \nTrong thời hạn 5 ngày làm việc sau ngày giao dịch Chứng chỉ quỹ, Nhà Đầu tư sẽ nhận được tiền bán chứng chỉ quỹ vào tài khoản mà Nhà Đầu tư đã đăng ký khi thực hiện mua Chứng chỉ quỹ.  \n- **Lệnh Bán Tối Thiểu**  \nLệnh Bán tối thiểu là 10 (mười) Đơn Vị Quỹ. Trường hợp sau khi đặt bán, số lượng chứng chỉ quỹ còn lại nhỏ hơn số lượng bán tối thiểu, Nhà Đầu tư cần đặt bán toàn bộ để giảm số Đơn vị Quỹ nắm giữ về 0 (không).', 'Trong trường hợp Quỹ nhận được số tiền mua thấp hơn lệnh đăng ký mua và không nhận được yêu cầu chuyển trả từ khách hàng, số tiền mua sẽ tiếp tục được giữ lại để chờ yêu cầu giao dịch tiếp theo từ khách hàng.  \nTrong trường hợp Nhà Đầu Tư có nhiều lệnh mua Chứng Chỉ Quỹ cùng một lúc, Lệnh Mua Chứng Chỉ Quỹ sẽ được ưu tiên theo thứ tự đặt lệnh.  \nPhí/giá dịch vụ chuyển tiền (nếu có) được trừ vào số tiền hoàn trả cho Nhà Đầu Tư. Đơn Vị Quỹ sẽ chỉ được ghi nhận vào tài khoản của Nhà Đầu Tư hay của Đại Lý Kỷ Danh sau khi có kết quả giao dịch chứng chỉ quỹ.', 'Trong trường hợp Quỹ nhận được số tiền mua thấp hơn Phiếu lệnh mua và không nhận được yêu cầu chuyển trả từ khách hàng, số tiền mua sẽ tiếp tục được giữ lại để chờ yêu cầu giao dịch tiếp theo từ khách hàng.  \nTrong trường hợp Nhà Đầu Tư có nhiều lệnh mua Chứng Chỉ Quỹ cùng một lúc, Lệnh Mua Chứng Chỉ Quỹ sẽ được ưu tiên theo thứ tự đặt lệnh.  \nPhí/giá dịch vụ chuyển tiền (nếu có) được trừ vào số tiền hoàn trả cho Nhà Đầu Tư. Đơn Vị Quỹ sẽ chỉ được ghi nhận vào tài khoản của Nhà Đầu Tư hay của Đại Lý Ký Danh sau khi có kết quả giao dịch chứng chỉ quỹ.', 'Lệnh Mua thành công của Nhà Đầu Tư hay Đại Lý Kỷ Danh sẽ được thông báo trong vòng 03 (ba) ngày làm việc sau Ngày Giao Dịch, số lượng Đơn Vị Quỹ sẽ được làm tròn xuống đến hai số thập phân sau dấu phẩy. Số Đơn Vị Quỹ lẻ sẽ không ảnh hưởng đến khả năng bán lại Đơn Vị Quỹ của Nhà Đầu Tư.  \n- **Tạm Dừng Thực Hiện Lệnh Mua**  \nNhà Đầu Tư cần lưu ý rằng trong một số trường hợp các Lệnh Mua của Nhà Đầu Tư cùng với tất cả các Lệnh Mua khác có thể bị tạm dừng thực hiện. Các trường hợp này được liệt kê trong mục 2.4.8.  \nTrong trường hợp các giao dịch Đơn Vị Quỹ bị tạm dừng, Lệnh Mua sẽ được thực hiện vào Ngày Giao Dịch đầu tiên sau khi giao dịch được thực hiện trở lại.  \n- **Lệnh Mua Tối Thiểu**  \nMức đầu tư tối thiểu (tính theo giá trị Lệnh Mua) là 10.000 VNĐ (Mười nghìn đồng)', 'Ngày Giao Dịch các kỳ tiếp theo là ngày tròn kỳ kể từ Ngày Giao Dịch đầu tiên. Trường hợp ngày tròn kỳ của các kỳ tiếp theo rơi vào ngày nghỉ (bao gồm cả ngày nghỉ bù), thì ngày Giao Dịch các kỳ tiếp theo sẽ là ngày làm việc ngay sau ngày tròn kỳ. Lệnh cho các Ngày Giao Dịch này sẽ được tạo ra vào ngày làm việc trước Ngày Giao Dịch tương ứng.  \nNhà Đầu Tư cần thanh toán cho khoản đầu tư của Chương Trình ĐTĐK để Ngân Hàng Giám Sát nhận được tiền mua trước Thời điểm Đóng Số Lệnh của Ngày Giao Dịch của các kỳ đầu tư tương ứng.  \nTrường hợp Nhà Đầu Tư không nộp đủ tiền mua vào tài khoản của quỹ trước Thời điểm Đóng Số Lệnh của một Ngày Giao Dịch trong Chương Trình ĐTĐK, lệnh mua chứng chỉ quỹ của kỳ đầu tư đó sẽ không được thực hiện. Số tiền không hợp lệ này sẽ được xử lý như sau:', '# i. Chương trình Đầu tư Định kỳ\nNgày Giao Dịch các kỳ tiếp theo là ngày tròn kỳ kể từ Ngày Giao Dịch đầu tiên. Trường hợp ngày tròn kỳ của các kỳ tiếp theo rơi vào ngày nghỉ (bao gồm cả ngày nghỉ bù), thì ngày Giao Dịch các kỳ tiếp theo sẽ là ngày làm việc ngay sau ngày tròn kỳ. Lệnh cho các Ngày Giao Dịch này sẽ được tạo ra vào ngày làm việc trước Ngày Giao Dịch tương ứng.  \nNhà Đầu Tư cần thanh toán cho khoản đầu tư của Chương Trình ĐTĐK để Ngân Hàng Giám Sát nhận được tiền mua trước Thời điểm Đóng Số Lệnh của Ngày Giao Dịch của các kỳ đầu tư tương ứng.  \nTrường hợp Nhà Đầu Tư không nộp đủ tiền mua vào tài khoản của quỹ trước Thời điểm Đóng Số Lệnh của một Ngày Giao Dịch trong Chương Trình ĐTĐK, lệnh mua chứng chỉ quỹ của kỳ đầu tư đó sẽ không được thực hiện. Số tiền không hợp lệ này sẽ được xử lý như sau:', '## e) Thực Hiện Một Phần Lệnh Bán\nSố lượng Chứng Chỉ Quỹ Nhà Đầu Tư được thực hiện trong trường hợp thực hiện một phần Lệnh Bán cũng áp dụng nguyên tắc của Lệnh Bán tối thiểu nêu trên. Phần lệnh chưa được thực hiện và các lệnh đến sau thời điểm đóng số lệnh sẽ tự động bị hủy. Nhà Đầu Tư có thể thực hiện tiếp các lệnh bán của mình bằng cách đăng ký giao dịch tại ngày giao dịch tiếp theo.', '- Thực hiện các lệnh giao dịch của Nhà Đầu Tư;  \n- Các hoạt động sáp nhập, hợp nhất của các tổ chức phát hành các chứng khoán mà Quỹ đang nắm giữ;  \n- Quỹ mới được cấp phép thành lập hoặc do tách Quỹ, hợp nhất Quỹ, sát nhập Quỹ mà thời gian hoạt động không quá sáu (06) tháng, tính từ ngày được cấp giấy chứng nhận đăng ký lập Quỹ;  \n- Quỹ đang trong thời gian giải thể.  \nTrong trường hợp xảy ra sai lệch so với các hạn mức đầu tư, Công ty Quản Lý Quỹ sẽ điều chỉnh danh mục đầu tư để đáp ứng các hạn mức đầu tư kể trên trong vòng 3 (ba) tháng kể từ ngày mà sai lệch phát sinh.', 'Sau khi thực hiện các Lệnh Bán Được Chấp Nhận, số Đơn Vị Quỹ đã bán sẽ được trừ ra từ tổng số Đơn Vị Quỹ trong tài khoản của Nhà Đầu Tư và bảng kê mới về số Đơn Vị Quỹ nắm giữ sẽ được gửi đến Nhà Đầu Tư. Chi tiết ngày thanh toán tiền mua lại chứng chỉ quỹ sẽ được Công ty Quản Lý Quỹ công bố trên trang web theo từng thời kỳ.', '## 3. Giao dịch chứng chỉ quỹ các lần tiếp theo\n- Ngày giao dịch  \nNhà đầu tư có thể mua, bán, chuyển đổi Quỹ hoặc chuyển nhượng Đơn vị Quỹ vào một trong các Ngày Giao Dịch. Ngày Giao Dịch là các ngày từ Thứ 2 đến Thứ 6 hàng tuần.  \nNgày Giao Dịch sẽ không bao gồm các ngày nghỉ lễ, kể cả nghỉ bù theo quy định của pháp luật.  \nViệc giảm tần suất giao dịch sẽ được Đại Hội Nhà Đầu Tư thông qua và luôn đảm bảo tần suất giao dịch không được ít hơn hai lần trong một tháng.  \n- Giá bán/Giá dịch vụ phát hành và Giá dịch vụ mua lại  \n**Giá bán/Giá dịch vụ phát hành:** Là mức giá Nhà Đầu Tư phải thanh toán để mua một đơn vị quỹ.', '## c) Lệnh Bán Tối Thiểu\nLệnh Bán tối thiểu là 10 (mười) Đơn Vị Quỹ. Trường hợp sau khi đặt bán, số lượng chứng chỉ quỹ còn lại nhỏ hơn số lượng bán tối thiểu, Nhà Đầu tư cần đặt bán toàn bộ để giảm số Đơn vị Quỹ nắm giữ về 0 (không).  \nCông Ty Quản Lý Quỹ có quyền thay đổi các mức bán tối thiểu trong từng thời điểm.  \nNhà Đầu Tư cần lưu ý là trong một số trường hợp Lệnh Bán sẽ không thể thực hiện toàn bộ hoặc Lệnh Bán có thể bị tạm dừng thực hiện.', '## e) Thực Hiện Một Phần Lệnh Bán\nTrong các trường hợp sau, Quỹ chỉ có thể thực hiện một phần Lệnh Bán và Chuyến Đổi Quỹ của Nhà Đầu Tư:  \n- Tổng giá trị của các Lệnh Bán (bao gồm cả Lệnh Bán từ hoạt động Chuyến Đổi Quỹ) trừ đi tổng giá trị của tất cả các Lệnh Mua (bao gồm cả Lệnh Mua từ hoạt động Chuyến Đổi Quỹ) tại Ngày Giao Dịch lớn hơn 10% của giá trị tài sản ròng của Quỹ (NAV); hoặc\n- Việc thực hiện tất cả các lệnh giao dịch của Nhà Đầu Tư tại Ngày Giao Dịch dẫn đến NAV của Quỹ thấp hơn 50.000.000.000 đồng (năm mươi tỷ đồng); hoặc Giá trị phần đơn vị quỹ hoặc số đơn vị quỹ còn lại trên tài khoản của nhà đầu tư thấp hơn giá trị tối thiểu hoặc số lượng đơn vị quỹ tối thiểu để duy trì tài khoản của nhà đầu tư theo quy định tại Điều lệ quỹ và Bán cáo bạch.', 'Trong các trường hợp tạm dừng thực hiện các giao dịch Đơn Vị Quỹ, Lệnh Chuyển Đổi đã nhận sẽ được thực hiện tại NAV tại Ngày Giao Dịch đầu tiên sau khi giao dịch được thực hiện trở lại.  \n**g. Quy trình chuyển nhượng chứng chỉ quỹ**  \n- **Đơn Chuyển Nhượng**  \nNhà Đầu Tư có thể Chuyển Nhượng Đơn Vị Quỹ cho nhà đầu tư khác dưới dạng quà tặng, thừa kế hoặc thực hiện lệnh của toà án. Chuyển Nhượng chỉ được thực hiện dưới dạng số lượng Đơn  \n55']",Thời điểm đóng sổ lệnh là 14h45 ngày T-1 (trước ngày giao dịch).
Giá trị đặt lệnh mua tối thiểu (Minimum Subscription) đối với nhà đầu tư là bao nhiêu?,"Giá trị đặt lệnh mua tối thiểu (Minimum Subscription) đối với nhà đầu tư là 10.000 VNĐ.

Thông tin này được lấy từ trang 35 của tài liệu, cụ thể trong phần bảng giá dịch vụ phát hành:

| Từ trên 9 đến tròn 12 tháng | 0,50% |
| Từ trên 12 tháng trở lên | 0,00% |

(Nguồn: Trang 35)","['## f) Lệnh Mua Tối Thiểu\nMức đầu tư tối thiểu (tính theo giá trị Lệnh Mua) là 10.000 VND (Mười nghìn đồng)  \nKhông có mức giới hạn đầu tư tối đa cho Nhà Đầu Tư. Công Ty Quản Lý Quỹ bảo lưu quyền thay đổi các giới hạn đầu tư trên trong từng thời điểm và sẽ thông báo về các thay đổi này.', 'Mức đầu tư tối thiểu (tính theo giá trị Lệnh Mua) là 10.000 VNĐ (Mười nghìn đồng)  \nKhông có mức giới hạn đầu tư tối đa cho Nhà Đầu Tư. Công Ty Quản Lý Quỹ bảo lưu quyền thay đổi các giới hạn đầu tư trên trong từng thời điểm và sẽ thông báo về các thay đổi này.', '## c) Lệnh Bán Tối Thiểu\nLệnh Bán tối thiểu là 10 (mười) Đơn Vị Quỹ. Trường hợp sau khi đặt bán, số lượng chứng chỉ quỹ còn lại nhỏ hơn số lượng bán tối thiểu, Nhà Đầu tư cần đặt bán toàn bộ để giảm số Đơn vị Quỹ nắm giữ về 0 (không).  \nCông Ty Quản Lý Quỹ có quyền thay đổi các mức bán tối thiểu trong từng thời điểm.  \nNhà Đầu Tư cần lưu ý là trong một số trường hợp Lệnh Bán sẽ không thể thực hiện toàn bộ hoặc Lệnh Bán có thể bị tạm dừng thực hiện.', 'Lệnh Mua thành công của Nhà Đầu Tư hay Đại Lý Kỷ Danh sẽ được thông báo trong vòng 03 (ba) ngày làm việc sau Ngày Giao Dịch, số lượng Đơn Vị Quỹ sẽ được làm tròn xuống đến hai số thập phân sau dấu phẩy. Số Đơn Vị Quỹ lẻ sẽ không ảnh hưởng đến khả năng bán lại Đơn Vị Quỹ của Nhà Đầu Tư.  \n- **Tạm Dừng Thực Hiện Lệnh Mua**  \nNhà Đầu Tư cần lưu ý rằng trong một số trường hợp các Lệnh Mua của Nhà Đầu Tư cùng với tất cả các Lệnh Mua khác có thể bị tạm dừng thực hiện. Các trường hợp này được liệt kê trong mục 2.4.8.  \nTrong trường hợp các giao dịch Đơn Vị Quỹ bị tạm dừng, Lệnh Mua sẽ được thực hiện vào Ngày Giao Dịch đầu tiên sau khi giao dịch được thực hiện trở lại.  \n- **Lệnh Mua Tối Thiểu**  \nMức đầu tư tối thiểu (tính theo giá trị Lệnh Mua) là 10.000 VNĐ (Mười nghìn đồng)', 'Sau khi thực hiện các Lệnh Bán Được Chấp Nhận, số Đơn Vị Quỹ đã bán sẽ được trù ra từ tổng số Đơn Vị Quỹ trong tài khoản của Nhà Đầu Tư và bảng kê mới về số Đơn Vị Quỹ nắm giữ sẽ được gửi đến Nhà Đầu Tư.  \nLệnh Bán thành công của Nhà Đầu Tư hay Đại Lý Ký Danh sẽ được thông báo trong vòng 03 (ba) ngày làm việc sau Ngày Giao Dịch.  \nTrong thời hạn 5 ngày làm việc sau ngày giao dịch Chứng chỉ quỹ, Nhà Đầu tư sẽ nhận được tiền bán chứng chỉ quỹ vào tài khoản mà Nhà Đầu tư đã đăng ký khi thực hiện mua Chứng chỉ quỹ.  \n- **Lệnh Bán Tối Thiểu**  \nLệnh Bán tối thiểu là 10 (mười) Đơn Vị Quỹ. Trường hợp sau khi đặt bán, số lượng chứng chỉ quỹ còn lại nhỏ hơn số lượng bán tối thiểu, Nhà Đầu tư cần đặt bán toàn bộ để giảm số Đơn vị Quỹ nắm giữ về 0 (không).', '## 2.4.6. Quy trình chuyển đổi quỹ\nLệnh Bán chuyển đổi và Lệnh Mua chuyển đổi cũng áp dụng quy định về Lệnh Bán tối thiểu và Mức Đầu tư tối thiểu như nêu trên.', '- Việc thực hiện tất cả các lệnh giao dịch của Nhà Đầu Tư tại Ngày Giao Dịch dẫn đến NAV của Quỹ thấp hơn 50.000.000.000 đồng (năm mươi tỷ đồng); hoặc Giá trị phần đơn vị quỹ hoặc số đơn vị quỹ còn lại trên tài khoản của nhà đầu tư thấp hơn giá trị tối thiểu hoặc số lượng đơn vị quỹ tối thiểu để duy trì tài khoản của nhà đầu tư theo quy định tại Điều lệ quỹ và Bán cáo bạch.\n- Trường hợp thực hiện một phần Lệnh Bán, Lệnh mua, Lệnh Chuyến Đổi Quỹ theo quy định nêu trên, Công ty Quản Lý Quỹ áp dụng nguyên tắc phân phối cùng tỷ lệ: Phần giá trị được thực hiện sẽ được phân bổ cho tất cả nhà đầu tư đăng ký giao dịch theo cùng một tỷ lệ giữa giá trị thực hiện và giá trị đăng ký giao dịch.  \nSố lượng chứng chỉ quỹ được thực hiện trong trường hợp này được tính như sau:', 'Mức đầu tư tối thiểu định kỳ cho chương trình ĐTĐK là 10.000 VNĐ (Mười nghìn đồng).  \nNhà Đầu Tư có thể thay đổi giá trị khoản đầu tư và/hoặc kỳ đầu tư bất cứ lúc nào (nhưng không dưới mức đầu tư tối thiểu) bằng cách thay đổi lệnh thực hiện ĐTĐK với Đại Lý Phân Phối và các lệnh thanh toán với ngân hàng của mình. Nhà Đầu tư đã tham gia chương trình đầu tư định kỳ cũ sẽ được quyền bảo lưu hoặc chuyển đổi sang chương trình đầu tư định kỳ mới.  \nc) Ngày giao dịch và thanh toán cho các khoản đầu tư ĐTĐK  \nNgày Giao Dịch đầu tiên của Chương Trình ĐTĐK do Nhà Đầu tư chọn. Thời điểm cuối cùng để Nhà Đầu Tư đăng ký Chương Trình ĐTĐK là Thời điểm Đóng Số Lệnh của Ngày Giao Dịch đầu tiên mà Nhà Đầu tư lựa chọn.', 'Công Ty Quản Lý Quỹ có quyền thay đổi các mức bán tối thiểu trong từng thời điểm.  \nNhà Đầu Tư cần lưu ý là trong một số trường hợp Lệnh Bán sẽ không thể thực hiện toàn bộ hoặc Lệnh Bán có thể bị tạm dừng thực hiện.  \n- **Số Dư Tài Khoản Tối Thiểu**  \nKhông áp dụng.  \n- **Thực Hiện Một Phần Lệnh Bán**  \nTrong các trường hợp sau, Quỹ chỉ có thể thực hiện một phần Lệnh Bán và Chuyến Đổi Quỹ của Nhà Đầu Tư:  \n- Tổng giá trị của các Lệnh Bán (bao gồm cả Lệnh Bán từ hoạt động Chuyến Đổi Quỹ) trừ đi tổng giá trị của tất cả các Lệnh Mua (bao gồm cả Lệnh Mua từ hoạt động Chuyến Đổi Quỹ) tại Ngày Giao Dịch lớn hơn 10% của giá trị tài sản ròng của Quỹ (NAV); hoặc', '## d) Giá dịch vụ Lưu Ký xử lý hồ sơ\n|  Loại Giá dịch vụ | Mức giá dịch vụ | Tối thiểu/tối đa | Ghi chú  |\n| --- | --- |\n|  Giá dịch vụ lưu ký xử lý hồ sơ  |   |   |   |\n|  Đối với giao dịch cổ phiếu niêm yết/đăng ký giao dịch | 0,03% * giá trị giao dịch | Tối thiểu 100.000 đồng/ngày giao dịch, Tối đa 10.000.000 đồng/ngày giao dịch |   |\n|  Đối với giao dịch trái phiếu niêm yết/đăng ký giao dịch | 0,01% * giá trị giao dịch |   |   |\n|  Đối với các giao dịch mua | 100.000 đồng/giao |  |   |', 'Trong trường hợp Quỹ nhận được số tiền mua thấp hơn lệnh đăng ký mua và không nhận được yêu cầu chuyển trả từ khách hàng, số tiền mua sẽ tiếp tục được giữ lại để chờ yêu cầu giao dịch tiếp theo từ khách hàng.  \nTrong trường hợp Nhà Đầu Tư có nhiều lệnh mua Chứng Chỉ Quỹ cùng một lúc, Lệnh Mua Chứng Chỉ Quỹ sẽ được ưu tiên theo thứ tự đặt lệnh.  \nPhí/giá dịch vụ chuyển tiền (nếu có) được trừ vào số tiền hoàn trả cho Nhà Đầu Tư. Đơn Vị Quỹ sẽ chỉ được ghi nhận vào tài khoản của Nhà Đầu Tư hay của Đại Lý Kỷ Danh sau khi có kết quả giao dịch chứng chỉ quỹ.', '## e) Thực Hiện Một Phần Lệnh Bán\nTrong các trường hợp sau, Quỹ chỉ có thể thực hiện một phần Lệnh Bán và Chuyến Đổi Quỹ của Nhà Đầu Tư:  \n- Tổng giá trị của các Lệnh Bán (bao gồm cả Lệnh Bán từ hoạt động Chuyến Đổi Quỹ) trừ đi tổng giá trị của tất cả các Lệnh Mua (bao gồm cả Lệnh Mua từ hoạt động Chuyến Đổi Quỹ) tại Ngày Giao Dịch lớn hơn 10% của giá trị tài sản ròng của Quỹ (NAV); hoặc\n- Việc thực hiện tất cả các lệnh giao dịch của Nhà Đầu Tư tại Ngày Giao Dịch dẫn đến NAV của Quỹ thấp hơn 50.000.000.000 đồng (năm mươi tỷ đồng); hoặc Giá trị phần đơn vị quỹ hoặc số đơn vị quỹ còn lại trên tài khoản của nhà đầu tư thấp hơn giá trị tối thiểu hoặc số lượng đơn vị quỹ tối thiểu để duy trì tài khoản của nhà đầu tư theo quy định tại Điều lệ quỹ và Bán cáo bạch.', 'Trong trường hợp Quỹ nhận được số tiền mua thấp hơn Phiếu lệnh mua và không nhận được yêu cầu chuyển trả từ khách hàng, số tiền mua sẽ tiếp tục được giữ lại để chờ yêu cầu giao dịch tiếp theo từ khách hàng.  \nTrong trường hợp Nhà Đầu Tư có nhiều lệnh mua Chứng Chỉ Quỹ cùng một lúc, Lệnh Mua Chứng Chỉ Quỹ sẽ được ưu tiên theo thứ tự đặt lệnh.  \nPhí/giá dịch vụ chuyển tiền (nếu có) được trừ vào số tiền hoàn trả cho Nhà Đầu Tư. Đơn Vị Quỹ sẽ chỉ được ghi nhận vào tài khoản của Nhà Đầu Tư hay của Đại Lý Ký Danh sau khi có kết quả giao dịch chứng chỉ quỹ.', '## 3. Giao dịch chứng chỉ quỹ các lần tiếp theo\n- Ngày giao dịch  \nNhà đầu tư có thể mua, bán, chuyển đổi Quỹ hoặc chuyển nhượng Đơn vị Quỹ vào một trong các Ngày Giao Dịch. Ngày Giao Dịch là các ngày từ Thứ 2 đến Thứ 6 hàng tuần.  \nNgày Giao Dịch sẽ không bao gồm các ngày nghỉ lễ, kể cả nghỉ bù theo quy định của pháp luật.  \nViệc giảm tần suất giao dịch sẽ được Đại Hội Nhà Đầu Tư thông qua và luôn đảm bảo tần suất giao dịch không được ít hơn hai lần trong một tháng.  \n- Giá bán/Giá dịch vụ phát hành và Giá dịch vụ mua lại  \n**Giá bán/Giá dịch vụ phát hành:** Là mức giá Nhà Đầu Tư phải thanh toán để mua một đơn vị quỹ.', 'Lệnh Mua thành công của Nhà Đầu Tư hay Đại Lý Ký Danh sẽ được thông báo trong vòng 03 (ba) ngày làm việc từ Ngày Giao Dịch, số lượng Đơn Vị Quỹ sẽ được làm tròn xuống đến hai số thập phân sau dấu phẩy. Số Đơn Vị Quỹ lẻ sẽ không ảnh hưởng đến khả năng bán lại Đơn Vị Quỹ của Nhà Đầu Tư.', '## 3. Giá dịch vụ và thưởng hoạt động\nNhà Đầu Tư được khuyến khích nắm giữ các Đơn Vị Quỹ như một phần của các khoản đầu tư dài hạn và chương trình tiết kiệm hưu trí. Quỹ mở không được thiết kế cho mục đích mua bán ngắn hạn. Việc Nhà Đầu Tư thường xuyên mua đi và bán lại Đơn Vị Quỹ, vốn được thiết kế để đạt được lợi nhuận dài hạn sẽ ảnh hưởng đến mục tiêu lợi nhuận của Nhà Đầu Tư khi đầu tư vào Quỹ cũng như lợi nhuận của Quỹ.  \nGiá dịch vụ Mua lại và các khoản giá dịch vụ ngân hàng và thuế khác (nếu có) sẽ được trừ vào khoản tiền thu được từ bán Đơn Vị Quỹ của Nhà Đầu Tư.', 'Nhà Đầu Tư có thể thanh toán số tiền mua Đơn Vị Quỹ từ tài khoản ngân hàng của mình vào tài khoản của Quỹ để Ngân Hàng Giám Sát nhận được đúng hạn và Đại Lý Phân Phối hoàn thành xử lý việc đăng ký với Đại Lý Chuyển Nhượng. Mọi khoản đầu tư vào Đơn Vị Quỹ đều thực hiện bằng tiền Đồng Việt Nam.  \nTrong trường hợp lệnh mua chứng chỉ quỹ và việc thanh toán cho lệnh mua được thực hiện bởi cá nhân, tổ chức khác không phải nhà đầu tư thì phiếu lệnh và tài liệu xác nhận thanh toán phải nêu rõ tên, số tài khoản và giá trị thanh toán của nhà đầu tư được hưởng lợi.', '|  Từ trên 9 đến tròn 12 tháng | 0,50%  |\n|  Từ trên 12 tháng trở lên | 0,00%  |  \nTrường hợp Nhà Đầu Tư mua Chứng Chỉ Quỹ nhiều lần, mua theo Chương Trình ĐTĐK hoặc dưới hình thức tái đầu tư bằng nguồn cổ tức của Quỹ không phải chịu Giá dịch vụ phát hành, ưu tiên bán được thực hiện theo nguyên tắc các Chứng Chỉ Quỹ mua trước sẽ được bán trước, không phân biệt chứng chỉ quỹ mua theo lệnh mua bình thường hay Chương Trình ĐTĐK hay hình thức tái đầu tư bằng nguồn cổ tức.  \nCông Ty Quản Lý Quỹ có quyền thay đổi Giá dịch vụ Mua lại nhưng không được vượt quá mức quy định của pháp luật. Mức Giá dịch vụ Mua lại mới sẽ được Công Ty Quản Lý Quỹ thông báo chi tiết tại trang thông tin điện tử của Quỹ và tại các địa điểm phân phối của các Đại Lý Phân Phối.', 'Lệnh Chuyển Đổi được đặt bằng số lượng Đơn Vị Quỹ.  \n- **Mức Tối Thiểu Cho Lệnh Chuyển Đổi**  \nLệnh Bản chuyển đổi và Lệnh Mua chuyển đổi cũng áp dụng quy định về Lệnh Bản tối thiểu và Mức Đầu tư tối thiểu như nêu trên.  \n- **Thực Hiện Một Phần Lệnh Chuyển Đổi**  \nNhà Đầu Tư cần lưu ý rằng Lệnh Chuyển Đổi có thể chỉ được thực hiện một phần nếu Lệnh Bản nằm trong Lệnh Chuyển Đổi chỉ được thực hiện một phần. Các trường hợp Lệnh Bản chỉ được thực hiện một phần được quy định chi tiết tại mục 2.4.6. Phần chưa được thực hiện của Lệnh Chuyển Đổi được thực hiện một phần sẽ bị hủy.  \n- **Tạm Dừng Thực Hiện Lệnh Chuyển Đổi**  \nTrong một vài trường hợp Lệnh Chuyển Đổi cùng các lệnh khác có thể bị tạm dừng thực hiện. Các trường hợp được này được nêu tại mục 2.4.6.', '# i. Chương trình Đầu tư Định kỳ\n- **Khoản Tiền Đầu Tư Cho Chương Trình ĐTĐK**  \nKhoản tiền đầu tư cho Chương Trình ĐTĐK là số tiền Nhà Đầu Tư đăng ký mua chứng chỉ quỹ hàng kỳ, tuy nhiên không thấp hơn mức đầu tư tối thiểu.  \nMức đầu tư tối thiểu định kỳ cho chương trình ĐTĐK là 10.000 VNĐ (mười nghìn đồng).  \nNhà Đầu Tư có thể thay đổi kỳ đầu tư bất cứ lúc nào bằng cách thay đổi lệnh thực hiện ĐTĐK với Đại Lý Phân Phối và các lệnh thanh toán với ngân hàng của mình.  \n- **Ngày giao dịch và thanh toán cho các khoản đầu tư ĐTĐK**  \nNgày Giao Dịch đầu tiên của Chương Trình ĐTĐK do Nhà Đầu lựa chọn. Thời điểm cuối cùng để Nhà Đầu Tư đăng ký Chương Trình ĐTĐK là Thời điểm Đóng Số Lệnh của Ngày Giao Dịch đầu tiên mà Nhà Đầu tư lựa chọn.', 'a. Giá dịch vụ Lưu Ký xử lý hồ sơ  \n|  Loại Giá dịch vụ | Mức giá dịch vụ | Tối thiểu/tối đa | Ghi chú  |\n| --- | --- |\n|  Giá dịch vụ lưu ký xử lý hồ sơ  |   |   |   |\n|  Đối với giao dịch cổ phiếu niêm yết/đăng ký giao dịch | 0,03% * giá trị giao dịch | Tối thiểu 100.000 đồng/ngày giao dịch, Tối đa 10.000.000 đồng/ngày giao dịch |   |\n|  Đối với giao dịch trái phiếu niêm yết/đăng ký giao dịch | 0,01% * giá trị giao dịch |   |   |\n|  Đối với các giao dịch mua bán CK OTC và các tài sản khác | 100.000 đồng/giao dịch |  |   |  \nb. Giá dịch vụ Quản Trị Quỹ  \nGiá dịch vụ Quản trị quỹ sẽ là 0,03% NAV/năm và thấp nhất là 15.000.000 đồng/ tháng (chưa bao gồm thuế VAT)  \nCông thức tính giá dịch vụ quản trị quỹ vào mỗi kỳ định giá được xác định như sau:', '|  Số lượng đơn vị quỹ dự kiến phát hành: | 5.000.000 Đơn Vị Quỹ  |\n| --- | --- |\n|  Thời gian phát hành: | Được đề cập trong thông báo phát hành lần đầu ra công chúng  |\n|  Mệnh giá: | 10.000 đồng một Đơn Vị Quỹ  |\n|  Đồng tiền sử dụng và trình bày: | Đồng (VNĐ)  |\n|  Giá phát hành: | 10.000 VNĐ  |\n|  Phương thức phân bổ chứng chỉ quỹ lần đầu | = Tổng số tiền đầu tư ban đầu/ Giá phát hành  |  \nCác Nhà Đầu Tư muốn đầu tư vào Quỹ phải hoàn thành và nộp Đơn Đăng Ký cho Đại Lý Phân Phối theo các quy trình và hướng dẫn trong lần chào bán lần đầu ra công chúng.  \nMức đầu tư đăng ký tối thiểu (tính theo giá trị Lệnh Mua) của Nhà Đầu Tư là 10.000 VNĐ (Mười ngàn Việt Nam đồng)', '## 3. Giá dịch vụ và thưởng hoạt động\nGiá dịch vụ Mua lại cho tất cả các Chương trình được TCC ấn định và công bố bằng văn bản thông báo tại từng thời kỳ nhưng không quá 3,0% (ba phần trăm) giá trị của Lệnh Bán. Thời điểm áp dụng mức giá dịch vụ mới tăng sớm nhất là 60 ngày kể từ ngày Công ty Quản Lý Quỹ công bố về mức giá dịch vụ mới trên trang thông tin điện tử của Công ty.  \nMức giá dịch vụ mua lại của Quỹ như sau:  \n|  Thời gian nắm giữ CCQ | Giá dịch vụ mua lại (% giá trị lệnh bán)  |\n| --- | --- |\n|  0 đến dưới 6 tháng | 1,00%  |', '## e) Thực Hiện Một Phần Lệnh Bán\nSố lượng Chứng Chỉ Quỹ Nhà Đầu Tư được thực hiện trong trường hợp thực hiện một phần Lệnh Bán cũng áp dụng nguyên tắc của Lệnh Bán tối thiểu nêu trên. Phần lệnh chưa được thực hiện và các lệnh đến sau thời điểm đóng số lệnh sẽ tự động bị hủy. Nhà Đầu Tư có thể thực hiện tiếp các lệnh bán của mình bằng cách đăng ký giao dịch tại ngày giao dịch tiếp theo.', 'Nhà Đầu Tư có thể mở nhiều tài khoản tại các Đại lý phân phối khác nhau để cùng giao dịch một loại Chứng chỉ Quỹ. Nhà Đầu Tư cần nộp Hợp đồng và các giấy tờ quy định để mở tài khoản giao dịch tại mỗi Đại Lý Phân Phối mà Nhà Đầu Tư muốn thực hiện giao dịch. Các tài khoản tại các Đại Lý Phân Phối khác nhau của cùng một Nhà Đầu Tư được quản lý độc lập. Do đó, Lệnh Mua lần đầu tối thiểu cũng như số dư tài khoản tối thiểu được áp dụng cho từng Đại Lý Phân Phối. Nhà Đầu Tư chỉ có thể nộp các Phiếu Lệnh Bán, Chuyển Đổi, Chuyển Nhượng, Hủy Lệnh hay thay đổi thông tin tài khoản của tài khoản mở tại một Đại Lý Phân Phối ở bất kỳ Điểm Nhận Lệnh nào của Đại Lý Phân Phối đó.']",Mức đầu tư tối thiểu là 10.000 VNĐ.
Số lượng chứng chỉ quỹ tối thiểu phải bán trong một lệnh bán (Minimum Redemption) là bao nhiêu?,"Theo thông tin từ tài liệu:

- Không có quy định cụ thể về số lượng chứng chỉ quỹ tối thiểu phải bán trong một lệnh bán (Minimum Redemption).
- Tuy nhiên, khi thực hiện một phần lệnh bán, mua hoặc chuyển đổi, Công ty Quản Lý Quỹ áp dụng nguyên tắc phân phối cùng tỷ lệ: Phần giá trị được thực hiện sẽ được phân bổ cho tất cả nhà đầu tư đăng ký giao dịch theo cùng một tỷ lệ giữa giá trị thực hiện và giá trị đăng ký giao dịch.

Thông tin này được lấy từ trang 29 của tài liệu (Nguồn: Trang 29).

Nếu bạn cần thông tin chi tiết hơn về điều kiện cụ thể, vui lòng tham khảo thêm tại các nguồn khác hoặc liên hệ trực tiếp với Công ty Quản Lý Quỹ.","['## c) Lệnh Bán Tối Thiểu\nLệnh Bán tối thiểu là 10 (mười) Đơn Vị Quỹ. Trường hợp sau khi đặt bán, số lượng chứng chỉ quỹ còn lại nhỏ hơn số lượng bán tối thiểu, Nhà Đầu tư cần đặt bán toàn bộ để giảm số Đơn vị Quỹ nắm giữ về 0 (không).  \nCông Ty Quản Lý Quỹ có quyền thay đổi các mức bán tối thiểu trong từng thời điểm.  \nNhà Đầu Tư cần lưu ý là trong một số trường hợp Lệnh Bán sẽ không thể thực hiện toàn bộ hoặc Lệnh Bán có thể bị tạm dừng thực hiện.', 'Sau khi thực hiện các Lệnh Bán Được Chấp Nhận, số Đơn Vị Quỹ đã bán sẽ được trù ra từ tổng số Đơn Vị Quỹ trong tài khoản của Nhà Đầu Tư và bảng kê mới về số Đơn Vị Quỹ nắm giữ sẽ được gửi đến Nhà Đầu Tư.  \nLệnh Bán thành công của Nhà Đầu Tư hay Đại Lý Ký Danh sẽ được thông báo trong vòng 03 (ba) ngày làm việc sau Ngày Giao Dịch.  \nTrong thời hạn 5 ngày làm việc sau ngày giao dịch Chứng chỉ quỹ, Nhà Đầu tư sẽ nhận được tiền bán chứng chỉ quỹ vào tài khoản mà Nhà Đầu tư đã đăng ký khi thực hiện mua Chứng chỉ quỹ.  \n- **Lệnh Bán Tối Thiểu**  \nLệnh Bán tối thiểu là 10 (mười) Đơn Vị Quỹ. Trường hợp sau khi đặt bán, số lượng chứng chỉ quỹ còn lại nhỏ hơn số lượng bán tối thiểu, Nhà Đầu tư cần đặt bán toàn bộ để giảm số Đơn vị Quỹ nắm giữ về 0 (không).', '## f) Lệnh Mua Tối Thiểu\nMức đầu tư tối thiểu (tính theo giá trị Lệnh Mua) là 10.000 VND (Mười nghìn đồng)  \nKhông có mức giới hạn đầu tư tối đa cho Nhà Đầu Tư. Công Ty Quản Lý Quỹ bảo lưu quyền thay đổi các giới hạn đầu tư trên trong từng thời điểm và sẽ thông báo về các thay đổi này.', 'Mức đầu tư tối thiểu (tính theo giá trị Lệnh Mua) là 10.000 VNĐ (Mười nghìn đồng)  \nKhông có mức giới hạn đầu tư tối đa cho Nhà Đầu Tư. Công Ty Quản Lý Quỹ bảo lưu quyền thay đổi các giới hạn đầu tư trên trong từng thời điểm và sẽ thông báo về các thay đổi này.', 'Số lượng chứng chỉ quỹ được thực hiện trong trường hợp này được tính như sau:  \nSố lượng CCQ NĐT được thực hiện = Số lượng CCQ NĐT đăng ký bán * [Tổng số lượng CCQ mà CTQLQ có thể đáp ứng cho lệnh bán của NĐT/Tổng số lượng CCQ đăng ký bán trong kỳ]  \nSố lượng Chứng Chỉ Quỹ Nhà Đầu Tư được thực hiện trong trường hợp thực hiện một phần Lệnh Bán cũng áp dụng nguyên tắc của Lệnh Bán tối thiểu nêu trên. Phần lệnh chưa được thực hiện và các lệnh đến sau thời điểm đóng số lệnh sẽ tự động bị hủy. Nhà Đầu Tư có thể thực hiện tiếp các lệnh bán của mình bằng cách đăng ký giao dịch tại ngày giao dịch tiếp theo.', '## e) Thực Hiện Một Phần Lệnh Bán\nSố lượng Chứng Chỉ Quỹ Nhà Đầu Tư được thực hiện trong trường hợp thực hiện một phần Lệnh Bán cũng áp dụng nguyên tắc của Lệnh Bán tối thiểu nêu trên. Phần lệnh chưa được thực hiện và các lệnh đến sau thời điểm đóng số lệnh sẽ tự động bị hủy. Nhà Đầu Tư có thể thực hiện tiếp các lệnh bán của mình bằng cách đăng ký giao dịch tại ngày giao dịch tiếp theo.', '## 2. Điều lệ Quỹ tóm tắt\nSố lượng chứng chỉ quỹ/tổng chứng chỉ quỹ được phép lưu hành tối đa: không hạn chế.  \nViệc thay đổi giá trị tài sản huy động tối đa hoặc số lượng chứng chỉ quỹ huy động tối đa phải do Đại hội nhà đầu tư quyết định và phải thông báo cho Ủy ban Chứng khoán Nhà nước.', 'Công Ty Quản Lý Quỹ có quyền thay đổi các mức bán tối thiểu trong từng thời điểm.  \nNhà Đầu Tư cần lưu ý là trong một số trường hợp Lệnh Bán sẽ không thể thực hiện toàn bộ hoặc Lệnh Bán có thể bị tạm dừng thực hiện.  \n- **Số Dư Tài Khoản Tối Thiểu**  \nKhông áp dụng.  \n- **Thực Hiện Một Phần Lệnh Bán**  \nTrong các trường hợp sau, Quỹ chỉ có thể thực hiện một phần Lệnh Bán và Chuyến Đổi Quỹ của Nhà Đầu Tư:  \n- Tổng giá trị của các Lệnh Bán (bao gồm cả Lệnh Bán từ hoạt động Chuyến Đổi Quỹ) trừ đi tổng giá trị của tất cả các Lệnh Mua (bao gồm cả Lệnh Mua từ hoạt động Chuyến Đổi Quỹ) tại Ngày Giao Dịch lớn hơn 10% của giá trị tài sản ròng của Quỹ (NAV); hoặc', 'Lệnh Mua thành công của Nhà Đầu Tư hay Đại Lý Kỷ Danh sẽ được thông báo trong vòng 03 (ba) ngày làm việc sau Ngày Giao Dịch, số lượng Đơn Vị Quỹ sẽ được làm tròn xuống đến hai số thập phân sau dấu phẩy. Số Đơn Vị Quỹ lẻ sẽ không ảnh hưởng đến khả năng bán lại Đơn Vị Quỹ của Nhà Đầu Tư.  \n- **Tạm Dừng Thực Hiện Lệnh Mua**  \nNhà Đầu Tư cần lưu ý rằng trong một số trường hợp các Lệnh Mua của Nhà Đầu Tư cùng với tất cả các Lệnh Mua khác có thể bị tạm dừng thực hiện. Các trường hợp này được liệt kê trong mục 2.4.8.  \nTrong trường hợp các giao dịch Đơn Vị Quỹ bị tạm dừng, Lệnh Mua sẽ được thực hiện vào Ngày Giao Dịch đầu tiên sau khi giao dịch được thực hiện trở lại.  \n- **Lệnh Mua Tối Thiểu**  \nMức đầu tư tối thiểu (tính theo giá trị Lệnh Mua) là 10.000 VNĐ (Mười nghìn đồng)', '## 2.4.6. Quy trình chuyển đổi quỹ\nLệnh Bán chuyển đổi và Lệnh Mua chuyển đổi cũng áp dụng quy định về Lệnh Bán tối thiểu và Mức Đầu tư tối thiểu như nêu trên.', '|  Số lượng đơn vị quỹ dự kiến phát hành: | 5.000.000 Đơn Vị Quỹ  |\n| --- | --- |\n|  Thời gian phát hành: | Được đề cập trong thông báo phát hành lần đầu ra công chúng  |\n|  Mệnh giá: | 10.000 đồng một Đơn Vị Quỹ  |\n|  Đồng tiền sử dụng và trình bày: | Đồng (VNĐ)  |\n|  Giá phát hành: | 10.000 VNĐ  |\n|  Phương thức phân bổ chứng chỉ quỹ lần đầu | = Tổng số tiền đầu tư ban đầu/ Giá phát hành  |  \nCác Nhà Đầu Tư muốn đầu tư vào Quỹ phải hoàn thành và nộp Đơn Đăng Ký cho Đại Lý Phân Phối theo các quy trình và hướng dẫn trong lần chào bán lần đầu ra công chúng.  \nMức đầu tư đăng ký tối thiểu (tính theo giá trị Lệnh Mua) của Nhà Đầu Tư là 10.000 VNĐ (Mười ngàn Việt Nam đồng)', 'Trong trường hợp Quỹ nhận được số tiền mua thấp hơn lệnh đăng ký mua và không nhận được yêu cầu chuyển trả từ khách hàng, số tiền mua sẽ tiếp tục được giữ lại để chờ yêu cầu giao dịch tiếp theo từ khách hàng.  \nTrong trường hợp Nhà Đầu Tư có nhiều lệnh mua Chứng Chỉ Quỹ cùng một lúc, Lệnh Mua Chứng Chỉ Quỹ sẽ được ưu tiên theo thứ tự đặt lệnh.  \nPhí/giá dịch vụ chuyển tiền (nếu có) được trừ vào số tiền hoàn trả cho Nhà Đầu Tư. Đơn Vị Quỹ sẽ chỉ được ghi nhận vào tài khoản của Nhà Đầu Tư hay của Đại Lý Kỷ Danh sau khi có kết quả giao dịch chứng chỉ quỹ.', 'Trong trường hợp Quỹ nhận được số tiền mua thấp hơn Phiếu lệnh mua và không nhận được yêu cầu chuyển trả từ khách hàng, số tiền mua sẽ tiếp tục được giữ lại để chờ yêu cầu giao dịch tiếp theo từ khách hàng.  \nTrong trường hợp Nhà Đầu Tư có nhiều lệnh mua Chứng Chỉ Quỹ cùng một lúc, Lệnh Mua Chứng Chỉ Quỹ sẽ được ưu tiên theo thứ tự đặt lệnh.  \nPhí/giá dịch vụ chuyển tiền (nếu có) được trừ vào số tiền hoàn trả cho Nhà Đầu Tư. Đơn Vị Quỹ sẽ chỉ được ghi nhận vào tài khoản của Nhà Đầu Tư hay của Đại Lý Ký Danh sau khi có kết quả giao dịch chứng chỉ quỹ.', '- Việc thực hiện tất cả các lệnh giao dịch của Nhà Đầu Tư tại Ngày Giao Dịch dẫn đến NAV của Quỹ thấp hơn 50.000.000.000 đồng (năm mươi tỷ đồng); hoặc Giá trị phần đơn vị quỹ hoặc số đơn vị quỹ còn lại trên tài khoản của nhà đầu tư thấp hơn giá trị tối thiểu hoặc số lượng đơn vị quỹ tối thiểu để duy trì tài khoản của nhà đầu tư theo quy định tại Điều lệ quỹ và Bán cáo bạch.\n- Trường hợp thực hiện một phần Lệnh Bán, Lệnh mua, Lệnh Chuyến Đổi Quỹ theo quy định nêu trên, Công ty Quản Lý Quỹ áp dụng nguyên tắc phân phối cùng tỷ lệ: Phần giá trị được thực hiện sẽ được phân bổ cho tất cả nhà đầu tư đăng ký giao dịch theo cùng một tỷ lệ giữa giá trị thực hiện và giá trị đăng ký giao dịch.  \nSố lượng chứng chỉ quỹ được thực hiện trong trường hợp này được tính như sau:', '## e) Thực Hiện Một Phần Lệnh Bán\nTrong các trường hợp sau, Quỹ chỉ có thể thực hiện một phần Lệnh Bán và Chuyến Đổi Quỹ của Nhà Đầu Tư:  \n- Tổng giá trị của các Lệnh Bán (bao gồm cả Lệnh Bán từ hoạt động Chuyến Đổi Quỹ) trừ đi tổng giá trị của tất cả các Lệnh Mua (bao gồm cả Lệnh Mua từ hoạt động Chuyến Đổi Quỹ) tại Ngày Giao Dịch lớn hơn 10% của giá trị tài sản ròng của Quỹ (NAV); hoặc\n- Việc thực hiện tất cả các lệnh giao dịch của Nhà Đầu Tư tại Ngày Giao Dịch dẫn đến NAV của Quỹ thấp hơn 50.000.000.000 đồng (năm mươi tỷ đồng); hoặc Giá trị phần đơn vị quỹ hoặc số đơn vị quỹ còn lại trên tài khoản của nhà đầu tư thấp hơn giá trị tối thiểu hoặc số lượng đơn vị quỹ tối thiểu để duy trì tài khoản của nhà đầu tư theo quy định tại Điều lệ quỹ và Bán cáo bạch.', 'Sau khi thực hiện các Lệnh Bán Được Chấp Nhận, số Đơn Vị Quỹ đã bán sẽ được trừ ra từ tổng số Đơn Vị Quỹ trong tài khoản của Nhà Đầu Tư và bảng kê mới về số Đơn Vị Quỹ nắm giữ sẽ được gửi đến Nhà Đầu Tư. Chi tiết ngày thanh toán tiền mua lại chứng chỉ quỹ sẽ được Công ty Quản Lý Quỹ công bố trên trang web theo từng thời kỳ.', 'Lệnh Chuyển Đổi được đặt bằng số lượng Đơn Vị Quỹ.  \n- **Mức Tối Thiểu Cho Lệnh Chuyển Đổi**  \nLệnh Bản chuyển đổi và Lệnh Mua chuyển đổi cũng áp dụng quy định về Lệnh Bản tối thiểu và Mức Đầu tư tối thiểu như nêu trên.  \n- **Thực Hiện Một Phần Lệnh Chuyển Đổi**  \nNhà Đầu Tư cần lưu ý rằng Lệnh Chuyển Đổi có thể chỉ được thực hiện một phần nếu Lệnh Bản nằm trong Lệnh Chuyển Đổi chỉ được thực hiện một phần. Các trường hợp Lệnh Bản chỉ được thực hiện một phần được quy định chi tiết tại mục 2.4.6. Phần chưa được thực hiện của Lệnh Chuyển Đổi được thực hiện một phần sẽ bị hủy.  \n- **Tạm Dừng Thực Hiện Lệnh Chuyển Đổi**  \nTrong một vài trường hợp Lệnh Chuyển Đổi cùng các lệnh khác có thể bị tạm dừng thực hiện. Các trường hợp được này được nêu tại mục 2.4.6.', '## Lĩnh vực được phép đầu tư\nđ) Cổ phiếu chào bán lần đầu ra công chúng, trái phiếu chào bán ra công chúng; trái phiếu doanh nghiệp phát hành riêng lẻ bởi tổ chức niêm yết có bảo lãnh thanh toán của tổ chức tín dụng hoặc cam kết mua lại của tổ chức phát hành tối thiểu 1 lần trong 12 tháng và mỗi lần cam kết mua lại tối thiểu 30% giá trị đợt phát hành;  \ne) Chứng khoán phải sinh niêm yết giao dịch tại Sở giao dịch chứng khoán và chỉ nhằm mục tiêu phòng ngừa rủi ro cho chứng khoán cơ sở mà quỹ đang nắm giữ;  \ng) Quyền phát sinh gắn liền với chứng khoán mà quỹ đang nắm giữ.  \nViệc đầu tư vào các tài sản quy định tại điểm đ khoản 2.2.3 Điều này phải đáp ứng các điều kiện sau:  \n- Có quy định tại Điều lệ quỹ và Bản cáo bạch;', '|  Từ trên 9 đến tròn 12 tháng | 0,50%  |\n|  Từ trên 12 tháng trở lên | 0,00%  |  \nTrường hợp Nhà Đầu Tư mua Chứng Chỉ Quỹ nhiều lần, mua theo Chương Trình ĐTĐK hoặc dưới hình thức tái đầu tư bằng nguồn cổ tức của Quỹ không phải chịu Giá dịch vụ phát hành, ưu tiên bán được thực hiện theo nguyên tắc các Chứng Chỉ Quỹ mua trước sẽ được bán trước, không phân biệt chứng chỉ quỹ mua theo lệnh mua bình thường hay Chương Trình ĐTĐK hay hình thức tái đầu tư bằng nguồn cổ tức.  \nCông Ty Quản Lý Quỹ có quyền thay đổi Giá dịch vụ Mua lại nhưng không được vượt quá mức quy định của pháp luật. Mức Giá dịch vụ Mua lại mới sẽ được Công Ty Quản Lý Quỹ thông báo chi tiết tại trang thông tin điện tử của Quỹ và tại các địa điểm phân phối của các Đại Lý Phân Phối.', 'Theo quy định hiện hành, nếu Quỹ không thể huy động được ít nhất là 50.000.000.000 VNĐ (năm mươi tỷ đồng) hoặc có ít hơn 100 (một trăm) Nhà Đầu Tư không chuyên nghiệp vào thời điểm kết thúc IPO hoặc thời gian được gia hạn (nếu có), UBCKNN sẽ không cấp Giấy chứng nhận đăng ký lập quỹ cho Quỹ. Trong trường hợp này, tất cả số tiền nhận được từ các Nhà Đầu Tư trong thời gian IPO cùng với lãi phát sinh nếu có sẽ được hoàn trả vào tài khoản đăng ký của Nhà Đầu Tư trong vòng 15 (mười lăm ngày) kể từ ngày kết thúc đợt IPO. Công Ty Quản Lý Quỹ sẽ chịu tất cả các chi giá dịch vụ phát sinh từ đợt IPO trong trường hợp này.  \n49', 'Vị Quỹ, bao gồm cả phần lẻ của Đơn Vị Quỹ. Nhà Đầu Tư chuyển nhượng cần điền Lệnh Chuyển Nhượng Đơn Vị Quỹ với điều kiện là số lượng Chuyển Nhượng phải bằng hoặc lớn hơn số dư tối thiểu khi mở tài khoản nếu người nhận chuyển nhượng chưa phải là Nhà Đầu Tư.  \n- **Xử Lý Các Đơn Chuyển Nhượng**', '## e) Thực Hiện Một Phần Lệnh Bán\n- Trường hợp thực hiện một phần Lệnh Bán, Lệnh mua, Lệnh Chuyến Đổi Quỹ theo quy định nêu trên, Công ty Quản Lý Quỹ áp dụng nguyên tắc phân phối cùng tỷ lệ: Phần giá trị được thực hiện sẽ được phân bổ cho tất cả nhà đầu tư đăng ký giao dịch theo cùng một tỷ lệ giữa giá trị thực hiện và giá trị đăng ký giao dịch.  \nSố lượng chứng chỉ quỹ được thực hiện trong trường hợp này được tính như sau:  \nSố lượng CCQ NĐT được thực hiện = Số lượng CCQ NĐT đăng ký bán * [Tổng số lượng CCQ mà CTQLQ có thể đáp ứng cho lệnh bán của NĐT/Tổng số lượng CCQ đăng ký bán trong kỳ]', '|  Từ tròn 6 đến tròn 9 tháng | 0,75%  |\n| --- | --- |\n|  Từ trên 9 đến tròn 12 tháng | 0,50%  |\n|  Từ trên 12 tháng trở lên | 0,00%  |  \nTrường hợp Nhà Đầu Tư mua Chứng Chỉ Quỹ nhiều lần, mua theo Chương Trình ĐTĐK hoặc dưới hình thức tái đầu tư bằng nguồn cổ tức của Quỹ không phải chịu Giá dịch vụ phát hành, ưu tiên bán được thực hiện theo nguyên tắc các Chứng Chỉ Quỹ mua trước sẽ được bán trước, không phân biệt chứng chỉ quỹ mua theo lệnh mua bình thường hay Chương Trình ĐTĐK hay hình thức tái đầu tư bằng nguồn cổ tức.', '## Lĩnh vực được phép đầu tư\n- Có quy định tại Điều lệ quỹ và Bản cáo bạch;\n- Đã được Ban đại diện quỹ chấp thuận bằng văn bản về loại, mã chứng khoán, số lượng, giá trị giao dịch, thời điểm thực hiện;\n- Có đủ tài liệu chứng minh về bảo lãnh thanh toán hoặc tài liệu về cam kết mua lại của tổ chức phát hành.', '## f) Lệnh Mua Tối Thiểu\n#### a) Phiếu Lệnh Bản  \nNhà Đầu Tư có thể bán Đơn Vị Quỹ vào bất kỳ Ngày Giao Dịch nào bằng cách nộp Lệnh Bản tới một Điểm Nhận Lệnh bất kỳ trước Thời Điểm Đóng Số Lệnh cho Ngày Giao Dịch đó. Phiếu Lệnh Bản được đính kèm theo Đơn Đăng Ký hoặc có sẵn tại các Điểm Nhận Lệnh. Tất cả các Phiếu Lệnh Bản phải được ký tên đầy đủ.  \n#### b) Quy Trình Xử lý Lệnh Bản  \nNhà Đầu Tư có thể đặt Lệnh Bản số Đơn Vị Quỹ muốn bán, lẻ đến 2 số thập phân và đảm bảo số lượng chứng chỉ quỹ còn lại sau khi đặt bán không nhỏ hơn số lượng bán tối thiểu.']",Lệnh Bán tối thiểu là 10 (mười) Đơn Vị Quỹ.
"Trong trường hợp lệnh bán bị thực hiện một phần, nhà đầu tư cần làm gì nếu số lượng CCQ còn lại nhỏ hơn số lượng tối thiểu?","Nếu số lượng Chứng Chỉ Quỹ (CCQ) còn lại sau khi lệnh bán được thực hiện một phần nhỏ hơn số lượng bán tối thiểu, nhà đầu tư cần thực hiện việc mua thêm để đảm bảo số lượng CCQ trong tài khoản không nhỏ hơn số lượng bán tối thiểu.

Thông tin này được lấy từ trang 57 của tài liệu.","['## c) Lệnh Bán Tối Thiểu\nLệnh Bán tối thiểu là 10 (mười) Đơn Vị Quỹ. Trường hợp sau khi đặt bán, số lượng chứng chỉ quỹ còn lại nhỏ hơn số lượng bán tối thiểu, Nhà Đầu tư cần đặt bán toàn bộ để giảm số Đơn vị Quỹ nắm giữ về 0 (không).  \nCông Ty Quản Lý Quỹ có quyền thay đổi các mức bán tối thiểu trong từng thời điểm.  \nNhà Đầu Tư cần lưu ý là trong một số trường hợp Lệnh Bán sẽ không thể thực hiện toàn bộ hoặc Lệnh Bán có thể bị tạm dừng thực hiện.', '## e) Thực Hiện Một Phần Lệnh Bán\nSố lượng Chứng Chỉ Quỹ Nhà Đầu Tư được thực hiện trong trường hợp thực hiện một phần Lệnh Bán cũng áp dụng nguyên tắc của Lệnh Bán tối thiểu nêu trên. Phần lệnh chưa được thực hiện và các lệnh đến sau thời điểm đóng số lệnh sẽ tự động bị hủy. Nhà Đầu Tư có thể thực hiện tiếp các lệnh bán của mình bằng cách đăng ký giao dịch tại ngày giao dịch tiếp theo.', 'Số lượng chứng chỉ quỹ được thực hiện trong trường hợp này được tính như sau:  \nSố lượng CCQ NĐT được thực hiện = Số lượng CCQ NĐT đăng ký bán * [Tổng số lượng CCQ mà CTQLQ có thể đáp ứng cho lệnh bán của NĐT/Tổng số lượng CCQ đăng ký bán trong kỳ]  \nSố lượng Chứng Chỉ Quỹ Nhà Đầu Tư được thực hiện trong trường hợp thực hiện một phần Lệnh Bán cũng áp dụng nguyên tắc của Lệnh Bán tối thiểu nêu trên. Phần lệnh chưa được thực hiện và các lệnh đến sau thời điểm đóng số lệnh sẽ tự động bị hủy. Nhà Đầu Tư có thể thực hiện tiếp các lệnh bán của mình bằng cách đăng ký giao dịch tại ngày giao dịch tiếp theo.', 'Công Ty Quản Lý Quỹ có quyền thay đổi các mức bán tối thiểu trong từng thời điểm.  \nNhà Đầu Tư cần lưu ý là trong một số trường hợp Lệnh Bán sẽ không thể thực hiện toàn bộ hoặc Lệnh Bán có thể bị tạm dừng thực hiện.  \n- **Số Dư Tài Khoản Tối Thiểu**  \nKhông áp dụng.  \n- **Thực Hiện Một Phần Lệnh Bán**  \nTrong các trường hợp sau, Quỹ chỉ có thể thực hiện một phần Lệnh Bán và Chuyến Đổi Quỹ của Nhà Đầu Tư:  \n- Tổng giá trị của các Lệnh Bán (bao gồm cả Lệnh Bán từ hoạt động Chuyến Đổi Quỹ) trừ đi tổng giá trị của tất cả các Lệnh Mua (bao gồm cả Lệnh Mua từ hoạt động Chuyến Đổi Quỹ) tại Ngày Giao Dịch lớn hơn 10% của giá trị tài sản ròng của Quỹ (NAV); hoặc', 'Sau khi thực hiện các Lệnh Bán Được Chấp Nhận, số Đơn Vị Quỹ đã bán sẽ được trù ra từ tổng số Đơn Vị Quỹ trong tài khoản của Nhà Đầu Tư và bảng kê mới về số Đơn Vị Quỹ nắm giữ sẽ được gửi đến Nhà Đầu Tư.  \nLệnh Bán thành công của Nhà Đầu Tư hay Đại Lý Ký Danh sẽ được thông báo trong vòng 03 (ba) ngày làm việc sau Ngày Giao Dịch.  \nTrong thời hạn 5 ngày làm việc sau ngày giao dịch Chứng chỉ quỹ, Nhà Đầu tư sẽ nhận được tiền bán chứng chỉ quỹ vào tài khoản mà Nhà Đầu tư đã đăng ký khi thực hiện mua Chứng chỉ quỹ.  \n- **Lệnh Bán Tối Thiểu**  \nLệnh Bán tối thiểu là 10 (mười) Đơn Vị Quỹ. Trường hợp sau khi đặt bán, số lượng chứng chỉ quỹ còn lại nhỏ hơn số lượng bán tối thiểu, Nhà Đầu tư cần đặt bán toàn bộ để giảm số Đơn vị Quỹ nắm giữ về 0 (không).', '## e) Thực Hiện Một Phần Lệnh Bán\n- Trường hợp thực hiện một phần Lệnh Bán, Lệnh mua, Lệnh Chuyến Đổi Quỹ theo quy định nêu trên, Công ty Quản Lý Quỹ áp dụng nguyên tắc phân phối cùng tỷ lệ: Phần giá trị được thực hiện sẽ được phân bổ cho tất cả nhà đầu tư đăng ký giao dịch theo cùng một tỷ lệ giữa giá trị thực hiện và giá trị đăng ký giao dịch.  \nSố lượng chứng chỉ quỹ được thực hiện trong trường hợp này được tính như sau:  \nSố lượng CCQ NĐT được thực hiện = Số lượng CCQ NĐT đăng ký bán * [Tổng số lượng CCQ mà CTQLQ có thể đáp ứng cho lệnh bán của NĐT/Tổng số lượng CCQ đăng ký bán trong kỳ]', '## 2.4.6. Quy trình chuyển đổi quỹ\nNhà Đầu Tư cần lưu ý rằng Lệnh Chuyển Đổi có thể chỉ được thực hiện một phần nếu Lệnh Bán nằm trong Lệnh Chuyển Đổi chỉ được thực hiện một phần. Các trường hợp Lệnh Bán chỉ được thực hiện một phần được quy định chi tiết tại mục 2.4.5.e. Phần chưa được thực hiện của Lệnh Chuyển Đổi được thực hiện một phần sẽ bị hủy.', '## e) Thực Hiện Một Phần Lệnh Bán\nTrong các trường hợp sau, Quỹ chỉ có thể thực hiện một phần Lệnh Bán và Chuyến Đổi Quỹ của Nhà Đầu Tư:  \n- Tổng giá trị của các Lệnh Bán (bao gồm cả Lệnh Bán từ hoạt động Chuyến Đổi Quỹ) trừ đi tổng giá trị của tất cả các Lệnh Mua (bao gồm cả Lệnh Mua từ hoạt động Chuyến Đổi Quỹ) tại Ngày Giao Dịch lớn hơn 10% của giá trị tài sản ròng của Quỹ (NAV); hoặc\n- Việc thực hiện tất cả các lệnh giao dịch của Nhà Đầu Tư tại Ngày Giao Dịch dẫn đến NAV của Quỹ thấp hơn 50.000.000.000 đồng (năm mươi tỷ đồng); hoặc Giá trị phần đơn vị quỹ hoặc số đơn vị quỹ còn lại trên tài khoản của nhà đầu tư thấp hơn giá trị tối thiểu hoặc số lượng đơn vị quỹ tối thiểu để duy trì tài khoản của nhà đầu tư theo quy định tại Điều lệ quỹ và Bán cáo bạch.', '## f) Tạm dừng thực hiện Lệnh Bán\nNhà Đầu Tư cần lưu ý rằng trong một số trường hợp, các Lệnh Bán cùng với tất cả các lệnh khác có thể bị tạm dừng thực hiện. Các trường hợp này được quy định chi tiết tại mục 2.4.8.  \nTrong trường hợp các lệnh giao dịch Đơn Vị Quỹ bị tạm dừng thực hiện, Lệnh Bán đã nhận sẽ được thực hiện tại NAV tại Ngày Giao Dịch đầu tiên sau khi giao dịch được thực hiện trở lại.  \n29', 'Trong trường hợp Quỹ nhận được số tiền mua thấp hơn Phiếu lệnh mua và không nhận được yêu cầu chuyển trả từ khách hàng, số tiền mua sẽ tiếp tục được giữ lại để chờ yêu cầu giao dịch tiếp theo từ khách hàng.  \nTrong trường hợp Nhà Đầu Tư có nhiều lệnh mua Chứng Chỉ Quỹ cùng một lúc, Lệnh Mua Chứng Chỉ Quỹ sẽ được ưu tiên theo thứ tự đặt lệnh.  \nPhí/giá dịch vụ chuyển tiền (nếu có) được trừ vào số tiền hoàn trả cho Nhà Đầu Tư. Đơn Vị Quỹ sẽ chỉ được ghi nhận vào tài khoản của Nhà Đầu Tư hay của Đại Lý Ký Danh sau khi có kết quả giao dịch chứng chỉ quỹ.', 'Trong trường hợp Quỹ nhận được số tiền mua thấp hơn lệnh đăng ký mua và không nhận được yêu cầu chuyển trả từ khách hàng, số tiền mua sẽ tiếp tục được giữ lại để chờ yêu cầu giao dịch tiếp theo từ khách hàng.  \nTrong trường hợp Nhà Đầu Tư có nhiều lệnh mua Chứng Chỉ Quỹ cùng một lúc, Lệnh Mua Chứng Chỉ Quỹ sẽ được ưu tiên theo thứ tự đặt lệnh.  \nPhí/giá dịch vụ chuyển tiền (nếu có) được trừ vào số tiền hoàn trả cho Nhà Đầu Tư. Đơn Vị Quỹ sẽ chỉ được ghi nhận vào tài khoản của Nhà Đầu Tư hay của Đại Lý Kỷ Danh sau khi có kết quả giao dịch chứng chỉ quỹ.', '- Việc thực hiện tất cả các lệnh giao dịch của Nhà Đầu Tư tại Ngày Giao Dịch dẫn đến NAV của Quỹ thấp hơn 50.000.000.000 đồng (năm mươi tỷ đồng); hoặc Giá trị phần đơn vị quỹ hoặc số đơn vị quỹ còn lại trên tài khoản của nhà đầu tư thấp hơn giá trị tối thiểu hoặc số lượng đơn vị quỹ tối thiểu để duy trì tài khoản của nhà đầu tư theo quy định tại Điều lệ quỹ và Bán cáo bạch.\n- Trường hợp thực hiện một phần Lệnh Bán, Lệnh mua, Lệnh Chuyến Đổi Quỹ theo quy định nêu trên, Công ty Quản Lý Quỹ áp dụng nguyên tắc phân phối cùng tỷ lệ: Phần giá trị được thực hiện sẽ được phân bổ cho tất cả nhà đầu tư đăng ký giao dịch theo cùng một tỷ lệ giữa giá trị thực hiện và giá trị đăng ký giao dịch.  \nSố lượng chứng chỉ quỹ được thực hiện trong trường hợp này được tính như sau:', 'Lệnh Mua thành công của Nhà Đầu Tư hay Đại Lý Kỷ Danh sẽ được thông báo trong vòng 03 (ba) ngày làm việc sau Ngày Giao Dịch, số lượng Đơn Vị Quỹ sẽ được làm tròn xuống đến hai số thập phân sau dấu phẩy. Số Đơn Vị Quỹ lẻ sẽ không ảnh hưởng đến khả năng bán lại Đơn Vị Quỹ của Nhà Đầu Tư.  \n- **Tạm Dừng Thực Hiện Lệnh Mua**  \nNhà Đầu Tư cần lưu ý rằng trong một số trường hợp các Lệnh Mua của Nhà Đầu Tư cùng với tất cả các Lệnh Mua khác có thể bị tạm dừng thực hiện. Các trường hợp này được liệt kê trong mục 2.4.8.  \nTrong trường hợp các giao dịch Đơn Vị Quỹ bị tạm dừng, Lệnh Mua sẽ được thực hiện vào Ngày Giao Dịch đầu tiên sau khi giao dịch được thực hiện trở lại.  \n- **Lệnh Mua Tối Thiểu**  \nMức đầu tư tối thiểu (tính theo giá trị Lệnh Mua) là 10.000 VNĐ (Mười nghìn đồng)', '## e) Tạm Dừng Thực Hiện Lệnh Mua\nNhà Đầu Tư cần lưu ý rằng trong một số trường hợp các Lệnh Mua của Nhà Đầu Tư cùng với tất cả các Lệnh Mua khác có thể bị tạm dừng thực hiện. Các trường hợp này được liệt kê trong mục 2.4.8 dưới đây.  \nTrong trường hợp các giao dịch Đơn Vị Quỹ bị tạm dừng, Lệnh Mua sẽ được thực hiện vào Ngày Giao Dịch đầu tiên sau khi giao dịch được thực hiện trở lại.', '## f) Lệnh Mua Tối Thiểu\nĐại Lý Phân Phối sẽ xử lý tất cả các Lệnh Bản nhận trước Thời Điểm Đóng Số Lệnh và gửi lệnh giao dịch tổng hợp tới Đại lý Chuyển Nhượng để thực hiện giao dịch cho Ngày Giao Dịch kế tiếp, và đảm bảo các thông tin trong Lệnh Bản đầy đủ và nhất quán và Nhà Đầu Tư có đủ số Đơn Vị Quỹ trong tài khoản để bán. Nhà Đầu tư có thể đặt bán số Chứng Chỉ Quỹ tối đa bằng số lượng Chứng Chỉ Quỹ mà mình sở hữu. Khoản tiền bán ròng sẽ được chuyển trả cho Nhà Đầu Tư. Lệnh Bản không thuộc trường hợp được thực hiện một phần bởi các điều kiện liên quan đến Lệnh Bản một phần như để trong các mục dưới đây sẽ được giao dịch tại NAV tại Ngày Giao Dịch trừ đi Giá dịch vụ Mua lại, giá dịch vụ chuyển tiền và thuế (nếu có), dựa trên ngày giờ nhận Lệnh Bản tại Điểm Nhận Lệnh, theo ngày giờ xác nhận tại Điểm Nhận Lệnh', 'Lệnh Chuyển Đổi được đặt bằng số lượng Đơn Vị Quỹ.  \n- **Mức Tối Thiểu Cho Lệnh Chuyển Đổi**  \nLệnh Bản chuyển đổi và Lệnh Mua chuyển đổi cũng áp dụng quy định về Lệnh Bản tối thiểu và Mức Đầu tư tối thiểu như nêu trên.  \n- **Thực Hiện Một Phần Lệnh Chuyển Đổi**  \nNhà Đầu Tư cần lưu ý rằng Lệnh Chuyển Đổi có thể chỉ được thực hiện một phần nếu Lệnh Bản nằm trong Lệnh Chuyển Đổi chỉ được thực hiện một phần. Các trường hợp Lệnh Bản chỉ được thực hiện một phần được quy định chi tiết tại mục 2.4.6. Phần chưa được thực hiện của Lệnh Chuyển Đổi được thực hiện một phần sẽ bị hủy.  \n- **Tạm Dừng Thực Hiện Lệnh Chuyển Đổi**  \nTrong một vài trường hợp Lệnh Chuyển Đổi cùng các lệnh khác có thể bị tạm dừng thực hiện. Các trường hợp được này được nêu tại mục 2.4.6.', '## e. Quy trình bán chứng chỉ quỹ\nĐại Lý Phân Phối sẽ xử lý tất cả các Lệnh Bản nhận trước Thời Điểm Đóng Số Lệnh và gửi lệnh giao dịch tổng hợp tới Đại lý Chuyển Nhượng để thực hiện giao dịch cho Ngày Giao Dịch kế tiếp, và đảm bảo các thông tin trong Lệnh Bản đầy đủ và nhất quán và Nhà Đầu Tư có đủ số Đơn Vị Quỹ trong tài khoản để bán. Nhà Đầu tư có thể đặt bản số Chứng Chỉ Quỹ tối đa bằng số lượng Chứng Chỉ Quỹ mà mình sở hữu. Khoản tiền bán ròng sẽ được chuyển trả cho Nhà Đầu Tư. Lệnh Bản không thuộc trường hợp được thực hiện một phần bởi các điều kiện liên quan đến Lệnh Bản một phần như để trong các mục dưới đây sẽ được giao dịch tại NAV tại Ngày Giao Dịch trừ đi Giá dịch vụ Mua lại, giá dịch vụ chuyển tiền và thuế (nếu có), dựa trên ngày giờ nhận Lệnh Bản tại Điểm Nhận Lệnh, theo ngày giờ xác nhận tại Điểm Nhận Lệnh', 'Vị Quỹ, bao gồm cả phần lẻ của Đơn Vị Quỹ. Nhà Đầu Tư chuyển nhượng cần điền Lệnh Chuyển Nhượng Đơn Vị Quỹ với điều kiện là số lượng Chuyển Nhượng phải bằng hoặc lớn hơn số dư tối thiểu khi mở tài khoản nếu người nhận chuyển nhượng chưa phải là Nhà Đầu Tư.  \n- **Xử Lý Các Đơn Chuyển Nhượng**', 'Sau khi thực hiện các Lệnh Bán Được Chấp Nhận, số Đơn Vị Quỹ đã bán sẽ được trừ ra từ tổng số Đơn Vị Quỹ trong tài khoản của Nhà Đầu Tư và bảng kê mới về số Đơn Vị Quỹ nắm giữ sẽ được gửi đến Nhà Đầu Tư. Chi tiết ngày thanh toán tiền mua lại chứng chỉ quỹ sẽ được Công ty Quản Lý Quỹ công bố trên trang web theo từng thời kỳ.', '# i. Chương trình Đầu tư Định kỳ\n- Trong trường hợp Nhà Đầu Tư muốn sử dụng tiền không hợp lệ ở trên để mua chứng chỉ quỹ tại các kỳ giao dịch bình thường không phải là kỳ giao dịch theo Chương trình ĐTĐK thì Nhà Đầu Tư sẽ phải thực hiện quy trình theo Mục 2.4.4. Quy trình mua chứng chỉ quỹ.  \n- Trong trường hợp Nhà Đầu Tư muốn giữ lại và tiếp tục để chờ cho kỳ giao dịch theo Chương trình ĐKĐT tiếp theo thì Nhà Đầu Tư cần phải đảm bảo nộp bổ sung phần còn thiếu trước thời điểm đóng số lệnh của ngày giao dịch theo Chương trình ĐKĐT.  \n- Trong trường hợp nhận được yêu cầu chuyển trả cụ thể từ Nhà Đầu tư hoặc không nhận được yêu cầu chuyển trả từ Nhà Đầu Tư, số tiền không hợp lệ ở trên sẽ được chuyển trả', '- Trong trường hợp Nhà Đầu Tư muốn sử dụng tiền không hợp lệ ở trên để mua chứng chỉ quỹ tại các kỳ giao dịch bình thường không phải là kỳ giao dịch theo Chương trình ĐTĐK thì Nhà Đầu Tư sẽ phải thực hiện quy trình theo Mục 2.4.4 Quy trình mua chứng chỉ quỹ.\n- Trong trường hợp Nhà Đầu Tư muốn giữ lại và tiếp tục để chờ cho kỳ giao dịch theo Chương trình ĐKĐT tiếp theo thì Nhà Đầu Tư cần phải đảm bảo nộp bổ sung phần còn thiếu trước thời điểm đóng số lệnh của ngày giao dịch theo Chương trình ĐKĐT.', '## f) Lệnh Mua Tối Thiểu\n#### a) Phiếu Lệnh Bản  \nNhà Đầu Tư có thể bán Đơn Vị Quỹ vào bất kỳ Ngày Giao Dịch nào bằng cách nộp Lệnh Bản tới một Điểm Nhận Lệnh bất kỳ trước Thời Điểm Đóng Số Lệnh cho Ngày Giao Dịch đó. Phiếu Lệnh Bản được đính kèm theo Đơn Đăng Ký hoặc có sẵn tại các Điểm Nhận Lệnh. Tất cả các Phiếu Lệnh Bản phải được ký tên đầy đủ.  \n#### b) Quy Trình Xử lý Lệnh Bản  \nNhà Đầu Tư có thể đặt Lệnh Bản số Đơn Vị Quỹ muốn bán, lẻ đến 2 số thập phân và đảm bảo số lượng chứng chỉ quỹ còn lại sau khi đặt bán không nhỏ hơn số lượng bán tối thiểu.', '## 3.6. Rủi ro về biến động giá\nRủi ro về biến động giá của Quỹ phát sinh khi một hay một số Nhà Đầu Tư đang nắm giữ một số lượng lớn Đơn Vị Quỹ quyết định thực hiện Lệnh Bản các Đơn Vị Quỹ này cùng lúc. Điều này có thể ảnh hưởng bất lợi tới giá của Đơn Vị Quỹ nếu các Lệnh Bản này đòi hỏi Công Ty Quản Lý Quỹ phải thoái vốn các khoản đầu tư tại mức giá thấp. Các quy định về thực hiện một phần lệnh bán và tạm dừng lệnh bán có thể giảm thiểu rủi ro biến động giá của Quỹ.', '- Thực hiện các lệnh giao dịch của Nhà Đầu Tư;  \n- Các hoạt động sáp nhập, hợp nhất của các tổ chức phát hành các chứng khoán mà Quỹ đang nắm giữ;  \n- Quỹ mới được cấp phép thành lập hoặc do tách Quỹ, hợp nhất Quỹ, sát nhập Quỹ mà thời gian hoạt động không quá sáu (06) tháng, tính từ ngày được cấp giấy chứng nhận đăng ký lập Quỹ;  \n- Quỹ đang trong thời gian giải thể.  \nTrong trường hợp xảy ra sai lệch so với các hạn mức đầu tư, Công ty Quản Lý Quỹ sẽ điều chỉnh danh mục đầu tư để đáp ứng các hạn mức đầu tư kể trên trong vòng 3 (ba) tháng kể từ ngày mà sai lệch phát sinh.', '## e. Quy trình bán chứng chỉ quỹ\n- **Phiếu Lệnh Bản**  \nNhà Đầu Tư có thể bán Đơn Vị Quỹ vào bất kỳ Ngày Giao Dịch nào bằng cách nộp Lệnh Bản tới một Điểm Nhận Lệnh bất kỳ trước Thời Điểm Đóng Số Lệnh cho Ngày Giao Dịch đó. Phiếu Lệnh Bản được đính kèm theo Đơn Đăng Ký hoặc có sẵn tại các Điểm Nhận Lệnh. Tất cả các Phiếu Lệnh Bản phải được ký tên đầy đủ.  \n- **Quy Trình Xử lý Lệnh Bản**  \nNhà Đầu Tư có thể đặt Lệnh Bản số Đơn Vị Quỹ muốn bán, lẻ đến 2 số thập phân và đảm bảo số lượng chứng chỉ quỹ còn lại sau khi đặt bản không nhỏ hơn số lượng bán tối thiểu.']",Nhà Đầu tư cần đặt bán toàn bộ để giảm số Đơn vị Quỹ nắm giữ về 0.
Quỹ xác định Giá trị tài sản ròng (NAV) với tần suất như thế nào và công bố ở đâu?,"Quỹ xác định Giá trị tài sản ròng (NAV) theo tần suất hàng ngày. NAV được công bố trên website của quỹ, đồng thời cũng thông báo cho Ủy ban Chứng khoán Nhà nước về việc định giá sai nếu có.

Thông tin này được lấy từ Trang 29 và Trang 58 của tài liệu.","['Xác định giá trị tài sản ròng NAV  \nGiá Trị Tài Sản Ròng (NAV) của một Chứng chỉ quỹ bằng NAV của Quỹ chia cho tổng số Chứng chỉ quỹ đang lưu hành tại Ngày Giao Dịch gần nhất trước Ngày Định Giá.  \nNAV là tổng giá trị các tài sản và các khoản đầu tư do Quỹ sở hữu trừ đi các nghĩa vụ nợ của Quỹ tính đến ngày gần nhất trước Ngày Định Giá.  \n$$\n\\mathrm{NAV/CCQ} = \\frac{(\\text{Tổng tài sản của Quỹ} - \\text{Tổng nợ của Quỹ})}{\\text{Tổng số đơn vị Quỹ đang lưu hành của Quỹ}}\n$$  \nNAV được tính cho mỗi Ngày Giao Dịch của Quỹ và sẽ được tính làm tròn xuống đến 02 (hai) chữ số thập phân.  \nVí dụ sau đây minh họa cho cách tính NAV của Quỹ tại ngày gần nhất trước Ngày Định Giá (T-1) cụ thể theo các giả định được đưa ra:  \n|  Khoản mục | Đơn vị | Giá trị  |\n| --- | --- | --- |', '## 4. Phương pháp xác định giá trị tài sản ròng\nGiá Trị Tài Sản Ròng (NAV) của một Chứng chỉ quỹ bằng NAV của Quỹ chia cho tổng số Chứng chỉ quỹ đang lưu hành tại Ngày Giao Dịch gần nhất trước Ngày Định Giá.', '## 2.2.8 Nguyên tắc, phương thức xác định giá trị tài sản ròng\nGiá Trị Tài Sản Ròng (NAV) của một Chứng chỉ quỹ bằng NAV của Quỹ chia cho tổng số Chứng chỉ quỹ đang lưu hành tại Ngày Giao Dịch gần nhất trước Ngày Định Giá. Giá trị tài sản ròng trên một Chứng chỉ quỹ sẽ được làm tròn xuống đến 2 (hai) chữ số thập phân.', '|  NAV trên một Đơn Vị Quỹ: | = | 78.000.000.000 /7.000.000\n= 11.142,85 VNĐ/đơn vị  |\n| --- | --- | --- |  \nViệc định giá tài sản của Quỹ, bao gồm cả các quyền, và việc tính toán NAV của Quỹ sẽ phải theo các quy tắc và quy định áp dụng cho từng thời điểm, được quy định trong Điều Lệ và sẽ được kiểm toán hằng năm. Chính sách kế toán phải phù hợp với các quy định hiện hành. Chính sách định giá tài sản của Quỹ được quy định tại Số Tay Định Giá và sẽ tuân thủ Pháp Luật và thông lệ quốc tế tốt nhất. Số tay định giá phải được Ban Đại Diện Quỹ phê duyệt và cung cấp cho ngân hàng giám sát để giám sát việc tính toán giá trị tài sản ròng.', '## 2.2.8 Nguyên tắc, phương thức xác định giá trị tài sản ròng\nNgày Định Giá là ngày Công ty Quản Lý Quỹ xác định NAV của Quỹ. Ngày Định Giá là ngày giao dịch (để phục vụ cho việc tính giá phát hành và giá mua lại); và là ngày đầu tiên của tháng tiếp theo đối với việc định giá để làm báo cáo tháng, quý, năm theo luật định.  \n**Ví dụ:**  \n|  Khoản mục | Đơn vị | Giá trị  |\n| --- | --- | --- |\n|  NAV của Quỹ tại Ngày Định Giá T | = | 78.000.000.000  |\n|  Số lượng Đơn Vị Quỹ đang lưu hành tại T-1 | Đơn vị | 7.000.000  |', '## 4. Phương pháp xác định giá trị tài sản ròng\nGiá trị tài sản ròng của Quỹ và Giá trị tài sản ròng trên một Đơn Vị Quỹ phải được Ngân Hàng Giám Sát xác nhận và sẽ được công bố tại Trụ sở chính của Công Ty Quản Lý Quỹ, và trên các trang web hoặc các phương tiện truyền thông khác theo yêu cầu của Luật vào ngày làm việc tiếp theo của Ngày Định Giá với điều kiện các trang điện tử này hoạt động bình thường. Trong thời hạn 24 giờ kể từ khi phát hiện giá trị tài sản ròng bị định giá sai, Ngân Hàng Giám Sát phải thông báo và yêu cầu công ty quản lý quỹ kịp thời điều chỉnh hoặc ngược lại trong trường hợp ngân hàng giám sát cung cấp dịch vụ xác định giá trị tài sản ròng', '## 2.5.2. Hình thức công bố thông tin về giá các giao dịch, nơi công bố thông tin, tần suất công bố thông tin\nGiá trị tài sản ròng của Quỹ và Giá trị tài sản ròng trên một Đơn Vị Quỹ phải được Ngân Hàng Giám Sát xác nhận và sẽ được công bố tại Trụ sở chính của Công Ty Quản Lý Quỹ, và trên các trang web hoặc các phương tiện truyền thông khác theo yêu cầu của Luật vào ngày làm việc tiếp theo của Ngày Định Giá với điều kiện các trang điện tử này hoạt động bình thường. Trong thời hạn 24 giờ kể từ khi phát hiện giá trị tài sản ròng bị định giá sai, Ngân Hàng Giám Sát phải thông báo và yêu cầu công ty quản lý quỹ kịp thời điều chỉnh hoặc ngược lại trong trường hợp ngân hàng giám sát cung cấp dịch vụ xác định giá trị tài sản ròng', '## XIII. CUNG CÁP THỐNG TIN CHO NHÀ ĐẦU TƯ, CHẾ ĐỘ BÁO CÁO\nHàng tháng, quý, năm Công Ty Quản Lý Quỹ sẽ gửi thống kê giao dịch, sao kê tài khoản giao dịch, tài khoản phụ, báo cáo giá trị NAV và các thay đổi NAV của Quỹ và các báo cáo khác theo luật định cho Nhà Đầu Tư.  \nĐối với Nhà Đầu Tư giao dịch trên tài khoản ký danh, Công Ty Quản Lý Quỹ hoặc tổ chức được ủy quyền bởi Công Ty Quản Lý Quỹ (trong phạm vi pháp luật hiện hành cho phép) sẽ gửi thống kê giao dịch và sao kê tài khoản phụ nếu Nhà Đầu Tư có yêu cầu bằng văn bản. Thời hạn cung cấp thông tin là trong vòng 05 (năm) ngày làm việc, kể từ ngày nhận được yêu cầu của Nhà Đầu Tư.', '|  NAV của Quỹ tại Ngày Định Giá T (2) | = | 78.000.000.000  |\n| --- | --- | --- |\n|  NAV trên một Đơn Vị Quỹ (3)=(1)/(2) | = | 11.142,85 VNĐ/đơn vị  |', '## d) Giá dịch vụ Quản Trị Quỹ\nGiá dịch vụ Quản trị quỹ sẽ là 0,03% NAV/năm và thấp nhất là 15.000.000 đồng/ tháng (chưa bao gồm thuế VAT)  \nCông thức tính giá dịch vụ quản trị quỹ vào mỗi kỳ định giá được xác định như sau:  \nGiá dịch vụ quản trị quỹ cho kỳ định giá = Tỷ lệ giá dịch vụ quản trị quỹ (năm) x NAV tại ngày trước ngày định giá x số ngày theo lịch thực tế của chu kỳ định giá / số ngày thực tế của năm (365 hoặc 366).', '## 4. Phương pháp xác định giá trị tài sản ròng\nCác quy định khác về việc công bố giá trị tài sản ròng và tình hình giao dịch tuân thủ theo quy định của Pháp luật và Điều lệ Quỹ.', '## 3.2 Giá dịch vụ mà Quỹ phải trả\nGiá dịch vụ quản lý được tính vào mỗi kỳ định giá dựa trên NAV tại ngày trước ngày định giá và được thanh toán hàng tháng cho Công ty Quản Lý Quỹ. Số giá dịch vụ trả hàng tháng là tổng số giá dịch vụ được tính (trích lập) cho các kỳ định giá thực hiện trong tháng.  \nCông thức tính giá dịch vụ quản lý quỹ vào mỗi kỳ định giá được xác định như sau:  \nGiá dịch vụ quản lý quỹ cho kỳ định giá = Tỷ lệ giá dịch vụ quản lý (năm) x NAV tại ngày trước ngày định giá x số ngày theo lịch thực tế của chu kỳ định giá / số ngày thực tế của năm (365 hoặc 366).  \nGiá dịch vụ Quản Lý tối đa là 1,2% * NAV/năm.', '## 2.6. Giá dịch vụ mà Quỹ phải trả\nGiá dịch vụ quản lý được tính vào mỗi kỳ định giá dựa trên NAV tại ngày trước ngày định giá và được thanh toán hàng tháng cho Công ty Quản Lý Quỹ. Số giá dịch vụ trả hàng tháng là tổng số giá dịch vụ được tính (trích lập) cho các kỳ định giá thực hiện trong tháng.  \nCông thức tính giá dịch vụ quản lý quỹ vào mỗi kỳ định giá được xác định như sau:  \nGiá dịch vụ quản lý quỹ cho kỳ định giá = Tỷ lệ giá dịch vụ quản lý (năm) x NAV tại ngày trước ngày định giá x số ngày theo lịch thực tế của chu kỳ định giá / số ngày thực tế của năm (365 hoặc 366).  \n36', '- Việc thực hiện tất cả các lệnh giao dịch của Nhà Đầu Tư tại Ngày Giao Dịch dẫn đến NAV của Quỹ thấp hơn 50.000.000.000 đồng (năm mươi tỷ đồng); hoặc Giá trị phần đơn vị quỹ hoặc số đơn vị quỹ còn lại trên tài khoản của nhà đầu tư thấp hơn giá trị tối thiểu hoặc số lượng đơn vị quỹ tối thiểu để duy trì tài khoản của nhà đầu tư theo quy định tại Điều lệ quỹ và Bán cáo bạch.\n- Trường hợp thực hiện một phần Lệnh Bán, Lệnh mua, Lệnh Chuyến Đổi Quỹ theo quy định nêu trên, Công ty Quản Lý Quỹ áp dụng nguyên tắc phân phối cùng tỷ lệ: Phần giá trị được thực hiện sẽ được phân bổ cho tất cả nhà đầu tư đăng ký giao dịch theo cùng một tỷ lệ giữa giá trị thực hiện và giá trị đăng ký giao dịch.  \nSố lượng chứng chỉ quỹ được thực hiện trong trường hợp này được tính như sau:', 'Trong các trường hợp tạm dừng thực hiện các giao dịch Đơn Vị Quỹ, Lệnh Chuyển Đổi đã nhận sẽ được thực hiện tại NAV tại Ngày Giao Dịch đầu tiên sau khi giao dịch được thực hiện trở lại.  \n**g. Quy trình chuyển nhượng chứng chỉ quỹ**  \n- **Đơn Chuyển Nhượng**  \nNhà Đầu Tư có thể Chuyển Nhượng Đơn Vị Quỹ cho nhà đầu tư khác dưới dạng quà tặng, thừa kế hoặc thực hiện lệnh của toà án. Chuyển Nhượng chỉ được thực hiện dưới dạng số lượng Đơn  \n55', '## b. Giá dịch vụ giám sát\nGiá dịch vụ giám sát được trả cho Ngân Hàng Giám Sát để cung cấp dịch vụ Ngân Hàng Giám Sát cho Quỹ. Giá dịch vụ được tính vào mỗi kỳ định giá dựa trên NAV tại ngày trước Ngày Định Giá và được trả hàng tháng. Số tiền trả dịch vụ hàng tháng là tổng số được tính (trích lập) cho các kỳ định giá thực hiện trong tháng.  \nCông thức tính giá dịch vụ giám sát vào mỗi kỳ định giá được xác định như sau:  \nGiá dịch vụ giám sát cho kỳ định giá = Tỷ lệ giá dịch vụ giám sát (năm) x NAV tại ngày trước ngày định giá x số ngày theo lịch thực tế của chu kỳ định giá / số ngày thực tế của năm (365 hoặc 366).  \n|  Loại Giá dịch vụ | Mức giá dịch vụ | Tối thiểu/tối đa | Ghi chú  |\n| --- | --- |\n|  Giá dịch vụ giám sát | 0,02%*NAV/Năm | Tối thiểu: 5.000.000 đồng /tháng | Thuế VAT 10%  |', '## 3.2 Giá dịch vụ mà Quỹ phải trả\nGiá dịch vụ giám sát được trả cho Ngân Hàng Giám Sát để cung cấp dịch vụ Ngân Hàng Giám Sát cho Quỹ. Giá dịch vụ được tính vào mỗi kỳ định giá dựa trên NAV tại ngày trước Ngày Định Giá và được trả hàng tháng. Số tiền trả dịch vụ hàng tháng là tổng số được tính (trích lập) cho các kỳ định giá thực hiện trong tháng.', '## e) Thực Hiện Một Phần Lệnh Bán\nTrong các trường hợp sau, Quỹ chỉ có thể thực hiện một phần Lệnh Bán và Chuyến Đổi Quỹ của Nhà Đầu Tư:  \n- Tổng giá trị của các Lệnh Bán (bao gồm cả Lệnh Bán từ hoạt động Chuyến Đổi Quỹ) trừ đi tổng giá trị của tất cả các Lệnh Mua (bao gồm cả Lệnh Mua từ hoạt động Chuyến Đổi Quỹ) tại Ngày Giao Dịch lớn hơn 10% của giá trị tài sản ròng của Quỹ (NAV); hoặc\n- Việc thực hiện tất cả các lệnh giao dịch của Nhà Đầu Tư tại Ngày Giao Dịch dẫn đến NAV của Quỹ thấp hơn 50.000.000.000 đồng (năm mươi tỷ đồng); hoặc Giá trị phần đơn vị quỹ hoặc số đơn vị quỹ còn lại trên tài khoản của nhà đầu tư thấp hơn giá trị tối thiểu hoặc số lượng đơn vị quỹ tối thiểu để duy trì tài khoản của nhà đầu tư theo quy định tại Điều lệ quỹ và Bán cáo bạch.', '## 2.5.2. Hình thức công bố thông tin về giá các giao dịch, nơi công bố thông tin, tần suất công bố thông tin\n. Trong thời hạn 05 ngày làm việc, kể từ ngày phát hiện giá trị tài sản ròng bị định giá sai, công ty quản lý quỹ hoặc ngân hàng giám sát (trong trường hợp ngân hàng giám sát cung cấp dịch vụ xác định giá trị tài sản ròng) phải điều chỉnh lại và công bố thông tin theo quy định, đồng thời thông báo cho Ủy ban Chứng khoán Nhà nước về việc định giá sai, bao gồm nguyên nhân xảy ra sự việc, thời gian bị định giá sai, biện pháp xử lý. Nội dung thông báo phải được công ty quản lý quỹ và ngân hàng giám sát cùng ký xác nhận.', '## 4. Phương pháp xác định giá trị tài sản ròng\n. Trong thời hạn 05 ngày làm việc, kể từ ngày phát hiện giá trị tài sản ròng bị định giá sai, công ty quản lý quỹ hoặc ngân hàng giám sát (trong trường hợp ngân hàng giám sát cung cấp dịch vụ xác định giá trị tài sản ròng) phải điều chỉnh lại và công bố thông tin theo quy định, đồng thời thông báo cho Ủy ban Chứng khoán Nhà nước về việc định giá sai, bao gồm nguyên nhân xảy ra sự việc, thời gian bị định giá sai, biện pháp xử lý. Nội dung thông báo phải được công ty quản lý quỹ và ngân hàng giám sát cùng ký xác nhận.', '## c. Giá dịch vụ Lưu ký\nGiá dịch vụ lưu ký được trả cho Ngân Hàng Lưu ký để cung cấp dịch vụ Ngân Hàng Lưu ký cho Quỹ. Giá dịch vụ được tính vào mỗi kỳ định giá dựa trên NAV tại ngày trước Ngày Định Giá và được trả hàng tháng. Số tiền trả dịch vụ hàng tháng là tổng số được tính (trích lập) cho các kỳ định giá thực hiện trong tháng.  \nCông thức tính giá dịch vụ lưu ký vào mỗi kỳ định giá được xác định như sau:  \nGiá dịch vụ lưu ký cho kỳ định giá = Tỷ lệ giá dịch vụ lưu ký (năm) x NAV tại ngày trước ngày định giá x số ngày theo lịch thực tế của chu kỳ định giá / số ngày thực tế của năm (365 hoặc 366).  \n|  Loại Giá dịch vụ | Mức giá dịch vụ | Tối thiểu/tối đa | Ghi chú  |\n| --- | --- |\n|  Giá dịch vụ lưu ký | 0,06%*NAV/Năm | Tối thiểu: 20.000.000 đồng /tháng |   |', '## c) Giá dịch vụ Lưu Ký\nGiá dịch vụ lưu ký được trả cho Ngân Hàng Lưu ký để cung cấp dịch vụ Ngân Hàng Lưu ký cho Quỹ. Giá dịch vụ được tính vào mỗi kỳ định giá dựa trên NAV tại ngày trước Ngày Định Giá và được trả hàng tháng. Số tiền trả dịch vụ hàng tháng là tổng số được tính (trích lập) cho các kỳ định giá thực hiện trong tháng.  \nCông thức tính giá dịch vụ lưu ký vào mỗi kỳ định giá được xác định như sau:  \nGiá dịch vụ lưu ký cho kỳ định giá = Tỷ lệ giá dịch vụ lưu ký (năm) x NAV tại ngày trước ngày định giá x số ngày theo lịch thực tế của chu kỳ định giá / số ngày thực tế của năm (365 hoặc 366).  \n|  Loại Giá dịch vụ | Mức giá dịch vụ | Tối thiểu/tối đa | Ghi chú  |\n| --- | --- |\n|  Giá dịch vụ lưu ký | 0,06%*NAV/Năm | Tối thiểu: 20.000.000 đồng /tháng |   |', '## d) Xác Nhận Lệnh Chuyển Nhượng\n- Các điều kiện bất khả kháng;\n- Không thể xác định được NAV của Quỹ tại Ngày Giao Dịch do các Sở giao dịch chứng khoán quyết định đình chỉ giao dịch chứng khoán trong danh mục đầu tư của Quỹ hoặc do các sở giao dịch chứng khoán tạm dừng giao dịch; hoặc\n- Các trường hợp khác theo quy định của Ủy Ban Chứng Khoán Nhà Nước.', 'Công thức tính giá dịch vụ quản trị quỹ vào mỗi kỳ định giá được xác định như sau:  \nGiá dịch vụ quản trị quỹ cho kỳ định giá = Tỷ lệ giá dịch vụ quản trị quỹ (năm) x NAV tại ngày trước ngày định giá x số ngày theo lịch thực tế của chu kỳ định giá / số ngày thực tế của năm (365 hoặc 366).  \nc. Giá dịch vụ Đại Lý Chuyển Nhượng  \nGiá dịch vụ Đại lý chuyển nhượng được tính toán và cộng đồng theo kỳ định giá và được thanh toán định kỳ theo thỏa thuận với Đại lý chuyển nhượng. Giá dịch vụ Đại lý chuyển nhượng được thống nhất với Đại lý chuyển nhượng phù hợp với quy định của pháp luật và có thể được điều chỉnh theo thỏa thuận với Đại lý chuyển nhượng.  \nd. Chi phí Kiểm Toán', 'Công thức tính giá dịch vụ giám sát vào mỗi kỳ định giá được xác định như sau:  \nGiá dịch vụ giám sát cho kỳ định giá = Tỷ lệ giá dịch vụ giám sát (năm) x NAV tại ngày trước ngày định giá x số ngày theo lịch thực tế của chu kỳ định giá / số ngày thực tế của năm (365 hoặc 366).  \n|  Loại Giá dịch vụ | Mức giá dịch vụ | Tối thiểu/tối đa | Ghi chú  |\n| --- | --- |\n|  Giá dịch vụ giám sát | 0,02%*NAV/Năm | Tối thiểu: 5.000.000 đồng /tháng | Thuế VAT 10%  |']",NAV được xác định tại mỗi Ngày Giao Dịch (thứ Hai đến thứ Sáu) và công bố vào ngày làm việc tiếp theo.
Thời gian thanh toán tiền bán chứng chỉ quỹ cho nhà đầu tư là trong vòng bao lâu?,"Theo thông tin trong tài liệu, thời gian thanh toán tiền bán chứng chỉ quỹ cho nhà đầu tư là trong vòng 5 (năm) ngày làm việc kể từ kỳ giao dịch chứng chỉ quỹ áp dụng.

Thông tin này được lấy từ Trang 58 của tài liệu.","['Nhà Đầu Tư có thể thanh toán số tiền mua Đơn Vị Quỹ từ tài khoản ngân hàng của mình vào tài khoản của Quỹ để Ngân Hàng Giám Sát nhận được đúng hạn và Đại Lý Phân Phối hoàn thành xử lý việc đăng ký với Đại Lý Chuyển Nhượng. Mọi khoản đầu tư vào Đơn Vị Quỹ đều thực hiện bằng tiền Đồng Việt Nam.  \nTrong trường hợp lệnh mua chứng chỉ quỹ và việc thanh toán cho lệnh mua được thực hiện bởi cá nhân, tổ chức khác không phải nhà đầu tư thì phiếu lệnh và tài liệu xác nhận thanh toán phải nêu rõ tên, số tài khoản và giá trị thanh toán của nhà đầu tư được hưởng lợi.', 'Nhà Đầu Tư có thể thanh toán số tiền mua Đơn Vị Quỹ bằng cách chuyển khoản từ tài khoản ngân hàng của mình hoặc nộp tiền trực tiếp vào tài khoản của Quỹ để Ngân Hàng Giám Sát nhận được đúng hạn và Đại Lý Phân Phối hoàn thành xử lý việc đăng ký với Đại Lý Chuyển Nhượng. Mọi khoản đầu tư vào Đơn Vị Quỹ đều thực hiện bằng tiền Đồng Việt Nam.  \nTrong trường hợp lệnh mua chứng chỉ quỹ và việc thanh toán cho lệnh mua được thực hiện bởi cá nhân, tổ chức khác không phải nhà đầu tư thì phiếu lệnh và tài liệu xác nhận thanh toán phải nêu rõ tên, số tài khoản và giá trị thanh toán của nhà đầu tư được hưởng lợi.  \n- **Tuân Thủ**', 'Sau khi thực hiện các Lệnh Bán Được Chấp Nhận, số Đơn Vị Quỹ đã bán sẽ được trừ ra từ tổng số Đơn Vị Quỹ trong tài khoản của Nhà Đầu Tư và bảng kê mới về số Đơn Vị Quỹ nắm giữ sẽ được gửi đến Nhà Đầu Tư. Chi tiết ngày thanh toán tiền mua lại chứng chỉ quỹ sẽ được Công ty Quản Lý Quỹ công bố trên trang web theo từng thời kỳ.', 'b) Chọn Thời Điểm Giao Dịch  \nChứng Chỉ Quỹ cũng như Quỹ không được coi là công cụ phục vụ việc giao dịch thường xuyên để tận dụng các biến động ngắn hạn của thị trường. Loại giao dịch này thường được gọi là “chọn thời điểm giao dịch” và có thể gây ra các thiệt hại tiềm tàng hoặc thiệt hại thực tế cho Nhà Đầu Tư.  \n2.4.4. Quy trình mua chứng chỉ quỹ  \na) Hợp đồng mở tài khoản giao dịch chứng khoán và đăng ký giao dịch quỹ mở', 'Cổ tức sẽ được chi trả trong thời hạn 30 (ba mươi) ngày kể từ ngày được công bố và được chuyển vào tài khoản ngân hàng của Nhà Đầu Tư theo đăng ký trong Sổ Đăng Ký vào ngày thanh toán cổ tức, sau khi được khấu trừ các loại thuế có liên quan.  \nCổ tức được chi trả sẽ phải chịu thuế tùy thuộc vào nguồn gốc của thu nhập của Quỹ cũng như các loại thuế áp dụng cho Nhà Đầu Tư.', 'Trong trường hợp Quỹ nhận được số tiền mua thấp hơn lệnh đăng ký mua và không nhận được yêu cầu chuyển trả từ khách hàng, số tiền mua sẽ tiếp tục được giữ lại để chờ yêu cầu giao dịch tiếp theo từ khách hàng.  \nTrong trường hợp Nhà Đầu Tư có nhiều lệnh mua Chứng Chỉ Quỹ cùng một lúc, Lệnh Mua Chứng Chỉ Quỹ sẽ được ưu tiên theo thứ tự đặt lệnh.  \nPhí/giá dịch vụ chuyển tiền (nếu có) được trừ vào số tiền hoàn trả cho Nhà Đầu Tư. Đơn Vị Quỹ sẽ chỉ được ghi nhận vào tài khoản của Nhà Đầu Tư hay của Đại Lý Kỷ Danh sau khi có kết quả giao dịch chứng chỉ quỹ.', 'Sau khi thực hiện các Lệnh Bán Được Chấp Nhận, số Đơn Vị Quỹ đã bán sẽ được trù ra từ tổng số Đơn Vị Quỹ trong tài khoản của Nhà Đầu Tư và bảng kê mới về số Đơn Vị Quỹ nắm giữ sẽ được gửi đến Nhà Đầu Tư.  \nLệnh Bán thành công của Nhà Đầu Tư hay Đại Lý Ký Danh sẽ được thông báo trong vòng 03 (ba) ngày làm việc sau Ngày Giao Dịch.  \nTrong thời hạn 5 ngày làm việc sau ngày giao dịch Chứng chỉ quỹ, Nhà Đầu tư sẽ nhận được tiền bán chứng chỉ quỹ vào tài khoản mà Nhà Đầu tư đã đăng ký khi thực hiện mua Chứng chỉ quỹ.  \n- **Lệnh Bán Tối Thiểu**  \nLệnh Bán tối thiểu là 10 (mười) Đơn Vị Quỹ. Trường hợp sau khi đặt bán, số lượng chứng chỉ quỹ còn lại nhỏ hơn số lượng bán tối thiểu, Nhà Đầu tư cần đặt bán toàn bộ để giảm số Đơn vị Quỹ nắm giữ về 0 (không).', 'Theo quy định hiện hành, nếu Quỹ không thể huy động được ít nhất là 50.000.000.000 VNĐ (năm mươi tỷ đồng) hoặc có ít hơn 100 (một trăm) Nhà Đầu Tư không chuyên nghiệp vào thời điểm kết thúc IPO hoặc thời gian được gia hạn (nếu có), UBCKNN sẽ không cấp Giấy chứng nhận đăng ký lập quỹ cho Quỹ. Trong trường hợp này, tất cả số tiền nhận được từ các Nhà Đầu Tư trong thời gian IPO cùng với lãi phát sinh nếu có sẽ được hoàn trả vào tài khoản đăng ký của Nhà Đầu Tư trong vòng 15 (mười lăm ngày) kể từ ngày kết thúc đợt IPO. Công Ty Quản Lý Quỹ sẽ chịu tất cả các chi giá dịch vụ phát sinh từ đợt IPO trong trường hợp này.  \n49', '|  Từ tròn 6 đến tròn 9 tháng | 0,75%  |\n| --- | --- |\n|  Từ trên 9 đến tròn 12 tháng | 0,50%  |\n|  Từ trên 12 tháng trở lên | 0,00%  |  \nTrường hợp Nhà Đầu Tư mua Chứng Chỉ Quỹ nhiều lần, mua theo Chương Trình ĐTĐK hoặc dưới hình thức tái đầu tư bằng nguồn cổ tức của Quỹ không phải chịu Giá dịch vụ phát hành, ưu tiên bán được thực hiện theo nguyên tắc các Chứng Chỉ Quỹ mua trước sẽ được bán trước, không phân biệt chứng chỉ quỹ mua theo lệnh mua bình thường hay Chương Trình ĐTĐK hay hình thức tái đầu tư bằng nguồn cổ tức.', 'Trong thời hạn 05 ngày làm việc kể từ ngày hoàn tất việc điều chỉnh lại danh mục đầu tư, công ty quản lý quỹ phải công bố thông tin theo quy định, đồng thời thông báo cho Ủy ban Chứng khoán Nhà nước về các sai lệch cơ cấu danh mục đầu tư, nguyên nhân, thời điểm phát sinh hoặc phát hiện ra sự việc, mức độ thiệt hại và bồi thường thiệt hại cho quỹ (nếu có) hoặc lợi nhuận tạo cho quỹ (nếu có), biện pháp khắc phục, thời gian thực hiện, kết quả khắc phục.  \nCông ty quản lý quỹ chỉ được gửi tiền và đầu tư công cụ thị trường tiền tệ quy định tại điểm a, b mục IX.2.2.3 của các tổ chức tín dụng trong danh sách đã được Ban đại diện quỹ phê duyệt.', '## Lĩnh vực được phép đầu tư\nđ) Cổ phiếu chào bán lần đầu ra công chúng, trái phiếu chào bán ra công chúng; trái phiếu doanh nghiệp phát hành riêng lẻ bởi tổ chức niêm yết có bảo lãnh thanh toán của tổ chức tín dụng hoặc cam kết mua lại của tổ chức phát hành tối thiểu 1 lần trong 12 tháng và mỗi lần cam kết mua lại tối thiểu 30% giá trị đợt phát hành;  \ne) Chứng khoán phải sinh niêm yết giao dịch tại Sở giao dịch chứng khoán và chỉ nhằm mục tiêu phòng ngừa rủi ro cho chứng khoán cơ sở mà quỹ đang nắm giữ;  \ng) Quyền phát sinh gắn liền với chứng khoán mà quỹ đang nắm giữ.  \nViệc đầu tư vào các tài sản quy định tại điểm đ khoản 2.2.3 Điều này phải đáp ứng các điều kiện sau:  \n- Có quy định tại Điều lệ quỹ và Bản cáo bạch;', 'Sau khi hoàn thành đợt IPO, Công Ty Quản Lý Quỹ sẽ đăng ký xin giấy chứng nhận đăng ký thành lập Quỹ với UBCKNN nếu có ít nhất 100 (một trăm) Nhà Đầu Tư không chuyên nghiệp đầu tư vào Quỹ và tổng vốn đầu tư vào Quỹ đạt tối thiểu 50.000.000.000 VNĐ (năm mươi tỷ đồng). Khi nhận Giấy phép đăng ký, Ngân Hàng Giám Sát sẽ giải toả tài khoản ký quỹ của Quỹ đó để Quỹ có thể bắt đầu đầu tư. Dự kiến Ngày Giao Dịch đầu tiên sẽ trong vòng 30 (ba mươi) ngày kể từ ngày Giấy chứng nhận đăng ký lập quỹ có hiệu lực.  \nXác nhận đầu tư sẽ được gửi cho Nhà Đầu Tư trong vòng 05 (năm) ngày kể từ ngày Quỹ có được Giấy chứng nhận đăng ký thành lập từ UBCKNN.', '## e) Thực Hiện Một Phần Lệnh Bán\nSố lượng Chứng Chỉ Quỹ Nhà Đầu Tư được thực hiện trong trường hợp thực hiện một phần Lệnh Bán cũng áp dụng nguyên tắc của Lệnh Bán tối thiểu nêu trên. Phần lệnh chưa được thực hiện và các lệnh đến sau thời điểm đóng số lệnh sẽ tự động bị hủy. Nhà Đầu Tư có thể thực hiện tiếp các lệnh bán của mình bằng cách đăng ký giao dịch tại ngày giao dịch tiếp theo.', '## 2. Tình hình phát hành và mua lại chứng chỉ quỹ\nTình hình phát hành và mua lại chứng chỉ quỹ được trình bày chi tiết trong các báo cáo tài chính soát xét bán niên/ hàng năm của Quỹ và được công bố công khai trên website của Công ty quản lý quỹ.', 'Nhà Đầu Tư thanh toán tiền mua Đơn Vị Quỹ vào một tài khoản phong tỏa của Quỹ mở tại Ngân Hàng Giám Sát. Thông tin chi tiết của tài khoản này sẽ được cung cấp bởi các Đại Lý Phân Phối và được đề cập trong Đơn Đăng Ký. Ngân Hàng Giám Sát sẽ thanh toán lãi phát sinh (nếu có) trên các khoản tiền gửi trong tài khoản ký quỹ với mức lãi suất không thấp hơn lãi suất tiền gửi không kỳ hạn đang được áp dụng của Ngân Hàng Giám Sát trong suốt quá trình IPO. Nếu IPO thành công, số lãi này sẽ cấu thành một phần tài sản Quỹ.', 'Trong trường hợp Quỹ nhận được số tiền mua thấp hơn Phiếu lệnh mua và không nhận được yêu cầu chuyển trả từ khách hàng, số tiền mua sẽ tiếp tục được giữ lại để chờ yêu cầu giao dịch tiếp theo từ khách hàng.  \nTrong trường hợp Nhà Đầu Tư có nhiều lệnh mua Chứng Chỉ Quỹ cùng một lúc, Lệnh Mua Chứng Chỉ Quỹ sẽ được ưu tiên theo thứ tự đặt lệnh.  \nPhí/giá dịch vụ chuyển tiền (nếu có) được trừ vào số tiền hoàn trả cho Nhà Đầu Tư. Đơn Vị Quỹ sẽ chỉ được ghi nhận vào tài khoản của Nhà Đầu Tư hay của Đại Lý Ký Danh sau khi có kết quả giao dịch chứng chỉ quỹ.', '|  Từ trên 9 đến tròn 12 tháng | 0,50%  |\n|  Từ trên 12 tháng trở lên | 0,00%  |  \nTrường hợp Nhà Đầu Tư mua Chứng Chỉ Quỹ nhiều lần, mua theo Chương Trình ĐTĐK hoặc dưới hình thức tái đầu tư bằng nguồn cổ tức của Quỹ không phải chịu Giá dịch vụ phát hành, ưu tiên bán được thực hiện theo nguyên tắc các Chứng Chỉ Quỹ mua trước sẽ được bán trước, không phân biệt chứng chỉ quỹ mua theo lệnh mua bình thường hay Chương Trình ĐTĐK hay hình thức tái đầu tư bằng nguồn cổ tức.  \nCông Ty Quản Lý Quỹ có quyền thay đổi Giá dịch vụ Mua lại nhưng không được vượt quá mức quy định của pháp luật. Mức Giá dịch vụ Mua lại mới sẽ được Công Ty Quản Lý Quỹ thông báo chi tiết tại trang thông tin điện tử của Quỹ và tại các địa điểm phân phối của các Đại Lý Phân Phối.', '- Thực hiện các lệnh giao dịch của Nhà Đầu Tư;  \n- Các hoạt động sáp nhập, hợp nhất của các tổ chức phát hành các chứng khoán mà Quỹ đang nắm giữ;  \n- Quỹ mới được cấp phép thành lập hoặc do tách Quỹ, hợp nhất Quỹ, sát nhập Quỹ mà thời gian hoạt động không quá sáu (06) tháng, tính từ ngày được cấp giấy chứng nhận đăng ký lập Quỹ;  \n- Quỹ đang trong thời gian giải thể.  \nTrong trường hợp xảy ra sai lệch so với các hạn mức đầu tư, Công ty Quản Lý Quỹ sẽ điều chỉnh danh mục đầu tư để đáp ứng các hạn mức đầu tư kể trên trong vòng 3 (ba) tháng kể từ ngày mà sai lệch phát sinh.', '## 3. Giá dịch vụ và thưởng hoạt động\nNhà Đầu Tư được khuyến khích nắm giữ các Đơn Vị Quỹ như một phần của các khoản đầu tư dài hạn và chương trình tiết kiệm hưu trí. Quỹ mở không được thiết kế cho mục đích mua bán ngắn hạn. Việc Nhà Đầu Tư thường xuyên mua đi và bán lại Đơn Vị Quỹ, vốn được thiết kế để đạt được lợi nhuận dài hạn sẽ ảnh hưởng đến mục tiêu lợi nhuận của Nhà Đầu Tư khi đầu tư vào Quỹ cũng như lợi nhuận của Quỹ.  \nGiá dịch vụ Mua lại và các khoản giá dịch vụ ngân hàng và thuế khác (nếu có) sẽ được trừ vào khoản tiền thu được từ bán Đơn Vị Quỹ của Nhà Đầu Tư.', '## 2. Điều lệ Quỹ tóm tắt\nSố lượng chứng chỉ quỹ/tổng chứng chỉ quỹ được phép lưu hành tối đa: không hạn chế.  \nViệc thay đổi giá trị tài sản huy động tối đa hoặc số lượng chứng chỉ quỹ huy động tối đa phải do Đại hội nhà đầu tư quyết định và phải thông báo cho Ủy ban Chứng khoán Nhà nước.', '- Trong trường hợp Nhà Đầu Tư muốn sử dụng tiền không hợp lệ ở trên để mua chứng chỉ quỹ tại các kỳ giao dịch bình thường không phải là kỳ giao dịch theo Chương trình ĐTĐK thì Nhà Đầu Tư sẽ phải thực hiện quy trình theo Mục 2.4.4 Quy trình mua chứng chỉ quỹ.\n- Trong trường hợp Nhà Đầu Tư muốn giữ lại và tiếp tục để chờ cho kỳ giao dịch theo Chương trình ĐKĐT tiếp theo thì Nhà Đầu Tư cần phải đảm bảo nộp bổ sung phần còn thiếu trước thời điểm đóng số lệnh của ngày giao dịch theo Chương trình ĐKĐT.', 'lại cho Nhà đầu tư hoặc bên chuyển tiền không hợp lệ trong vòng 05 (năm) ngày làm việc kể từ kỳ giao dịch chứng chỉ quỹ áp dụng.  \nChương trình ĐTĐK sẽ dùng khi Nhà Đầu Tư quyết định dừng bằng cách thông báo dừng thực hiện ĐTĐK với Đại Lý Phân Phối hoặc do Nhà Đầu Tư không nộp tiền/không nộp đủ tiền mua chứng chỉ quỹ cho Chương Trình ĐTĐK trong 05 kỳ liên tiếp.  \n- Phí/giá dịch vụ áp dụng cho Chương Trình ĐTĐK  \nPhí/giá dịch vụ áp dụng cho chương trình ĐTĐK được quy định chi tiết tại mục 2.5.3 của Bản Cáo Bạch này.  \n- Bản chứng chỉ quỹ mua theo Chương Trình ĐTĐK  \nNhà Đầu Tư bán chứng chỉ quỹ mua theo Chương Trình ĐTĐK theo nguyên tắc quy định tại mục 2.5.3 của Bản Cáo Bạch này.', '1  \nỦy ban Chứng khoán Nhà nước cấp giấy phép phát hành chứng chỉ quỹ ra công chúng có nghĩa là việc xin phép lập Quỹ và phát hành chứng chỉ quỹ đầu tư đã thực hiện theo các quy định của pháp luật liên quan, không hàm ý bảo đảm về nội dung của Bản cáo bạch cũng như mục tiêu, chiến lược đầu tư của Quỹ.', 'Ngay sau khi các sự kiện này chấm dứt, các giao dịch Đơn Vị Quỹ sẽ được thực hiện trở lại vào Ngày Giao Dịch tiếp theo. Theo luật, thời gian tạm dừng thực hiện các Lệnh Mua và Bán Đơn Vị Quỹ sẽ không quá 90 (chín mươi) ngày kể từ Ngày Giao Dịch gần nhất. Trong trường hợp giao dịch không thể tiếp tục trong khoảng thời gian tạm dừng tối đa nêu trên, thì trong vòng 30 (ba mươi) ngày kể từ ngày kết thúc thời hạn tạm dừng trên, Công Ty Quản Lý Quỹ phải tổ chức họp để lấy ý kiến Đại Hội Nhà Đầu Tư về việc giải thể Quỹ, hoặc tách Quỹ, hoặc tiếp tục kéo dài thời gian tạm dừng giao dịch Chứng chỉ Quỹ. Trong thời hạn triệu tập Đại Hội Nhà Đầu Tư, nếu các nguyên nhân dẫn tới việc tạm dừng giao dịch Chứng Chỉ Quỹ chấm dứt, Công ty Quản Lý Quỹ được hủy bỏ việc triệu tập Đại Hội Nhà Đầu Tư.  \n56', '## d) Xác Nhận Lệnh Chuyển Nhượng\nNgay sau khi các sự kiện này chấm dứt, các giao dịch Đơn Vị Quỹ sẽ được thực hiện trở lại vào Ngày Giao Dịch tiếp theo. Theo luật, thời gian tạm dừng thực hiện các Lệnh Mua và Bán Đơn Vị Quỹ sẽ không quá 90 (chín mươi) ngày kể từ Ngày Giao Dịch gần nhất. Trong trường hợp giao dịch không thể tiếp tục trong khoảng thời gian tạm dừng tối đa nêu trên, thì trong vòng 30 (ba mươi) ngày kể từ ngày kết thúc thời hạn tạm dừng trên, Công Ty Quản Lý Quỹ phải tổ chức họp để lấy ý kiến Đại Hội Nhà Đầu Tư về việc giải thể Quỹ, hoặc tách Quỹ, hoặc tiếp tục kéo dài thời gian tạm dừng giao dịch Chứng chỉ Quỹ. Trong thời hạn triệu tập Đại Hội Nhà Đầu Tư, nếu các nguyên nhân dẫn tới việc tạm dừng giao dịch Chứng Chỉ Quỹ chấm dứt, Công ty Quản Lý Quỹ được hủy bỏ việc triệu tập Đại Hội Nhà Đầu Tư.']",Trong thời hạn 5 ngày làm việc sau ngày giao dịch Chứng chỉ quỹ.
Quỹ TCSME không được đầu tư quá bao nhiêu phần trăm tổng giá trị tài sản vào chứng khoán của một tổ chức phát hành?,"Quỹ TCSME không được đầu tư quá 10% tổng giá trị tài sản vào chứng khoán của một tổ chức phát hành.

Thông tin này được lấy từ nguồn 2, trang 20.","['## 2.2.4 Hạn mức đầu tư\nHạn mức đầu tư của Quỹ được quy định chi tiết tuân thủ các quy định tại Thông tư hướng dẫn hoạt động và quản lý các quỹ đầu tư chứng khoán. Cơ cấu danh mục đầu tư của Quỹ phải bảo đảm tuân thủ các hạn mức đầu tư sau:  \na) Trừ tiền gửi trên tài khoản thanh toán của quỹ tại ngân hàng giám sát, quỹ mở không được đầu tư quá 49% tổng giá trị tài sản của quỹ vào các tài sản theo quy định tại điểm a, b mục IX.2.2.3  \nb) Không được đầu tư vào chứng khoán của một tổ chức phát hành quá 10% tổng giá trị chứng khoán đang lưu hành của tổ chức đó, trừ công cụ nợ của Chính phủ;  \nc) Không được đầu tư quá 20% tổng giá trị tài sản của quỹ vào chứng khoán đang lưu hành và các tài sản (nếu có) quy định tại điểm a, b mục IX.2.2.3 của một tổ chức phát hành, trừ công cụ nợ của Chính phủ;', 'ii. Không được đầu tư quá ba mươi phần trăm (30%) tổng giá trị tài sản của quỹ vào các tài sản quy định tại điểm i, ii, iv, v và vi các loại tài sản Quỹ được phép đầu tư, phát hành bởi một công ty hoặc một nhóm công ty có quan hệ sở hữu với nhau, trong đó phần đầu tư vào chứng khoán phái sinh tính bằng giá trị cam kết của hợp đồng xác định theo quy định tại Phụ lục 4 Điều lệ Quỹ.  \niii. Không được đầu tư quá 20% (hai mươi phần trăm) tổng giá trị tài sản của Quỹ vào chứng khoán đang lưu hành và các tài sản (nếu có) quy định tại điểm i, ii các loại tài sản Quỹ được phép đầu tư của một tổ chức phát hành, trừ Công cụ nợ của Chính phủ;', '## 2.2.4 Hạn mức đầu tư\nd) Không được đầu tư quá 30% tổng giá trị tài sản của quỹ vào các tài sản quy định tại điểm a, b, d, đ và e mục IX.2.2.3, phát hành bởi các công ty trong cùng một nhóm công ty có quan hệ sở hữu với nhau thuộc các trường hợp sau đây: công ty mẹ, công ty con; các công ty sở hữu trên 35% cổ phần, phần vốn góp của nhau; nhóm công ty con có cùng một công ty mẹ. Trong đó phần đầu tư vào chứng khoán phải sinh tính bằng giá trị cam kết của hợp đồng xác định theo quy định tại Phụ lục 4 Điều lệ Quỹ;  \nđ) Không được đầu tư quá 10% tổng giá trị tài sản của quỹ vào các tài sản quy định tại điểm đ mục IX.2.2.3;', '## 2.2.4 Hạn mức đầu tư\ne) Tổng giá trị các hạng mục đầu tư lớn trong danh mục đầu tư của quỹ không được vượt quá 40% tổng giá trị tài sản của quỹ. Trong đó, hạng mục đầu tư lớn của quỹ là hạng mục đầu tư vào các loại tài sản quy định tại điểm b, d, đ và g mục IX.2.2.3 (ngoại trừ chứng chỉ tiền gửi) phát hành bởi cùng một tổ chức, có tổng giá trị chiếm từ 5% trở lên tổng giá trị tài sản của quỹ;  \ng) Tại mọi thời điểm, tổng giá trị cam kết trong các giao dịch chứng khoán phải sinh, dư nợ vay và các khoản phải trả của quỹ không được vượt quá giá trị tài sản ròng của quỹ;  \nh) Không được đầu tư vào chứng chỉ quỹ của chính quỹ đó;  \ni) Chỉ được đầu tư vào chứng chỉ quỹ đại chúng khác, công ty đầu tư chứng khoán đại chúng do công ty quản lý quỹ khác quản lý và bảo đảm các hạn chế sau:', '## 2.2.4 Hạn mức đầu tư\n- Không đầu tư vào quá 10% tổng số chứng chỉ quỹ đang lưu hành của một quỹ đại chúng, cổ phiếu đang lưu hành của một công ty đầu tư chứng khoán đại chúng;\n- Không đầu tư quá 20% tổng giá trị tài sản của quỹ vào chứng chỉ quỹ của một quỹ đại chúng, cổ phiếu của một công ty đầu tư chứng khoán đại chúng;\n- Không đầu tư quá 30% tổng giá trị tài sản của quỹ vào các chứng chỉ quỹ đại chúng, cổ phiếu công ty đầu tư chứng khoán đại chúng;  \nk) Không được đầu tư trực tiếp vào bất động sản, đá quý, kim loại quý hiếm;  \nl) Phải có chứng khoán của ít nhất 06 tổ chức phát hành.', '- Không đầu tư quá 30% tổng giá trị tài sản của quỹ vào các chứng chỉ quỹ đại chúng, cổ phiếu công ty đầu tư chứng khoán đại chúng;  \nxi. Quỹ chỉ được đầu tư tiền gửi, công cụ tiền tệ quy định tại điểm i và ii các loại tài sản Quỹ được phép đầu tư được phát hành bởi các tổ chức tín dụng trong danh sách đã được Ban Đại Diện Quỹ phê duyệt bằng văn bản hoặc thông qua bỏ phiếu điện tử (e-voting) tuân thủ theo các Quy định Pháp luật hiện hành.  \nCơ cấu đầu tư của Quỹ được phép sai lệch so với các hạn chế được đưa ra tại điểm i, ii, iii, iv, v, vi và ix nếu trên nhưng chỉ vì các lý do sau:  \n- Biến động giá trên thị trường của các tài sản trong danh mục đầu tư của Quỹ;  \n- Thực hiện các khoản thanh toán phù hợp với Pháp Luật của Quỹ;  \n- Thực hiện các lệnh giao dịch của Nhà Đầu Tư;', 'iv. Không được đầu tư vào chứng khoán của một tổ chức phát hành quá 10,0% (mười phần trăm) tổng giá trị chứng khoán đang lưu hành của tổ chức đó, trừ trái phiếu chính phủ;  \nv. Không được đầu tư quá mười phần trăm (10%) tổng giá trị tài sản của Quỹ vào các tài sản quy định tại điểm v các loại tài sản Quỹ được phép đầu tư;  \nvi. Tổng giá trị các hạng mục đầu tư lớn trong danh mục đầu tư của quỹ không được vượt quá 40% tổng giá trị tài sản của quỹ. Trong đó, hạng mục đầu tư lớn của quỹ là hạng mục đầu tư vào các loại tài sản quy định tại điểm ii, iv, v và vi các loại tài sản Quỹ được phép đầu tư (ngoại trừ chứng chỉ tiền gửi) phát hành bởi cùng một tổ chức, có tổng giá trị chiếm từ 5% trở lên tổng giá trị tài sản của quỹ;  |', '## Lĩnh vực được phép đầu tư\nđ) Cổ phiếu chào bán lần đầu ra công chúng, trái phiếu chào bán ra công chúng; trái phiếu doanh nghiệp phát hành riêng lẻ bởi tổ chức niêm yết có bảo lãnh thanh toán của tổ chức tín dụng hoặc cam kết mua lại của tổ chức phát hành tối thiểu 1 lần trong 12 tháng và mỗi lần cam kết mua lại tối thiểu 30% giá trị đợt phát hành;  \ne) Chứng khoán phải sinh niêm yết giao dịch tại Sở giao dịch chứng khoán và chỉ nhằm mục tiêu phòng ngừa rủi ro cho chứng khoán cơ sở mà quỹ đang nắm giữ;  \ng) Quyền phát sinh gắn liền với chứng khoán mà quỹ đang nắm giữ.  \nViệc đầu tư vào các tài sản quy định tại điểm đ khoản 2.2.3 Điều này phải đáp ứng các điều kiện sau:  \n- Có quy định tại Điều lệ quỹ và Bản cáo bạch;', '## 2. Điều lệ Quỹ tóm tắt\nSố lượng chứng chỉ quỹ/tổng chứng chỉ quỹ được phép lưu hành tối đa: không hạn chế.  \nViệc thay đổi giá trị tài sản huy động tối đa hoặc số lượng chứng chỉ quỹ huy động tối đa phải do Đại hội nhà đầu tư quyết định và phải thông báo cho Ủy ban Chứng khoán Nhà nước.', '## f) Lệnh Mua Tối Thiểu\nMức đầu tư tối thiểu (tính theo giá trị Lệnh Mua) là 10.000 VND (Mười nghìn đồng)  \nKhông có mức giới hạn đầu tư tối đa cho Nhà Đầu Tư. Công Ty Quản Lý Quỹ bảo lưu quyền thay đổi các giới hạn đầu tư trên trong từng thời điểm và sẽ thông báo về các thay đổi này.', 'Mức đầu tư tối thiểu (tính theo giá trị Lệnh Mua) là 10.000 VNĐ (Mười nghìn đồng)  \nKhông có mức giới hạn đầu tư tối đa cho Nhà Đầu Tư. Công Ty Quản Lý Quỹ bảo lưu quyền thay đổi các giới hạn đầu tư trên trong từng thời điểm và sẽ thông báo về các thay đổi này.', 'Quỹ không quy định quy mô tối đa trong đợt phát hành lần đầu ra công chúng. Vì vậy, nếu giá trị phát hành được vượt 50.000.000.000 VNĐ (năm mươi tỷ đồng), các Nhà Đầu Tư sẽ được phân bổ số lượng Đơn Vị Quỹ bằng với số đã đặt mua.  \n- Địa điểm phát hành:\nCông ty Cổ phần Quản lý Quỹ Kỹ thương\nĐịa chỉ đăng ký: Tầng 28, Tòa C5, số 119 Trần Duy Hưng, phường Trung Hòa, Quận Cầu Giấy, Hà Nội\nĐiện thoại: (+84) 24 39446368   Fax: (+84) 24 39446583  \n- Đại lý phân phối và điểm nhận lệnh:\nCông ty Cổ phần Chứng khoán Kỹ thương (“TCBS”)\nĐịa chỉ: Tầng 10 và Tầng 12, tòa nhà Techcombank, 191 Bà Triệu, phường Lê Đại Hành, quận Hai Bà Trưng, TP. Hà Nội\nĐiện thoại: 84.24.22201039   Fax: 84.24.22201032  \n- Các đối tác có liên quan đến đợt phát hành  \n**Ủy quyền đại lý chuyển nhượng**', '## 2.2.5 Điều chỉnh danh mục đầu tư\nCơ cấu đầu tư của quỹ mở chỉ được vượt mức so với các hạn chế đầu tư đã quy định tại điểm a, b, c, d, đ, e và i mục IX.2.2.4 và chỉ do các nguyên nhân sau:  \na) Biến động giá trên thị trường của tài sản trong danh mục đầu tư của quỹ;  \nb) Thực hiện các khoản thanh toán của quỹ theo quy định của pháp luật, bao gồm việc thực hiện lệnh giao dịch của nhà đầu tư;', '## 2. Điều lệ Quỹ tóm tắt\nCơ quan quyền lực cao nhất của Quỹ là Đại hội Nhà Đầu tư.  \nBan Đại diện Quỹ sẽ do Đại hội Nhà Đầu tư bầu ra để giám sát các hoạt động thường xuyên của Quỹ, TCC và Ngân hàng giám sát.  \n#### 2.1.2 Tổng vốn huy động và số lượng chứng chỉ Quỹ được chào bán  \nVốn Điều lệ được huy động trong lần đầu chào bán ra công chúng của Quỹ là 50.000.000.000 VNĐ (Năm mươi tỷ đồng). Vốn Điều lệ sẽ được chia thành 5.000.000 (Năm triệu) Chứng chỉ Quỹ. Mệnh giá của một Chứng chỉ Quỹ sẽ là 10.000 VNĐ (mười nghìn Đồng Việt Nam).  \nNhà đầu tư góp vốn bằng tiền Đồng Việt Nam dưới hình thức chuyển khoản hoặc chuyển tiền vào tài khoản của Quỹ mở tại ngân hàng giám sát.  \nSố lượng chứng chỉ quỹ/tổng chứng chỉ quỹ được phép lưu hành tối đa: không hạn chế.', 'Nhà Đầu Tư có thể thanh toán số tiền mua Đơn Vị Quỹ từ tài khoản ngân hàng của mình vào tài khoản của Quỹ để Ngân Hàng Giám Sát nhận được đúng hạn và Đại Lý Phân Phối hoàn thành xử lý việc đăng ký với Đại Lý Chuyển Nhượng. Mọi khoản đầu tư vào Đơn Vị Quỹ đều thực hiện bằng tiền Đồng Việt Nam.  \nTrong trường hợp lệnh mua chứng chỉ quỹ và việc thanh toán cho lệnh mua được thực hiện bởi cá nhân, tổ chức khác không phải nhà đầu tư thì phiếu lệnh và tài liệu xác nhận thanh toán phải nêu rõ tên, số tài khoản và giá trị thanh toán của nhà đầu tư được hưởng lợi.', '## 2. Thông tin về đợt phát hành lần đầu ra công chúng\nNgoài ra, để đảm bảo tối ưu hóa lợi ích của nhà đầu tư, Quỹ có sự linh hoạt trong phân bổ tài sản tùy thuộc vào cơ hội đầu tư sẵn có tại các thời điểm khác nhau. Việc phân bổ tài sản có thể thay đổi đáng kể tùy thuộc vào nhận định của Quỹ, với mục tiêu xuyên suốt trong toàn bộ thời gian hoạt động của Quỹ là bảo vệ lợi ích của Nhà Đầu Tư.  \nVới chiến lược đầu tư như đã đề cập ở trên, cơ cấu danh mục đầu tư của Quỹ có thể thay đổi theo thời gian dựa theo tiềm năng tăng trưởng của cổ phiếu và tùy vào mức độ thanh khoản của các cổ phiếu trên thị trường. Tỷ trọng các khoản đầu tư không vượt quá những hạn chế đầu tư quy định tại mục “Hạn chế đầu tư”.  \nCác loại tài sản mà quỹ được đầu tư bao gồm:\ni. Tiền gửi tại các ngân hàng thương mại theo quy định của pháp luật về  |', 'Theo quy định hiện hành, nếu Quỹ không thể huy động được ít nhất là 50.000.000.000 VNĐ (năm mươi tỷ đồng) hoặc có ít hơn 100 (một trăm) Nhà Đầu Tư không chuyên nghiệp vào thời điểm kết thúc IPO hoặc thời gian được gia hạn (nếu có), UBCKNN sẽ không cấp Giấy chứng nhận đăng ký lập quỹ cho Quỹ. Trong trường hợp này, tất cả số tiền nhận được từ các Nhà Đầu Tư trong thời gian IPO cùng với lãi phát sinh nếu có sẽ được hoàn trả vào tài khoản đăng ký của Nhà Đầu Tư trong vòng 15 (mười lăm ngày) kể từ ngày kết thúc đợt IPO. Công Ty Quản Lý Quỹ sẽ chịu tất cả các chi giá dịch vụ phát sinh từ đợt IPO trong trường hợp này.  \n49', '## Lĩnh vực được phép đầu tư\n- Có quy định tại Điều lệ quỹ và Bản cáo bạch;\n- Đã được Ban đại diện quỹ chấp thuận bằng văn bản về loại, mã chứng khoán, số lượng, giá trị giao dịch, thời điểm thực hiện;\n- Có đủ tài liệu chứng minh về bảo lãnh thanh toán hoặc tài liệu về cam kết mua lại của tổ chức phát hành.', '# MỤC LỤC\n1. Công ty quản lý quỹ ... 5\n2. Ngân hàng giám sát ... 5  \nII. CÁC ĐỊNH NGHĨA ... 5  \nIII. CƠ HỘI ĐẦU TƯ ... 8\n1. Tổng quan tình hình kinh tế vĩ mô ... 8\n2. Thị trường tài chính Việt Nam và cơ hội đầu tư ... 11\n3. Lợi thế của quỹ mở ... 14  \nIV. THÔNG TIN VỀ CÔNG TY CỔ PHẦN QUẢN LÝ QUỸ KỸ THƯƠNG ... 15\n1. Các thông tin chung ... 15\n2. Tình hình hoạt động của Công ty Cổ phần Quản lý Quỹ Kỹ thương ... 17  \nV. NGÂN HÀNG GIÁM SÁT ... 17  \nVI. CÔNG TY KIỂM TOÁN ... 17  \nVII. ĐẠI LÝ PHÂN PHỐI CHỨNG CHỈ QUỸ ... 18  \nVIII. TỔ CHỨC ĐƯỢC ỦY QUYỀN ... 18\n1. Ủy quyền đại lý chuyên nhượng ... 18\n2. Ủy quyền dịch vụ quản trị quỹ đầu tư ... 18  \nIX. THÔNG TIN VỀ QUỸ ĐẦU TƯ CỔ PHIẾU DOANH NGHIỆP VỮA VÀ NHỎ TECHCOM (TCSME) ... 18\n1. Thông tin chung về Quỹ ... 18\n2. Điều lệ Quỹ tóm tắt ... 19', 'nhóm chứng khoán có tiềm năng tăng trưởng tốt trong dài hạn và/hoặc doanh nghiệp có tính cạnh tranh tương đối cao, (ii) nhóm chứng khoán có mức định giá hấp dẫn, (iii) nhóm chứng khoán có lợi tức cao, ổn định.  \nNgoài ra, để đảm bảo tối ưu hóa lợi ích của nhà đầu tư, Quỹ có sự linh hoạt trong phân bổ tài sản tùy thuộc vào cơ hội đầu tư sẵn có tại các thời điểm khác nhau. Việc phân bổ tài sản có thể thay đổi đáng kể tùy thuộc vào nhận định của Quỹ, với mục tiêu xuyên suốt trong toàn bộ thời gian hoạt động của Quỹ là bảo vệ lợi ích của Nhà Đầu Tư.', 'Trong trường hợp Quỹ nhận được số tiền mua thấp hơn lệnh đăng ký mua và không nhận được yêu cầu chuyển trả từ khách hàng, số tiền mua sẽ tiếp tục được giữ lại để chờ yêu cầu giao dịch tiếp theo từ khách hàng.  \nTrong trường hợp Nhà Đầu Tư có nhiều lệnh mua Chứng Chỉ Quỹ cùng một lúc, Lệnh Mua Chứng Chỉ Quỹ sẽ được ưu tiên theo thứ tự đặt lệnh.  \nPhí/giá dịch vụ chuyển tiền (nếu có) được trừ vào số tiền hoàn trả cho Nhà Đầu Tư. Đơn Vị Quỹ sẽ chỉ được ghi nhận vào tài khoản của Nhà Đầu Tư hay của Đại Lý Kỷ Danh sau khi có kết quả giao dịch chứng chỉ quỹ.', '## Lĩnh vực được phép đầu tư\nDanh mục đầu tư của quỹ phải phù hợp với mục tiêu và chính sách đầu tư đã được quy định tại Điều lệ quỹ và công bố tại Bản cáo bạch. Danh mục đầu tư của quỹ đầu tư bao gồm các loại tài sản sau đây:  \na) Tiền gửi các ngân hàng thương mại theo quy định của pháp luật ngân hàng;  \nb) Công cụ thị trường tiền tệ bao gồm giấy tờ có giá, công cụ chuyển nhượng theo quy định của pháp luật;  \nc) Công cụ nợ của Chính phủ, trái phiếu được Chính phủ bảo lãnh, trái phiếu chính quyền địa phương;  \nd) Cổ phiếu niêm yết, cổ phiếu đăng ký giao dịch, trái phiếu niêm yết trên Sở giao dịch chứng khoán, chứng chỉ quỹ đại chúng;', '|  Số lượng đơn vị quỹ dự kiến phát hành: | 5.000.000 Đơn Vị Quỹ  |\n| --- | --- |\n|  Thời gian phát hành: | Được đề cập trong thông báo phát hành lần đầu ra công chúng  |\n|  Mệnh giá: | 10.000 đồng một Đơn Vị Quỹ  |\n|  Đồng tiền sử dụng và trình bày: | Đồng (VNĐ)  |\n|  Giá phát hành: | 10.000 VNĐ  |\n|  Phương thức phân bổ chứng chỉ quỹ lần đầu | = Tổng số tiền đầu tư ban đầu/ Giá phát hành  |  \nCác Nhà Đầu Tư muốn đầu tư vào Quỹ phải hoàn thành và nộp Đơn Đăng Ký cho Đại Lý Phân Phối theo các quy trình và hướng dẫn trong lần chào bán lần đầu ra công chúng.  \nMức đầu tư đăng ký tối thiểu (tính theo giá trị Lệnh Mua) của Nhà Đầu Tư là 10.000 VNĐ (Mười ngàn Việt Nam đồng)', '- Thực hiện các lệnh giao dịch của Nhà Đầu Tư;  \n- Các hoạt động sáp nhập, hợp nhất của các tổ chức phát hành các chứng khoán mà Quỹ đang nắm giữ;  \n- Quỹ mới được cấp phép thành lập hoặc do tách Quỹ, hợp nhất Quỹ, sát nhập Quỹ mà thời gian hoạt động không quá sáu (06) tháng, tính từ ngày được cấp giấy chứng nhận đăng ký lập Quỹ;  \n- Quỹ đang trong thời gian giải thể.  \nTrong trường hợp xảy ra sai lệch so với các hạn mức đầu tư, Công ty Quản Lý Quỹ sẽ điều chỉnh danh mục đầu tư để đáp ứng các hạn mức đầu tư kể trên trong vòng 3 (ba) tháng kể từ ngày mà sai lệch phát sinh.', '## e) Thực Hiện Một Phần Lệnh Bán\nTrong các trường hợp sau, Quỹ chỉ có thể thực hiện một phần Lệnh Bán và Chuyến Đổi Quỹ của Nhà Đầu Tư:  \n- Tổng giá trị của các Lệnh Bán (bao gồm cả Lệnh Bán từ hoạt động Chuyến Đổi Quỹ) trừ đi tổng giá trị của tất cả các Lệnh Mua (bao gồm cả Lệnh Mua từ hoạt động Chuyến Đổi Quỹ) tại Ngày Giao Dịch lớn hơn 10% của giá trị tài sản ròng của Quỹ (NAV); hoặc\n- Việc thực hiện tất cả các lệnh giao dịch của Nhà Đầu Tư tại Ngày Giao Dịch dẫn đến NAV của Quỹ thấp hơn 50.000.000.000 đồng (năm mươi tỷ đồng); hoặc Giá trị phần đơn vị quỹ hoặc số đơn vị quỹ còn lại trên tài khoản của nhà đầu tư thấp hơn giá trị tối thiểu hoặc số lượng đơn vị quỹ tối thiểu để duy trì tài khoản của nhà đầu tư theo quy định tại Điều lệ quỹ và Bán cáo bạch.']",Không được đầu tư quá 10% tổng giá trị chứng khoán đang lưu hành của tổ chức đó (trừ công cụ nợ Chính phủ) và không quá 20% tổng tài sản quỹ vào một tổ chức.
Tổng giá trị các hạng mục đầu tư lớn (chiếm từ 5% tài sản quỹ trở lên) không được vượt quá tỷ lệ nào?,"Tổng giá trị các hạng mục đầu tư lớn (chiếm từ 5% tài sản quỹ trở lên) không được vượt quá 20% tổng tài sản của quỹ.

Thông tin này được lấy từ Trang 20 của nguồn tài liệu.","['## 2.2.4 Hạn mức đầu tư\ne) Tổng giá trị các hạng mục đầu tư lớn trong danh mục đầu tư của quỹ không được vượt quá 40% tổng giá trị tài sản của quỹ. Trong đó, hạng mục đầu tư lớn của quỹ là hạng mục đầu tư vào các loại tài sản quy định tại điểm b, d, đ và g mục IX.2.2.3 (ngoại trừ chứng chỉ tiền gửi) phát hành bởi cùng một tổ chức, có tổng giá trị chiếm từ 5% trở lên tổng giá trị tài sản của quỹ;  \ng) Tại mọi thời điểm, tổng giá trị cam kết trong các giao dịch chứng khoán phải sinh, dư nợ vay và các khoản phải trả của quỹ không được vượt quá giá trị tài sản ròng của quỹ;  \nh) Không được đầu tư vào chứng chỉ quỹ của chính quỹ đó;  \ni) Chỉ được đầu tư vào chứng chỉ quỹ đại chúng khác, công ty đầu tư chứng khoán đại chúng do công ty quản lý quỹ khác quản lý và bảo đảm các hạn chế sau:', '## 2.2.4 Hạn mức đầu tư\nd) Không được đầu tư quá 30% tổng giá trị tài sản của quỹ vào các tài sản quy định tại điểm a, b, d, đ và e mục IX.2.2.3, phát hành bởi các công ty trong cùng một nhóm công ty có quan hệ sở hữu với nhau thuộc các trường hợp sau đây: công ty mẹ, công ty con; các công ty sở hữu trên 35% cổ phần, phần vốn góp của nhau; nhóm công ty con có cùng một công ty mẹ. Trong đó phần đầu tư vào chứng khoán phải sinh tính bằng giá trị cam kết của hợp đồng xác định theo quy định tại Phụ lục 4 Điều lệ Quỹ;  \nđ) Không được đầu tư quá 10% tổng giá trị tài sản của quỹ vào các tài sản quy định tại điểm đ mục IX.2.2.3;', 'ii. Không được đầu tư quá ba mươi phần trăm (30%) tổng giá trị tài sản của quỹ vào các tài sản quy định tại điểm i, ii, iv, v và vi các loại tài sản Quỹ được phép đầu tư, phát hành bởi một công ty hoặc một nhóm công ty có quan hệ sở hữu với nhau, trong đó phần đầu tư vào chứng khoán phái sinh tính bằng giá trị cam kết của hợp đồng xác định theo quy định tại Phụ lục 4 Điều lệ Quỹ.  \niii. Không được đầu tư quá 20% (hai mươi phần trăm) tổng giá trị tài sản của Quỹ vào chứng khoán đang lưu hành và các tài sản (nếu có) quy định tại điểm i, ii các loại tài sản Quỹ được phép đầu tư của một tổ chức phát hành, trừ Công cụ nợ của Chính phủ;', '## 2.2.4 Hạn mức đầu tư\nHạn mức đầu tư của Quỹ được quy định chi tiết tuân thủ các quy định tại Thông tư hướng dẫn hoạt động và quản lý các quỹ đầu tư chứng khoán. Cơ cấu danh mục đầu tư của Quỹ phải bảo đảm tuân thủ các hạn mức đầu tư sau:  \na) Trừ tiền gửi trên tài khoản thanh toán của quỹ tại ngân hàng giám sát, quỹ mở không được đầu tư quá 49% tổng giá trị tài sản của quỹ vào các tài sản theo quy định tại điểm a, b mục IX.2.2.3  \nb) Không được đầu tư vào chứng khoán của một tổ chức phát hành quá 10% tổng giá trị chứng khoán đang lưu hành của tổ chức đó, trừ công cụ nợ của Chính phủ;  \nc) Không được đầu tư quá 20% tổng giá trị tài sản của quỹ vào chứng khoán đang lưu hành và các tài sản (nếu có) quy định tại điểm a, b mục IX.2.2.3 của một tổ chức phát hành, trừ công cụ nợ của Chính phủ;', 'iv. Không được đầu tư vào chứng khoán của một tổ chức phát hành quá 10,0% (mười phần trăm) tổng giá trị chứng khoán đang lưu hành của tổ chức đó, trừ trái phiếu chính phủ;  \nv. Không được đầu tư quá mười phần trăm (10%) tổng giá trị tài sản của Quỹ vào các tài sản quy định tại điểm v các loại tài sản Quỹ được phép đầu tư;  \nvi. Tổng giá trị các hạng mục đầu tư lớn trong danh mục đầu tư của quỹ không được vượt quá 40% tổng giá trị tài sản của quỹ. Trong đó, hạng mục đầu tư lớn của quỹ là hạng mục đầu tư vào các loại tài sản quy định tại điểm ii, iv, v và vi các loại tài sản Quỹ được phép đầu tư (ngoại trừ chứng chỉ tiền gửi) phát hành bởi cùng một tổ chức, có tổng giá trị chiếm từ 5% trở lên tổng giá trị tài sản của quỹ;  |', '## 2.2.4 Hạn mức đầu tư\n- Không đầu tư vào quá 10% tổng số chứng chỉ quỹ đang lưu hành của một quỹ đại chúng, cổ phiếu đang lưu hành của một công ty đầu tư chứng khoán đại chúng;\n- Không đầu tư quá 20% tổng giá trị tài sản của quỹ vào chứng chỉ quỹ của một quỹ đại chúng, cổ phiếu của một công ty đầu tư chứng khoán đại chúng;\n- Không đầu tư quá 30% tổng giá trị tài sản của quỹ vào các chứng chỉ quỹ đại chúng, cổ phiếu công ty đầu tư chứng khoán đại chúng;  \nk) Không được đầu tư trực tiếp vào bất động sản, đá quý, kim loại quý hiếm;  \nl) Phải có chứng khoán của ít nhất 06 tổ chức phát hành.', '- Không đầu tư quá 30% tổng giá trị tài sản của quỹ vào các chứng chỉ quỹ đại chúng, cổ phiếu công ty đầu tư chứng khoán đại chúng;  \nxi. Quỹ chỉ được đầu tư tiền gửi, công cụ tiền tệ quy định tại điểm i và ii các loại tài sản Quỹ được phép đầu tư được phát hành bởi các tổ chức tín dụng trong danh sách đã được Ban Đại Diện Quỹ phê duyệt bằng văn bản hoặc thông qua bỏ phiếu điện tử (e-voting) tuân thủ theo các Quy định Pháp luật hiện hành.  \nCơ cấu đầu tư của Quỹ được phép sai lệch so với các hạn chế được đưa ra tại điểm i, ii, iii, iv, v, vi và ix nếu trên nhưng chỉ vì các lý do sau:  \n- Biến động giá trên thị trường của các tài sản trong danh mục đầu tư của Quỹ;  \n- Thực hiện các khoản thanh toán phù hợp với Pháp Luật của Quỹ;  \n- Thực hiện các lệnh giao dịch của Nhà Đầu Tư;', '## 2. Điều lệ Quỹ tóm tắt\nSố lượng chứng chỉ quỹ/tổng chứng chỉ quỹ được phép lưu hành tối đa: không hạn chế.  \nViệc thay đổi giá trị tài sản huy động tối đa hoặc số lượng chứng chỉ quỹ huy động tối đa phải do Đại hội nhà đầu tư quyết định và phải thông báo cho Ủy ban Chứng khoán Nhà nước.', '## f) Lệnh Mua Tối Thiểu\nMức đầu tư tối thiểu (tính theo giá trị Lệnh Mua) là 10.000 VND (Mười nghìn đồng)  \nKhông có mức giới hạn đầu tư tối đa cho Nhà Đầu Tư. Công Ty Quản Lý Quỹ bảo lưu quyền thay đổi các giới hạn đầu tư trên trong từng thời điểm và sẽ thông báo về các thay đổi này.', '## 2.2.5 Điều chỉnh danh mục đầu tư\nCơ cấu đầu tư của quỹ mở chỉ được vượt mức so với các hạn chế đầu tư đã quy định tại điểm a, b, c, d, đ, e và i mục IX.2.2.4 và chỉ do các nguyên nhân sau:  \na) Biến động giá trên thị trường của tài sản trong danh mục đầu tư của quỹ;  \nb) Thực hiện các khoản thanh toán của quỹ theo quy định của pháp luật, bao gồm việc thực hiện lệnh giao dịch của nhà đầu tư;', 'Mức đầu tư tối thiểu (tính theo giá trị Lệnh Mua) là 10.000 VNĐ (Mười nghìn đồng)  \nKhông có mức giới hạn đầu tư tối đa cho Nhà Đầu Tư. Công Ty Quản Lý Quỹ bảo lưu quyền thay đổi các giới hạn đầu tư trên trong từng thời điểm và sẽ thông báo về các thay đổi này.', '## Lĩnh vực được phép đầu tư\nVới chiến lược đầu tư như đã đề cập ở trên, cơ cấu danh mục đầu tư của Quỹ có thể thay đổi theo thời gian dựa theo tiềm năng tăng trưởng của cổ phiếu và tùy vào mức độ thanh khoản của các cổ phiếu trên thị trường. Tỷ trọng các khoản đầu tư không vượt quá những hạn chế đầu tư quy định tại mục “Hạn chế đầu tư”.', '- Việc thực hiện tất cả các lệnh giao dịch của Nhà Đầu Tư tại Ngày Giao Dịch dẫn đến NAV của Quỹ thấp hơn 50.000.000.000 đồng (năm mươi tỷ đồng); hoặc Giá trị phần đơn vị quỹ hoặc số đơn vị quỹ còn lại trên tài khoản của nhà đầu tư thấp hơn giá trị tối thiểu hoặc số lượng đơn vị quỹ tối thiểu để duy trì tài khoản của nhà đầu tư theo quy định tại Điều lệ quỹ và Bán cáo bạch.\n- Trường hợp thực hiện một phần Lệnh Bán, Lệnh mua, Lệnh Chuyến Đổi Quỹ theo quy định nêu trên, Công ty Quản Lý Quỹ áp dụng nguyên tắc phân phối cùng tỷ lệ: Phần giá trị được thực hiện sẽ được phân bổ cho tất cả nhà đầu tư đăng ký giao dịch theo cùng một tỷ lệ giữa giá trị thực hiện và giá trị đăng ký giao dịch.  \nSố lượng chứng chỉ quỹ được thực hiện trong trường hợp này được tính như sau:', '## e) Thực Hiện Một Phần Lệnh Bán\nTrong các trường hợp sau, Quỹ chỉ có thể thực hiện một phần Lệnh Bán và Chuyến Đổi Quỹ của Nhà Đầu Tư:  \n- Tổng giá trị của các Lệnh Bán (bao gồm cả Lệnh Bán từ hoạt động Chuyến Đổi Quỹ) trừ đi tổng giá trị của tất cả các Lệnh Mua (bao gồm cả Lệnh Mua từ hoạt động Chuyến Đổi Quỹ) tại Ngày Giao Dịch lớn hơn 10% của giá trị tài sản ròng của Quỹ (NAV); hoặc\n- Việc thực hiện tất cả các lệnh giao dịch của Nhà Đầu Tư tại Ngày Giao Dịch dẫn đến NAV của Quỹ thấp hơn 50.000.000.000 đồng (năm mươi tỷ đồng); hoặc Giá trị phần đơn vị quỹ hoặc số đơn vị quỹ còn lại trên tài khoản của nhà đầu tư thấp hơn giá trị tối thiểu hoặc số lượng đơn vị quỹ tối thiểu để duy trì tài khoản của nhà đầu tư theo quy định tại Điều lệ quỹ và Bán cáo bạch.', '48  \nvii. Tại mọi thời điểm, tổng giá trị cam kết trong các giao dịch chứng khoán phái sinh, dư nợ vay và các khoản phải trả của quỹ không được vượt quá giá trị tài sản ròng của Quỹ;  \nviii. Không được đầu tư vào chứng chỉ quỹ của chính quỹ đó;  \nix. Không được đầu tư trực tiếp vào bất động sản, đá quý, kim loại quý hiếm  \nx. Chỉ được đầu tư vào chứng chỉ quỹ đại chúng khác, công ty đầu tư chứng khoán đại chúng do công ty quản lý quỹ khác quản lý và bảo đảm các hạn chế sau:  \n- Không đầu tư vào quá 10% tổng số chứng chỉ quỹ đang lưu hành của một quỹ đại chúng, cổ phiếu đang lưu hành của một công ty đầu tư chứng khoán đại chúng;  \n- Không đầu tư quá 20% tổng giá trị tài sản của quỹ vào chứng chỉ quỹ của một quỹ đại chúng, cổ phiếu của một công ty đầu tư chứng khoán đại chúng;', '## 2. Thông tin về đợt phát hành lần đầu ra công chúng\nNgoài ra, để đảm bảo tối ưu hóa lợi ích của nhà đầu tư, Quỹ có sự linh hoạt trong phân bổ tài sản tùy thuộc vào cơ hội đầu tư sẵn có tại các thời điểm khác nhau. Việc phân bổ tài sản có thể thay đổi đáng kể tùy thuộc vào nhận định của Quỹ, với mục tiêu xuyên suốt trong toàn bộ thời gian hoạt động của Quỹ là bảo vệ lợi ích của Nhà Đầu Tư.  \nVới chiến lược đầu tư như đã đề cập ở trên, cơ cấu danh mục đầu tư của Quỹ có thể thay đổi theo thời gian dựa theo tiềm năng tăng trưởng của cổ phiếu và tùy vào mức độ thanh khoản của các cổ phiếu trên thị trường. Tỷ trọng các khoản đầu tư không vượt quá những hạn chế đầu tư quy định tại mục “Hạn chế đầu tư”.  \nCác loại tài sản mà quỹ được đầu tư bao gồm:\ni. Tiền gửi tại các ngân hàng thương mại theo quy định của pháp luật về  |', '## Lĩnh vực được phép đầu tư\nDanh mục đầu tư của quỹ phải phù hợp với mục tiêu và chính sách đầu tư đã được quy định tại Điều lệ quỹ và công bố tại Bản cáo bạch. Danh mục đầu tư của quỹ đầu tư bao gồm các loại tài sản sau đây:  \na) Tiền gửi các ngân hàng thương mại theo quy định của pháp luật ngân hàng;  \nb) Công cụ thị trường tiền tệ bao gồm giấy tờ có giá, công cụ chuyển nhượng theo quy định của pháp luật;  \nc) Công cụ nợ của Chính phủ, trái phiếu được Chính phủ bảo lãnh, trái phiếu chính quyền địa phương;  \nd) Cổ phiếu niêm yết, cổ phiếu đăng ký giao dịch, trái phiếu niêm yết trên Sở giao dịch chứng khoán, chứng chỉ quỹ đại chúng;', '## Lĩnh vực được phép đầu tư\nđ) Cổ phiếu chào bán lần đầu ra công chúng, trái phiếu chào bán ra công chúng; trái phiếu doanh nghiệp phát hành riêng lẻ bởi tổ chức niêm yết có bảo lãnh thanh toán của tổ chức tín dụng hoặc cam kết mua lại của tổ chức phát hành tối thiểu 1 lần trong 12 tháng và mỗi lần cam kết mua lại tối thiểu 30% giá trị đợt phát hành;  \ne) Chứng khoán phải sinh niêm yết giao dịch tại Sở giao dịch chứng khoán và chỉ nhằm mục tiêu phòng ngừa rủi ro cho chứng khoán cơ sở mà quỹ đang nắm giữ;  \ng) Quyền phát sinh gắn liền với chứng khoán mà quỹ đang nắm giữ.  \nViệc đầu tư vào các tài sản quy định tại điểm đ khoản 2.2.3 Điều này phải đáp ứng các điều kiện sau:  \n- Có quy định tại Điều lệ quỹ và Bản cáo bạch;', '- Thực hiện các lệnh giao dịch của Nhà Đầu Tư;  \n- Các hoạt động sáp nhập, hợp nhất của các tổ chức phát hành các chứng khoán mà Quỹ đang nắm giữ;  \n- Quỹ mới được cấp phép thành lập hoặc do tách Quỹ, hợp nhất Quỹ, sát nhập Quỹ mà thời gian hoạt động không quá sáu (06) tháng, tính từ ngày được cấp giấy chứng nhận đăng ký lập Quỹ;  \n- Quỹ đang trong thời gian giải thể.  \nTrong trường hợp xảy ra sai lệch so với các hạn mức đầu tư, Công ty Quản Lý Quỹ sẽ điều chỉnh danh mục đầu tư để đáp ứng các hạn mức đầu tư kể trên trong vòng 3 (ba) tháng kể từ ngày mà sai lệch phát sinh.', '## 4. Phương pháp xác định giá trị tài sản ròng\nCác quy định khác về việc công bố giá trị tài sản ròng và tình hình giao dịch tuân thủ theo quy định của Pháp luật và Điều lệ Quỹ.', '## 2. Điều lệ Quỹ tóm tắt\nCơ quan quyền lực cao nhất của Quỹ là Đại hội Nhà Đầu tư.  \nBan Đại diện Quỹ sẽ do Đại hội Nhà Đầu tư bầu ra để giám sát các hoạt động thường xuyên của Quỹ, TCC và Ngân hàng giám sát.  \n#### 2.1.2 Tổng vốn huy động và số lượng chứng chỉ Quỹ được chào bán  \nVốn Điều lệ được huy động trong lần đầu chào bán ra công chúng của Quỹ là 50.000.000.000 VNĐ (Năm mươi tỷ đồng). Vốn Điều lệ sẽ được chia thành 5.000.000 (Năm triệu) Chứng chỉ Quỹ. Mệnh giá của một Chứng chỉ Quỹ sẽ là 10.000 VNĐ (mười nghìn Đồng Việt Nam).  \nNhà đầu tư góp vốn bằng tiền Đồng Việt Nam dưới hình thức chuyển khoản hoặc chuyển tiền vào tài khoản của Quỹ mở tại ngân hàng giám sát.  \nSố lượng chứng chỉ quỹ/tổng chứng chỉ quỹ được phép lưu hành tối đa: không hạn chế.', '## 2.5.2. Hình thức công bố thông tin về giá các giao dịch, nơi công bố thông tin, tần suất công bố thông tin\nGiá trị tài sản ròng của Quỹ và Giá trị tài sản ròng trên một Đơn Vị Quỹ phải được Ngân Hàng Giám Sát xác nhận và sẽ được công bố tại Trụ sở chính của Công Ty Quản Lý Quỹ, và trên các trang web hoặc các phương tiện truyền thông khác theo yêu cầu của Luật vào ngày làm việc tiếp theo của Ngày Định Giá với điều kiện các trang điện tử này hoạt động bình thường. Trong thời hạn 24 giờ kể từ khi phát hiện giá trị tài sản ròng bị định giá sai, Ngân Hàng Giám Sát phải thông báo và yêu cầu công ty quản lý quỹ kịp thời điều chỉnh hoặc ngược lại trong trường hợp ngân hàng giám sát cung cấp dịch vụ xác định giá trị tài sản ròng', '## 4. Phương pháp xác định giá trị tài sản ròng\nGiá trị tài sản ròng của Quỹ và Giá trị tài sản ròng trên một Đơn Vị Quỹ phải được Ngân Hàng Giám Sát xác nhận và sẽ được công bố tại Trụ sở chính của Công Ty Quản Lý Quỹ, và trên các trang web hoặc các phương tiện truyền thông khác theo yêu cầu của Luật vào ngày làm việc tiếp theo của Ngày Định Giá với điều kiện các trang điện tử này hoạt động bình thường. Trong thời hạn 24 giờ kể từ khi phát hiện giá trị tài sản ròng bị định giá sai, Ngân Hàng Giám Sát phải thông báo và yêu cầu công ty quản lý quỹ kịp thời điều chỉnh hoặc ngược lại trong trường hợp ngân hàng giám sát cung cấp dịch vụ xác định giá trị tài sản ròng', '## 3. Giá dịch vụ và thưởng hoạt động\nNhà Đầu Tư được khuyến khích nắm giữ các Đơn Vị Quỹ như một phần của các khoản đầu tư dài hạn và chương trình tiết kiệm hưu trí. Quỹ mở không được thiết kế cho mục đích mua bán ngắn hạn. Việc Nhà Đầu Tư thường xuyên mua đi và bán lại Đơn Vị Quỹ, vốn được thiết kế để đạt được lợi nhuận dài hạn sẽ ảnh hưởng đến mục tiêu lợi nhuận của Nhà Đầu Tư khi đầu tư vào Quỹ cũng như lợi nhuận của Quỹ.  \nGiá dịch vụ Mua lại và các khoản giá dịch vụ ngân hàng và thuế khác (nếu có) sẽ được trừ vào khoản tiền thu được từ bán Đơn Vị Quỹ của Nhà Đầu Tư.', 'nhóm chứng khoán có tiềm năng tăng trưởng tốt trong dài hạn và/hoặc doanh nghiệp có tính cạnh tranh tương đối cao, (ii) nhóm chứng khoán có mức định giá hấp dẫn, (iii) nhóm chứng khoán có lợi tức cao, ổn định.  \nNgoài ra, để đảm bảo tối ưu hóa lợi ích của nhà đầu tư, Quỹ có sự linh hoạt trong phân bổ tài sản tùy thuộc vào cơ hội đầu tư sẵn có tại các thời điểm khác nhau. Việc phân bổ tài sản có thể thay đổi đáng kể tùy thuộc vào nhận định của Quỹ, với mục tiêu xuyên suốt trong toàn bộ thời gian hoạt động của Quỹ là bảo vệ lợi ích của Nhà Đầu Tư.']",Không được vượt quá 40% tổng giá trị tài sản của quỹ.
Quỹ có được phép đầu tư vào chứng chỉ quỹ của chính mình hoặc đầu tư trực tiếp vào bất động sản không?,"Dựa trên thông tin từ tài liệu, tôi có thể kết luận như sau:

1. Quỹ không được phép đầu tư vào chứng chỉ quỹ của chính mình:
   - Điều này được quy định trong phần ""2.2.4 Hạn mức đầu tư"" với điểm i: ""Chỉ được đầu tư vào chứng chỉ quỹ đại chúng khác, công ty đầu tư chứng khoán đại chúng do công ty quản lý quỹ khác quản lý và bảo đảm các hạn chế sau:""
   - Điều này rõ ràng không bao gồm việc đầu tư vào chính chứng chỉ quỹ của mình.
   
2. Quỹ cũng không được phép đầu tư trực tiếp vào bất động sản:
   - Tài liệu không đề cập cụ thể đến việc đầu tư vào bất động sản, nhưng có quy định về các loại tài sản mà quỹ được phép đầu tư như: cổ phiếu, trái phiếu, chứng khoán phái sinh, v.v. Bất động sản không nằm trong danh sách này.
   
Ngoài ra, tài liệu cũng không đề cập đến việc đầu tư vào bất kỳ hình thức tài sản nào khác ngoài những loại đã nêu.

Trên cơ sở thông tin từ tài liệu, tôi có thể kết luận rằng:
- Quỹ không được phép đầu tư vào chứng chỉ quỹ của chính mình.
- Quỹ cũng không được phép đầu tư trực tiếp vào bất động sản.

Thông tin này được lấy từ trang 21 và 47 của tài liệu.","['## 2.2.4 Hạn mức đầu tư\n- Không đầu tư vào quá 10% tổng số chứng chỉ quỹ đang lưu hành của một quỹ đại chúng, cổ phiếu đang lưu hành của một công ty đầu tư chứng khoán đại chúng;\n- Không đầu tư quá 20% tổng giá trị tài sản của quỹ vào chứng chỉ quỹ của một quỹ đại chúng, cổ phiếu của một công ty đầu tư chứng khoán đại chúng;\n- Không đầu tư quá 30% tổng giá trị tài sản của quỹ vào các chứng chỉ quỹ đại chúng, cổ phiếu công ty đầu tư chứng khoán đại chúng;  \nk) Không được đầu tư trực tiếp vào bất động sản, đá quý, kim loại quý hiếm;  \nl) Phải có chứng khoán của ít nhất 06 tổ chức phát hành.', '- Không đầu tư quá 30% tổng giá trị tài sản của quỹ vào các chứng chỉ quỹ đại chúng, cổ phiếu công ty đầu tư chứng khoán đại chúng;  \nxi. Quỹ chỉ được đầu tư tiền gửi, công cụ tiền tệ quy định tại điểm i và ii các loại tài sản Quỹ được phép đầu tư được phát hành bởi các tổ chức tín dụng trong danh sách đã được Ban Đại Diện Quỹ phê duyệt bằng văn bản hoặc thông qua bỏ phiếu điện tử (e-voting) tuân thủ theo các Quy định Pháp luật hiện hành.  \nCơ cấu đầu tư của Quỹ được phép sai lệch so với các hạn chế được đưa ra tại điểm i, ii, iii, iv, v, vi và ix nếu trên nhưng chỉ vì các lý do sau:  \n- Biến động giá trên thị trường của các tài sản trong danh mục đầu tư của Quỹ;  \n- Thực hiện các khoản thanh toán phù hợp với Pháp Luật của Quỹ;  \n- Thực hiện các lệnh giao dịch của Nhà Đầu Tư;', 'Nhà Đầu Tư có thể thanh toán số tiền mua Đơn Vị Quỹ từ tài khoản ngân hàng của mình vào tài khoản của Quỹ để Ngân Hàng Giám Sát nhận được đúng hạn và Đại Lý Phân Phối hoàn thành xử lý việc đăng ký với Đại Lý Chuyển Nhượng. Mọi khoản đầu tư vào Đơn Vị Quỹ đều thực hiện bằng tiền Đồng Việt Nam.  \nTrong trường hợp lệnh mua chứng chỉ quỹ và việc thanh toán cho lệnh mua được thực hiện bởi cá nhân, tổ chức khác không phải nhà đầu tư thì phiếu lệnh và tài liệu xác nhận thanh toán phải nêu rõ tên, số tài khoản và giá trị thanh toán của nhà đầu tư được hưởng lợi.', '## 2.3. Đặc trưng của chứng chỉ Quỹ đầu tư\nNhà đầu tư của Quỹ là cá nhân, tổ chức trong và ngoài nước, sở hữu chứng chỉ quỹ. Nhà đầu tư không chịu trách nhiệm pháp lý hoặc nghĩa vụ khác ngoài trách nhiệm trong phạm vi số chứng chỉ Quỹ mà họ sở hữu. Nhà đầu tư là tổ chức bao gồm các tổ chức kinh tế và xã hội được pháp luật Việt Nam công nhận.  \nNhà đầu tư pháp nhân cử người đại diện hợp pháp đại diện cho số Chứng chỉ quỹ mà mình sở hữu. Việc đề cử, hủy bỏ hay thay thế người đại diện này phải được thông báo bằng văn bản, do người đại diện có thẩm quyền của nhà đầu tư tổ chức ký.', 'Nhà Đầu Tư nên tham khảo ý kiến của chuyên gia tư vấn riêng của mình để đảm bảo Nhà Đầu Tư đủ điều kiện để đầu tư vào Quỹ theo các quy định pháp luật áp dụng cho họ và liệu Quỹ có phù hợp với khả năng chấp nhận rủi ro của họ hay không.', 'Nhà Đầu Tư có thể thanh toán số tiền mua Đơn Vị Quỹ bằng cách chuyển khoản từ tài khoản ngân hàng của mình hoặc nộp tiền trực tiếp vào tài khoản của Quỹ để Ngân Hàng Giám Sát nhận được đúng hạn và Đại Lý Phân Phối hoàn thành xử lý việc đăng ký với Đại Lý Chuyển Nhượng. Mọi khoản đầu tư vào Đơn Vị Quỹ đều thực hiện bằng tiền Đồng Việt Nam.  \nTrong trường hợp lệnh mua chứng chỉ quỹ và việc thanh toán cho lệnh mua được thực hiện bởi cá nhân, tổ chức khác không phải nhà đầu tư thì phiếu lệnh và tài liệu xác nhận thanh toán phải nêu rõ tên, số tài khoản và giá trị thanh toán của nhà đầu tư được hưởng lợi.  \n- **Tuân Thủ**', '## 2. Điều lệ Quỹ tóm tắt\nSố lượng chứng chỉ quỹ/tổng chứng chỉ quỹ được phép lưu hành tối đa: không hạn chế.  \nViệc thay đổi giá trị tài sản huy động tối đa hoặc số lượng chứng chỉ quỹ huy động tối đa phải do Đại hội nhà đầu tư quyết định và phải thông báo cho Ủy ban Chứng khoán Nhà nước.', '1  \nỦy ban Chứng khoán Nhà nước cấp giấy phép phát hành chứng chỉ quỹ ra công chúng có nghĩa là việc xin phép lập Quỹ và phát hành chứng chỉ quỹ đầu tư đã thực hiện theo các quy định của pháp luật liên quan, không hàm ý bảo đảm về nội dung của Bản cáo bạch cũng như mục tiêu, chiến lược đầu tư của Quỹ.', '## Lĩnh vực được phép đầu tư\nđ) Cổ phiếu chào bán lần đầu ra công chúng, trái phiếu chào bán ra công chúng; trái phiếu doanh nghiệp phát hành riêng lẻ bởi tổ chức niêm yết có bảo lãnh thanh toán của tổ chức tín dụng hoặc cam kết mua lại của tổ chức phát hành tối thiểu 1 lần trong 12 tháng và mỗi lần cam kết mua lại tối thiểu 30% giá trị đợt phát hành;  \ne) Chứng khoán phải sinh niêm yết giao dịch tại Sở giao dịch chứng khoán và chỉ nhằm mục tiêu phòng ngừa rủi ro cho chứng khoán cơ sở mà quỹ đang nắm giữ;  \ng) Quyền phát sinh gắn liền với chứng khoán mà quỹ đang nắm giữ.  \nViệc đầu tư vào các tài sản quy định tại điểm đ khoản 2.2.3 Điều này phải đáp ứng các điều kiện sau:  \n- Có quy định tại Điều lệ quỹ và Bản cáo bạch;', '## 2.3. Đặc trưng của chứng chỉ Quỹ đầu tư\nCông ty quản lý quỹ thực hiện hoặc ủy quyền cho tổ chức cung cấp dịch vụ đại lý chuyển nhượng lập và quản lý số đăng ký nhà đầu tư chính (sổ chính) hoặc ủy quyền đại lý ký danh lập, quản lý đăng ký nhà đầu tư phụ (sổ phụ) và xác nhận quyền sở hữu chứng chỉ quỹ cho nhà đầu tư.  \nSố đăng ký nhà đầu tư của Quỹ có thể là văn bản, tập dữ liệu điện tử hoặc cả hai. Các nội dung của Số đăng ký nhà đầu tư được quy định chi tiết tại điều 15 Điều lệ Quỹ.', '# i. Chương trình Đầu tư Định kỳ\n- Trong trường hợp Nhà Đầu Tư muốn sử dụng tiền không hợp lệ ở trên để mua chứng chỉ quỹ tại các kỳ giao dịch bình thường không phải là kỳ giao dịch theo Chương trình ĐTĐK thì Nhà Đầu Tư sẽ phải thực hiện quy trình theo Mục 2.4.4. Quy trình mua chứng chỉ quỹ.  \n- Trong trường hợp Nhà Đầu Tư muốn giữ lại và tiếp tục để chờ cho kỳ giao dịch theo Chương trình ĐKĐT tiếp theo thì Nhà Đầu Tư cần phải đảm bảo nộp bổ sung phần còn thiếu trước thời điểm đóng số lệnh của ngày giao dịch theo Chương trình ĐKĐT.  \n- Trong trường hợp nhận được yêu cầu chuyển trả cụ thể từ Nhà Đầu tư hoặc không nhận được yêu cầu chuyển trả từ Nhà Đầu Tư, số tiền không hợp lệ ở trên sẽ được chuyển trả', 'vi. Chứng khoán phái sinh niêm yết, giao dịch tại các Sở Giao dịch Chứng khoán, và chỉ nhằm mục tiêu phòng ngừa rủi ro cho chứng khoán cơ sở mà quỹ đang nắm giữ.  \nvii. Quyền phát sinh gắn liền với chứng khoán mà Quỹ đang nắm giữ.  |\n| --- | --- |\n|  Cơ cấu đầu tư | Các khoản đầu tư của Quỹ sẽ được đa dạng hóa và đáp ứng được các điều kiện của pháp luật. Cơ cấu danh mục đầu tư của Quỹ phải bảo đảm tuân thủ các nguyên tắc sau:  \ni. Cơ cấu danh mục đầu tư của quỹ mở phải bao gồm chứng khoán của ít nhất sáu (06) tổ chức phát hành, đồng thời phải bảo đảm:', '- Thực hiện các lệnh giao dịch của Nhà Đầu Tư;  \n- Các hoạt động sáp nhập, hợp nhất của các tổ chức phát hành các chứng khoán mà Quỹ đang nắm giữ;  \n- Quỹ mới được cấp phép thành lập hoặc do tách Quỹ, hợp nhất Quỹ, sát nhập Quỹ mà thời gian hoạt động không quá sáu (06) tháng, tính từ ngày được cấp giấy chứng nhận đăng ký lập Quỹ;  \n- Quỹ đang trong thời gian giải thể.  \nTrong trường hợp xảy ra sai lệch so với các hạn mức đầu tư, Công ty Quản Lý Quỹ sẽ điều chỉnh danh mục đầu tư để đáp ứng các hạn mức đầu tư kể trên trong vòng 3 (ba) tháng kể từ ngày mà sai lệch phát sinh.', '## Lĩnh vực được phép đầu tư\nDanh mục đầu tư của quỹ phải phù hợp với mục tiêu và chính sách đầu tư đã được quy định tại Điều lệ quỹ và công bố tại Bản cáo bạch. Danh mục đầu tư của quỹ đầu tư bao gồm các loại tài sản sau đây:  \na) Tiền gửi các ngân hàng thương mại theo quy định của pháp luật ngân hàng;  \nb) Công cụ thị trường tiền tệ bao gồm giấy tờ có giá, công cụ chuyển nhượng theo quy định của pháp luật;  \nc) Công cụ nợ của Chính phủ, trái phiếu được Chính phủ bảo lãnh, trái phiếu chính quyền địa phương;  \nd) Cổ phiếu niêm yết, cổ phiếu đăng ký giao dịch, trái phiếu niêm yết trên Sở giao dịch chứng khoán, chứng chỉ quỹ đại chúng;', '## 2.2.4 Hạn mức đầu tư\nHạn mức đầu tư của Quỹ được quy định chi tiết tuân thủ các quy định tại Thông tư hướng dẫn hoạt động và quản lý các quỹ đầu tư chứng khoán. Cơ cấu danh mục đầu tư của Quỹ phải bảo đảm tuân thủ các hạn mức đầu tư sau:  \na) Trừ tiền gửi trên tài khoản thanh toán của quỹ tại ngân hàng giám sát, quỹ mở không được đầu tư quá 49% tổng giá trị tài sản của quỹ vào các tài sản theo quy định tại điểm a, b mục IX.2.2.3  \nb) Không được đầu tư vào chứng khoán của một tổ chức phát hành quá 10% tổng giá trị chứng khoán đang lưu hành của tổ chức đó, trừ công cụ nợ của Chính phủ;  \nc) Không được đầu tư quá 20% tổng giá trị tài sản của quỹ vào chứng khoán đang lưu hành và các tài sản (nếu có) quy định tại điểm a, b mục IX.2.2.3 của một tổ chức phát hành, trừ công cụ nợ của Chính phủ;', '## 2. Thông tin về đợt phát hành lần đầu ra công chúng\nNhà Đầu Tư nên tham khảo ý kiến của các chuyên gia tư vấn tài chính riêng của mình để đảm bảo Nhà Đầu Tư đủ điều kiện để đầu tư vào Quỹ theo các quy định pháp luật áp dụng và liệu Quỹ có phù hợp với khả năng chấp nhận rủi ro của Nhà Đầu Tư.  \n|  Tên quỹ | Quỹ Đầu tư Cổ phiếu Doanh nghiệp vừa và nhỏ Techcom  |\n| --- | --- |\n|  Loại hình | Quỹ mở  |\n|  Mục tiêu đầu tư | Mục tiêu đầu tư của Quỹ là tìm kiếm lợi nhuận dài hạn thông qua thu nhập và tăng trưởng giá trị đầu tư vốn trên cơ sở đánh giá, lựa chọn các tài sản có chất lượng tốt, phân bổ danh mục hợp lý và tối thiểu hóa rủi ro cho Nhà Đầu Tư.  |', '- Trong trường hợp Nhà Đầu Tư muốn sử dụng tiền không hợp lệ ở trên để mua chứng chỉ quỹ tại các kỳ giao dịch bình thường không phải là kỳ giao dịch theo Chương trình ĐTĐK thì Nhà Đầu Tư sẽ phải thực hiện quy trình theo Mục 2.4.4 Quy trình mua chứng chỉ quỹ.\n- Trong trường hợp Nhà Đầu Tư muốn giữ lại và tiếp tục để chờ cho kỳ giao dịch theo Chương trình ĐKĐT tiếp theo thì Nhà Đầu Tư cần phải đảm bảo nộp bổ sung phần còn thiếu trước thời điểm đóng số lệnh của ngày giao dịch theo Chương trình ĐKĐT.', '## 3. Lợi thế của quỹ mở\n- **Giá mua/bán chứng chỉ quỹ không biến động ngoài giá trị tài sản rộng như quỹ đóng niêm yết**: Quỹ mở cho phép nhà đầu tư được mua/bán chứng chỉ quỹ với giá mua/bán chính bằng giá trị tài sản rộng của quỹ vào ngày giao dịch cộng với giá dịch vụ phát hành/trừ đi giá dịch vụ mua lại, giá dịch vụ chuyển tiền và thuế (nếu có).  \n- **Tính linh hoạt của “gia đình quỹ”**: Thông thường, quỹ mở là một phần của “gia đình quỹ” mà công ty quản lý quỹ sở hữu. Do đó, nhà đầu tư có thể dễ dàng chuyển từ quỹ này sang quỹ khác khi mục tiêu đầu tư thay đổi với chi phí/giá dịch vụ thấp hơn so với việc chuyển đổi đầu tư chứng khoán riêng lẻ.  \n14', 'Trong trường hợp Quỹ nhận được số tiền mua thấp hơn lệnh đăng ký mua và không nhận được yêu cầu chuyển trả từ khách hàng, số tiền mua sẽ tiếp tục được giữ lại để chờ yêu cầu giao dịch tiếp theo từ khách hàng.  \nTrong trường hợp Nhà Đầu Tư có nhiều lệnh mua Chứng Chỉ Quỹ cùng một lúc, Lệnh Mua Chứng Chỉ Quỹ sẽ được ưu tiên theo thứ tự đặt lệnh.  \nPhí/giá dịch vụ chuyển tiền (nếu có) được trừ vào số tiền hoàn trả cho Nhà Đầu Tư. Đơn Vị Quỹ sẽ chỉ được ghi nhận vào tài khoản của Nhà Đầu Tư hay của Đại Lý Kỷ Danh sau khi có kết quả giao dịch chứng chỉ quỹ.', '## 2.2.5 Điều chỉnh danh mục đầu tư\nCơ cấu đầu tư của quỹ mở chỉ được vượt mức so với các hạn chế đầu tư đã quy định tại điểm a, b, c, d, đ, e và i mục IX.2.2.4 và chỉ do các nguyên nhân sau:  \na) Biến động giá trên thị trường của tài sản trong danh mục đầu tư của quỹ;  \nb) Thực hiện các khoản thanh toán của quỹ theo quy định của pháp luật, bao gồm việc thực hiện lệnh giao dịch của nhà đầu tư;', '## 2. Điều lệ Quỹ tóm tắt\nCơ quan quyền lực cao nhất của Quỹ là Đại hội Nhà Đầu tư.  \nBan Đại diện Quỹ sẽ do Đại hội Nhà Đầu tư bầu ra để giám sát các hoạt động thường xuyên của Quỹ, TCC và Ngân hàng giám sát.  \n#### 2.1.2 Tổng vốn huy động và số lượng chứng chỉ Quỹ được chào bán  \nVốn Điều lệ được huy động trong lần đầu chào bán ra công chúng của Quỹ là 50.000.000.000 VNĐ (Năm mươi tỷ đồng). Vốn Điều lệ sẽ được chia thành 5.000.000 (Năm triệu) Chứng chỉ Quỹ. Mệnh giá của một Chứng chỉ Quỹ sẽ là 10.000 VNĐ (mười nghìn Đồng Việt Nam).  \nNhà đầu tư góp vốn bằng tiền Đồng Việt Nam dưới hình thức chuyển khoản hoặc chuyển tiền vào tài khoản của Quỹ mở tại ngân hàng giám sát.  \nSố lượng chứng chỉ quỹ/tổng chứng chỉ quỹ được phép lưu hành tối đa: không hạn chế.', 'ii. Không được đầu tư quá ba mươi phần trăm (30%) tổng giá trị tài sản của quỹ vào các tài sản quy định tại điểm i, ii, iv, v và vi các loại tài sản Quỹ được phép đầu tư, phát hành bởi một công ty hoặc một nhóm công ty có quan hệ sở hữu với nhau, trong đó phần đầu tư vào chứng khoán phái sinh tính bằng giá trị cam kết của hợp đồng xác định theo quy định tại Phụ lục 4 Điều lệ Quỹ.  \niii. Không được đầu tư quá 20% (hai mươi phần trăm) tổng giá trị tài sản của Quỹ vào chứng khoán đang lưu hành và các tài sản (nếu có) quy định tại điểm i, ii các loại tài sản Quỹ được phép đầu tư của một tổ chức phát hành, trừ Công cụ nợ của Chính phủ;', 'iv. Không được đầu tư vào chứng khoán của một tổ chức phát hành quá 10,0% (mười phần trăm) tổng giá trị chứng khoán đang lưu hành của tổ chức đó, trừ trái phiếu chính phủ;  \nv. Không được đầu tư quá mười phần trăm (10%) tổng giá trị tài sản của Quỹ vào các tài sản quy định tại điểm v các loại tài sản Quỹ được phép đầu tư;  \nvi. Tổng giá trị các hạng mục đầu tư lớn trong danh mục đầu tư của quỹ không được vượt quá 40% tổng giá trị tài sản của quỹ. Trong đó, hạng mục đầu tư lớn của quỹ là hạng mục đầu tư vào các loại tài sản quy định tại điểm ii, iv, v và vi các loại tài sản Quỹ được phép đầu tư (ngoại trừ chứng chỉ tiền gửi) phát hành bởi cùng một tổ chức, có tổng giá trị chiếm từ 5% trở lên tổng giá trị tài sản của quỹ;  |', '## 2.2.4 Hạn mức đầu tư\nd) Không được đầu tư quá 30% tổng giá trị tài sản của quỹ vào các tài sản quy định tại điểm a, b, d, đ và e mục IX.2.2.3, phát hành bởi các công ty trong cùng một nhóm công ty có quan hệ sở hữu với nhau thuộc các trường hợp sau đây: công ty mẹ, công ty con; các công ty sở hữu trên 35% cổ phần, phần vốn góp của nhau; nhóm công ty con có cùng một công ty mẹ. Trong đó phần đầu tư vào chứng khoán phải sinh tính bằng giá trị cam kết của hợp đồng xác định theo quy định tại Phụ lục 4 Điều lệ Quỹ;  \nđ) Không được đầu tư quá 10% tổng giá trị tài sản của quỹ vào các tài sản quy định tại điểm đ mục IX.2.2.3;', '## 2.2.4 Hạn mức đầu tư\ne) Tổng giá trị các hạng mục đầu tư lớn trong danh mục đầu tư của quỹ không được vượt quá 40% tổng giá trị tài sản của quỹ. Trong đó, hạng mục đầu tư lớn của quỹ là hạng mục đầu tư vào các loại tài sản quy định tại điểm b, d, đ và g mục IX.2.2.3 (ngoại trừ chứng chỉ tiền gửi) phát hành bởi cùng một tổ chức, có tổng giá trị chiếm từ 5% trở lên tổng giá trị tài sản của quỹ;  \ng) Tại mọi thời điểm, tổng giá trị cam kết trong các giao dịch chứng khoán phải sinh, dư nợ vay và các khoản phải trả của quỹ không được vượt quá giá trị tài sản ròng của quỹ;  \nh) Không được đầu tư vào chứng chỉ quỹ của chính quỹ đó;  \ni) Chỉ được đầu tư vào chứng chỉ quỹ đại chúng khác, công ty đầu tư chứng khoán đại chúng do công ty quản lý quỹ khác quản lý và bảo đảm các hạn chế sau:']","Không được đầu tư vào chứng chỉ quỹ của chính quỹ đó. Không được đầu tư trực tiếp vào bất động sản, đá quý, kim loại quý hiếm."
"Giới hạn đầu tư vào nhóm công ty có quan hệ sở hữu (công ty mẹ, công ty con) là bao nhiêu phần trăm tổng giá trị tài sản quỹ?","Tôi không tìm thấy thông tin đó trong tài liệu.

Trong các nguồn cung cấp thông tin được cung cấp, không đề cập đến giới hạn đầu tư vào nhóm công ty có quan hệ sở hữu (công ty mẹ, công ty con). Các quy định về giới hạn đầu tư thường được nêu rõ trong Điều lệ Quỹ hoặc Bản cáo bạch của Quỹ, nhưng thông tin này không xuất hiện trong các trang tài liệu đã được cung cấp.

Nếu bạn cần thông tin chính xác về vấn đề này, tôi khuyên bạn nên tham khảo Điều lệ Quỹ hoặc Bản cáo bạch cụ thể của quỹ đó.","['## 2.2.4 Hạn mức đầu tư\nd) Không được đầu tư quá 30% tổng giá trị tài sản của quỹ vào các tài sản quy định tại điểm a, b, d, đ và e mục IX.2.2.3, phát hành bởi các công ty trong cùng một nhóm công ty có quan hệ sở hữu với nhau thuộc các trường hợp sau đây: công ty mẹ, công ty con; các công ty sở hữu trên 35% cổ phần, phần vốn góp của nhau; nhóm công ty con có cùng một công ty mẹ. Trong đó phần đầu tư vào chứng khoán phải sinh tính bằng giá trị cam kết của hợp đồng xác định theo quy định tại Phụ lục 4 Điều lệ Quỹ;  \nđ) Không được đầu tư quá 10% tổng giá trị tài sản của quỹ vào các tài sản quy định tại điểm đ mục IX.2.2.3;', 'ii. Không được đầu tư quá ba mươi phần trăm (30%) tổng giá trị tài sản của quỹ vào các tài sản quy định tại điểm i, ii, iv, v và vi các loại tài sản Quỹ được phép đầu tư, phát hành bởi một công ty hoặc một nhóm công ty có quan hệ sở hữu với nhau, trong đó phần đầu tư vào chứng khoán phái sinh tính bằng giá trị cam kết của hợp đồng xác định theo quy định tại Phụ lục 4 Điều lệ Quỹ.  \niii. Không được đầu tư quá 20% (hai mươi phần trăm) tổng giá trị tài sản của Quỹ vào chứng khoán đang lưu hành và các tài sản (nếu có) quy định tại điểm i, ii các loại tài sản Quỹ được phép đầu tư của một tổ chức phát hành, trừ Công cụ nợ của Chính phủ;', '## 2.2.4 Hạn mức đầu tư\ne) Tổng giá trị các hạng mục đầu tư lớn trong danh mục đầu tư của quỹ không được vượt quá 40% tổng giá trị tài sản của quỹ. Trong đó, hạng mục đầu tư lớn của quỹ là hạng mục đầu tư vào các loại tài sản quy định tại điểm b, d, đ và g mục IX.2.2.3 (ngoại trừ chứng chỉ tiền gửi) phát hành bởi cùng một tổ chức, có tổng giá trị chiếm từ 5% trở lên tổng giá trị tài sản của quỹ;  \ng) Tại mọi thời điểm, tổng giá trị cam kết trong các giao dịch chứng khoán phải sinh, dư nợ vay và các khoản phải trả của quỹ không được vượt quá giá trị tài sản ròng của quỹ;  \nh) Không được đầu tư vào chứng chỉ quỹ của chính quỹ đó;  \ni) Chỉ được đầu tư vào chứng chỉ quỹ đại chúng khác, công ty đầu tư chứng khoán đại chúng do công ty quản lý quỹ khác quản lý và bảo đảm các hạn chế sau:', '## 2.2.4 Hạn mức đầu tư\nHạn mức đầu tư của Quỹ được quy định chi tiết tuân thủ các quy định tại Thông tư hướng dẫn hoạt động và quản lý các quỹ đầu tư chứng khoán. Cơ cấu danh mục đầu tư của Quỹ phải bảo đảm tuân thủ các hạn mức đầu tư sau:  \na) Trừ tiền gửi trên tài khoản thanh toán của quỹ tại ngân hàng giám sát, quỹ mở không được đầu tư quá 49% tổng giá trị tài sản của quỹ vào các tài sản theo quy định tại điểm a, b mục IX.2.2.3  \nb) Không được đầu tư vào chứng khoán của một tổ chức phát hành quá 10% tổng giá trị chứng khoán đang lưu hành của tổ chức đó, trừ công cụ nợ của Chính phủ;  \nc) Không được đầu tư quá 20% tổng giá trị tài sản của quỹ vào chứng khoán đang lưu hành và các tài sản (nếu có) quy định tại điểm a, b mục IX.2.2.3 của một tổ chức phát hành, trừ công cụ nợ của Chính phủ;', '## 2.2.4 Hạn mức đầu tư\n- Không đầu tư vào quá 10% tổng số chứng chỉ quỹ đang lưu hành của một quỹ đại chúng, cổ phiếu đang lưu hành của một công ty đầu tư chứng khoán đại chúng;\n- Không đầu tư quá 20% tổng giá trị tài sản của quỹ vào chứng chỉ quỹ của một quỹ đại chúng, cổ phiếu của một công ty đầu tư chứng khoán đại chúng;\n- Không đầu tư quá 30% tổng giá trị tài sản của quỹ vào các chứng chỉ quỹ đại chúng, cổ phiếu công ty đầu tư chứng khoán đại chúng;  \nk) Không được đầu tư trực tiếp vào bất động sản, đá quý, kim loại quý hiếm;  \nl) Phải có chứng khoán của ít nhất 06 tổ chức phát hành.', 'iv. Không được đầu tư vào chứng khoán của một tổ chức phát hành quá 10,0% (mười phần trăm) tổng giá trị chứng khoán đang lưu hành của tổ chức đó, trừ trái phiếu chính phủ;  \nv. Không được đầu tư quá mười phần trăm (10%) tổng giá trị tài sản của Quỹ vào các tài sản quy định tại điểm v các loại tài sản Quỹ được phép đầu tư;  \nvi. Tổng giá trị các hạng mục đầu tư lớn trong danh mục đầu tư của quỹ không được vượt quá 40% tổng giá trị tài sản của quỹ. Trong đó, hạng mục đầu tư lớn của quỹ là hạng mục đầu tư vào các loại tài sản quy định tại điểm ii, iv, v và vi các loại tài sản Quỹ được phép đầu tư (ngoại trừ chứng chỉ tiền gửi) phát hành bởi cùng một tổ chức, có tổng giá trị chiếm từ 5% trở lên tổng giá trị tài sản của quỹ;  |', '- Không đầu tư quá 30% tổng giá trị tài sản của quỹ vào các chứng chỉ quỹ đại chúng, cổ phiếu công ty đầu tư chứng khoán đại chúng;  \nxi. Quỹ chỉ được đầu tư tiền gửi, công cụ tiền tệ quy định tại điểm i và ii các loại tài sản Quỹ được phép đầu tư được phát hành bởi các tổ chức tín dụng trong danh sách đã được Ban Đại Diện Quỹ phê duyệt bằng văn bản hoặc thông qua bỏ phiếu điện tử (e-voting) tuân thủ theo các Quy định Pháp luật hiện hành.  \nCơ cấu đầu tư của Quỹ được phép sai lệch so với các hạn chế được đưa ra tại điểm i, ii, iii, iv, v, vi và ix nếu trên nhưng chỉ vì các lý do sau:  \n- Biến động giá trên thị trường của các tài sản trong danh mục đầu tư của Quỹ;  \n- Thực hiện các khoản thanh toán phù hợp với Pháp Luật của Quỹ;  \n- Thực hiện các lệnh giao dịch của Nhà Đầu Tư;', '## 2. Điều lệ Quỹ tóm tắt\nSố lượng chứng chỉ quỹ/tổng chứng chỉ quỹ được phép lưu hành tối đa: không hạn chế.  \nViệc thay đổi giá trị tài sản huy động tối đa hoặc số lượng chứng chỉ quỹ huy động tối đa phải do Đại hội nhà đầu tư quyết định và phải thông báo cho Ủy ban Chứng khoán Nhà nước.', '## f) Lệnh Mua Tối Thiểu\nMức đầu tư tối thiểu (tính theo giá trị Lệnh Mua) là 10.000 VND (Mười nghìn đồng)  \nKhông có mức giới hạn đầu tư tối đa cho Nhà Đầu Tư. Công Ty Quản Lý Quỹ bảo lưu quyền thay đổi các giới hạn đầu tư trên trong từng thời điểm và sẽ thông báo về các thay đổi này.', 'Mức đầu tư tối thiểu (tính theo giá trị Lệnh Mua) là 10.000 VNĐ (Mười nghìn đồng)  \nKhông có mức giới hạn đầu tư tối đa cho Nhà Đầu Tư. Công Ty Quản Lý Quỹ bảo lưu quyền thay đổi các giới hạn đầu tư trên trong từng thời điểm và sẽ thông báo về các thay đổi này.', '## 2.2.5 Điều chỉnh danh mục đầu tư\nCơ cấu đầu tư của quỹ mở chỉ được vượt mức so với các hạn chế đầu tư đã quy định tại điểm a, b, c, d, đ, e và i mục IX.2.2.4 và chỉ do các nguyên nhân sau:  \na) Biến động giá trên thị trường của tài sản trong danh mục đầu tư của quỹ;  \nb) Thực hiện các khoản thanh toán của quỹ theo quy định của pháp luật, bao gồm việc thực hiện lệnh giao dịch của nhà đầu tư;', '## Lĩnh vực được phép đầu tư\nđ) Cổ phiếu chào bán lần đầu ra công chúng, trái phiếu chào bán ra công chúng; trái phiếu doanh nghiệp phát hành riêng lẻ bởi tổ chức niêm yết có bảo lãnh thanh toán của tổ chức tín dụng hoặc cam kết mua lại của tổ chức phát hành tối thiểu 1 lần trong 12 tháng và mỗi lần cam kết mua lại tối thiểu 30% giá trị đợt phát hành;  \ne) Chứng khoán phải sinh niêm yết giao dịch tại Sở giao dịch chứng khoán và chỉ nhằm mục tiêu phòng ngừa rủi ro cho chứng khoán cơ sở mà quỹ đang nắm giữ;  \ng) Quyền phát sinh gắn liền với chứng khoán mà quỹ đang nắm giữ.  \nViệc đầu tư vào các tài sản quy định tại điểm đ khoản 2.2.3 Điều này phải đáp ứng các điều kiện sau:  \n- Có quy định tại Điều lệ quỹ và Bản cáo bạch;', '- Thực hiện các lệnh giao dịch của Nhà Đầu Tư;  \n- Các hoạt động sáp nhập, hợp nhất của các tổ chức phát hành các chứng khoán mà Quỹ đang nắm giữ;  \n- Quỹ mới được cấp phép thành lập hoặc do tách Quỹ, hợp nhất Quỹ, sát nhập Quỹ mà thời gian hoạt động không quá sáu (06) tháng, tính từ ngày được cấp giấy chứng nhận đăng ký lập Quỹ;  \n- Quỹ đang trong thời gian giải thể.  \nTrong trường hợp xảy ra sai lệch so với các hạn mức đầu tư, Công ty Quản Lý Quỹ sẽ điều chỉnh danh mục đầu tư để đáp ứng các hạn mức đầu tư kể trên trong vòng 3 (ba) tháng kể từ ngày mà sai lệch phát sinh.', 'nhóm chứng khoán có tiềm năng tăng trưởng tốt trong dài hạn và/hoặc doanh nghiệp có tính cạnh tranh tương đối cao, (ii) nhóm chứng khoán có mức định giá hấp dẫn, (iii) nhóm chứng khoán có lợi tức cao, ổn định.  \nNgoài ra, để đảm bảo tối ưu hóa lợi ích của nhà đầu tư, Quỹ có sự linh hoạt trong phân bổ tài sản tùy thuộc vào cơ hội đầu tư sẵn có tại các thời điểm khác nhau. Việc phân bổ tài sản có thể thay đổi đáng kể tùy thuộc vào nhận định của Quỹ, với mục tiêu xuyên suốt trong toàn bộ thời gian hoạt động của Quỹ là bảo vệ lợi ích của Nhà Đầu Tư.', '48  \nvii. Tại mọi thời điểm, tổng giá trị cam kết trong các giao dịch chứng khoán phái sinh, dư nợ vay và các khoản phải trả của quỹ không được vượt quá giá trị tài sản ròng của Quỹ;  \nviii. Không được đầu tư vào chứng chỉ quỹ của chính quỹ đó;  \nix. Không được đầu tư trực tiếp vào bất động sản, đá quý, kim loại quý hiếm  \nx. Chỉ được đầu tư vào chứng chỉ quỹ đại chúng khác, công ty đầu tư chứng khoán đại chúng do công ty quản lý quỹ khác quản lý và bảo đảm các hạn chế sau:  \n- Không đầu tư vào quá 10% tổng số chứng chỉ quỹ đang lưu hành của một quỹ đại chúng, cổ phiếu đang lưu hành của một công ty đầu tư chứng khoán đại chúng;  \n- Không đầu tư quá 20% tổng giá trị tài sản của quỹ vào chứng chỉ quỹ của một quỹ đại chúng, cổ phiếu của một công ty đầu tư chứng khoán đại chúng;', '- Việc thực hiện tất cả các lệnh giao dịch của Nhà Đầu Tư tại Ngày Giao Dịch dẫn đến NAV của Quỹ thấp hơn 50.000.000.000 đồng (năm mươi tỷ đồng); hoặc Giá trị phần đơn vị quỹ hoặc số đơn vị quỹ còn lại trên tài khoản của nhà đầu tư thấp hơn giá trị tối thiểu hoặc số lượng đơn vị quỹ tối thiểu để duy trì tài khoản của nhà đầu tư theo quy định tại Điều lệ quỹ và Bán cáo bạch.\n- Trường hợp thực hiện một phần Lệnh Bán, Lệnh mua, Lệnh Chuyến Đổi Quỹ theo quy định nêu trên, Công ty Quản Lý Quỹ áp dụng nguyên tắc phân phối cùng tỷ lệ: Phần giá trị được thực hiện sẽ được phân bổ cho tất cả nhà đầu tư đăng ký giao dịch theo cùng một tỷ lệ giữa giá trị thực hiện và giá trị đăng ký giao dịch.  \nSố lượng chứng chỉ quỹ được thực hiện trong trường hợp này được tính như sau:', '## 2. Thông tin về đợt phát hành lần đầu ra công chúng\nNgoài ra, để đảm bảo tối ưu hóa lợi ích của nhà đầu tư, Quỹ có sự linh hoạt trong phân bổ tài sản tùy thuộc vào cơ hội đầu tư sẵn có tại các thời điểm khác nhau. Việc phân bổ tài sản có thể thay đổi đáng kể tùy thuộc vào nhận định của Quỹ, với mục tiêu xuyên suốt trong toàn bộ thời gian hoạt động của Quỹ là bảo vệ lợi ích của Nhà Đầu Tư.  \nVới chiến lược đầu tư như đã đề cập ở trên, cơ cấu danh mục đầu tư của Quỹ có thể thay đổi theo thời gian dựa theo tiềm năng tăng trưởng của cổ phiếu và tùy vào mức độ thanh khoản của các cổ phiếu trên thị trường. Tỷ trọng các khoản đầu tư không vượt quá những hạn chế đầu tư quy định tại mục “Hạn chế đầu tư”.  \nCác loại tài sản mà quỹ được đầu tư bao gồm:\ni. Tiền gửi tại các ngân hàng thương mại theo quy định của pháp luật về  |', '## 4. Phương pháp xác định giá trị tài sản ròng\nGiá trị tài sản ròng của Quỹ và Giá trị tài sản ròng trên một Đơn Vị Quỹ phải được Ngân Hàng Giám Sát xác nhận và sẽ được công bố tại Trụ sở chính của Công Ty Quản Lý Quỹ, và trên các trang web hoặc các phương tiện truyền thông khác theo yêu cầu của Luật vào ngày làm việc tiếp theo của Ngày Định Giá với điều kiện các trang điện tử này hoạt động bình thường. Trong thời hạn 24 giờ kể từ khi phát hiện giá trị tài sản ròng bị định giá sai, Ngân Hàng Giám Sát phải thông báo và yêu cầu công ty quản lý quỹ kịp thời điều chỉnh hoặc ngược lại trong trường hợp ngân hàng giám sát cung cấp dịch vụ xác định giá trị tài sản ròng', '## 2.5.2. Hình thức công bố thông tin về giá các giao dịch, nơi công bố thông tin, tần suất công bố thông tin\nGiá trị tài sản ròng của Quỹ và Giá trị tài sản ròng trên một Đơn Vị Quỹ phải được Ngân Hàng Giám Sát xác nhận và sẽ được công bố tại Trụ sở chính của Công Ty Quản Lý Quỹ, và trên các trang web hoặc các phương tiện truyền thông khác theo yêu cầu của Luật vào ngày làm việc tiếp theo của Ngày Định Giá với điều kiện các trang điện tử này hoạt động bình thường. Trong thời hạn 24 giờ kể từ khi phát hiện giá trị tài sản ròng bị định giá sai, Ngân Hàng Giám Sát phải thông báo và yêu cầu công ty quản lý quỹ kịp thời điều chỉnh hoặc ngược lại trong trường hợp ngân hàng giám sát cung cấp dịch vụ xác định giá trị tài sản ròng', '## Lĩnh vực được phép đầu tư\nDanh mục đầu tư của quỹ phải phù hợp với mục tiêu và chính sách đầu tư đã được quy định tại Điều lệ quỹ và công bố tại Bản cáo bạch. Danh mục đầu tư của quỹ đầu tư bao gồm các loại tài sản sau đây:  \na) Tiền gửi các ngân hàng thương mại theo quy định của pháp luật ngân hàng;  \nb) Công cụ thị trường tiền tệ bao gồm giấy tờ có giá, công cụ chuyển nhượng theo quy định của pháp luật;  \nc) Công cụ nợ của Chính phủ, trái phiếu được Chính phủ bảo lãnh, trái phiếu chính quyền địa phương;  \nd) Cổ phiếu niêm yết, cổ phiếu đăng ký giao dịch, trái phiếu niêm yết trên Sở giao dịch chứng khoán, chứng chỉ quỹ đại chúng;', '## 2. Điều lệ Quỹ tóm tắt\nCơ quan quyền lực cao nhất của Quỹ là Đại hội Nhà Đầu tư.  \nBan Đại diện Quỹ sẽ do Đại hội Nhà Đầu tư bầu ra để giám sát các hoạt động thường xuyên của Quỹ, TCC và Ngân hàng giám sát.  \n#### 2.1.2 Tổng vốn huy động và số lượng chứng chỉ Quỹ được chào bán  \nVốn Điều lệ được huy động trong lần đầu chào bán ra công chúng của Quỹ là 50.000.000.000 VNĐ (Năm mươi tỷ đồng). Vốn Điều lệ sẽ được chia thành 5.000.000 (Năm triệu) Chứng chỉ Quỹ. Mệnh giá của một Chứng chỉ Quỹ sẽ là 10.000 VNĐ (mười nghìn Đồng Việt Nam).  \nNhà đầu tư góp vốn bằng tiền Đồng Việt Nam dưới hình thức chuyển khoản hoặc chuyển tiền vào tài khoản của Quỹ mở tại ngân hàng giám sát.  \nSố lượng chứng chỉ quỹ/tổng chứng chỉ quỹ được phép lưu hành tối đa: không hạn chế.', '## 4. Phương pháp xác định giá trị tài sản ròng\nCác quy định khác về việc công bố giá trị tài sản ròng và tình hình giao dịch tuân thủ theo quy định của Pháp luật và Điều lệ Quỹ.', '## e) Thực Hiện Một Phần Lệnh Bán\nTrong các trường hợp sau, Quỹ chỉ có thể thực hiện một phần Lệnh Bán và Chuyến Đổi Quỹ của Nhà Đầu Tư:  \n- Tổng giá trị của các Lệnh Bán (bao gồm cả Lệnh Bán từ hoạt động Chuyến Đổi Quỹ) trừ đi tổng giá trị của tất cả các Lệnh Mua (bao gồm cả Lệnh Mua từ hoạt động Chuyến Đổi Quỹ) tại Ngày Giao Dịch lớn hơn 10% của giá trị tài sản ròng của Quỹ (NAV); hoặc\n- Việc thực hiện tất cả các lệnh giao dịch của Nhà Đầu Tư tại Ngày Giao Dịch dẫn đến NAV của Quỹ thấp hơn 50.000.000.000 đồng (năm mươi tỷ đồng); hoặc Giá trị phần đơn vị quỹ hoặc số đơn vị quỹ còn lại trên tài khoản của nhà đầu tư thấp hơn giá trị tối thiểu hoặc số lượng đơn vị quỹ tối thiểu để duy trì tài khoản của nhà đầu tư theo quy định tại Điều lệ quỹ và Bán cáo bạch.', '## 3. Các rủi ro khi đầu tư vào Quỹ\nMục tiêu của Công Ty Quản Lý Quỹ là quản lý các rủi ro đầu tư, và nếu có thể, hạn chế tác động của các rủi ro này bằng việc áp dụng các phương pháp quản lý đầu tư theo tiêu chuẩn quốc tế tốt nhất. Nhà Đầu Tư cần lưu ý các điểm quan trọng sau đây:  \n- Quỹ, Công Ty Quản Lý Quỹ, thành viên Hội đồng thành viên, ban điều hành và nhân viên Công Ty Quản Lý Quỹ không có bất kỳ sự đảm bảo nào đối với vốn đầu tư ban đầu cũng như mức lợi nhuận từ đầu tư của Quỹ;\n- Không có bất kỳ sự bảo đảm nào về sổ lần chi trả và giá trị của cổ tức được thanh toán trong tương lai;  \n42', 'Theo quy định hiện hành, nếu Quỹ không thể huy động được ít nhất là 50.000.000.000 VNĐ (năm mươi tỷ đồng) hoặc có ít hơn 100 (một trăm) Nhà Đầu Tư không chuyên nghiệp vào thời điểm kết thúc IPO hoặc thời gian được gia hạn (nếu có), UBCKNN sẽ không cấp Giấy chứng nhận đăng ký lập quỹ cho Quỹ. Trong trường hợp này, tất cả số tiền nhận được từ các Nhà Đầu Tư trong thời gian IPO cùng với lãi phát sinh nếu có sẽ được hoàn trả vào tài khoản đăng ký của Nhà Đầu Tư trong vòng 15 (mười lăm ngày) kể từ ngày kết thúc đợt IPO. Công Ty Quản Lý Quỹ sẽ chịu tất cả các chi giá dịch vụ phát sinh từ đợt IPO trong trường hợp này.  \n49']",Không được đầu tư quá 30% tổng giá trị tài sản của quỹ vào các công ty trong cùng một nhóm công ty có quan hệ sở hữu.
Ngân hàng giám sát của Quỹ TCSME là ngân hàng nào và chi nhánh nào?,"Ngân hàng giám sát của Quỹ TCSME là Ngân Hàng Thương Mại Cổ Phần Công Thương Việt Nam (Techcombank), cụ thể là chi nhánh chính của Techcombank.

Thông tin này được lấy từ Trang 65 của tài liệu.","['# PHỤ LỤC 2. CÁC ĐỐI TÁC CÓ LIÊN QUAN\nNgân hàng lưu ký, giám sát và quản trị quỹ:  \nNgân hàng TMCP Đầu tư và Phát triển Việt Nam - Chi nhánh Hà Thành, một chi nhánh được thành lập theo Giấy chứng nhận đăng ký hoạt động chi nhánh số 0100150619-073 cấp lần đầu ngày 12/9/2003 thay đổi lần 12 ngày 16/06/2020 do Sở kế hoạch và Đầu tư thành phố Hà Nội cấp và Giấy chứng nhận đăng ký hoạt động lưu ký chứng khoán số 510/QĐ-ĐKHĐLK ngày 01/08/2006 do UBCKNN cấp, thực hiện các nghiệp vụ (i) bảo quản, lưu ký chứng khoán, tài liệu xác nhận quyền sở hữu tài sản hợp pháp của Quỹ; các hợp đồng kinh tế, các chứng từ có liên quan đến tài sản của Quỹ đồng thời giám sát hoạt động của Quỹ; (ii) thực hiện chức năng giám sát toàn bộ quản lý tài sản của Quỹ do Công ty Quản lý Quỹ thực hiện.  \n![img-14.jpeg](img-14.jpeg)', '## 2. Ngân hàng giám sát\nNgân hàng TMCP Đầu tư và Phát triển Việt Nam - Chi nhánh Hà Thành  \nĐại diện hợp pháp: Ông Nguyễn Mạnh Cường  \nChức vụ: Phó Giám đốc  \nBản cáo bạch này là một phần của hồ sơ đăng ký chào bán của Công ty Cổ phần Quản lý quỹ Kỹ thương (Techcom Capital – “TCC”). Chúng tôi, với tư cách là Ngân hàng Giám sát của Quỹ Đầu Tư Cổ phiếu Doanh nghiệp vừa và nhỏ Techcom (TCSME) sẽ chịu trách nhiệm theo các quy định trong phạm vi Hợp Đồng Cung Cấp Dịch Vụ Giám Sát Quỹ được ký kết giữa chúng tôi với Công ty Cổ phần Quản lý quỹ Kỹ thương, là công ty quản lý Quỹ Đầu tư Cổ phiếu Doanh nghiệp vừa và nhỏ Techcom và theo quy định của pháp luật.', '## V. NGÂN HÀNG GIÁM SÁT\n- Tên ngân hàng: Ngân hàng TMCP Đầu tư và Phát triển Việt Nam – Chi nhánh Hà Thành\n- Giấy chứng nhận đăng ký hoạt động chi nhánh: Số 0100150619-073 cấp lần đầu ngày 12/9/2003 thay đổi lần 12 ngày 16/06/2020 do Sở kế hoạch và Đầu tư thành phố Hà Nội cấp\n- GCNDK hoạt động lưu ký: Số 510/QĐ-ĐKHĐLK ngày 01/08/2006 do UBCKNN cấp\n- Trụ sở chính: 74 Thợ Nhuộm, Hoàn Kiếm, Hà Nội, Việt Nam\n- Điện thoại: +84.24 39411840 Fax: +84.24 39411847  \nNgân hàng Giám sát chịu trách nhiệm trong phạm vi liên quan đến hoạt động của ngân hàng giám sát theo quy định tại Điều lệ Quỹ và Hợp đồng Giám sát.', '## 2.11. Tiêu chí lựa chọn, quyền hạn và trách nhiệm của Ngân hàng giám sát\nNgân Hàng Giám Sát được lựa chọn phải đáp ứng các điều kiện sau:  \n- Ngân hàng giám sát do Công ty quản lý quỹ lựa chọn phải đáp ứng các điều kiện quy định tại Khoản 1 Điều 116 Luật Chứng khoán;\n- Ngân hàng giám sát phải hoàn toàn độc lập và tách biệt với công ty quản lý quỹ mà ngân hàng cung cấp dịch vụ giám sát;\n- Ngân hàng giám sát, thành viên Hội đồng quản trị, người điều hành và nhân viên của ngân hàng giám sát làm nhiệm vụ giám sát hoạt động và bảo quản tài sản của quỹ đại chúng, công ty đầu tư chứng khoán không được là người có liên quan hoặc có quan hệ sở hữu, vay hoặc cho vay với công ty quản lý quỹ, công ty đầu tư chứng khoán và', '# NGÂN HÀNG GIÁM SÁT\nTên ngân hàng giám sát: Ngân hàng TMCP Đầu tư &amp; Phát triển Việt Nam – Chi nhánh Hà Thành;  \nGiấy chứng nhận đăng ký kinh doanh số 0100150619-073 cấp lần đầu ngày 12/09/2003, thay đổi lần thứ 12 ngày 16/06/2020 do Sở Kế hoạch và Đầu tư thành phố Hà Nội cấp;  \nGiấy phép hoạt động lưu ký chứng khoán số: 510/QĐ-ĐKHĐLK ngày 01/08/2006 do UBCKNN cấp;  \nChúng tôi, với tư cách là Ngân hàng giám sát của Quỹ Đầu Tư Cổ phiếu Doanh nghiệp vừa và nhỏ Techcom sẽ chịu trách nhiệm theo các quy định trong phạm vi Hợp Đồng Cung Cấp Dịch Vụ lưu ký giám sát của Quỹ được ký kết giữa chúng tôi với Công ty Cổ phần Quản lý Quỹ Kỹ Thương, và các quy định về Ngân hàng giám sát trong Điều lệ, Bản cáo bạch của Quỹ.  \n![img-13.jpeg](img-13.jpeg)  \nPHÓ GIÁM ĐỐC\nNguyễn Mạnh Cường', '# II. CÁC ĐỊNH NGHĨA\nGiấy chứng nhận đăng ký doanh nghiệp số 0102995749 do Sở Kế hoạch và Đầu tư Thành phố Hà Nội cấp ngày 27/05/2021, đáp ứng các tiêu chuẩn như nêu tại Điều 30 và có các quyền và nghĩa vụ như quy định tại Điều 31 của Điều lệ Quỹ.  \n“Ngân Hàng Giám Sát” Là Ngân hàng TMCP Đầu tư và Phát triển Việt Nam - Chi nhánh Hà Thành, một chi nhánh được thành lập theo Giấy chứng nhận đăng ký hoạt động chi nhánh số 0100150619-073 cấp lần đầu ngày 12/9/2003 thay đổi lần 12 ngày 16/06/2020 do Sở kế hoạch và Đầu tư thành phố Hà Nội cấp', '# VIII. TỔ CHỨC ĐƯỢC ỦY QUYỀN\n## 2. Ủy quyền dịch vụ quản trị quỹ đầu tư\n- Tên ngân hàng: Ngân hàng TMCP Đầu tư và Phát triển Việt Nam – Chi nhánh Hà Thành\n- Giấy chứng nhận đăng ký hoạt động chi nhánh: Số 0100150619-073 cấp lần đầu ngày 12/9/2003 thay đổi lần 12 ngày 16/06/2020 do Sở kế hoạch và Đầu tư thành phố Hà Nội cấp\n- GCNDK hoạt động lưu ký: Số 510/QĐ-ĐKHDLK ngày 01/08/2006 do UBCKNN cấp\n- Trụ sở chính: 74 Thợ Nhuộm, Hoàn Kiếm, Hà Nội, Việt Nam\n- Điện thoại: +84.24 39411840    Fax: +84.24 39411847  \nTổ chức cung cấp dịch vụ quản trị quỹ chịu trách nhiệm trong phạm vi liên quan đến dịch vụ cung cấp theo quy định tại hợp đồng dịch vụ ký kết giữa Công ty Quản lý Quỹ và tổ chức cung cấp dịch vụ quản trị quỹ.', 'ngược lại;  \n- Ngân hàng giám sát, thành viên Hội đồng quản trị, người điều hành và nhân viên của ngân hàng giám sát làm nhiệm vụ giám sát hoạt động và bảo quản tài sản của quỹ đại chúng, công ty đầu tư chứng khoán không được là đối tác mua, bán trong giao dịch mua, bán tài sản của quỹ đại chúng, công ty đầu tư chứng khoán.\n- Có đầy đủ năng lực cung cấp dịch vụ giám sát, lưu ký;\n- Thực hiện các cam kết đối với Quỹ như nêu tại Phụ lục 2 và Phụ lục 3 của Điều lệ Quỹ.  \nCác quy định về quyền và nghĩa vụ, hoạt động giám sát và chấm dứt quyền và nghĩa vụ của Ngân hàng giám sát tuân thủ theo quy định tại chương VII Điều lệ Quỹ.', 'Nhà Đầu Tư thanh toán tiền mua Đơn Vị Quỹ vào một tài khoản phong tỏa của Quỹ mở tại Ngân Hàng Giám Sát. Thông tin chi tiết của tài khoản này sẽ được cung cấp bởi các Đại Lý Phân Phối và được đề cập trong Đơn Đăng Ký. Ngân Hàng Giám Sát sẽ thanh toán lãi phát sinh (nếu có) trên các khoản tiền gửi trong tài khoản ký quỹ với mức lãi suất không thấp hơn lãi suất tiền gửi không kỳ hạn đang được áp dụng của Ngân Hàng Giám Sát trong suốt quá trình IPO. Nếu IPO thành công, số lãi này sẽ cấu thành một phần tài sản Quỹ.', 'Nhà Đầu Tư có thể thanh toán số tiền mua Đơn Vị Quỹ từ tài khoản ngân hàng của mình vào tài khoản của Quỹ để Ngân Hàng Giám Sát nhận được đúng hạn và Đại Lý Phân Phối hoàn thành xử lý việc đăng ký với Đại Lý Chuyển Nhượng. Mọi khoản đầu tư vào Đơn Vị Quỹ đều thực hiện bằng tiền Đồng Việt Nam.  \nTrong trường hợp lệnh mua chứng chỉ quỹ và việc thanh toán cho lệnh mua được thực hiện bởi cá nhân, tổ chức khác không phải nhà đầu tư thì phiếu lệnh và tài liệu xác nhận thanh toán phải nêu rõ tên, số tài khoản và giá trị thanh toán của nhà đầu tư được hưởng lợi.', '# MỤC LỤC\n1. Công ty quản lý quỹ ... 5\n2. Ngân hàng giám sát ... 5  \nII. CÁC ĐỊNH NGHĨA ... 5  \nIII. CƠ HỘI ĐẦU TƯ ... 8\n1. Tổng quan tình hình kinh tế vĩ mô ... 8\n2. Thị trường tài chính Việt Nam và cơ hội đầu tư ... 11\n3. Lợi thế của quỹ mở ... 14  \nIV. THÔNG TIN VỀ CÔNG TY CỔ PHẦN QUẢN LÝ QUỸ KỸ THƯƠNG ... 15\n1. Các thông tin chung ... 15\n2. Tình hình hoạt động của Công ty Cổ phần Quản lý Quỹ Kỹ thương ... 17  \nV. NGÂN HÀNG GIÁM SÁT ... 17  \nVI. CÔNG TY KIỂM TOÁN ... 17  \nVII. ĐẠI LÝ PHÂN PHỐI CHỨNG CHỈ QUỸ ... 18  \nVIII. TỔ CHỨC ĐƯỢC ỦY QUYỀN ... 18\n1. Ủy quyền đại lý chuyên nhượng ... 18\n2. Ủy quyền dịch vụ quản trị quỹ đầu tư ... 18  \nIX. THÔNG TIN VỀ QUỸ ĐẦU TƯ CỔ PHIẾU DOANH NGHIỆP VỮA VÀ NHỎ TECHCOM (TCSME) ... 18\n1. Thông tin chung về Quỹ ... 18\n2. Điều lệ Quỹ tóm tắt ... 19', 'Quỹ không quy định quy mô tối đa trong đợt phát hành lần đầu ra công chúng. Vì vậy, nếu giá trị phát hành được vượt 50.000.000.000 VNĐ (năm mươi tỷ đồng), các Nhà Đầu Tư sẽ được phân bổ số lượng Đơn Vị Quỹ bằng với số đã đặt mua.  \n- Địa điểm phát hành:\nCông ty Cổ phần Quản lý Quỹ Kỹ thương\nĐịa chỉ đăng ký: Tầng 28, Tòa C5, số 119 Trần Duy Hưng, phường Trung Hòa, Quận Cầu Giấy, Hà Nội\nĐiện thoại: (+84) 24 39446368   Fax: (+84) 24 39446583  \n- Đại lý phân phối và điểm nhận lệnh:\nCông ty Cổ phần Chứng khoán Kỹ thương (“TCBS”)\nĐịa chỉ: Tầng 10 và Tầng 12, tòa nhà Techcombank, 191 Bà Triệu, phường Lê Đại Hành, quận Hai Bà Trưng, TP. Hà Nội\nĐiện thoại: 84.24.22201039   Fax: 84.24.22201032  \n- Các đối tác có liên quan đến đợt phát hành  \n**Ủy quyền đại lý chuyển nhượng**', 'Nhà Đầu Tư có thể thanh toán số tiền mua Đơn Vị Quỹ bằng cách chuyển khoản từ tài khoản ngân hàng của mình hoặc nộp tiền trực tiếp vào tài khoản của Quỹ để Ngân Hàng Giám Sát nhận được đúng hạn và Đại Lý Phân Phối hoàn thành xử lý việc đăng ký với Đại Lý Chuyển Nhượng. Mọi khoản đầu tư vào Đơn Vị Quỹ đều thực hiện bằng tiền Đồng Việt Nam.  \nTrong trường hợp lệnh mua chứng chỉ quỹ và việc thanh toán cho lệnh mua được thực hiện bởi cá nhân, tổ chức khác không phải nhà đầu tư thì phiếu lệnh và tài liệu xác nhận thanh toán phải nêu rõ tên, số tài khoản và giá trị thanh toán của nhà đầu tư được hưởng lợi.  \n- **Tuân Thủ**', '## 3.2 Giá dịch vụ mà Quỹ phải trả\nGiá dịch vụ giám sát được trả cho Ngân Hàng Giám Sát để cung cấp dịch vụ Ngân Hàng Giám Sát cho Quỹ. Giá dịch vụ được tính vào mỗi kỳ định giá dựa trên NAV tại ngày trước Ngày Định Giá và được trả hàng tháng. Số tiền trả dịch vụ hàng tháng là tổng số được tính (trích lập) cho các kỳ định giá thực hiện trong tháng.', '# PHỤ LỤC 1. DANH SÁCH ĐẠI LÝ PHÂN PHỐI VÀ CÁC ĐIỂM NHẬN LỆNH\nCông ty Cổ phần Chứng khoán Kỹ thương (“TCBS”)  \nGiấy phép thành lập và hoạt động: Số 125/GP-UBCK ngày 30/05/2018 do Ủy ban Chứng khoán Nhà nước cấp  \nĐịa chỉ nhận lệnh: Tầng 10 và Tầng 12, Tòa nhà Techcombank, 191 Bà Triệu, Phường Lê Đại Hành, quận Hai Bà Trưng, Hà Nội', '- Các đối tác có liên quan đến đợt phát hành  \n**Ủy quyền đại lý chuyển nhượng**  \nTên đại lý: Trung tâm Lưu ký Chứng khoán Việt Nam\nTrụ sở chính: 15 Đoàn Trần Nghiệp, Quận Hai Bà Trưng, Hà Nội\nĐiện thoại: +84 24 39747113   Fax: +84 24 39747120  \n**Ủy quyền dịch vụ quản trị quỹ đầu tư**  \nTên ngân hàng: Ngân hàng TMCP Đầu tư và Phát triển Việt Nam – Chi nhánh Hà Thành\nTrụ sở chính: 74 Thợ Nhuộm, Hoàn Kiếm, Hà Nội\nĐiện thoại: (+84) 43 9362086   Fax: (+84) 439411847', '## 2.10. Tiêu chí lựa chọn, quyền hạn và trách nhiệm của Công ty Quản lý quỹ\nCông ty Quản Lý Quỹ được lựa chọn phải thỏa mãn các điều kiện sau:  \n- Được thực hiện nghiệp vụ Quản Lý Quỹ;\n- Hoàn toàn độc lập với Ngân Hàng Giám Sát;\n- Có đầy đủ cơ sở vật chất, nhân sự để Quản Lý Quỹ mở;\n- Đồng ý thực hiện các cam kết đối với Quỹ như nêu tại Phụ Lục 1 và Phụ Lục 3 của Điều lệ Quỹ.  \nCác quy định về quyền và nghĩa vụ, chấm dứt quyền và nghĩa vụ, hạn chế hoạt động của Công ty Quản lý quỹ tuân thủ theo quy định tại Chương VI Điều lệ Quỹ.', '## b. Giá dịch vụ giám sát\nGiá dịch vụ giám sát được trả cho Ngân Hàng Giám Sát để cung cấp dịch vụ Ngân Hàng Giám Sát cho Quỹ. Giá dịch vụ được tính vào mỗi kỳ định giá dựa trên NAV tại ngày trước Ngày Định Giá và được trả hàng tháng. Số tiền trả dịch vụ hàng tháng là tổng số được tính (trích lập) cho các kỳ định giá thực hiện trong tháng.  \nCông thức tính giá dịch vụ giám sát vào mỗi kỳ định giá được xác định như sau:  \nGiá dịch vụ giám sát cho kỳ định giá = Tỷ lệ giá dịch vụ giám sát (năm) x NAV tại ngày trước ngày định giá x số ngày theo lịch thực tế của chu kỳ định giá / số ngày thực tế của năm (365 hoặc 366).  \n|  Loại Giá dịch vụ | Mức giá dịch vụ | Tối thiểu/tối đa | Ghi chú  |\n| --- | --- |\n|  Giá dịch vụ giám sát | 0,02%*NAV/Năm | Tối thiểu: 5.000.000 đồng /tháng | Thuế VAT 10%  |', '## XIII. CUNG CÁP THỐNG TIN CHO NHÀ ĐẦU TƯ, CHẾ ĐỘ BÁO CÁO\nHàng tháng, quý, năm Công Ty Quản Lý Quỹ sẽ gửi thống kê giao dịch, sao kê tài khoản giao dịch, tài khoản phụ, báo cáo giá trị NAV và các thay đổi NAV của Quỹ và các báo cáo khác theo luật định cho Nhà Đầu Tư.  \nĐối với Nhà Đầu Tư giao dịch trên tài khoản ký danh, Công Ty Quản Lý Quỹ hoặc tổ chức được ủy quyền bởi Công Ty Quản Lý Quỹ (trong phạm vi pháp luật hiện hành cho phép) sẽ gửi thống kê giao dịch và sao kê tài khoản phụ nếu Nhà Đầu Tư có yêu cầu bằng văn bản. Thời hạn cung cấp thông tin là trong vòng 05 (năm) ngày làm việc, kể từ ngày nhận được yêu cầu của Nhà Đầu Tư.', 'vi. Chứng khoán phái sinh niêm yết, giao dịch tại các Sở Giao dịch Chứng khoán, và chỉ nhằm mục tiêu phòng ngừa rủi ro cho chứng khoán cơ sở mà quỹ đang nắm giữ.  \nvii. Quyền phát sinh gắn liền với chứng khoán mà Quỹ đang nắm giữ.  |\n| --- | --- |\n|  Cơ cấu đầu tư | Các khoản đầu tư của Quỹ sẽ được đa dạng hóa và đáp ứng được các điều kiện của pháp luật. Cơ cấu danh mục đầu tư của Quỹ phải bảo đảm tuân thủ các nguyên tắc sau:  \ni. Cơ cấu danh mục đầu tư của quỹ mở phải bao gồm chứng khoán của ít nhất sáu (06) tổ chức phát hành, đồng thời phải bảo đảm:', '- Thực hiện các lệnh giao dịch của Nhà Đầu Tư;  \n- Các hoạt động sáp nhập, hợp nhất của các tổ chức phát hành các chứng khoán mà Quỹ đang nắm giữ;  \n- Quỹ mới được cấp phép thành lập hoặc do tách Quỹ, hợp nhất Quỹ, sát nhập Quỹ mà thời gian hoạt động không quá sáu (06) tháng, tính từ ngày được cấp giấy chứng nhận đăng ký lập Quỹ;  \n- Quỹ đang trong thời gian giải thể.  \nTrong trường hợp xảy ra sai lệch so với các hạn mức đầu tư, Công ty Quản Lý Quỹ sẽ điều chỉnh danh mục đầu tư để đáp ứng các hạn mức đầu tư kể trên trong vòng 3 (ba) tháng kể từ ngày mà sai lệch phát sinh.', '## 4. Phương pháp xác định giá trị tài sản ròng\nGiá trị tài sản ròng của Quỹ và Giá trị tài sản ròng trên một Đơn Vị Quỹ phải được Ngân Hàng Giám Sát xác nhận và sẽ được công bố tại Trụ sở chính của Công Ty Quản Lý Quỹ, và trên các trang web hoặc các phương tiện truyền thông khác theo yêu cầu của Luật vào ngày làm việc tiếp theo của Ngày Định Giá với điều kiện các trang điện tử này hoạt động bình thường. Trong thời hạn 24 giờ kể từ khi phát hiện giá trị tài sản ròng bị định giá sai, Ngân Hàng Giám Sát phải thông báo và yêu cầu công ty quản lý quỹ kịp thời điều chỉnh hoặc ngược lại trong trường hợp ngân hàng giám sát cung cấp dịch vụ xác định giá trị tài sản ròng', '## 2.5.2. Hình thức công bố thông tin về giá các giao dịch, nơi công bố thông tin, tần suất công bố thông tin\nGiá trị tài sản ròng của Quỹ và Giá trị tài sản ròng trên một Đơn Vị Quỹ phải được Ngân Hàng Giám Sát xác nhận và sẽ được công bố tại Trụ sở chính của Công Ty Quản Lý Quỹ, và trên các trang web hoặc các phương tiện truyền thông khác theo yêu cầu của Luật vào ngày làm việc tiếp theo của Ngày Định Giá với điều kiện các trang điện tử này hoạt động bình thường. Trong thời hạn 24 giờ kể từ khi phát hiện giá trị tài sản ròng bị định giá sai, Ngân Hàng Giám Sát phải thông báo và yêu cầu công ty quản lý quỹ kịp thời điều chỉnh hoặc ngược lại trong trường hợp ngân hàng giám sát cung cấp dịch vụ xác định giá trị tài sản ròng', '## 2.3. Đặc trưng của chứng chỉ Quỹ đầu tư\nNhà đầu tư của Quỹ là cá nhân, tổ chức trong và ngoài nước, sở hữu chứng chỉ quỹ. Nhà đầu tư không chịu trách nhiệm pháp lý hoặc nghĩa vụ khác ngoài trách nhiệm trong phạm vi số chứng chỉ Quỹ mà họ sở hữu. Nhà đầu tư là tổ chức bao gồm các tổ chức kinh tế và xã hội được pháp luật Việt Nam công nhận.  \nNhà đầu tư pháp nhân cử người đại diện hợp pháp đại diện cho số Chứng chỉ quỹ mà mình sở hữu. Việc đề cử, hủy bỏ hay thay thế người đại diện này phải được thông báo bằng văn bản, do người đại diện có thẩm quyền của nhà đầu tư tổ chức ký.', 'Giao dịch với người có liên quan của TCC sẽ cấu thành xung đột lợi ích tiềm tàng. Người Có Liên Quan của TCC bao gồm Techcombank, thành viên Hội Đồng Thành viên của TCC, thành viên Ban Điều Hành (Giám đốc, Phó giám đốc) của TCC và các tổ chức, cá nhân khác được coi là người có liên quan của TCC theo quy định của Pháp Luật. Quỹ có thể có một số giao dịch với các bên được coi là người có liên quan của TCC như sau:  \n|  Tên của người có liên quan trong giao dịch | Bản chất quan hệ  |\n| --- | --- | --- |\n|  Công ty Cổ phần Chứng khoán Kỹ thương Việt Nam (""TCBS"") | Giao dịch chứng khoán Phân phối chứng chỉ quỹ\nĐầu tư vào Quỹ | TCBS là Đại Lý Phân Phối mà Techcombank sở hữu 89% cổ phần  |\n|  Techcombank (""TCB"") | Gửi tiền có kỳ hạn | Techcombank sở hữu 88.99% vốn của TCC  |']",Ngân hàng TMCP Đầu tư và Phát triển Việt Nam (BIDV) - Chi nhánh Hà Thành.
Đại lý phân phối chứng chỉ quỹ (Distributor) và Đại lý chuyển nhượng (Transfer Agent) là những tổ chức nào?,"Đại lý phân phối chứng chỉ quỹ (Distributor) và Đại lý chuyển nhượng (Transfer Agent) là các tổ chức có vai trò quan trọng trong quá trình phát hành và quản lý hoạt động của chứng chỉ quỹ. Cụ thể:

- **Đại lý Phân phối (Distributor):** Đây là tổ chức được chọn để thực hiện việc phân phối chứng chỉ quỹ đến các nhà đầu tư. Trong trường hợp này, Công ty Cổ phần Chứng khoán Kỹ thương (""TCBS"") đã được lựa chọn làm Đại lý Phân phối.

- **Đại lý Chuyển nhượng (Transfer Agent):** Tổ chức này chịu trách nhiệm quản lý và thực hiện các giao dịch chuyển nhượng chứng chỉ quỹ giữa nhà đầu tư. Thông tin về Đại lý Chuyển nhượng không trực tiếp xuất hiện trong đoạn trích, nhưng thông thường nó sẽ là một tổ chức chuyên nghiệp như ngân hàng hoặc công ty chứng khoán.

Trong văn bản đề cập, Công ty Cổ phần Chứng khoán Kỹ thương (""TCBS"") cũng được liệt kê đồng thời là Đại lý Phân phối và có thể là Đại lý Chuyển nhượng. 

Thông tin này được lấy từ trang 18 của tài liệu (Nguồn: Trang 18).","['## XVI. PHỤ LỤC ĐỈNH KÈM\nPhụ lục 01: Danh sách các đại lý phân phối chứng chỉ quỹ được lựa chọn.  \nPhụ lục 02: Các đối tác liên quan  \nCÔNG TY CỔ PHẦN QUẢN LÝ QUỸ KỸ THƯƠNG  \n![img-12.jpeg](img-12.jpeg)  \nTỔNG GIÁM ĐỐC\nĐặng Lư Dũng', 'Giá dịch vụ Chuyển Đổi Quỹ sẽ được hạch toán cho Công Ty Quản Lý Quỹ và Đại Lý Phân Phối căn cứ theo hợp đồng ký giữa Công Ty Quản Lý Quỹ và Đại Lý Phân Phối.', 'Nhà Đầu Tư có thể mở nhiều tài khoản tại các Đại lý phân phối khác nhau để cùng giao dịch một loại Chứng chỉ Quỹ. Nhà Đầu Tư cần nộp Hợp đồng và các giấy tờ quy định để mở tài khoản giao dịch tại mỗi Đại Lý Phân Phối mà Nhà Đầu Tư muốn thực hiện giao dịch. Các tài khoản tại các Đại Lý Phân Phối khác nhau của cùng một Nhà Đầu Tư được quản lý độc lập. Do đó, Lệnh Mua lần đầu tối thiểu cũng như số dư tài khoản tối thiểu được áp dụng cho từng Đại Lý Phân Phối. Nhà Đầu Tư chỉ có thể nộp các Phiếu Lệnh Bán, Chuyển Đổi, Chuyển Nhượng, Hủy Lệnh hay thay đổi thông tin tài khoản của tài khoản mở tại một Đại Lý Phân Phối ở bất kỳ Điểm Nhận Lệnh nào của Đại Lý Phân Phối đó.', 'Các Đại Lý Phân Phối sẽ tập hợp các Yêu cầu mở tài khoản của Nhà Đầu Tư và gửi Chỉ thị mở tài khoản cho Đại Lý Chuyển Nhượng, là tổ chức sẽ đại diện Công Ty Quản Lý Quỹ tiến hành xử lý yêu cầu. Các yêu cầu không đầy đủ thông tin sẽ bị từ chối và có thể làm trì hoãn việc hoàn tất quá trình xử lý yêu cầu. Trong một số trường hợp, việc bổ sung thêm thông tin yêu cầu cũng có thể làm chậm việc hoàn tất quá trình xử lý. Công Ty Quản Lý Quỹ được quyền từ chối yêu cầu trong trường hợp không tìm được cách giải quyết cho bất kỳ vấn đề nào này sinh trong quá trình xử lý yêu cầu đăng ký.', '## 2.3. Đặc trưng của chứng chỉ Quỹ đầu tư\nCông ty quản lý quỹ thực hiện hoặc ủy quyền cho tổ chức cung cấp dịch vụ đại lý chuyển nhượng lập và quản lý số đăng ký nhà đầu tư chính (sổ chính) hoặc ủy quyền đại lý ký danh lập, quản lý đăng ký nhà đầu tư phụ (sổ phụ) và xác nhận quyền sở hữu chứng chỉ quỹ cho nhà đầu tư.  \nSố đăng ký nhà đầu tư của Quỹ có thể là văn bản, tập dữ liệu điện tử hoặc cả hai. Các nội dung của Số đăng ký nhà đầu tư được quy định chi tiết tại điều 15 Điều lệ Quỹ.', '## d) Giá dịch vụ Chuyển Nhượng\nNhà Đầu Tư phải trả một mức Giá dịch vụ Chuyển Nhượng duy nhất là 300.000 đồng (ba trăm nghìn đồng) cho mỗi giao dịch chuyển nhượng Đơn Vị Quỹ. Giá dịch vụ Chuyển Nhượng do người thực hiện chuyển nhượng thanh toán.  \nGiá dịch vụ Chuyển Nhượng sẽ không áp dụng trong trường hợp Nhà Đầu Tư thực hiện chuyển nhượng số Chứng Chỉ Quỹ từ tài khoản này sang tài khoản khác cùng đứng tên Nhà Đầu Tư tại hai Đại Lý Phân Phối khác nhau.  \nGiá dịch vụ Chuyển Nhượng sẽ được hạch toán cho Công Ty Quản Lý Quỹ và Đại Lý Phân Phối căn cứ theo hợp đồng ký giữa Công Ty Quản Lý Quỹ và Đại Lý Phân Phối.', 'Vị Quỹ, bao gồm cả phần lẻ của Đơn Vị Quỹ. Nhà Đầu Tư chuyển nhượng cần điền Lệnh Chuyển Nhượng Đơn Vị Quỹ với điều kiện là số lượng Chuyển Nhượng phải bằng hoặc lớn hơn số dư tối thiểu khi mở tài khoản nếu người nhận chuyển nhượng chưa phải là Nhà Đầu Tư.  \n- **Xử Lý Các Đơn Chuyển Nhượng**', '“Ban Đại Diện Quỹ”\nlà những người đại diện cho Nhà Đầu Tư được Đại Hội Nhà Đầu Tư bầu ra để thay mặt Nhà Đầu Tư thực hiện việc giám sát các hoạt động của Quỹ, Công ty Quản Lý Quỹ và Ngân Hàng Giám Sát.  \n“Vốn Điều lệ”\nlà tổng số vốn bằng tiền do các Nhà Đầu Tư thực góp trong đợt phát hành Chứng Chỉ Quỹ lần đầu ra công chúng và được ghi trong Điều lệ.  \n“Chứng Chỉ Quỹ”\nLà loại chứng khoán xác nhận quyền sở hữu của nhà đầu tư đối với một phần vốn góp tại quỹ. Mệnh giá 01 chứng chỉ quỹ là 10.000 đồng.  \n“Giá bán/ Giá phát hành”', '## 2.4.7. Quy trình chuyển nhượng chứng chỉ quỹ\nNhà Đầu Tư có thể Chuyển Nhượng Đơn Vị Quỹ cho nhà đầu tư khác dưới dạng quà tặng, thừa kế hoặc thực hiện lệnh của toà án. Chuyển Nhượng chỉ được thực hiện dưới dạng số lượng Đơn Vị Quỹ, bao gồm cả phần lẻ của Đơn Vị Quỹ. Nhà Đầu Tư chuyển nhượng cần điền Lệnh Chuyển Nhượng Đơn Vị Quỹ với điều kiện là số lượng Chuyển Nhượng phải bằng hoặc lớn hơn số dư tối thiểu khi mở tài khoản nếu người nhận chuyển nhượng chưa phải là Nhà Đầu Tư.', '- Các đối tác có liên quan đến đợt phát hành  \n**Ủy quyền đại lý chuyển nhượng**  \nTên đại lý: Trung tâm Lưu ký Chứng khoán Việt Nam\nTrụ sở chính: 15 Đoàn Trần Nghiệp, Quận Hai Bà Trưng, Hà Nội\nĐiện thoại: +84 24 39747113   Fax: +84 24 39747120  \n**Ủy quyền dịch vụ quản trị quỹ đầu tư**  \nTên ngân hàng: Ngân hàng TMCP Đầu tư và Phát triển Việt Nam – Chi nhánh Hà Thành\nTrụ sở chính: 74 Thợ Nhuộm, Hoàn Kiếm, Hà Nội\nĐiện thoại: (+84) 43 9362086   Fax: (+84) 439411847', 'Nhà Đầu Tư có thể thanh toán số tiền mua Đơn Vị Quỹ từ tài khoản ngân hàng của mình vào tài khoản của Quỹ để Ngân Hàng Giám Sát nhận được đúng hạn và Đại Lý Phân Phối hoàn thành xử lý việc đăng ký với Đại Lý Chuyển Nhượng. Mọi khoản đầu tư vào Đơn Vị Quỹ đều thực hiện bằng tiền Đồng Việt Nam.  \nTrong trường hợp lệnh mua chứng chỉ quỹ và việc thanh toán cho lệnh mua được thực hiện bởi cá nhân, tổ chức khác không phải nhà đầu tư thì phiếu lệnh và tài liệu xác nhận thanh toán phải nêu rõ tên, số tài khoản và giá trị thanh toán của nhà đầu tư được hưởng lợi.', '## d) Giá dịch vụ Chuyển Nhượng\nNhà Đầu Tư phải trả một mức Giá dịch vụ Chuyển Nhượng duy nhất là 300.000 đồng (ba trăm nghìn đồng) cho mỗi giao dịch chuyển nhượng Đơn Vị Quỹ. Giá dịch vụ Chuyển Nhượng do người thực hiện chuyển nhượng thanh toán.  \nGiá dịch vụ Chuyển Nhượng sẽ không áp dụng trong trường hợp Nhà Đầu Tư thực hiện chuyển nhượng số Chứng Chí Quỹ từ tài khoản này sang tài khoản khác cùng đứng tên Nhà Đầu Tư tại hai Đại Lý Phân Phối khác nhau.  \nGiá dịch vụ Chuyển Nhượng sẽ được hạch toán cho Công Ty Quản Lý Quỹ và Đại Lý Phân Phối căn cứ theo hợp đồng ký giữa Công Ty Quản Lý Quỹ và Đại Lý Phân Phối.', '- Trong trường hợp nhận được yêu cầu chuyển trả cụ thể từ Nhà Đầu tư hoặc không nhận được yêu cầu chuyển trả từ Nhà Đầu Tư, số tiền không hợp lệ ở trên sẽ được chuyển trả lại cho Nhà đầu tư hoặc bên chuyển tiền không hợp lệ trong vòng 05 (năm) ngày làm việc kể từ kỳ giao dịch chứng chỉ quỹ áp dụng.  \nChương trình ĐTĐK sẽ dừng khi Nhà Đầu Tư quyết định dừng bằng cách thông báo dừng thực hiện ĐTĐK với Đại Lý Phân Phối hoặc do Nhà Đầu Tư không nộp tiền/không nộp đủ tiền mua chứng chỉ quỹ cho Chương Trình ĐTĐK trong 05 kỳ liên tiếp.  \n32', 'Trong các trường hợp tạm dừng thực hiện các giao dịch Đơn Vị Quỹ, Lệnh Chuyển Đổi đã nhận sẽ được thực hiện tại NAV tại Ngày Giao Dịch đầu tiên sau khi giao dịch được thực hiện trở lại.  \n**g. Quy trình chuyển nhượng chứng chỉ quỹ**  \n- **Đơn Chuyển Nhượng**  \nNhà Đầu Tư có thể Chuyển Nhượng Đơn Vị Quỹ cho nhà đầu tư khác dưới dạng quà tặng, thừa kế hoặc thực hiện lệnh của toà án. Chuyển Nhượng chỉ được thực hiện dưới dạng số lượng Đơn  \n55', '## e. Quy trình bán chứng chỉ quỹ\nĐại Lý Phân Phối sẽ xử lý tất cả các Lệnh Bản nhận trước Thời Điểm Đóng Số Lệnh và gửi lệnh giao dịch tổng hợp tới Đại lý Chuyển Nhượng để thực hiện giao dịch cho Ngày Giao Dịch kế tiếp, và đảm bảo các thông tin trong Lệnh Bản đầy đủ và nhất quán và Nhà Đầu Tư có đủ số Đơn Vị Quỹ trong tài khoản để bán. Nhà Đầu tư có thể đặt bản số Chứng Chỉ Quỹ tối đa bằng số lượng Chứng Chỉ Quỹ mà mình sở hữu. Khoản tiền bán ròng sẽ được chuyển trả cho Nhà Đầu Tư. Lệnh Bản không thuộc trường hợp được thực hiện một phần bởi các điều kiện liên quan đến Lệnh Bản một phần như để trong các mục dưới đây sẽ được giao dịch tại NAV tại Ngày Giao Dịch trừ đi Giá dịch vụ Mua lại, giá dịch vụ chuyển tiền và thuế (nếu có), dựa trên ngày giờ nhận Lệnh Bản tại Điểm Nhận Lệnh, theo ngày giờ xác nhận tại Điểm Nhận Lệnh', '## 2.3. Đặc trưng của chứng chỉ Quỹ đầu tư\nNhà đầu tư của Quỹ là cá nhân, tổ chức trong và ngoài nước, sở hữu chứng chỉ quỹ. Nhà đầu tư không chịu trách nhiệm pháp lý hoặc nghĩa vụ khác ngoài trách nhiệm trong phạm vi số chứng chỉ Quỹ mà họ sở hữu. Nhà đầu tư là tổ chức bao gồm các tổ chức kinh tế và xã hội được pháp luật Việt Nam công nhận.  \nNhà đầu tư pháp nhân cử người đại diện hợp pháp đại diện cho số Chứng chỉ quỹ mà mình sở hữu. Việc đề cử, hủy bỏ hay thay thế người đại diện này phải được thông báo bằng văn bản, do người đại diện có thẩm quyền của nhà đầu tư tổ chức ký.', '## f) Lệnh Mua Tối Thiểu\nĐại Lý Phân Phối sẽ xử lý tất cả các Lệnh Bản nhận trước Thời Điểm Đóng Số Lệnh và gửi lệnh giao dịch tổng hợp tới Đại lý Chuyển Nhượng để thực hiện giao dịch cho Ngày Giao Dịch kế tiếp, và đảm bảo các thông tin trong Lệnh Bản đầy đủ và nhất quán và Nhà Đầu Tư có đủ số Đơn Vị Quỹ trong tài khoản để bán. Nhà Đầu tư có thể đặt bán số Chứng Chỉ Quỹ tối đa bằng số lượng Chứng Chỉ Quỹ mà mình sở hữu. Khoản tiền bán ròng sẽ được chuyển trả cho Nhà Đầu Tư. Lệnh Bản không thuộc trường hợp được thực hiện một phần bởi các điều kiện liên quan đến Lệnh Bản một phần như để trong các mục dưới đây sẽ được giao dịch tại NAV tại Ngày Giao Dịch trừ đi Giá dịch vụ Mua lại, giá dịch vụ chuyển tiền và thuế (nếu có), dựa trên ngày giờ nhận Lệnh Bản tại Điểm Nhận Lệnh, theo ngày giờ xác nhận tại Điểm Nhận Lệnh', '## 2.4.6. Quy trình chuyển đổi quỹ\nNhà Đầu Tư có thể chuyển đổi sang Quỹ khác do Công Ty Quản Lý Quỹ quản lý bằng Lệnh Chuyển Đổi. Phiếu Lệnh Chuyển Đổi được đính kèm theo Đơn Đăng Ký, hoặc có tại Điểm Nhận Lệnh. Đối với Lệnh Chuyển Đổi, toàn bộ tiền bán Đơn Vị Quỹ của Quỹ này sau khi trừ phí và thuế (nếu có), sẽ dùng để mua Đơn Vị Quỹ của Quỹ khác.  \nViệc chuyển đổi Quỹ bằng việc bán một Quỹ và mua một Quỹ khác tại ngày giao dịch tương ứng được coi như thực hiện một lệnh bán. Giá dịch vụ Chuyển Đổi Quỹ do đó được áp dụng một lần trên giá trị giao dịch bán và Giá dịch vụ Chuyển Đổi Quỹ được TCC ấn định và công bố bằng văn bản thông báo tại từng thời kỳ nhưng không quá ba phần trăm (3%) giá trị mua lại.', 'lại cho Nhà đầu tư hoặc bên chuyển tiền không hợp lệ trong vòng 05 (năm) ngày làm việc kể từ kỳ giao dịch chứng chỉ quỹ áp dụng.  \nChương trình ĐTĐK sẽ dùng khi Nhà Đầu Tư quyết định dừng bằng cách thông báo dừng thực hiện ĐTĐK với Đại Lý Phân Phối hoặc do Nhà Đầu Tư không nộp tiền/không nộp đủ tiền mua chứng chỉ quỹ cho Chương Trình ĐTĐK trong 05 kỳ liên tiếp.  \n- Phí/giá dịch vụ áp dụng cho Chương Trình ĐTĐK  \nPhí/giá dịch vụ áp dụng cho chương trình ĐTĐK được quy định chi tiết tại mục 2.5.3 của Bản Cáo Bạch này.  \n- Bản chứng chỉ quỹ mua theo Chương Trình ĐTĐK  \nNhà Đầu Tư bán chứng chỉ quỹ mua theo Chương Trình ĐTĐK theo nguyên tắc quy định tại mục 2.5.3 của Bản Cáo Bạch này.', 'Trong trường hợp Quỹ nhận được số tiền mua thấp hơn lệnh đăng ký mua và không nhận được yêu cầu chuyển trả từ khách hàng, số tiền mua sẽ tiếp tục được giữ lại để chờ yêu cầu giao dịch tiếp theo từ khách hàng.  \nTrong trường hợp Nhà Đầu Tư có nhiều lệnh mua Chứng Chỉ Quỹ cùng một lúc, Lệnh Mua Chứng Chỉ Quỹ sẽ được ưu tiên theo thứ tự đặt lệnh.  \nPhí/giá dịch vụ chuyển tiền (nếu có) được trừ vào số tiền hoàn trả cho Nhà Đầu Tư. Đơn Vị Quỹ sẽ chỉ được ghi nhận vào tài khoản của Nhà Đầu Tư hay của Đại Lý Kỷ Danh sau khi có kết quả giao dịch chứng chỉ quỹ.', 'Nhà Đầu Tư có thể thanh toán số tiền mua Đơn Vị Quỹ bằng cách chuyển khoản từ tài khoản ngân hàng của mình hoặc nộp tiền trực tiếp vào tài khoản của Quỹ để Ngân Hàng Giám Sát nhận được đúng hạn và Đại Lý Phân Phối hoàn thành xử lý việc đăng ký với Đại Lý Chuyển Nhượng. Mọi khoản đầu tư vào Đơn Vị Quỹ đều thực hiện bằng tiền Đồng Việt Nam.  \nTrong trường hợp lệnh mua chứng chỉ quỹ và việc thanh toán cho lệnh mua được thực hiện bởi cá nhân, tổ chức khác không phải nhà đầu tư thì phiếu lệnh và tài liệu xác nhận thanh toán phải nêu rõ tên, số tài khoản và giá trị thanh toán của nhà đầu tư được hưởng lợi.  \n- **Tuân Thủ**', 'Trong trường hợp Quỹ nhận được số tiền mua thấp hơn Phiếu lệnh mua và không nhận được yêu cầu chuyển trả từ khách hàng, số tiền mua sẽ tiếp tục được giữ lại để chờ yêu cầu giao dịch tiếp theo từ khách hàng.  \nTrong trường hợp Nhà Đầu Tư có nhiều lệnh mua Chứng Chỉ Quỹ cùng một lúc, Lệnh Mua Chứng Chỉ Quỹ sẽ được ưu tiên theo thứ tự đặt lệnh.  \nPhí/giá dịch vụ chuyển tiền (nếu có) được trừ vào số tiền hoàn trả cho Nhà Đầu Tư. Đơn Vị Quỹ sẽ chỉ được ghi nhận vào tài khoản của Nhà Đầu Tư hay của Đại Lý Ký Danh sau khi có kết quả giao dịch chứng chỉ quỹ.', '# VII. ĐẠI LÝ PHÂN PHỐI CHỨNG CHỈ QUỸ\nDanh sách Đại lý Phân phối được lựa chọn bao gồm:  \n- Công ty Cổ phần Chứng khoán Kỹ thương (“TCBS”)\n- Địa chỉ: Tầng 10 và Tầng 12, tòa nhà Techcombank, 191 Bà Triệu, phường Lê Đại Hành, quận Hai Bà Trưng, TP. Hà Nội\n- Giấy phép thành lập và hoạt động: số 125/GP-UBCK ngày 30/05/2018 do Ủy ban Chứng khoán Nhà nước cấp và các giấy phép điều chỉnh.\n- Số Giấy chứng nhận đăng ký hoạt động phân phối:\n- Điện thoại: 84.24.22201039    Fax: 84.24.22201032  \nDanh sách Đại Lý Phân phối và các Điểm Nhận Lệnh có thể thay đổi bất kỳ lúc nào sau khi hoàn thành các thủ tục thông báo tới Ủy ban Chứng khoán Nhà nước theo quy định của Pháp Luật.', '|  Từ trên 12 tháng trở lên | 0,00%  |\n| --- | --- |  \nGiá dịch vụ Chuyển Đổi Quỹ sẽ được hạch toán cho Công Ty Quản Lý Quỹ và Đại Lý Phân Phối căn cứ theo hợp đồng ký giữa Công Ty Quản Lý Quỹ và Đại Lý Phân Phối.', 'Quỹ không quy định quy mô tối đa trong đợt phát hành lần đầu ra công chúng. Vì vậy, nếu giá trị phát hành được vượt 50.000.000.000 VNĐ (năm mươi tỷ đồng), các Nhà Đầu Tư sẽ được phân bổ số lượng Đơn Vị Quỹ bằng với số đã đặt mua.  \n- Địa điểm phát hành:\nCông ty Cổ phần Quản lý Quỹ Kỹ thương\nĐịa chỉ đăng ký: Tầng 28, Tòa C5, số 119 Trần Duy Hưng, phường Trung Hòa, Quận Cầu Giấy, Hà Nội\nĐiện thoại: (+84) 24 39446368   Fax: (+84) 24 39446583  \n- Đại lý phân phối và điểm nhận lệnh:\nCông ty Cổ phần Chứng khoán Kỹ thương (“TCBS”)\nĐịa chỉ: Tầng 10 và Tầng 12, tòa nhà Techcombank, 191 Bà Triệu, phường Lê Đại Hành, quận Hai Bà Trưng, TP. Hà Nội\nĐiện thoại: 84.24.22201039   Fax: 84.24.22201032  \n- Các đối tác có liên quan đến đợt phát hành  \n**Ủy quyền đại lý chuyển nhượng**']",Đại lý phân phối: Công ty CP Chứng khoán Kỹ thương (TCBS). Đại lý chuyển nhượng: Trung tâm Lưu ký Chứng khoán Việt Nam (VSD).
Trong trường hợp nào việc thực hiện lệnh bán của nhà đầu tư có thể bị thực hiện một phần (prorated)?,"Việc thực hiện lệnh bán của nhà đầu tư có thể bị thực hiện một phần (prorated) trong các trường hợp sau:

- Khi cơ cấu danh mục đầu tư của quỹ cần được điều chỉnh để đảm bảo tuân thủ các hạn chế đầu tư đã quy định.
- Khi thực hiện các khoản thanh toán của quỹ theo quy định của pháp luật, bao gồm việc thực hiện lệnh giao dịch của nhà đầu tư.

Thông tin này được lấy từ trang 21 (Nguồn: Trang 21).","['## 2.4.6. Quy trình chuyển đổi quỹ\nNhà Đầu Tư cần lưu ý rằng Lệnh Chuyển Đổi có thể chỉ được thực hiện một phần nếu Lệnh Bán nằm trong Lệnh Chuyển Đổi chỉ được thực hiện một phần. Các trường hợp Lệnh Bán chỉ được thực hiện một phần được quy định chi tiết tại mục 2.4.5.e. Phần chưa được thực hiện của Lệnh Chuyển Đổi được thực hiện một phần sẽ bị hủy.', '## f) Tạm dừng thực hiện Lệnh Bán\nNhà Đầu Tư cần lưu ý rằng trong một số trường hợp, các Lệnh Bán cùng với tất cả các lệnh khác có thể bị tạm dừng thực hiện. Các trường hợp này được quy định chi tiết tại mục 2.4.8.  \nTrong trường hợp các lệnh giao dịch Đơn Vị Quỹ bị tạm dừng thực hiện, Lệnh Bán đã nhận sẽ được thực hiện tại NAV tại Ngày Giao Dịch đầu tiên sau khi giao dịch được thực hiện trở lại.  \n29', '## e) Thực Hiện Một Phần Lệnh Bán\nSố lượng Chứng Chỉ Quỹ Nhà Đầu Tư được thực hiện trong trường hợp thực hiện một phần Lệnh Bán cũng áp dụng nguyên tắc của Lệnh Bán tối thiểu nêu trên. Phần lệnh chưa được thực hiện và các lệnh đến sau thời điểm đóng số lệnh sẽ tự động bị hủy. Nhà Đầu Tư có thể thực hiện tiếp các lệnh bán của mình bằng cách đăng ký giao dịch tại ngày giao dịch tiếp theo.', '## e) Thực Hiện Một Phần Lệnh Bán\nTrong các trường hợp sau, Quỹ chỉ có thể thực hiện một phần Lệnh Bán và Chuyến Đổi Quỹ của Nhà Đầu Tư:  \n- Tổng giá trị của các Lệnh Bán (bao gồm cả Lệnh Bán từ hoạt động Chuyến Đổi Quỹ) trừ đi tổng giá trị của tất cả các Lệnh Mua (bao gồm cả Lệnh Mua từ hoạt động Chuyến Đổi Quỹ) tại Ngày Giao Dịch lớn hơn 10% của giá trị tài sản ròng của Quỹ (NAV); hoặc\n- Việc thực hiện tất cả các lệnh giao dịch của Nhà Đầu Tư tại Ngày Giao Dịch dẫn đến NAV của Quỹ thấp hơn 50.000.000.000 đồng (năm mươi tỷ đồng); hoặc Giá trị phần đơn vị quỹ hoặc số đơn vị quỹ còn lại trên tài khoản của nhà đầu tư thấp hơn giá trị tối thiểu hoặc số lượng đơn vị quỹ tối thiểu để duy trì tài khoản của nhà đầu tư theo quy định tại Điều lệ quỹ và Bán cáo bạch.', '## e) Tạm Dừng Thực Hiện Lệnh Mua\nNhà Đầu Tư cần lưu ý rằng trong một số trường hợp các Lệnh Mua của Nhà Đầu Tư cùng với tất cả các Lệnh Mua khác có thể bị tạm dừng thực hiện. Các trường hợp này được liệt kê trong mục 2.4.8 dưới đây.  \nTrong trường hợp các giao dịch Đơn Vị Quỹ bị tạm dừng, Lệnh Mua sẽ được thực hiện vào Ngày Giao Dịch đầu tiên sau khi giao dịch được thực hiện trở lại.', 'Công Ty Quản Lý Quỹ có quyền thay đổi các mức bán tối thiểu trong từng thời điểm.  \nNhà Đầu Tư cần lưu ý là trong một số trường hợp Lệnh Bán sẽ không thể thực hiện toàn bộ hoặc Lệnh Bán có thể bị tạm dừng thực hiện.  \n- **Số Dư Tài Khoản Tối Thiểu**  \nKhông áp dụng.  \n- **Thực Hiện Một Phần Lệnh Bán**  \nTrong các trường hợp sau, Quỹ chỉ có thể thực hiện một phần Lệnh Bán và Chuyến Đổi Quỹ của Nhà Đầu Tư:  \n- Tổng giá trị của các Lệnh Bán (bao gồm cả Lệnh Bán từ hoạt động Chuyến Đổi Quỹ) trừ đi tổng giá trị của tất cả các Lệnh Mua (bao gồm cả Lệnh Mua từ hoạt động Chuyến Đổi Quỹ) tại Ngày Giao Dịch lớn hơn 10% của giá trị tài sản ròng của Quỹ (NAV); hoặc', '## e) Thực Hiện Một Phần Lệnh Bán\n- Trường hợp thực hiện một phần Lệnh Bán, Lệnh mua, Lệnh Chuyến Đổi Quỹ theo quy định nêu trên, Công ty Quản Lý Quỹ áp dụng nguyên tắc phân phối cùng tỷ lệ: Phần giá trị được thực hiện sẽ được phân bổ cho tất cả nhà đầu tư đăng ký giao dịch theo cùng một tỷ lệ giữa giá trị thực hiện và giá trị đăng ký giao dịch.  \nSố lượng chứng chỉ quỹ được thực hiện trong trường hợp này được tính như sau:  \nSố lượng CCQ NĐT được thực hiện = Số lượng CCQ NĐT đăng ký bán * [Tổng số lượng CCQ mà CTQLQ có thể đáp ứng cho lệnh bán của NĐT/Tổng số lượng CCQ đăng ký bán trong kỳ]', '- Việc thực hiện tất cả các lệnh giao dịch của Nhà Đầu Tư tại Ngày Giao Dịch dẫn đến NAV của Quỹ thấp hơn 50.000.000.000 đồng (năm mươi tỷ đồng); hoặc Giá trị phần đơn vị quỹ hoặc số đơn vị quỹ còn lại trên tài khoản của nhà đầu tư thấp hơn giá trị tối thiểu hoặc số lượng đơn vị quỹ tối thiểu để duy trì tài khoản của nhà đầu tư theo quy định tại Điều lệ quỹ và Bán cáo bạch.\n- Trường hợp thực hiện một phần Lệnh Bán, Lệnh mua, Lệnh Chuyến Đổi Quỹ theo quy định nêu trên, Công ty Quản Lý Quỹ áp dụng nguyên tắc phân phối cùng tỷ lệ: Phần giá trị được thực hiện sẽ được phân bổ cho tất cả nhà đầu tư đăng ký giao dịch theo cùng một tỷ lệ giữa giá trị thực hiện và giá trị đăng ký giao dịch.  \nSố lượng chứng chỉ quỹ được thực hiện trong trường hợp này được tính như sau:', '## 2.4.6. Quy trình chuyển đổi quỹ\nTrong một vài trường hợp Lệnh Chuyển Đổi cùng các lệnh khác có thể bị tạm dừng thực hiện. Các trường hợp được này được nêu tại mục 2.4.8.  \nTrong các trường hợp tạm dừng thực hiện các giao dịch Đơn Vị Quỹ, Lệnh Chuyển Đổi đã nhận sẽ được thực hiện tại NAV tại Ngày Giao Dịch đầu tiên sau khi giao dịch được thực hiện trở lại.', '## f) Lệnh Mua Tối Thiểu\nĐại Lý Phân Phối sẽ xử lý tất cả các Lệnh Bản nhận trước Thời Điểm Đóng Số Lệnh và gửi lệnh giao dịch tổng hợp tới Đại lý Chuyển Nhượng để thực hiện giao dịch cho Ngày Giao Dịch kế tiếp, và đảm bảo các thông tin trong Lệnh Bản đầy đủ và nhất quán và Nhà Đầu Tư có đủ số Đơn Vị Quỹ trong tài khoản để bán. Nhà Đầu tư có thể đặt bán số Chứng Chỉ Quỹ tối đa bằng số lượng Chứng Chỉ Quỹ mà mình sở hữu. Khoản tiền bán ròng sẽ được chuyển trả cho Nhà Đầu Tư. Lệnh Bản không thuộc trường hợp được thực hiện một phần bởi các điều kiện liên quan đến Lệnh Bản một phần như để trong các mục dưới đây sẽ được giao dịch tại NAV tại Ngày Giao Dịch trừ đi Giá dịch vụ Mua lại, giá dịch vụ chuyển tiền và thuế (nếu có), dựa trên ngày giờ nhận Lệnh Bản tại Điểm Nhận Lệnh, theo ngày giờ xác nhận tại Điểm Nhận Lệnh', '## e. Quy trình bán chứng chỉ quỹ\nĐại Lý Phân Phối sẽ xử lý tất cả các Lệnh Bản nhận trước Thời Điểm Đóng Số Lệnh và gửi lệnh giao dịch tổng hợp tới Đại lý Chuyển Nhượng để thực hiện giao dịch cho Ngày Giao Dịch kế tiếp, và đảm bảo các thông tin trong Lệnh Bản đầy đủ và nhất quán và Nhà Đầu Tư có đủ số Đơn Vị Quỹ trong tài khoản để bán. Nhà Đầu tư có thể đặt bản số Chứng Chỉ Quỹ tối đa bằng số lượng Chứng Chỉ Quỹ mà mình sở hữu. Khoản tiền bán ròng sẽ được chuyển trả cho Nhà Đầu Tư. Lệnh Bản không thuộc trường hợp được thực hiện một phần bởi các điều kiện liên quan đến Lệnh Bản một phần như để trong các mục dưới đây sẽ được giao dịch tại NAV tại Ngày Giao Dịch trừ đi Giá dịch vụ Mua lại, giá dịch vụ chuyển tiền và thuế (nếu có), dựa trên ngày giờ nhận Lệnh Bản tại Điểm Nhận Lệnh, theo ngày giờ xác nhận tại Điểm Nhận Lệnh', 'Lệnh Mua thành công của Nhà Đầu Tư hay Đại Lý Kỷ Danh sẽ được thông báo trong vòng 03 (ba) ngày làm việc sau Ngày Giao Dịch, số lượng Đơn Vị Quỹ sẽ được làm tròn xuống đến hai số thập phân sau dấu phẩy. Số Đơn Vị Quỹ lẻ sẽ không ảnh hưởng đến khả năng bán lại Đơn Vị Quỹ của Nhà Đầu Tư.  \n- **Tạm Dừng Thực Hiện Lệnh Mua**  \nNhà Đầu Tư cần lưu ý rằng trong một số trường hợp các Lệnh Mua của Nhà Đầu Tư cùng với tất cả các Lệnh Mua khác có thể bị tạm dừng thực hiện. Các trường hợp này được liệt kê trong mục 2.4.8.  \nTrong trường hợp các giao dịch Đơn Vị Quỹ bị tạm dừng, Lệnh Mua sẽ được thực hiện vào Ngày Giao Dịch đầu tiên sau khi giao dịch được thực hiện trở lại.  \n- **Lệnh Mua Tối Thiểu**  \nMức đầu tư tối thiểu (tính theo giá trị Lệnh Mua) là 10.000 VNĐ (Mười nghìn đồng)', 'Sau khi thực hiện các Lệnh Bán Được Chấp Nhận, số Đơn Vị Quỹ đã bán sẽ được trù ra từ tổng số Đơn Vị Quỹ trong tài khoản của Nhà Đầu Tư và bảng kê mới về số Đơn Vị Quỹ nắm giữ sẽ được gửi đến Nhà Đầu Tư.  \nLệnh Bán thành công của Nhà Đầu Tư hay Đại Lý Ký Danh sẽ được thông báo trong vòng 03 (ba) ngày làm việc sau Ngày Giao Dịch.  \nTrong thời hạn 5 ngày làm việc sau ngày giao dịch Chứng chỉ quỹ, Nhà Đầu tư sẽ nhận được tiền bán chứng chỉ quỹ vào tài khoản mà Nhà Đầu tư đã đăng ký khi thực hiện mua Chứng chỉ quỹ.  \n- **Lệnh Bán Tối Thiểu**  \nLệnh Bán tối thiểu là 10 (mười) Đơn Vị Quỹ. Trường hợp sau khi đặt bán, số lượng chứng chỉ quỹ còn lại nhỏ hơn số lượng bán tối thiểu, Nhà Đầu tư cần đặt bán toàn bộ để giảm số Đơn vị Quỹ nắm giữ về 0 (không).', '## 3.6. Rủi ro về biến động giá\nRủi ro về biến động giá của Quỹ phát sinh khi một hay một số Nhà Đầu Tư đang nắm giữ một số lượng lớn Đơn Vị Quỹ quyết định thực hiện Lệnh Bản các Đơn Vị Quỹ này cùng lúc. Điều này có thể ảnh hưởng bất lợi tới giá của Đơn Vị Quỹ nếu các Lệnh Bản này đòi hỏi Công Ty Quản Lý Quỹ phải thoái vốn các khoản đầu tư tại mức giá thấp. Các quy định về thực hiện một phần lệnh bán và tạm dừng lệnh bán có thể giảm thiểu rủi ro biến động giá của Quỹ.', '## c) Lệnh Bán Tối Thiểu\nLệnh Bán tối thiểu là 10 (mười) Đơn Vị Quỹ. Trường hợp sau khi đặt bán, số lượng chứng chỉ quỹ còn lại nhỏ hơn số lượng bán tối thiểu, Nhà Đầu tư cần đặt bán toàn bộ để giảm số Đơn vị Quỹ nắm giữ về 0 (không).  \nCông Ty Quản Lý Quỹ có quyền thay đổi các mức bán tối thiểu trong từng thời điểm.  \nNhà Đầu Tư cần lưu ý là trong một số trường hợp Lệnh Bán sẽ không thể thực hiện toàn bộ hoặc Lệnh Bán có thể bị tạm dừng thực hiện.', 'Trong trường hợp Quỹ nhận được số tiền mua thấp hơn Phiếu lệnh mua và không nhận được yêu cầu chuyển trả từ khách hàng, số tiền mua sẽ tiếp tục được giữ lại để chờ yêu cầu giao dịch tiếp theo từ khách hàng.  \nTrong trường hợp Nhà Đầu Tư có nhiều lệnh mua Chứng Chỉ Quỹ cùng một lúc, Lệnh Mua Chứng Chỉ Quỹ sẽ được ưu tiên theo thứ tự đặt lệnh.  \nPhí/giá dịch vụ chuyển tiền (nếu có) được trừ vào số tiền hoàn trả cho Nhà Đầu Tư. Đơn Vị Quỹ sẽ chỉ được ghi nhận vào tài khoản của Nhà Đầu Tư hay của Đại Lý Ký Danh sau khi có kết quả giao dịch chứng chỉ quỹ.', 'Trong trường hợp Quỹ nhận được số tiền mua thấp hơn lệnh đăng ký mua và không nhận được yêu cầu chuyển trả từ khách hàng, số tiền mua sẽ tiếp tục được giữ lại để chờ yêu cầu giao dịch tiếp theo từ khách hàng.  \nTrong trường hợp Nhà Đầu Tư có nhiều lệnh mua Chứng Chỉ Quỹ cùng một lúc, Lệnh Mua Chứng Chỉ Quỹ sẽ được ưu tiên theo thứ tự đặt lệnh.  \nPhí/giá dịch vụ chuyển tiền (nếu có) được trừ vào số tiền hoàn trả cho Nhà Đầu Tư. Đơn Vị Quỹ sẽ chỉ được ghi nhận vào tài khoản của Nhà Đầu Tư hay của Đại Lý Kỷ Danh sau khi có kết quả giao dịch chứng chỉ quỹ.', 'Trong các trường hợp tạm dừng thực hiện các giao dịch Đơn Vị Quỹ, Lệnh Chuyển Đổi đã nhận sẽ được thực hiện tại NAV tại Ngày Giao Dịch đầu tiên sau khi giao dịch được thực hiện trở lại.  \n**g. Quy trình chuyển nhượng chứng chỉ quỹ**  \n- **Đơn Chuyển Nhượng**  \nNhà Đầu Tư có thể Chuyển Nhượng Đơn Vị Quỹ cho nhà đầu tư khác dưới dạng quà tặng, thừa kế hoặc thực hiện lệnh của toà án. Chuyển Nhượng chỉ được thực hiện dưới dạng số lượng Đơn  \n55', '## f) Lệnh Mua Tối Thiểu\n#### a) Phiếu Lệnh Bản  \nNhà Đầu Tư có thể bán Đơn Vị Quỹ vào bất kỳ Ngày Giao Dịch nào bằng cách nộp Lệnh Bản tới một Điểm Nhận Lệnh bất kỳ trước Thời Điểm Đóng Số Lệnh cho Ngày Giao Dịch đó. Phiếu Lệnh Bản được đính kèm theo Đơn Đăng Ký hoặc có sẵn tại các Điểm Nhận Lệnh. Tất cả các Phiếu Lệnh Bản phải được ký tên đầy đủ.  \n#### b) Quy Trình Xử lý Lệnh Bản  \nNhà Đầu Tư có thể đặt Lệnh Bản số Đơn Vị Quỹ muốn bán, lẻ đến 2 số thập phân và đảm bảo số lượng chứng chỉ quỹ còn lại sau khi đặt bán không nhỏ hơn số lượng bán tối thiểu.', '## e. Quy trình bán chứng chỉ quỹ\n- **Phiếu Lệnh Bản**  \nNhà Đầu Tư có thể bán Đơn Vị Quỹ vào bất kỳ Ngày Giao Dịch nào bằng cách nộp Lệnh Bản tới một Điểm Nhận Lệnh bất kỳ trước Thời Điểm Đóng Số Lệnh cho Ngày Giao Dịch đó. Phiếu Lệnh Bản được đính kèm theo Đơn Đăng Ký hoặc có sẵn tại các Điểm Nhận Lệnh. Tất cả các Phiếu Lệnh Bản phải được ký tên đầy đủ.  \n- **Quy Trình Xử lý Lệnh Bản**  \nNhà Đầu Tư có thể đặt Lệnh Bản số Đơn Vị Quỹ muốn bán, lẻ đến 2 số thập phân và đảm bảo số lượng chứng chỉ quỹ còn lại sau khi đặt bản không nhỏ hơn số lượng bán tối thiểu.', '## 2.2.5 Điều chỉnh danh mục đầu tư\nCơ cấu đầu tư của quỹ mở chỉ được vượt mức so với các hạn chế đầu tư đã quy định tại điểm a, b, c, d, đ, e và i mục IX.2.2.4 và chỉ do các nguyên nhân sau:  \na) Biến động giá trên thị trường của tài sản trong danh mục đầu tư của quỹ;  \nb) Thực hiện các khoản thanh toán của quỹ theo quy định của pháp luật, bao gồm việc thực hiện lệnh giao dịch của nhà đầu tư;', '- **Tạm dừng thực hiện Lệnh Bản**  \nNhà Đầu Tư cần lưu ý rằng trong một số trường hợp, các Lệnh Bản cùng với tất cả các lệnh khác có thể bị tạm dừng thực hiện. Các trường hợp này được quy định chi tiết tại mục 2.4.8.  \nTrong trường hợp các lệnh giao dịch Đơn Vị Quỹ bị tạm dừng thực hiện, Lệnh Bản đã nhận sẽ được thực hiện tại NAV tại Ngày Giao Dịch đầu tiên sau khi giao dịch được thực hiện trở lại.  \n**f. Quy trình chuyển đổi quỹ**  \n- **Phiếu Lệnh Chuyển Đổi Quỹ**  \nNhà Đầu Tư có thể chuyển đổi sang Quỹ khác do Công Ty Quản Lý Quỹ quản lý bằng Lệnh Chuyển Đổi. Phiếu Lệnh Chuyển Đổi được đính kèm theo Đơn Đăng Ký, hoặc có tại Điểm Nhận Lệnh. Đối với Lệnh Chuyển Đổi, toàn bộ tiền bán Đơn Vị Quỹ của Quỹ này sau khi trừ phí và thuế (nếu có), sẽ dùng để mua Đơn Vị Quỹ của Quỹ khác.', 'Lệnh Chuyển Đổi được đặt bằng số lượng Đơn Vị Quỹ.  \n- **Mức Tối Thiểu Cho Lệnh Chuyển Đổi**  \nLệnh Bản chuyển đổi và Lệnh Mua chuyển đổi cũng áp dụng quy định về Lệnh Bản tối thiểu và Mức Đầu tư tối thiểu như nêu trên.  \n- **Thực Hiện Một Phần Lệnh Chuyển Đổi**  \nNhà Đầu Tư cần lưu ý rằng Lệnh Chuyển Đổi có thể chỉ được thực hiện một phần nếu Lệnh Bản nằm trong Lệnh Chuyển Đổi chỉ được thực hiện một phần. Các trường hợp Lệnh Bản chỉ được thực hiện một phần được quy định chi tiết tại mục 2.4.6. Phần chưa được thực hiện của Lệnh Chuyển Đổi được thực hiện một phần sẽ bị hủy.  \n- **Tạm Dừng Thực Hiện Lệnh Chuyển Đổi**  \nTrong một vài trường hợp Lệnh Chuyển Đổi cùng các lệnh khác có thể bị tạm dừng thực hiện. Các trường hợp được này được nêu tại mục 2.4.6.', 'Ngày Giao Dịch các kỳ tiếp theo là ngày tròn kỳ kể từ Ngày Giao Dịch đầu tiên. Trường hợp ngày tròn kỳ của các kỳ tiếp theo rơi vào ngày nghỉ (bao gồm cả ngày nghỉ bù), thì ngày Giao Dịch các kỳ tiếp theo sẽ là ngày làm việc ngay sau ngày tròn kỳ. Lệnh cho các Ngày Giao Dịch này sẽ được tạo ra vào ngày làm việc trước Ngày Giao Dịch tương ứng.  \nNhà Đầu Tư cần thanh toán cho khoản đầu tư của Chương Trình ĐTĐK để Ngân Hàng Giám Sát nhận được tiền mua trước Thời điểm Đóng Số Lệnh của Ngày Giao Dịch của các kỳ đầu tư tương ứng.  \nTrường hợp Nhà Đầu Tư không nộp đủ tiền mua vào tài khoản của quỹ trước Thời điểm Đóng Số Lệnh của một Ngày Giao Dịch trong Chương Trình ĐTĐK, lệnh mua chứng chỉ quỹ của kỳ đầu tư đó sẽ không được thực hiện. Số tiền không hợp lệ này sẽ được xử lý như sau:', '# i. Chương trình Đầu tư Định kỳ\nNgày Giao Dịch các kỳ tiếp theo là ngày tròn kỳ kể từ Ngày Giao Dịch đầu tiên. Trường hợp ngày tròn kỳ của các kỳ tiếp theo rơi vào ngày nghỉ (bao gồm cả ngày nghỉ bù), thì ngày Giao Dịch các kỳ tiếp theo sẽ là ngày làm việc ngay sau ngày tròn kỳ. Lệnh cho các Ngày Giao Dịch này sẽ được tạo ra vào ngày làm việc trước Ngày Giao Dịch tương ứng.  \nNhà Đầu Tư cần thanh toán cho khoản đầu tư của Chương Trình ĐTĐK để Ngân Hàng Giám Sát nhận được tiền mua trước Thời điểm Đóng Số Lệnh của Ngày Giao Dịch của các kỳ đầu tư tương ứng.  \nTrường hợp Nhà Đầu Tư không nộp đủ tiền mua vào tài khoản của quỹ trước Thời điểm Đóng Số Lệnh của một Ngày Giao Dịch trong Chương Trình ĐTĐK, lệnh mua chứng chỉ quỹ của kỳ đầu tư đó sẽ không được thực hiện. Số tiền không hợp lệ này sẽ được xử lý như sau:']",Khi tổng giá trị lệnh bán ròng > 10% NAV hoặc việc thực hiện lệnh làm NAV Quỹ < 50 tỷ đồng.
Chương trình Đầu tư Định kỳ (SIP) sẽ tự động chấm dứt trong trường hợp nào?,"Chương trình Đầu tư Định kỳ (SIP) sẽ tự động chấm dứt trong trường hợp Nhà Đầu Tư thay đổi lệnh thực hiện ĐTĐK với Đại Lý Phân Phối và các lệnh thanh toán với ngân hàng của mình. Nếu không có sự thay đổi từ phía Nhà Đầu Tư, chương trình SIP sẽ tiếp tục theo kế hoạch đã chọn.

Thông tin này được lấy từ trang 57 (Nguồn: Trang 57).

Nếu bạn cần thêm thông tin chi tiết về cách thay đổi lệnh hoặc bất kỳ quy định nào liên quan đến việc chấm dứt SIP, vui lòng cho tôi biết.","['- Trong trường hợp nhận được yêu cầu chuyển trả cụ thể từ Nhà Đầu tư hoặc không nhận được yêu cầu chuyển trả từ Nhà Đầu Tư, số tiền không hợp lệ ở trên sẽ được chuyển trả lại cho Nhà đầu tư hoặc bên chuyển tiền không hợp lệ trong vòng 05 (năm) ngày làm việc kể từ kỳ giao dịch chứng chỉ quỹ áp dụng.  \nChương trình ĐTĐK sẽ dừng khi Nhà Đầu Tư quyết định dừng bằng cách thông báo dừng thực hiện ĐTĐK với Đại Lý Phân Phối hoặc do Nhà Đầu Tư không nộp tiền/không nộp đủ tiền mua chứng chỉ quỹ cho Chương Trình ĐTĐK trong 05 kỳ liên tiếp.  \n32', '## d) Xác Nhận Lệnh Chuyển Nhượng\nĐầu Tư Định Kỳ (ĐTĐK) là một chương trình đầu tư tiết kiệm có hệ thống cho phép Nhà Đầu Tư có thể tiết kiệm một khoản tiền cố định một cách thường xuyên bằng cách mua định kỳ các Đơn Vị Quỹ. Chương Trình ĐTĐK cho phép thực hiện các chương trình tiết kiệm theo kế hoạch đã đề ra.  \nNhà Đầu Tư sử dụng các lệnh tự động hoặc lệnh chờ để thực hiện chương trình Đầu Tư Định Kỳ.', '# i. Chương trình Đầu tư Định kỳ\nĐầu Tư Định Kỳ (ĐTĐK) là một chương trình đầu tư tiết kiệm có hệ thống cho phép Nhà Đầu Tư có thể tiết kiệm một khoản tiền cố định một cách thường xuyên bằng cách mua định kỳ các Đơn Vị Quỹ. Chương Trình ĐTĐK cho phép thực hiện các chương trình tiết kiệm theo kế hoạch đã đề ra.  \nNhà Đầu Tư sử dụng các lệnh tự động hoặc lệnh chờ để thực hiện chương trình Đầu Tư Định Kỳ.  \n- **Kỳ đầu tư của Chương Trình ĐTĐK**  \nĐịnh kỳ đầu tư của Chương Trình ĐTĐK là hàng tháng hoặc hàng quý hoặc hàng năm. Đại Lý Phân Phối có thể hỗ trợ các nhà đầu tư trong việc đưa ra một Chương Trình ĐTĐK và tần suất thanh toán phù hợp.  \n- **Khoản Tiền Đầu Tư Cho Chương Trình ĐTĐK**', 'Mức đầu tư tối thiểu định kỳ cho chương trình ĐTĐK là 10.000 VNĐ (Mười nghìn đồng).  \nNhà Đầu Tư có thể thay đổi giá trị khoản đầu tư và/hoặc kỳ đầu tư bất cứ lúc nào (nhưng không dưới mức đầu tư tối thiểu) bằng cách thay đổi lệnh thực hiện ĐTĐK với Đại Lý Phân Phối và các lệnh thanh toán với ngân hàng của mình. Nhà Đầu tư đã tham gia chương trình đầu tư định kỳ cũ sẽ được quyền bảo lưu hoặc chuyển đổi sang chương trình đầu tư định kỳ mới.  \nc) Ngày giao dịch và thanh toán cho các khoản đầu tư ĐTĐK  \nNgày Giao Dịch đầu tiên của Chương Trình ĐTĐK do Nhà Đầu tư chọn. Thời điểm cuối cùng để Nhà Đầu Tư đăng ký Chương Trình ĐTĐK là Thời điểm Đóng Số Lệnh của Ngày Giao Dịch đầu tiên mà Nhà Đầu tư lựa chọn.', 'Ngày Giao Dịch các kỳ tiếp theo là ngày tròn kỳ kể từ Ngày Giao Dịch đầu tiên. Trường hợp ngày tròn kỳ của các kỳ tiếp theo rơi vào ngày nghỉ (bao gồm cả ngày nghỉ bù), thì ngày Giao Dịch các kỳ tiếp theo sẽ là ngày làm việc ngay sau ngày tròn kỳ. Lệnh cho các Ngày Giao Dịch này sẽ được tạo ra vào ngày làm việc trước Ngày Giao Dịch tương ứng.  \nNhà Đầu Tư cần thanh toán cho khoản đầu tư của Chương Trình ĐTĐK để Ngân Hàng Giám Sát nhận được tiền mua trước Thời điểm Đóng Số Lệnh của Ngày Giao Dịch của các kỳ đầu tư tương ứng.  \nTrường hợp Nhà Đầu Tư không nộp đủ tiền mua vào tài khoản của quỹ trước Thời điểm Đóng Số Lệnh của một Ngày Giao Dịch trong Chương Trình ĐTĐK, lệnh mua chứng chỉ quỹ của kỳ đầu tư đó sẽ không được thực hiện. Số tiền không hợp lệ này sẽ được xử lý như sau:', '# i. Chương trình Đầu tư Định kỳ\nNgày Giao Dịch các kỳ tiếp theo là ngày tròn kỳ kể từ Ngày Giao Dịch đầu tiên. Trường hợp ngày tròn kỳ của các kỳ tiếp theo rơi vào ngày nghỉ (bao gồm cả ngày nghỉ bù), thì ngày Giao Dịch các kỳ tiếp theo sẽ là ngày làm việc ngay sau ngày tròn kỳ. Lệnh cho các Ngày Giao Dịch này sẽ được tạo ra vào ngày làm việc trước Ngày Giao Dịch tương ứng.  \nNhà Đầu Tư cần thanh toán cho khoản đầu tư của Chương Trình ĐTĐK để Ngân Hàng Giám Sát nhận được tiền mua trước Thời điểm Đóng Số Lệnh của Ngày Giao Dịch của các kỳ đầu tư tương ứng.  \nTrường hợp Nhà Đầu Tư không nộp đủ tiền mua vào tài khoản của quỹ trước Thời điểm Đóng Số Lệnh của một Ngày Giao Dịch trong Chương Trình ĐTĐK, lệnh mua chứng chỉ quỹ của kỳ đầu tư đó sẽ không được thực hiện. Số tiền không hợp lệ này sẽ được xử lý như sau:', 'lại cho Nhà đầu tư hoặc bên chuyển tiền không hợp lệ trong vòng 05 (năm) ngày làm việc kể từ kỳ giao dịch chứng chỉ quỹ áp dụng.  \nChương trình ĐTĐK sẽ dùng khi Nhà Đầu Tư quyết định dừng bằng cách thông báo dừng thực hiện ĐTĐK với Đại Lý Phân Phối hoặc do Nhà Đầu Tư không nộp tiền/không nộp đủ tiền mua chứng chỉ quỹ cho Chương Trình ĐTĐK trong 05 kỳ liên tiếp.  \n- Phí/giá dịch vụ áp dụng cho Chương Trình ĐTĐK  \nPhí/giá dịch vụ áp dụng cho chương trình ĐTĐK được quy định chi tiết tại mục 2.5.3 của Bản Cáo Bạch này.  \n- Bản chứng chỉ quỹ mua theo Chương Trình ĐTĐK  \nNhà Đầu Tư bán chứng chỉ quỹ mua theo Chương Trình ĐTĐK theo nguyên tắc quy định tại mục 2.5.3 của Bản Cáo Bạch này.', 'Ngay sau khi các sự kiện này chấm dứt, các giao dịch Đơn Vị Quỹ sẽ được thực hiện trở lại vào Ngày Giao Dịch tiếp theo. Theo luật, thời gian tạm dừng thực hiện các Lệnh Mua và Bán Đơn Vị Quỹ sẽ không quá 90 (chín mươi) ngày kể từ Ngày Giao Dịch gần nhất. Trong trường hợp giao dịch không thể tiếp tục trong khoảng thời gian tạm dừng tối đa nêu trên, thì trong vòng 30 (ba mươi) ngày kể từ ngày kết thúc thời hạn tạm dừng trên, Công Ty Quản Lý Quỹ phải tổ chức họp để lấy ý kiến Đại Hội Nhà Đầu Tư về việc giải thể Quỹ, hoặc tách Quỹ, hoặc tiếp tục kéo dài thời gian tạm dừng giao dịch Chứng chỉ Quỹ. Trong thời hạn triệu tập Đại Hội Nhà Đầu Tư, nếu các nguyên nhân dẫn tới việc tạm dừng giao dịch Chứng Chỉ Quỹ chấm dứt, Công ty Quản Lý Quỹ được hủy bỏ việc triệu tập Đại Hội Nhà Đầu Tư.  \n56', 'Việc thực hiện các giao dịch Đơn Vị Quỹ có thể bị tạm dừng do một trong các sự kiện sau:  \n- Các điều kiện bất khả kháng;\n- Không thể xác định được NAV của Quỹ tại Ngày Giao Dịch do các Sở giao dịch chứng khoán quyết định đình chỉ giao dịch chứng khoán trong danh mục đầu tư của Quỹ hoặc do các sở giao dịch chứng khoán tạm dừng giao dịch; hoặc\n- Các trường hợp khác theo quy định của Ủy Ban Chứng Khoán Nhà Nước.', 'Lệnh Mua thành công của Nhà Đầu Tư hay Đại Lý Kỷ Danh sẽ được thông báo trong vòng 03 (ba) ngày làm việc sau Ngày Giao Dịch, số lượng Đơn Vị Quỹ sẽ được làm tròn xuống đến hai số thập phân sau dấu phẩy. Số Đơn Vị Quỹ lẻ sẽ không ảnh hưởng đến khả năng bán lại Đơn Vị Quỹ của Nhà Đầu Tư.  \n- **Tạm Dừng Thực Hiện Lệnh Mua**  \nNhà Đầu Tư cần lưu ý rằng trong một số trường hợp các Lệnh Mua của Nhà Đầu Tư cùng với tất cả các Lệnh Mua khác có thể bị tạm dừng thực hiện. Các trường hợp này được liệt kê trong mục 2.4.8.  \nTrong trường hợp các giao dịch Đơn Vị Quỹ bị tạm dừng, Lệnh Mua sẽ được thực hiện vào Ngày Giao Dịch đầu tiên sau khi giao dịch được thực hiện trở lại.  \n- **Lệnh Mua Tối Thiểu**  \nMức đầu tư tối thiểu (tính theo giá trị Lệnh Mua) là 10.000 VNĐ (Mười nghìn đồng)', '## e) Tạm Dừng Thực Hiện Lệnh Mua\nNhà Đầu Tư cần lưu ý rằng trong một số trường hợp các Lệnh Mua của Nhà Đầu Tư cùng với tất cả các Lệnh Mua khác có thể bị tạm dừng thực hiện. Các trường hợp này được liệt kê trong mục 2.4.8 dưới đây.  \nTrong trường hợp các giao dịch Đơn Vị Quỹ bị tạm dừng, Lệnh Mua sẽ được thực hiện vào Ngày Giao Dịch đầu tiên sau khi giao dịch được thực hiện trở lại.', 'a) Kỳ đầu tư của Chương Trình ĐTĐK  \nĐịnh kỳ đầu tư của Chương Trình ĐTĐK là hàng tháng hoặc hàng quý hoặc hàng năm. Đại Lý Phân Phối có thể hỗ trợ các nhà đầu tư trong việc đưa ra một Chương Trình ĐTĐK và tần suất thanh toán phù hợp.  \nb) Khoản Tiền Đầu Tư Cho Chương Trình ĐTĐK  \nKhoản tiền đầu tư cho Chương Trình ĐTĐK là số tiền Nhà Đầu Tư đăng ký mua chứng chỉ quỹ hàng kỳ, tuy nhiên không thấp hơn mức đầu tư tối thiểu.  \nMức đầu tư tối thiểu định kỳ cho chương trình ĐTĐK là 10.000 VNĐ (Mười nghìn đồng).', '## d) Xác Nhận Lệnh Chuyển Nhượng\nNgay sau khi các sự kiện này chấm dứt, các giao dịch Đơn Vị Quỹ sẽ được thực hiện trở lại vào Ngày Giao Dịch tiếp theo. Theo luật, thời gian tạm dừng thực hiện các Lệnh Mua và Bán Đơn Vị Quỹ sẽ không quá 90 (chín mươi) ngày kể từ Ngày Giao Dịch gần nhất. Trong trường hợp giao dịch không thể tiếp tục trong khoảng thời gian tạm dừng tối đa nêu trên, thì trong vòng 30 (ba mươi) ngày kể từ ngày kết thúc thời hạn tạm dừng trên, Công Ty Quản Lý Quỹ phải tổ chức họp để lấy ý kiến Đại Hội Nhà Đầu Tư về việc giải thể Quỹ, hoặc tách Quỹ, hoặc tiếp tục kéo dài thời gian tạm dừng giao dịch Chứng chỉ Quỹ. Trong thời hạn triệu tập Đại Hội Nhà Đầu Tư, nếu các nguyên nhân dẫn tới việc tạm dừng giao dịch Chứng Chỉ Quỹ chấm dứt, Công ty Quản Lý Quỹ được hủy bỏ việc triệu tập Đại Hội Nhà Đầu Tư.', '# i. Chương trình Đầu tư Định kỳ\n- Trong trường hợp Nhà Đầu Tư muốn sử dụng tiền không hợp lệ ở trên để mua chứng chỉ quỹ tại các kỳ giao dịch bình thường không phải là kỳ giao dịch theo Chương trình ĐTĐK thì Nhà Đầu Tư sẽ phải thực hiện quy trình theo Mục 2.4.4. Quy trình mua chứng chỉ quỹ.  \n- Trong trường hợp Nhà Đầu Tư muốn giữ lại và tiếp tục để chờ cho kỳ giao dịch theo Chương trình ĐKĐT tiếp theo thì Nhà Đầu Tư cần phải đảm bảo nộp bổ sung phần còn thiếu trước thời điểm đóng số lệnh của ngày giao dịch theo Chương trình ĐKĐT.  \n- Trong trường hợp nhận được yêu cầu chuyển trả cụ thể từ Nhà Đầu tư hoặc không nhận được yêu cầu chuyển trả từ Nhà Đầu Tư, số tiền không hợp lệ ở trên sẽ được chuyển trả', '# 5. Kế hoạch phân chia lợi nhuận\n- Các khoản đầu tư dưới hình thức DRIP sẽ không phải trả Giá dịch vụ Phát hành.\n- Không phải trả Giá dịch vụ Mua lại hoặc Giá dịch vụ Chuyển Đổi đối với khoản đầu tư từ DRIP.  \nNhà Đầu Tư cần phải nêu rõ lựa chọn của mình trong hai lựa chọn trên, DPP hoặc DRIP, được ghi trong Đơn Đăng Ký. Nếu Nhà Đầu Tư không có sự lựa chọn, lựa chọn DRIP được tự động áp dụng.  \nĐại Hội Nhà Đầu Tư có thể phê duyệt cổ tức tại bất kỳ thời điểm nào và bất kỳ tần suất thanh toán nào (hàng quý, nửa năm, hàng năm) khi phù hợp. Tuy nhiên, sẽ không có sự đảm bảo nào về giá trị, tần suất, cũng như sự đều đặn của việc phân phối cổ tức. Việc phân phối cổ tức sẽ tùy thuộc vào lợi nhuận có thể phân phối và sự chấp thuận của Đại Hội Nhà Đầu Tư hoặc Ban Đại diện Quỹ (nếu được ủy quyền).', '- Các khoản đầu tư dưới hình thức DRIP sẽ không phải trả Giá dịch vụ Phát hành.\n- Không phải trả Giá dịch vụ Mua lại hoặc Giá dịch vụ Chuyển Đổi đối với khoản đầu tư từ DRIP.  \nNhà Đầu Tư cần phải nêu rõ lựa chọn của mình trong hai lựa chọn trên, DPP hoặc DRIP, được ghi trong Đơn Đăng Ký. Nếu Nhà Đầu Tư không có sự lựa chọn, lựa chọn DRIP được tự động áp dụng.  \nĐại Hội Nhà Đầu Tư có thể phê duyệt cổ tức tại bất kỳ thời điểm nào và bất kỳ tần suất thanh toán nào (hàng quý, nửa năm, hàng năm) khi phù hợp. Tuy nhiên, sẽ không có sự đảm bảo nào về giá trị, tần suất, cũng như sự đều đặn của việc phân phối cổ tức. Việc phân phối cổ tức sẽ tùy thuộc vào lợi nhuận có thể phân phối và sự chấp thuận của Đại Hội Nhà Đầu Tư hoặc Ban Đại diện Quỹ (nếu được ủy quyền).', '# i. Chương trình Đầu tư Định kỳ\n- **Khoản Tiền Đầu Tư Cho Chương Trình ĐTĐK**  \nKhoản tiền đầu tư cho Chương Trình ĐTĐK là số tiền Nhà Đầu Tư đăng ký mua chứng chỉ quỹ hàng kỳ, tuy nhiên không thấp hơn mức đầu tư tối thiểu.  \nMức đầu tư tối thiểu định kỳ cho chương trình ĐTĐK là 10.000 VNĐ (mười nghìn đồng).  \nNhà Đầu Tư có thể thay đổi kỳ đầu tư bất cứ lúc nào bằng cách thay đổi lệnh thực hiện ĐTĐK với Đại Lý Phân Phối và các lệnh thanh toán với ngân hàng của mình.  \n- **Ngày giao dịch và thanh toán cho các khoản đầu tư ĐTĐK**  \nNgày Giao Dịch đầu tiên của Chương Trình ĐTĐK do Nhà Đầu lựa chọn. Thời điểm cuối cùng để Nhà Đầu Tư đăng ký Chương Trình ĐTĐK là Thời điểm Đóng Số Lệnh của Ngày Giao Dịch đầu tiên mà Nhà Đầu tư lựa chọn.', '- Trong trường hợp Nhà Đầu Tư muốn sử dụng tiền không hợp lệ ở trên để mua chứng chỉ quỹ tại các kỳ giao dịch bình thường không phải là kỳ giao dịch theo Chương trình ĐTĐK thì Nhà Đầu Tư sẽ phải thực hiện quy trình theo Mục 2.4.4 Quy trình mua chứng chỉ quỹ.\n- Trong trường hợp Nhà Đầu Tư muốn giữ lại và tiếp tục để chờ cho kỳ giao dịch theo Chương trình ĐKĐT tiếp theo thì Nhà Đầu Tư cần phải đảm bảo nộp bổ sung phần còn thiếu trước thời điểm đóng số lệnh của ngày giao dịch theo Chương trình ĐKĐT.', '## d) Xác Nhận Lệnh Chuyển Nhượng\n#### a) Hủy lệnh giao dịch Đơn Vị Quỹ  \nNhà Đầu Tư có thể hủy các lệnh giao dịch bằng cách điền và nộp Phiếu Hủy Lệnh cho các Điểm Nhận Lệnh của Đại Lý Phân Phối của họ trước Thời Điểm Đóng Số Lệnh áp dụng cho các giao dịch đó.  \n#### b) Tạm dừng thực hiện các lệnh giao dịch Đơn Vị Quỹ  \nNhà Đầu Tư cần lưu ý là việc thực hiện các lệnh giao dịch - Mua, Bán, Chuyển Đổi, Chuyển Nhượng Đơn Vị Quỹ có thể sẽ bị tạm dừng một hoặc nhiều Ngày Giao Dịch vì tình hình vượt ngoài tầm kiểm soát của Công Ty Quản Lý Quỹ. Tất cả Điểm Nhận Lệnh sẽ được thông báo trong các trường hợp giao dịch bị tạm dừng.  \nViệc thực hiện các giao dịch Đơn Vị Quỹ có thể bị tạm dừng do một trong các sự kiện sau:  \n- Các điều kiện bất khả kháng;', '- Thực hiện các lệnh giao dịch của Nhà Đầu Tư;  \n- Các hoạt động sáp nhập, hợp nhất của các tổ chức phát hành các chứng khoán mà Quỹ đang nắm giữ;  \n- Quỹ mới được cấp phép thành lập hoặc do tách Quỹ, hợp nhất Quỹ, sát nhập Quỹ mà thời gian hoạt động không quá sáu (06) tháng, tính từ ngày được cấp giấy chứng nhận đăng ký lập Quỹ;  \n- Quỹ đang trong thời gian giải thể.  \nTrong trường hợp xảy ra sai lệch so với các hạn mức đầu tư, Công ty Quản Lý Quỹ sẽ điều chỉnh danh mục đầu tư để đáp ứng các hạn mức đầu tư kể trên trong vòng 3 (ba) tháng kể từ ngày mà sai lệch phát sinh.', '## 2.4.6. Quy trình chuyển đổi quỹ\nTrong một vài trường hợp Lệnh Chuyển Đổi cùng các lệnh khác có thể bị tạm dừng thực hiện. Các trường hợp được này được nêu tại mục 2.4.8.  \nTrong các trường hợp tạm dừng thực hiện các giao dịch Đơn Vị Quỹ, Lệnh Chuyển Đổi đã nhận sẽ được thực hiện tại NAV tại Ngày Giao Dịch đầu tiên sau khi giao dịch được thực hiện trở lại.', '## f) Tạm dừng thực hiện Lệnh Bán\nNhà Đầu Tư cần lưu ý rằng trong một số trường hợp, các Lệnh Bán cùng với tất cả các lệnh khác có thể bị tạm dừng thực hiện. Các trường hợp này được quy định chi tiết tại mục 2.4.8.  \nTrong trường hợp các lệnh giao dịch Đơn Vị Quỹ bị tạm dừng thực hiện, Lệnh Bán đã nhận sẽ được thực hiện tại NAV tại Ngày Giao Dịch đầu tiên sau khi giao dịch được thực hiện trở lại.  \n29', '## e) Thực Hiện Một Phần Lệnh Bán\nSố lượng Chứng Chỉ Quỹ Nhà Đầu Tư được thực hiện trong trường hợp thực hiện một phần Lệnh Bán cũng áp dụng nguyên tắc của Lệnh Bán tối thiểu nêu trên. Phần lệnh chưa được thực hiện và các lệnh đến sau thời điểm đóng số lệnh sẽ tự động bị hủy. Nhà Đầu Tư có thể thực hiện tiếp các lệnh bán của mình bằng cách đăng ký giao dịch tại ngày giao dịch tiếp theo.', 'Trong các trường hợp tạm dừng thực hiện các giao dịch Đơn Vị Quỹ, Lệnh Chuyển Đổi đã nhận sẽ được thực hiện tại NAV tại Ngày Giao Dịch đầu tiên sau khi giao dịch được thực hiện trở lại.  \n**g. Quy trình chuyển nhượng chứng chỉ quỹ**  \n- **Đơn Chuyển Nhượng**  \nNhà Đầu Tư có thể Chuyển Nhượng Đơn Vị Quỹ cho nhà đầu tư khác dưới dạng quà tặng, thừa kế hoặc thực hiện lệnh của toà án. Chuyển Nhượng chỉ được thực hiện dưới dạng số lượng Đơn  \n55', '- **Xác Nhận Lệnh Chuyển Nhượng**  \nCác Lệnh Chuyển Nhượng được thực hiện bởi Đại Lý Chuyển Nhượng tại Ngày Giao Dịch.  \n**h. Các trường hợp hủy, tạm dừng lệnh giao dịch**  \n- **Hủy lệnh giao dịch Đơn Vị Quỹ**  \nNhà Đầu Tư có thể hủy các lệnh giao dịch bằng cách điền và nộp Phiếu Hủy Lệnh cho các Điểm Nhận Lệnh của Đại Lý Phân Phối của họ trước Thời Điểm Đóng Số Lệnh áp dụng cho các giao dịch đó.  \n- **Tạm dừng thực hiện các lệnh giao dịch Đơn Vị Quỹ**  \nNhà Đầu Tư cần lưu ý là việc thực hiện các lệnh giao dịch - Mua, Bán, Chuyển Đổi, Chuyển Nhượng Đơn Vị Quỹ có thể sẽ bị tạm dừng một hoặc nhiều Ngày Giao Dịch vì tình hình vượt ngoài tầm kiểm soát của Công Ty Quản Lý Quỹ. Tất cả Điểm Nhận Lệnh sẽ được thông báo trong các trường hợp giao dịch bị tạm dừng.']",Khi Nhà Đầu Tư thông báo dừng hoặc không nộp tiền/không nộp đủ tiền mua trong 05 kỳ liên tiếp.
Rủi ro tái đầu tư (Reinvestment risk) được mô tả như thế nào trong Bản cáo bạch?,"Tôi không tìm thấy thông tin về rủi ro tái đầu tư (reinvestment risk) cụ thể trong bản cáo bạch đã được cung cấp. Tuy nhiên, dựa trên nội dung có sẵn, có một số rủi ro liên quan đến việc tái đầu tư mà bạn có thể tham khảo:

- Rủi ro về biến động giá: ""Rủi ro về biến động giá của Quỹ phát sinh khi một hay một số Nhà Đầu Tư đang nắm giữ một số lượng lớn Đơn Vị Quỹ quyết định thực hiện Lệnh Bản các Đơn Vị Quỹ này cùng lúc. Điều này có thể ảnh hưởng bất lợi tới giá của Đơn Vị Quỹ nếu các Lệnh Bản này đòi hỏi Công Ty Quản Lý Quỹ phải thoái vốn các khoản đầu tư tại mức giá thấp."" (Nguồn: Trang 44)

- Rủi ro hệ thống: ""Rủi ro hệ thống như trục trặc trong hệ thống máy tính hoặc thông tin. Có rất ít biện pháp để giảm thiểu rủi ro bất khả kháng có mức độ ảnh hưởng lớn do bản chất của những hiện tượng này."" (Nguồn: Trang 45)

Nếu bạn cần thông tin cụ thể về rủi ro tái đầu tư, tôi khuyên bạn nên kiểm tra thêm phần ""Rủi ro đầu tư"" hoặc các phần liên quan khác trong bản cáo bạch.","['## 3.7. Rủi ro tái đầu tư\nRủi ro tái đầu tư là rủi ro đặc thù của các khoản đầu tư trái phiếu với dòng tiền từ lãi trái phiếu nhận được hàng kỳ và gốc trái phiếu nhận được vào thời điểm đáo hạn được đem đi tái đầu tư nhằm thu lợi nhuận (lãi-trên-lãi). Rủi ro tái đầu tư phát sinh khi mặt bằng lãi suất tại thời điểm tái đầu tư thấp hơn so với lãi suất kỳ vọng trước đó. Ngoài ra, một số chứng khoán có thu nhập cố định được phát hành kèm theo quyền cho phép người phát hành mua lại chứng khoán đó trước hạn, thường là khi lãi suất thị trường có xu hướng giảm. Điều này khiến Quỹ có thể phải đối mặt với rủi ro tái đầu tư phần tiền thu hồi tại mức sinh lợi thấp hơn, do đó làm giảm thu nhập từ lãi của Quỹ', '## 3.5. Rủi ro thanh khoản\nRủi ro thanh khoản là rủi ro mà nhà đầu tư không bán lại được chứng chỉ quỹ vào ngày giao dịch chứng chỉ quỹ do các chứng khoán trong danh mục của quỹ không thanh khoản được, hoặc do việc nhà đầu tư bán chứng chỉ quỹ thuộc các trường hợp thực hiện một phần lệnh bán hoặc tạm dừng lệnh bán theo quy định của Điều Lệ Quỹ.  \nĐối với các chứng khoán trong danh mục của Quỹ, rủi ro thanh khoản sẽ được theo dõi trên cơ sở số ngày cần thiết để bán mỗi chứng khoán trong danh mục dựa trên dữ liệu giao dịch bình quân của chứng khoán đó trong năm liền trước. Các phương pháp cần thiết khác sẽ được tiến hành để giữ thời gian thoái vốn bình quân nằm trong các khoảng thời gian mục tiêu theo nguyên tắc cần trong giới hạn trong quy định nội bộ.', '## 3.7. Rủi ro tái đầu tư\n. Rủi ro tái đầu tư của danh mục đầu tư trái phiếu được quản trị thông qua việc theo dõi kỳ vọng lãi suất thể hiện trên đường cong lợi suất và kỳ hạn của danh mục đầu tư trái phiếu.', '## 3.1. Rủi ro tín dụng\nRủi ro tín dụng hay rủi ro mất khả năng thanh toán là rủi ro mà tổ chức phát hành không thể đáp ứng các nghĩa vụ của mình đối với phần vốn gốc và lãi khi đến hạn thanh toán. Rủi ro này chủ yếu liên quan đến các chứng khoán có thu nhập cố định như: trái phiếu Chính phủ, trái phiếu được Chính phủ bảo lãnh, và hoặc trái phiếu doanh nghiệp. Công Ty Quản Lý Quỹ sẽ xem xét cẩn trọng và thường xuyên đánh giá chất lượng tín dụng trong quá trình lựa chọn đầu tư vào trái phiếu và các chứng khoán có thu nhập cố định khác.', 'Giống như các hình thức đầu tư khác, Quỹ mở có những rủi ro như Nhà Đầu Tư có thể bị lỗ một phần hoặc toàn bộ vốn đầu tư ban đầu, rủi ro không có lợi nhuận hoặc lợi nhuận đạt được thấp hơn dự kiến hoặc thấp hơn so với lợi nhuận của các hình thức đầu tư khác được đầu tư cùng thời điểm và có cùng thời gian nắm giữ. Nhà Đầu Tư cần nhận thức được những rủi ro này tại thời điểm thực hiện đầu tư cũng như hiểu được khả năng chấp nhận của họ đối với rủi ro mất vốn đầu tư ban đầu hoặc lợi nhuận thấp hơn kỳ vọng. Rủi ro trong đầu tư chứng khoán thông thường được phân thành những loại rủi ro sau đây:', '## 3.8. Rủi ro pháp lý\nĐây là rủi ro có thể phát sinh khi Luật hoặc các quy định pháp lý thay đổi hoặc sự diễn giải và thi hành Luật và các quy định pháp lý này thay đổi khiến cho Quỹ hoặc giá trị tài sản của Quỹ bị ảnh hưởng. Những thay đổi về Luật hay các quy định pháp lý thường được thông báo trước khi có hiệu lực. Mức độ ảnh hưởng của những thay đổi này đối với Quỹ và các công ty trong danh mục sẽ được đánh giá, và nếu cần thiết và khả thi, Quỹ sẽ thay đổi cơ cấu danh mục đầu tư hoặc đối tượng các công ty được đầu tư.', '2.11. Tiêu chí lựa chọn, quyền hạn và trách nhiệm của Ngân hàng giám sát ... 41\n2.12. Kiểm toán, kế toán và chế độ báo cáo ... 42\n3. Các rủi ro khi đầu tư vào Quỹ ... 42\n3.1. Rủi ro tín dụng ... 43\n3.2. Rủi ro lãi suất ... 43\n3.3. Rủi ro lạm phát ... 43\n3.4. Rủi ro tỷ giá ... 43\n3.5. Rủi ro thanh khoản ... 44\n3.6. Rủi ro về biến động giá ... 44\n3.7. Rủi ro tài đầu tư ... 44\n3.8. Rủi ro pháp lý ... 44\n3.9. Rủi ro bất khả kháng ... 44', '## 3. Các rủi ro khi đầu tư vào Quỹ\nMục tiêu của Công Ty Quản Lý Quỹ là quản lý các rủi ro đầu tư, và nếu có thể, hạn chế tác động của các rủi ro này bằng việc áp dụng các phương pháp quản lý đầu tư theo tiêu chuẩn quốc tế tốt nhất. Nhà Đầu Tư cần lưu ý các điểm quan trọng sau đây:  \n- Quỹ, Công Ty Quản Lý Quỹ, thành viên Hội đồng thành viên, ban điều hành và nhân viên Công Ty Quản Lý Quỹ không có bất kỳ sự đảm bảo nào đối với vốn đầu tư ban đầu cũng như mức lợi nhuận từ đầu tư của Quỹ;\n- Không có bất kỳ sự bảo đảm nào về sổ lần chi trả và giá trị của cổ tức được thanh toán trong tương lai;  \n42', '## 3.4. Rủi ro tỷ giá\nDo tài sản và nợ phải trả của Quỹ đều được trình bày bằng đồng Việt Nam, là đơn vị tiền tệ sử dụng của Quỹ. Vì vậy, mặc dù rủi ro tỷ giá trong trung hạn tại Việt Nam trong thời điểm hiện nay được chúng tôi đánh giá là tương đối thấp do tình hình kinh tế vĩ mô được giữ ổn định, cán cân thương mại thặng dư và Chính phủ thể hiện quyết tâm duy trì sự ổn định của đồng Việt Nam, các Nhà Đầu Tư nước ngoài thực tế sẽ phải chịu rủi ro tỷ giá trong thời gian đầu tư tại Việt Nam.  \n43', '## 3.9. Rủi ro bất khả kháng\nĐây là rủi ro khi những sự kiện bất thường phát sinh có ảnh hưởng lớn và đột ngột lên giá trị của tất cả hoặc một số tài sản của Quỹ. Những sự kiện này - dù là có thật hay tin đồn, có thể bao gồm:  \n- Thảm họa thiên nhiên như động đất, lũ lụt, hỏa hoạn, thảm họa hạt nhân;', '## 3. Giá dịch vụ và thưởng hoạt động\nNhà Đầu Tư được khuyến khích nắm giữ các Đơn Vị Quỹ như một phần của các khoản đầu tư dài hạn và chương trình tiết kiệm hưu trí. Quỹ mở không được thiết kế cho mục đích mua bán ngắn hạn. Việc Nhà Đầu Tư thường xuyên mua đi và bán lại Đơn Vị Quỹ, vốn được thiết kế để đạt được lợi nhuận dài hạn sẽ ảnh hưởng đến mục tiêu lợi nhuận của Nhà Đầu Tư khi đầu tư vào Quỹ cũng như lợi nhuận của Quỹ.  \nGiá dịch vụ Mua lại và các khoản giá dịch vụ ngân hàng và thuế khác (nếu có) sẽ được trừ vào khoản tiền thu được từ bán Đơn Vị Quỹ của Nhà Đầu Tư.', '## Lĩnh vực được phép đầu tư\nđ) Cổ phiếu chào bán lần đầu ra công chúng, trái phiếu chào bán ra công chúng; trái phiếu doanh nghiệp phát hành riêng lẻ bởi tổ chức niêm yết có bảo lãnh thanh toán của tổ chức tín dụng hoặc cam kết mua lại của tổ chức phát hành tối thiểu 1 lần trong 12 tháng và mỗi lần cam kết mua lại tối thiểu 30% giá trị đợt phát hành;  \ne) Chứng khoán phải sinh niêm yết giao dịch tại Sở giao dịch chứng khoán và chỉ nhằm mục tiêu phòng ngừa rủi ro cho chứng khoán cơ sở mà quỹ đang nắm giữ;  \ng) Quyền phát sinh gắn liền với chứng khoán mà quỹ đang nắm giữ.  \nViệc đầu tư vào các tài sản quy định tại điểm đ khoản 2.2.3 Điều này phải đáp ứng các điều kiện sau:  \n- Có quy định tại Điều lệ quỹ và Bản cáo bạch;', '## THÔNG BÁO QUAN TRỌNG\nCác nhà đầu tư nên nghiên cứu Bản Cáo Bạch này một cách cẩn trọng và toàn diện và không nên coi nội dung hoặc các tóm tắt ở đây là các tư vấn liên quan đến pháp lý, thuế, hoặc tài chính/đầu tư và nên tham khảo ý kiến chuyên gia tư vấn của mình về các yêu cầu pháp lý hoặc các điều kiện hoặc bất kỳ các hạn chế nào khác liên quan đến việc đăng ký mua, mua, cho tặng, nắm giữ, định đoạt (chuyển nhượng; chuyển đổi quỹ hoặc bản hoặc chuyển đổi thành tiền) các Đơn Vị Quỹ, việc xử lý khoản thu nhập (nếu có), lợi nhuận đầu tư, hoặc các khoản phân phối lợi nhuận, các khoản thuế khác liên quan đến việc đăng ký mua, mua, cho tặng, nắm giữ, định đoạt (bản, chuyển giao, chuyển đổi quỹ hoặc bản hoặc chuyển đổi thành tiền) các Đơn Vị Quỹ trong phạm vi lãnh thổ tài phán áp dụng đối với quốc tịch, nơi cư trú', '# 5. Kế hoạch phân chia lợi nhuận\nNhà Đầu Tư nhận cổ tức bằng tiền có thể dùng để tái đầu tư:  \n- Lựa chọn Nhận Cổ Tức Bằng Tiền (“DPP”): Nhà Đầu Tư muốn nhận cổ tức bằng tiền cần phải nêu rõ lựa chọn của mình trong Đơn Đăng Ký mở tài khoản giao dịch.\n- Lựa chọn Tái Đầu tư Cổ tức (“DRIP”): Nhà Đầu Tư muốn dùng cổ tức để tái đầu tư sẽ nhận được thêm các Đơn Vị Quỹ. Cổ tức được trả cho Nhà Đầu Tư sẽ được tự động tái đầu tư tại NAV của Quỹ trong Ngày Giao Dịch liền sau ngày trả cổ tức. Số lượng các Đơn Vị Quỹ của Nhà Đầu Tư do đó sẽ tăng bằng với số cổ tức phải trả chia cho NAV vào Ngày Giao Dịch đó. Cổ tức được dùng để tái đầu tư giống như việc Nhà Đầu Tư nhận được cổ tức bằng tiền mặt và dùng số tiền đã nhận được để tái đầu tư và đồng thời:\n- Các khoản đầu tư dưới hình thức DRIP sẽ không phải trả Giá dịch vụ Phát hành.', 'Nhà Đầu Tư nhận cổ tức bằng tiền có thể dùng để tái đầu tư:  \n- Lựa chọn Nhận Cổ Tức Bằng Tiền (“DPP”): Nhà Đầu Tư muốn nhận cổ tức bằng tiền cần phải nêu rõ lựa chọn của mình trong Đơn Đăng Ký mở tài khoản giao dịch.\n- Lựa chọn Tái Đầu tư Cổ tức (“DRIP”): Nhà Đầu Tư muốn dùng cổ tức để tái đầu tư sẽ nhận được thêm các Đơn Vị Quỹ. Cổ tức được trả cho Nhà Đầu Tư sẽ được tự động tái đầu tư tại NAV của Quỹ trong Ngày Giao Dịch liền sau ngày trả cổ tức. Số lượng các Đơn Vị Quỹ của Nhà Đầu Tư do đó sẽ tăng bằng với số cổ tức phải trả chia cho NAV vào Ngày Giao Dịch đó. Cổ tức được dùng để tái đầu tư giống như việc Nhà Đầu Tư nhận được cổ tức bằng tiền mặt và dùng số tiền đã nhận được để tái đầu tư và đồng thời:\n- Các khoản đầu tư dưới hình thức DRIP sẽ không phải trả Giá dịch vụ Phát hành.', '## 2.2.5 Điều chỉnh danh mục đầu tư\nCơ cấu đầu tư của quỹ mở chỉ được vượt mức so với các hạn chế đầu tư đã quy định tại điểm a, b, c, d, đ, e và i mục IX.2.2.4 và chỉ do các nguyên nhân sau:  \na) Biến động giá trên thị trường của tài sản trong danh mục đầu tư của quỹ;  \nb) Thực hiện các khoản thanh toán của quỹ theo quy định của pháp luật, bao gồm việc thực hiện lệnh giao dịch của nhà đầu tư;', 'Việc bảo vệ Nhà Đầu Tư nước ngoài tránh khỏi rủi ro này nằm ngoài khả năng của Quỹ và vì vậy, các Nhà Đầu Tư nước ngoài, nếu cần thiết, cần phải tìm kiếm các công cụ để tự phòng ngừa rủi ro này.', '## 3.6. Rủi ro về biến động giá\nRủi ro về biến động giá của Quỹ phát sinh khi một hay một số Nhà Đầu Tư đang nắm giữ một số lượng lớn Đơn Vị Quỹ quyết định thực hiện Lệnh Bản các Đơn Vị Quỹ này cùng lúc. Điều này có thể ảnh hưởng bất lợi tới giá của Đơn Vị Quỹ nếu các Lệnh Bản này đòi hỏi Công Ty Quản Lý Quỹ phải thoái vốn các khoản đầu tư tại mức giá thấp. Các quy định về thực hiện một phần lệnh bán và tạm dừng lệnh bán có thể giảm thiểu rủi ro biến động giá của Quỹ.', '- Khủng hoảng hệ thống ngân hàng, các nhà lãnh đạo chủ chốt mất khả năng điều hành;\n- Rủi ro hệ thống như trục trặc trong hệ thống máy tính hoặc thông tin.  \nCó rất ít biện pháp để giảm thiểu rủi ro bất khả kháng có mức độ ảnh hưởng lớn do bản chất của những hiện tượng này. Đa dạng hoá danh mục đầu tư vào các ngành, lĩnh vực khác nhau góp phần giảm thiểu rủi ro này. Ở cấp độ công ty trong danh mục, chính sách bảo hiểm và các kế hoạch khắc phục tổn thất do thảm họa có thể giúp giới hạn tác động của một số rủi ro bất khả kháng.', '## 2. Thông tin về đợt phát hành lần đầu ra công chúng\nNgoài ra, để đảm bảo tối ưu hóa lợi ích của nhà đầu tư, Quỹ có sự linh hoạt trong phân bổ tài sản tùy thuộc vào cơ hội đầu tư sẵn có tại các thời điểm khác nhau. Việc phân bổ tài sản có thể thay đổi đáng kể tùy thuộc vào nhận định của Quỹ, với mục tiêu xuyên suốt trong toàn bộ thời gian hoạt động của Quỹ là bảo vệ lợi ích của Nhà Đầu Tư.  \nVới chiến lược đầu tư như đã đề cập ở trên, cơ cấu danh mục đầu tư của Quỹ có thể thay đổi theo thời gian dựa theo tiềm năng tăng trưởng của cổ phiếu và tùy vào mức độ thanh khoản của các cổ phiếu trên thị trường. Tỷ trọng các khoản đầu tư không vượt quá những hạn chế đầu tư quy định tại mục “Hạn chế đầu tư”.  \nCác loại tài sản mà quỹ được đầu tư bao gồm:\ni. Tiền gửi tại các ngân hàng thương mại theo quy định của pháp luật về  |', '- Không đầu tư quá 30% tổng giá trị tài sản của quỹ vào các chứng chỉ quỹ đại chúng, cổ phiếu công ty đầu tư chứng khoán đại chúng;  \nxi. Quỹ chỉ được đầu tư tiền gửi, công cụ tiền tệ quy định tại điểm i và ii các loại tài sản Quỹ được phép đầu tư được phát hành bởi các tổ chức tín dụng trong danh sách đã được Ban Đại Diện Quỹ phê duyệt bằng văn bản hoặc thông qua bỏ phiếu điện tử (e-voting) tuân thủ theo các Quy định Pháp luật hiện hành.  \nCơ cấu đầu tư của Quỹ được phép sai lệch so với các hạn chế được đưa ra tại điểm i, ii, iii, iv, v, vi và ix nếu trên nhưng chỉ vì các lý do sau:  \n- Biến động giá trên thị trường của các tài sản trong danh mục đầu tư của Quỹ;  \n- Thực hiện các khoản thanh toán phù hợp với Pháp Luật của Quỹ;  \n- Thực hiện các lệnh giao dịch của Nhà Đầu Tư;', '## e) Thực Hiện Một Phần Lệnh Bán\nTrong các trường hợp sau, Quỹ chỉ có thể thực hiện một phần Lệnh Bán và Chuyến Đổi Quỹ của Nhà Đầu Tư:  \n- Tổng giá trị của các Lệnh Bán (bao gồm cả Lệnh Bán từ hoạt động Chuyến Đổi Quỹ) trừ đi tổng giá trị của tất cả các Lệnh Mua (bao gồm cả Lệnh Mua từ hoạt động Chuyến Đổi Quỹ) tại Ngày Giao Dịch lớn hơn 10% của giá trị tài sản ròng của Quỹ (NAV); hoặc\n- Việc thực hiện tất cả các lệnh giao dịch của Nhà Đầu Tư tại Ngày Giao Dịch dẫn đến NAV của Quỹ thấp hơn 50.000.000.000 đồng (năm mươi tỷ đồng); hoặc Giá trị phần đơn vị quỹ hoặc số đơn vị quỹ còn lại trên tài khoản của nhà đầu tư thấp hơn giá trị tối thiểu hoặc số lượng đơn vị quỹ tối thiểu để duy trì tài khoản của nhà đầu tư theo quy định tại Điều lệ quỹ và Bán cáo bạch.', 'Công Ty Quản Lý Quỹ có quyền thay đổi Giá dịch vụ Mua lại nhưng không được vượt quá mức quy định của pháp luật. Mức Giá dịch vụ Mua lại mới sẽ được Công Ty Quản Lý Quỹ thông báo chi tiết tại trang thông tin điện tử của Quỹ và tại các địa điểm phân phối của các Đại Lý Phân Phối.  \nGiá dịch vụ Mua lại sẽ được trừ vào khoản tiền bán được trả lại cho các Nhà Đầu Tư khi thực hiện các Lệnh Bản và được hạch toán cho Công Ty Quản Lý Quỹ và Đại Lý Phân Phối căn cứ theo hợp đồng ký giữa Công Ty Quản Lý Quỹ và Đại Lý Phân Phối.', '- Trong trường hợp nhận được yêu cầu chuyển trả cụ thể từ Nhà Đầu tư hoặc không nhận được yêu cầu chuyển trả từ Nhà Đầu Tư, số tiền không hợp lệ ở trên sẽ được chuyển trả lại cho Nhà đầu tư hoặc bên chuyển tiền không hợp lệ trong vòng 05 (năm) ngày làm việc kể từ kỳ giao dịch chứng chỉ quỹ áp dụng.  \nChương trình ĐTĐK sẽ dừng khi Nhà Đầu Tư quyết định dừng bằng cách thông báo dừng thực hiện ĐTĐK với Đại Lý Phân Phối hoặc do Nhà Đầu Tư không nộp tiền/không nộp đủ tiền mua chứng chỉ quỹ cho Chương Trình ĐTĐK trong 05 kỳ liên tiếp.  \n32', '- Kết quả hoạt động trong quá khứ của một Quỹ, của Công Ty Quản Lý Quỹ hoặc của các chủ sở hữu của Công Ty Quản Lý Quỹ không hàm ý hay đảm bảo kết quả hoạt động của Quỹ trong tương lai;\n- Tên của Quỹ không hàm ý về chất lượng hoạt động cũng như triển vọng và lợi nhuận của Quỹ trong tương lai;\n- Công Ty Quản Lý Quỹ không chịu trách nhiệm pháp lý về những rủi ro đầu tư của Quỹ và các chủ sở hữu, thành viên Hội đồng thành viên, ban điều hành và nhân viên của Công Ty Quản Lý Quỹ không có trách nhiệm pháp lý về các rủi ro hoạt động của Công Ty Quản Lý Quỹ trong quá trình quản lý Quỹ này.']","Là rủi ro khi lãi suất thị trường giảm, tiền lãi hoặc gốc nhận được phải tái đầu tư với mức sinh lợi thấp hơn."
Nhà đầu tư nước ngoài cần thực hiện giao dịch đầu tư qua loại tài khoản vốn nào?,"Nhà đầu tư nước ngoài cần thực hiện giao dịch đầu tư qua tài khoản phong tỏa tại Ngân Hàng Giám Sát. Theo thông tin từ nguồn:

- ""Nhà Đầu Tư thanh toán tiền mua Đơn Vị Quỹ vào một tài khoản phong tỏa của Quỹ mở tại Ngân Hàng Giám Sát."" (Nguồn: Trang 59)

Vì vậy, câu trả lời đầy đủ là nhà đầu tư nước ngoài cần thực hiện giao dịch đầu tư qua tài khoản phong tỏa tại Ngân Hàng Giám Sát.","['## c) Tuân Thủ\nNhà Đầu Tư cư trú ngoài lãnh thổ Việt Nam muốn mua Đơn Vị Quỹ phải đảm bảo tuân thủ các quy định và luật áp dụng tại nước sở tại của mình. Nhà Đầu Tư chịu trách nhiệm tuân thủ các quy định về thuế, ngoại hối hay các quy định khác áp dụng đối với giao dịch mua và bán. Theo quy định hiện tại của Việt Nam, Nhà Đầu Tư nước ngoài cần mở một tài khoản đầu tư bằng tiền Đồng Việt Nam tại một ngân hàng thương mại ở Việt Nam (Tài khoản vốn đầu tư gián tiếp (IICA)). Tất cả các giao dịch đầu tư, nhận cổ tức (bao gồm chuyển tiền đăng ký mua chứng chỉ quỹ và nhận tiền thanh toán bán/nhận cổ tức từ chứng chỉ quỹ), mua ngoại tệ để chuyển tiền đầu tư ra nước ngoài và các hoạt động liên quan khác đều phải được thực hiện qua tài khoản này', 'Nhà Đầu Tư cư trú ngoài lãnh thổ Việt Nam muốn mua Đơn Vị Quỹ phải đảm bảo tuân thủ các quy định và luật áp dụng tại nước sở tại của mình. Nhà Đầu Tư chịu trách nhiệm tuân thủ các quy định về thuế, ngoại hối hay các quy định khác áp dụng đối với giao dịch mua và bán. Theo quy định hiện tại của Việt Nam, Nhà Đầu Tư nước ngoài cần mở một tài khoản đầu tư bằng tiền Đồng Việt Nam tại một ngân hàng thương mại ở Việt Nam (Tài khoản vốn đầu tư gián tiếp (IICA)). Tất cả các giao dịch đầu tư, nhận cổ tức (bao gồm chuyển tiền đăng ký mua chứng chỉ quỹ và nhận tiền thanh toán bán/nhận cổ tức từ chứng chỉ quỹ), mua ngoại tệ để chuyển tiền đầu tư ra nước ngoài và các hoạt động liên quan khác đều phải được thực hiện qua tài khoản này', 'Quỹ thực hiện đầu tư gián tiếp ra nước ngoài theo quy định của pháp luật về đầu tư sau khi được Ủy ban Chứng khoán Nhà nước chấp thuận cho phép đầu tư gián tiếp ra nước ngoài và bảo đảm các nguyên tắc sau:  \n- Quỹ đã được Ngân hàng Nhà nước Việt Nam cấp hạn mức đầu tư gián tiếp ra nước ngoài;\n- Quỹ chỉ được đầu tư gián tiếp ra nước ngoài vào các tài sản đã được quy định tại Điều lệ quỹ và phù hợp với quy định của Ngân hàng Nhà nước Việt Nam;\n- Quỹ không được đầu tư quá 20% giá trị tài sản ròng của quỹ ra nước ngoài và không vượt quá hạn mức đầu tư đăng ký đã được Ngân hàng Nhà nước Việt Nam xác nhận.', 'Việc bảo vệ Nhà Đầu Tư nước ngoài tránh khỏi rủi ro này nằm ngoài khả năng của Quỹ và vì vậy, các Nhà Đầu Tư nước ngoài, nếu cần thiết, cần phải tìm kiếm các công cụ để tự phòng ngừa rủi ro này.', 'Nhà Đầu Tư có thể thanh toán số tiền mua Đơn Vị Quỹ từ tài khoản ngân hàng của mình vào tài khoản của Quỹ để Ngân Hàng Giám Sát nhận được đúng hạn và Đại Lý Phân Phối hoàn thành xử lý việc đăng ký với Đại Lý Chuyển Nhượng. Mọi khoản đầu tư vào Đơn Vị Quỹ đều thực hiện bằng tiền Đồng Việt Nam.  \nTrong trường hợp lệnh mua chứng chỉ quỹ và việc thanh toán cho lệnh mua được thực hiện bởi cá nhân, tổ chức khác không phải nhà đầu tư thì phiếu lệnh và tài liệu xác nhận thanh toán phải nêu rõ tên, số tài khoản và giá trị thanh toán của nhà đầu tư được hưởng lợi.', 'Nhà Đầu Tư có thể thanh toán số tiền mua Đơn Vị Quỹ bằng cách chuyển khoản từ tài khoản ngân hàng của mình hoặc nộp tiền trực tiếp vào tài khoản của Quỹ để Ngân Hàng Giám Sát nhận được đúng hạn và Đại Lý Phân Phối hoàn thành xử lý việc đăng ký với Đại Lý Chuyển Nhượng. Mọi khoản đầu tư vào Đơn Vị Quỹ đều thực hiện bằng tiền Đồng Việt Nam.  \nTrong trường hợp lệnh mua chứng chỉ quỹ và việc thanh toán cho lệnh mua được thực hiện bởi cá nhân, tổ chức khác không phải nhà đầu tư thì phiếu lệnh và tài liệu xác nhận thanh toán phải nêu rõ tên, số tài khoản và giá trị thanh toán của nhà đầu tư được hưởng lợi.  \n- **Tuân Thủ**', 'Nhà Đầu Tư có thể mở nhiều tài khoản tại các Đại lý phân phối khác nhau để cùng giao dịch một loại Chứng chỉ Quỹ. Nhà Đầu Tư cần nộp Hợp đồng và các giấy tờ quy định để mở tài khoản giao dịch tại mỗi Đại Lý Phân Phối mà Nhà Đầu Tư muốn thực hiện giao dịch. Các tài khoản tại các Đại Lý Phân Phối khác nhau của cùng một Nhà Đầu Tư được quản lý độc lập. Do đó, Lệnh Mua lần đầu tối thiểu cũng như số dư tài khoản tối thiểu được áp dụng cho từng Đại Lý Phân Phối. Nhà Đầu Tư chỉ có thể nộp các Phiếu Lệnh Bán, Chuyển Đổi, Chuyển Nhượng, Hủy Lệnh hay thay đổi thông tin tài khoản của tài khoản mở tại một Đại Lý Phân Phối ở bất kỳ Điểm Nhận Lệnh nào của Đại Lý Phân Phối đó.', '## 2.3. Đặc trưng của chứng chỉ Quỹ đầu tư\nNhà đầu tư của Quỹ là cá nhân, tổ chức trong và ngoài nước, sở hữu chứng chỉ quỹ. Nhà đầu tư không chịu trách nhiệm pháp lý hoặc nghĩa vụ khác ngoài trách nhiệm trong phạm vi số chứng chỉ Quỹ mà họ sở hữu. Nhà đầu tư là tổ chức bao gồm các tổ chức kinh tế và xã hội được pháp luật Việt Nam công nhận.  \nNhà đầu tư pháp nhân cử người đại diện hợp pháp đại diện cho số Chứng chỉ quỹ mà mình sở hữu. Việc đề cử, hủy bỏ hay thay thế người đại diện này phải được thông báo bằng văn bản, do người đại diện có thẩm quyền của nhà đầu tư tổ chức ký.', 'a) Hợp đồng mở tài khoản giao dịch chứng khoán và đăng ký giao dịch quỹ mở  \nNhà Đầu Tư mua Đơn Vị Quỹ lần đầu tiên cần điền đầy đủ vào Hợp đồng để mua Đơn Vị Quỹ. Hợp đồng được cung cấp tại bất kỳ Điểm Nhận Lệnh nào. Hợp đồng phải kèm theo các bản sao hợp lệ các giấy tờ quy định trong Hợp đồng (bao gồm Xác nhận đăng ký mở tài khoản góp vốn của ngân hàng thương mại đối với trường hợp Nhà Đầu Tư nước ngoài) đối với mỗi cá nhân/tổ chức hay các bên đồng sở hữu hay người được hưởng lợi hay người được ủy quyền.', '## 2.4 Cơ chế giao dịch chứng chỉ quỹ\nNhà Đầu Tư có thể liên tục giao dịch các Đơn Vị Quỹ kể từ Ngày Giao Dịch đầu tiên.', '## 3. Giao dịch chứng chỉ quỹ các lần tiếp theo\nNhà Đầu Tư có thể liên tục giao dịch các Đơn Vị Quỹ kể từ Ngày Giao Dịch đầu tiên.', '## 2.4.1. Ngày giao dịch\nNhà đầu tư có thể mua, bán, chuyển đổi Quỹ hoặc chuyển nhượng Đơn vị Quỹ vào một trong các Ngày Giao Dịch. Ngày Giao Dịch được xác định như sau:  \n- Các ngày làm việc trong tuần từ thứ Hai đến thứ Sáu (tần suất giao dịch hàng ngày).\n- Ngày Giao Dịch sẽ không bao gồm các ngày nghỉ lễ, kể cả nghỉ bù theo quy định của pháp luật.  \nViệc giảm tần suất giao dịch sẽ được Đại Hội Nhà Đầu Tư thông qua và luôn đảm bảo tần suất giao dịch không được ít hơn hai lần trong một tháng.', '## 3. Giá dịch vụ và thưởng hoạt động\nNhà Đầu Tư được khuyến khích nắm giữ các Đơn Vị Quỹ như một phần của các khoản đầu tư dài hạn và chương trình tiết kiệm hưu trí. Quỹ mở không được thiết kế cho mục đích mua bán ngắn hạn. Việc Nhà Đầu Tư thường xuyên mua đi và bán lại Đơn Vị Quỹ, vốn được thiết kế để đạt được lợi nhuận dài hạn sẽ ảnh hưởng đến mục tiêu lợi nhuận của Nhà Đầu Tư khi đầu tư vào Quỹ cũng như lợi nhuận của Quỹ.  \nGiá dịch vụ Mua lại và các khoản giá dịch vụ ngân hàng và thuế khác (nếu có) sẽ được trừ vào khoản tiền thu được từ bán Đơn Vị Quỹ của Nhà Đầu Tư.', '## 3. Giao dịch chứng chỉ quỹ các lần tiếp theo\n- Ngày giao dịch  \nNhà đầu tư có thể mua, bán, chuyển đổi Quỹ hoặc chuyển nhượng Đơn vị Quỹ vào một trong các Ngày Giao Dịch. Ngày Giao Dịch là các ngày từ Thứ 2 đến Thứ 6 hàng tuần.  \nNgày Giao Dịch sẽ không bao gồm các ngày nghỉ lễ, kể cả nghỉ bù theo quy định của pháp luật.  \nViệc giảm tần suất giao dịch sẽ được Đại Hội Nhà Đầu Tư thông qua và luôn đảm bảo tần suất giao dịch không được ít hơn hai lần trong một tháng.  \n- Giá bán/Giá dịch vụ phát hành và Giá dịch vụ mua lại  \n**Giá bán/Giá dịch vụ phát hành:** Là mức giá Nhà Đầu Tư phải thanh toán để mua một đơn vị quỹ.', 'Nhà Đầu Tư thanh toán tiền mua Đơn Vị Quỹ vào một tài khoản phong tỏa của Quỹ mở tại Ngân Hàng Giám Sát. Thông tin chi tiết của tài khoản này sẽ được cung cấp bởi các Đại Lý Phân Phối và được đề cập trong Đơn Đăng Ký. Ngân Hàng Giám Sát sẽ thanh toán lãi phát sinh (nếu có) trên các khoản tiền gửi trong tài khoản ký quỹ với mức lãi suất không thấp hơn lãi suất tiền gửi không kỳ hạn đang được áp dụng của Ngân Hàng Giám Sát trong suốt quá trình IPO. Nếu IPO thành công, số lãi này sẽ cấu thành một phần tài sản Quỹ.', '## 2.5.3. Thông tin về các mức giá dịch vụ\nCác loại phí/dịch vụ và chi phí/giá dịch vụ liên quan trực tiếp đến việc giao dịch Đơn Vị Quỹ sẽ do Nhà Đầu Tư trả và không được tính vào chi phí của Quỹ. Công Ty Quản Lý Quỹ bảo lưu quyền thay đổi biểu phí/giá dịch vụ này.  \nCác khoản giá dịch vụ giao dịch như sau:', '## 3. Giá dịch vụ và thưởng hoạt động\nCác loại phí/dịch vụ và chi phí/giá dịch vụ liên quan trực tiếp đến việc giao dịch Đơn Vị Quỹ sẽ do Nhà Đầu Tư trả và không được tính vào chi phí của Quỹ. Công Ty Quản Lý Quỹ bảo lưu quyền thay đổi biểu phí/giá dịch vụ này.  \nCác khoản giá dịch vụ giao dịch như sau:', '. Nhà Đầu Tư cần tham khảo các ý kiến tư vấn về luật và thuế để có thông tin phù hợp đối với các giao dịch của mình.', '## c) Tuân Thủ\n. Nhà Đầu Tư cần tham khảo các ý kiến tư vấn về luật và thuế để có thông tin phù hợp đối với các giao dịch của mình.', 'Nhà đầu tư nên lưu lại một bản Hợp đồng và cập nhật các thông tin cung cấp trong Hợp đồng. Thông tin này sẽ được lưu lại trong Số Đăng Ký của Quỹ và luôn chứa đựng thông tin về địa chỉ hiện tại địa chỉ thư điện tử, nơi đăng ký thuế, và chi tiết tài khoản ngân hàng của từng Nhà Đầu Tư nhằm đảm bảo Nhà Đầu Tư nhận được đầy đủ các thông báo, báo cáo và thanh toán liên quan đến Quỹ.  \nNhà Đầu Tư mua Đơn Vị Quỹ tại các lần tiếp theo cần điền đầy đủ vào phiếu Lệnh Mua có sẵn tại các Điểm Nhận Lệnh.', '## 2.2.5 Điều chỉnh danh mục đầu tư\nCơ cấu đầu tư của quỹ mở chỉ được vượt mức so với các hạn chế đầu tư đã quy định tại điểm a, b, c, d, đ, e và i mục IX.2.2.4 và chỉ do các nguyên nhân sau:  \na) Biến động giá trên thị trường của tài sản trong danh mục đầu tư của quỹ;  \nb) Thực hiện các khoản thanh toán của quỹ theo quy định của pháp luật, bao gồm việc thực hiện lệnh giao dịch của nhà đầu tư;', 'Vị Quỹ, bao gồm cả phần lẻ của Đơn Vị Quỹ. Nhà Đầu Tư chuyển nhượng cần điền Lệnh Chuyển Nhượng Đơn Vị Quỹ với điều kiện là số lượng Chuyển Nhượng phải bằng hoặc lớn hơn số dư tối thiểu khi mở tài khoản nếu người nhận chuyển nhượng chưa phải là Nhà Đầu Tư.  \n- **Xử Lý Các Đơn Chuyển Nhượng**', 'Nhà Đầu Tư mua Đơn Vị Quỹ cần điền đầy đủ vào phiếu Lệnh Mua có sẵn tại các Điểm Nhận Lệnh.  \nNhà Đầu Tư chỉ có thể nộp các Phiếu Lệnh Bán, Chuyển Đổi, Chuyển Nhượng, Hủy Lệnh hay thay đổi thông tin tài khoản của tài khoản mở tại một Đại Lý Phân Phối ở bất kỳ Điểm Nhận Lệnh nào của Đại Lý Phân Phối đó.', '- Việc thực hiện tất cả các lệnh giao dịch của Nhà Đầu Tư tại Ngày Giao Dịch dẫn đến NAV của Quỹ thấp hơn 50.000.000.000 đồng (năm mươi tỷ đồng); hoặc Giá trị phần đơn vị quỹ hoặc số đơn vị quỹ còn lại trên tài khoản của nhà đầu tư thấp hơn giá trị tối thiểu hoặc số lượng đơn vị quỹ tối thiểu để duy trì tài khoản của nhà đầu tư theo quy định tại Điều lệ quỹ và Bán cáo bạch.\n- Trường hợp thực hiện một phần Lệnh Bán, Lệnh mua, Lệnh Chuyến Đổi Quỹ theo quy định nêu trên, Công ty Quản Lý Quỹ áp dụng nguyên tắc phân phối cùng tỷ lệ: Phần giá trị được thực hiện sẽ được phân bổ cho tất cả nhà đầu tư đăng ký giao dịch theo cùng một tỷ lệ giữa giá trị thực hiện và giá trị đăng ký giao dịch.  \nSố lượng chứng chỉ quỹ được thực hiện trong trường hợp này được tính như sau:', '- Thực hiện các lệnh giao dịch của Nhà Đầu Tư;  \n- Các hoạt động sáp nhập, hợp nhất của các tổ chức phát hành các chứng khoán mà Quỹ đang nắm giữ;  \n- Quỹ mới được cấp phép thành lập hoặc do tách Quỹ, hợp nhất Quỹ, sát nhập Quỹ mà thời gian hoạt động không quá sáu (06) tháng, tính từ ngày được cấp giấy chứng nhận đăng ký lập Quỹ;  \n- Quỹ đang trong thời gian giải thể.  \nTrong trường hợp xảy ra sai lệch so với các hạn mức đầu tư, Công ty Quản Lý Quỹ sẽ điều chỉnh danh mục đầu tư để đáp ứng các hạn mức đầu tư kể trên trong vòng 3 (ba) tháng kể từ ngày mà sai lệch phát sinh.']",Nhà đầu tư nước ngoài phải thực hiện qua Tài khoản vốn đầu tư gián tiếp (IICA) tại một ngân hàng thương mại ở Việt Nam.
Ai là những người chịu trách nhiệm chính về nội dung Bản cáo bạch từ phía Công ty quản lý quỹ?,"Theo thông tin được cung cấp, những người chịu trách nhiệm chính về nội dung Bản cáo bạch từ phía Công ty quản lý quỹ Techcom Capital bao gồm:

- Ông Đặng Lưu Dũng - Tổng Giám đốc 
- Ông Phi Tuấn Thành - Giám đốc Phân tích đầu tư

Cụ thể:
- Ông Đặng Lưu Dũng là Tổng Giám đốc của Công ty Cổ phần Quản lý quỹ Kỹ thương, công ty quản lý quỹ Techcom. Ông này có trách nhiệm tổng thể về nội dung Bản cáo bạch.
- Ông Phi Tuấn Thành là Giám đốc Phân tích đầu tư tại Techcom Capital, có kinh nghiệm hơn 15 năm trong lĩnh vực tài chính ngân hàng. Ông cũng tham gia vào việc soạn thảo và chịu trách nhiệm về một số nội dung cụ thể của Bản cáo bạch.

(Nguồn: Trang 1)","['## XV. CAM KẾT\nCông Ty Quản Lý Quỹ cam kết chịu hoàn toàn trách nhiệm về tính chính xác, trung thực của nội dung thông tin và các tài liệu đính kèm trong Bản cáo bạch này.', '## 1. Công ty quản lý quỹ\nBà Nguyễn Thị Thu Hiền\nChức vụ: Chủ tịch Hội đồng quản trị  \nÔng Đặng Lưu Dũng\nChức vụ: Tổng Giám đốc  \nBà Phan Thị Thu Hằng\nChức vụ: Kế toán trưởng  \nChúng tôi đảm bảo rằng các thông tin và số liệu trong Bản Cáo Bạch này là phù hợp với thực tế mà chúng tôi được biết, hoặc đã điều tra, thu thập một cách hợp lý. Tuy vậy, thông tin trong Bản Cáo Bạch này chưa được thẩm định bởi bất kỳ bên nào khác ngoại trừ như được đề cập tại Bản Cáo Bạch này.', '# XII. XUNG ĐỘT LỢI ÍCH\nCông Ty Quản Lý Quỹ có nghĩa vụ, theo Điều lệ và theo thông lệ quốc tế tốt nhất, tại mọi thời điểm hoạt động vì lợi ích của Nhà Đầu Tư và quản lý một cách công bằng, minh bạch đối với tất cả các quỹ do Công ty quản lý. Bộ phận kiểm soát nội bộ và quản trị rủi ro của Công Ty sẽ chịu trách nhiệm theo dõi và giám sát các xung đột lợi ích thực tế hoặc có khả năng xảy ra. Trong trường hợp xung đột lợi ích phát sinh, Công ty Quản lý Quỹ sẽ thông báo cho Ban Đại Diện Quỹ để thống nhất phương án khắc phục nhằm giảm thiểu hoặc quản lý các xung đột đó.', '## 2.12. Kiểm toán, kế toán và chế độ báo cáo\nCông ty Quản Lý Quỹ có trách nhiệm duy trì sổ sách kế toán và chuẩn bị báo cáo tài chính cho Quỹ. Phù hợp với quy định tại Điều 38 của Điều Lệ Quỹ, Công ty Quản Lý Quỹ có thể ủy quyền cho một nhà cung cấp dịch vụ để thực hiện Công việc này. Mọi Sổ sách kế toán và báo cáo tài chính của Quỹ sẽ được lưu tại văn phòng của Công ty Quản Lý Quỹ hoặc của nhà cung cấp dịch vụ mà Công ty Quản Lý Quỹ ủy quyền. Ban Đại diện Quỹ có quyền kiểm tra bất kỳ báo cáo, sổ sách kế toán, hoặc tài liệu nào của Quỹ.  \nCác quy định khác liên quan đến kiểm toán, kế toán và chế độ báo cáo tuân thủ theo quy định tại Điều lệ Quỹ.', '1  \nỦy ban Chứng khoán Nhà nước cấp giấy phép phát hành chứng chỉ quỹ ra công chúng có nghĩa là việc xin phép lập Quỹ và phát hành chứng chỉ quỹ đầu tư đã thực hiện theo các quy định của pháp luật liên quan, không hàm ý bảo đảm về nội dung của Bản cáo bạch cũng như mục tiêu, chiến lược đầu tư của Quỹ.', 'ngược lại;  \n- Ngân hàng giám sát, thành viên Hội đồng quản trị, người điều hành và nhân viên của ngân hàng giám sát làm nhiệm vụ giám sát hoạt động và bảo quản tài sản của quỹ đại chúng, công ty đầu tư chứng khoán không được là đối tác mua, bán trong giao dịch mua, bán tài sản của quỹ đại chúng, công ty đầu tư chứng khoán.\n- Có đầy đủ năng lực cung cấp dịch vụ giám sát, lưu ký;\n- Thực hiện các cam kết đối với Quỹ như nêu tại Phụ lục 2 và Phụ lục 3 của Điều lệ Quỹ.  \nCác quy định về quyền và nghĩa vụ, hoạt động giám sát và chấm dứt quyền và nghĩa vụ của Ngân hàng giám sát tuân thủ theo quy định tại chương VII Điều lệ Quỹ.', '## Lĩnh vực được phép đầu tư\n- Có quy định tại Điều lệ quỹ và Bản cáo bạch;\n- Đã được Ban đại diện quỹ chấp thuận bằng văn bản về loại, mã chứng khoán, số lượng, giá trị giao dịch, thời điểm thực hiện;\n- Có đủ tài liệu chứng minh về bảo lãnh thanh toán hoặc tài liệu về cam kết mua lại của tổ chức phát hành.', '## 2.3. Đặc trưng của chứng chỉ Quỹ đầu tư\nNhà đầu tư của Quỹ là cá nhân, tổ chức trong và ngoài nước, sở hữu chứng chỉ quỹ. Nhà đầu tư không chịu trách nhiệm pháp lý hoặc nghĩa vụ khác ngoài trách nhiệm trong phạm vi số chứng chỉ Quỹ mà họ sở hữu. Nhà đầu tư là tổ chức bao gồm các tổ chức kinh tế và xã hội được pháp luật Việt Nam công nhận.  \nNhà đầu tư pháp nhân cử người đại diện hợp pháp đại diện cho số Chứng chỉ quỹ mà mình sở hữu. Việc đề cử, hủy bỏ hay thay thế người đại diện này phải được thông báo bằng văn bản, do người đại diện có thẩm quyền của nhà đầu tư tổ chức ký.', '## 3. Giá dịch vụ và thưởng hoạt động\nCác loại phí/dịch vụ và chi phí/giá dịch vụ liên quan trực tiếp đến việc giao dịch Đơn Vị Quỹ sẽ do Nhà Đầu Tư trả và không được tính vào chi phí của Quỹ. Công Ty Quản Lý Quỹ bảo lưu quyền thay đổi biểu phí/giá dịch vụ này.  \nCác khoản giá dịch vụ giao dịch như sau:', '## 2.5.3. Thông tin về các mức giá dịch vụ\nCác loại phí/dịch vụ và chi phí/giá dịch vụ liên quan trực tiếp đến việc giao dịch Đơn Vị Quỹ sẽ do Nhà Đầu Tư trả và không được tính vào chi phí của Quỹ. Công Ty Quản Lý Quỹ bảo lưu quyền thay đổi biểu phí/giá dịch vụ này.  \nCác khoản giá dịch vụ giao dịch như sau:', '## 2.10. Tiêu chí lựa chọn, quyền hạn và trách nhiệm của Công ty Quản lý quỹ\nCông ty Quản Lý Quỹ được lựa chọn phải thỏa mãn các điều kiện sau:  \n- Được thực hiện nghiệp vụ Quản Lý Quỹ;\n- Hoàn toàn độc lập với Ngân Hàng Giám Sát;\n- Có đầy đủ cơ sở vật chất, nhân sự để Quản Lý Quỹ mở;\n- Đồng ý thực hiện các cam kết đối với Quỹ như nêu tại Phụ Lục 1 và Phụ Lục 3 của Điều lệ Quỹ.  \nCác quy định về quyền và nghĩa vụ, chấm dứt quyền và nghĩa vụ, hạn chế hoạt động của Công ty Quản lý quỹ tuân thủ theo quy định tại Chương VI Điều lệ Quỹ.', '“Bản Cáo Bạch”\ncó nghĩa là tài liệu này hoặc dữ liệu điện tử công khai thông tin chính xác, trung thực và khách quan liên quan đến việc chào bán và phát hành Chứng Chỉ Quỹ của Quỹ.  \n“Hợp Đồng Giám Sát”\ncó nghĩa là hợp đồng được ký kết giữa Công ty Quản Lý Quỹ và Ngân Hàng Giám Sát được thông qua bởi Đại Hội Nhà Đầu Tư.  \n“Nhà Đầu Tư”\nlà cá nhân, tổ chức trong nước và ngoài nước nắm giữ Chứng Chỉ Quỹ  \n“Đại Hội Nhà Đầu Tư”\nLà đại hội của Nhà Đầu Tư có quyền biểu quyết được tổ chức thường kỳ hoặc bất thường để thông qua các vấn đề quan trọng có liên quan đến Quỹ. Đại Hội Nhà Đầu Tư là cơ quan quyền lực cao nhất của Quỹ.  \n“Ban Đại Diện Quỹ”', '- Kết quả hoạt động trong quá khứ của một Quỹ, của Công Ty Quản Lý Quỹ hoặc của các chủ sở hữu của Công Ty Quản Lý Quỹ không hàm ý hay đảm bảo kết quả hoạt động của Quỹ trong tương lai;\n- Tên của Quỹ không hàm ý về chất lượng hoạt động cũng như triển vọng và lợi nhuận của Quỹ trong tương lai;\n- Công Ty Quản Lý Quỹ không chịu trách nhiệm pháp lý về những rủi ro đầu tư của Quỹ và các chủ sở hữu, thành viên Hội đồng thành viên, ban điều hành và nhân viên của Công Ty Quản Lý Quỹ không có trách nhiệm pháp lý về các rủi ro hoạt động của Công Ty Quản Lý Quỹ trong quá trình quản lý Quỹ này.', '|  Ông Đào Kiên Trung | Ông Trung tốt nghiệp Đại học Luật chuyên ngành Pháp luật Quốc tế, Đại học ngoại ngữ Hà Nội chuyên ngành Tiếng Anh.  \nTừ 1999 đến nay, ông Trung đã trải qua nhiều vị trí khác nhau tại các đơn vị như Công ty TNHH Grant Thornton VN, Ngân hàng TMCP Kỹ Thương Việt Nam, CTCP FPT, Công ty QLQ FPT, Công ty TNHH Quản lý nợ và khai thác tài sản - Ngân hàng TMCP Kỹ Thương Việt Nam.  \nHiện nay ông Trung giữ chức vụ Giám đốc pháp chế và tuân thủ kiêm Kiểm soát nội bộ, Pháp chế và kiểm soát tuân thủ Công ty Cổ phần quản lý Quỹ Kỹ Thương.  |\n| --- | --- |\n|  Ông Trần Viết Thỏa | Ông Thỏa có 20 năm kinh nghiệm trong lĩnh vực kế toán, kiểm toán và tài chính và đầu tư.  \n9 năm kinh nghiệm với vai trò giám đốc kiểm toán tại Công ty TNHH KPMG Việt Nam.', '## 2.3. Đặc trưng của chứng chỉ Quỹ đầu tư\nCông ty quản lý quỹ thực hiện hoặc ủy quyền cho tổ chức cung cấp dịch vụ đại lý chuyển nhượng lập và quản lý số đăng ký nhà đầu tư chính (sổ chính) hoặc ủy quyền đại lý ký danh lập, quản lý đăng ký nhà đầu tư phụ (sổ phụ) và xác nhận quyền sở hữu chứng chỉ quỹ cho nhà đầu tư.  \nSố đăng ký nhà đầu tư của Quỹ có thể là văn bản, tập dữ liệu điện tử hoặc cả hai. Các nội dung của Số đăng ký nhà đầu tư được quy định chi tiết tại điều 15 Điều lệ Quỹ.', 'e. Phụ Cấp Ban Đại Diện Quỹ  \nCác chi phí của Ban Đại Diện Quỹ bao gồm chi phí ăn ở, đi lại với mức hợp lý và phù hợp với các quy định tại Điều lệ Quỹ, các chi phí phát sinh từ hoạt động của Ban Đại Diện Quỹ để phục vụ cho lợi ích của Quỹ sẽ được tính vào chi phí của Quỹ. Để dễ hiểu, chi phí trên không bao gồm các chi phí bảo hiểm đối với trách nhiệm phát sinh cho Ban Đại Diện Quỹ khi thực hiện nghĩa vụ của Ban Đại Diện Quỹ. Thù lao của các thành viên của Ban Đại Diện Quỹ được tính vào chi phí hoạt động của Quỹ và tổng mức thù lao không được vượt quá tổng ngân sách hoạt động hàng năm của Ban Đại Diện đã được thông qua tại Đại Hội Nhà Đầu Tư.', 'Trường hợp sai lệch là do Công ty Quản Lý Quỹ không tuân thủ các hạn chế đầu tư theo quy định của Pháp Luật hoặc Điều lệ Quỹ, Công ty Quản Lý Quỹ có trách nhiệm điều chỉnh lại danh mục đầu tư trong thời hạn mười lăm (15) ngày, kể từ ngày phát sinh sai lệch. Trong trường hợp này, Công ty Quản Lý Quỹ phải chịu mọi chi phí phát sinh liên quan đến các giao dịch này và các tổn thất (nếu có phát sinh). Nếu phát sinh lợi nhuận, thì phải hạch toán ngay mọi khoản lợi nhuận có được cho Quỹ.', '## 2. Ngân hàng giám sát\nNgân hàng TMCP Đầu tư và Phát triển Việt Nam - Chi nhánh Hà Thành  \nĐại diện hợp pháp: Ông Nguyễn Mạnh Cường  \nChức vụ: Phó Giám đốc  \nBản cáo bạch này là một phần của hồ sơ đăng ký chào bán của Công ty Cổ phần Quản lý quỹ Kỹ thương (Techcom Capital – “TCC”). Chúng tôi, với tư cách là Ngân hàng Giám sát của Quỹ Đầu Tư Cổ phiếu Doanh nghiệp vừa và nhỏ Techcom (TCSME) sẽ chịu trách nhiệm theo các quy định trong phạm vi Hợp Đồng Cung Cấp Dịch Vụ Giám Sát Quỹ được ký kết giữa chúng tôi với Công ty Cổ phần Quản lý quỹ Kỹ thương, là công ty quản lý Quỹ Đầu tư Cổ phiếu Doanh nghiệp vừa và nhỏ Techcom và theo quy định của pháp luật.', 'Trong thời hạn 05 ngày làm việc kể từ ngày hoàn tất việc điều chỉnh lại danh mục đầu tư, công ty quản lý quỹ phải công bố thông tin theo quy định, đồng thời thông báo cho Ủy ban Chứng khoán Nhà nước về các sai lệch cơ cấu danh mục đầu tư, nguyên nhân, thời điểm phát sinh hoặc phát hiện ra sự việc, mức độ thiệt hại và bồi thường thiệt hại cho quỹ (nếu có) hoặc lợi nhuận tạo cho quỹ (nếu có), biện pháp khắc phục, thời gian thực hiện, kết quả khắc phục.  \nCông ty quản lý quỹ chỉ được gửi tiền và đầu tư công cụ thị trường tiền tệ quy định tại điểm a, b mục IX.2.2.3 của các tổ chức tín dụng trong danh sách đã được Ban đại diện quỹ phê duyệt.', '## 3. Các rủi ro khi đầu tư vào Quỹ\nMục tiêu của Công Ty Quản Lý Quỹ là quản lý các rủi ro đầu tư, và nếu có thể, hạn chế tác động của các rủi ro này bằng việc áp dụng các phương pháp quản lý đầu tư theo tiêu chuẩn quốc tế tốt nhất. Nhà Đầu Tư cần lưu ý các điểm quan trọng sau đây:  \n- Quỹ, Công Ty Quản Lý Quỹ, thành viên Hội đồng thành viên, ban điều hành và nhân viên Công Ty Quản Lý Quỹ không có bất kỳ sự đảm bảo nào đối với vốn đầu tư ban đầu cũng như mức lợi nhuận từ đầu tư của Quỹ;\n- Không có bất kỳ sự bảo đảm nào về sổ lần chi trả và giá trị của cổ tức được thanh toán trong tương lai;  \n42', '## Lĩnh vực được phép đầu tư\nđ) Cổ phiếu chào bán lần đầu ra công chúng, trái phiếu chào bán ra công chúng; trái phiếu doanh nghiệp phát hành riêng lẻ bởi tổ chức niêm yết có bảo lãnh thanh toán của tổ chức tín dụng hoặc cam kết mua lại của tổ chức phát hành tối thiểu 1 lần trong 12 tháng và mỗi lần cam kết mua lại tối thiểu 30% giá trị đợt phát hành;  \ne) Chứng khoán phải sinh niêm yết giao dịch tại Sở giao dịch chứng khoán và chỉ nhằm mục tiêu phòng ngừa rủi ro cho chứng khoán cơ sở mà quỹ đang nắm giữ;  \ng) Quyền phát sinh gắn liền với chứng khoán mà quỹ đang nắm giữ.  \nViệc đầu tư vào các tài sản quy định tại điểm đ khoản 2.2.3 Điều này phải đáp ứng các điều kiện sau:  \n- Có quy định tại Điều lệ quỹ và Bản cáo bạch;', 'Ban điều hành Công ty  \n- **Ông Đặng Lưu Dũng – Tổng Giám đốc**  \nDanh sách nhân viên điều hành Quỹ  \n- **Ông Phi Tuấn Thành**  \nÔng Thành tốt nghiệp Đại học Kinh tế Quốc dân và Thạc sĩ Quản trị kinh doanh – ĐH Tổng hợp bang Washington, Hoa Kỳ. Ông Thành được cấp Chứng chỉ hành nghề Quản lý Quỹ của Bộ Tài Chính số 00135/QLQ ngày 15/04/2009.  \nÔng Thành đã có hơn 15 năm kinh nghiệm trong lĩnh vực tài chính ngân hàng, với 2 năm làm việc tại ngân hàng VID Public và 3 năm làm phó trưởng phòng phân tích của CTCP Chứng khoán Sài Gòn SSI.  \nÔng hiện đảm nhiệm vị trí Giám đốc Phân tích đầu tư – Công ty Cổ phần Quản lý Quỹ Kỹ Thương từ năm 2010 cho tới nay.  \n- **Bà Đồng Thị Khánh Ngọc**', '9 năm kinh nghiệm với vai trò giám đốc kiểm toán tại Công ty TNHH KPMG Việt Nam.  \nHiện là Giám đốc tài chính (CFO) tại Công ty CP Đầu tư Thương Mại Quốc Tế Mặt Trời Đỏ.  |  \nCác quy định về tiêu chuẩn lựa chọn thành viên Ban đại diện Quỹ, quyền hạn và nhiệm vụ của Ban đại diện Quỹ, chủ tịch Ban đại diện Quỹ, đình chỉ hoặc bãi miễn thành viên Ban đại diện Quỹ, cuộc họp của Ban đại diện Quỹ tuân theo quy định tại chương V Điều lệ Quỹ.', '## 2. Điều lệ Quỹ tóm tắt\nCơ quan quyền lực cao nhất của Quỹ là Đại hội Nhà Đầu tư.  \nBan Đại diện Quỹ sẽ do Đại hội Nhà Đầu tư bầu ra để giám sát các hoạt động thường xuyên của Quỹ, TCC và Ngân hàng giám sát.  \n#### 2.1.2 Tổng vốn huy động và số lượng chứng chỉ Quỹ được chào bán  \nVốn Điều lệ được huy động trong lần đầu chào bán ra công chúng của Quỹ là 50.000.000.000 VNĐ (Năm mươi tỷ đồng). Vốn Điều lệ sẽ được chia thành 5.000.000 (Năm triệu) Chứng chỉ Quỹ. Mệnh giá của một Chứng chỉ Quỹ sẽ là 10.000 VNĐ (mười nghìn Đồng Việt Nam).  \nNhà đầu tư góp vốn bằng tiền Đồng Việt Nam dưới hình thức chuyển khoản hoặc chuyển tiền vào tài khoản của Quỹ mở tại ngân hàng giám sát.  \nSố lượng chứng chỉ quỹ/tổng chứng chỉ quỹ được phép lưu hành tối đa: không hạn chế.', '# QUỸ ĐẦU TƯ CỔ PHIẾU DOANH NGHIỆP VỮA VÀ NHỎ TECHCOM (TCSME)\n**Phụ trách công bố thông tin:**  \n**Ông** : Đặng Lưu Dũng – Tổng Giám đốc  \n**Địa chỉ** : Công ty Cổ phần Quản lý quỹ Kỹ thương  \nTầng 28, Tòa C5, số 119 Trần Duy Hưng, phường Trung Hòa, Quận Cầu Giấy, Hà Nội  \n**Điện thoại** : (84-24) 39446368Fax: (84-24) 39446583']","Bà Nguyễn Thị Thu Hiền (Chủ tịch HĐQT), Ông Đặng Lưu Dũng (Tổng Giám đốc), Bà Phan Thị Thu Hằng (Kế toán trưởng)."
Ban đại diện Quỹ bao gồm những thành viên nào?,"Theo thông tin được cung cấp từ Bản cáo bạch, Ban Đại Diện Quỹ bao gồm:

- Ông Đào Kiên Trung với vai trò Giám đốc pháp chế và tuân thủ kiêm Kiểm soát nội bộ, Pháp chế và kiểm soát tuân thủ Công ty Cổ phần quản lý Quỹ Kỹ Thương.

- Ông Trần Viết Thỏa có 9 năm kinh nghiệm với vai trò giám đốc kiểm toán tại Công ty TNHH KPMG Việt Nam. 

(Nguồn: Trang 47)","['“Ban Đại Diện Quỹ”\nlà những người đại diện cho Nhà Đầu Tư được Đại Hội Nhà Đầu Tư bầu ra để thay mặt Nhà Đầu Tư thực hiện việc giám sát các hoạt động của Quỹ, Công ty Quản Lý Quỹ và Ngân Hàng Giám Sát.  \n“Vốn Điều lệ”\nlà tổng số vốn bằng tiền do các Nhà Đầu Tư thực góp trong đợt phát hành Chứng Chỉ Quỹ lần đầu ra công chúng và được ghi trong Điều lệ.  \n“Chứng Chỉ Quỹ”\nLà loại chứng khoán xác nhận quyền sở hữu của nhà đầu tư đối với một phần vốn góp tại quỹ. Mệnh giá 01 chứng chỉ quỹ là 10.000 đồng.  \n“Giá bán/ Giá phát hành”', 'e. Phụ Cấp Ban Đại Diện Quỹ  \nCác chi phí của Ban Đại Diện Quỹ bao gồm chi phí ăn ở, đi lại với mức hợp lý và phù hợp với các quy định tại Điều lệ Quỹ, các chi phí phát sinh từ hoạt động của Ban Đại Diện Quỹ để phục vụ cho lợi ích của Quỹ sẽ được tính vào chi phí của Quỹ. Để dễ hiểu, chi phí trên không bao gồm các chi phí bảo hiểm đối với trách nhiệm phát sinh cho Ban Đại Diện Quỹ khi thực hiện nghĩa vụ của Ban Đại Diện Quỹ. Thù lao của các thành viên của Ban Đại Diện Quỹ được tính vào chi phí hoạt động của Quỹ và tổng mức thù lao không được vượt quá tổng ngân sách hoạt động hàng năm của Ban Đại Diện đã được thông qua tại Đại Hội Nhà Đầu Tư.', 'Ban điều hành Công ty  \n- **Ông Đặng Lưu Dũng – Tổng Giám đốc**  \nDanh sách nhân viên điều hành Quỹ  \n- **Ông Phi Tuấn Thành**  \nÔng Thành tốt nghiệp Đại học Kinh tế Quốc dân và Thạc sĩ Quản trị kinh doanh – ĐH Tổng hợp bang Washington, Hoa Kỳ. Ông Thành được cấp Chứng chỉ hành nghề Quản lý Quỹ của Bộ Tài Chính số 00135/QLQ ngày 15/04/2009.  \nÔng Thành đã có hơn 15 năm kinh nghiệm trong lĩnh vực tài chính ngân hàng, với 2 năm làm việc tại ngân hàng VID Public và 3 năm làm phó trưởng phòng phân tích của CTCP Chứng khoán Sài Gòn SSI.  \nÔng hiện đảm nhiệm vị trí Giám đốc Phân tích đầu tư – Công ty Cổ phần Quản lý Quỹ Kỹ Thương từ năm 2010 cho tới nay.  \n- **Bà Đồng Thị Khánh Ngọc**', '## g) Phụ Cấp Ban Đại Diện Quỹ\nCác chi phí của Ban Đại Diện Quỹ bao gồm chi phí ăn ở, đi lại với mức hợp lý và phù hợp với các quy định tại Điều lệ Quỹ, các chi phí phát sinh từ hoạt động của Ban Đại Diện Quỹ để phục vụ cho lợi ích của Quỹ sẽ được tính vào chi phí của Quỹ. Để dễ hiểu, chi phí trên không bao gồm các chi phí bảo hiểm đối với trách nhiệm phát sinh cho Ban Đại Diện Quỹ khi thực hiện nghĩa vụ của Ban Đại Diện Quỹ. Thủ lao của các thành viên của Ban Đại Diện Quỹ được tính vào chi phí hoạt động của Quỹ và tổng mức thủ lao không được vượt quá tổng ngân sách hoạt động hàng năm của Ban Đại Diện đã được thông qua tại Đại Hội Nhà Đầu Tư.', '9 năm kinh nghiệm với vai trò giám đốc kiểm toán tại Công ty TNHH KPMG Việt Nam.  \nHiện là Giám đốc tài chính (CFO) tại Công ty CP Đầu tư Thương Mại Quốc Tế Mặt Trời Đỏ.  |  \nCác quy định về tiêu chuẩn lựa chọn thành viên Ban đại diện Quỹ, quyền hạn và nhiệm vụ của Ban đại diện Quỹ, chủ tịch Ban đại diện Quỹ, đình chỉ hoặc bãi miễn thành viên Ban đại diện Quỹ, cuộc họp của Ban đại diện Quỹ tuân theo quy định tại chương V Điều lệ Quỹ.', '“Bản Cáo Bạch”\ncó nghĩa là tài liệu này hoặc dữ liệu điện tử công khai thông tin chính xác, trung thực và khách quan liên quan đến việc chào bán và phát hành Chứng Chỉ Quỹ của Quỹ.  \n“Hợp Đồng Giám Sát”\ncó nghĩa là hợp đồng được ký kết giữa Công ty Quản Lý Quỹ và Ngân Hàng Giám Sát được thông qua bởi Đại Hội Nhà Đầu Tư.  \n“Nhà Đầu Tư”\nlà cá nhân, tổ chức trong nước và ngoài nước nắm giữ Chứng Chỉ Quỹ  \n“Đại Hội Nhà Đầu Tư”\nLà đại hội của Nhà Đầu Tư có quyền biểu quyết được tổ chức thường kỳ hoặc bất thường để thông qua các vấn đề quan trọng có liên quan đến Quỹ. Đại Hội Nhà Đầu Tư là cơ quan quyền lực cao nhất của Quỹ.  \n“Ban Đại Diện Quỹ”', '## 2. Điều lệ Quỹ tóm tắt\nCơ quan quyền lực cao nhất của Quỹ là Đại hội Nhà Đầu tư.  \nBan Đại diện Quỹ sẽ do Đại hội Nhà Đầu tư bầu ra để giám sát các hoạt động thường xuyên của Quỹ, TCC và Ngân hàng giám sát.  \n#### 2.1.2 Tổng vốn huy động và số lượng chứng chỉ Quỹ được chào bán  \nVốn Điều lệ được huy động trong lần đầu chào bán ra công chúng của Quỹ là 50.000.000.000 VNĐ (Năm mươi tỷ đồng). Vốn Điều lệ sẽ được chia thành 5.000.000 (Năm triệu) Chứng chỉ Quỹ. Mệnh giá của một Chứng chỉ Quỹ sẽ là 10.000 VNĐ (mười nghìn Đồng Việt Nam).  \nNhà đầu tư góp vốn bằng tiền Đồng Việt Nam dưới hình thức chuyển khoản hoặc chuyển tiền vào tài khoản của Quỹ mở tại ngân hàng giám sát.  \nSố lượng chứng chỉ quỹ/tổng chứng chỉ quỹ được phép lưu hành tối đa: không hạn chế.', '## Lĩnh vực được phép đầu tư\n- Có quy định tại Điều lệ quỹ và Bản cáo bạch;\n- Đã được Ban đại diện quỹ chấp thuận bằng văn bản về loại, mã chứng khoán, số lượng, giá trị giao dịch, thời điểm thực hiện;\n- Có đủ tài liệu chứng minh về bảo lãnh thanh toán hoặc tài liệu về cam kết mua lại của tổ chức phát hành.', '## 1. Công ty quản lý quỹ\nBà Nguyễn Thị Thu Hiền\nChức vụ: Chủ tịch Hội đồng quản trị  \nÔng Đặng Lưu Dũng\nChức vụ: Tổng Giám đốc  \nBà Phan Thị Thu Hằng\nChức vụ: Kế toán trưởng  \nChúng tôi đảm bảo rằng các thông tin và số liệu trong Bản Cáo Bạch này là phù hợp với thực tế mà chúng tôi được biết, hoặc đã điều tra, thu thập một cách hợp lý. Tuy vậy, thông tin trong Bản Cáo Bạch này chưa được thẩm định bởi bất kỳ bên nào khác ngoại trừ như được đề cập tại Bản Cáo Bạch này.', '## 2.3. Đặc trưng của chứng chỉ Quỹ đầu tư\nNhà đầu tư của Quỹ là cá nhân, tổ chức trong và ngoài nước, sở hữu chứng chỉ quỹ. Nhà đầu tư không chịu trách nhiệm pháp lý hoặc nghĩa vụ khác ngoài trách nhiệm trong phạm vi số chứng chỉ Quỹ mà họ sở hữu. Nhà đầu tư là tổ chức bao gồm các tổ chức kinh tế và xã hội được pháp luật Việt Nam công nhận.  \nNhà đầu tư pháp nhân cử người đại diện hợp pháp đại diện cho số Chứng chỉ quỹ mà mình sở hữu. Việc đề cử, hủy bỏ hay thay thế người đại diện này phải được thông báo bằng văn bản, do người đại diện có thẩm quyền của nhà đầu tư tổ chức ký.', '## Lĩnh vực được phép đầu tư\nđ) Cổ phiếu chào bán lần đầu ra công chúng, trái phiếu chào bán ra công chúng; trái phiếu doanh nghiệp phát hành riêng lẻ bởi tổ chức niêm yết có bảo lãnh thanh toán của tổ chức tín dụng hoặc cam kết mua lại của tổ chức phát hành tối thiểu 1 lần trong 12 tháng và mỗi lần cam kết mua lại tối thiểu 30% giá trị đợt phát hành;  \ne) Chứng khoán phải sinh niêm yết giao dịch tại Sở giao dịch chứng khoán và chỉ nhằm mục tiêu phòng ngừa rủi ro cho chứng khoán cơ sở mà quỹ đang nắm giữ;  \ng) Quyền phát sinh gắn liền với chứng khoán mà quỹ đang nắm giữ.  \nViệc đầu tư vào các tài sản quy định tại điểm đ khoản 2.2.3 Điều này phải đáp ứng các điều kiện sau:  \n- Có quy định tại Điều lệ quỹ và Bản cáo bạch;', '1  \nỦy ban Chứng khoán Nhà nước cấp giấy phép phát hành chứng chỉ quỹ ra công chúng có nghĩa là việc xin phép lập Quỹ và phát hành chứng chỉ quỹ đầu tư đã thực hiện theo các quy định của pháp luật liên quan, không hàm ý bảo đảm về nội dung của Bản cáo bạch cũng như mục tiêu, chiến lược đầu tư của Quỹ.', 'ngược lại;  \n- Ngân hàng giám sát, thành viên Hội đồng quản trị, người điều hành và nhân viên của ngân hàng giám sát làm nhiệm vụ giám sát hoạt động và bảo quản tài sản của quỹ đại chúng, công ty đầu tư chứng khoán không được là đối tác mua, bán trong giao dịch mua, bán tài sản của quỹ đại chúng, công ty đầu tư chứng khoán.\n- Có đầy đủ năng lực cung cấp dịch vụ giám sát, lưu ký;\n- Thực hiện các cam kết đối với Quỹ như nêu tại Phụ lục 2 và Phụ lục 3 của Điều lệ Quỹ.  \nCác quy định về quyền và nghĩa vụ, hoạt động giám sát và chấm dứt quyền và nghĩa vụ của Ngân hàng giám sát tuân thủ theo quy định tại chương VII Điều lệ Quỹ.', '- Giấy chứng nhận đăng ký lập Quỹ đại chúng: do UBCKNN cấp\n- Loại hình: Quỹ mở\n- Vốn điều lệ ban đầu: 50.000.000.000 (năm mươi tỷ đồng)\n- Thời hạn của Quỹ: không giới hạn', '## 2.8. Đại hội Nhà đầu tư\nĐại Hội Nhà Đầu Tư là cơ quan có thẩm quyền cao nhất của Quỹ và tất cả các Nhà Đầu Tư có tên trong sổ đăng ký nhà đầu tư trước khi triệu tập cuộc họp đều có quyền tham dự.  \nĐại Hội Nhà Đầu Tư thường niên hoặc bất thường sẽ được tổ chức bởi Công ty Quản Lý Quỹ phù hợp với quy định của Pháp Luật với điều kiện là Nhà Đầu Tư phải được thông báo về thời gian, địa điểm, chương trình và nội dung của cuộc họp 21 (hai mươi mốt) ngày trước khi tổ chức đại hội. Đại Hội Nhà Đầu Tư không thảo luận các vấn đề khác ngoài vấn đề đã được nêu trong chương trình đại hội và Công ty Quản Lý Quỹ phải gửi toàn bộ chương trình, nội dung họp và các tài liệu có liên quan cho UBCKNN ít nhất 07 (bảy) ngày làm việc trước ngày tiến hành đại hội.', '6  \nvà Giấy chứng nhận đăng ký hoạt động lưu ký chứng khoán số 510/QĐ-ĐKHĐLK ngày 01/08/2006 do UBCKNN cấp, thực hiện các nghiệp vụ bảo quản, lưu ký các chứng khoán, các hợp đồng kinh tế, các chứng từ có liên quan đến tài sản của Quỹ, đồng thời giám sát hoạt động của Quỹ. Quyền và nghĩa vụ của Ngân Hàng Giám Sát được quy định tại Chương VII của Điều lệ Quỹ.  \n“Công Ty Kiểm Toán”\nlà công ty kiểm toán độc lập cho quỹ được Đại Hội Nhà Đầu Tư chỉ định, thực hiện việc kiểm toán hàng năm tài sản của Quỹ Đầu Tư Cổ phiếu Doanh nghiệp vừa và nhỏ Techcom.  \n“Điều lệ”\ncó nghĩa là Điều lệ Quỹ, các phụ lục đính kèm và các sửa đổi bổ sung hợp pháp (nếu có) được Đại hội nhà đầu tư thông qua tại Đại hội Nhà đầu tư.  \n“Bản Cáo Bạch”', 'vi. Chứng khoán phái sinh niêm yết, giao dịch tại các Sở Giao dịch Chứng khoán, và chỉ nhằm mục tiêu phòng ngừa rủi ro cho chứng khoán cơ sở mà quỹ đang nắm giữ.  \nvii. Quyền phát sinh gắn liền với chứng khoán mà Quỹ đang nắm giữ.  |\n| --- | --- |\n|  Cơ cấu đầu tư | Các khoản đầu tư của Quỹ sẽ được đa dạng hóa và đáp ứng được các điều kiện của pháp luật. Cơ cấu danh mục đầu tư của Quỹ phải bảo đảm tuân thủ các nguyên tắc sau:  \ni. Cơ cấu danh mục đầu tư của quỹ mở phải bao gồm chứng khoán của ít nhất sáu (06) tổ chức phát hành, đồng thời phải bảo đảm:', '- Không đầu tư quá 30% tổng giá trị tài sản của quỹ vào các chứng chỉ quỹ đại chúng, cổ phiếu công ty đầu tư chứng khoán đại chúng;  \nxi. Quỹ chỉ được đầu tư tiền gửi, công cụ tiền tệ quy định tại điểm i và ii các loại tài sản Quỹ được phép đầu tư được phát hành bởi các tổ chức tín dụng trong danh sách đã được Ban Đại Diện Quỹ phê duyệt bằng văn bản hoặc thông qua bỏ phiếu điện tử (e-voting) tuân thủ theo các Quy định Pháp luật hiện hành.  \nCơ cấu đầu tư của Quỹ được phép sai lệch so với các hạn chế được đưa ra tại điểm i, ii, iii, iv, v, vi và ix nếu trên nhưng chỉ vì các lý do sau:  \n- Biến động giá trên thị trường của các tài sản trong danh mục đầu tư của Quỹ;  \n- Thực hiện các khoản thanh toán phù hợp với Pháp Luật của Quỹ;  \n- Thực hiện các lệnh giao dịch của Nhà Đầu Tư;', '## Lĩnh vực được phép đầu tư\nDanh mục đầu tư của quỹ phải phù hợp với mục tiêu và chính sách đầu tư đã được quy định tại Điều lệ quỹ và công bố tại Bản cáo bạch. Danh mục đầu tư của quỹ đầu tư bao gồm các loại tài sản sau đây:  \na) Tiền gửi các ngân hàng thương mại theo quy định của pháp luật ngân hàng;  \nb) Công cụ thị trường tiền tệ bao gồm giấy tờ có giá, công cụ chuyển nhượng theo quy định của pháp luật;  \nc) Công cụ nợ của Chính phủ, trái phiếu được Chính phủ bảo lãnh, trái phiếu chính quyền địa phương;  \nd) Cổ phiếu niêm yết, cổ phiếu đăng ký giao dịch, trái phiếu niêm yết trên Sở giao dịch chứng khoán, chứng chỉ quỹ đại chúng;', '|  Ông Đào Kiên Trung | Ông Trung tốt nghiệp Đại học Luật chuyên ngành Pháp luật Quốc tế, Đại học ngoại ngữ Hà Nội chuyên ngành Tiếng Anh.  \nTừ 1999 đến nay, ông Trung đã trải qua nhiều vị trí khác nhau tại các đơn vị như Công ty TNHH Grant Thornton VN, Ngân hàng TMCP Kỹ Thương Việt Nam, CTCP FPT, Công ty QLQ FPT, Công ty TNHH Quản lý nợ và khai thác tài sản - Ngân hàng TMCP Kỹ Thương Việt Nam.  \nHiện nay ông Trung giữ chức vụ Giám đốc pháp chế và tuân thủ kiêm Kiểm soát nội bộ, Pháp chế và kiểm soát tuân thủ Công ty Cổ phần quản lý Quỹ Kỹ Thương.  |\n| --- | --- |\n|  Ông Trần Viết Thỏa | Ông Thỏa có 20 năm kinh nghiệm trong lĩnh vực kế toán, kiểm toán và tài chính và đầu tư.  \n9 năm kinh nghiệm với vai trò giám đốc kiểm toán tại Công ty TNHH KPMG Việt Nam.', 'Quỹ đầu tư chứng khoán được mô tả trong Bản cáo bạch này là Quỹ được thành lập theo Luật Chứng khoán số 54/2019/QH14 được Quốc hội Nước Cộng hòa xã hội chủ nghĩa Việt Nam thông qua ngày 26 tháng 11 năm 2019 và các văn bản hướng dẫn thi hành. Bản cáo bạch này đã được đăng ký với Ủy ban Chứng khoán Nhà nước ngày / / 2022.', '## 2.3. Đặc trưng của chứng chỉ Quỹ đầu tư\nCông ty quản lý quỹ thực hiện hoặc ủy quyền cho tổ chức cung cấp dịch vụ đại lý chuyển nhượng lập và quản lý số đăng ký nhà đầu tư chính (sổ chính) hoặc ủy quyền đại lý ký danh lập, quản lý đăng ký nhà đầu tư phụ (sổ phụ) và xác nhận quyền sở hữu chứng chỉ quỹ cho nhà đầu tư.  \nSố đăng ký nhà đầu tư của Quỹ có thể là văn bản, tập dữ liệu điện tử hoặc cả hai. Các nội dung của Số đăng ký nhà đầu tư được quy định chi tiết tại điều 15 Điều lệ Quỹ.', '# IV. THÔNG TIN VỀ CÔNG TY CỔ PHẦN QUẢN LÝ QUỸ KỸ THƯƠNG\n## Hội đồng quản trị\n- **Bà Nguyễn Thị Thu Hiền – Chủ tịch Hội đồng quản trị**  \nBà Hiền có hơn 20 năm kinh nghiệm trong lĩnh vực tài chính ngân hàng tại các tổ chức tài chính lớn như Chinfon bank, Citibank và Techcombank. Hiện Bà là Tổng Giám đốc Công ty Cổ phần Chứng khoán Kỹ thương.  \nBà Hiền tốt nghiệp chuyên ngành Tài chính ngân hàng Đại học Kinh tế quốc dân Hà Nội và Thạc sĩ chuyên ngành Tài chính ngân hàng trường Đại học Monash, Melbourne, Úc với học bổng chính phủ của Úc.  \n- **Ông Đặng Lưu Dũng – Thành viên Hội đồng quản trị**', '- Thực hiện các lệnh giao dịch của Nhà Đầu Tư;  \n- Các hoạt động sáp nhập, hợp nhất của các tổ chức phát hành các chứng khoán mà Quỹ đang nắm giữ;  \n- Quỹ mới được cấp phép thành lập hoặc do tách Quỹ, hợp nhất Quỹ, sát nhập Quỹ mà thời gian hoạt động không quá sáu (06) tháng, tính từ ngày được cấp giấy chứng nhận đăng ký lập Quỹ;  \n- Quỹ đang trong thời gian giải thể.  \nTrong trường hợp xảy ra sai lệch so với các hạn mức đầu tư, Công ty Quản Lý Quỹ sẽ điều chỉnh danh mục đầu tư để đáp ứng các hạn mức đầu tư kể trên trong vòng 3 (ba) tháng kể từ ngày mà sai lệch phát sinh.', 'Sau khi thực hiện các Lệnh Bán Được Chấp Nhận, số Đơn Vị Quỹ đã bán sẽ được trù ra từ tổng số Đơn Vị Quỹ trong tài khoản của Nhà Đầu Tư và bảng kê mới về số Đơn Vị Quỹ nắm giữ sẽ được gửi đến Nhà Đầu Tư.  \nLệnh Bán thành công của Nhà Đầu Tư hay Đại Lý Ký Danh sẽ được thông báo trong vòng 03 (ba) ngày làm việc sau Ngày Giao Dịch.  \nTrong thời hạn 5 ngày làm việc sau ngày giao dịch Chứng chỉ quỹ, Nhà Đầu tư sẽ nhận được tiền bán chứng chỉ quỹ vào tài khoản mà Nhà Đầu tư đã đăng ký khi thực hiện mua Chứng chỉ quỹ.  \n- **Lệnh Bán Tối Thiểu**  \nLệnh Bán tối thiểu là 10 (mười) Đơn Vị Quỹ. Trường hợp sau khi đặt bán, số lượng chứng chỉ quỹ còn lại nhỏ hơn số lượng bán tối thiểu, Nhà Đầu tư cần đặt bán toàn bộ để giảm số Đơn vị Quỹ nắm giữ về 0 (không).']","Ông Nhâm Hà Hải, Ông Đào Kiên Trung, Ông Trần Viết Thỏa."
Nhà đầu tư có những lựa chọn nào về việc nhận phân phối lợi nhuận (cổ tức)?,"Dựa trên thông tin được cung cấp từ các trang của bản cáo bạch, nhà đầu tư có hai lựa chọn chính về việc nhận phân phối lợi nhuận (cổ tức):

1. Nhà Đầu Tư có trong danh sách chốt tại Ngày Chốt Danh Sách được công bố bởi TCC cho việc chia cổ tức (""Ngày Chốt Danh Sách"") được xem là đủ điều kiện để nhận cổ tức.

2. Nhà Đầu Tư có thể chọn nhận phân phối lợi nhuận bằng tiền mặt hoặc bằng đơn vị quỹ (Đơn Vị Quỹ) theo quy định tại Điều lệ Quỹ và chính sách phân phối lợi nhuận được công bố trong Bản Cáo Bạch.

Thông tin này được lấy từ trang 39 của bản cáo bạch.","['# 5. Kế hoạch phân chia lợi nhuận\nNhà Đầu Tư có trong danh sách chốt trong số Đăng Ký tại Ngày Giao Dịch được công bố bởi TCC cho việc chia cổ tức (“Ngày Chốt Danh Sách”) được xem là đủ điều kiện để nhận cổ tức.  \nCổ tức sẽ được chi trả trong thời hạn 30 (ba mươi) ngày kể từ ngày được công bố và được chuyển vào tài khoản ngân hàng của Nhà Đầu Tư theo đăng ký trong Số Đăng Ký vào ngày thanh toán cổ tức, sau khi được khấu trừ các loại thuế có liên quan.  \nCổ tức được chi trả sẽ phải chịu thuế tùy thuộc vào nguồn gốc của thu nhập của Quỹ cũng như các loại thuế áp dụng cho Nhà Đầu Tư.', '## 2.2.7 Phương pháp lựa chọn đầu tư\n**Phương pháp lựa chọn đầu tư đối với các công cụ khác:**  \nQuỹ áp dụng phương pháp phù hợp với tính chất, đặc điểm của tài sản để có lựa chọn phù hợp.', '## 2.2.7 Phương pháp lựa chọn đầu tư\n**Phương pháp lựa chọn đầu tư đối với các công cụ thị trường tiền tệ:**  \nQuỹ lựa chọn các công cụ thị trường tiền tệ của các tổ chức tín dụng có khả năng mang lại lãi suất tốt, đồng thời xem xét đến thứ hạng tín dụng và định mức tín dụng phù hợp cho từng tổ chức tín dụng.  \n**Phương pháp lựa chọn đầu tư đối với trái phiếu và công cụ nợ:**  \nTrái phiếu và công cụ nợ được lựa chọn trên cơ sở phân tích, đánh giá dự án/chương trình được tài trợ bởi công cụ nợ kết hợp phân tích xu hướng lãi suất, đánh giá với mức lãi suất của công cụ nợ trong tương quan với mức độ chấp nhận rủi ro của nhà đầu tư, tính thanh khoản của trái phiếu, công cụ nợ hoặc chỉ số tín nhiệm tín dụng của tổ chức phát hành để lựa chọn danh mục đầu tư phù hợp.  \n**Phương pháp lựa chọn đầu tư đối với cổ phiếu:**', 'Nhà Đầu Tư nhận cổ tức bằng tiền có thể dùng để tái đầu tư:  \n- Lựa chọn Nhận Cổ Tức Bằng Tiền (“DPP”): Nhà Đầu Tư muốn nhận cổ tức bằng tiền cần phải nêu rõ lựa chọn của mình trong Đơn Đăng Ký mở tài khoản giao dịch.\n- Lựa chọn Tái Đầu tư Cổ tức (“DRIP”): Nhà Đầu Tư muốn dùng cổ tức để tái đầu tư sẽ nhận được thêm các Đơn Vị Quỹ. Cổ tức được trả cho Nhà Đầu Tư sẽ được tự động tái đầu tư tại NAV của Quỹ trong Ngày Giao Dịch liền sau ngày trả cổ tức. Số lượng các Đơn Vị Quỹ của Nhà Đầu Tư do đó sẽ tăng bằng với số cổ tức phải trả chia cho NAV vào Ngày Giao Dịch đó. Cổ tức được dùng để tái đầu tư giống như việc Nhà Đầu Tư nhận được cổ tức bằng tiền mặt và dùng số tiền đã nhận được để tái đầu tư và đồng thời:\n- Các khoản đầu tư dưới hình thức DRIP sẽ không phải trả Giá dịch vụ Phát hành.', '# 5. Kế hoạch phân chia lợi nhuận\nNhà Đầu Tư nhận cổ tức bằng tiền có thể dùng để tái đầu tư:  \n- Lựa chọn Nhận Cổ Tức Bằng Tiền (“DPP”): Nhà Đầu Tư muốn nhận cổ tức bằng tiền cần phải nêu rõ lựa chọn của mình trong Đơn Đăng Ký mở tài khoản giao dịch.\n- Lựa chọn Tái Đầu tư Cổ tức (“DRIP”): Nhà Đầu Tư muốn dùng cổ tức để tái đầu tư sẽ nhận được thêm các Đơn Vị Quỹ. Cổ tức được trả cho Nhà Đầu Tư sẽ được tự động tái đầu tư tại NAV của Quỹ trong Ngày Giao Dịch liền sau ngày trả cổ tức. Số lượng các Đơn Vị Quỹ của Nhà Đầu Tư do đó sẽ tăng bằng với số cổ tức phải trả chia cho NAV vào Ngày Giao Dịch đó. Cổ tức được dùng để tái đầu tư giống như việc Nhà Đầu Tư nhận được cổ tức bằng tiền mặt và dùng số tiền đã nhận được để tái đầu tư và đồng thời:\n- Các khoản đầu tư dưới hình thức DRIP sẽ không phải trả Giá dịch vụ Phát hành.', '## c) Tuân Thủ\n. Nhà Đầu Tư cần tham khảo các ý kiến tư vấn về luật và thuế để có thông tin phù hợp đối với các giao dịch của mình.', '. Nhà Đầu Tư cần tham khảo các ý kiến tư vấn về luật và thuế để có thông tin phù hợp đối với các giao dịch của mình.', '- Các khoản đầu tư dưới hình thức DRIP sẽ không phải trả Giá dịch vụ Phát hành.\n- Không phải trả Giá dịch vụ Mua lại hoặc Giá dịch vụ Chuyển Đổi đối với khoản đầu tư từ DRIP.  \nNhà Đầu Tư cần phải nêu rõ lựa chọn của mình trong hai lựa chọn trên, DPP hoặc DRIP, được ghi trong Đơn Đăng Ký. Nếu Nhà Đầu Tư không có sự lựa chọn, lựa chọn DRIP được tự động áp dụng.  \nĐại Hội Nhà Đầu Tư có thể phê duyệt cổ tức tại bất kỳ thời điểm nào và bất kỳ tần suất thanh toán nào (hàng quý, nửa năm, hàng năm) khi phù hợp. Tuy nhiên, sẽ không có sự đảm bảo nào về giá trị, tần suất, cũng như sự đều đặn của việc phân phối cổ tức. Việc phân phối cổ tức sẽ tùy thuộc vào lợi nhuận có thể phân phối và sự chấp thuận của Đại Hội Nhà Đầu Tư hoặc Ban Đại diện Quỹ (nếu được ủy quyền).', '# 5. Kế hoạch phân chia lợi nhuận\n- Các khoản đầu tư dưới hình thức DRIP sẽ không phải trả Giá dịch vụ Phát hành.\n- Không phải trả Giá dịch vụ Mua lại hoặc Giá dịch vụ Chuyển Đổi đối với khoản đầu tư từ DRIP.  \nNhà Đầu Tư cần phải nêu rõ lựa chọn của mình trong hai lựa chọn trên, DPP hoặc DRIP, được ghi trong Đơn Đăng Ký. Nếu Nhà Đầu Tư không có sự lựa chọn, lựa chọn DRIP được tự động áp dụng.  \nĐại Hội Nhà Đầu Tư có thể phê duyệt cổ tức tại bất kỳ thời điểm nào và bất kỳ tần suất thanh toán nào (hàng quý, nửa năm, hàng năm) khi phù hợp. Tuy nhiên, sẽ không có sự đảm bảo nào về giá trị, tần suất, cũng như sự đều đặn của việc phân phối cổ tức. Việc phân phối cổ tức sẽ tùy thuộc vào lợi nhuận có thể phân phối và sự chấp thuận của Đại Hội Nhà Đầu Tư hoặc Ban Đại diện Quỹ (nếu được ủy quyền).', 'a. Chính sách cổ tức Quỹ  \nCông ty quản lý quỹ được phân chia lợi nhuận của quỹ cho nhà đầu tư bằng tiền hoặc bằng chứng chỉ quỹ theo quy định tại điều lệ quỹ và chính sách phân chia lợi nhuận được công bố tại bản cáo bạch. Lợi nhuận phân chia được trích từ nguồn lợi nhuận để lại hoặc từ thu nhập của quỹ. Công ty quản lý quỹ chỉ được phân chia lợi nhuận khi quỹ đã hoàn thành hoặc có đủ năng lực tài chính để hoàn thành nghĩa vụ thuế và các nghĩa vụ tài chính khác theo quy định của pháp luật; trích lập đầy đủ các quỹ theo quy định tại điều lệ quỹ; ngay sau khi trả hết số lợi nhuận đã định, quỹ vẫn phải bảo đảm thanh toán đủ các khoản nợ, nghĩa vụ tài sản khác đến hạn. Lịch trình và kế hoạch thực hiện phải được công bố công khai trên trang thông tin điện tử của công ty quản lý quỹ.', 'Cổ tức sẽ được chi trả trong thời hạn 30 (ba mươi) ngày kể từ ngày được công bố và được chuyển vào tài khoản ngân hàng của Nhà Đầu Tư theo đăng ký trong Sổ Đăng Ký vào ngày thanh toán cổ tức, sau khi được khấu trừ các loại thuế có liên quan.  \nCổ tức được chi trả sẽ phải chịu thuế tùy thuộc vào nguồn gốc của thu nhập của Quỹ cũng như các loại thuế áp dụng cho Nhà Đầu Tư.', '## 2.2.7 Phương pháp lựa chọn đầu tư\n**Phương pháp lựa chọn đầu tư đối với cổ phiếu:**  \nQuỹ sử dụng phương pháp từ trên xuống (top-down approach), trong đó việc lựa chọn và phân bổ tài sản sẽ dựa trên đánh giá tổng thể về xu thế của kinh tế vĩ mô, chính sách của nhà nước, tiềm năng tăng trưởng và chính sách ngành. Từ đó, lập danh sách các chứng khoán tốt trong lĩnh vực Ngân hàng và dịch vụ tài chính phục vụ việc lựa chọn công ty sẽ đầu tư.  \nQuỹ cũng áp dụng phương pháp từ dưới lên (bottom-up approach), trong việc lựa chọn từng loại chứng khoán cụ thể thông qua việc phân tích công ty, bao gồm phân tích hiệu quả hoạt động sản xuất kinh doanh, đánh giá các chỉ số tài chính, đánh giá tiềm năng tăng trưởng, lợi thế cạnh tranh, bộ máy điều hành, quản trị doanh nghiệp, vv.', '# 5. Kế hoạch phân chia lợi nhuận\nCông ty quản lý quỹ được phân chia lợi nhuận của quỹ cho nhà đầu tư bằng tiền hoặc bằng đơn vị quỹ theo quy định tại điều lệ quỹ và chính sách phân chia lợi nhuận được công bố tại bản cáo bạch. Lợi nhuận phân chia được trích từ nguồn lợi nhuận để lại hoặc từ thu nhập của quỹ. Công ty quản lý quỹ chỉ được phân chia lợi nhuận khi quỹ đã hoàn thành hoặc có đủ năng lực tài chính để hoàn thành nghĩa vụ thuế và các nghĩa vụ tài chính khác theo quy định của pháp luật; trích lập đầy đủ các quỹ theo quy định tại điều lệ quỹ; ngay sau khi trả hết số lợi nhuận đã định, quỹ vẫn phải bảo đảm thanh toán đủ các khoản nợ, nghĩa vụ tài sản khác đến hạn. Lịch trình và kế hoạch thực hiện phải được công bố công khai trên trang thông tin điện tử của công ty quản lý quỹ.', 'nhóm chứng khoán có tiềm năng tăng trưởng tốt trong dài hạn và/hoặc doanh nghiệp có tính cạnh tranh tương đối cao, (ii) nhóm chứng khoán có mức định giá hấp dẫn, (iii) nhóm chứng khoán có lợi tức cao, ổn định.  \nNgoài ra, để đảm bảo tối ưu hóa lợi ích của nhà đầu tư, Quỹ có sự linh hoạt trong phân bổ tài sản tùy thuộc vào cơ hội đầu tư sẵn có tại các thời điểm khác nhau. Việc phân bổ tài sản có thể thay đổi đáng kể tùy thuộc vào nhận định của Quỹ, với mục tiêu xuyên suốt trong toàn bộ thời gian hoạt động của Quỹ là bảo vệ lợi ích của Nhà Đầu Tư.', '## b. Chính sách thuế\nNhà Đầu Tư nên tham khảo ý kiến tư vấn của các nhà tư vấn thuế chuyên nghiệp của mình đối với các nghĩa vụ thuế cụ thể và những vấn đề về tài chính của việc đầu tư vào Quỹ.', '## 3. Giá dịch vụ và thưởng hoạt động\nNhà Đầu Tư được khuyến khích nắm giữ các Đơn Vị Quỹ như một phần của các khoản đầu tư dài hạn và chương trình tiết kiệm hưu trí. Quỹ mở không được thiết kế cho mục đích mua bán ngắn hạn. Việc Nhà Đầu Tư thường xuyên mua đi và bán lại Đơn Vị Quỹ, vốn được thiết kế để đạt được lợi nhuận dài hạn sẽ ảnh hưởng đến mục tiêu lợi nhuận của Nhà Đầu Tư khi đầu tư vào Quỹ cũng như lợi nhuận của Quỹ.  \nGiá dịch vụ Mua lại và các khoản giá dịch vụ ngân hàng và thuế khác (nếu có) sẽ được trừ vào khoản tiền thu được từ bán Đơn Vị Quỹ của Nhà Đầu Tư.', '## 3. Báo cáo bất thường\nCác báo cáo bất thường sẽ được cung cấp cho Nhà Đầu Tư trong trường hợp có những diễn biến hoặc hoạt động bất thường của Quỹ phát sinh, bao gồm nhưng không giới hạn bởi các báo cáo về việc phân phối lợi nhuận, báo cáo trước khi hợp nhất hoặc sáp nhập quỹ hay sau các quyết định của Đại Hội Nhà Đầu Tư ủy quyền cho Ban Đại Diện Quỹ.', 'Nhà Đầu Tư nên tham khảo ý kiến của chuyên gia tư vấn riêng của mình để đảm bảo Nhà Đầu Tư đủ điều kiện để đầu tư vào Quỹ theo các quy định pháp luật áp dụng cho họ và liệu Quỹ có phù hợp với khả năng chấp nhận rủi ro của họ hay không.', 'Nhà Đầu Tư có trong danh sách chốt trong số Đăng Ký tại Ngày Giao Dịch được công bố bởi TCC cho việc chia cổ tức (“Ngày Chốt Danh Sách”) được xem là đủ điều kiện để nhận cổ tức.  \n39', '## 2. Thông tin về đợt phát hành lần đầu ra công chúng\nNgoài ra, để đảm bảo tối ưu hóa lợi ích của nhà đầu tư, Quỹ có sự linh hoạt trong phân bổ tài sản tùy thuộc vào cơ hội đầu tư sẵn có tại các thời điểm khác nhau. Việc phân bổ tài sản có thể thay đổi đáng kể tùy thuộc vào nhận định của Quỹ, với mục tiêu xuyên suốt trong toàn bộ thời gian hoạt động của Quỹ là bảo vệ lợi ích của Nhà Đầu Tư.  \nVới chiến lược đầu tư như đã đề cập ở trên, cơ cấu danh mục đầu tư của Quỹ có thể thay đổi theo thời gian dựa theo tiềm năng tăng trưởng của cổ phiếu và tùy vào mức độ thanh khoản của các cổ phiếu trên thị trường. Tỷ trọng các khoản đầu tư không vượt quá những hạn chế đầu tư quy định tại mục “Hạn chế đầu tư”.  \nCác loại tài sản mà quỹ được đầu tư bao gồm:\ni. Tiền gửi tại các ngân hàng thương mại theo quy định của pháp luật về  |', '## 2.5.3. Thông tin về các mức giá dịch vụ\nNhà Đầu Tư được khuyến khích nắm giữ các Đơn Vị Quỹ như một phần của các khoản đầu tư dài hạn và chương trình tiết kiệm lưu trí. Quỹ mở không được thiết kế cho mục đích mua bán ngắn hạn. Việc Nhà Đầu Tư thường xuyên mua đi và bán lại Đơn Vị Quỹ, vốn được thiết kế để đạt được lợi nhuận dài hạn sẽ ảnh hưởng đến mục tiêu lợi nhuận của Nhà Đầu Tư khi đầu tư vào Quỹ cũng như lợi nhuận của Quỹ.', 'Nhà Đầu Tư có thể thanh toán số tiền mua Đơn Vị Quỹ từ tài khoản ngân hàng của mình vào tài khoản của Quỹ để Ngân Hàng Giám Sát nhận được đúng hạn và Đại Lý Phân Phối hoàn thành xử lý việc đăng ký với Đại Lý Chuyển Nhượng. Mọi khoản đầu tư vào Đơn Vị Quỹ đều thực hiện bằng tiền Đồng Việt Nam.  \nTrong trường hợp lệnh mua chứng chỉ quỹ và việc thanh toán cho lệnh mua được thực hiện bởi cá nhân, tổ chức khác không phải nhà đầu tư thì phiếu lệnh và tài liệu xác nhận thanh toán phải nêu rõ tên, số tài khoản và giá trị thanh toán của nhà đầu tư được hưởng lợi.', '## THÔNG BÁO QUAN TRỌNG\nCác nhà đầu tư nên nghiên cứu Bản Cáo Bạch này một cách cẩn trọng và toàn diện và không nên coi nội dung hoặc các tóm tắt ở đây là các tư vấn liên quan đến pháp lý, thuế, hoặc tài chính/đầu tư và nên tham khảo ý kiến chuyên gia tư vấn của mình về các yêu cầu pháp lý hoặc các điều kiện hoặc bất kỳ các hạn chế nào khác liên quan đến việc đăng ký mua, mua, cho tặng, nắm giữ, định đoạt (chuyển nhượng; chuyển đổi quỹ hoặc bản hoặc chuyển đổi thành tiền) các Đơn Vị Quỹ, việc xử lý khoản thu nhập (nếu có), lợi nhuận đầu tư, hoặc các khoản phân phối lợi nhuận, các khoản thuế khác liên quan đến việc đăng ký mua, mua, cho tặng, nắm giữ, định đoạt (bản, chuyển giao, chuyển đổi quỹ hoặc bản hoặc chuyển đổi thành tiền) các Đơn Vị Quỹ trong phạm vi lãnh thổ tài phán áp dụng đối với quốc tịch, nơi cư trú', '## c) Tuân Thủ\nNhà Đầu Tư phải đảm bảo rằng số tiền đầu tư phải từ nguồn hợp pháp và không có nguồn gốc từ các hành vi vi phạm Pháp Luật cũng như không vi phạm các điều khoản của Luật áp dụng đối với thuế thu nhập, quy định về AML, chống tham nhũng, chống hối lộ và/hoặc các luật áp dụng khác ban hành bởi chính phủ Việt Nam hay chính phủ sở tại của nhà đầu tư ở các thời điểm khác nhau.', '## 2.4.7. Quy trình chuyển nhượng chứng chỉ quỹ\nNhà Đầu Tư muốn thực hiện Chuyển Nhượng hoặc người thừa hưởng thừa kế trong trường hợp thừa kế có thể nộp Lệnh Chuyển Nhượng tại bất kỳ Điểm Nhận Lệnh nào. Lệnh Chuyển Nhượng']",Lựa chọn Nhận Cổ Tức Bằng Tiền (DPP) hoặc Lựa chọn Tái Đầu tư Cổ tức (DRIP).
"Nếu nhà đầu tư không chọn phương thức nhận cổ tức cụ thể, Quỹ sẽ áp dụng phương thức mặc định nào?","Nếu nhà đầu tư không chọn phương thức nhận cổ tức cụ thể, Quỹ sẽ áp dụng phương thức mặc định là nhận cổ tức dưới dạng tiền mặt. Thông tin này được lấy từ nguồn 1, trang 5.

(Nguồn: Trang 5)","['## 2.2.7 Phương pháp lựa chọn đầu tư\n**Phương pháp lựa chọn đầu tư đối với các công cụ khác:**  \nQuỹ áp dụng phương pháp phù hợp với tính chất, đặc điểm của tài sản để có lựa chọn phù hợp.', '# 5. Kế hoạch phân chia lợi nhuận\nNhà Đầu Tư có trong danh sách chốt trong số Đăng Ký tại Ngày Giao Dịch được công bố bởi TCC cho việc chia cổ tức (“Ngày Chốt Danh Sách”) được xem là đủ điều kiện để nhận cổ tức.  \nCổ tức sẽ được chi trả trong thời hạn 30 (ba mươi) ngày kể từ ngày được công bố và được chuyển vào tài khoản ngân hàng của Nhà Đầu Tư theo đăng ký trong Số Đăng Ký vào ngày thanh toán cổ tức, sau khi được khấu trừ các loại thuế có liên quan.  \nCổ tức được chi trả sẽ phải chịu thuế tùy thuộc vào nguồn gốc của thu nhập của Quỹ cũng như các loại thuế áp dụng cho Nhà Đầu Tư.', 'Cổ tức sẽ được chi trả trong thời hạn 30 (ba mươi) ngày kể từ ngày được công bố và được chuyển vào tài khoản ngân hàng của Nhà Đầu Tư theo đăng ký trong Sổ Đăng Ký vào ngày thanh toán cổ tức, sau khi được khấu trừ các loại thuế có liên quan.  \nCổ tức được chi trả sẽ phải chịu thuế tùy thuộc vào nguồn gốc của thu nhập của Quỹ cũng như các loại thuế áp dụng cho Nhà Đầu Tư.', '# 5. Kế hoạch phân chia lợi nhuận\nNhà Đầu Tư nhận cổ tức bằng tiền có thể dùng để tái đầu tư:  \n- Lựa chọn Nhận Cổ Tức Bằng Tiền (“DPP”): Nhà Đầu Tư muốn nhận cổ tức bằng tiền cần phải nêu rõ lựa chọn của mình trong Đơn Đăng Ký mở tài khoản giao dịch.\n- Lựa chọn Tái Đầu tư Cổ tức (“DRIP”): Nhà Đầu Tư muốn dùng cổ tức để tái đầu tư sẽ nhận được thêm các Đơn Vị Quỹ. Cổ tức được trả cho Nhà Đầu Tư sẽ được tự động tái đầu tư tại NAV của Quỹ trong Ngày Giao Dịch liền sau ngày trả cổ tức. Số lượng các Đơn Vị Quỹ của Nhà Đầu Tư do đó sẽ tăng bằng với số cổ tức phải trả chia cho NAV vào Ngày Giao Dịch đó. Cổ tức được dùng để tái đầu tư giống như việc Nhà Đầu Tư nhận được cổ tức bằng tiền mặt và dùng số tiền đã nhận được để tái đầu tư và đồng thời:\n- Các khoản đầu tư dưới hình thức DRIP sẽ không phải trả Giá dịch vụ Phát hành.', 'Nhà Đầu Tư nhận cổ tức bằng tiền có thể dùng để tái đầu tư:  \n- Lựa chọn Nhận Cổ Tức Bằng Tiền (“DPP”): Nhà Đầu Tư muốn nhận cổ tức bằng tiền cần phải nêu rõ lựa chọn của mình trong Đơn Đăng Ký mở tài khoản giao dịch.\n- Lựa chọn Tái Đầu tư Cổ tức (“DRIP”): Nhà Đầu Tư muốn dùng cổ tức để tái đầu tư sẽ nhận được thêm các Đơn Vị Quỹ. Cổ tức được trả cho Nhà Đầu Tư sẽ được tự động tái đầu tư tại NAV của Quỹ trong Ngày Giao Dịch liền sau ngày trả cổ tức. Số lượng các Đơn Vị Quỹ của Nhà Đầu Tư do đó sẽ tăng bằng với số cổ tức phải trả chia cho NAV vào Ngày Giao Dịch đó. Cổ tức được dùng để tái đầu tư giống như việc Nhà Đầu Tư nhận được cổ tức bằng tiền mặt và dùng số tiền đã nhận được để tái đầu tư và đồng thời:\n- Các khoản đầu tư dưới hình thức DRIP sẽ không phải trả Giá dịch vụ Phát hành.', '- Các khoản đầu tư dưới hình thức DRIP sẽ không phải trả Giá dịch vụ Phát hành.\n- Không phải trả Giá dịch vụ Mua lại hoặc Giá dịch vụ Chuyển Đổi đối với khoản đầu tư từ DRIP.  \nNhà Đầu Tư cần phải nêu rõ lựa chọn của mình trong hai lựa chọn trên, DPP hoặc DRIP, được ghi trong Đơn Đăng Ký. Nếu Nhà Đầu Tư không có sự lựa chọn, lựa chọn DRIP được tự động áp dụng.  \nĐại Hội Nhà Đầu Tư có thể phê duyệt cổ tức tại bất kỳ thời điểm nào và bất kỳ tần suất thanh toán nào (hàng quý, nửa năm, hàng năm) khi phù hợp. Tuy nhiên, sẽ không có sự đảm bảo nào về giá trị, tần suất, cũng như sự đều đặn của việc phân phối cổ tức. Việc phân phối cổ tức sẽ tùy thuộc vào lợi nhuận có thể phân phối và sự chấp thuận của Đại Hội Nhà Đầu Tư hoặc Ban Đại diện Quỹ (nếu được ủy quyền).', '# 5. Kế hoạch phân chia lợi nhuận\n- Các khoản đầu tư dưới hình thức DRIP sẽ không phải trả Giá dịch vụ Phát hành.\n- Không phải trả Giá dịch vụ Mua lại hoặc Giá dịch vụ Chuyển Đổi đối với khoản đầu tư từ DRIP.  \nNhà Đầu Tư cần phải nêu rõ lựa chọn của mình trong hai lựa chọn trên, DPP hoặc DRIP, được ghi trong Đơn Đăng Ký. Nếu Nhà Đầu Tư không có sự lựa chọn, lựa chọn DRIP được tự động áp dụng.  \nĐại Hội Nhà Đầu Tư có thể phê duyệt cổ tức tại bất kỳ thời điểm nào và bất kỳ tần suất thanh toán nào (hàng quý, nửa năm, hàng năm) khi phù hợp. Tuy nhiên, sẽ không có sự đảm bảo nào về giá trị, tần suất, cũng như sự đều đặn của việc phân phối cổ tức. Việc phân phối cổ tức sẽ tùy thuộc vào lợi nhuận có thể phân phối và sự chấp thuận của Đại Hội Nhà Đầu Tư hoặc Ban Đại diện Quỹ (nếu được ủy quyền).', 'Nhà Đầu Tư có thể thanh toán số tiền mua Đơn Vị Quỹ từ tài khoản ngân hàng của mình vào tài khoản của Quỹ để Ngân Hàng Giám Sát nhận được đúng hạn và Đại Lý Phân Phối hoàn thành xử lý việc đăng ký với Đại Lý Chuyển Nhượng. Mọi khoản đầu tư vào Đơn Vị Quỹ đều thực hiện bằng tiền Đồng Việt Nam.  \nTrong trường hợp lệnh mua chứng chỉ quỹ và việc thanh toán cho lệnh mua được thực hiện bởi cá nhân, tổ chức khác không phải nhà đầu tư thì phiếu lệnh và tài liệu xác nhận thanh toán phải nêu rõ tên, số tài khoản và giá trị thanh toán của nhà đầu tư được hưởng lợi.', '## 2.2.7 Phương pháp lựa chọn đầu tư\n**Phương pháp lựa chọn đầu tư đối với các công cụ thị trường tiền tệ:**  \nQuỹ lựa chọn các công cụ thị trường tiền tệ của các tổ chức tín dụng có khả năng mang lại lãi suất tốt, đồng thời xem xét đến thứ hạng tín dụng và định mức tín dụng phù hợp cho từng tổ chức tín dụng.  \n**Phương pháp lựa chọn đầu tư đối với trái phiếu và công cụ nợ:**  \nTrái phiếu và công cụ nợ được lựa chọn trên cơ sở phân tích, đánh giá dự án/chương trình được tài trợ bởi công cụ nợ kết hợp phân tích xu hướng lãi suất, đánh giá với mức lãi suất của công cụ nợ trong tương quan với mức độ chấp nhận rủi ro của nhà đầu tư, tính thanh khoản của trái phiếu, công cụ nợ hoặc chỉ số tín nhiệm tín dụng của tổ chức phát hành để lựa chọn danh mục đầu tư phù hợp.  \n**Phương pháp lựa chọn đầu tư đối với cổ phiếu:**', 'a. Chính sách cổ tức Quỹ  \nCông ty quản lý quỹ được phân chia lợi nhuận của quỹ cho nhà đầu tư bằng tiền hoặc bằng chứng chỉ quỹ theo quy định tại điều lệ quỹ và chính sách phân chia lợi nhuận được công bố tại bản cáo bạch. Lợi nhuận phân chia được trích từ nguồn lợi nhuận để lại hoặc từ thu nhập của quỹ. Công ty quản lý quỹ chỉ được phân chia lợi nhuận khi quỹ đã hoàn thành hoặc có đủ năng lực tài chính để hoàn thành nghĩa vụ thuế và các nghĩa vụ tài chính khác theo quy định của pháp luật; trích lập đầy đủ các quỹ theo quy định tại điều lệ quỹ; ngay sau khi trả hết số lợi nhuận đã định, quỹ vẫn phải bảo đảm thanh toán đủ các khoản nợ, nghĩa vụ tài sản khác đến hạn. Lịch trình và kế hoạch thực hiện phải được công bố công khai trên trang thông tin điện tử của công ty quản lý quỹ.', '## 2.2.7 Phương pháp lựa chọn đầu tư\n**Phương pháp lựa chọn đầu tư đối với cổ phiếu:**  \nQuỹ sử dụng phương pháp từ trên xuống (top-down approach), trong đó việc lựa chọn và phân bổ tài sản sẽ dựa trên đánh giá tổng thể về xu thế của kinh tế vĩ mô, chính sách của nhà nước, tiềm năng tăng trưởng và chính sách ngành. Từ đó, lập danh sách các chứng khoán tốt trong lĩnh vực Ngân hàng và dịch vụ tài chính phục vụ việc lựa chọn công ty sẽ đầu tư.  \nQuỹ cũng áp dụng phương pháp từ dưới lên (bottom-up approach), trong việc lựa chọn từng loại chứng khoán cụ thể thông qua việc phân tích công ty, bao gồm phân tích hiệu quả hoạt động sản xuất kinh doanh, đánh giá các chỉ số tài chính, đánh giá tiềm năng tăng trưởng, lợi thế cạnh tranh, bộ máy điều hành, quản trị doanh nghiệp, vv.', 'Nhà Đầu Tư có thể thanh toán số tiền mua Đơn Vị Quỹ bằng cách chuyển khoản từ tài khoản ngân hàng của mình hoặc nộp tiền trực tiếp vào tài khoản của Quỹ để Ngân Hàng Giám Sát nhận được đúng hạn và Đại Lý Phân Phối hoàn thành xử lý việc đăng ký với Đại Lý Chuyển Nhượng. Mọi khoản đầu tư vào Đơn Vị Quỹ đều thực hiện bằng tiền Đồng Việt Nam.  \nTrong trường hợp lệnh mua chứng chỉ quỹ và việc thanh toán cho lệnh mua được thực hiện bởi cá nhân, tổ chức khác không phải nhà đầu tư thì phiếu lệnh và tài liệu xác nhận thanh toán phải nêu rõ tên, số tài khoản và giá trị thanh toán của nhà đầu tư được hưởng lợi.  \n- **Tuân Thủ**', 'Trong trường hợp Quỹ nhận được số tiền mua thấp hơn lệnh đăng ký mua và không nhận được yêu cầu chuyển trả từ khách hàng, số tiền mua sẽ tiếp tục được giữ lại để chờ yêu cầu giao dịch tiếp theo từ khách hàng.  \nTrong trường hợp Nhà Đầu Tư có nhiều lệnh mua Chứng Chỉ Quỹ cùng một lúc, Lệnh Mua Chứng Chỉ Quỹ sẽ được ưu tiên theo thứ tự đặt lệnh.  \nPhí/giá dịch vụ chuyển tiền (nếu có) được trừ vào số tiền hoàn trả cho Nhà Đầu Tư. Đơn Vị Quỹ sẽ chỉ được ghi nhận vào tài khoản của Nhà Đầu Tư hay của Đại Lý Kỷ Danh sau khi có kết quả giao dịch chứng chỉ quỹ.', '# i. Chương trình Đầu tư Định kỳ\n- Trong trường hợp Nhà Đầu Tư muốn sử dụng tiền không hợp lệ ở trên để mua chứng chỉ quỹ tại các kỳ giao dịch bình thường không phải là kỳ giao dịch theo Chương trình ĐTĐK thì Nhà Đầu Tư sẽ phải thực hiện quy trình theo Mục 2.4.4. Quy trình mua chứng chỉ quỹ.  \n- Trong trường hợp Nhà Đầu Tư muốn giữ lại và tiếp tục để chờ cho kỳ giao dịch theo Chương trình ĐKĐT tiếp theo thì Nhà Đầu Tư cần phải đảm bảo nộp bổ sung phần còn thiếu trước thời điểm đóng số lệnh của ngày giao dịch theo Chương trình ĐKĐT.  \n- Trong trường hợp nhận được yêu cầu chuyển trả cụ thể từ Nhà Đầu tư hoặc không nhận được yêu cầu chuyển trả từ Nhà Đầu Tư, số tiền không hợp lệ ở trên sẽ được chuyển trả', '## Lĩnh vực được phép đầu tư\nVới chiến lược đầu tư như đã đề cập ở trên, cơ cấu danh mục đầu tư của Quỹ có thể thay đổi theo thời gian dựa theo tiềm năng tăng trưởng của cổ phiếu và tùy vào mức độ thanh khoản của các cổ phiếu trên thị trường. Tỷ trọng các khoản đầu tư không vượt quá những hạn chế đầu tư quy định tại mục “Hạn chế đầu tư”.', '- Trong trường hợp Nhà Đầu Tư muốn sử dụng tiền không hợp lệ ở trên để mua chứng chỉ quỹ tại các kỳ giao dịch bình thường không phải là kỳ giao dịch theo Chương trình ĐTĐK thì Nhà Đầu Tư sẽ phải thực hiện quy trình theo Mục 2.4.4 Quy trình mua chứng chỉ quỹ.\n- Trong trường hợp Nhà Đầu Tư muốn giữ lại và tiếp tục để chờ cho kỳ giao dịch theo Chương trình ĐKĐT tiếp theo thì Nhà Đầu Tư cần phải đảm bảo nộp bổ sung phần còn thiếu trước thời điểm đóng số lệnh của ngày giao dịch theo Chương trình ĐKĐT.', 'Nhà Đầu Tư nên tham khảo ý kiến của chuyên gia tư vấn riêng của mình để đảm bảo Nhà Đầu Tư đủ điều kiện để đầu tư vào Quỹ theo các quy định pháp luật áp dụng cho họ và liệu Quỹ có phù hợp với khả năng chấp nhận rủi ro của họ hay không.', 'Trong trường hợp Quỹ nhận được số tiền mua thấp hơn Phiếu lệnh mua và không nhận được yêu cầu chuyển trả từ khách hàng, số tiền mua sẽ tiếp tục được giữ lại để chờ yêu cầu giao dịch tiếp theo từ khách hàng.  \nTrong trường hợp Nhà Đầu Tư có nhiều lệnh mua Chứng Chỉ Quỹ cùng một lúc, Lệnh Mua Chứng Chỉ Quỹ sẽ được ưu tiên theo thứ tự đặt lệnh.  \nPhí/giá dịch vụ chuyển tiền (nếu có) được trừ vào số tiền hoàn trả cho Nhà Đầu Tư. Đơn Vị Quỹ sẽ chỉ được ghi nhận vào tài khoản của Nhà Đầu Tư hay của Đại Lý Ký Danh sau khi có kết quả giao dịch chứng chỉ quỹ.', '## 3. Giá dịch vụ và thưởng hoạt động\nNhà Đầu Tư được khuyến khích nắm giữ các Đơn Vị Quỹ như một phần của các khoản đầu tư dài hạn và chương trình tiết kiệm hưu trí. Quỹ mở không được thiết kế cho mục đích mua bán ngắn hạn. Việc Nhà Đầu Tư thường xuyên mua đi và bán lại Đơn Vị Quỹ, vốn được thiết kế để đạt được lợi nhuận dài hạn sẽ ảnh hưởng đến mục tiêu lợi nhuận của Nhà Đầu Tư khi đầu tư vào Quỹ cũng như lợi nhuận của Quỹ.  \nGiá dịch vụ Mua lại và các khoản giá dịch vụ ngân hàng và thuế khác (nếu có) sẽ được trừ vào khoản tiền thu được từ bán Đơn Vị Quỹ của Nhà Đầu Tư.', '## 2. Thông tin về đợt phát hành lần đầu ra công chúng\nNgoài ra, để đảm bảo tối ưu hóa lợi ích của nhà đầu tư, Quỹ có sự linh hoạt trong phân bổ tài sản tùy thuộc vào cơ hội đầu tư sẵn có tại các thời điểm khác nhau. Việc phân bổ tài sản có thể thay đổi đáng kể tùy thuộc vào nhận định của Quỹ, với mục tiêu xuyên suốt trong toàn bộ thời gian hoạt động của Quỹ là bảo vệ lợi ích của Nhà Đầu Tư.  \nVới chiến lược đầu tư như đã đề cập ở trên, cơ cấu danh mục đầu tư của Quỹ có thể thay đổi theo thời gian dựa theo tiềm năng tăng trưởng của cổ phiếu và tùy vào mức độ thanh khoản của các cổ phiếu trên thị trường. Tỷ trọng các khoản đầu tư không vượt quá những hạn chế đầu tư quy định tại mục “Hạn chế đầu tư”.  \nCác loại tài sản mà quỹ được đầu tư bao gồm:\ni. Tiền gửi tại các ngân hàng thương mại theo quy định của pháp luật về  |', '- Không đầu tư quá 30% tổng giá trị tài sản của quỹ vào các chứng chỉ quỹ đại chúng, cổ phiếu công ty đầu tư chứng khoán đại chúng;  \nxi. Quỹ chỉ được đầu tư tiền gửi, công cụ tiền tệ quy định tại điểm i và ii các loại tài sản Quỹ được phép đầu tư được phát hành bởi các tổ chức tín dụng trong danh sách đã được Ban Đại Diện Quỹ phê duyệt bằng văn bản hoặc thông qua bỏ phiếu điện tử (e-voting) tuân thủ theo các Quy định Pháp luật hiện hành.  \nCơ cấu đầu tư của Quỹ được phép sai lệch so với các hạn chế được đưa ra tại điểm i, ii, iii, iv, v, vi và ix nếu trên nhưng chỉ vì các lý do sau:  \n- Biến động giá trên thị trường của các tài sản trong danh mục đầu tư của Quỹ;  \n- Thực hiện các khoản thanh toán phù hợp với Pháp Luật của Quỹ;  \n- Thực hiện các lệnh giao dịch của Nhà Đầu Tư;', '## 2.3. Đặc trưng của chứng chỉ Quỹ đầu tư\nNhà đầu tư của Quỹ là cá nhân, tổ chức trong và ngoài nước, sở hữu chứng chỉ quỹ. Nhà đầu tư không chịu trách nhiệm pháp lý hoặc nghĩa vụ khác ngoài trách nhiệm trong phạm vi số chứng chỉ Quỹ mà họ sở hữu. Nhà đầu tư là tổ chức bao gồm các tổ chức kinh tế và xã hội được pháp luật Việt Nam công nhận.  \nNhà đầu tư pháp nhân cử người đại diện hợp pháp đại diện cho số Chứng chỉ quỹ mà mình sở hữu. Việc đề cử, hủy bỏ hay thay thế người đại diện này phải được thông báo bằng văn bản, do người đại diện có thẩm quyền của nhà đầu tư tổ chức ký.', '## Lĩnh vực được phép đầu tư\nđ) Cổ phiếu chào bán lần đầu ra công chúng, trái phiếu chào bán ra công chúng; trái phiếu doanh nghiệp phát hành riêng lẻ bởi tổ chức niêm yết có bảo lãnh thanh toán của tổ chức tín dụng hoặc cam kết mua lại của tổ chức phát hành tối thiểu 1 lần trong 12 tháng và mỗi lần cam kết mua lại tối thiểu 30% giá trị đợt phát hành;  \ne) Chứng khoán phải sinh niêm yết giao dịch tại Sở giao dịch chứng khoán và chỉ nhằm mục tiêu phòng ngừa rủi ro cho chứng khoán cơ sở mà quỹ đang nắm giữ;  \ng) Quyền phát sinh gắn liền với chứng khoán mà quỹ đang nắm giữ.  \nViệc đầu tư vào các tài sản quy định tại điểm đ khoản 2.2.3 Điều này phải đáp ứng các điều kiện sau:  \n- Có quy định tại Điều lệ quỹ và Bản cáo bạch;', 'Trong các trường hợp tạm dừng thực hiện các giao dịch Đơn Vị Quỹ, Lệnh Chuyển Đổi đã nhận sẽ được thực hiện tại NAV tại Ngày Giao Dịch đầu tiên sau khi giao dịch được thực hiện trở lại.  \n**g. Quy trình chuyển nhượng chứng chỉ quỹ**  \n- **Đơn Chuyển Nhượng**  \nNhà Đầu Tư có thể Chuyển Nhượng Đơn Vị Quỹ cho nhà đầu tư khác dưới dạng quà tặng, thừa kế hoặc thực hiện lệnh của toà án. Chuyển Nhượng chỉ được thực hiện dưới dạng số lượng Đơn  \n55', '## THÔNG BÁO QUAN TRỌNG\nthành tiền) các Đơn Vị Quỹ trong phạm vi lãnh thổ tài phán áp dụng đối với quốc tịch, nơi cư trú của mình hoặc theo luật pháp của bất kỳ quốc gia hay lãnh thổ nào áp dụng cho Nhà Đầu Tư hoặc bất kỳ quỹ được quản lý nào được sử dụng để mua Đơn Vị Quỹ, và xác định các vấn đề có thể phát sinh liên quan đến pháp lý, thuế, tài chính hay các vấn đề khác từ việc mua và nắm giữ Đơn Vị Quỹ trước khi quyết định đăng ký mua Đơn Vị Quỹ']",Lựa chọn Tái Đầu tư Cổ tức (DRIP) sẽ được tự động áp dụng.
Công ty quản lý quỹ có được phép sử dụng vốn của Quỹ để cho vay không?,"Theo tài liệu cung cấp, tôi không tìm thấy thông tin về việc công ty quản lý quỹ có được phép sử dụng vốn của Quỹ để cho vay hay không. Tuy nhiên, dựa trên các quy định chung về hoạt động của quỹ đầu tư chứng khoán, việc sử dụng vốn của quỹ để cho vay thường bị hạn chế và phải tuân thủ các quy định cụ thể.

Nếu bạn cần thông tin chính xác hơn, tôi khuyên bạn nên tham khảo Điều lệ Quỹ hoặc liên hệ trực tiếp với công ty quản lý quỹ.","['## 2.2.6 Hoạt động vay, cho vay, giao dịch mua bán lại và giao dịch ký quỹ\nCông ty Quản Lý Quỹ không được sử dụng vốn và tài sản của Quỹ để cho vay hoặc bảo lãnh cho bất kỳ khoản vay nào.  \nCông ty Quản Lý Quỹ không được phép vay để đầu tư, trừ trường hợp vay ngắn hạn theo quy định của pháp luật về ngân hàng để trang trải các chi phí cần thiết cho quỹ hoặc thực hiện thanh toán các giao dịch chứng chỉ quỹ với Nhà Đầu Tư. Tổng giá trị các khoản vay ngắn hạn của Quỹ không được quá 5% giá trị tài sản ròng của quỹ tại mọi thời điểm và thời hạn vay tối đa là 30 ngày.  \nCông ty Quản Lý Quỹ không được sử dụng tài sản của quỹ để thực hiện các giao dịch ký quỹ (vay mua chứng khoán) cho quỹ hoặc cho bất kỳ cá nhân, tổ chức khác; không được sử dụng tài sản của quỹ thực hiện các giao dịch bán khổng, cho vay chứng khoán.', '## 2.10. Tiêu chí lựa chọn, quyền hạn và trách nhiệm của Công ty Quản lý quỹ\nCông ty Quản Lý Quỹ được lựa chọn phải thỏa mãn các điều kiện sau:  \n- Được thực hiện nghiệp vụ Quản Lý Quỹ;\n- Hoàn toàn độc lập với Ngân Hàng Giám Sát;\n- Có đầy đủ cơ sở vật chất, nhân sự để Quản Lý Quỹ mở;\n- Đồng ý thực hiện các cam kết đối với Quỹ như nêu tại Phụ Lục 1 và Phụ Lục 3 của Điều lệ Quỹ.  \nCác quy định về quyền và nghĩa vụ, chấm dứt quyền và nghĩa vụ, hạn chế hoạt động của Công ty Quản lý quỹ tuân thủ theo quy định tại Chương VI Điều lệ Quỹ.', 'Công ty Quản Lý Quỹ để Nhà Đầu Tư có thể tham khảo.', '## 2.3. Đặc trưng của chứng chỉ Quỹ đầu tư\nCông ty quản lý quỹ thực hiện hoặc ủy quyền cho tổ chức cung cấp dịch vụ đại lý chuyển nhượng lập và quản lý số đăng ký nhà đầu tư chính (sổ chính) hoặc ủy quyền đại lý ký danh lập, quản lý đăng ký nhà đầu tư phụ (sổ phụ) và xác nhận quyền sở hữu chứng chỉ quỹ cho nhà đầu tư.  \nSố đăng ký nhà đầu tư của Quỹ có thể là văn bản, tập dữ liệu điện tử hoặc cả hai. Các nội dung của Số đăng ký nhà đầu tư được quy định chi tiết tại điều 15 Điều lệ Quỹ.', '# 5. Kế hoạch phân chia lợi nhuận\nCông ty quản lý quỹ được phân chia lợi nhuận của quỹ cho nhà đầu tư bằng tiền hoặc bằng đơn vị quỹ theo quy định tại điều lệ quỹ và chính sách phân chia lợi nhuận được công bố tại bản cáo bạch. Lợi nhuận phân chia được trích từ nguồn lợi nhuận để lại hoặc từ thu nhập của quỹ. Công ty quản lý quỹ chỉ được phân chia lợi nhuận khi quỹ đã hoàn thành hoặc có đủ năng lực tài chính để hoàn thành nghĩa vụ thuế và các nghĩa vụ tài chính khác theo quy định của pháp luật; trích lập đầy đủ các quỹ theo quy định tại điều lệ quỹ; ngay sau khi trả hết số lợi nhuận đã định, quỹ vẫn phải bảo đảm thanh toán đủ các khoản nợ, nghĩa vụ tài sản khác đến hạn. Lịch trình và kế hoạch thực hiện phải được công bố công khai trên trang thông tin điện tử của công ty quản lý quỹ.', '# XII. XUNG ĐỘT LỢI ÍCH\nCông Ty Quản Lý Quỹ có nghĩa vụ, theo Điều lệ và theo thông lệ quốc tế tốt nhất, tại mọi thời điểm hoạt động vì lợi ích của Nhà Đầu Tư và quản lý một cách công bằng, minh bạch đối với tất cả các quỹ do Công ty quản lý. Bộ phận kiểm soát nội bộ và quản trị rủi ro của Công Ty sẽ chịu trách nhiệm theo dõi và giám sát các xung đột lợi ích thực tế hoặc có khả năng xảy ra. Trong trường hợp xung đột lợi ích phát sinh, Công ty Quản lý Quỹ sẽ thông báo cho Ban Đại Diện Quỹ để thống nhất phương án khắc phục nhằm giảm thiểu hoặc quản lý các xung đột đó.', '- Thực hiện các lệnh giao dịch của Nhà Đầu Tư;  \n- Các hoạt động sáp nhập, hợp nhất của các tổ chức phát hành các chứng khoán mà Quỹ đang nắm giữ;  \n- Quỹ mới được cấp phép thành lập hoặc do tách Quỹ, hợp nhất Quỹ, sát nhập Quỹ mà thời gian hoạt động không quá sáu (06) tháng, tính từ ngày được cấp giấy chứng nhận đăng ký lập Quỹ;  \n- Quỹ đang trong thời gian giải thể.  \nTrong trường hợp xảy ra sai lệch so với các hạn mức đầu tư, Công ty Quản Lý Quỹ sẽ điều chỉnh danh mục đầu tư để đáp ứng các hạn mức đầu tư kể trên trong vòng 3 (ba) tháng kể từ ngày mà sai lệch phát sinh.', '## 3. Các rủi ro khi đầu tư vào Quỹ\nMục tiêu của Công Ty Quản Lý Quỹ là quản lý các rủi ro đầu tư, và nếu có thể, hạn chế tác động của các rủi ro này bằng việc áp dụng các phương pháp quản lý đầu tư theo tiêu chuẩn quốc tế tốt nhất. Nhà Đầu Tư cần lưu ý các điểm quan trọng sau đây:  \n- Quỹ, Công Ty Quản Lý Quỹ, thành viên Hội đồng thành viên, ban điều hành và nhân viên Công Ty Quản Lý Quỹ không có bất kỳ sự đảm bảo nào đối với vốn đầu tư ban đầu cũng như mức lợi nhuận từ đầu tư của Quỹ;\n- Không có bất kỳ sự bảo đảm nào về sổ lần chi trả và giá trị của cổ tức được thanh toán trong tương lai;  \n42', '- Không đầu tư quá 30% tổng giá trị tài sản của quỹ vào các chứng chỉ quỹ đại chúng, cổ phiếu công ty đầu tư chứng khoán đại chúng;  \nxi. Quỹ chỉ được đầu tư tiền gửi, công cụ tiền tệ quy định tại điểm i và ii các loại tài sản Quỹ được phép đầu tư được phát hành bởi các tổ chức tín dụng trong danh sách đã được Ban Đại Diện Quỹ phê duyệt bằng văn bản hoặc thông qua bỏ phiếu điện tử (e-voting) tuân thủ theo các Quy định Pháp luật hiện hành.  \nCơ cấu đầu tư của Quỹ được phép sai lệch so với các hạn chế được đưa ra tại điểm i, ii, iii, iv, v, vi và ix nếu trên nhưng chỉ vì các lý do sau:  \n- Biến động giá trên thị trường của các tài sản trong danh mục đầu tư của Quỹ;  \n- Thực hiện các khoản thanh toán phù hợp với Pháp Luật của Quỹ;  \n- Thực hiện các lệnh giao dịch của Nhà Đầu Tư;', '## 2.12. Kiểm toán, kế toán và chế độ báo cáo\nCông ty Quản Lý Quỹ có trách nhiệm duy trì sổ sách kế toán và chuẩn bị báo cáo tài chính cho Quỹ. Phù hợp với quy định tại Điều 38 của Điều Lệ Quỹ, Công ty Quản Lý Quỹ có thể ủy quyền cho một nhà cung cấp dịch vụ để thực hiện Công việc này. Mọi Sổ sách kế toán và báo cáo tài chính của Quỹ sẽ được lưu tại văn phòng của Công ty Quản Lý Quỹ hoặc của nhà cung cấp dịch vụ mà Công ty Quản Lý Quỹ ủy quyền. Ban Đại diện Quỹ có quyền kiểm tra bất kỳ báo cáo, sổ sách kế toán, hoặc tài liệu nào của Quỹ.  \nCác quy định khác liên quan đến kiểm toán, kế toán và chế độ báo cáo tuân thủ theo quy định tại Điều lệ Quỹ.', '# II. CÁC ĐỊNH NGHĨA\n“Quỹ” có nghĩa là Quỹ Đầu Tư Cổ phiếu Doanh nghiệp vừa và nhỏ Techcom, một loại hình Quỹ đầu tư chứng khoán dạng mở do Công ty Quản Lý Quỹ quản lý chào bán Chứng Chỉ Quỹ ra công chúng và được thành lập theo các quy định hiện hành về chứng khoán tại Việt Nam và Điều lệ này.  \n“Công ty Quản Lý Quỹ” có nghĩa là Công ty Cổ phần Quản Lý Quỹ Kỹ thương, được thành lập theo giấy phép thành lập và hoạt động Số 40/UBCK-GP do Chủ tịch Ủy ban Chứng khoán Nhà nước cấp ngày 21/10/2008 và được cấp lại Giấy phép thành lập và hoạt động Số 57/GP-UBCK do UBCKNN cấp ngày 30/01/2019 do chuyển đổi loại hình từ công ty TNHH sang công ty cổ phần.', '1  \nỦy ban Chứng khoán Nhà nước cấp giấy phép phát hành chứng chỉ quỹ ra công chúng có nghĩa là việc xin phép lập Quỹ và phát hành chứng chỉ quỹ đầu tư đã thực hiện theo các quy định của pháp luật liên quan, không hàm ý bảo đảm về nội dung của Bản cáo bạch cũng như mục tiêu, chiến lược đầu tư của Quỹ.', '## VI. CÔNG TY KIỂM TOÁN\nCông ty kiểm toán được lựa chọn phải được thành lập và hoạt động phù hợp với quy định của Pháp Luật và không được là người có liên quan của Công Ty Quản Lý Quỹ và Ngân Hàng Giám Sát. Năm đầu tiên, công ty kiểm toán của Quỹ sẽ được Công Ty Quản Lý Quỹ để cử để Đại Hội Nhà Đầu Tư thông qua. Các năm sau đó, Đại Hội Nhà Đầu Tư ủy quyền cho Ban Đại Diện Quỹ thông qua việc lựa chọn công ty kiểm toán. Công Ty Quản Lý Quỹ sẽ đề xuất với Ban Đại Diện quỹ ít nhất 02 (hai) công ty kiểm toán để lựa chọn cho Quỹ.', '## 2. Điều lệ Quỹ tóm tắt\nCơ quan quyền lực cao nhất của Quỹ là Đại hội Nhà Đầu tư.  \nBan Đại diện Quỹ sẽ do Đại hội Nhà Đầu tư bầu ra để giám sát các hoạt động thường xuyên của Quỹ, TCC và Ngân hàng giám sát.  \n#### 2.1.2 Tổng vốn huy động và số lượng chứng chỉ Quỹ được chào bán  \nVốn Điều lệ được huy động trong lần đầu chào bán ra công chúng của Quỹ là 50.000.000.000 VNĐ (Năm mươi tỷ đồng). Vốn Điều lệ sẽ được chia thành 5.000.000 (Năm triệu) Chứng chỉ Quỹ. Mệnh giá của một Chứng chỉ Quỹ sẽ là 10.000 VNĐ (mười nghìn Đồng Việt Nam).  \nNhà đầu tư góp vốn bằng tiền Đồng Việt Nam dưới hình thức chuyển khoản hoặc chuyển tiền vào tài khoản của Quỹ mở tại ngân hàng giám sát.  \nSố lượng chứng chỉ quỹ/tổng chứng chỉ quỹ được phép lưu hành tối đa: không hạn chế.', '## 3. Giá dịch vụ và thưởng hoạt động\nCác loại phí/dịch vụ và chi phí/giá dịch vụ liên quan trực tiếp đến việc giao dịch Đơn Vị Quỹ sẽ do Nhà Đầu Tư trả và không được tính vào chi phí của Quỹ. Công Ty Quản Lý Quỹ bảo lưu quyền thay đổi biểu phí/giá dịch vụ này.  \nCác khoản giá dịch vụ giao dịch như sau:', '## 2.5.3. Thông tin về các mức giá dịch vụ\nCác loại phí/dịch vụ và chi phí/giá dịch vụ liên quan trực tiếp đến việc giao dịch Đơn Vị Quỹ sẽ do Nhà Đầu Tư trả và không được tính vào chi phí của Quỹ. Công Ty Quản Lý Quỹ bảo lưu quyền thay đổi biểu phí/giá dịch vụ này.  \nCác khoản giá dịch vụ giao dịch như sau:', '## 2.3. Đặc trưng của chứng chỉ Quỹ đầu tư\nNhà đầu tư của Quỹ là cá nhân, tổ chức trong và ngoài nước, sở hữu chứng chỉ quỹ. Nhà đầu tư không chịu trách nhiệm pháp lý hoặc nghĩa vụ khác ngoài trách nhiệm trong phạm vi số chứng chỉ Quỹ mà họ sở hữu. Nhà đầu tư là tổ chức bao gồm các tổ chức kinh tế và xã hội được pháp luật Việt Nam công nhận.  \nNhà đầu tư pháp nhân cử người đại diện hợp pháp đại diện cho số Chứng chỉ quỹ mà mình sở hữu. Việc đề cử, hủy bỏ hay thay thế người đại diện này phải được thông báo bằng văn bản, do người đại diện có thẩm quyền của nhà đầu tư tổ chức ký.', '## 2.2.4 Hạn mức đầu tư\n- Không đầu tư vào quá 10% tổng số chứng chỉ quỹ đang lưu hành của một quỹ đại chúng, cổ phiếu đang lưu hành của một công ty đầu tư chứng khoán đại chúng;\n- Không đầu tư quá 20% tổng giá trị tài sản của quỹ vào chứng chỉ quỹ của một quỹ đại chúng, cổ phiếu của một công ty đầu tư chứng khoán đại chúng;\n- Không đầu tư quá 30% tổng giá trị tài sản của quỹ vào các chứng chỉ quỹ đại chúng, cổ phiếu công ty đầu tư chứng khoán đại chúng;  \nk) Không được đầu tư trực tiếp vào bất động sản, đá quý, kim loại quý hiếm;  \nl) Phải có chứng khoán của ít nhất 06 tổ chức phát hành.', '## 4. Các chỉ tiêu hoạt động\nCông ty quản lý quỹ sẽ công bố thông tin về tỷ lệ chi phí hoạt động quỹ và tốc độ vòng quay danh mục trong báo cáo tài chính bán niên và báo cáo tài chính năm được công bố trên trang thông tin điện tử của Công ty quản lý quỹ.', '## 2.2.4 Hạn mức đầu tư\nHạn mức đầu tư của Quỹ được quy định chi tiết tuân thủ các quy định tại Thông tư hướng dẫn hoạt động và quản lý các quỹ đầu tư chứng khoán. Cơ cấu danh mục đầu tư của Quỹ phải bảo đảm tuân thủ các hạn mức đầu tư sau:  \na) Trừ tiền gửi trên tài khoản thanh toán của quỹ tại ngân hàng giám sát, quỹ mở không được đầu tư quá 49% tổng giá trị tài sản của quỹ vào các tài sản theo quy định tại điểm a, b mục IX.2.2.3  \nb) Không được đầu tư vào chứng khoán của một tổ chức phát hành quá 10% tổng giá trị chứng khoán đang lưu hành của tổ chức đó, trừ công cụ nợ của Chính phủ;  \nc) Không được đầu tư quá 20% tổng giá trị tài sản của quỹ vào chứng khoán đang lưu hành và các tài sản (nếu có) quy định tại điểm a, b mục IX.2.2.3 của một tổ chức phát hành, trừ công cụ nợ của Chính phủ;', 'a. Chính sách cổ tức Quỹ  \nCông ty quản lý quỹ được phân chia lợi nhuận của quỹ cho nhà đầu tư bằng tiền hoặc bằng chứng chỉ quỹ theo quy định tại điều lệ quỹ và chính sách phân chia lợi nhuận được công bố tại bản cáo bạch. Lợi nhuận phân chia được trích từ nguồn lợi nhuận để lại hoặc từ thu nhập của quỹ. Công ty quản lý quỹ chỉ được phân chia lợi nhuận khi quỹ đã hoàn thành hoặc có đủ năng lực tài chính để hoàn thành nghĩa vụ thuế và các nghĩa vụ tài chính khác theo quy định của pháp luật; trích lập đầy đủ các quỹ theo quy định tại điều lệ quỹ; ngay sau khi trả hết số lợi nhuận đã định, quỹ vẫn phải bảo đảm thanh toán đủ các khoản nợ, nghĩa vụ tài sản khác đến hạn. Lịch trình và kế hoạch thực hiện phải được công bố công khai trên trang thông tin điện tử của công ty quản lý quỹ.', '“Ban Đại Diện Quỹ”\nlà những người đại diện cho Nhà Đầu Tư được Đại Hội Nhà Đầu Tư bầu ra để thay mặt Nhà Đầu Tư thực hiện việc giám sát các hoạt động của Quỹ, Công ty Quản Lý Quỹ và Ngân Hàng Giám Sát.  \n“Vốn Điều lệ”\nlà tổng số vốn bằng tiền do các Nhà Đầu Tư thực góp trong đợt phát hành Chứng Chỉ Quỹ lần đầu ra công chúng và được ghi trong Điều lệ.  \n“Chứng Chỉ Quỹ”\nLà loại chứng khoán xác nhận quyền sở hữu của nhà đầu tư đối với một phần vốn góp tại quỹ. Mệnh giá 01 chứng chỉ quỹ là 10.000 đồng.  \n“Giá bán/ Giá phát hành”', 'vi. Chứng khoán phái sinh niêm yết, giao dịch tại các Sở Giao dịch Chứng khoán, và chỉ nhằm mục tiêu phòng ngừa rủi ro cho chứng khoán cơ sở mà quỹ đang nắm giữ.  \nvii. Quyền phát sinh gắn liền với chứng khoán mà Quỹ đang nắm giữ.  |\n| --- | --- |\n|  Cơ cấu đầu tư | Các khoản đầu tư của Quỹ sẽ được đa dạng hóa và đáp ứng được các điều kiện của pháp luật. Cơ cấu danh mục đầu tư của Quỹ phải bảo đảm tuân thủ các nguyên tắc sau:  \ni. Cơ cấu danh mục đầu tư của quỹ mở phải bao gồm chứng khoán của ít nhất sáu (06) tổ chức phát hành, đồng thời phải bảo đảm:', '## Lĩnh vực được phép đầu tư\nDanh mục đầu tư của quỹ phải phù hợp với mục tiêu và chính sách đầu tư đã được quy định tại Điều lệ quỹ và công bố tại Bản cáo bạch. Danh mục đầu tư của quỹ đầu tư bao gồm các loại tài sản sau đây:  \na) Tiền gửi các ngân hàng thương mại theo quy định của pháp luật ngân hàng;  \nb) Công cụ thị trường tiền tệ bao gồm giấy tờ có giá, công cụ chuyển nhượng theo quy định của pháp luật;  \nc) Công cụ nợ của Chính phủ, trái phiếu được Chính phủ bảo lãnh, trái phiếu chính quyền địa phương;  \nd) Cổ phiếu niêm yết, cổ phiếu đăng ký giao dịch, trái phiếu niêm yết trên Sở giao dịch chứng khoán, chứng chỉ quỹ đại chúng;', '## d) Chấp Nhận Hợp đồng mở tài khoản giao dịch chứng khoán và đăng ký giao dịch quỹ mở\nCông Ty Quản Lý Quỹ có toàn quyền chấp nhận hay từ chối bất kỳ Hợp đồng nào theo các điều khoản của Điều Lệ, Bản Cáo Bạch và các quy định về KYC và AML và không có nghĩa vụ phải cung cấp lý do từ chối cho nhà đầu tư. Các Lệnh Mua sẽ được thực hiện vào Ngày Giao Dịch kế tiếp.  \nTrong trường hợp Công Ty Quản Lý Quỹ từ chối Lệnh Mua, tiền mua sẽ được chuyển trả lại (không có lãi) cho Nhà Đầu Tư hoặc bên chuyển tiền không hợp lệ trong vòng 05 (năm) ngày làm việc kể từ kỳ giao dịch Chứng Chỉ Quỹ áp dụng.  \nTrong trường hợp số tiền mua Quỹ nhận được nhiều hơn Phiếu lệnh mua, số tiền dự nếu không nhận được yêu cầu chuyển trả từ khách hàng sẽ tiếp tục được giữ lại để chờ yêu cầu giao dịch tiếp theo từ khách hàng.  \n27']",Không. Công ty Quản Lý Quỹ không được sử dụng vốn và tài sản của Quỹ để cho vay hoặc bảo lãnh.
