user_input,retrieved_contexts,response,reference,faithfulness,answer_relevancy,context_precision,context_recall
Trong trường hợp nào việc thực hiện lệnh bán của nhà đầu tư có thể bị thực hiện một phần (prorated)?,"['## 2.4.6. Quy trình chuyển đổi quỹ\nNhà Đầu Tư cần lưu ý rằng Lệnh Chuyển Đổi có thể chỉ được thực hiện một phần nếu Lệnh Bán nằm trong Lệnh Chuyển Đổi chỉ được thực hiện một phần. Các trường hợp Lệnh Bán chỉ được thực hiện một phần được quy định chi tiết tại mục 2.4.5.e. Phần chưa được thực hiện của Lệnh Chuyển Đổi được thực hiện một phần sẽ bị hủy.', '## f) Tạm dừng thực hiện Lệnh Bán\nNhà Đầu Tư cần lưu ý rằng trong một số trường hợp, các Lệnh Bán cùng với tất cả các lệnh khác có thể bị tạm dừng thực hiện. Các trường hợp này được quy định chi tiết tại mục 2.4.8.  \nTrong trường hợp các lệnh giao dịch Đơn Vị Quỹ bị tạm dừng thực hiện, Lệnh Bán đã nhận sẽ được thực hiện tại NAV tại Ngày Giao Dịch đầu tiên sau khi giao dịch được thực hiện trở lại.  \n29', '## e) Thực Hiện Một Phần Lệnh Bán\nSố lượng Chứng Chỉ Quỹ Nhà Đầu Tư được thực hiện trong trường hợp thực hiện một phần Lệnh Bán cũng áp dụng nguyên tắc của Lệnh Bán tối thiểu nêu trên. Phần lệnh chưa được thực hiện và các lệnh đến sau thời điểm đóng số lệnh sẽ tự động bị hủy. Nhà Đầu Tư có thể thực hiện tiếp các lệnh bán của mình bằng cách đăng ký giao dịch tại ngày giao dịch tiếp theo.', '## e) Thực Hiện Một Phần Lệnh Bán\nTrong các trường hợp sau, Quỹ chỉ có thể thực hiện một phần Lệnh Bán và Chuyến Đổi Quỹ của Nhà Đầu Tư:  \n- Tổng giá trị của các Lệnh Bán (bao gồm cả Lệnh Bán từ hoạt động Chuyến Đổi Quỹ) trừ đi tổng giá trị của tất cả các Lệnh Mua (bao gồm cả Lệnh Mua từ hoạt động Chuyến Đổi Quỹ) tại Ngày Giao Dịch lớn hơn 10% của giá trị tài sản ròng của Quỹ (NAV); hoặc\n- Việc thực hiện tất cả các lệnh giao dịch của Nhà Đầu Tư tại Ngày Giao Dịch dẫn đến NAV của Quỹ thấp hơn 50.000.000.000 đồng (năm mươi tỷ đồng); hoặc Giá trị phần đơn vị quỹ hoặc số đơn vị quỹ còn lại trên tài khoản của nhà đầu tư thấp hơn giá trị tối thiểu hoặc số lượng đơn vị quỹ tối thiểu để duy trì tài khoản của nhà đầu tư theo quy định tại Điều lệ quỹ và Bán cáo bạch.', '## e) Tạm Dừng Thực Hiện Lệnh Mua\nNhà Đầu Tư cần lưu ý rằng trong một số trường hợp các Lệnh Mua của Nhà Đầu Tư cùng với tất cả các Lệnh Mua khác có thể bị tạm dừng thực hiện. Các trường hợp này được liệt kê trong mục 2.4.8 dưới đây.  \nTrong trường hợp các giao dịch Đơn Vị Quỹ bị tạm dừng, Lệnh Mua sẽ được thực hiện vào Ngày Giao Dịch đầu tiên sau khi giao dịch được thực hiện trở lại.', 'Công Ty Quản Lý Quỹ có quyền thay đổi các mức bán tối thiểu trong từng thời điểm.  \nNhà Đầu Tư cần lưu ý là trong một số trường hợp Lệnh Bán sẽ không thể thực hiện toàn bộ hoặc Lệnh Bán có thể bị tạm dừng thực hiện.  \n- **Số Dư Tài Khoản Tối Thiểu**  \nKhông áp dụng.  \n- **Thực Hiện Một Phần Lệnh Bán**  \nTrong các trường hợp sau, Quỹ chỉ có thể thực hiện một phần Lệnh Bán và Chuyến Đổi Quỹ của Nhà Đầu Tư:  \n- Tổng giá trị của các Lệnh Bán (bao gồm cả Lệnh Bán từ hoạt động Chuyến Đổi Quỹ) trừ đi tổng giá trị của tất cả các Lệnh Mua (bao gồm cả Lệnh Mua từ hoạt động Chuyến Đổi Quỹ) tại Ngày Giao Dịch lớn hơn 10% của giá trị tài sản ròng của Quỹ (NAV); hoặc', '## e) Thực Hiện Một Phần Lệnh Bán\n- Trường hợp thực hiện một phần Lệnh Bán, Lệnh mua, Lệnh Chuyến Đổi Quỹ theo quy định nêu trên, Công ty Quản Lý Quỹ áp dụng nguyên tắc phân phối cùng tỷ lệ: Phần giá trị được thực hiện sẽ được phân bổ cho tất cả nhà đầu tư đăng ký giao dịch theo cùng một tỷ lệ giữa giá trị thực hiện và giá trị đăng ký giao dịch.  \nSố lượng chứng chỉ quỹ được thực hiện trong trường hợp này được tính như sau:  \nSố lượng CCQ NĐT được thực hiện = Số lượng CCQ NĐT đăng ký bán * [Tổng số lượng CCQ mà CTQLQ có thể đáp ứng cho lệnh bán của NĐT/Tổng số lượng CCQ đăng ký bán trong kỳ]', '- Việc thực hiện tất cả các lệnh giao dịch của Nhà Đầu Tư tại Ngày Giao Dịch dẫn đến NAV của Quỹ thấp hơn 50.000.000.000 đồng (năm mươi tỷ đồng); hoặc Giá trị phần đơn vị quỹ hoặc số đơn vị quỹ còn lại trên tài khoản của nhà đầu tư thấp hơn giá trị tối thiểu hoặc số lượng đơn vị quỹ tối thiểu để duy trì tài khoản của nhà đầu tư theo quy định tại Điều lệ quỹ và Bán cáo bạch.\n- Trường hợp thực hiện một phần Lệnh Bán, Lệnh mua, Lệnh Chuyến Đổi Quỹ theo quy định nêu trên, Công ty Quản Lý Quỹ áp dụng nguyên tắc phân phối cùng tỷ lệ: Phần giá trị được thực hiện sẽ được phân bổ cho tất cả nhà đầu tư đăng ký giao dịch theo cùng một tỷ lệ giữa giá trị thực hiện và giá trị đăng ký giao dịch.  \nSố lượng chứng chỉ quỹ được thực hiện trong trường hợp này được tính như sau:', '## 2.4.6. Quy trình chuyển đổi quỹ\nTrong một vài trường hợp Lệnh Chuyển Đổi cùng các lệnh khác có thể bị tạm dừng thực hiện. Các trường hợp được này được nêu tại mục 2.4.8.  \nTrong các trường hợp tạm dừng thực hiện các giao dịch Đơn Vị Quỹ, Lệnh Chuyển Đổi đã nhận sẽ được thực hiện tại NAV tại Ngày Giao Dịch đầu tiên sau khi giao dịch được thực hiện trở lại.', '## f) Lệnh Mua Tối Thiểu\nĐại Lý Phân Phối sẽ xử lý tất cả các Lệnh Bản nhận trước Thời Điểm Đóng Số Lệnh và gửi lệnh giao dịch tổng hợp tới Đại lý Chuyển Nhượng để thực hiện giao dịch cho Ngày Giao Dịch kế tiếp, và đảm bảo các thông tin trong Lệnh Bản đầy đủ và nhất quán và Nhà Đầu Tư có đủ số Đơn Vị Quỹ trong tài khoản để bán. Nhà Đầu tư có thể đặt bán số Chứng Chỉ Quỹ tối đa bằng số lượng Chứng Chỉ Quỹ mà mình sở hữu. Khoản tiền bán ròng sẽ được chuyển trả cho Nhà Đầu Tư. Lệnh Bản không thuộc trường hợp được thực hiện một phần bởi các điều kiện liên quan đến Lệnh Bản một phần như để trong các mục dưới đây sẽ được giao dịch tại NAV tại Ngày Giao Dịch trừ đi Giá dịch vụ Mua lại, giá dịch vụ chuyển tiền và thuế (nếu có), dựa trên ngày giờ nhận Lệnh Bản tại Điểm Nhận Lệnh, theo ngày giờ xác nhận tại Điểm Nhận Lệnh', '## e. Quy trình bán chứng chỉ quỹ\nĐại Lý Phân Phối sẽ xử lý tất cả các Lệnh Bản nhận trước Thời Điểm Đóng Số Lệnh và gửi lệnh giao dịch tổng hợp tới Đại lý Chuyển Nhượng để thực hiện giao dịch cho Ngày Giao Dịch kế tiếp, và đảm bảo các thông tin trong Lệnh Bản đầy đủ và nhất quán và Nhà Đầu Tư có đủ số Đơn Vị Quỹ trong tài khoản để bán. Nhà Đầu tư có thể đặt bản số Chứng Chỉ Quỹ tối đa bằng số lượng Chứng Chỉ Quỹ mà mình sở hữu. Khoản tiền bán ròng sẽ được chuyển trả cho Nhà Đầu Tư. Lệnh Bản không thuộc trường hợp được thực hiện một phần bởi các điều kiện liên quan đến Lệnh Bản một phần như để trong các mục dưới đây sẽ được giao dịch tại NAV tại Ngày Giao Dịch trừ đi Giá dịch vụ Mua lại, giá dịch vụ chuyển tiền và thuế (nếu có), dựa trên ngày giờ nhận Lệnh Bản tại Điểm Nhận Lệnh, theo ngày giờ xác nhận tại Điểm Nhận Lệnh', 'Lệnh Mua thành công của Nhà Đầu Tư hay Đại Lý Kỷ Danh sẽ được thông báo trong vòng 03 (ba) ngày làm việc sau Ngày Giao Dịch, số lượng Đơn Vị Quỹ sẽ được làm tròn xuống đến hai số thập phân sau dấu phẩy. Số Đơn Vị Quỹ lẻ sẽ không ảnh hưởng đến khả năng bán lại Đơn Vị Quỹ của Nhà Đầu Tư.  \n- **Tạm Dừng Thực Hiện Lệnh Mua**  \nNhà Đầu Tư cần lưu ý rằng trong một số trường hợp các Lệnh Mua của Nhà Đầu Tư cùng với tất cả các Lệnh Mua khác có thể bị tạm dừng thực hiện. Các trường hợp này được liệt kê trong mục 2.4.8.  \nTrong trường hợp các giao dịch Đơn Vị Quỹ bị tạm dừng, Lệnh Mua sẽ được thực hiện vào Ngày Giao Dịch đầu tiên sau khi giao dịch được thực hiện trở lại.  \n- **Lệnh Mua Tối Thiểu**  \nMức đầu tư tối thiểu (tính theo giá trị Lệnh Mua) là 10.000 VNĐ (Mười nghìn đồng)', 'Sau khi thực hiện các Lệnh Bán Được Chấp Nhận, số Đơn Vị Quỹ đã bán sẽ được trù ra từ tổng số Đơn Vị Quỹ trong tài khoản của Nhà Đầu Tư và bảng kê mới về số Đơn Vị Quỹ nắm giữ sẽ được gửi đến Nhà Đầu Tư.  \nLệnh Bán thành công của Nhà Đầu Tư hay Đại Lý Ký Danh sẽ được thông báo trong vòng 03 (ba) ngày làm việc sau Ngày Giao Dịch.  \nTrong thời hạn 5 ngày làm việc sau ngày giao dịch Chứng chỉ quỹ, Nhà Đầu tư sẽ nhận được tiền bán chứng chỉ quỹ vào tài khoản mà Nhà Đầu tư đã đăng ký khi thực hiện mua Chứng chỉ quỹ.  \n- **Lệnh Bán Tối Thiểu**  \nLệnh Bán tối thiểu là 10 (mười) Đơn Vị Quỹ. Trường hợp sau khi đặt bán, số lượng chứng chỉ quỹ còn lại nhỏ hơn số lượng bán tối thiểu, Nhà Đầu tư cần đặt bán toàn bộ để giảm số Đơn vị Quỹ nắm giữ về 0 (không).', '## 3.6. Rủi ro về biến động giá\nRủi ro về biến động giá của Quỹ phát sinh khi một hay một số Nhà Đầu Tư đang nắm giữ một số lượng lớn Đơn Vị Quỹ quyết định thực hiện Lệnh Bản các Đơn Vị Quỹ này cùng lúc. Điều này có thể ảnh hưởng bất lợi tới giá của Đơn Vị Quỹ nếu các Lệnh Bản này đòi hỏi Công Ty Quản Lý Quỹ phải thoái vốn các khoản đầu tư tại mức giá thấp. Các quy định về thực hiện một phần lệnh bán và tạm dừng lệnh bán có thể giảm thiểu rủi ro biến động giá của Quỹ.', '## c) Lệnh Bán Tối Thiểu\nLệnh Bán tối thiểu là 10 (mười) Đơn Vị Quỹ. Trường hợp sau khi đặt bán, số lượng chứng chỉ quỹ còn lại nhỏ hơn số lượng bán tối thiểu, Nhà Đầu tư cần đặt bán toàn bộ để giảm số Đơn vị Quỹ nắm giữ về 0 (không).  \nCông Ty Quản Lý Quỹ có quyền thay đổi các mức bán tối thiểu trong từng thời điểm.  \nNhà Đầu Tư cần lưu ý là trong một số trường hợp Lệnh Bán sẽ không thể thực hiện toàn bộ hoặc Lệnh Bán có thể bị tạm dừng thực hiện.', 'Trong trường hợp Quỹ nhận được số tiền mua thấp hơn Phiếu lệnh mua và không nhận được yêu cầu chuyển trả từ khách hàng, số tiền mua sẽ tiếp tục được giữ lại để chờ yêu cầu giao dịch tiếp theo từ khách hàng.  \nTrong trường hợp Nhà Đầu Tư có nhiều lệnh mua Chứng Chỉ Quỹ cùng một lúc, Lệnh Mua Chứng Chỉ Quỹ sẽ được ưu tiên theo thứ tự đặt lệnh.  \nPhí/giá dịch vụ chuyển tiền (nếu có) được trừ vào số tiền hoàn trả cho Nhà Đầu Tư. Đơn Vị Quỹ sẽ chỉ được ghi nhận vào tài khoản của Nhà Đầu Tư hay của Đại Lý Ký Danh sau khi có kết quả giao dịch chứng chỉ quỹ.', 'Trong trường hợp Quỹ nhận được số tiền mua thấp hơn lệnh đăng ký mua và không nhận được yêu cầu chuyển trả từ khách hàng, số tiền mua sẽ tiếp tục được giữ lại để chờ yêu cầu giao dịch tiếp theo từ khách hàng.  \nTrong trường hợp Nhà Đầu Tư có nhiều lệnh mua Chứng Chỉ Quỹ cùng một lúc, Lệnh Mua Chứng Chỉ Quỹ sẽ được ưu tiên theo thứ tự đặt lệnh.  \nPhí/giá dịch vụ chuyển tiền (nếu có) được trừ vào số tiền hoàn trả cho Nhà Đầu Tư. Đơn Vị Quỹ sẽ chỉ được ghi nhận vào tài khoản của Nhà Đầu Tư hay của Đại Lý Kỷ Danh sau khi có kết quả giao dịch chứng chỉ quỹ.', 'Trong các trường hợp tạm dừng thực hiện các giao dịch Đơn Vị Quỹ, Lệnh Chuyển Đổi đã nhận sẽ được thực hiện tại NAV tại Ngày Giao Dịch đầu tiên sau khi giao dịch được thực hiện trở lại.  \n**g. Quy trình chuyển nhượng chứng chỉ quỹ**  \n- **Đơn Chuyển Nhượng**  \nNhà Đầu Tư có thể Chuyển Nhượng Đơn Vị Quỹ cho nhà đầu tư khác dưới dạng quà tặng, thừa kế hoặc thực hiện lệnh của toà án. Chuyển Nhượng chỉ được thực hiện dưới dạng số lượng Đơn  \n55', '## f) Lệnh Mua Tối Thiểu\n#### a) Phiếu Lệnh Bản  \nNhà Đầu Tư có thể bán Đơn Vị Quỹ vào bất kỳ Ngày Giao Dịch nào bằng cách nộp Lệnh Bản tới một Điểm Nhận Lệnh bất kỳ trước Thời Điểm Đóng Số Lệnh cho Ngày Giao Dịch đó. Phiếu Lệnh Bản được đính kèm theo Đơn Đăng Ký hoặc có sẵn tại các Điểm Nhận Lệnh. Tất cả các Phiếu Lệnh Bản phải được ký tên đầy đủ.  \n#### b) Quy Trình Xử lý Lệnh Bản  \nNhà Đầu Tư có thể đặt Lệnh Bản số Đơn Vị Quỹ muốn bán, lẻ đến 2 số thập phân và đảm bảo số lượng chứng chỉ quỹ còn lại sau khi đặt bán không nhỏ hơn số lượng bán tối thiểu.', '## e. Quy trình bán chứng chỉ quỹ\n- **Phiếu Lệnh Bản**  \nNhà Đầu Tư có thể bán Đơn Vị Quỹ vào bất kỳ Ngày Giao Dịch nào bằng cách nộp Lệnh Bản tới một Điểm Nhận Lệnh bất kỳ trước Thời Điểm Đóng Số Lệnh cho Ngày Giao Dịch đó. Phiếu Lệnh Bản được đính kèm theo Đơn Đăng Ký hoặc có sẵn tại các Điểm Nhận Lệnh. Tất cả các Phiếu Lệnh Bản phải được ký tên đầy đủ.  \n- **Quy Trình Xử lý Lệnh Bản**  \nNhà Đầu Tư có thể đặt Lệnh Bản số Đơn Vị Quỹ muốn bán, lẻ đến 2 số thập phân và đảm bảo số lượng chứng chỉ quỹ còn lại sau khi đặt bản không nhỏ hơn số lượng bán tối thiểu.', '## 2.2.5 Điều chỉnh danh mục đầu tư\nCơ cấu đầu tư của quỹ mở chỉ được vượt mức so với các hạn chế đầu tư đã quy định tại điểm a, b, c, d, đ, e và i mục IX.2.2.4 và chỉ do các nguyên nhân sau:  \na) Biến động giá trên thị trường của tài sản trong danh mục đầu tư của quỹ;  \nb) Thực hiện các khoản thanh toán của quỹ theo quy định của pháp luật, bao gồm việc thực hiện lệnh giao dịch của nhà đầu tư;', '- **Tạm dừng thực hiện Lệnh Bản**  \nNhà Đầu Tư cần lưu ý rằng trong một số trường hợp, các Lệnh Bản cùng với tất cả các lệnh khác có thể bị tạm dừng thực hiện. Các trường hợp này được quy định chi tiết tại mục 2.4.8.  \nTrong trường hợp các lệnh giao dịch Đơn Vị Quỹ bị tạm dừng thực hiện, Lệnh Bản đã nhận sẽ được thực hiện tại NAV tại Ngày Giao Dịch đầu tiên sau khi giao dịch được thực hiện trở lại.  \n**f. Quy trình chuyển đổi quỹ**  \n- **Phiếu Lệnh Chuyển Đổi Quỹ**  \nNhà Đầu Tư có thể chuyển đổi sang Quỹ khác do Công Ty Quản Lý Quỹ quản lý bằng Lệnh Chuyển Đổi. Phiếu Lệnh Chuyển Đổi được đính kèm theo Đơn Đăng Ký, hoặc có tại Điểm Nhận Lệnh. Đối với Lệnh Chuyển Đổi, toàn bộ tiền bán Đơn Vị Quỹ của Quỹ này sau khi trừ phí và thuế (nếu có), sẽ dùng để mua Đơn Vị Quỹ của Quỹ khác.', 'Lệnh Chuyển Đổi được đặt bằng số lượng Đơn Vị Quỹ.  \n- **Mức Tối Thiểu Cho Lệnh Chuyển Đổi**  \nLệnh Bản chuyển đổi và Lệnh Mua chuyển đổi cũng áp dụng quy định về Lệnh Bản tối thiểu và Mức Đầu tư tối thiểu như nêu trên.  \n- **Thực Hiện Một Phần Lệnh Chuyển Đổi**  \nNhà Đầu Tư cần lưu ý rằng Lệnh Chuyển Đổi có thể chỉ được thực hiện một phần nếu Lệnh Bản nằm trong Lệnh Chuyển Đổi chỉ được thực hiện một phần. Các trường hợp Lệnh Bản chỉ được thực hiện một phần được quy định chi tiết tại mục 2.4.6. Phần chưa được thực hiện của Lệnh Chuyển Đổi được thực hiện một phần sẽ bị hủy.  \n- **Tạm Dừng Thực Hiện Lệnh Chuyển Đổi**  \nTrong một vài trường hợp Lệnh Chuyển Đổi cùng các lệnh khác có thể bị tạm dừng thực hiện. Các trường hợp được này được nêu tại mục 2.4.6.', 'Ngày Giao Dịch các kỳ tiếp theo là ngày tròn kỳ kể từ Ngày Giao Dịch đầu tiên. Trường hợp ngày tròn kỳ của các kỳ tiếp theo rơi vào ngày nghỉ (bao gồm cả ngày nghỉ bù), thì ngày Giao Dịch các kỳ tiếp theo sẽ là ngày làm việc ngay sau ngày tròn kỳ. Lệnh cho các Ngày Giao Dịch này sẽ được tạo ra vào ngày làm việc trước Ngày Giao Dịch tương ứng.  \nNhà Đầu Tư cần thanh toán cho khoản đầu tư của Chương Trình ĐTĐK để Ngân Hàng Giám Sát nhận được tiền mua trước Thời điểm Đóng Số Lệnh của Ngày Giao Dịch của các kỳ đầu tư tương ứng.  \nTrường hợp Nhà Đầu Tư không nộp đủ tiền mua vào tài khoản của quỹ trước Thời điểm Đóng Số Lệnh của một Ngày Giao Dịch trong Chương Trình ĐTĐK, lệnh mua chứng chỉ quỹ của kỳ đầu tư đó sẽ không được thực hiện. Số tiền không hợp lệ này sẽ được xử lý như sau:', '# i. Chương trình Đầu tư Định kỳ\nNgày Giao Dịch các kỳ tiếp theo là ngày tròn kỳ kể từ Ngày Giao Dịch đầu tiên. Trường hợp ngày tròn kỳ của các kỳ tiếp theo rơi vào ngày nghỉ (bao gồm cả ngày nghỉ bù), thì ngày Giao Dịch các kỳ tiếp theo sẽ là ngày làm việc ngay sau ngày tròn kỳ. Lệnh cho các Ngày Giao Dịch này sẽ được tạo ra vào ngày làm việc trước Ngày Giao Dịch tương ứng.  \nNhà Đầu Tư cần thanh toán cho khoản đầu tư của Chương Trình ĐTĐK để Ngân Hàng Giám Sát nhận được tiền mua trước Thời điểm Đóng Số Lệnh của Ngày Giao Dịch của các kỳ đầu tư tương ứng.  \nTrường hợp Nhà Đầu Tư không nộp đủ tiền mua vào tài khoản của quỹ trước Thời điểm Đóng Số Lệnh của một Ngày Giao Dịch trong Chương Trình ĐTĐK, lệnh mua chứng chỉ quỹ của kỳ đầu tư đó sẽ không được thực hiện. Số tiền không hợp lệ này sẽ được xử lý như sau:']","Việc thực hiện lệnh bán của nhà đầu tư có thể bị thực hiện một phần khi:

1. Lệnh Bản nằm trong Lệnh Chuyển Đổi chỉ được thực hiện một phần.
2. Các trường hợp cụ thể được quy định chi tiết tại mục 2.4.6.

Trong những trường hợp này, phần chưa được thực hiện của lệnh chuyển đổi sẽ bị hủy.",Khi tổng giá trị lệnh bán ròng > 10% NAV hoặc việc thực hiện lệnh làm NAV Quỹ < 50 tỷ đồng.,1.0,0.5311556384827295,0.7273809523718601,1.0
Chương trình Đầu tư Định kỳ (SIP) sẽ tự động chấm dứt trong trường hợp nào?,"['- Trong trường hợp nhận được yêu cầu chuyển trả cụ thể từ Nhà Đầu tư hoặc không nhận được yêu cầu chuyển trả từ Nhà Đầu Tư, số tiền không hợp lệ ở trên sẽ được chuyển trả lại cho Nhà đầu tư hoặc bên chuyển tiền không hợp lệ trong vòng 05 (năm) ngày làm việc kể từ kỳ giao dịch chứng chỉ quỹ áp dụng.  \nChương trình ĐTĐK sẽ dừng khi Nhà Đầu Tư quyết định dừng bằng cách thông báo dừng thực hiện ĐTĐK với Đại Lý Phân Phối hoặc do Nhà Đầu Tư không nộp tiền/không nộp đủ tiền mua chứng chỉ quỹ cho Chương Trình ĐTĐK trong 05 kỳ liên tiếp.  \n32', '## d) Xác Nhận Lệnh Chuyển Nhượng\nĐầu Tư Định Kỳ (ĐTĐK) là một chương trình đầu tư tiết kiệm có hệ thống cho phép Nhà Đầu Tư có thể tiết kiệm một khoản tiền cố định một cách thường xuyên bằng cách mua định kỳ các Đơn Vị Quỹ. Chương Trình ĐTĐK cho phép thực hiện các chương trình tiết kiệm theo kế hoạch đã đề ra.  \nNhà Đầu Tư sử dụng các lệnh tự động hoặc lệnh chờ để thực hiện chương trình Đầu Tư Định Kỳ.', '# i. Chương trình Đầu tư Định kỳ\nĐầu Tư Định Kỳ (ĐTĐK) là một chương trình đầu tư tiết kiệm có hệ thống cho phép Nhà Đầu Tư có thể tiết kiệm một khoản tiền cố định một cách thường xuyên bằng cách mua định kỳ các Đơn Vị Quỹ. Chương Trình ĐTĐK cho phép thực hiện các chương trình tiết kiệm theo kế hoạch đã đề ra.  \nNhà Đầu Tư sử dụng các lệnh tự động hoặc lệnh chờ để thực hiện chương trình Đầu Tư Định Kỳ.  \n- **Kỳ đầu tư của Chương Trình ĐTĐK**  \nĐịnh kỳ đầu tư của Chương Trình ĐTĐK là hàng tháng hoặc hàng quý hoặc hàng năm. Đại Lý Phân Phối có thể hỗ trợ các nhà đầu tư trong việc đưa ra một Chương Trình ĐTĐK và tần suất thanh toán phù hợp.  \n- **Khoản Tiền Đầu Tư Cho Chương Trình ĐTĐK**', 'Mức đầu tư tối thiểu định kỳ cho chương trình ĐTĐK là 10.000 VNĐ (Mười nghìn đồng).  \nNhà Đầu Tư có thể thay đổi giá trị khoản đầu tư và/hoặc kỳ đầu tư bất cứ lúc nào (nhưng không dưới mức đầu tư tối thiểu) bằng cách thay đổi lệnh thực hiện ĐTĐK với Đại Lý Phân Phối và các lệnh thanh toán với ngân hàng của mình. Nhà Đầu tư đã tham gia chương trình đầu tư định kỳ cũ sẽ được quyền bảo lưu hoặc chuyển đổi sang chương trình đầu tư định kỳ mới.  \nc) Ngày giao dịch và thanh toán cho các khoản đầu tư ĐTĐK  \nNgày Giao Dịch đầu tiên của Chương Trình ĐTĐK do Nhà Đầu tư chọn. Thời điểm cuối cùng để Nhà Đầu Tư đăng ký Chương Trình ĐTĐK là Thời điểm Đóng Số Lệnh của Ngày Giao Dịch đầu tiên mà Nhà Đầu tư lựa chọn.', 'Ngày Giao Dịch các kỳ tiếp theo là ngày tròn kỳ kể từ Ngày Giao Dịch đầu tiên. Trường hợp ngày tròn kỳ của các kỳ tiếp theo rơi vào ngày nghỉ (bao gồm cả ngày nghỉ bù), thì ngày Giao Dịch các kỳ tiếp theo sẽ là ngày làm việc ngay sau ngày tròn kỳ. Lệnh cho các Ngày Giao Dịch này sẽ được tạo ra vào ngày làm việc trước Ngày Giao Dịch tương ứng.  \nNhà Đầu Tư cần thanh toán cho khoản đầu tư của Chương Trình ĐTĐK để Ngân Hàng Giám Sát nhận được tiền mua trước Thời điểm Đóng Số Lệnh của Ngày Giao Dịch của các kỳ đầu tư tương ứng.  \nTrường hợp Nhà Đầu Tư không nộp đủ tiền mua vào tài khoản của quỹ trước Thời điểm Đóng Số Lệnh của một Ngày Giao Dịch trong Chương Trình ĐTĐK, lệnh mua chứng chỉ quỹ của kỳ đầu tư đó sẽ không được thực hiện. Số tiền không hợp lệ này sẽ được xử lý như sau:', '# i. Chương trình Đầu tư Định kỳ\nNgày Giao Dịch các kỳ tiếp theo là ngày tròn kỳ kể từ Ngày Giao Dịch đầu tiên. Trường hợp ngày tròn kỳ của các kỳ tiếp theo rơi vào ngày nghỉ (bao gồm cả ngày nghỉ bù), thì ngày Giao Dịch các kỳ tiếp theo sẽ là ngày làm việc ngay sau ngày tròn kỳ. Lệnh cho các Ngày Giao Dịch này sẽ được tạo ra vào ngày làm việc trước Ngày Giao Dịch tương ứng.  \nNhà Đầu Tư cần thanh toán cho khoản đầu tư của Chương Trình ĐTĐK để Ngân Hàng Giám Sát nhận được tiền mua trước Thời điểm Đóng Số Lệnh của Ngày Giao Dịch của các kỳ đầu tư tương ứng.  \nTrường hợp Nhà Đầu Tư không nộp đủ tiền mua vào tài khoản của quỹ trước Thời điểm Đóng Số Lệnh của một Ngày Giao Dịch trong Chương Trình ĐTĐK, lệnh mua chứng chỉ quỹ của kỳ đầu tư đó sẽ không được thực hiện. Số tiền không hợp lệ này sẽ được xử lý như sau:', 'lại cho Nhà đầu tư hoặc bên chuyển tiền không hợp lệ trong vòng 05 (năm) ngày làm việc kể từ kỳ giao dịch chứng chỉ quỹ áp dụng.  \nChương trình ĐTĐK sẽ dùng khi Nhà Đầu Tư quyết định dừng bằng cách thông báo dừng thực hiện ĐTĐK với Đại Lý Phân Phối hoặc do Nhà Đầu Tư không nộp tiền/không nộp đủ tiền mua chứng chỉ quỹ cho Chương Trình ĐTĐK trong 05 kỳ liên tiếp.  \n- Phí/giá dịch vụ áp dụng cho Chương Trình ĐTĐK  \nPhí/giá dịch vụ áp dụng cho chương trình ĐTĐK được quy định chi tiết tại mục 2.5.3 của Bản Cáo Bạch này.  \n- Bản chứng chỉ quỹ mua theo Chương Trình ĐTĐK  \nNhà Đầu Tư bán chứng chỉ quỹ mua theo Chương Trình ĐTĐK theo nguyên tắc quy định tại mục 2.5.3 của Bản Cáo Bạch này.', 'Ngay sau khi các sự kiện này chấm dứt, các giao dịch Đơn Vị Quỹ sẽ được thực hiện trở lại vào Ngày Giao Dịch tiếp theo. Theo luật, thời gian tạm dừng thực hiện các Lệnh Mua và Bán Đơn Vị Quỹ sẽ không quá 90 (chín mươi) ngày kể từ Ngày Giao Dịch gần nhất. Trong trường hợp giao dịch không thể tiếp tục trong khoảng thời gian tạm dừng tối đa nêu trên, thì trong vòng 30 (ba mươi) ngày kể từ ngày kết thúc thời hạn tạm dừng trên, Công Ty Quản Lý Quỹ phải tổ chức họp để lấy ý kiến Đại Hội Nhà Đầu Tư về việc giải thể Quỹ, hoặc tách Quỹ, hoặc tiếp tục kéo dài thời gian tạm dừng giao dịch Chứng chỉ Quỹ. Trong thời hạn triệu tập Đại Hội Nhà Đầu Tư, nếu các nguyên nhân dẫn tới việc tạm dừng giao dịch Chứng Chỉ Quỹ chấm dứt, Công ty Quản Lý Quỹ được hủy bỏ việc triệu tập Đại Hội Nhà Đầu Tư.  \n56', 'Việc thực hiện các giao dịch Đơn Vị Quỹ có thể bị tạm dừng do một trong các sự kiện sau:  \n- Các điều kiện bất khả kháng;\n- Không thể xác định được NAV của Quỹ tại Ngày Giao Dịch do các Sở giao dịch chứng khoán quyết định đình chỉ giao dịch chứng khoán trong danh mục đầu tư của Quỹ hoặc do các sở giao dịch chứng khoán tạm dừng giao dịch; hoặc\n- Các trường hợp khác theo quy định của Ủy Ban Chứng Khoán Nhà Nước.', 'Lệnh Mua thành công của Nhà Đầu Tư hay Đại Lý Kỷ Danh sẽ được thông báo trong vòng 03 (ba) ngày làm việc sau Ngày Giao Dịch, số lượng Đơn Vị Quỹ sẽ được làm tròn xuống đến hai số thập phân sau dấu phẩy. Số Đơn Vị Quỹ lẻ sẽ không ảnh hưởng đến khả năng bán lại Đơn Vị Quỹ của Nhà Đầu Tư.  \n- **Tạm Dừng Thực Hiện Lệnh Mua**  \nNhà Đầu Tư cần lưu ý rằng trong một số trường hợp các Lệnh Mua của Nhà Đầu Tư cùng với tất cả các Lệnh Mua khác có thể bị tạm dừng thực hiện. Các trường hợp này được liệt kê trong mục 2.4.8.  \nTrong trường hợp các giao dịch Đơn Vị Quỹ bị tạm dừng, Lệnh Mua sẽ được thực hiện vào Ngày Giao Dịch đầu tiên sau khi giao dịch được thực hiện trở lại.  \n- **Lệnh Mua Tối Thiểu**  \nMức đầu tư tối thiểu (tính theo giá trị Lệnh Mua) là 10.000 VNĐ (Mười nghìn đồng)', '## e) Tạm Dừng Thực Hiện Lệnh Mua\nNhà Đầu Tư cần lưu ý rằng trong một số trường hợp các Lệnh Mua của Nhà Đầu Tư cùng với tất cả các Lệnh Mua khác có thể bị tạm dừng thực hiện. Các trường hợp này được liệt kê trong mục 2.4.8 dưới đây.  \nTrong trường hợp các giao dịch Đơn Vị Quỹ bị tạm dừng, Lệnh Mua sẽ được thực hiện vào Ngày Giao Dịch đầu tiên sau khi giao dịch được thực hiện trở lại.', 'a) Kỳ đầu tư của Chương Trình ĐTĐK  \nĐịnh kỳ đầu tư của Chương Trình ĐTĐK là hàng tháng hoặc hàng quý hoặc hàng năm. Đại Lý Phân Phối có thể hỗ trợ các nhà đầu tư trong việc đưa ra một Chương Trình ĐTĐK và tần suất thanh toán phù hợp.  \nb) Khoản Tiền Đầu Tư Cho Chương Trình ĐTĐK  \nKhoản tiền đầu tư cho Chương Trình ĐTĐK là số tiền Nhà Đầu Tư đăng ký mua chứng chỉ quỹ hàng kỳ, tuy nhiên không thấp hơn mức đầu tư tối thiểu.  \nMức đầu tư tối thiểu định kỳ cho chương trình ĐTĐK là 10.000 VNĐ (Mười nghìn đồng).', '## d) Xác Nhận Lệnh Chuyển Nhượng\nNgay sau khi các sự kiện này chấm dứt, các giao dịch Đơn Vị Quỹ sẽ được thực hiện trở lại vào Ngày Giao Dịch tiếp theo. Theo luật, thời gian tạm dừng thực hiện các Lệnh Mua và Bán Đơn Vị Quỹ sẽ không quá 90 (chín mươi) ngày kể từ Ngày Giao Dịch gần nhất. Trong trường hợp giao dịch không thể tiếp tục trong khoảng thời gian tạm dừng tối đa nêu trên, thì trong vòng 30 (ba mươi) ngày kể từ ngày kết thúc thời hạn tạm dừng trên, Công Ty Quản Lý Quỹ phải tổ chức họp để lấy ý kiến Đại Hội Nhà Đầu Tư về việc giải thể Quỹ, hoặc tách Quỹ, hoặc tiếp tục kéo dài thời gian tạm dừng giao dịch Chứng chỉ Quỹ. Trong thời hạn triệu tập Đại Hội Nhà Đầu Tư, nếu các nguyên nhân dẫn tới việc tạm dừng giao dịch Chứng Chỉ Quỹ chấm dứt, Công ty Quản Lý Quỹ được hủy bỏ việc triệu tập Đại Hội Nhà Đầu Tư.', '# i. Chương trình Đầu tư Định kỳ\n- Trong trường hợp Nhà Đầu Tư muốn sử dụng tiền không hợp lệ ở trên để mua chứng chỉ quỹ tại các kỳ giao dịch bình thường không phải là kỳ giao dịch theo Chương trình ĐTĐK thì Nhà Đầu Tư sẽ phải thực hiện quy trình theo Mục 2.4.4. Quy trình mua chứng chỉ quỹ.  \n- Trong trường hợp Nhà Đầu Tư muốn giữ lại và tiếp tục để chờ cho kỳ giao dịch theo Chương trình ĐKĐT tiếp theo thì Nhà Đầu Tư cần phải đảm bảo nộp bổ sung phần còn thiếu trước thời điểm đóng số lệnh của ngày giao dịch theo Chương trình ĐKĐT.  \n- Trong trường hợp nhận được yêu cầu chuyển trả cụ thể từ Nhà Đầu tư hoặc không nhận được yêu cầu chuyển trả từ Nhà Đầu Tư, số tiền không hợp lệ ở trên sẽ được chuyển trả', '# 5. Kế hoạch phân chia lợi nhuận\n- Các khoản đầu tư dưới hình thức DRIP sẽ không phải trả Giá dịch vụ Phát hành.\n- Không phải trả Giá dịch vụ Mua lại hoặc Giá dịch vụ Chuyển Đổi đối với khoản đầu tư từ DRIP.  \nNhà Đầu Tư cần phải nêu rõ lựa chọn của mình trong hai lựa chọn trên, DPP hoặc DRIP, được ghi trong Đơn Đăng Ký. Nếu Nhà Đầu Tư không có sự lựa chọn, lựa chọn DRIP được tự động áp dụng.  \nĐại Hội Nhà Đầu Tư có thể phê duyệt cổ tức tại bất kỳ thời điểm nào và bất kỳ tần suất thanh toán nào (hàng quý, nửa năm, hàng năm) khi phù hợp. Tuy nhiên, sẽ không có sự đảm bảo nào về giá trị, tần suất, cũng như sự đều đặn của việc phân phối cổ tức. Việc phân phối cổ tức sẽ tùy thuộc vào lợi nhuận có thể phân phối và sự chấp thuận của Đại Hội Nhà Đầu Tư hoặc Ban Đại diện Quỹ (nếu được ủy quyền).', '- Các khoản đầu tư dưới hình thức DRIP sẽ không phải trả Giá dịch vụ Phát hành.\n- Không phải trả Giá dịch vụ Mua lại hoặc Giá dịch vụ Chuyển Đổi đối với khoản đầu tư từ DRIP.  \nNhà Đầu Tư cần phải nêu rõ lựa chọn của mình trong hai lựa chọn trên, DPP hoặc DRIP, được ghi trong Đơn Đăng Ký. Nếu Nhà Đầu Tư không có sự lựa chọn, lựa chọn DRIP được tự động áp dụng.  \nĐại Hội Nhà Đầu Tư có thể phê duyệt cổ tức tại bất kỳ thời điểm nào và bất kỳ tần suất thanh toán nào (hàng quý, nửa năm, hàng năm) khi phù hợp. Tuy nhiên, sẽ không có sự đảm bảo nào về giá trị, tần suất, cũng như sự đều đặn của việc phân phối cổ tức. Việc phân phối cổ tức sẽ tùy thuộc vào lợi nhuận có thể phân phối và sự chấp thuận của Đại Hội Nhà Đầu Tư hoặc Ban Đại diện Quỹ (nếu được ủy quyền).', '# i. Chương trình Đầu tư Định kỳ\n- **Khoản Tiền Đầu Tư Cho Chương Trình ĐTĐK**  \nKhoản tiền đầu tư cho Chương Trình ĐTĐK là số tiền Nhà Đầu Tư đăng ký mua chứng chỉ quỹ hàng kỳ, tuy nhiên không thấp hơn mức đầu tư tối thiểu.  \nMức đầu tư tối thiểu định kỳ cho chương trình ĐTĐK là 10.000 VNĐ (mười nghìn đồng).  \nNhà Đầu Tư có thể thay đổi kỳ đầu tư bất cứ lúc nào bằng cách thay đổi lệnh thực hiện ĐTĐK với Đại Lý Phân Phối và các lệnh thanh toán với ngân hàng của mình.  \n- **Ngày giao dịch và thanh toán cho các khoản đầu tư ĐTĐK**  \nNgày Giao Dịch đầu tiên của Chương Trình ĐTĐK do Nhà Đầu lựa chọn. Thời điểm cuối cùng để Nhà Đầu Tư đăng ký Chương Trình ĐTĐK là Thời điểm Đóng Số Lệnh của Ngày Giao Dịch đầu tiên mà Nhà Đầu tư lựa chọn.', '- Trong trường hợp Nhà Đầu Tư muốn sử dụng tiền không hợp lệ ở trên để mua chứng chỉ quỹ tại các kỳ giao dịch bình thường không phải là kỳ giao dịch theo Chương trình ĐTĐK thì Nhà Đầu Tư sẽ phải thực hiện quy trình theo Mục 2.4.4 Quy trình mua chứng chỉ quỹ.\n- Trong trường hợp Nhà Đầu Tư muốn giữ lại và tiếp tục để chờ cho kỳ giao dịch theo Chương trình ĐKĐT tiếp theo thì Nhà Đầu Tư cần phải đảm bảo nộp bổ sung phần còn thiếu trước thời điểm đóng số lệnh của ngày giao dịch theo Chương trình ĐKĐT.', '## d) Xác Nhận Lệnh Chuyển Nhượng\n#### a) Hủy lệnh giao dịch Đơn Vị Quỹ  \nNhà Đầu Tư có thể hủy các lệnh giao dịch bằng cách điền và nộp Phiếu Hủy Lệnh cho các Điểm Nhận Lệnh của Đại Lý Phân Phối của họ trước Thời Điểm Đóng Số Lệnh áp dụng cho các giao dịch đó.  \n#### b) Tạm dừng thực hiện các lệnh giao dịch Đơn Vị Quỹ  \nNhà Đầu Tư cần lưu ý là việc thực hiện các lệnh giao dịch - Mua, Bán, Chuyển Đổi, Chuyển Nhượng Đơn Vị Quỹ có thể sẽ bị tạm dừng một hoặc nhiều Ngày Giao Dịch vì tình hình vượt ngoài tầm kiểm soát của Công Ty Quản Lý Quỹ. Tất cả Điểm Nhận Lệnh sẽ được thông báo trong các trường hợp giao dịch bị tạm dừng.  \nViệc thực hiện các giao dịch Đơn Vị Quỹ có thể bị tạm dừng do một trong các sự kiện sau:  \n- Các điều kiện bất khả kháng;', '- Thực hiện các lệnh giao dịch của Nhà Đầu Tư;  \n- Các hoạt động sáp nhập, hợp nhất của các tổ chức phát hành các chứng khoán mà Quỹ đang nắm giữ;  \n- Quỹ mới được cấp phép thành lập hoặc do tách Quỹ, hợp nhất Quỹ, sát nhập Quỹ mà thời gian hoạt động không quá sáu (06) tháng, tính từ ngày được cấp giấy chứng nhận đăng ký lập Quỹ;  \n- Quỹ đang trong thời gian giải thể.  \nTrong trường hợp xảy ra sai lệch so với các hạn mức đầu tư, Công ty Quản Lý Quỹ sẽ điều chỉnh danh mục đầu tư để đáp ứng các hạn mức đầu tư kể trên trong vòng 3 (ba) tháng kể từ ngày mà sai lệch phát sinh.', '## 2.4.6. Quy trình chuyển đổi quỹ\nTrong một vài trường hợp Lệnh Chuyển Đổi cùng các lệnh khác có thể bị tạm dừng thực hiện. Các trường hợp được này được nêu tại mục 2.4.8.  \nTrong các trường hợp tạm dừng thực hiện các giao dịch Đơn Vị Quỹ, Lệnh Chuyển Đổi đã nhận sẽ được thực hiện tại NAV tại Ngày Giao Dịch đầu tiên sau khi giao dịch được thực hiện trở lại.', '## f) Tạm dừng thực hiện Lệnh Bán\nNhà Đầu Tư cần lưu ý rằng trong một số trường hợp, các Lệnh Bán cùng với tất cả các lệnh khác có thể bị tạm dừng thực hiện. Các trường hợp này được quy định chi tiết tại mục 2.4.8.  \nTrong trường hợp các lệnh giao dịch Đơn Vị Quỹ bị tạm dừng thực hiện, Lệnh Bán đã nhận sẽ được thực hiện tại NAV tại Ngày Giao Dịch đầu tiên sau khi giao dịch được thực hiện trở lại.  \n29', '## e) Thực Hiện Một Phần Lệnh Bán\nSố lượng Chứng Chỉ Quỹ Nhà Đầu Tư được thực hiện trong trường hợp thực hiện một phần Lệnh Bán cũng áp dụng nguyên tắc của Lệnh Bán tối thiểu nêu trên. Phần lệnh chưa được thực hiện và các lệnh đến sau thời điểm đóng số lệnh sẽ tự động bị hủy. Nhà Đầu Tư có thể thực hiện tiếp các lệnh bán của mình bằng cách đăng ký giao dịch tại ngày giao dịch tiếp theo.', 'Trong các trường hợp tạm dừng thực hiện các giao dịch Đơn Vị Quỹ, Lệnh Chuyển Đổi đã nhận sẽ được thực hiện tại NAV tại Ngày Giao Dịch đầu tiên sau khi giao dịch được thực hiện trở lại.  \n**g. Quy trình chuyển nhượng chứng chỉ quỹ**  \n- **Đơn Chuyển Nhượng**  \nNhà Đầu Tư có thể Chuyển Nhượng Đơn Vị Quỹ cho nhà đầu tư khác dưới dạng quà tặng, thừa kế hoặc thực hiện lệnh của toà án. Chuyển Nhượng chỉ được thực hiện dưới dạng số lượng Đơn  \n55', '- **Xác Nhận Lệnh Chuyển Nhượng**  \nCác Lệnh Chuyển Nhượng được thực hiện bởi Đại Lý Chuyển Nhượng tại Ngày Giao Dịch.  \n**h. Các trường hợp hủy, tạm dừng lệnh giao dịch**  \n- **Hủy lệnh giao dịch Đơn Vị Quỹ**  \nNhà Đầu Tư có thể hủy các lệnh giao dịch bằng cách điền và nộp Phiếu Hủy Lệnh cho các Điểm Nhận Lệnh của Đại Lý Phân Phối của họ trước Thời Điểm Đóng Số Lệnh áp dụng cho các giao dịch đó.  \n- **Tạm dừng thực hiện các lệnh giao dịch Đơn Vị Quỹ**  \nNhà Đầu Tư cần lưu ý là việc thực hiện các lệnh giao dịch - Mua, Bán, Chuyển Đổi, Chuyển Nhượng Đơn Vị Quỹ có thể sẽ bị tạm dừng một hoặc nhiều Ngày Giao Dịch vì tình hình vượt ngoài tầm kiểm soát của Công Ty Quản Lý Quỹ. Tất cả Điểm Nhận Lệnh sẽ được thông báo trong các trường hợp giao dịch bị tạm dừng.']","Chương trình Đầu tư Định kỳ (SIP) sẽ tự động chấm dứt trong trường hợp Nhà Đầu Tư không có sự lựa chọn và lựa chọn DRIP được tự động áp dụng, đồng thời Đại Hội Nhà Đầu Tư không phê duyệt cổ tức với tần suất thanh toán cụ thể. Tuy nhiên, thông tin chính xác về điều kiện chấm dứt chương trình SIP không được nêu rõ trong các nguồn tài liệu đã cung cấp.

Nếu cần thông tin chi tiết hơn, tôi không tìm thấy thông tin đó trong tài liệu.",Khi Nhà Đầu Tư thông báo dừng hoặc không nộp tiền/không nộp đủ tiền mua trong 05 kỳ liên tiếp.,0.5,0.0,0.8445378151119748,1.0
Rủi ro tái đầu tư (Reinvestment risk) được mô tả như thế nào trong Bản cáo bạch?,"['## 3.7. Rủi ro tái đầu tư\nRủi ro tái đầu tư là rủi ro đặc thù của các khoản đầu tư trái phiếu với dòng tiền từ lãi trái phiếu nhận được hàng kỳ và gốc trái phiếu nhận được vào thời điểm đáo hạn được đem đi tái đầu tư nhằm thu lợi nhuận (lãi-trên-lãi). Rủi ro tái đầu tư phát sinh khi mặt bằng lãi suất tại thời điểm tái đầu tư thấp hơn so với lãi suất kỳ vọng trước đó. Ngoài ra, một số chứng khoán có thu nhập cố định được phát hành kèm theo quyền cho phép người phát hành mua lại chứng khoán đó trước hạn, thường là khi lãi suất thị trường có xu hướng giảm. Điều này khiến Quỹ có thể phải đối mặt với rủi ro tái đầu tư phần tiền thu hồi tại mức sinh lợi thấp hơn, do đó làm giảm thu nhập từ lãi của Quỹ', '## 3.5. Rủi ro thanh khoản\nRủi ro thanh khoản là rủi ro mà nhà đầu tư không bán lại được chứng chỉ quỹ vào ngày giao dịch chứng chỉ quỹ do các chứng khoán trong danh mục của quỹ không thanh khoản được, hoặc do việc nhà đầu tư bán chứng chỉ quỹ thuộc các trường hợp thực hiện một phần lệnh bán hoặc tạm dừng lệnh bán theo quy định của Điều Lệ Quỹ.  \nĐối với các chứng khoán trong danh mục của Quỹ, rủi ro thanh khoản sẽ được theo dõi trên cơ sở số ngày cần thiết để bán mỗi chứng khoán trong danh mục dựa trên dữ liệu giao dịch bình quân của chứng khoán đó trong năm liền trước. Các phương pháp cần thiết khác sẽ được tiến hành để giữ thời gian thoái vốn bình quân nằm trong các khoảng thời gian mục tiêu theo nguyên tắc cần trong giới hạn trong quy định nội bộ.', '## 3.7. Rủi ro tái đầu tư\n. Rủi ro tái đầu tư của danh mục đầu tư trái phiếu được quản trị thông qua việc theo dõi kỳ vọng lãi suất thể hiện trên đường cong lợi suất và kỳ hạn của danh mục đầu tư trái phiếu.', '## 3.1. Rủi ro tín dụng\nRủi ro tín dụng hay rủi ro mất khả năng thanh toán là rủi ro mà tổ chức phát hành không thể đáp ứng các nghĩa vụ của mình đối với phần vốn gốc và lãi khi đến hạn thanh toán. Rủi ro này chủ yếu liên quan đến các chứng khoán có thu nhập cố định như: trái phiếu Chính phủ, trái phiếu được Chính phủ bảo lãnh, và hoặc trái phiếu doanh nghiệp. Công Ty Quản Lý Quỹ sẽ xem xét cẩn trọng và thường xuyên đánh giá chất lượng tín dụng trong quá trình lựa chọn đầu tư vào trái phiếu và các chứng khoán có thu nhập cố định khác.', 'Giống như các hình thức đầu tư khác, Quỹ mở có những rủi ro như Nhà Đầu Tư có thể bị lỗ một phần hoặc toàn bộ vốn đầu tư ban đầu, rủi ro không có lợi nhuận hoặc lợi nhuận đạt được thấp hơn dự kiến hoặc thấp hơn so với lợi nhuận của các hình thức đầu tư khác được đầu tư cùng thời điểm và có cùng thời gian nắm giữ. Nhà Đầu Tư cần nhận thức được những rủi ro này tại thời điểm thực hiện đầu tư cũng như hiểu được khả năng chấp nhận của họ đối với rủi ro mất vốn đầu tư ban đầu hoặc lợi nhuận thấp hơn kỳ vọng. Rủi ro trong đầu tư chứng khoán thông thường được phân thành những loại rủi ro sau đây:', '## 3.8. Rủi ro pháp lý\nĐây là rủi ro có thể phát sinh khi Luật hoặc các quy định pháp lý thay đổi hoặc sự diễn giải và thi hành Luật và các quy định pháp lý này thay đổi khiến cho Quỹ hoặc giá trị tài sản của Quỹ bị ảnh hưởng. Những thay đổi về Luật hay các quy định pháp lý thường được thông báo trước khi có hiệu lực. Mức độ ảnh hưởng của những thay đổi này đối với Quỹ và các công ty trong danh mục sẽ được đánh giá, và nếu cần thiết và khả thi, Quỹ sẽ thay đổi cơ cấu danh mục đầu tư hoặc đối tượng các công ty được đầu tư.', '2.11. Tiêu chí lựa chọn, quyền hạn và trách nhiệm của Ngân hàng giám sát ... 41\n2.12. Kiểm toán, kế toán và chế độ báo cáo ... 42\n3. Các rủi ro khi đầu tư vào Quỹ ... 42\n3.1. Rủi ro tín dụng ... 43\n3.2. Rủi ro lãi suất ... 43\n3.3. Rủi ro lạm phát ... 43\n3.4. Rủi ro tỷ giá ... 43\n3.5. Rủi ro thanh khoản ... 44\n3.6. Rủi ro về biến động giá ... 44\n3.7. Rủi ro tài đầu tư ... 44\n3.8. Rủi ro pháp lý ... 44\n3.9. Rủi ro bất khả kháng ... 44', '## 3. Các rủi ro khi đầu tư vào Quỹ\nMục tiêu của Công Ty Quản Lý Quỹ là quản lý các rủi ro đầu tư, và nếu có thể, hạn chế tác động của các rủi ro này bằng việc áp dụng các phương pháp quản lý đầu tư theo tiêu chuẩn quốc tế tốt nhất. Nhà Đầu Tư cần lưu ý các điểm quan trọng sau đây:  \n- Quỹ, Công Ty Quản Lý Quỹ, thành viên Hội đồng thành viên, ban điều hành và nhân viên Công Ty Quản Lý Quỹ không có bất kỳ sự đảm bảo nào đối với vốn đầu tư ban đầu cũng như mức lợi nhuận từ đầu tư của Quỹ;\n- Không có bất kỳ sự bảo đảm nào về sổ lần chi trả và giá trị của cổ tức được thanh toán trong tương lai;  \n42', '## 3.4. Rủi ro tỷ giá\nDo tài sản và nợ phải trả của Quỹ đều được trình bày bằng đồng Việt Nam, là đơn vị tiền tệ sử dụng của Quỹ. Vì vậy, mặc dù rủi ro tỷ giá trong trung hạn tại Việt Nam trong thời điểm hiện nay được chúng tôi đánh giá là tương đối thấp do tình hình kinh tế vĩ mô được giữ ổn định, cán cân thương mại thặng dư và Chính phủ thể hiện quyết tâm duy trì sự ổn định của đồng Việt Nam, các Nhà Đầu Tư nước ngoài thực tế sẽ phải chịu rủi ro tỷ giá trong thời gian đầu tư tại Việt Nam.  \n43', '## 3.9. Rủi ro bất khả kháng\nĐây là rủi ro khi những sự kiện bất thường phát sinh có ảnh hưởng lớn và đột ngột lên giá trị của tất cả hoặc một số tài sản của Quỹ. Những sự kiện này - dù là có thật hay tin đồn, có thể bao gồm:  \n- Thảm họa thiên nhiên như động đất, lũ lụt, hỏa hoạn, thảm họa hạt nhân;', '## 3. Giá dịch vụ và thưởng hoạt động\nNhà Đầu Tư được khuyến khích nắm giữ các Đơn Vị Quỹ như một phần của các khoản đầu tư dài hạn và chương trình tiết kiệm hưu trí. Quỹ mở không được thiết kế cho mục đích mua bán ngắn hạn. Việc Nhà Đầu Tư thường xuyên mua đi và bán lại Đơn Vị Quỹ, vốn được thiết kế để đạt được lợi nhuận dài hạn sẽ ảnh hưởng đến mục tiêu lợi nhuận của Nhà Đầu Tư khi đầu tư vào Quỹ cũng như lợi nhuận của Quỹ.  \nGiá dịch vụ Mua lại và các khoản giá dịch vụ ngân hàng và thuế khác (nếu có) sẽ được trừ vào khoản tiền thu được từ bán Đơn Vị Quỹ của Nhà Đầu Tư.', '## Lĩnh vực được phép đầu tư\nđ) Cổ phiếu chào bán lần đầu ra công chúng, trái phiếu chào bán ra công chúng; trái phiếu doanh nghiệp phát hành riêng lẻ bởi tổ chức niêm yết có bảo lãnh thanh toán của tổ chức tín dụng hoặc cam kết mua lại của tổ chức phát hành tối thiểu 1 lần trong 12 tháng và mỗi lần cam kết mua lại tối thiểu 30% giá trị đợt phát hành;  \ne) Chứng khoán phải sinh niêm yết giao dịch tại Sở giao dịch chứng khoán và chỉ nhằm mục tiêu phòng ngừa rủi ro cho chứng khoán cơ sở mà quỹ đang nắm giữ;  \ng) Quyền phát sinh gắn liền với chứng khoán mà quỹ đang nắm giữ.  \nViệc đầu tư vào các tài sản quy định tại điểm đ khoản 2.2.3 Điều này phải đáp ứng các điều kiện sau:  \n- Có quy định tại Điều lệ quỹ và Bản cáo bạch;', '## THÔNG BÁO QUAN TRỌNG\nCác nhà đầu tư nên nghiên cứu Bản Cáo Bạch này một cách cẩn trọng và toàn diện và không nên coi nội dung hoặc các tóm tắt ở đây là các tư vấn liên quan đến pháp lý, thuế, hoặc tài chính/đầu tư và nên tham khảo ý kiến chuyên gia tư vấn của mình về các yêu cầu pháp lý hoặc các điều kiện hoặc bất kỳ các hạn chế nào khác liên quan đến việc đăng ký mua, mua, cho tặng, nắm giữ, định đoạt (chuyển nhượng; chuyển đổi quỹ hoặc bản hoặc chuyển đổi thành tiền) các Đơn Vị Quỹ, việc xử lý khoản thu nhập (nếu có), lợi nhuận đầu tư, hoặc các khoản phân phối lợi nhuận, các khoản thuế khác liên quan đến việc đăng ký mua, mua, cho tặng, nắm giữ, định đoạt (bản, chuyển giao, chuyển đổi quỹ hoặc bản hoặc chuyển đổi thành tiền) các Đơn Vị Quỹ trong phạm vi lãnh thổ tài phán áp dụng đối với quốc tịch, nơi cư trú', '# 5. Kế hoạch phân chia lợi nhuận\nNhà Đầu Tư nhận cổ tức bằng tiền có thể dùng để tái đầu tư:  \n- Lựa chọn Nhận Cổ Tức Bằng Tiền (“DPP”): Nhà Đầu Tư muốn nhận cổ tức bằng tiền cần phải nêu rõ lựa chọn của mình trong Đơn Đăng Ký mở tài khoản giao dịch.\n- Lựa chọn Tái Đầu tư Cổ tức (“DRIP”): Nhà Đầu Tư muốn dùng cổ tức để tái đầu tư sẽ nhận được thêm các Đơn Vị Quỹ. Cổ tức được trả cho Nhà Đầu Tư sẽ được tự động tái đầu tư tại NAV của Quỹ trong Ngày Giao Dịch liền sau ngày trả cổ tức. Số lượng các Đơn Vị Quỹ của Nhà Đầu Tư do đó sẽ tăng bằng với số cổ tức phải trả chia cho NAV vào Ngày Giao Dịch đó. Cổ tức được dùng để tái đầu tư giống như việc Nhà Đầu Tư nhận được cổ tức bằng tiền mặt và dùng số tiền đã nhận được để tái đầu tư và đồng thời:\n- Các khoản đầu tư dưới hình thức DRIP sẽ không phải trả Giá dịch vụ Phát hành.', 'Nhà Đầu Tư nhận cổ tức bằng tiền có thể dùng để tái đầu tư:  \n- Lựa chọn Nhận Cổ Tức Bằng Tiền (“DPP”): Nhà Đầu Tư muốn nhận cổ tức bằng tiền cần phải nêu rõ lựa chọn của mình trong Đơn Đăng Ký mở tài khoản giao dịch.\n- Lựa chọn Tái Đầu tư Cổ tức (“DRIP”): Nhà Đầu Tư muốn dùng cổ tức để tái đầu tư sẽ nhận được thêm các Đơn Vị Quỹ. Cổ tức được trả cho Nhà Đầu Tư sẽ được tự động tái đầu tư tại NAV của Quỹ trong Ngày Giao Dịch liền sau ngày trả cổ tức. Số lượng các Đơn Vị Quỹ của Nhà Đầu Tư do đó sẽ tăng bằng với số cổ tức phải trả chia cho NAV vào Ngày Giao Dịch đó. Cổ tức được dùng để tái đầu tư giống như việc Nhà Đầu Tư nhận được cổ tức bằng tiền mặt và dùng số tiền đã nhận được để tái đầu tư và đồng thời:\n- Các khoản đầu tư dưới hình thức DRIP sẽ không phải trả Giá dịch vụ Phát hành.', '## 2.2.5 Điều chỉnh danh mục đầu tư\nCơ cấu đầu tư của quỹ mở chỉ được vượt mức so với các hạn chế đầu tư đã quy định tại điểm a, b, c, d, đ, e và i mục IX.2.2.4 và chỉ do các nguyên nhân sau:  \na) Biến động giá trên thị trường của tài sản trong danh mục đầu tư của quỹ;  \nb) Thực hiện các khoản thanh toán của quỹ theo quy định của pháp luật, bao gồm việc thực hiện lệnh giao dịch của nhà đầu tư;', 'Việc bảo vệ Nhà Đầu Tư nước ngoài tránh khỏi rủi ro này nằm ngoài khả năng của Quỹ và vì vậy, các Nhà Đầu Tư nước ngoài, nếu cần thiết, cần phải tìm kiếm các công cụ để tự phòng ngừa rủi ro này.', '## 3.6. Rủi ro về biến động giá\nRủi ro về biến động giá của Quỹ phát sinh khi một hay một số Nhà Đầu Tư đang nắm giữ một số lượng lớn Đơn Vị Quỹ quyết định thực hiện Lệnh Bản các Đơn Vị Quỹ này cùng lúc. Điều này có thể ảnh hưởng bất lợi tới giá của Đơn Vị Quỹ nếu các Lệnh Bản này đòi hỏi Công Ty Quản Lý Quỹ phải thoái vốn các khoản đầu tư tại mức giá thấp. Các quy định về thực hiện một phần lệnh bán và tạm dừng lệnh bán có thể giảm thiểu rủi ro biến động giá của Quỹ.', '- Khủng hoảng hệ thống ngân hàng, các nhà lãnh đạo chủ chốt mất khả năng điều hành;\n- Rủi ro hệ thống như trục trặc trong hệ thống máy tính hoặc thông tin.  \nCó rất ít biện pháp để giảm thiểu rủi ro bất khả kháng có mức độ ảnh hưởng lớn do bản chất của những hiện tượng này. Đa dạng hoá danh mục đầu tư vào các ngành, lĩnh vực khác nhau góp phần giảm thiểu rủi ro này. Ở cấp độ công ty trong danh mục, chính sách bảo hiểm và các kế hoạch khắc phục tổn thất do thảm họa có thể giúp giới hạn tác động của một số rủi ro bất khả kháng.', '## 2. Thông tin về đợt phát hành lần đầu ra công chúng\nNgoài ra, để đảm bảo tối ưu hóa lợi ích của nhà đầu tư, Quỹ có sự linh hoạt trong phân bổ tài sản tùy thuộc vào cơ hội đầu tư sẵn có tại các thời điểm khác nhau. Việc phân bổ tài sản có thể thay đổi đáng kể tùy thuộc vào nhận định của Quỹ, với mục tiêu xuyên suốt trong toàn bộ thời gian hoạt động của Quỹ là bảo vệ lợi ích của Nhà Đầu Tư.  \nVới chiến lược đầu tư như đã đề cập ở trên, cơ cấu danh mục đầu tư của Quỹ có thể thay đổi theo thời gian dựa theo tiềm năng tăng trưởng của cổ phiếu và tùy vào mức độ thanh khoản của các cổ phiếu trên thị trường. Tỷ trọng các khoản đầu tư không vượt quá những hạn chế đầu tư quy định tại mục “Hạn chế đầu tư”.  \nCác loại tài sản mà quỹ được đầu tư bao gồm:\ni. Tiền gửi tại các ngân hàng thương mại theo quy định của pháp luật về  |', '- Không đầu tư quá 30% tổng giá trị tài sản của quỹ vào các chứng chỉ quỹ đại chúng, cổ phiếu công ty đầu tư chứng khoán đại chúng;  \nxi. Quỹ chỉ được đầu tư tiền gửi, công cụ tiền tệ quy định tại điểm i và ii các loại tài sản Quỹ được phép đầu tư được phát hành bởi các tổ chức tín dụng trong danh sách đã được Ban Đại Diện Quỹ phê duyệt bằng văn bản hoặc thông qua bỏ phiếu điện tử (e-voting) tuân thủ theo các Quy định Pháp luật hiện hành.  \nCơ cấu đầu tư của Quỹ được phép sai lệch so với các hạn chế được đưa ra tại điểm i, ii, iii, iv, v, vi và ix nếu trên nhưng chỉ vì các lý do sau:  \n- Biến động giá trên thị trường của các tài sản trong danh mục đầu tư của Quỹ;  \n- Thực hiện các khoản thanh toán phù hợp với Pháp Luật của Quỹ;  \n- Thực hiện các lệnh giao dịch của Nhà Đầu Tư;', '## e) Thực Hiện Một Phần Lệnh Bán\nTrong các trường hợp sau, Quỹ chỉ có thể thực hiện một phần Lệnh Bán và Chuyến Đổi Quỹ của Nhà Đầu Tư:  \n- Tổng giá trị của các Lệnh Bán (bao gồm cả Lệnh Bán từ hoạt động Chuyến Đổi Quỹ) trừ đi tổng giá trị của tất cả các Lệnh Mua (bao gồm cả Lệnh Mua từ hoạt động Chuyến Đổi Quỹ) tại Ngày Giao Dịch lớn hơn 10% của giá trị tài sản ròng của Quỹ (NAV); hoặc\n- Việc thực hiện tất cả các lệnh giao dịch của Nhà Đầu Tư tại Ngày Giao Dịch dẫn đến NAV của Quỹ thấp hơn 50.000.000.000 đồng (năm mươi tỷ đồng); hoặc Giá trị phần đơn vị quỹ hoặc số đơn vị quỹ còn lại trên tài khoản của nhà đầu tư thấp hơn giá trị tối thiểu hoặc số lượng đơn vị quỹ tối thiểu để duy trì tài khoản của nhà đầu tư theo quy định tại Điều lệ quỹ và Bán cáo bạch.', 'Công Ty Quản Lý Quỹ có quyền thay đổi Giá dịch vụ Mua lại nhưng không được vượt quá mức quy định của pháp luật. Mức Giá dịch vụ Mua lại mới sẽ được Công Ty Quản Lý Quỹ thông báo chi tiết tại trang thông tin điện tử của Quỹ và tại các địa điểm phân phối của các Đại Lý Phân Phối.  \nGiá dịch vụ Mua lại sẽ được trừ vào khoản tiền bán được trả lại cho các Nhà Đầu Tư khi thực hiện các Lệnh Bản và được hạch toán cho Công Ty Quản Lý Quỹ và Đại Lý Phân Phối căn cứ theo hợp đồng ký giữa Công Ty Quản Lý Quỹ và Đại Lý Phân Phối.', '- Trong trường hợp nhận được yêu cầu chuyển trả cụ thể từ Nhà Đầu tư hoặc không nhận được yêu cầu chuyển trả từ Nhà Đầu Tư, số tiền không hợp lệ ở trên sẽ được chuyển trả lại cho Nhà đầu tư hoặc bên chuyển tiền không hợp lệ trong vòng 05 (năm) ngày làm việc kể từ kỳ giao dịch chứng chỉ quỹ áp dụng.  \nChương trình ĐTĐK sẽ dừng khi Nhà Đầu Tư quyết định dừng bằng cách thông báo dừng thực hiện ĐTĐK với Đại Lý Phân Phối hoặc do Nhà Đầu Tư không nộp tiền/không nộp đủ tiền mua chứng chỉ quỹ cho Chương Trình ĐTĐK trong 05 kỳ liên tiếp.  \n32', '- Kết quả hoạt động trong quá khứ của một Quỹ, của Công Ty Quản Lý Quỹ hoặc của các chủ sở hữu của Công Ty Quản Lý Quỹ không hàm ý hay đảm bảo kết quả hoạt động của Quỹ trong tương lai;\n- Tên của Quỹ không hàm ý về chất lượng hoạt động cũng như triển vọng và lợi nhuận của Quỹ trong tương lai;\n- Công Ty Quản Lý Quỹ không chịu trách nhiệm pháp lý về những rủi ro đầu tư của Quỹ và các chủ sở hữu, thành viên Hội đồng thành viên, ban điều hành và nhân viên của Công Ty Quản Lý Quỹ không có trách nhiệm pháp lý về các rủi ro hoạt động của Công Ty Quản Lý Quỹ trong quá trình quản lý Quỹ này.']",Tôi không tìm thấy thông tin đó trong tài liệu.,"Là rủi ro khi lãi suất thị trường giảm, tiền lãi hoặc gốc nhận được phải tái đầu tư với mức sinh lợi thấp hơn.",0.0,0.0,0.9999999999,1.0
Nhà đầu tư nước ngoài cần thực hiện giao dịch đầu tư qua loại tài khoản vốn nào?,"['## c) Tuân Thủ\nNhà Đầu Tư cư trú ngoài lãnh thổ Việt Nam muốn mua Đơn Vị Quỹ phải đảm bảo tuân thủ các quy định và luật áp dụng tại nước sở tại của mình. Nhà Đầu Tư chịu trách nhiệm tuân thủ các quy định về thuế, ngoại hối hay các quy định khác áp dụng đối với giao dịch mua và bán. Theo quy định hiện tại của Việt Nam, Nhà Đầu Tư nước ngoài cần mở một tài khoản đầu tư bằng tiền Đồng Việt Nam tại một ngân hàng thương mại ở Việt Nam (Tài khoản vốn đầu tư gián tiếp (IICA)). Tất cả các giao dịch đầu tư, nhận cổ tức (bao gồm chuyển tiền đăng ký mua chứng chỉ quỹ và nhận tiền thanh toán bán/nhận cổ tức từ chứng chỉ quỹ), mua ngoại tệ để chuyển tiền đầu tư ra nước ngoài và các hoạt động liên quan khác đều phải được thực hiện qua tài khoản này', 'Nhà Đầu Tư cư trú ngoài lãnh thổ Việt Nam muốn mua Đơn Vị Quỹ phải đảm bảo tuân thủ các quy định và luật áp dụng tại nước sở tại của mình. Nhà Đầu Tư chịu trách nhiệm tuân thủ các quy định về thuế, ngoại hối hay các quy định khác áp dụng đối với giao dịch mua và bán. Theo quy định hiện tại của Việt Nam, Nhà Đầu Tư nước ngoài cần mở một tài khoản đầu tư bằng tiền Đồng Việt Nam tại một ngân hàng thương mại ở Việt Nam (Tài khoản vốn đầu tư gián tiếp (IICA)). Tất cả các giao dịch đầu tư, nhận cổ tức (bao gồm chuyển tiền đăng ký mua chứng chỉ quỹ và nhận tiền thanh toán bán/nhận cổ tức từ chứng chỉ quỹ), mua ngoại tệ để chuyển tiền đầu tư ra nước ngoài và các hoạt động liên quan khác đều phải được thực hiện qua tài khoản này', 'Quỹ thực hiện đầu tư gián tiếp ra nước ngoài theo quy định của pháp luật về đầu tư sau khi được Ủy ban Chứng khoán Nhà nước chấp thuận cho phép đầu tư gián tiếp ra nước ngoài và bảo đảm các nguyên tắc sau:  \n- Quỹ đã được Ngân hàng Nhà nước Việt Nam cấp hạn mức đầu tư gián tiếp ra nước ngoài;\n- Quỹ chỉ được đầu tư gián tiếp ra nước ngoài vào các tài sản đã được quy định tại Điều lệ quỹ và phù hợp với quy định của Ngân hàng Nhà nước Việt Nam;\n- Quỹ không được đầu tư quá 20% giá trị tài sản ròng của quỹ ra nước ngoài và không vượt quá hạn mức đầu tư đăng ký đã được Ngân hàng Nhà nước Việt Nam xác nhận.', 'Việc bảo vệ Nhà Đầu Tư nước ngoài tránh khỏi rủi ro này nằm ngoài khả năng của Quỹ và vì vậy, các Nhà Đầu Tư nước ngoài, nếu cần thiết, cần phải tìm kiếm các công cụ để tự phòng ngừa rủi ro này.', 'Nhà Đầu Tư có thể thanh toán số tiền mua Đơn Vị Quỹ từ tài khoản ngân hàng của mình vào tài khoản của Quỹ để Ngân Hàng Giám Sát nhận được đúng hạn và Đại Lý Phân Phối hoàn thành xử lý việc đăng ký với Đại Lý Chuyển Nhượng. Mọi khoản đầu tư vào Đơn Vị Quỹ đều thực hiện bằng tiền Đồng Việt Nam.  \nTrong trường hợp lệnh mua chứng chỉ quỹ và việc thanh toán cho lệnh mua được thực hiện bởi cá nhân, tổ chức khác không phải nhà đầu tư thì phiếu lệnh và tài liệu xác nhận thanh toán phải nêu rõ tên, số tài khoản và giá trị thanh toán của nhà đầu tư được hưởng lợi.', 'Nhà Đầu Tư có thể thanh toán số tiền mua Đơn Vị Quỹ bằng cách chuyển khoản từ tài khoản ngân hàng của mình hoặc nộp tiền trực tiếp vào tài khoản của Quỹ để Ngân Hàng Giám Sát nhận được đúng hạn và Đại Lý Phân Phối hoàn thành xử lý việc đăng ký với Đại Lý Chuyển Nhượng. Mọi khoản đầu tư vào Đơn Vị Quỹ đều thực hiện bằng tiền Đồng Việt Nam.  \nTrong trường hợp lệnh mua chứng chỉ quỹ và việc thanh toán cho lệnh mua được thực hiện bởi cá nhân, tổ chức khác không phải nhà đầu tư thì phiếu lệnh và tài liệu xác nhận thanh toán phải nêu rõ tên, số tài khoản và giá trị thanh toán của nhà đầu tư được hưởng lợi.  \n- **Tuân Thủ**', 'Nhà Đầu Tư có thể mở nhiều tài khoản tại các Đại lý phân phối khác nhau để cùng giao dịch một loại Chứng chỉ Quỹ. Nhà Đầu Tư cần nộp Hợp đồng và các giấy tờ quy định để mở tài khoản giao dịch tại mỗi Đại Lý Phân Phối mà Nhà Đầu Tư muốn thực hiện giao dịch. Các tài khoản tại các Đại Lý Phân Phối khác nhau của cùng một Nhà Đầu Tư được quản lý độc lập. Do đó, Lệnh Mua lần đầu tối thiểu cũng như số dư tài khoản tối thiểu được áp dụng cho từng Đại Lý Phân Phối. Nhà Đầu Tư chỉ có thể nộp các Phiếu Lệnh Bán, Chuyển Đổi, Chuyển Nhượng, Hủy Lệnh hay thay đổi thông tin tài khoản của tài khoản mở tại một Đại Lý Phân Phối ở bất kỳ Điểm Nhận Lệnh nào của Đại Lý Phân Phối đó.', '## 2.3. Đặc trưng của chứng chỉ Quỹ đầu tư\nNhà đầu tư của Quỹ là cá nhân, tổ chức trong và ngoài nước, sở hữu chứng chỉ quỹ. Nhà đầu tư không chịu trách nhiệm pháp lý hoặc nghĩa vụ khác ngoài trách nhiệm trong phạm vi số chứng chỉ Quỹ mà họ sở hữu. Nhà đầu tư là tổ chức bao gồm các tổ chức kinh tế và xã hội được pháp luật Việt Nam công nhận.  \nNhà đầu tư pháp nhân cử người đại diện hợp pháp đại diện cho số Chứng chỉ quỹ mà mình sở hữu. Việc đề cử, hủy bỏ hay thay thế người đại diện này phải được thông báo bằng văn bản, do người đại diện có thẩm quyền của nhà đầu tư tổ chức ký.', 'a) Hợp đồng mở tài khoản giao dịch chứng khoán và đăng ký giao dịch quỹ mở  \nNhà Đầu Tư mua Đơn Vị Quỹ lần đầu tiên cần điền đầy đủ vào Hợp đồng để mua Đơn Vị Quỹ. Hợp đồng được cung cấp tại bất kỳ Điểm Nhận Lệnh nào. Hợp đồng phải kèm theo các bản sao hợp lệ các giấy tờ quy định trong Hợp đồng (bao gồm Xác nhận đăng ký mở tài khoản góp vốn của ngân hàng thương mại đối với trường hợp Nhà Đầu Tư nước ngoài) đối với mỗi cá nhân/tổ chức hay các bên đồng sở hữu hay người được hưởng lợi hay người được ủy quyền.', '## 2.4 Cơ chế giao dịch chứng chỉ quỹ\nNhà Đầu Tư có thể liên tục giao dịch các Đơn Vị Quỹ kể từ Ngày Giao Dịch đầu tiên.', '## 3. Giao dịch chứng chỉ quỹ các lần tiếp theo\nNhà Đầu Tư có thể liên tục giao dịch các Đơn Vị Quỹ kể từ Ngày Giao Dịch đầu tiên.', '## 2.4.1. Ngày giao dịch\nNhà đầu tư có thể mua, bán, chuyển đổi Quỹ hoặc chuyển nhượng Đơn vị Quỹ vào một trong các Ngày Giao Dịch. Ngày Giao Dịch được xác định như sau:  \n- Các ngày làm việc trong tuần từ thứ Hai đến thứ Sáu (tần suất giao dịch hàng ngày).\n- Ngày Giao Dịch sẽ không bao gồm các ngày nghỉ lễ, kể cả nghỉ bù theo quy định của pháp luật.  \nViệc giảm tần suất giao dịch sẽ được Đại Hội Nhà Đầu Tư thông qua và luôn đảm bảo tần suất giao dịch không được ít hơn hai lần trong một tháng.', '## 3. Giá dịch vụ và thưởng hoạt động\nNhà Đầu Tư được khuyến khích nắm giữ các Đơn Vị Quỹ như một phần của các khoản đầu tư dài hạn và chương trình tiết kiệm hưu trí. Quỹ mở không được thiết kế cho mục đích mua bán ngắn hạn. Việc Nhà Đầu Tư thường xuyên mua đi và bán lại Đơn Vị Quỹ, vốn được thiết kế để đạt được lợi nhuận dài hạn sẽ ảnh hưởng đến mục tiêu lợi nhuận của Nhà Đầu Tư khi đầu tư vào Quỹ cũng như lợi nhuận của Quỹ.  \nGiá dịch vụ Mua lại và các khoản giá dịch vụ ngân hàng và thuế khác (nếu có) sẽ được trừ vào khoản tiền thu được từ bán Đơn Vị Quỹ của Nhà Đầu Tư.', '## 3. Giao dịch chứng chỉ quỹ các lần tiếp theo\n- Ngày giao dịch  \nNhà đầu tư có thể mua, bán, chuyển đổi Quỹ hoặc chuyển nhượng Đơn vị Quỹ vào một trong các Ngày Giao Dịch. Ngày Giao Dịch là các ngày từ Thứ 2 đến Thứ 6 hàng tuần.  \nNgày Giao Dịch sẽ không bao gồm các ngày nghỉ lễ, kể cả nghỉ bù theo quy định của pháp luật.  \nViệc giảm tần suất giao dịch sẽ được Đại Hội Nhà Đầu Tư thông qua và luôn đảm bảo tần suất giao dịch không được ít hơn hai lần trong một tháng.  \n- Giá bán/Giá dịch vụ phát hành và Giá dịch vụ mua lại  \n**Giá bán/Giá dịch vụ phát hành:** Là mức giá Nhà Đầu Tư phải thanh toán để mua một đơn vị quỹ.', 'Nhà Đầu Tư thanh toán tiền mua Đơn Vị Quỹ vào một tài khoản phong tỏa của Quỹ mở tại Ngân Hàng Giám Sát. Thông tin chi tiết của tài khoản này sẽ được cung cấp bởi các Đại Lý Phân Phối và được đề cập trong Đơn Đăng Ký. Ngân Hàng Giám Sát sẽ thanh toán lãi phát sinh (nếu có) trên các khoản tiền gửi trong tài khoản ký quỹ với mức lãi suất không thấp hơn lãi suất tiền gửi không kỳ hạn đang được áp dụng của Ngân Hàng Giám Sát trong suốt quá trình IPO. Nếu IPO thành công, số lãi này sẽ cấu thành một phần tài sản Quỹ.', '## 2.5.3. Thông tin về các mức giá dịch vụ\nCác loại phí/dịch vụ và chi phí/giá dịch vụ liên quan trực tiếp đến việc giao dịch Đơn Vị Quỹ sẽ do Nhà Đầu Tư trả và không được tính vào chi phí của Quỹ. Công Ty Quản Lý Quỹ bảo lưu quyền thay đổi biểu phí/giá dịch vụ này.  \nCác khoản giá dịch vụ giao dịch như sau:', '## 3. Giá dịch vụ và thưởng hoạt động\nCác loại phí/dịch vụ và chi phí/giá dịch vụ liên quan trực tiếp đến việc giao dịch Đơn Vị Quỹ sẽ do Nhà Đầu Tư trả và không được tính vào chi phí của Quỹ. Công Ty Quản Lý Quỹ bảo lưu quyền thay đổi biểu phí/giá dịch vụ này.  \nCác khoản giá dịch vụ giao dịch như sau:', '. Nhà Đầu Tư cần tham khảo các ý kiến tư vấn về luật và thuế để có thông tin phù hợp đối với các giao dịch của mình.', '## c) Tuân Thủ\n. Nhà Đầu Tư cần tham khảo các ý kiến tư vấn về luật và thuế để có thông tin phù hợp đối với các giao dịch của mình.', 'Nhà đầu tư nên lưu lại một bản Hợp đồng và cập nhật các thông tin cung cấp trong Hợp đồng. Thông tin này sẽ được lưu lại trong Số Đăng Ký của Quỹ và luôn chứa đựng thông tin về địa chỉ hiện tại địa chỉ thư điện tử, nơi đăng ký thuế, và chi tiết tài khoản ngân hàng của từng Nhà Đầu Tư nhằm đảm bảo Nhà Đầu Tư nhận được đầy đủ các thông báo, báo cáo và thanh toán liên quan đến Quỹ.  \nNhà Đầu Tư mua Đơn Vị Quỹ tại các lần tiếp theo cần điền đầy đủ vào phiếu Lệnh Mua có sẵn tại các Điểm Nhận Lệnh.', '## 2.2.5 Điều chỉnh danh mục đầu tư\nCơ cấu đầu tư của quỹ mở chỉ được vượt mức so với các hạn chế đầu tư đã quy định tại điểm a, b, c, d, đ, e và i mục IX.2.2.4 và chỉ do các nguyên nhân sau:  \na) Biến động giá trên thị trường của tài sản trong danh mục đầu tư của quỹ;  \nb) Thực hiện các khoản thanh toán của quỹ theo quy định của pháp luật, bao gồm việc thực hiện lệnh giao dịch của nhà đầu tư;', 'Vị Quỹ, bao gồm cả phần lẻ của Đơn Vị Quỹ. Nhà Đầu Tư chuyển nhượng cần điền Lệnh Chuyển Nhượng Đơn Vị Quỹ với điều kiện là số lượng Chuyển Nhượng phải bằng hoặc lớn hơn số dư tối thiểu khi mở tài khoản nếu người nhận chuyển nhượng chưa phải là Nhà Đầu Tư.  \n- **Xử Lý Các Đơn Chuyển Nhượng**', 'Nhà Đầu Tư mua Đơn Vị Quỹ cần điền đầy đủ vào phiếu Lệnh Mua có sẵn tại các Điểm Nhận Lệnh.  \nNhà Đầu Tư chỉ có thể nộp các Phiếu Lệnh Bán, Chuyển Đổi, Chuyển Nhượng, Hủy Lệnh hay thay đổi thông tin tài khoản của tài khoản mở tại một Đại Lý Phân Phối ở bất kỳ Điểm Nhận Lệnh nào của Đại Lý Phân Phối đó.', '- Việc thực hiện tất cả các lệnh giao dịch của Nhà Đầu Tư tại Ngày Giao Dịch dẫn đến NAV của Quỹ thấp hơn 50.000.000.000 đồng (năm mươi tỷ đồng); hoặc Giá trị phần đơn vị quỹ hoặc số đơn vị quỹ còn lại trên tài khoản của nhà đầu tư thấp hơn giá trị tối thiểu hoặc số lượng đơn vị quỹ tối thiểu để duy trì tài khoản của nhà đầu tư theo quy định tại Điều lệ quỹ và Bán cáo bạch.\n- Trường hợp thực hiện một phần Lệnh Bán, Lệnh mua, Lệnh Chuyến Đổi Quỹ theo quy định nêu trên, Công ty Quản Lý Quỹ áp dụng nguyên tắc phân phối cùng tỷ lệ: Phần giá trị được thực hiện sẽ được phân bổ cho tất cả nhà đầu tư đăng ký giao dịch theo cùng một tỷ lệ giữa giá trị thực hiện và giá trị đăng ký giao dịch.  \nSố lượng chứng chỉ quỹ được thực hiện trong trường hợp này được tính như sau:', '- Thực hiện các lệnh giao dịch của Nhà Đầu Tư;  \n- Các hoạt động sáp nhập, hợp nhất của các tổ chức phát hành các chứng khoán mà Quỹ đang nắm giữ;  \n- Quỹ mới được cấp phép thành lập hoặc do tách Quỹ, hợp nhất Quỹ, sát nhập Quỹ mà thời gian hoạt động không quá sáu (06) tháng, tính từ ngày được cấp giấy chứng nhận đăng ký lập Quỹ;  \n- Quỹ đang trong thời gian giải thể.  \nTrong trường hợp xảy ra sai lệch so với các hạn mức đầu tư, Công ty Quản Lý Quỹ sẽ điều chỉnh danh mục đầu tư để đáp ứng các hạn mức đầu tư kể trên trong vòng 3 (ba) tháng kể từ ngày mà sai lệch phát sinh.']","Nhà đầu tư nước ngoài cần thực hiện giao dịch đầu tư qua tài khoản phong tỏa tại ngân hàng giám sát.pecifically, the document states that ""Nhà Đầu Tư thanh toán tiền mua Đơn Vị Quỹ vào một tài khoản phong tỏa của Quỹ mở tại Ngân Hàng Giám Sát.""",Nhà đầu tư nước ngoài phải thực hiện qua Tài khoản vốn đầu tư gián tiếp (IICA) tại một ngân hàng thương mại ở Việt Nam.,1.0,0.4456823108071408,0.99999999995,1.0
Ai là những người chịu trách nhiệm chính về nội dung Bản cáo bạch từ phía Công ty quản lý quỹ?,"['## XV. CAM KẾT\nCông Ty Quản Lý Quỹ cam kết chịu hoàn toàn trách nhiệm về tính chính xác, trung thực của nội dung thông tin và các tài liệu đính kèm trong Bản cáo bạch này.', '## 1. Công ty quản lý quỹ\nBà Nguyễn Thị Thu Hiền\nChức vụ: Chủ tịch Hội đồng quản trị  \nÔng Đặng Lưu Dũng\nChức vụ: Tổng Giám đốc  \nBà Phan Thị Thu Hằng\nChức vụ: Kế toán trưởng  \nChúng tôi đảm bảo rằng các thông tin và số liệu trong Bản Cáo Bạch này là phù hợp với thực tế mà chúng tôi được biết, hoặc đã điều tra, thu thập một cách hợp lý. Tuy vậy, thông tin trong Bản Cáo Bạch này chưa được thẩm định bởi bất kỳ bên nào khác ngoại trừ như được đề cập tại Bản Cáo Bạch này.', '# XII. XUNG ĐỘT LỢI ÍCH\nCông Ty Quản Lý Quỹ có nghĩa vụ, theo Điều lệ và theo thông lệ quốc tế tốt nhất, tại mọi thời điểm hoạt động vì lợi ích của Nhà Đầu Tư và quản lý một cách công bằng, minh bạch đối với tất cả các quỹ do Công ty quản lý. Bộ phận kiểm soát nội bộ và quản trị rủi ro của Công Ty sẽ chịu trách nhiệm theo dõi và giám sát các xung đột lợi ích thực tế hoặc có khả năng xảy ra. Trong trường hợp xung đột lợi ích phát sinh, Công ty Quản lý Quỹ sẽ thông báo cho Ban Đại Diện Quỹ để thống nhất phương án khắc phục nhằm giảm thiểu hoặc quản lý các xung đột đó.', '## 2.12. Kiểm toán, kế toán và chế độ báo cáo\nCông ty Quản Lý Quỹ có trách nhiệm duy trì sổ sách kế toán và chuẩn bị báo cáo tài chính cho Quỹ. Phù hợp với quy định tại Điều 38 của Điều Lệ Quỹ, Công ty Quản Lý Quỹ có thể ủy quyền cho một nhà cung cấp dịch vụ để thực hiện Công việc này. Mọi Sổ sách kế toán và báo cáo tài chính của Quỹ sẽ được lưu tại văn phòng của Công ty Quản Lý Quỹ hoặc của nhà cung cấp dịch vụ mà Công ty Quản Lý Quỹ ủy quyền. Ban Đại diện Quỹ có quyền kiểm tra bất kỳ báo cáo, sổ sách kế toán, hoặc tài liệu nào của Quỹ.  \nCác quy định khác liên quan đến kiểm toán, kế toán và chế độ báo cáo tuân thủ theo quy định tại Điều lệ Quỹ.', '1  \nỦy ban Chứng khoán Nhà nước cấp giấy phép phát hành chứng chỉ quỹ ra công chúng có nghĩa là việc xin phép lập Quỹ và phát hành chứng chỉ quỹ đầu tư đã thực hiện theo các quy định của pháp luật liên quan, không hàm ý bảo đảm về nội dung của Bản cáo bạch cũng như mục tiêu, chiến lược đầu tư của Quỹ.', 'ngược lại;  \n- Ngân hàng giám sát, thành viên Hội đồng quản trị, người điều hành và nhân viên của ngân hàng giám sát làm nhiệm vụ giám sát hoạt động và bảo quản tài sản của quỹ đại chúng, công ty đầu tư chứng khoán không được là đối tác mua, bán trong giao dịch mua, bán tài sản của quỹ đại chúng, công ty đầu tư chứng khoán.\n- Có đầy đủ năng lực cung cấp dịch vụ giám sát, lưu ký;\n- Thực hiện các cam kết đối với Quỹ như nêu tại Phụ lục 2 và Phụ lục 3 của Điều lệ Quỹ.  \nCác quy định về quyền và nghĩa vụ, hoạt động giám sát và chấm dứt quyền và nghĩa vụ của Ngân hàng giám sát tuân thủ theo quy định tại chương VII Điều lệ Quỹ.', '## Lĩnh vực được phép đầu tư\n- Có quy định tại Điều lệ quỹ và Bản cáo bạch;\n- Đã được Ban đại diện quỹ chấp thuận bằng văn bản về loại, mã chứng khoán, số lượng, giá trị giao dịch, thời điểm thực hiện;\n- Có đủ tài liệu chứng minh về bảo lãnh thanh toán hoặc tài liệu về cam kết mua lại của tổ chức phát hành.', '## 2.3. Đặc trưng của chứng chỉ Quỹ đầu tư\nNhà đầu tư của Quỹ là cá nhân, tổ chức trong và ngoài nước, sở hữu chứng chỉ quỹ. Nhà đầu tư không chịu trách nhiệm pháp lý hoặc nghĩa vụ khác ngoài trách nhiệm trong phạm vi số chứng chỉ Quỹ mà họ sở hữu. Nhà đầu tư là tổ chức bao gồm các tổ chức kinh tế và xã hội được pháp luật Việt Nam công nhận.  \nNhà đầu tư pháp nhân cử người đại diện hợp pháp đại diện cho số Chứng chỉ quỹ mà mình sở hữu. Việc đề cử, hủy bỏ hay thay thế người đại diện này phải được thông báo bằng văn bản, do người đại diện có thẩm quyền của nhà đầu tư tổ chức ký.', '## 3. Giá dịch vụ và thưởng hoạt động\nCác loại phí/dịch vụ và chi phí/giá dịch vụ liên quan trực tiếp đến việc giao dịch Đơn Vị Quỹ sẽ do Nhà Đầu Tư trả và không được tính vào chi phí của Quỹ. Công Ty Quản Lý Quỹ bảo lưu quyền thay đổi biểu phí/giá dịch vụ này.  \nCác khoản giá dịch vụ giao dịch như sau:', '## 2.5.3. Thông tin về các mức giá dịch vụ\nCác loại phí/dịch vụ và chi phí/giá dịch vụ liên quan trực tiếp đến việc giao dịch Đơn Vị Quỹ sẽ do Nhà Đầu Tư trả và không được tính vào chi phí của Quỹ. Công Ty Quản Lý Quỹ bảo lưu quyền thay đổi biểu phí/giá dịch vụ này.  \nCác khoản giá dịch vụ giao dịch như sau:', '## 2.10. Tiêu chí lựa chọn, quyền hạn và trách nhiệm của Công ty Quản lý quỹ\nCông ty Quản Lý Quỹ được lựa chọn phải thỏa mãn các điều kiện sau:  \n- Được thực hiện nghiệp vụ Quản Lý Quỹ;\n- Hoàn toàn độc lập với Ngân Hàng Giám Sát;\n- Có đầy đủ cơ sở vật chất, nhân sự để Quản Lý Quỹ mở;\n- Đồng ý thực hiện các cam kết đối với Quỹ như nêu tại Phụ Lục 1 và Phụ Lục 3 của Điều lệ Quỹ.  \nCác quy định về quyền và nghĩa vụ, chấm dứt quyền và nghĩa vụ, hạn chế hoạt động của Công ty Quản lý quỹ tuân thủ theo quy định tại Chương VI Điều lệ Quỹ.', '“Bản Cáo Bạch”\ncó nghĩa là tài liệu này hoặc dữ liệu điện tử công khai thông tin chính xác, trung thực và khách quan liên quan đến việc chào bán và phát hành Chứng Chỉ Quỹ của Quỹ.  \n“Hợp Đồng Giám Sát”\ncó nghĩa là hợp đồng được ký kết giữa Công ty Quản Lý Quỹ và Ngân Hàng Giám Sát được thông qua bởi Đại Hội Nhà Đầu Tư.  \n“Nhà Đầu Tư”\nlà cá nhân, tổ chức trong nước và ngoài nước nắm giữ Chứng Chỉ Quỹ  \n“Đại Hội Nhà Đầu Tư”\nLà đại hội của Nhà Đầu Tư có quyền biểu quyết được tổ chức thường kỳ hoặc bất thường để thông qua các vấn đề quan trọng có liên quan đến Quỹ. Đại Hội Nhà Đầu Tư là cơ quan quyền lực cao nhất của Quỹ.  \n“Ban Đại Diện Quỹ”', '- Kết quả hoạt động trong quá khứ của một Quỹ, của Công Ty Quản Lý Quỹ hoặc của các chủ sở hữu của Công Ty Quản Lý Quỹ không hàm ý hay đảm bảo kết quả hoạt động của Quỹ trong tương lai;\n- Tên của Quỹ không hàm ý về chất lượng hoạt động cũng như triển vọng và lợi nhuận của Quỹ trong tương lai;\n- Công Ty Quản Lý Quỹ không chịu trách nhiệm pháp lý về những rủi ro đầu tư của Quỹ và các chủ sở hữu, thành viên Hội đồng thành viên, ban điều hành và nhân viên của Công Ty Quản Lý Quỹ không có trách nhiệm pháp lý về các rủi ro hoạt động của Công Ty Quản Lý Quỹ trong quá trình quản lý Quỹ này.', '|  Ông Đào Kiên Trung | Ông Trung tốt nghiệp Đại học Luật chuyên ngành Pháp luật Quốc tế, Đại học ngoại ngữ Hà Nội chuyên ngành Tiếng Anh.  \nTừ 1999 đến nay, ông Trung đã trải qua nhiều vị trí khác nhau tại các đơn vị như Công ty TNHH Grant Thornton VN, Ngân hàng TMCP Kỹ Thương Việt Nam, CTCP FPT, Công ty QLQ FPT, Công ty TNHH Quản lý nợ và khai thác tài sản - Ngân hàng TMCP Kỹ Thương Việt Nam.  \nHiện nay ông Trung giữ chức vụ Giám đốc pháp chế và tuân thủ kiêm Kiểm soát nội bộ, Pháp chế và kiểm soát tuân thủ Công ty Cổ phần quản lý Quỹ Kỹ Thương.  |\n| --- | --- |\n|  Ông Trần Viết Thỏa | Ông Thỏa có 20 năm kinh nghiệm trong lĩnh vực kế toán, kiểm toán và tài chính và đầu tư.  \n9 năm kinh nghiệm với vai trò giám đốc kiểm toán tại Công ty TNHH KPMG Việt Nam.', '## 2.3. Đặc trưng của chứng chỉ Quỹ đầu tư\nCông ty quản lý quỹ thực hiện hoặc ủy quyền cho tổ chức cung cấp dịch vụ đại lý chuyển nhượng lập và quản lý số đăng ký nhà đầu tư chính (sổ chính) hoặc ủy quyền đại lý ký danh lập, quản lý đăng ký nhà đầu tư phụ (sổ phụ) và xác nhận quyền sở hữu chứng chỉ quỹ cho nhà đầu tư.  \nSố đăng ký nhà đầu tư của Quỹ có thể là văn bản, tập dữ liệu điện tử hoặc cả hai. Các nội dung của Số đăng ký nhà đầu tư được quy định chi tiết tại điều 15 Điều lệ Quỹ.', 'e. Phụ Cấp Ban Đại Diện Quỹ  \nCác chi phí của Ban Đại Diện Quỹ bao gồm chi phí ăn ở, đi lại với mức hợp lý và phù hợp với các quy định tại Điều lệ Quỹ, các chi phí phát sinh từ hoạt động của Ban Đại Diện Quỹ để phục vụ cho lợi ích của Quỹ sẽ được tính vào chi phí của Quỹ. Để dễ hiểu, chi phí trên không bao gồm các chi phí bảo hiểm đối với trách nhiệm phát sinh cho Ban Đại Diện Quỹ khi thực hiện nghĩa vụ của Ban Đại Diện Quỹ. Thù lao của các thành viên của Ban Đại Diện Quỹ được tính vào chi phí hoạt động của Quỹ và tổng mức thù lao không được vượt quá tổng ngân sách hoạt động hàng năm của Ban Đại Diện đã được thông qua tại Đại Hội Nhà Đầu Tư.', 'Trường hợp sai lệch là do Công ty Quản Lý Quỹ không tuân thủ các hạn chế đầu tư theo quy định của Pháp Luật hoặc Điều lệ Quỹ, Công ty Quản Lý Quỹ có trách nhiệm điều chỉnh lại danh mục đầu tư trong thời hạn mười lăm (15) ngày, kể từ ngày phát sinh sai lệch. Trong trường hợp này, Công ty Quản Lý Quỹ phải chịu mọi chi phí phát sinh liên quan đến các giao dịch này và các tổn thất (nếu có phát sinh). Nếu phát sinh lợi nhuận, thì phải hạch toán ngay mọi khoản lợi nhuận có được cho Quỹ.', '## 2. Ngân hàng giám sát\nNgân hàng TMCP Đầu tư và Phát triển Việt Nam - Chi nhánh Hà Thành  \nĐại diện hợp pháp: Ông Nguyễn Mạnh Cường  \nChức vụ: Phó Giám đốc  \nBản cáo bạch này là một phần của hồ sơ đăng ký chào bán của Công ty Cổ phần Quản lý quỹ Kỹ thương (Techcom Capital – “TCC”). Chúng tôi, với tư cách là Ngân hàng Giám sát của Quỹ Đầu Tư Cổ phiếu Doanh nghiệp vừa và nhỏ Techcom (TCSME) sẽ chịu trách nhiệm theo các quy định trong phạm vi Hợp Đồng Cung Cấp Dịch Vụ Giám Sát Quỹ được ký kết giữa chúng tôi với Công ty Cổ phần Quản lý quỹ Kỹ thương, là công ty quản lý Quỹ Đầu tư Cổ phiếu Doanh nghiệp vừa và nhỏ Techcom và theo quy định của pháp luật.', 'Trong thời hạn 05 ngày làm việc kể từ ngày hoàn tất việc điều chỉnh lại danh mục đầu tư, công ty quản lý quỹ phải công bố thông tin theo quy định, đồng thời thông báo cho Ủy ban Chứng khoán Nhà nước về các sai lệch cơ cấu danh mục đầu tư, nguyên nhân, thời điểm phát sinh hoặc phát hiện ra sự việc, mức độ thiệt hại và bồi thường thiệt hại cho quỹ (nếu có) hoặc lợi nhuận tạo cho quỹ (nếu có), biện pháp khắc phục, thời gian thực hiện, kết quả khắc phục.  \nCông ty quản lý quỹ chỉ được gửi tiền và đầu tư công cụ thị trường tiền tệ quy định tại điểm a, b mục IX.2.2.3 của các tổ chức tín dụng trong danh sách đã được Ban đại diện quỹ phê duyệt.', '## 3. Các rủi ro khi đầu tư vào Quỹ\nMục tiêu của Công Ty Quản Lý Quỹ là quản lý các rủi ro đầu tư, và nếu có thể, hạn chế tác động của các rủi ro này bằng việc áp dụng các phương pháp quản lý đầu tư theo tiêu chuẩn quốc tế tốt nhất. Nhà Đầu Tư cần lưu ý các điểm quan trọng sau đây:  \n- Quỹ, Công Ty Quản Lý Quỹ, thành viên Hội đồng thành viên, ban điều hành và nhân viên Công Ty Quản Lý Quỹ không có bất kỳ sự đảm bảo nào đối với vốn đầu tư ban đầu cũng như mức lợi nhuận từ đầu tư của Quỹ;\n- Không có bất kỳ sự bảo đảm nào về sổ lần chi trả và giá trị của cổ tức được thanh toán trong tương lai;  \n42', '## Lĩnh vực được phép đầu tư\nđ) Cổ phiếu chào bán lần đầu ra công chúng, trái phiếu chào bán ra công chúng; trái phiếu doanh nghiệp phát hành riêng lẻ bởi tổ chức niêm yết có bảo lãnh thanh toán của tổ chức tín dụng hoặc cam kết mua lại của tổ chức phát hành tối thiểu 1 lần trong 12 tháng và mỗi lần cam kết mua lại tối thiểu 30% giá trị đợt phát hành;  \ne) Chứng khoán phải sinh niêm yết giao dịch tại Sở giao dịch chứng khoán và chỉ nhằm mục tiêu phòng ngừa rủi ro cho chứng khoán cơ sở mà quỹ đang nắm giữ;  \ng) Quyền phát sinh gắn liền với chứng khoán mà quỹ đang nắm giữ.  \nViệc đầu tư vào các tài sản quy định tại điểm đ khoản 2.2.3 Điều này phải đáp ứng các điều kiện sau:  \n- Có quy định tại Điều lệ quỹ và Bản cáo bạch;', 'Ban điều hành Công ty  \n- **Ông Đặng Lưu Dũng – Tổng Giám đốc**  \nDanh sách nhân viên điều hành Quỹ  \n- **Ông Phi Tuấn Thành**  \nÔng Thành tốt nghiệp Đại học Kinh tế Quốc dân và Thạc sĩ Quản trị kinh doanh – ĐH Tổng hợp bang Washington, Hoa Kỳ. Ông Thành được cấp Chứng chỉ hành nghề Quản lý Quỹ của Bộ Tài Chính số 00135/QLQ ngày 15/04/2009.  \nÔng Thành đã có hơn 15 năm kinh nghiệm trong lĩnh vực tài chính ngân hàng, với 2 năm làm việc tại ngân hàng VID Public và 3 năm làm phó trưởng phòng phân tích của CTCP Chứng khoán Sài Gòn SSI.  \nÔng hiện đảm nhiệm vị trí Giám đốc Phân tích đầu tư – Công ty Cổ phần Quản lý Quỹ Kỹ Thương từ năm 2010 cho tới nay.  \n- **Bà Đồng Thị Khánh Ngọc**', '9 năm kinh nghiệm với vai trò giám đốc kiểm toán tại Công ty TNHH KPMG Việt Nam.  \nHiện là Giám đốc tài chính (CFO) tại Công ty CP Đầu tư Thương Mại Quốc Tế Mặt Trời Đỏ.  |  \nCác quy định về tiêu chuẩn lựa chọn thành viên Ban đại diện Quỹ, quyền hạn và nhiệm vụ của Ban đại diện Quỹ, chủ tịch Ban đại diện Quỹ, đình chỉ hoặc bãi miễn thành viên Ban đại diện Quỹ, cuộc họp của Ban đại diện Quỹ tuân theo quy định tại chương V Điều lệ Quỹ.', '## 2. Điều lệ Quỹ tóm tắt\nCơ quan quyền lực cao nhất của Quỹ là Đại hội Nhà Đầu tư.  \nBan Đại diện Quỹ sẽ do Đại hội Nhà Đầu tư bầu ra để giám sát các hoạt động thường xuyên của Quỹ, TCC và Ngân hàng giám sát.  \n#### 2.1.2 Tổng vốn huy động và số lượng chứng chỉ Quỹ được chào bán  \nVốn Điều lệ được huy động trong lần đầu chào bán ra công chúng của Quỹ là 50.000.000.000 VNĐ (Năm mươi tỷ đồng). Vốn Điều lệ sẽ được chia thành 5.000.000 (Năm triệu) Chứng chỉ Quỹ. Mệnh giá của một Chứng chỉ Quỹ sẽ là 10.000 VNĐ (mười nghìn Đồng Việt Nam).  \nNhà đầu tư góp vốn bằng tiền Đồng Việt Nam dưới hình thức chuyển khoản hoặc chuyển tiền vào tài khoản của Quỹ mở tại ngân hàng giám sát.  \nSố lượng chứng chỉ quỹ/tổng chứng chỉ quỹ được phép lưu hành tối đa: không hạn chế.', '# QUỸ ĐẦU TƯ CỔ PHIẾU DOANH NGHIỆP VỮA VÀ NHỎ TECHCOM (TCSME)\n**Phụ trách công bố thông tin:**  \n**Ông** : Đặng Lưu Dũng – Tổng Giám đốc  \n**Địa chỉ** : Công ty Cổ phần Quản lý quỹ Kỹ thương  \nTầng 28, Tòa C5, số 119 Trần Duy Hưng, phường Trung Hòa, Quận Cầu Giấy, Hà Nội  \n**Điện thoại** : (84-24) 39446368Fax: (84-24) 39446583']","Theo thông tin được cung cấp, những người chịu trách nhiệm chính về nội dung Bản cáo bạch từ phía Công ty quản lý quỹ Techcom Capital bao gồm:

1. Ông Đặng Lưu Dũng - Tổng Giám đốc của Công ty Cổ phần Quản lý quỹ Kỹ thương (Techcom Capital).

2. Các thành viên Ban Đại diện Quỹ, cụ thể là:
   - Ông Phi Tuấn Thành: Giám đốc Phân tích đầu tư
   - Bà Đồng Thị Khánh Ngọc

3. Ngân hàng giám sát Techcombank Hà Thành cũng chịu trách nhiệm theo các quy định trong Hợp đồng cung cấp dịch vụ giám sát quỹ.

Trong đó, ông Đặng Lưu Dũng có thể là người chịu trách nhiệm chính nhất về nội dung bản cáo bạch do ông là Tổng Giám đốc của công ty quản lý quỹ.","Bà Nguyễn Thị Thu Hiền (Chủ tịch HĐQT), Ông Đặng Lưu Dũng (Tổng Giám đốc), Bà Phan Thị Thu Hằng (Kế toán trưởng).",0.8888888888888888,0.4778249756352955,0.49999999995,1.0
Ban đại diện Quỹ bao gồm những thành viên nào?,"['“Ban Đại Diện Quỹ”\nlà những người đại diện cho Nhà Đầu Tư được Đại Hội Nhà Đầu Tư bầu ra để thay mặt Nhà Đầu Tư thực hiện việc giám sát các hoạt động của Quỹ, Công ty Quản Lý Quỹ và Ngân Hàng Giám Sát.  \n“Vốn Điều lệ”\nlà tổng số vốn bằng tiền do các Nhà Đầu Tư thực góp trong đợt phát hành Chứng Chỉ Quỹ lần đầu ra công chúng và được ghi trong Điều lệ.  \n“Chứng Chỉ Quỹ”\nLà loại chứng khoán xác nhận quyền sở hữu của nhà đầu tư đối với một phần vốn góp tại quỹ. Mệnh giá 01 chứng chỉ quỹ là 10.000 đồng.  \n“Giá bán/ Giá phát hành”', 'e. Phụ Cấp Ban Đại Diện Quỹ  \nCác chi phí của Ban Đại Diện Quỹ bao gồm chi phí ăn ở, đi lại với mức hợp lý và phù hợp với các quy định tại Điều lệ Quỹ, các chi phí phát sinh từ hoạt động của Ban Đại Diện Quỹ để phục vụ cho lợi ích của Quỹ sẽ được tính vào chi phí của Quỹ. Để dễ hiểu, chi phí trên không bao gồm các chi phí bảo hiểm đối với trách nhiệm phát sinh cho Ban Đại Diện Quỹ khi thực hiện nghĩa vụ của Ban Đại Diện Quỹ. Thù lao của các thành viên của Ban Đại Diện Quỹ được tính vào chi phí hoạt động của Quỹ và tổng mức thù lao không được vượt quá tổng ngân sách hoạt động hàng năm của Ban Đại Diện đã được thông qua tại Đại Hội Nhà Đầu Tư.', 'Ban điều hành Công ty  \n- **Ông Đặng Lưu Dũng – Tổng Giám đốc**  \nDanh sách nhân viên điều hành Quỹ  \n- **Ông Phi Tuấn Thành**  \nÔng Thành tốt nghiệp Đại học Kinh tế Quốc dân và Thạc sĩ Quản trị kinh doanh – ĐH Tổng hợp bang Washington, Hoa Kỳ. Ông Thành được cấp Chứng chỉ hành nghề Quản lý Quỹ của Bộ Tài Chính số 00135/QLQ ngày 15/04/2009.  \nÔng Thành đã có hơn 15 năm kinh nghiệm trong lĩnh vực tài chính ngân hàng, với 2 năm làm việc tại ngân hàng VID Public và 3 năm làm phó trưởng phòng phân tích của CTCP Chứng khoán Sài Gòn SSI.  \nÔng hiện đảm nhiệm vị trí Giám đốc Phân tích đầu tư – Công ty Cổ phần Quản lý Quỹ Kỹ Thương từ năm 2010 cho tới nay.  \n- **Bà Đồng Thị Khánh Ngọc**', '## g) Phụ Cấp Ban Đại Diện Quỹ\nCác chi phí của Ban Đại Diện Quỹ bao gồm chi phí ăn ở, đi lại với mức hợp lý và phù hợp với các quy định tại Điều lệ Quỹ, các chi phí phát sinh từ hoạt động của Ban Đại Diện Quỹ để phục vụ cho lợi ích của Quỹ sẽ được tính vào chi phí của Quỹ. Để dễ hiểu, chi phí trên không bao gồm các chi phí bảo hiểm đối với trách nhiệm phát sinh cho Ban Đại Diện Quỹ khi thực hiện nghĩa vụ của Ban Đại Diện Quỹ. Thủ lao của các thành viên của Ban Đại Diện Quỹ được tính vào chi phí hoạt động của Quỹ và tổng mức thủ lao không được vượt quá tổng ngân sách hoạt động hàng năm của Ban Đại Diện đã được thông qua tại Đại Hội Nhà Đầu Tư.', '9 năm kinh nghiệm với vai trò giám đốc kiểm toán tại Công ty TNHH KPMG Việt Nam.  \nHiện là Giám đốc tài chính (CFO) tại Công ty CP Đầu tư Thương Mại Quốc Tế Mặt Trời Đỏ.  |  \nCác quy định về tiêu chuẩn lựa chọn thành viên Ban đại diện Quỹ, quyền hạn và nhiệm vụ của Ban đại diện Quỹ, chủ tịch Ban đại diện Quỹ, đình chỉ hoặc bãi miễn thành viên Ban đại diện Quỹ, cuộc họp của Ban đại diện Quỹ tuân theo quy định tại chương V Điều lệ Quỹ.', '“Bản Cáo Bạch”\ncó nghĩa là tài liệu này hoặc dữ liệu điện tử công khai thông tin chính xác, trung thực và khách quan liên quan đến việc chào bán và phát hành Chứng Chỉ Quỹ của Quỹ.  \n“Hợp Đồng Giám Sát”\ncó nghĩa là hợp đồng được ký kết giữa Công ty Quản Lý Quỹ và Ngân Hàng Giám Sát được thông qua bởi Đại Hội Nhà Đầu Tư.  \n“Nhà Đầu Tư”\nlà cá nhân, tổ chức trong nước và ngoài nước nắm giữ Chứng Chỉ Quỹ  \n“Đại Hội Nhà Đầu Tư”\nLà đại hội của Nhà Đầu Tư có quyền biểu quyết được tổ chức thường kỳ hoặc bất thường để thông qua các vấn đề quan trọng có liên quan đến Quỹ. Đại Hội Nhà Đầu Tư là cơ quan quyền lực cao nhất của Quỹ.  \n“Ban Đại Diện Quỹ”', '## 2. Điều lệ Quỹ tóm tắt\nCơ quan quyền lực cao nhất của Quỹ là Đại hội Nhà Đầu tư.  \nBan Đại diện Quỹ sẽ do Đại hội Nhà Đầu tư bầu ra để giám sát các hoạt động thường xuyên của Quỹ, TCC và Ngân hàng giám sát.  \n#### 2.1.2 Tổng vốn huy động và số lượng chứng chỉ Quỹ được chào bán  \nVốn Điều lệ được huy động trong lần đầu chào bán ra công chúng của Quỹ là 50.000.000.000 VNĐ (Năm mươi tỷ đồng). Vốn Điều lệ sẽ được chia thành 5.000.000 (Năm triệu) Chứng chỉ Quỹ. Mệnh giá của một Chứng chỉ Quỹ sẽ là 10.000 VNĐ (mười nghìn Đồng Việt Nam).  \nNhà đầu tư góp vốn bằng tiền Đồng Việt Nam dưới hình thức chuyển khoản hoặc chuyển tiền vào tài khoản của Quỹ mở tại ngân hàng giám sát.  \nSố lượng chứng chỉ quỹ/tổng chứng chỉ quỹ được phép lưu hành tối đa: không hạn chế.', '## Lĩnh vực được phép đầu tư\n- Có quy định tại Điều lệ quỹ và Bản cáo bạch;\n- Đã được Ban đại diện quỹ chấp thuận bằng văn bản về loại, mã chứng khoán, số lượng, giá trị giao dịch, thời điểm thực hiện;\n- Có đủ tài liệu chứng minh về bảo lãnh thanh toán hoặc tài liệu về cam kết mua lại của tổ chức phát hành.', '## 1. Công ty quản lý quỹ\nBà Nguyễn Thị Thu Hiền\nChức vụ: Chủ tịch Hội đồng quản trị  \nÔng Đặng Lưu Dũng\nChức vụ: Tổng Giám đốc  \nBà Phan Thị Thu Hằng\nChức vụ: Kế toán trưởng  \nChúng tôi đảm bảo rằng các thông tin và số liệu trong Bản Cáo Bạch này là phù hợp với thực tế mà chúng tôi được biết, hoặc đã điều tra, thu thập một cách hợp lý. Tuy vậy, thông tin trong Bản Cáo Bạch này chưa được thẩm định bởi bất kỳ bên nào khác ngoại trừ như được đề cập tại Bản Cáo Bạch này.', '## 2.3. Đặc trưng của chứng chỉ Quỹ đầu tư\nNhà đầu tư của Quỹ là cá nhân, tổ chức trong và ngoài nước, sở hữu chứng chỉ quỹ. Nhà đầu tư không chịu trách nhiệm pháp lý hoặc nghĩa vụ khác ngoài trách nhiệm trong phạm vi số chứng chỉ Quỹ mà họ sở hữu. Nhà đầu tư là tổ chức bao gồm các tổ chức kinh tế và xã hội được pháp luật Việt Nam công nhận.  \nNhà đầu tư pháp nhân cử người đại diện hợp pháp đại diện cho số Chứng chỉ quỹ mà mình sở hữu. Việc đề cử, hủy bỏ hay thay thế người đại diện này phải được thông báo bằng văn bản, do người đại diện có thẩm quyền của nhà đầu tư tổ chức ký.', '## Lĩnh vực được phép đầu tư\nđ) Cổ phiếu chào bán lần đầu ra công chúng, trái phiếu chào bán ra công chúng; trái phiếu doanh nghiệp phát hành riêng lẻ bởi tổ chức niêm yết có bảo lãnh thanh toán của tổ chức tín dụng hoặc cam kết mua lại của tổ chức phát hành tối thiểu 1 lần trong 12 tháng và mỗi lần cam kết mua lại tối thiểu 30% giá trị đợt phát hành;  \ne) Chứng khoán phải sinh niêm yết giao dịch tại Sở giao dịch chứng khoán và chỉ nhằm mục tiêu phòng ngừa rủi ro cho chứng khoán cơ sở mà quỹ đang nắm giữ;  \ng) Quyền phát sinh gắn liền với chứng khoán mà quỹ đang nắm giữ.  \nViệc đầu tư vào các tài sản quy định tại điểm đ khoản 2.2.3 Điều này phải đáp ứng các điều kiện sau:  \n- Có quy định tại Điều lệ quỹ và Bản cáo bạch;', '1  \nỦy ban Chứng khoán Nhà nước cấp giấy phép phát hành chứng chỉ quỹ ra công chúng có nghĩa là việc xin phép lập Quỹ và phát hành chứng chỉ quỹ đầu tư đã thực hiện theo các quy định của pháp luật liên quan, không hàm ý bảo đảm về nội dung của Bản cáo bạch cũng như mục tiêu, chiến lược đầu tư của Quỹ.', 'ngược lại;  \n- Ngân hàng giám sát, thành viên Hội đồng quản trị, người điều hành và nhân viên của ngân hàng giám sát làm nhiệm vụ giám sát hoạt động và bảo quản tài sản của quỹ đại chúng, công ty đầu tư chứng khoán không được là đối tác mua, bán trong giao dịch mua, bán tài sản của quỹ đại chúng, công ty đầu tư chứng khoán.\n- Có đầy đủ năng lực cung cấp dịch vụ giám sát, lưu ký;\n- Thực hiện các cam kết đối với Quỹ như nêu tại Phụ lục 2 và Phụ lục 3 của Điều lệ Quỹ.  \nCác quy định về quyền và nghĩa vụ, hoạt động giám sát và chấm dứt quyền và nghĩa vụ của Ngân hàng giám sát tuân thủ theo quy định tại chương VII Điều lệ Quỹ.', '- Giấy chứng nhận đăng ký lập Quỹ đại chúng: do UBCKNN cấp\n- Loại hình: Quỹ mở\n- Vốn điều lệ ban đầu: 50.000.000.000 (năm mươi tỷ đồng)\n- Thời hạn của Quỹ: không giới hạn', '## 2.8. Đại hội Nhà đầu tư\nĐại Hội Nhà Đầu Tư là cơ quan có thẩm quyền cao nhất của Quỹ và tất cả các Nhà Đầu Tư có tên trong sổ đăng ký nhà đầu tư trước khi triệu tập cuộc họp đều có quyền tham dự.  \nĐại Hội Nhà Đầu Tư thường niên hoặc bất thường sẽ được tổ chức bởi Công ty Quản Lý Quỹ phù hợp với quy định của Pháp Luật với điều kiện là Nhà Đầu Tư phải được thông báo về thời gian, địa điểm, chương trình và nội dung của cuộc họp 21 (hai mươi mốt) ngày trước khi tổ chức đại hội. Đại Hội Nhà Đầu Tư không thảo luận các vấn đề khác ngoài vấn đề đã được nêu trong chương trình đại hội và Công ty Quản Lý Quỹ phải gửi toàn bộ chương trình, nội dung họp và các tài liệu có liên quan cho UBCKNN ít nhất 07 (bảy) ngày làm việc trước ngày tiến hành đại hội.', '6  \nvà Giấy chứng nhận đăng ký hoạt động lưu ký chứng khoán số 510/QĐ-ĐKHĐLK ngày 01/08/2006 do UBCKNN cấp, thực hiện các nghiệp vụ bảo quản, lưu ký các chứng khoán, các hợp đồng kinh tế, các chứng từ có liên quan đến tài sản của Quỹ, đồng thời giám sát hoạt động của Quỹ. Quyền và nghĩa vụ của Ngân Hàng Giám Sát được quy định tại Chương VII của Điều lệ Quỹ.  \n“Công Ty Kiểm Toán”\nlà công ty kiểm toán độc lập cho quỹ được Đại Hội Nhà Đầu Tư chỉ định, thực hiện việc kiểm toán hàng năm tài sản của Quỹ Đầu Tư Cổ phiếu Doanh nghiệp vừa và nhỏ Techcom.  \n“Điều lệ”\ncó nghĩa là Điều lệ Quỹ, các phụ lục đính kèm và các sửa đổi bổ sung hợp pháp (nếu có) được Đại hội nhà đầu tư thông qua tại Đại hội Nhà đầu tư.  \n“Bản Cáo Bạch”', 'vi. Chứng khoán phái sinh niêm yết, giao dịch tại các Sở Giao dịch Chứng khoán, và chỉ nhằm mục tiêu phòng ngừa rủi ro cho chứng khoán cơ sở mà quỹ đang nắm giữ.  \nvii. Quyền phát sinh gắn liền với chứng khoán mà Quỹ đang nắm giữ.  |\n| --- | --- |\n|  Cơ cấu đầu tư | Các khoản đầu tư của Quỹ sẽ được đa dạng hóa và đáp ứng được các điều kiện của pháp luật. Cơ cấu danh mục đầu tư của Quỹ phải bảo đảm tuân thủ các nguyên tắc sau:  \ni. Cơ cấu danh mục đầu tư của quỹ mở phải bao gồm chứng khoán của ít nhất sáu (06) tổ chức phát hành, đồng thời phải bảo đảm:', '- Không đầu tư quá 30% tổng giá trị tài sản của quỹ vào các chứng chỉ quỹ đại chúng, cổ phiếu công ty đầu tư chứng khoán đại chúng;  \nxi. Quỹ chỉ được đầu tư tiền gửi, công cụ tiền tệ quy định tại điểm i và ii các loại tài sản Quỹ được phép đầu tư được phát hành bởi các tổ chức tín dụng trong danh sách đã được Ban Đại Diện Quỹ phê duyệt bằng văn bản hoặc thông qua bỏ phiếu điện tử (e-voting) tuân thủ theo các Quy định Pháp luật hiện hành.  \nCơ cấu đầu tư của Quỹ được phép sai lệch so với các hạn chế được đưa ra tại điểm i, ii, iii, iv, v, vi và ix nếu trên nhưng chỉ vì các lý do sau:  \n- Biến động giá trên thị trường của các tài sản trong danh mục đầu tư của Quỹ;  \n- Thực hiện các khoản thanh toán phù hợp với Pháp Luật của Quỹ;  \n- Thực hiện các lệnh giao dịch của Nhà Đầu Tư;', '## Lĩnh vực được phép đầu tư\nDanh mục đầu tư của quỹ phải phù hợp với mục tiêu và chính sách đầu tư đã được quy định tại Điều lệ quỹ và công bố tại Bản cáo bạch. Danh mục đầu tư của quỹ đầu tư bao gồm các loại tài sản sau đây:  \na) Tiền gửi các ngân hàng thương mại theo quy định của pháp luật ngân hàng;  \nb) Công cụ thị trường tiền tệ bao gồm giấy tờ có giá, công cụ chuyển nhượng theo quy định của pháp luật;  \nc) Công cụ nợ của Chính phủ, trái phiếu được Chính phủ bảo lãnh, trái phiếu chính quyền địa phương;  \nd) Cổ phiếu niêm yết, cổ phiếu đăng ký giao dịch, trái phiếu niêm yết trên Sở giao dịch chứng khoán, chứng chỉ quỹ đại chúng;', '|  Ông Đào Kiên Trung | Ông Trung tốt nghiệp Đại học Luật chuyên ngành Pháp luật Quốc tế, Đại học ngoại ngữ Hà Nội chuyên ngành Tiếng Anh.  \nTừ 1999 đến nay, ông Trung đã trải qua nhiều vị trí khác nhau tại các đơn vị như Công ty TNHH Grant Thornton VN, Ngân hàng TMCP Kỹ Thương Việt Nam, CTCP FPT, Công ty QLQ FPT, Công ty TNHH Quản lý nợ và khai thác tài sản - Ngân hàng TMCP Kỹ Thương Việt Nam.  \nHiện nay ông Trung giữ chức vụ Giám đốc pháp chế và tuân thủ kiêm Kiểm soát nội bộ, Pháp chế và kiểm soát tuân thủ Công ty Cổ phần quản lý Quỹ Kỹ Thương.  |\n| --- | --- |\n|  Ông Trần Viết Thỏa | Ông Thỏa có 20 năm kinh nghiệm trong lĩnh vực kế toán, kiểm toán và tài chính và đầu tư.  \n9 năm kinh nghiệm với vai trò giám đốc kiểm toán tại Công ty TNHH KPMG Việt Nam.', 'Quỹ đầu tư chứng khoán được mô tả trong Bản cáo bạch này là Quỹ được thành lập theo Luật Chứng khoán số 54/2019/QH14 được Quốc hội Nước Cộng hòa xã hội chủ nghĩa Việt Nam thông qua ngày 26 tháng 11 năm 2019 và các văn bản hướng dẫn thi hành. Bản cáo bạch này đã được đăng ký với Ủy ban Chứng khoán Nhà nước ngày / / 2022.', '## 2.3. Đặc trưng của chứng chỉ Quỹ đầu tư\nCông ty quản lý quỹ thực hiện hoặc ủy quyền cho tổ chức cung cấp dịch vụ đại lý chuyển nhượng lập và quản lý số đăng ký nhà đầu tư chính (sổ chính) hoặc ủy quyền đại lý ký danh lập, quản lý đăng ký nhà đầu tư phụ (sổ phụ) và xác nhận quyền sở hữu chứng chỉ quỹ cho nhà đầu tư.  \nSố đăng ký nhà đầu tư của Quỹ có thể là văn bản, tập dữ liệu điện tử hoặc cả hai. Các nội dung của Số đăng ký nhà đầu tư được quy định chi tiết tại điều 15 Điều lệ Quỹ.', '# IV. THÔNG TIN VỀ CÔNG TY CỔ PHẦN QUẢN LÝ QUỸ KỸ THƯƠNG\n## Hội đồng quản trị\n- **Bà Nguyễn Thị Thu Hiền – Chủ tịch Hội đồng quản trị**  \nBà Hiền có hơn 20 năm kinh nghiệm trong lĩnh vực tài chính ngân hàng tại các tổ chức tài chính lớn như Chinfon bank, Citibank và Techcombank. Hiện Bà là Tổng Giám đốc Công ty Cổ phần Chứng khoán Kỹ thương.  \nBà Hiền tốt nghiệp chuyên ngành Tài chính ngân hàng Đại học Kinh tế quốc dân Hà Nội và Thạc sĩ chuyên ngành Tài chính ngân hàng trường Đại học Monash, Melbourne, Úc với học bổng chính phủ của Úc.  \n- **Ông Đặng Lưu Dũng – Thành viên Hội đồng quản trị**', '- Thực hiện các lệnh giao dịch của Nhà Đầu Tư;  \n- Các hoạt động sáp nhập, hợp nhất của các tổ chức phát hành các chứng khoán mà Quỹ đang nắm giữ;  \n- Quỹ mới được cấp phép thành lập hoặc do tách Quỹ, hợp nhất Quỹ, sát nhập Quỹ mà thời gian hoạt động không quá sáu (06) tháng, tính từ ngày được cấp giấy chứng nhận đăng ký lập Quỹ;  \n- Quỹ đang trong thời gian giải thể.  \nTrong trường hợp xảy ra sai lệch so với các hạn mức đầu tư, Công ty Quản Lý Quỹ sẽ điều chỉnh danh mục đầu tư để đáp ứng các hạn mức đầu tư kể trên trong vòng 3 (ba) tháng kể từ ngày mà sai lệch phát sinh.', 'Sau khi thực hiện các Lệnh Bán Được Chấp Nhận, số Đơn Vị Quỹ đã bán sẽ được trù ra từ tổng số Đơn Vị Quỹ trong tài khoản của Nhà Đầu Tư và bảng kê mới về số Đơn Vị Quỹ nắm giữ sẽ được gửi đến Nhà Đầu Tư.  \nLệnh Bán thành công của Nhà Đầu Tư hay Đại Lý Ký Danh sẽ được thông báo trong vòng 03 (ba) ngày làm việc sau Ngày Giao Dịch.  \nTrong thời hạn 5 ngày làm việc sau ngày giao dịch Chứng chỉ quỹ, Nhà Đầu tư sẽ nhận được tiền bán chứng chỉ quỹ vào tài khoản mà Nhà Đầu tư đã đăng ký khi thực hiện mua Chứng chỉ quỹ.  \n- **Lệnh Bán Tối Thiểu**  \nLệnh Bán tối thiểu là 10 (mười) Đơn Vị Quỹ. Trường hợp sau khi đặt bán, số lượng chứng chỉ quỹ còn lại nhỏ hơn số lượng bán tối thiểu, Nhà Đầu tư cần đặt bán toàn bộ để giảm số Đơn vị Quỹ nắm giữ về 0 (không).']","Theo tài liệu cung cấp, Ban Đại Diện Quỹ chưa được liệt kê cụ thể các thành viên. Tuy nhiên, thông tin về Hội đồng quản trị đã được đề cập:

- Bà Nguyễn Thị Thu Hiền – Chủ tịch Hội đồng quản trị.
- Ông Đặng Lưu Dũng – Thành viên Hội đồng quản trị.

Để biết thêm chi tiết về Ban Đại Diện Quỹ, cần tham khảo phần khác của tài liệu hoặc thông tin bổ sung từ nguồn khác.","Ông Nhâm Hà Hải, Ông Đào Kiên Trung, Ông Trần Viết Thỏa.",0.5,0.0,0.0,0.6666666666666666
Nhà đầu tư có những lựa chọn nào về việc nhận phân phối lợi nhuận (cổ tức)?,"['# 5. Kế hoạch phân chia lợi nhuận\nNhà Đầu Tư có trong danh sách chốt trong số Đăng Ký tại Ngày Giao Dịch được công bố bởi TCC cho việc chia cổ tức (“Ngày Chốt Danh Sách”) được xem là đủ điều kiện để nhận cổ tức.  \nCổ tức sẽ được chi trả trong thời hạn 30 (ba mươi) ngày kể từ ngày được công bố và được chuyển vào tài khoản ngân hàng của Nhà Đầu Tư theo đăng ký trong Số Đăng Ký vào ngày thanh toán cổ tức, sau khi được khấu trừ các loại thuế có liên quan.  \nCổ tức được chi trả sẽ phải chịu thuế tùy thuộc vào nguồn gốc của thu nhập của Quỹ cũng như các loại thuế áp dụng cho Nhà Đầu Tư.', '## 2.2.7 Phương pháp lựa chọn đầu tư\n**Phương pháp lựa chọn đầu tư đối với các công cụ khác:**  \nQuỹ áp dụng phương pháp phù hợp với tính chất, đặc điểm của tài sản để có lựa chọn phù hợp.', '## 2.2.7 Phương pháp lựa chọn đầu tư\n**Phương pháp lựa chọn đầu tư đối với các công cụ thị trường tiền tệ:**  \nQuỹ lựa chọn các công cụ thị trường tiền tệ của các tổ chức tín dụng có khả năng mang lại lãi suất tốt, đồng thời xem xét đến thứ hạng tín dụng và định mức tín dụng phù hợp cho từng tổ chức tín dụng.  \n**Phương pháp lựa chọn đầu tư đối với trái phiếu và công cụ nợ:**  \nTrái phiếu và công cụ nợ được lựa chọn trên cơ sở phân tích, đánh giá dự án/chương trình được tài trợ bởi công cụ nợ kết hợp phân tích xu hướng lãi suất, đánh giá với mức lãi suất của công cụ nợ trong tương quan với mức độ chấp nhận rủi ro của nhà đầu tư, tính thanh khoản của trái phiếu, công cụ nợ hoặc chỉ số tín nhiệm tín dụng của tổ chức phát hành để lựa chọn danh mục đầu tư phù hợp.  \n**Phương pháp lựa chọn đầu tư đối với cổ phiếu:**', 'Nhà Đầu Tư nhận cổ tức bằng tiền có thể dùng để tái đầu tư:  \n- Lựa chọn Nhận Cổ Tức Bằng Tiền (“DPP”): Nhà Đầu Tư muốn nhận cổ tức bằng tiền cần phải nêu rõ lựa chọn của mình trong Đơn Đăng Ký mở tài khoản giao dịch.\n- Lựa chọn Tái Đầu tư Cổ tức (“DRIP”): Nhà Đầu Tư muốn dùng cổ tức để tái đầu tư sẽ nhận được thêm các Đơn Vị Quỹ. Cổ tức được trả cho Nhà Đầu Tư sẽ được tự động tái đầu tư tại NAV của Quỹ trong Ngày Giao Dịch liền sau ngày trả cổ tức. Số lượng các Đơn Vị Quỹ của Nhà Đầu Tư do đó sẽ tăng bằng với số cổ tức phải trả chia cho NAV vào Ngày Giao Dịch đó. Cổ tức được dùng để tái đầu tư giống như việc Nhà Đầu Tư nhận được cổ tức bằng tiền mặt và dùng số tiền đã nhận được để tái đầu tư và đồng thời:\n- Các khoản đầu tư dưới hình thức DRIP sẽ không phải trả Giá dịch vụ Phát hành.', '# 5. Kế hoạch phân chia lợi nhuận\nNhà Đầu Tư nhận cổ tức bằng tiền có thể dùng để tái đầu tư:  \n- Lựa chọn Nhận Cổ Tức Bằng Tiền (“DPP”): Nhà Đầu Tư muốn nhận cổ tức bằng tiền cần phải nêu rõ lựa chọn của mình trong Đơn Đăng Ký mở tài khoản giao dịch.\n- Lựa chọn Tái Đầu tư Cổ tức (“DRIP”): Nhà Đầu Tư muốn dùng cổ tức để tái đầu tư sẽ nhận được thêm các Đơn Vị Quỹ. Cổ tức được trả cho Nhà Đầu Tư sẽ được tự động tái đầu tư tại NAV của Quỹ trong Ngày Giao Dịch liền sau ngày trả cổ tức. Số lượng các Đơn Vị Quỹ của Nhà Đầu Tư do đó sẽ tăng bằng với số cổ tức phải trả chia cho NAV vào Ngày Giao Dịch đó. Cổ tức được dùng để tái đầu tư giống như việc Nhà Đầu Tư nhận được cổ tức bằng tiền mặt và dùng số tiền đã nhận được để tái đầu tư và đồng thời:\n- Các khoản đầu tư dưới hình thức DRIP sẽ không phải trả Giá dịch vụ Phát hành.', '## c) Tuân Thủ\n. Nhà Đầu Tư cần tham khảo các ý kiến tư vấn về luật và thuế để có thông tin phù hợp đối với các giao dịch của mình.', '. Nhà Đầu Tư cần tham khảo các ý kiến tư vấn về luật và thuế để có thông tin phù hợp đối với các giao dịch của mình.', '- Các khoản đầu tư dưới hình thức DRIP sẽ không phải trả Giá dịch vụ Phát hành.\n- Không phải trả Giá dịch vụ Mua lại hoặc Giá dịch vụ Chuyển Đổi đối với khoản đầu tư từ DRIP.  \nNhà Đầu Tư cần phải nêu rõ lựa chọn của mình trong hai lựa chọn trên, DPP hoặc DRIP, được ghi trong Đơn Đăng Ký. Nếu Nhà Đầu Tư không có sự lựa chọn, lựa chọn DRIP được tự động áp dụng.  \nĐại Hội Nhà Đầu Tư có thể phê duyệt cổ tức tại bất kỳ thời điểm nào và bất kỳ tần suất thanh toán nào (hàng quý, nửa năm, hàng năm) khi phù hợp. Tuy nhiên, sẽ không có sự đảm bảo nào về giá trị, tần suất, cũng như sự đều đặn của việc phân phối cổ tức. Việc phân phối cổ tức sẽ tùy thuộc vào lợi nhuận có thể phân phối và sự chấp thuận của Đại Hội Nhà Đầu Tư hoặc Ban Đại diện Quỹ (nếu được ủy quyền).', '# 5. Kế hoạch phân chia lợi nhuận\n- Các khoản đầu tư dưới hình thức DRIP sẽ không phải trả Giá dịch vụ Phát hành.\n- Không phải trả Giá dịch vụ Mua lại hoặc Giá dịch vụ Chuyển Đổi đối với khoản đầu tư từ DRIP.  \nNhà Đầu Tư cần phải nêu rõ lựa chọn của mình trong hai lựa chọn trên, DPP hoặc DRIP, được ghi trong Đơn Đăng Ký. Nếu Nhà Đầu Tư không có sự lựa chọn, lựa chọn DRIP được tự động áp dụng.  \nĐại Hội Nhà Đầu Tư có thể phê duyệt cổ tức tại bất kỳ thời điểm nào và bất kỳ tần suất thanh toán nào (hàng quý, nửa năm, hàng năm) khi phù hợp. Tuy nhiên, sẽ không có sự đảm bảo nào về giá trị, tần suất, cũng như sự đều đặn của việc phân phối cổ tức. Việc phân phối cổ tức sẽ tùy thuộc vào lợi nhuận có thể phân phối và sự chấp thuận của Đại Hội Nhà Đầu Tư hoặc Ban Đại diện Quỹ (nếu được ủy quyền).', 'a. Chính sách cổ tức Quỹ  \nCông ty quản lý quỹ được phân chia lợi nhuận của quỹ cho nhà đầu tư bằng tiền hoặc bằng chứng chỉ quỹ theo quy định tại điều lệ quỹ và chính sách phân chia lợi nhuận được công bố tại bản cáo bạch. Lợi nhuận phân chia được trích từ nguồn lợi nhuận để lại hoặc từ thu nhập của quỹ. Công ty quản lý quỹ chỉ được phân chia lợi nhuận khi quỹ đã hoàn thành hoặc có đủ năng lực tài chính để hoàn thành nghĩa vụ thuế và các nghĩa vụ tài chính khác theo quy định của pháp luật; trích lập đầy đủ các quỹ theo quy định tại điều lệ quỹ; ngay sau khi trả hết số lợi nhuận đã định, quỹ vẫn phải bảo đảm thanh toán đủ các khoản nợ, nghĩa vụ tài sản khác đến hạn. Lịch trình và kế hoạch thực hiện phải được công bố công khai trên trang thông tin điện tử của công ty quản lý quỹ.', 'Cổ tức sẽ được chi trả trong thời hạn 30 (ba mươi) ngày kể từ ngày được công bố và được chuyển vào tài khoản ngân hàng của Nhà Đầu Tư theo đăng ký trong Sổ Đăng Ký vào ngày thanh toán cổ tức, sau khi được khấu trừ các loại thuế có liên quan.  \nCổ tức được chi trả sẽ phải chịu thuế tùy thuộc vào nguồn gốc của thu nhập của Quỹ cũng như các loại thuế áp dụng cho Nhà Đầu Tư.', '## 2.2.7 Phương pháp lựa chọn đầu tư\n**Phương pháp lựa chọn đầu tư đối với cổ phiếu:**  \nQuỹ sử dụng phương pháp từ trên xuống (top-down approach), trong đó việc lựa chọn và phân bổ tài sản sẽ dựa trên đánh giá tổng thể về xu thế của kinh tế vĩ mô, chính sách của nhà nước, tiềm năng tăng trưởng và chính sách ngành. Từ đó, lập danh sách các chứng khoán tốt trong lĩnh vực Ngân hàng và dịch vụ tài chính phục vụ việc lựa chọn công ty sẽ đầu tư.  \nQuỹ cũng áp dụng phương pháp từ dưới lên (bottom-up approach), trong việc lựa chọn từng loại chứng khoán cụ thể thông qua việc phân tích công ty, bao gồm phân tích hiệu quả hoạt động sản xuất kinh doanh, đánh giá các chỉ số tài chính, đánh giá tiềm năng tăng trưởng, lợi thế cạnh tranh, bộ máy điều hành, quản trị doanh nghiệp, vv.', '# 5. Kế hoạch phân chia lợi nhuận\nCông ty quản lý quỹ được phân chia lợi nhuận của quỹ cho nhà đầu tư bằng tiền hoặc bằng đơn vị quỹ theo quy định tại điều lệ quỹ và chính sách phân chia lợi nhuận được công bố tại bản cáo bạch. Lợi nhuận phân chia được trích từ nguồn lợi nhuận để lại hoặc từ thu nhập của quỹ. Công ty quản lý quỹ chỉ được phân chia lợi nhuận khi quỹ đã hoàn thành hoặc có đủ năng lực tài chính để hoàn thành nghĩa vụ thuế và các nghĩa vụ tài chính khác theo quy định của pháp luật; trích lập đầy đủ các quỹ theo quy định tại điều lệ quỹ; ngay sau khi trả hết số lợi nhuận đã định, quỹ vẫn phải bảo đảm thanh toán đủ các khoản nợ, nghĩa vụ tài sản khác đến hạn. Lịch trình và kế hoạch thực hiện phải được công bố công khai trên trang thông tin điện tử của công ty quản lý quỹ.', 'nhóm chứng khoán có tiềm năng tăng trưởng tốt trong dài hạn và/hoặc doanh nghiệp có tính cạnh tranh tương đối cao, (ii) nhóm chứng khoán có mức định giá hấp dẫn, (iii) nhóm chứng khoán có lợi tức cao, ổn định.  \nNgoài ra, để đảm bảo tối ưu hóa lợi ích của nhà đầu tư, Quỹ có sự linh hoạt trong phân bổ tài sản tùy thuộc vào cơ hội đầu tư sẵn có tại các thời điểm khác nhau. Việc phân bổ tài sản có thể thay đổi đáng kể tùy thuộc vào nhận định của Quỹ, với mục tiêu xuyên suốt trong toàn bộ thời gian hoạt động của Quỹ là bảo vệ lợi ích của Nhà Đầu Tư.', '## b. Chính sách thuế\nNhà Đầu Tư nên tham khảo ý kiến tư vấn của các nhà tư vấn thuế chuyên nghiệp của mình đối với các nghĩa vụ thuế cụ thể và những vấn đề về tài chính của việc đầu tư vào Quỹ.', '## 3. Giá dịch vụ và thưởng hoạt động\nNhà Đầu Tư được khuyến khích nắm giữ các Đơn Vị Quỹ như một phần của các khoản đầu tư dài hạn và chương trình tiết kiệm hưu trí. Quỹ mở không được thiết kế cho mục đích mua bán ngắn hạn. Việc Nhà Đầu Tư thường xuyên mua đi và bán lại Đơn Vị Quỹ, vốn được thiết kế để đạt được lợi nhuận dài hạn sẽ ảnh hưởng đến mục tiêu lợi nhuận của Nhà Đầu Tư khi đầu tư vào Quỹ cũng như lợi nhuận của Quỹ.  \nGiá dịch vụ Mua lại và các khoản giá dịch vụ ngân hàng và thuế khác (nếu có) sẽ được trừ vào khoản tiền thu được từ bán Đơn Vị Quỹ của Nhà Đầu Tư.', '## 3. Báo cáo bất thường\nCác báo cáo bất thường sẽ được cung cấp cho Nhà Đầu Tư trong trường hợp có những diễn biến hoặc hoạt động bất thường của Quỹ phát sinh, bao gồm nhưng không giới hạn bởi các báo cáo về việc phân phối lợi nhuận, báo cáo trước khi hợp nhất hoặc sáp nhập quỹ hay sau các quyết định của Đại Hội Nhà Đầu Tư ủy quyền cho Ban Đại Diện Quỹ.', 'Nhà Đầu Tư nên tham khảo ý kiến của chuyên gia tư vấn riêng của mình để đảm bảo Nhà Đầu Tư đủ điều kiện để đầu tư vào Quỹ theo các quy định pháp luật áp dụng cho họ và liệu Quỹ có phù hợp với khả năng chấp nhận rủi ro của họ hay không.', 'Nhà Đầu Tư có trong danh sách chốt trong số Đăng Ký tại Ngày Giao Dịch được công bố bởi TCC cho việc chia cổ tức (“Ngày Chốt Danh Sách”) được xem là đủ điều kiện để nhận cổ tức.  \n39', '## 2. Thông tin về đợt phát hành lần đầu ra công chúng\nNgoài ra, để đảm bảo tối ưu hóa lợi ích của nhà đầu tư, Quỹ có sự linh hoạt trong phân bổ tài sản tùy thuộc vào cơ hội đầu tư sẵn có tại các thời điểm khác nhau. Việc phân bổ tài sản có thể thay đổi đáng kể tùy thuộc vào nhận định của Quỹ, với mục tiêu xuyên suốt trong toàn bộ thời gian hoạt động của Quỹ là bảo vệ lợi ích của Nhà Đầu Tư.  \nVới chiến lược đầu tư như đã đề cập ở trên, cơ cấu danh mục đầu tư của Quỹ có thể thay đổi theo thời gian dựa theo tiềm năng tăng trưởng của cổ phiếu và tùy vào mức độ thanh khoản của các cổ phiếu trên thị trường. Tỷ trọng các khoản đầu tư không vượt quá những hạn chế đầu tư quy định tại mục “Hạn chế đầu tư”.  \nCác loại tài sản mà quỹ được đầu tư bao gồm:\ni. Tiền gửi tại các ngân hàng thương mại theo quy định của pháp luật về  |', '## 2.5.3. Thông tin về các mức giá dịch vụ\nNhà Đầu Tư được khuyến khích nắm giữ các Đơn Vị Quỹ như một phần của các khoản đầu tư dài hạn và chương trình tiết kiệm lưu trí. Quỹ mở không được thiết kế cho mục đích mua bán ngắn hạn. Việc Nhà Đầu Tư thường xuyên mua đi và bán lại Đơn Vị Quỹ, vốn được thiết kế để đạt được lợi nhuận dài hạn sẽ ảnh hưởng đến mục tiêu lợi nhuận của Nhà Đầu Tư khi đầu tư vào Quỹ cũng như lợi nhuận của Quỹ.', 'Nhà Đầu Tư có thể thanh toán số tiền mua Đơn Vị Quỹ từ tài khoản ngân hàng của mình vào tài khoản của Quỹ để Ngân Hàng Giám Sát nhận được đúng hạn và Đại Lý Phân Phối hoàn thành xử lý việc đăng ký với Đại Lý Chuyển Nhượng. Mọi khoản đầu tư vào Đơn Vị Quỹ đều thực hiện bằng tiền Đồng Việt Nam.  \nTrong trường hợp lệnh mua chứng chỉ quỹ và việc thanh toán cho lệnh mua được thực hiện bởi cá nhân, tổ chức khác không phải nhà đầu tư thì phiếu lệnh và tài liệu xác nhận thanh toán phải nêu rõ tên, số tài khoản và giá trị thanh toán của nhà đầu tư được hưởng lợi.', '## THÔNG BÁO QUAN TRỌNG\nCác nhà đầu tư nên nghiên cứu Bản Cáo Bạch này một cách cẩn trọng và toàn diện và không nên coi nội dung hoặc các tóm tắt ở đây là các tư vấn liên quan đến pháp lý, thuế, hoặc tài chính/đầu tư và nên tham khảo ý kiến chuyên gia tư vấn của mình về các yêu cầu pháp lý hoặc các điều kiện hoặc bất kỳ các hạn chế nào khác liên quan đến việc đăng ký mua, mua, cho tặng, nắm giữ, định đoạt (chuyển nhượng; chuyển đổi quỹ hoặc bản hoặc chuyển đổi thành tiền) các Đơn Vị Quỹ, việc xử lý khoản thu nhập (nếu có), lợi nhuận đầu tư, hoặc các khoản phân phối lợi nhuận, các khoản thuế khác liên quan đến việc đăng ký mua, mua, cho tặng, nắm giữ, định đoạt (bản, chuyển giao, chuyển đổi quỹ hoặc bản hoặc chuyển đổi thành tiền) các Đơn Vị Quỹ trong phạm vi lãnh thổ tài phán áp dụng đối với quốc tịch, nơi cư trú', '## c) Tuân Thủ\nNhà Đầu Tư phải đảm bảo rằng số tiền đầu tư phải từ nguồn hợp pháp và không có nguồn gốc từ các hành vi vi phạm Pháp Luật cũng như không vi phạm các điều khoản của Luật áp dụng đối với thuế thu nhập, quy định về AML, chống tham nhũng, chống hối lộ và/hoặc các luật áp dụng khác ban hành bởi chính phủ Việt Nam hay chính phủ sở tại của nhà đầu tư ở các thời điểm khác nhau.', '## 2.4.7. Quy trình chuyển nhượng chứng chỉ quỹ\nNhà Đầu Tư muốn thực hiện Chuyển Nhượng hoặc người thừa hưởng thừa kế trong trường hợp thừa kế có thể nộp Lệnh Chuyển Nhượng tại bất kỳ Điểm Nhận Lệnh nào. Lệnh Chuyển Nhượng']","Nhà đầu tư có hai lựa chọn chính về việc nhận phân phối lợi nhuận (cổ tức) từ quỹ:

1. Nhận cổ tức bằng tiền mặt (tiền Đồng Việt Nam).

2. Nhận cổ tức bằng đơn vị quỹ.

Nhà đầu tư cũng có thể đăng ký để chuyển đổi cổ tức thành một trong hai hình thức trên.",Lựa chọn Nhận Cổ Tức Bằng Tiền (DPP) hoặc Lựa chọn Tái Đầu tư Cổ tức (DRIP).,1.0,0.5652936557734913,0.5802303976144491,1.0
"Nếu nhà đầu tư không chọn phương thức nhận cổ tức cụ thể, Quỹ sẽ áp dụng phương thức mặc định nào?","['## 2.2.7 Phương pháp lựa chọn đầu tư\n**Phương pháp lựa chọn đầu tư đối với các công cụ khác:**  \nQuỹ áp dụng phương pháp phù hợp với tính chất, đặc điểm của tài sản để có lựa chọn phù hợp.', '# 5. Kế hoạch phân chia lợi nhuận\nNhà Đầu Tư có trong danh sách chốt trong số Đăng Ký tại Ngày Giao Dịch được công bố bởi TCC cho việc chia cổ tức (“Ngày Chốt Danh Sách”) được xem là đủ điều kiện để nhận cổ tức.  \nCổ tức sẽ được chi trả trong thời hạn 30 (ba mươi) ngày kể từ ngày được công bố và được chuyển vào tài khoản ngân hàng của Nhà Đầu Tư theo đăng ký trong Số Đăng Ký vào ngày thanh toán cổ tức, sau khi được khấu trừ các loại thuế có liên quan.  \nCổ tức được chi trả sẽ phải chịu thuế tùy thuộc vào nguồn gốc của thu nhập của Quỹ cũng như các loại thuế áp dụng cho Nhà Đầu Tư.', 'Cổ tức sẽ được chi trả trong thời hạn 30 (ba mươi) ngày kể từ ngày được công bố và được chuyển vào tài khoản ngân hàng của Nhà Đầu Tư theo đăng ký trong Sổ Đăng Ký vào ngày thanh toán cổ tức, sau khi được khấu trừ các loại thuế có liên quan.  \nCổ tức được chi trả sẽ phải chịu thuế tùy thuộc vào nguồn gốc của thu nhập của Quỹ cũng như các loại thuế áp dụng cho Nhà Đầu Tư.', '# 5. Kế hoạch phân chia lợi nhuận\nNhà Đầu Tư nhận cổ tức bằng tiền có thể dùng để tái đầu tư:  \n- Lựa chọn Nhận Cổ Tức Bằng Tiền (“DPP”): Nhà Đầu Tư muốn nhận cổ tức bằng tiền cần phải nêu rõ lựa chọn của mình trong Đơn Đăng Ký mở tài khoản giao dịch.\n- Lựa chọn Tái Đầu tư Cổ tức (“DRIP”): Nhà Đầu Tư muốn dùng cổ tức để tái đầu tư sẽ nhận được thêm các Đơn Vị Quỹ. Cổ tức được trả cho Nhà Đầu Tư sẽ được tự động tái đầu tư tại NAV của Quỹ trong Ngày Giao Dịch liền sau ngày trả cổ tức. Số lượng các Đơn Vị Quỹ của Nhà Đầu Tư do đó sẽ tăng bằng với số cổ tức phải trả chia cho NAV vào Ngày Giao Dịch đó. Cổ tức được dùng để tái đầu tư giống như việc Nhà Đầu Tư nhận được cổ tức bằng tiền mặt và dùng số tiền đã nhận được để tái đầu tư và đồng thời:\n- Các khoản đầu tư dưới hình thức DRIP sẽ không phải trả Giá dịch vụ Phát hành.', 'Nhà Đầu Tư nhận cổ tức bằng tiền có thể dùng để tái đầu tư:  \n- Lựa chọn Nhận Cổ Tức Bằng Tiền (“DPP”): Nhà Đầu Tư muốn nhận cổ tức bằng tiền cần phải nêu rõ lựa chọn của mình trong Đơn Đăng Ký mở tài khoản giao dịch.\n- Lựa chọn Tái Đầu tư Cổ tức (“DRIP”): Nhà Đầu Tư muốn dùng cổ tức để tái đầu tư sẽ nhận được thêm các Đơn Vị Quỹ. Cổ tức được trả cho Nhà Đầu Tư sẽ được tự động tái đầu tư tại NAV của Quỹ trong Ngày Giao Dịch liền sau ngày trả cổ tức. Số lượng các Đơn Vị Quỹ của Nhà Đầu Tư do đó sẽ tăng bằng với số cổ tức phải trả chia cho NAV vào Ngày Giao Dịch đó. Cổ tức được dùng để tái đầu tư giống như việc Nhà Đầu Tư nhận được cổ tức bằng tiền mặt và dùng số tiền đã nhận được để tái đầu tư và đồng thời:\n- Các khoản đầu tư dưới hình thức DRIP sẽ không phải trả Giá dịch vụ Phát hành.', '- Các khoản đầu tư dưới hình thức DRIP sẽ không phải trả Giá dịch vụ Phát hành.\n- Không phải trả Giá dịch vụ Mua lại hoặc Giá dịch vụ Chuyển Đổi đối với khoản đầu tư từ DRIP.  \nNhà Đầu Tư cần phải nêu rõ lựa chọn của mình trong hai lựa chọn trên, DPP hoặc DRIP, được ghi trong Đơn Đăng Ký. Nếu Nhà Đầu Tư không có sự lựa chọn, lựa chọn DRIP được tự động áp dụng.  \nĐại Hội Nhà Đầu Tư có thể phê duyệt cổ tức tại bất kỳ thời điểm nào và bất kỳ tần suất thanh toán nào (hàng quý, nửa năm, hàng năm) khi phù hợp. Tuy nhiên, sẽ không có sự đảm bảo nào về giá trị, tần suất, cũng như sự đều đặn của việc phân phối cổ tức. Việc phân phối cổ tức sẽ tùy thuộc vào lợi nhuận có thể phân phối và sự chấp thuận của Đại Hội Nhà Đầu Tư hoặc Ban Đại diện Quỹ (nếu được ủy quyền).', '# 5. Kế hoạch phân chia lợi nhuận\n- Các khoản đầu tư dưới hình thức DRIP sẽ không phải trả Giá dịch vụ Phát hành.\n- Không phải trả Giá dịch vụ Mua lại hoặc Giá dịch vụ Chuyển Đổi đối với khoản đầu tư từ DRIP.  \nNhà Đầu Tư cần phải nêu rõ lựa chọn của mình trong hai lựa chọn trên, DPP hoặc DRIP, được ghi trong Đơn Đăng Ký. Nếu Nhà Đầu Tư không có sự lựa chọn, lựa chọn DRIP được tự động áp dụng.  \nĐại Hội Nhà Đầu Tư có thể phê duyệt cổ tức tại bất kỳ thời điểm nào và bất kỳ tần suất thanh toán nào (hàng quý, nửa năm, hàng năm) khi phù hợp. Tuy nhiên, sẽ không có sự đảm bảo nào về giá trị, tần suất, cũng như sự đều đặn của việc phân phối cổ tức. Việc phân phối cổ tức sẽ tùy thuộc vào lợi nhuận có thể phân phối và sự chấp thuận của Đại Hội Nhà Đầu Tư hoặc Ban Đại diện Quỹ (nếu được ủy quyền).', 'Nhà Đầu Tư có thể thanh toán số tiền mua Đơn Vị Quỹ từ tài khoản ngân hàng của mình vào tài khoản của Quỹ để Ngân Hàng Giám Sát nhận được đúng hạn và Đại Lý Phân Phối hoàn thành xử lý việc đăng ký với Đại Lý Chuyển Nhượng. Mọi khoản đầu tư vào Đơn Vị Quỹ đều thực hiện bằng tiền Đồng Việt Nam.  \nTrong trường hợp lệnh mua chứng chỉ quỹ và việc thanh toán cho lệnh mua được thực hiện bởi cá nhân, tổ chức khác không phải nhà đầu tư thì phiếu lệnh và tài liệu xác nhận thanh toán phải nêu rõ tên, số tài khoản và giá trị thanh toán của nhà đầu tư được hưởng lợi.', '## 2.2.7 Phương pháp lựa chọn đầu tư\n**Phương pháp lựa chọn đầu tư đối với các công cụ thị trường tiền tệ:**  \nQuỹ lựa chọn các công cụ thị trường tiền tệ của các tổ chức tín dụng có khả năng mang lại lãi suất tốt, đồng thời xem xét đến thứ hạng tín dụng và định mức tín dụng phù hợp cho từng tổ chức tín dụng.  \n**Phương pháp lựa chọn đầu tư đối với trái phiếu và công cụ nợ:**  \nTrái phiếu và công cụ nợ được lựa chọn trên cơ sở phân tích, đánh giá dự án/chương trình được tài trợ bởi công cụ nợ kết hợp phân tích xu hướng lãi suất, đánh giá với mức lãi suất của công cụ nợ trong tương quan với mức độ chấp nhận rủi ro của nhà đầu tư, tính thanh khoản của trái phiếu, công cụ nợ hoặc chỉ số tín nhiệm tín dụng của tổ chức phát hành để lựa chọn danh mục đầu tư phù hợp.  \n**Phương pháp lựa chọn đầu tư đối với cổ phiếu:**', 'a. Chính sách cổ tức Quỹ  \nCông ty quản lý quỹ được phân chia lợi nhuận của quỹ cho nhà đầu tư bằng tiền hoặc bằng chứng chỉ quỹ theo quy định tại điều lệ quỹ và chính sách phân chia lợi nhuận được công bố tại bản cáo bạch. Lợi nhuận phân chia được trích từ nguồn lợi nhuận để lại hoặc từ thu nhập của quỹ. Công ty quản lý quỹ chỉ được phân chia lợi nhuận khi quỹ đã hoàn thành hoặc có đủ năng lực tài chính để hoàn thành nghĩa vụ thuế và các nghĩa vụ tài chính khác theo quy định của pháp luật; trích lập đầy đủ các quỹ theo quy định tại điều lệ quỹ; ngay sau khi trả hết số lợi nhuận đã định, quỹ vẫn phải bảo đảm thanh toán đủ các khoản nợ, nghĩa vụ tài sản khác đến hạn. Lịch trình và kế hoạch thực hiện phải được công bố công khai trên trang thông tin điện tử của công ty quản lý quỹ.', '## 2.2.7 Phương pháp lựa chọn đầu tư\n**Phương pháp lựa chọn đầu tư đối với cổ phiếu:**  \nQuỹ sử dụng phương pháp từ trên xuống (top-down approach), trong đó việc lựa chọn và phân bổ tài sản sẽ dựa trên đánh giá tổng thể về xu thế của kinh tế vĩ mô, chính sách của nhà nước, tiềm năng tăng trưởng và chính sách ngành. Từ đó, lập danh sách các chứng khoán tốt trong lĩnh vực Ngân hàng và dịch vụ tài chính phục vụ việc lựa chọn công ty sẽ đầu tư.  \nQuỹ cũng áp dụng phương pháp từ dưới lên (bottom-up approach), trong việc lựa chọn từng loại chứng khoán cụ thể thông qua việc phân tích công ty, bao gồm phân tích hiệu quả hoạt động sản xuất kinh doanh, đánh giá các chỉ số tài chính, đánh giá tiềm năng tăng trưởng, lợi thế cạnh tranh, bộ máy điều hành, quản trị doanh nghiệp, vv.', 'Nhà Đầu Tư có thể thanh toán số tiền mua Đơn Vị Quỹ bằng cách chuyển khoản từ tài khoản ngân hàng của mình hoặc nộp tiền trực tiếp vào tài khoản của Quỹ để Ngân Hàng Giám Sát nhận được đúng hạn và Đại Lý Phân Phối hoàn thành xử lý việc đăng ký với Đại Lý Chuyển Nhượng. Mọi khoản đầu tư vào Đơn Vị Quỹ đều thực hiện bằng tiền Đồng Việt Nam.  \nTrong trường hợp lệnh mua chứng chỉ quỹ và việc thanh toán cho lệnh mua được thực hiện bởi cá nhân, tổ chức khác không phải nhà đầu tư thì phiếu lệnh và tài liệu xác nhận thanh toán phải nêu rõ tên, số tài khoản và giá trị thanh toán của nhà đầu tư được hưởng lợi.  \n- **Tuân Thủ**', 'Trong trường hợp Quỹ nhận được số tiền mua thấp hơn lệnh đăng ký mua và không nhận được yêu cầu chuyển trả từ khách hàng, số tiền mua sẽ tiếp tục được giữ lại để chờ yêu cầu giao dịch tiếp theo từ khách hàng.  \nTrong trường hợp Nhà Đầu Tư có nhiều lệnh mua Chứng Chỉ Quỹ cùng một lúc, Lệnh Mua Chứng Chỉ Quỹ sẽ được ưu tiên theo thứ tự đặt lệnh.  \nPhí/giá dịch vụ chuyển tiền (nếu có) được trừ vào số tiền hoàn trả cho Nhà Đầu Tư. Đơn Vị Quỹ sẽ chỉ được ghi nhận vào tài khoản của Nhà Đầu Tư hay của Đại Lý Kỷ Danh sau khi có kết quả giao dịch chứng chỉ quỹ.', '# i. Chương trình Đầu tư Định kỳ\n- Trong trường hợp Nhà Đầu Tư muốn sử dụng tiền không hợp lệ ở trên để mua chứng chỉ quỹ tại các kỳ giao dịch bình thường không phải là kỳ giao dịch theo Chương trình ĐTĐK thì Nhà Đầu Tư sẽ phải thực hiện quy trình theo Mục 2.4.4. Quy trình mua chứng chỉ quỹ.  \n- Trong trường hợp Nhà Đầu Tư muốn giữ lại và tiếp tục để chờ cho kỳ giao dịch theo Chương trình ĐKĐT tiếp theo thì Nhà Đầu Tư cần phải đảm bảo nộp bổ sung phần còn thiếu trước thời điểm đóng số lệnh của ngày giao dịch theo Chương trình ĐKĐT.  \n- Trong trường hợp nhận được yêu cầu chuyển trả cụ thể từ Nhà Đầu tư hoặc không nhận được yêu cầu chuyển trả từ Nhà Đầu Tư, số tiền không hợp lệ ở trên sẽ được chuyển trả', '## Lĩnh vực được phép đầu tư\nVới chiến lược đầu tư như đã đề cập ở trên, cơ cấu danh mục đầu tư của Quỹ có thể thay đổi theo thời gian dựa theo tiềm năng tăng trưởng của cổ phiếu và tùy vào mức độ thanh khoản của các cổ phiếu trên thị trường. Tỷ trọng các khoản đầu tư không vượt quá những hạn chế đầu tư quy định tại mục “Hạn chế đầu tư”.', '- Trong trường hợp Nhà Đầu Tư muốn sử dụng tiền không hợp lệ ở trên để mua chứng chỉ quỹ tại các kỳ giao dịch bình thường không phải là kỳ giao dịch theo Chương trình ĐTĐK thì Nhà Đầu Tư sẽ phải thực hiện quy trình theo Mục 2.4.4 Quy trình mua chứng chỉ quỹ.\n- Trong trường hợp Nhà Đầu Tư muốn giữ lại và tiếp tục để chờ cho kỳ giao dịch theo Chương trình ĐKĐT tiếp theo thì Nhà Đầu Tư cần phải đảm bảo nộp bổ sung phần còn thiếu trước thời điểm đóng số lệnh của ngày giao dịch theo Chương trình ĐKĐT.', 'Nhà Đầu Tư nên tham khảo ý kiến của chuyên gia tư vấn riêng của mình để đảm bảo Nhà Đầu Tư đủ điều kiện để đầu tư vào Quỹ theo các quy định pháp luật áp dụng cho họ và liệu Quỹ có phù hợp với khả năng chấp nhận rủi ro của họ hay không.', 'Trong trường hợp Quỹ nhận được số tiền mua thấp hơn Phiếu lệnh mua và không nhận được yêu cầu chuyển trả từ khách hàng, số tiền mua sẽ tiếp tục được giữ lại để chờ yêu cầu giao dịch tiếp theo từ khách hàng.  \nTrong trường hợp Nhà Đầu Tư có nhiều lệnh mua Chứng Chỉ Quỹ cùng một lúc, Lệnh Mua Chứng Chỉ Quỹ sẽ được ưu tiên theo thứ tự đặt lệnh.  \nPhí/giá dịch vụ chuyển tiền (nếu có) được trừ vào số tiền hoàn trả cho Nhà Đầu Tư. Đơn Vị Quỹ sẽ chỉ được ghi nhận vào tài khoản của Nhà Đầu Tư hay của Đại Lý Ký Danh sau khi có kết quả giao dịch chứng chỉ quỹ.', '## 3. Giá dịch vụ và thưởng hoạt động\nNhà Đầu Tư được khuyến khích nắm giữ các Đơn Vị Quỹ như một phần của các khoản đầu tư dài hạn và chương trình tiết kiệm hưu trí. Quỹ mở không được thiết kế cho mục đích mua bán ngắn hạn. Việc Nhà Đầu Tư thường xuyên mua đi và bán lại Đơn Vị Quỹ, vốn được thiết kế để đạt được lợi nhuận dài hạn sẽ ảnh hưởng đến mục tiêu lợi nhuận của Nhà Đầu Tư khi đầu tư vào Quỹ cũng như lợi nhuận của Quỹ.  \nGiá dịch vụ Mua lại và các khoản giá dịch vụ ngân hàng và thuế khác (nếu có) sẽ được trừ vào khoản tiền thu được từ bán Đơn Vị Quỹ của Nhà Đầu Tư.', '## 2. Thông tin về đợt phát hành lần đầu ra công chúng\nNgoài ra, để đảm bảo tối ưu hóa lợi ích của nhà đầu tư, Quỹ có sự linh hoạt trong phân bổ tài sản tùy thuộc vào cơ hội đầu tư sẵn có tại các thời điểm khác nhau. Việc phân bổ tài sản có thể thay đổi đáng kể tùy thuộc vào nhận định của Quỹ, với mục tiêu xuyên suốt trong toàn bộ thời gian hoạt động của Quỹ là bảo vệ lợi ích của Nhà Đầu Tư.  \nVới chiến lược đầu tư như đã đề cập ở trên, cơ cấu danh mục đầu tư của Quỹ có thể thay đổi theo thời gian dựa theo tiềm năng tăng trưởng của cổ phiếu và tùy vào mức độ thanh khoản của các cổ phiếu trên thị trường. Tỷ trọng các khoản đầu tư không vượt quá những hạn chế đầu tư quy định tại mục “Hạn chế đầu tư”.  \nCác loại tài sản mà quỹ được đầu tư bao gồm:\ni. Tiền gửi tại các ngân hàng thương mại theo quy định của pháp luật về  |', '- Không đầu tư quá 30% tổng giá trị tài sản của quỹ vào các chứng chỉ quỹ đại chúng, cổ phiếu công ty đầu tư chứng khoán đại chúng;  \nxi. Quỹ chỉ được đầu tư tiền gửi, công cụ tiền tệ quy định tại điểm i và ii các loại tài sản Quỹ được phép đầu tư được phát hành bởi các tổ chức tín dụng trong danh sách đã được Ban Đại Diện Quỹ phê duyệt bằng văn bản hoặc thông qua bỏ phiếu điện tử (e-voting) tuân thủ theo các Quy định Pháp luật hiện hành.  \nCơ cấu đầu tư của Quỹ được phép sai lệch so với các hạn chế được đưa ra tại điểm i, ii, iii, iv, v, vi và ix nếu trên nhưng chỉ vì các lý do sau:  \n- Biến động giá trên thị trường của các tài sản trong danh mục đầu tư của Quỹ;  \n- Thực hiện các khoản thanh toán phù hợp với Pháp Luật của Quỹ;  \n- Thực hiện các lệnh giao dịch của Nhà Đầu Tư;', '## 2.3. Đặc trưng của chứng chỉ Quỹ đầu tư\nNhà đầu tư của Quỹ là cá nhân, tổ chức trong và ngoài nước, sở hữu chứng chỉ quỹ. Nhà đầu tư không chịu trách nhiệm pháp lý hoặc nghĩa vụ khác ngoài trách nhiệm trong phạm vi số chứng chỉ Quỹ mà họ sở hữu. Nhà đầu tư là tổ chức bao gồm các tổ chức kinh tế và xã hội được pháp luật Việt Nam công nhận.  \nNhà đầu tư pháp nhân cử người đại diện hợp pháp đại diện cho số Chứng chỉ quỹ mà mình sở hữu. Việc đề cử, hủy bỏ hay thay thế người đại diện này phải được thông báo bằng văn bản, do người đại diện có thẩm quyền của nhà đầu tư tổ chức ký.', '## Lĩnh vực được phép đầu tư\nđ) Cổ phiếu chào bán lần đầu ra công chúng, trái phiếu chào bán ra công chúng; trái phiếu doanh nghiệp phát hành riêng lẻ bởi tổ chức niêm yết có bảo lãnh thanh toán của tổ chức tín dụng hoặc cam kết mua lại của tổ chức phát hành tối thiểu 1 lần trong 12 tháng và mỗi lần cam kết mua lại tối thiểu 30% giá trị đợt phát hành;  \ne) Chứng khoán phải sinh niêm yết giao dịch tại Sở giao dịch chứng khoán và chỉ nhằm mục tiêu phòng ngừa rủi ro cho chứng khoán cơ sở mà quỹ đang nắm giữ;  \ng) Quyền phát sinh gắn liền với chứng khoán mà quỹ đang nắm giữ.  \nViệc đầu tư vào các tài sản quy định tại điểm đ khoản 2.2.3 Điều này phải đáp ứng các điều kiện sau:  \n- Có quy định tại Điều lệ quỹ và Bản cáo bạch;', 'Trong các trường hợp tạm dừng thực hiện các giao dịch Đơn Vị Quỹ, Lệnh Chuyển Đổi đã nhận sẽ được thực hiện tại NAV tại Ngày Giao Dịch đầu tiên sau khi giao dịch được thực hiện trở lại.  \n**g. Quy trình chuyển nhượng chứng chỉ quỹ**  \n- **Đơn Chuyển Nhượng**  \nNhà Đầu Tư có thể Chuyển Nhượng Đơn Vị Quỹ cho nhà đầu tư khác dưới dạng quà tặng, thừa kế hoặc thực hiện lệnh của toà án. Chuyển Nhượng chỉ được thực hiện dưới dạng số lượng Đơn  \n55', '## THÔNG BÁO QUAN TRỌNG\nthành tiền) các Đơn Vị Quỹ trong phạm vi lãnh thổ tài phán áp dụng đối với quốc tịch, nơi cư trú của mình hoặc theo luật pháp của bất kỳ quốc gia hay lãnh thổ nào áp dụng cho Nhà Đầu Tư hoặc bất kỳ quỹ được quản lý nào được sử dụng để mua Đơn Vị Quỹ, và xác định các vấn đề có thể phát sinh liên quan đến pháp lý, thuế, tài chính hay các vấn đề khác từ việc mua và nắm giữ Đơn Vị Quỹ trước khi quyết định đăng ký mua Đơn Vị Quỹ']","Nếu nhà đầu tư không chọn phương thức nhận cổ tức cụ thể, Quỹ sẽ áp dụng phương thức mặc định là nhận cổ tức dưới dạng chứng chỉ quỹ (phương án giữ tiền trong quỹ).pecifically, according to the document, ""if investors do not specify a particular method of receiving dividends, the Fund will apply the default method of receiving dividends in the form of fund shares.""",Lựa chọn Tái Đầu tư Cổ tức (DRIP) sẽ được tự động áp dụng.,0.0,0.5003415359327482,0.43035714284638393,1.0
Công ty quản lý quỹ có được phép sử dụng vốn của Quỹ để cho vay không?,"['## 2.2.6 Hoạt động vay, cho vay, giao dịch mua bán lại và giao dịch ký quỹ\nCông ty Quản Lý Quỹ không được sử dụng vốn và tài sản của Quỹ để cho vay hoặc bảo lãnh cho bất kỳ khoản vay nào.  \nCông ty Quản Lý Quỹ không được phép vay để đầu tư, trừ trường hợp vay ngắn hạn theo quy định của pháp luật về ngân hàng để trang trải các chi phí cần thiết cho quỹ hoặc thực hiện thanh toán các giao dịch chứng chỉ quỹ với Nhà Đầu Tư. Tổng giá trị các khoản vay ngắn hạn của Quỹ không được quá 5% giá trị tài sản ròng của quỹ tại mọi thời điểm và thời hạn vay tối đa là 30 ngày.  \nCông ty Quản Lý Quỹ không được sử dụng tài sản của quỹ để thực hiện các giao dịch ký quỹ (vay mua chứng khoán) cho quỹ hoặc cho bất kỳ cá nhân, tổ chức khác; không được sử dụng tài sản của quỹ thực hiện các giao dịch bán khổng, cho vay chứng khoán.', '## 2.10. Tiêu chí lựa chọn, quyền hạn và trách nhiệm của Công ty Quản lý quỹ\nCông ty Quản Lý Quỹ được lựa chọn phải thỏa mãn các điều kiện sau:  \n- Được thực hiện nghiệp vụ Quản Lý Quỹ;\n- Hoàn toàn độc lập với Ngân Hàng Giám Sát;\n- Có đầy đủ cơ sở vật chất, nhân sự để Quản Lý Quỹ mở;\n- Đồng ý thực hiện các cam kết đối với Quỹ như nêu tại Phụ Lục 1 và Phụ Lục 3 của Điều lệ Quỹ.  \nCác quy định về quyền và nghĩa vụ, chấm dứt quyền và nghĩa vụ, hạn chế hoạt động của Công ty Quản lý quỹ tuân thủ theo quy định tại Chương VI Điều lệ Quỹ.', 'Công ty Quản Lý Quỹ để Nhà Đầu Tư có thể tham khảo.', '## 2.3. Đặc trưng của chứng chỉ Quỹ đầu tư\nCông ty quản lý quỹ thực hiện hoặc ủy quyền cho tổ chức cung cấp dịch vụ đại lý chuyển nhượng lập và quản lý số đăng ký nhà đầu tư chính (sổ chính) hoặc ủy quyền đại lý ký danh lập, quản lý đăng ký nhà đầu tư phụ (sổ phụ) và xác nhận quyền sở hữu chứng chỉ quỹ cho nhà đầu tư.  \nSố đăng ký nhà đầu tư của Quỹ có thể là văn bản, tập dữ liệu điện tử hoặc cả hai. Các nội dung của Số đăng ký nhà đầu tư được quy định chi tiết tại điều 15 Điều lệ Quỹ.', '# 5. Kế hoạch phân chia lợi nhuận\nCông ty quản lý quỹ được phân chia lợi nhuận của quỹ cho nhà đầu tư bằng tiền hoặc bằng đơn vị quỹ theo quy định tại điều lệ quỹ và chính sách phân chia lợi nhuận được công bố tại bản cáo bạch. Lợi nhuận phân chia được trích từ nguồn lợi nhuận để lại hoặc từ thu nhập của quỹ. Công ty quản lý quỹ chỉ được phân chia lợi nhuận khi quỹ đã hoàn thành hoặc có đủ năng lực tài chính để hoàn thành nghĩa vụ thuế và các nghĩa vụ tài chính khác theo quy định của pháp luật; trích lập đầy đủ các quỹ theo quy định tại điều lệ quỹ; ngay sau khi trả hết số lợi nhuận đã định, quỹ vẫn phải bảo đảm thanh toán đủ các khoản nợ, nghĩa vụ tài sản khác đến hạn. Lịch trình và kế hoạch thực hiện phải được công bố công khai trên trang thông tin điện tử của công ty quản lý quỹ.', '# XII. XUNG ĐỘT LỢI ÍCH\nCông Ty Quản Lý Quỹ có nghĩa vụ, theo Điều lệ và theo thông lệ quốc tế tốt nhất, tại mọi thời điểm hoạt động vì lợi ích của Nhà Đầu Tư và quản lý một cách công bằng, minh bạch đối với tất cả các quỹ do Công ty quản lý. Bộ phận kiểm soát nội bộ và quản trị rủi ro của Công Ty sẽ chịu trách nhiệm theo dõi và giám sát các xung đột lợi ích thực tế hoặc có khả năng xảy ra. Trong trường hợp xung đột lợi ích phát sinh, Công ty Quản lý Quỹ sẽ thông báo cho Ban Đại Diện Quỹ để thống nhất phương án khắc phục nhằm giảm thiểu hoặc quản lý các xung đột đó.', '- Thực hiện các lệnh giao dịch của Nhà Đầu Tư;  \n- Các hoạt động sáp nhập, hợp nhất của các tổ chức phát hành các chứng khoán mà Quỹ đang nắm giữ;  \n- Quỹ mới được cấp phép thành lập hoặc do tách Quỹ, hợp nhất Quỹ, sát nhập Quỹ mà thời gian hoạt động không quá sáu (06) tháng, tính từ ngày được cấp giấy chứng nhận đăng ký lập Quỹ;  \n- Quỹ đang trong thời gian giải thể.  \nTrong trường hợp xảy ra sai lệch so với các hạn mức đầu tư, Công ty Quản Lý Quỹ sẽ điều chỉnh danh mục đầu tư để đáp ứng các hạn mức đầu tư kể trên trong vòng 3 (ba) tháng kể từ ngày mà sai lệch phát sinh.', '## 3. Các rủi ro khi đầu tư vào Quỹ\nMục tiêu của Công Ty Quản Lý Quỹ là quản lý các rủi ro đầu tư, và nếu có thể, hạn chế tác động của các rủi ro này bằng việc áp dụng các phương pháp quản lý đầu tư theo tiêu chuẩn quốc tế tốt nhất. Nhà Đầu Tư cần lưu ý các điểm quan trọng sau đây:  \n- Quỹ, Công Ty Quản Lý Quỹ, thành viên Hội đồng thành viên, ban điều hành và nhân viên Công Ty Quản Lý Quỹ không có bất kỳ sự đảm bảo nào đối với vốn đầu tư ban đầu cũng như mức lợi nhuận từ đầu tư của Quỹ;\n- Không có bất kỳ sự bảo đảm nào về sổ lần chi trả và giá trị của cổ tức được thanh toán trong tương lai;  \n42', '- Không đầu tư quá 30% tổng giá trị tài sản của quỹ vào các chứng chỉ quỹ đại chúng, cổ phiếu công ty đầu tư chứng khoán đại chúng;  \nxi. Quỹ chỉ được đầu tư tiền gửi, công cụ tiền tệ quy định tại điểm i và ii các loại tài sản Quỹ được phép đầu tư được phát hành bởi các tổ chức tín dụng trong danh sách đã được Ban Đại Diện Quỹ phê duyệt bằng văn bản hoặc thông qua bỏ phiếu điện tử (e-voting) tuân thủ theo các Quy định Pháp luật hiện hành.  \nCơ cấu đầu tư của Quỹ được phép sai lệch so với các hạn chế được đưa ra tại điểm i, ii, iii, iv, v, vi và ix nếu trên nhưng chỉ vì các lý do sau:  \n- Biến động giá trên thị trường của các tài sản trong danh mục đầu tư của Quỹ;  \n- Thực hiện các khoản thanh toán phù hợp với Pháp Luật của Quỹ;  \n- Thực hiện các lệnh giao dịch của Nhà Đầu Tư;', '## 2.12. Kiểm toán, kế toán và chế độ báo cáo\nCông ty Quản Lý Quỹ có trách nhiệm duy trì sổ sách kế toán và chuẩn bị báo cáo tài chính cho Quỹ. Phù hợp với quy định tại Điều 38 của Điều Lệ Quỹ, Công ty Quản Lý Quỹ có thể ủy quyền cho một nhà cung cấp dịch vụ để thực hiện Công việc này. Mọi Sổ sách kế toán và báo cáo tài chính của Quỹ sẽ được lưu tại văn phòng của Công ty Quản Lý Quỹ hoặc của nhà cung cấp dịch vụ mà Công ty Quản Lý Quỹ ủy quyền. Ban Đại diện Quỹ có quyền kiểm tra bất kỳ báo cáo, sổ sách kế toán, hoặc tài liệu nào của Quỹ.  \nCác quy định khác liên quan đến kiểm toán, kế toán và chế độ báo cáo tuân thủ theo quy định tại Điều lệ Quỹ.', '# II. CÁC ĐỊNH NGHĨA\n“Quỹ” có nghĩa là Quỹ Đầu Tư Cổ phiếu Doanh nghiệp vừa và nhỏ Techcom, một loại hình Quỹ đầu tư chứng khoán dạng mở do Công ty Quản Lý Quỹ quản lý chào bán Chứng Chỉ Quỹ ra công chúng và được thành lập theo các quy định hiện hành về chứng khoán tại Việt Nam và Điều lệ này.  \n“Công ty Quản Lý Quỹ” có nghĩa là Công ty Cổ phần Quản Lý Quỹ Kỹ thương, được thành lập theo giấy phép thành lập và hoạt động Số 40/UBCK-GP do Chủ tịch Ủy ban Chứng khoán Nhà nước cấp ngày 21/10/2008 và được cấp lại Giấy phép thành lập và hoạt động Số 57/GP-UBCK do UBCKNN cấp ngày 30/01/2019 do chuyển đổi loại hình từ công ty TNHH sang công ty cổ phần.', '1  \nỦy ban Chứng khoán Nhà nước cấp giấy phép phát hành chứng chỉ quỹ ra công chúng có nghĩa là việc xin phép lập Quỹ và phát hành chứng chỉ quỹ đầu tư đã thực hiện theo các quy định của pháp luật liên quan, không hàm ý bảo đảm về nội dung của Bản cáo bạch cũng như mục tiêu, chiến lược đầu tư của Quỹ.', '## VI. CÔNG TY KIỂM TOÁN\nCông ty kiểm toán được lựa chọn phải được thành lập và hoạt động phù hợp với quy định của Pháp Luật và không được là người có liên quan của Công Ty Quản Lý Quỹ và Ngân Hàng Giám Sát. Năm đầu tiên, công ty kiểm toán của Quỹ sẽ được Công Ty Quản Lý Quỹ để cử để Đại Hội Nhà Đầu Tư thông qua. Các năm sau đó, Đại Hội Nhà Đầu Tư ủy quyền cho Ban Đại Diện Quỹ thông qua việc lựa chọn công ty kiểm toán. Công Ty Quản Lý Quỹ sẽ đề xuất với Ban Đại Diện quỹ ít nhất 02 (hai) công ty kiểm toán để lựa chọn cho Quỹ.', '## 2. Điều lệ Quỹ tóm tắt\nCơ quan quyền lực cao nhất của Quỹ là Đại hội Nhà Đầu tư.  \nBan Đại diện Quỹ sẽ do Đại hội Nhà Đầu tư bầu ra để giám sát các hoạt động thường xuyên của Quỹ, TCC và Ngân hàng giám sát.  \n#### 2.1.2 Tổng vốn huy động và số lượng chứng chỉ Quỹ được chào bán  \nVốn Điều lệ được huy động trong lần đầu chào bán ra công chúng của Quỹ là 50.000.000.000 VNĐ (Năm mươi tỷ đồng). Vốn Điều lệ sẽ được chia thành 5.000.000 (Năm triệu) Chứng chỉ Quỹ. Mệnh giá của một Chứng chỉ Quỹ sẽ là 10.000 VNĐ (mười nghìn Đồng Việt Nam).  \nNhà đầu tư góp vốn bằng tiền Đồng Việt Nam dưới hình thức chuyển khoản hoặc chuyển tiền vào tài khoản của Quỹ mở tại ngân hàng giám sát.  \nSố lượng chứng chỉ quỹ/tổng chứng chỉ quỹ được phép lưu hành tối đa: không hạn chế.', '## 3. Giá dịch vụ và thưởng hoạt động\nCác loại phí/dịch vụ và chi phí/giá dịch vụ liên quan trực tiếp đến việc giao dịch Đơn Vị Quỹ sẽ do Nhà Đầu Tư trả và không được tính vào chi phí của Quỹ. Công Ty Quản Lý Quỹ bảo lưu quyền thay đổi biểu phí/giá dịch vụ này.  \nCác khoản giá dịch vụ giao dịch như sau:', '## 2.5.3. Thông tin về các mức giá dịch vụ\nCác loại phí/dịch vụ và chi phí/giá dịch vụ liên quan trực tiếp đến việc giao dịch Đơn Vị Quỹ sẽ do Nhà Đầu Tư trả và không được tính vào chi phí của Quỹ. Công Ty Quản Lý Quỹ bảo lưu quyền thay đổi biểu phí/giá dịch vụ này.  \nCác khoản giá dịch vụ giao dịch như sau:', '## 2.3. Đặc trưng của chứng chỉ Quỹ đầu tư\nNhà đầu tư của Quỹ là cá nhân, tổ chức trong và ngoài nước, sở hữu chứng chỉ quỹ. Nhà đầu tư không chịu trách nhiệm pháp lý hoặc nghĩa vụ khác ngoài trách nhiệm trong phạm vi số chứng chỉ Quỹ mà họ sở hữu. Nhà đầu tư là tổ chức bao gồm các tổ chức kinh tế và xã hội được pháp luật Việt Nam công nhận.  \nNhà đầu tư pháp nhân cử người đại diện hợp pháp đại diện cho số Chứng chỉ quỹ mà mình sở hữu. Việc đề cử, hủy bỏ hay thay thế người đại diện này phải được thông báo bằng văn bản, do người đại diện có thẩm quyền của nhà đầu tư tổ chức ký.', '## 2.2.4 Hạn mức đầu tư\n- Không đầu tư vào quá 10% tổng số chứng chỉ quỹ đang lưu hành của một quỹ đại chúng, cổ phiếu đang lưu hành của một công ty đầu tư chứng khoán đại chúng;\n- Không đầu tư quá 20% tổng giá trị tài sản của quỹ vào chứng chỉ quỹ của một quỹ đại chúng, cổ phiếu của một công ty đầu tư chứng khoán đại chúng;\n- Không đầu tư quá 30% tổng giá trị tài sản của quỹ vào các chứng chỉ quỹ đại chúng, cổ phiếu công ty đầu tư chứng khoán đại chúng;  \nk) Không được đầu tư trực tiếp vào bất động sản, đá quý, kim loại quý hiếm;  \nl) Phải có chứng khoán của ít nhất 06 tổ chức phát hành.', '## 4. Các chỉ tiêu hoạt động\nCông ty quản lý quỹ sẽ công bố thông tin về tỷ lệ chi phí hoạt động quỹ và tốc độ vòng quay danh mục trong báo cáo tài chính bán niên và báo cáo tài chính năm được công bố trên trang thông tin điện tử của Công ty quản lý quỹ.', '## 2.2.4 Hạn mức đầu tư\nHạn mức đầu tư của Quỹ được quy định chi tiết tuân thủ các quy định tại Thông tư hướng dẫn hoạt động và quản lý các quỹ đầu tư chứng khoán. Cơ cấu danh mục đầu tư của Quỹ phải bảo đảm tuân thủ các hạn mức đầu tư sau:  \na) Trừ tiền gửi trên tài khoản thanh toán của quỹ tại ngân hàng giám sát, quỹ mở không được đầu tư quá 49% tổng giá trị tài sản của quỹ vào các tài sản theo quy định tại điểm a, b mục IX.2.2.3  \nb) Không được đầu tư vào chứng khoán của một tổ chức phát hành quá 10% tổng giá trị chứng khoán đang lưu hành của tổ chức đó, trừ công cụ nợ của Chính phủ;  \nc) Không được đầu tư quá 20% tổng giá trị tài sản của quỹ vào chứng khoán đang lưu hành và các tài sản (nếu có) quy định tại điểm a, b mục IX.2.2.3 của một tổ chức phát hành, trừ công cụ nợ của Chính phủ;', 'a. Chính sách cổ tức Quỹ  \nCông ty quản lý quỹ được phân chia lợi nhuận của quỹ cho nhà đầu tư bằng tiền hoặc bằng chứng chỉ quỹ theo quy định tại điều lệ quỹ và chính sách phân chia lợi nhuận được công bố tại bản cáo bạch. Lợi nhuận phân chia được trích từ nguồn lợi nhuận để lại hoặc từ thu nhập của quỹ. Công ty quản lý quỹ chỉ được phân chia lợi nhuận khi quỹ đã hoàn thành hoặc có đủ năng lực tài chính để hoàn thành nghĩa vụ thuế và các nghĩa vụ tài chính khác theo quy định của pháp luật; trích lập đầy đủ các quỹ theo quy định tại điều lệ quỹ; ngay sau khi trả hết số lợi nhuận đã định, quỹ vẫn phải bảo đảm thanh toán đủ các khoản nợ, nghĩa vụ tài sản khác đến hạn. Lịch trình và kế hoạch thực hiện phải được công bố công khai trên trang thông tin điện tử của công ty quản lý quỹ.', '“Ban Đại Diện Quỹ”\nlà những người đại diện cho Nhà Đầu Tư được Đại Hội Nhà Đầu Tư bầu ra để thay mặt Nhà Đầu Tư thực hiện việc giám sát các hoạt động của Quỹ, Công ty Quản Lý Quỹ và Ngân Hàng Giám Sát.  \n“Vốn Điều lệ”\nlà tổng số vốn bằng tiền do các Nhà Đầu Tư thực góp trong đợt phát hành Chứng Chỉ Quỹ lần đầu ra công chúng và được ghi trong Điều lệ.  \n“Chứng Chỉ Quỹ”\nLà loại chứng khoán xác nhận quyền sở hữu của nhà đầu tư đối với một phần vốn góp tại quỹ. Mệnh giá 01 chứng chỉ quỹ là 10.000 đồng.  \n“Giá bán/ Giá phát hành”', 'vi. Chứng khoán phái sinh niêm yết, giao dịch tại các Sở Giao dịch Chứng khoán, và chỉ nhằm mục tiêu phòng ngừa rủi ro cho chứng khoán cơ sở mà quỹ đang nắm giữ.  \nvii. Quyền phát sinh gắn liền với chứng khoán mà Quỹ đang nắm giữ.  |\n| --- | --- |\n|  Cơ cấu đầu tư | Các khoản đầu tư của Quỹ sẽ được đa dạng hóa và đáp ứng được các điều kiện của pháp luật. Cơ cấu danh mục đầu tư của Quỹ phải bảo đảm tuân thủ các nguyên tắc sau:  \ni. Cơ cấu danh mục đầu tư của quỹ mở phải bao gồm chứng khoán của ít nhất sáu (06) tổ chức phát hành, đồng thời phải bảo đảm:', '## Lĩnh vực được phép đầu tư\nDanh mục đầu tư của quỹ phải phù hợp với mục tiêu và chính sách đầu tư đã được quy định tại Điều lệ quỹ và công bố tại Bản cáo bạch. Danh mục đầu tư của quỹ đầu tư bao gồm các loại tài sản sau đây:  \na) Tiền gửi các ngân hàng thương mại theo quy định của pháp luật ngân hàng;  \nb) Công cụ thị trường tiền tệ bao gồm giấy tờ có giá, công cụ chuyển nhượng theo quy định của pháp luật;  \nc) Công cụ nợ của Chính phủ, trái phiếu được Chính phủ bảo lãnh, trái phiếu chính quyền địa phương;  \nd) Cổ phiếu niêm yết, cổ phiếu đăng ký giao dịch, trái phiếu niêm yết trên Sở giao dịch chứng khoán, chứng chỉ quỹ đại chúng;', '## d) Chấp Nhận Hợp đồng mở tài khoản giao dịch chứng khoán và đăng ký giao dịch quỹ mở\nCông Ty Quản Lý Quỹ có toàn quyền chấp nhận hay từ chối bất kỳ Hợp đồng nào theo các điều khoản của Điều Lệ, Bản Cáo Bạch và các quy định về KYC và AML và không có nghĩa vụ phải cung cấp lý do từ chối cho nhà đầu tư. Các Lệnh Mua sẽ được thực hiện vào Ngày Giao Dịch kế tiếp.  \nTrong trường hợp Công Ty Quản Lý Quỹ từ chối Lệnh Mua, tiền mua sẽ được chuyển trả lại (không có lãi) cho Nhà Đầu Tư hoặc bên chuyển tiền không hợp lệ trong vòng 05 (năm) ngày làm việc kể từ kỳ giao dịch Chứng Chỉ Quỹ áp dụng.  \nTrong trường hợp số tiền mua Quỹ nhận được nhiều hơn Phiếu lệnh mua, số tiền dự nếu không nhận được yêu cầu chuyển trả từ khách hàng sẽ tiếp tục được giữ lại để chờ yêu cầu giao dịch tiếp theo từ khách hàng.  \n27']",Tôi không tìm thấy thông tin đó trong tài liệu.,Không. Công ty Quản Lý Quỹ không được sử dụng vốn và tài sản của Quỹ để cho vay hoặc bảo lãnh.,1.0,0.0,0.8333333332916666,1.0
